"id","startTime","endTime","text","title"
"1005",4683840,4688230,"I know how to write my name.Good lad, just sign there, then.","10 Rillington Place"
"1006",4695159,4697354,"[BREATHES DEEPLY, SIGHS]","10 Rillington Place"
"1007",4697560,4699073,"[SNIFFS]","10 Rillington Place"
"1008",4712760,4716798,"Mr. Christie,I have got to suggest to you,","10 Rillington Place"
"1009",4717000,4720787,"and I do not want there to beany misapprehensions about it,","10 Rillington Place"
"1010",4721000,4723957,"that you are responsiblefor the death of Mrs. Evans","10 Rillington Place"
"1011",4724359,4726315,"and of the little girl.","10 Rillington Place"
"1012",4726960,4729632,"Or if that is not so,that at least you know
very much more","10 Rillington Place"
"1013",4729840,4733389,"about those deathsthan you've said.","10 Rillington Place"
"1014",4734920,4736557,"[QUIETLY]That is a lie.","10 Rillington Place"
"1015",4738399,4740595,"[LOUDER]That is a lie.","10 Rillington Place"
"1016",4740800,4745237,"Did you know thatMrs. Evans was pregnant
in November last year?","10 Rillington Place"
"1017",4745439,4747032,"My wife told me.","10 Rillington Place"
"1018",4747239,4750436,"MORRIS: Did youhave any discussion
with her or Mr. Evans?","10 Rillington Place"
"1019",4753239,4755673,"We understood from whatMrs. Evans told my wife","10 Rillington Place"
"1020",4755880,4759918,"that she had been taking pillsand various things","10 Rillington Place"
"1021",4760119,4763237,"to procure an abortion.","10 Rillington Place"
"1022",4764000,4768835,"MORRIS: Now, I suggestto you that a little later
you said to Evans:","10 Rillington Place"
"1023",4769680,4772796,"""If you or your wifehad come to me
in the first place,","10 Rillington Place"
"1024",4773000,4776310,"I could have done it for you,without any risk.""","10 Rillington Place"
"1025",4777720,4779198,"No, definitely not.","10 Rillington Place"
"1026",4780119,4781552,"MORRIS:Do you remember
him saying to you:","10 Rillington Place"
"1027",4781760,4784990,"""I didn't thinkyou knew anything
about medical stuff""?","10 Rillington Place"
"1028",4786640,4788231,"No, he...MORRIS: And that you said","10 Rillington Place"
"1029",4788439,4791351,"that you'd been trainingto be a doctor before the war?","10 Rillington Place"
"1030",4791560,4793073,"No, that's nonsense.","10 Rillington Place"
"1031",4793760,4797992,"Do you remember showingEvans some medical books
in your flat?","10 Rillington Place"
"1032",4798199,4799837,"I've not got any medical books.","10 Rillington Place"
"1033",4800560,4804269,"Except the St. John'sAmbulance handbook.","10 Rillington Place"
"1034",4804479,4806913,"MORRIS: Did you showthis book to Evans?","10 Rillington Place"
"1035",4807119,4808917,"No, certainly not.It's an obsolete book.","10 Rillington Place"
"1036",4809119,4811350,"I daresay it's obsolete,but did you show it to him?","10 Rillington Place"
"1037",4811560,4813038,"No.","10 Rillington Place"
"1038",4813239,4816311,"Did you not tellEvans that you had
been doing training","10 Rillington Place"
"1039",4816520,4820592,"in medical matters before thewar and that you stopped the
training because of an accident?","10 Rillington Place"
"1040",4820800,4822118,"No.","10 Rillington Place"
"1041",4824319,4827516,"You gave evidence yesterdaythat during the night of Tuesday,","10 Rillington Place"
"1042",4827720,4830631,"the 8th of November,you heard a thud.","10 Rillington Place"
"1043",4832000,4833512,"Yes.","10 Rillington Place"
"1044",4833720,4839238,"Uh, it seemed rather loud.It startled us, rather.","10 Rillington Place"
"1045",4839439,4842431,"It woke us up.MORRIS: This was about midnight?","10 Rillington Place"
"1046",4842640,4844835,"Yes, it would be.","10 Rillington Place"
"1047",4845039,4847997,"You quite sure about that?Absolutely certain.","10 Rillington Place"
"1048",4849000,4853868,"Do you remember givingevidence at the Magistrate's
Court at West London?","10 Rillington Place"
"1049",4854079,4856547,"Yes.Well, you never mentioned there","10 Rillington Place"
"1050",4856760,4860389,"this noise of somethingvery heavy being moved,
did you?","10 Rillington Place"
"1051",4860600,4862829,"Oh, yes, I did mention it.I'm certain.","10 Rillington Place"
"1052",4863920,4866514,"Well, perhapsit was not taken down.","10 Rillington Place"
"1053",4868560,4871631,"What happened after the soundof furniture moving?","10 Rillington Place"
"1054",4871840,4873636,"I, um...","10 Rillington Place"
"1055",4873840,4878550,"I went off to sleep again.Because of the pain I was
having with the fibrositis,","10 Rillington Place"
"1056",4878760,4882877,"I was taking tablets.It was the only way
I could get to sleep.","10 Rillington Place"
"1057",4883079,4885992,"I'm still taking them,as a matter of fact.","10 Rillington Place"
"1058",4886680,4889557,"Are you still sufferingfrom fibrositis, Mr. Christie?","10 Rillington Place"
"1059",4889760,4893798,"Very badly, my lord.I was in severe pain all night.","10 Rillington Place"
"1060",4894000,4898118,"I had to go to the doctor againlast night, and he prescribed for me","10 Rillington Place"
"1061",4898319,4901073,"and gave me some pillsto alleviate the pain,","10 Rillington Place"
"1062",4901279,4904430,"but I was awakefor most of the night.","10 Rillington Place"
"1063",4904640,4908712,"Would you be more comfortablegiving your evidence sitting down?","10 Rillington Place"
"1064",4909760,4913912,"Well, yes, I think I would, my lord.Then you may.","10 Rillington Place"
"1065",4915359,4917190,"Thank you.","10 Rillington Place"
"1066",4930359,4934273,"Mr. Christie,yesterday, you remember
Mr. Humphreys asking you","10 Rillington Place"
"1067",4934479,4937596,"if you had beenin the police force
during the last war?","10 Rillington Place"
"1068",4937800,4939028,"Yes.","10 Rillington Place"
"1069",4939239,4941595,"In fact, you werea constable
in the war reserve?","10 Rillington Place"
"1070",4941800,4943118,"For four years, yes.","10 Rillington Place"
"1071",4943359,4946670,"But you are not,are you, a man
of good character?","10 Rillington Place"
"1072",4951479,4955234,"Well, I...have had some trouble.","10 Rillington Place"
"1073",4955680,4959672,"I apologize for having to ask youthese questions, but I'm afraid I must.","10 Rillington Place"
"1074",4959880,4965431,"On four occasions, you have beenconvicted of offences of dishonesty,
haven't you?","10 Rillington Place"
"1075",4965760,4968592,"Three.Not four?","10 Rillington Place"
"1076",4971960,4975635,"Then perhaps I had betterput them to you.","10 Rillington Place"
"1077",4976239,4978958,"Were you sentenced tothree months' imprisonment
in 1921","10 Rillington Place"
"1078",4979159,4980512,"for stealing postal orders?","10 Rillington Place"
"1079",4982039,4983029,"Yes.","10 Rillington Place"
"1080",4984119,4987998,"Bound overfor false pretences
in 1923 at Halifax?","10 Rillington Place"
"1081",4988199,4990110,"Yes, I remember that.","10 Rillington Place"
"1082",4990319,4994393,"Nine months' hard labourfor stealing material
and goods in 1924","10 Rillington Place"
"1083",4994600,4996238,"at Uxbridge?","10 Rillington Place"
"1084",4996439,4997792,"Yes.","10 Rillington Place"
"1085",4998000,5003551,"And three months alsoat Uxbridge for stealing
a motor car in 1933?","10 Rillington Place"
"1086",5003760,5005078,"Yes, that's right.","10 Rillington Place"
"1087",5005279,5006997,"Well, surely, Mr. Christie,you could remember that.","10 Rillington Place"
"1088",5007199,5008712,"Four offences for dishonesty.","10 Rillington Place"
"1089",5010439,5014319,"Well, I... I had an ideait was three. I...","10 Rillington Place"
"1090",5014520,5017876,"I just didn't...I just wasn't quite sure.","10 Rillington Place"
"1091",5019239,5020672,"I see.","10 Rillington Place"
"1092",5020880,5026511,"But what is perhaps more importantand relevant to this matter,","10 Rillington Place"
"1093",5026720,5030507,"are there two other convictionsrecorded against you?","10 Rillington Place"
"1094",5032399,5034197,"Yes.","10 Rillington Place"
"1095",5034399,5040747,"The first of these beingfor violence at Halifax in 1923?","10 Rillington Place"
"1096",5040960,5042188,"Yes.","10 Rillington Place"
"1097",5042399,5045311,"And the second when you weresentenced to six months","10 Rillington Place"
"1098",5045520,5048273,"for malicious wounding in 1929?","10 Rillington Place"
"1099",5049439,5050509,"[QUIETLY]Yeah.","10 Rillington Place"
"1100",5052720,5053948,"[LOUDER]Yes.","10 Rillington Place"
"1101",5061520,5065034,"Do you appreciatethat the medical evidence
in this case","10 Rillington Place"
"1102",5065239,5068676,"which has been called,is that this woman
was strangled?","10 Rillington Place"
"1103",5071279,5072792,"I was informedof that, yes.","10 Rillington Place"
"1104",5073000,5075514,"Not killed by abortion,of which there is
no sign whatever,","10 Rillington Place"
"1105",5075720,5078631,"but by strangulation?Yes.","10 Rillington Place"
"1106",5078840,5082149,"Now, a word about your character.","10 Rillington Place"
"1107",5083279,5086430,"What were you doingin the First World War?","10 Rillington Place"
"1108",5086640,5088869,"I was in the armyin the First World War.","10 Rillington Place"
"1109",5089079,5091719,"Fighting for your country?Yes.","10 Rillington Place"
"1110",5091920,5095070,"L... I was gassed twice.","10 Rillington Place"
"1111",5095279,5101673,"I was blinded for threemonths, and I never spoke
for three and a half years.","10 Rillington Place"
"1112",5103920,5107037,"The last time you were in troublewith the police for any offence","10 Rillington Place"
"1113",5107239,5111279,"was in 1933, was it?Yes.","10 Rillington Place"
"1114",5112520,5115751,"Seventeen years ago?Yes.","10 Rillington Place"
"1115",5115960,5119555,"In this last war,in spite of your disabilities,","10 Rillington Place"
"1116",5119760,5123594,"you served inthe war reserve police
for many years.","10 Rillington Place"
"1117",5124520,5127113,"Is that right?Yes, I did.","10 Rillington Place"
"1118",5127319,5130198,"And I was commendedon two occasions.","10 Rillington Place"
"1119",5131279,5133430,"Thank you, Mr. Christie.","10 Rillington Place"
"1120",5145399,5147277,"What are you doing?","10 Rillington Place"
"1121",5147880,5150632,"I'm going to sleepin the front room.","10 Rillington Place"
"1122",5153439,5155158,"Front room?","10 Rillington Place"
"1123",5155359,5159194,"On the sofa from now on.What's that in aid of?","10 Rillington Place"
"1124",5160000,5164198,"Nothing. It's just that I'm notsleeping very well, that's all.","10 Rillington Place"
"1125",5172520,5174271,"Now...","10 Rillington Place"
"1126",5174479,5177313,"it is you who voluntarilygo to the police","10 Rillington Place"
"1127",5177520,5181671,"on the 30th of Novemberafter hearing about
the telegram","10 Rillington Place"
"1128",5181880,5186270,"which your aunt hadreceived from Mr. Thorley,
your wife's father?","10 Rillington Place"
"1129",5187439,5188429,"That's right.","10 Rillington Place"
"1130",5188640,5191756,"It was because yourprevious lies were
exposed by the telegram","10 Rillington Place"
"1131",5191960,5194474,"that you decidedto go to the police, was it?","10 Rillington Place"
"1132",5194680,5196954,"It wasn't becauseof the lies.","10 Rillington Place"
"1133",5197159,5199912,"Then why did yousuddenly go to
the police?","10 Rillington Place"
"1134",5200119,5201837,"Well...","10 Rillington Place"
"1135",5202039,5204076,"I was getting worriedabout my daughter.","10 Rillington Place"
"1136",5205479,5208789,"Are you saying thatseriously to the jury?","10 Rillington Place"
"1137",5209000,5211594,"That you go to the policeand confessed a murder","10 Rillington Place"
"1138",5211800,5213711,"because you're worriedabout your daughter?","10 Rillington Place"
"1139",5213920,5216957,"With great respect,there is no confession
of murder.","10 Rillington Place"
"1140",5217159,5221789,"He said, ""I have disposedof my wife. I have put her
down the drain.""","10 Rillington Place"
"1141",5223439,5225350,"It sounds very like murder.","10 Rillington Place"
"1142",5228399,5231994,"All he said was he had put her,it might well be her body,","10 Rillington Place"
"1143",5232199,5234395,"down the drain.","10 Rillington Place"
"1144",5236600,5241798,"You made a statementto the police, and this
is the first you made...","10 Rillington Place"
"1145",5242000,5244389,"Exhibit 6.","10 Rillington Place"
"1146",5244600,5248036,"In which you talkof meeting a man in a café","10 Rillington Place"
"1147",5248239,5251073,"and of how your wifetook these pills","10 Rillington Place"
"1148",5251279,5253157,"and died of them,","10 Rillington Place"
"1149",5253359,5255668,"and you found her dead.","10 Rillington Place"
"1150",5256399,5258675,"Do you remember that statement?","10 Rillington Place"
"1151",5258880,5263032,"Yes, I remember that statement.That is untrue?","10 Rillington Place"
"1152",5264199,5265679,"That is untrue, yes.","10 Rillington Place"
"1153",5266119,5270113,"You then make a statementin which you set out
in some detail","10 Rillington Place"
"1154",5270319,5272390,"how Mr. Christiegave your wife something","10 Rillington Place"
"1155",5272600,5276797,"which would cause an abortion,and she died of that.","10 Rillington Place"
"1156",5277000,5279639,"Do you rememberthat one?","10 Rillington Place"
"1157",5280000,5281637,"Yes, I remember that one too.","10 Rillington Place"
"1158",5282359,5285033,"Is that one true or untrue?","10 Rillington Place"
"1159",5285960,5287996,"That is true.","10 Rillington Place"
"1160",5288199,5289519,"Then you made a statement","10 Rillington Place"
"1161",5289720,5294315,"in which you confessedto murdering your wife
and your child.","10 Rillington Place"
"1162",5294520,5297318,"Is that true or untrue?","10 Rillington Place"
"1163",5297520,5300636,"I was told of my daughter's deathbefore I made that one.","10 Rillington Place"
"1164",5300840,5303149,"True or untrue?","10 Rillington Place"
"1165",5306960,5309394,"It is true I made the statement.","10 Rillington Place"
"1166",5309600,5312319,"Is the statement true or untrue?","10 Rillington Place"
"1167",5315159,5316639,"Untrue.","10 Rillington Place"
"1168",5316840,5320310,"So then that is the secondstatement you have made","10 Rillington Place"
"1169",5320520,5323113,"to the police, in some detail,","10 Rillington Place"
"1170",5323319,5325550,"which is untrue.","10 Rillington Place"
"1171",5327079,5328637,"Yes.","10 Rillington Place"
"1172",5329680,5333115,"So would it not be rightto say that you are a person
who's prepared to lie,","10 Rillington Place"
"1173",5333319,5336356,"or tell the truth,at your own convenience?","10 Rillington Place"
"1174",5336560,5339676,"Well, why should I tell lies?My life is at stake here.","10 Rillington Place"
"1175",5340239,5342150,"Now...","10 Rillington Place"
"1176",5342520,5344908,"we have shown that your story","10 Rillington Place"
"1177",5345119,5348873,"about Mr. Christie givingyour wife an abortion
is nonsense.","10 Rillington Place"
"1178",5349520,5353399,"Well, you are the personwho alleges Mr. Christie
is the murderer in this case.","10 Rillington Place"
"1179",5354560,5357949,"Can you suggestwhy he should have
strangled your wife?","10 Rillington Place"
"1180",5363000,5364831,"Well...","10 Rillington Place"
"1181",5365039,5366996,"he was...","10 Rillington Place"
"1182",5368720,5370278,"home all day.","10 Rillington Place"
"1183",5370840,5374673,"Can you suggestwhy he should have
strangled your wife?","10 Rillington Place"
"1184",5382159,5383639,"No, I can't.","10 Rillington Place"
"1185",5384720,5389190,"Can you suggestwhy he should have
strangled your daughter?","10 Rillington Place"
"1186",5397359,5399112,"No.","10 Rillington Place"
"1187",5401199,5403997,"I didn't do it,Auntie.","10 Rillington Place"
"1188",5404199,5406270,"Christie done it.","10 Rillington Place"
"1189",5406479,5411234,"I didn't even know the babywas dead till the police
brought me in to Notting Hill.","10 Rillington Place"
"1190",5411439,5414591,"Well, Christie saidshe was in East Acton.","10 Rillington Place"
"1191",5415119,5416792,"Get Christie.","10 Rillington Place"
"1192",5417000,5420912,"Get him here to see me.He's the only one
who can help me now.","10 Rillington Place"
"1193",5431079,5432911,"Timothy John Evans.","10 Rillington Place"
"1194",5433479,5436711,"The court has found youguilty of wilful murder.","10 Rillington Place"
"1195",5436920,5438751,"The sentence of the courtupon you is","10 Rillington Place"
"1196",5438960,5442190,"that you be takenfrom this place
to a lawful prison","10 Rillington Place"
"1197",5442399,5445038,"and thenceto a place of execution,","10 Rillington Place"
"1198",5445239,5447833,"and there you will sufferdeath by hanging,","10 Rillington Place"
"1199",5448720,5451996,"and that your bodybe buried within
the precincts of the prison","10 Rillington Place"
"1200",5452199,5456909,"in which you shallhave been last confined
before your execution.","10 Rillington Place"
"1201",5457840,5460229,"And may the Lordhave mercy on your soul.","10 Rillington Place"
"1202",5460439,5461759,"Amen.","10 Rillington Place"
"1203",5462920,5466673,"[CHRISTIE SOBBING]","10 Rillington Place"
"1204",5492560,5495073,"[BELL RINGING]","10 Rillington Place"
"1205",5497720,5500359,"The one thingthat sticks in my mind","10 Rillington Place"
"1206",5500560,5503279,"is I'm in for somethingI haven't done, sir.","10 Rillington Place"
"1207",5504479,5508996,"You must remember, Evans,that we're not here to go into
the rights and wrongs of your case.","10 Rillington Place"
"1208",5509199,5511030,"This is purelya medical board.","10 Rillington Place"
"1209",5512399,5514595,"Yes, I know that, sir.","10 Rillington Place"
"1210",5516039,5517631,"See...","10 Rillington Place"
"1211",5518159,5519512,"Christie done it.","10 Rillington Place"
"1212",5521199,5523997,"You confessedat Notting Hill.
Why was that?","10 Rillington Place"
"1213",5525159,5527469,"I broke down at Notting Hill.","10 Rillington Place"
"1214",5527680,5531467,"I had nothing else to worry aboutwhen I knew my daughter was dead.","10 Rillington Place"
"1215",5531840,5533909,"Why do you thinkyour daughter was killed?","10 Rillington Place"
"1216",5536840,5538238,"Well...","10 Rillington Place"
"1217",5539079,5540911,"to be out of the way, wasn't it?","10 Rillington Place"
"1218",5542720,5546029,"I see. Any further questions?No.","10 Rillington Place"
"1219",5546239,5547194,"No.","10 Rillington Place"
"1220",5547399,5549152,"All right. Thank you.","10 Rillington Place"
"1221",5552760,5554591,"Come along, then.","10 Rillington Place"
"1222",5556279,5558873,"But Christie done it.I say, Christie done it.","10 Rillington Place"
"1223",5559079,5560957,"All right.All right.","10 Rillington Place"
"1224",5565640,5568871,"Well, I don't know.He's not an unpleasing
little fellow.","10 Rillington Place"
"1225",5569079,5574676,"Oh, no. Primitive sort ofcreature, but nothing abnormal,
medically speaking.","10 Rillington Place"
"1226",5574880,5578634,"Rather nicer than average, I thought.Yes.","10 Rillington Place"
"1227",5578840,5581354,"Nothing very muchat all, really.","10 Rillington Place"
"1228",5581560,5584756,"Certainly no medical groundsfor a reprieve.","10 Rillington Place"
"1229",5608760,5610556,"[FOOTSTEPS APPROACHING]","10 Rillington Place"
"1230",5610760,5612033,"[KEYS JANGLING]","10 Rillington Place"
"1231",5612239,5613389,"[LOOK UNBOLTS]","10 Rillington Place"
"1232",5634439,5637716,"[BREATHING HEAVILY]","10 Rillington Place"
"1233",5643760,5644953,"Oh!","10 Rillington Place"
"1234",5646039,5647439,"[SIGHS]","10 Rillington Place"
"1235",5677319,5679993,"[###]","10 Rillington Place"
"1236",5697239,5699673,"Supper's in the meat safe.","10 Rillington Place"
"1237",5700760,5704115,"I should have thought youcould have got it for yourself.","10 Rillington Place"
"1238",5706520,5710069,"I'm going to bed now.I've taken a sleeping pill.","10 Rillington Place"
"1239",5711920,5714797,"I'm going to Sheffieldin the morning.","10 Rillington Place"
"1240",5717640,5720631,"Sheffield?To stay with Jessy and Bob.","10 Rillington Place"
"1241",5720840,5722716,"You can't just leave me here.","10 Rillington Place"
"1242",5722920,5725877,"I can't stand Jessy,you know that.
She talks too much.","10 Rillington Place"
"1243",5726079,5728469,"What am I meantto do then?","10 Rillington Place"
"1244",5730079,5731957,"We've no friends.","10 Rillington Place"
"1245",5733600,5737832,"Not a soul set footin this house
for two years, nearly.","10 Rillington Place"
"1246",5738199,5742876,"Not since the Evanses.We've no money.","10 Rillington Place"
"1247",5743399,5744992,"You haven't workedsince I don't know when.","10 Rillington Place"
"1248",5745199,5746189,"I can't work, can I?","10 Rillington Place"
"1249",5746399,5749836,"Not with my backand everything. The doctor
says I should be in hospital.","10 Rillington Place"
"1250",5750039,5752507,"I know whereyou should be.","10 Rillington Place"
"1251",5753000,5757789,"What's that supposed to mean?You know what I mean.","10 Rillington Place"
"1252",5832600,5834476,"Oh...","10 Rillington Place"
"1253",5836960,5838712,"[GROANS]","10 Rillington Place"
"1254",5853520,5855112,"[GRUNTING]","10 Rillington Place"
"1255",5869319,5872470,"[MAN SPEAKINGFOREIGN LANGUAGE]","10 Rillington Place"
"1256",5882199,5884509,"CHRISTIE:You don't mind,
do you?","10 Rillington Place"
"1257",5899920,5901591,"It's migraine.Hm.","10 Rillington Place"
"1258",5901800,5905429,"I get these terrible headaches.Very unpleasant, oh, very unpleasant.","10 Rillington Place"
"1259",5905640,5907676,"Mind you, um...","10 Rillington Place"
"1260",5908119,5911635,"medically speaking, of course,it's a very interesting condition,","10 Rillington Place"
"1261",5911840,5914957,"uh, syndrome, as we call it.","10 Rillington Place"
"1262",5916279,5919078,"You're not a doctor, are you?","10 Rillington Place"
"1263",5919720,5923234,"Well, now how did you know that?Well, I should say, I was.","10 Rillington Place"
"1264",5923439,5927194,"Was?Yes, I, um...","10 Rillington Place"
"1265",5927840,5933118,"I did a favour for a friend.A lady friend. I expect you
understand. You know how it is.","10 Rillington Place"
"1266",5933319,5936756,"Oh, yes. Oh, dear.Can I get you another cup of tea?","10 Rillington Place"
"1267",5936960,5938393,"No, thanks.Are you sure?","10 Rillington Place"
"1268",5938600,5939953,"Mm-hm.","10 Rillington Place"
"1269",5942600,5946479,"Yes, well, of course.They won't do you
any good, mind.","10 Rillington Place"
"1270",5946680,5951070,"What does, though?Well, if only I was free to, uh...","10 Rillington Place"
"1271",5952279,5954747,"Honestly, I'd do anything.","10 Rillington Place"
"1272",5984439,5986555,"[YELLING AND CHATTERING]","10 Rillington Place"
"1273",5991039,5993076,"You certainly do yourselfproud in here, I must say.","10 Rillington Place"
"1274",5993279,5995998,"My wife's away.I don't blame her.","10 Rillington Place"
"1275",5996199,5999953,"You can keep that mattress,for a start. I'd have the
whole shop running alive.","10 Rillington Place"
"1276",6000159,6002435,"What's that meant to mean?Bedbugs.","10 Rillington Place"
"1277",6002640,6004676,"Look, this is mahogany.Pure mahogany.","10 Rillington Place"
"1278",6004880,6007189,"Oh, yeah?Ten quid, the lot.","10 Rillington Place"
"1279",6007399,6009197,"What, for everything?Everything, bar that mattress.","10 Rillington Place"
"1280",6009399,6011470,"That'll walk out by itself.Ten pounds?","10 Rillington Place"
"1281",6011680,6014557,"Well, surely it must be worth 15.Not to me, it isn't.","10 Rillington Place"
"1282",6014760,6018594,"I can't work. I was wounded in the war.That's tough luck, squire.","10 Rillington Place"
"1283",6018800,6021872,"Twelve is my top.Yes or no?","10 Rillington Place"
"1284",6024439,6026270,"All right.I'll have the van round this afternoon.","10 Rillington Place"
"1285",6026479,6030917,"One, two, three.","10 Rillington Place"
"1286",6031680,6034399,"[###]","10 Rillington Place"
"1287",6048600,6050271,"[DOOR CLOSES]","10 Rillington Place"
"1288",6071239,6074470,"I was just lookingthrough my papers.","10 Rillington Place"
"1289",6074680,6077274,"Cuttings and things,newspaper cuttings.","10 Rillington Place"
"1290",6077479,6079755,"I was in all the papersa few years back.","10 Rillington Place"
"1291",6080000,6082434,"[MAN COUGHING]","10 Rillington Place"
"1292",6082640,6084835,"Murder trial, it was.","10 Rillington Place"
"1293",6085279,6087918,"Dreadful business, appalling.","10 Rillington Place"
"1294",6088560,6093270,"Of course, I wasin the police once, so I...","10 Rillington Place"
"1295",6093479,6095868,"understand these things.","10 Rillington Place"
"1296",6099760,6102432,"I have had a very...","10 Rillington Place"
"1297",6103000,6105594,"varied life.","10 Rillington Place"
"1298",6108119,6109951,"Funny, really.","10 Rillington Place"
"1299",6112000,6115355,"In all the papersa few years back, and now...","10 Rillington Place"
"1300",6116960,6118631,"Pig.","10 Rillington Place"
"1301",6124720,6126631,"Well, of course, if that'sthe way you're going to talk...","10 Rillington Place"
"1302",6126840,6129194,"[SHOVING PAPERS IN POCKET]","10 Rillington Place"
"1303",6129399,6131788,"It's what I'd expect, of course.","10 Rillington Place"
"1304",6147560,6149710,"Okay, just dump it here.","10 Rillington Place"
"1305",6150560,6154347,"Really smells bad in here.We'll soon get it cleaned up.","10 Rillington Place"
"1306",6155880,6157313,"[HOLLOW THUD]","10 Rillington Place"
"1307",6158159,6159797,"[KNOCKING]","10 Rillington Place"
"1308",6207680,6209078,"Cliff.Hm?","10 Rillington Place"
"1309",6210039,6211472,"Go and get the police.","10 Rillington Place"
"1310",6233039,6235076,"[HORN HONKING]","10 Rillington Place"
"1311",6267319,6269880,"What are you doing?Looking for work?","10 Rillington Place"
"1312",6272239,6275550,"My employment cardshaven't come through.","10 Rillington Place"
