"id","startTime","endTime","text","title"
"341",1398799,1400676,"You're very young,you know.","10 Rillington Place"
"342",1401240,1403309,"Inexperienced.","10 Rillington Place"
"343",1403519,1406478,"And thingswhich may seem...","10 Rillington Place"
"344",1406960,1409473,"great problems to you","10 Rillington Place"
"345",1409680,1413150,"may seem simplerto an older head, you know.","10 Rillington Place"
"346",1415160,1417833,"But it's just that I'm goingto have a baby.","10 Rillington Place"
"347",1420680,1422032,"Yes, I see.","10 Rillington Place"
"348",1422960,1426031,"Tim, I suppose...","10 Rillington Place"
"349",1426559,1429711,"is none too keen on this, uh...","10 Rillington Place"
"350",1429920,1432150,"addition to the family.","10 Rillington Place"
"351",1433160,1434593,"No.","10 Rillington Place"
"352",1434880,1436871,"Well, I'm not either.","10 Rillington Place"
"353",1437079,1440071,"I took some pills yesterday.","10 Rillington Place"
"354",1442599,1443669,"Pills?","10 Rillington Place"
"355",1443880,1445790,"Yes. They didn't work though.","10 Rillington Place"
"356",1447319,1450153,"You see, Mr. Christie,Tim only gets 7 pounds
a week.","10 Rillington Place"
"357",1450400,1452038,"Well...","10 Rillington Place"
"358",1452240,1454434,"we can't afford another baby now.","10 Rillington Place"
"359",1456720,1459358,"No, I understand that.","10 Rillington Place"
"360",1460119,1462474,"I, uh...","10 Rillington Place"
"361",1462680,1466229,"I do know people, medical people,","10 Rillington Place"
"362",1466440,1468192,"who could help you out.","10 Rillington Place"
"363",1468839,1471273,"But that would cost money,wouldn't it?","10 Rillington Place"
"364",1472200,1474474,"Yes. That's...That's true.","10 Rillington Place"
"365",1474680,1476910,"Yes.That's true, I'm afraid.","10 Rillington Place"
"366",1477119,1482478,"They are very eminent men,one particularly I have in mind.","10 Rillington Place"
"367",1482680,1486752,"I used to assist himin his earlier days.","10 Rillington Place"
"368",1487680,1489635,"Studied with him.","10 Rillington Place"
"369",1490880,1493791,"It's quite a simple matter.","10 Rillington Place"
"370",1495799,1498633,"You... You mean you knowhow to do it, Mr. Christie?","10 Rillington Place"
"371",1498880,1500393,"Oh, yes.","10 Rillington Place"
"372",1500599,1502078,"Oh, that's not a problem.","10 Rillington Place"
"373",1502279,1505157,"I've seen it donea hundred times.","10 Rillington Place"
"374",1505359,1507669,"Terminations, we call them.","10 Rillington Place"
"375",1507880,1511111,"Had to learn about thatin the police.","10 Rillington Place"
"376",1511480,1516190,"Well, I suppose you couldn't...","10 Rillington Place"
"377",1517200,1518633,"Oh, I...","10 Rillington Place"
"378",1518839,1522719,"I know it's againstthe law and everything.","10 Rillington Place"
"379",1523400,1527518,"Oh, no, that's...That's all right.","10 Rillington Place"
"380",1527720,1531269,"As long as nobody goes tellingtales out at school. Sugar?","10 Rillington Place"
"381",1531480,1532515,"No, I wouldn't...","10 Rillington Place"
"382",1532720,1534596,"It's the moral questionthat concerns me.","10 Rillington Place"
"383",1534799,1536551,"I wouldn't tell a soul,Mr. Christie. Honestly.","10 Rillington Place"
"384",1536759,1539148,"The taking of life.","10 Rillington Place"
"385",1539359,1541395,"No matter how rudimentary.","10 Rillington Place"
"386",1541640,1545427,"Well, it's not, really.","10 Rillington Place"
"387",1547519,1551398,"I'd be ever so grateful,Mr. Christie.","10 Rillington Place"
"388",1551640,1555189,"[TRAIN PASSING IN DISTANCE]","10 Rillington Place"
"389",1559000,1560228,"All right, I will.","10 Rillington Place"
"390",1566039,1568076,"[STAMMERING]","10 Rillington Place"
"391",1568279,1570349,"It's such a weight off my mind.","10 Rillington Place"
"392",1570559,1572471,"Honestly, Mr. Christie.","10 Rillington Place"
"393",1572680,1574477,"Honestly.","10 Rillington Place"
"394",1578240,1579194,"Well...","10 Rillington Place"
"395",1579400,1582357,"W... When do you think you could...?","10 Rillington Place"
"396",1583400,1585152,"Well, do you think you could...?","10 Rillington Place"
"397",1585359,1587953,"Well, you have a wordwith Tim tonight.","10 Rillington Place"
"398",1588200,1589519,"Yes.","10 Rillington Place"
"399",1589720,1590709,"And, uh...","10 Rillington Place"
"400",1591480,1593471,"Perhaps we'll be ableto fit you in tomorrow.","10 Rillington Place"
"401",1593680,1595671,"Yes.","10 Rillington Place"
"402",1596599,1598670,"[FACTORY WHISTLE BLOWING]","10 Rillington Place"
"403",1598839,1601637,"What you doing here,then, Beryl?","10 Rillington Place"
"404",1601960,1604269,"Now then, now then.","10 Rillington Place"
"405",1607799,1609438,"I thought we'd go to the pictures.","10 Rillington Place"
"406",1609640,1612200,"Oh, did you, then?Yes.","10 Rillington Place"
"407",1613880,1616872,"Now, Mrs. Christieslooking after Geraldine.","10 Rillington Place"
"408",1617079,1620196,"And you and I are goingto have a night out, okay?","10 Rillington Place"
"409",1620400,1622709,"Well, all right, then. Come on.[BELL RINGS]","10 Rillington Place"
"410",1622920,1625194,"BERYL:Oh, the bus!","10 Rillington Place"
"411",1634400,1637994,"[SINGING ""I'LL TAKE YOUHOME AGAIN, KATHLEEN""]","10 Rillington Place"
"412",1667279,1668234,"Ta.","10 Rillington Place"
"413",1668440,1670157,"Here's how.","10 Rillington Place"
"414",1674319,1676880,"Did you like it? The film?","10 Rillington Place"
"415",1677079,1678990,"Oh, it was all right.","10 Rillington Place"
"416",1679200,1681155,"Didn't see too much of it.","10 Rillington Place"
"417",1681359,1682873,"I like Gregory Peck.","10 Rillington Place"
"418",1683079,1684832,"Ah, he's okay.","10 Rillington Place"
"419",1685559,1687993,"You know, you're a bitlike him, to look at.","10 Rillington Place"
"420",1688200,1690155,"Good God, girl, you'vehardly had one drink.","10 Rillington Place"
"421",1690359,1692191,"No, no, you are.","10 Rillington Place"
"422",1693680,1695954,"He's about 7-foot-3for a start off.","10 Rillington Place"
"423",1696160,1699356,"I know. But just aroundthe eyes, you look like him.","10 Rillington Place"
"424",1703799,1706597,"Mr. Christie was talkingto me today.","10 Rillington Place"
"425",1707039,1708632,"What? About last night?","10 Rillington Place"
"426",1708880,1712111,"Oh, no. He was...He was okay about that.","10 Rillington Place"
"427",1712480,1714868,"He, uh...","10 Rillington Place"
"428",1715079,1717991,"Well, he said he mightbe able to help us.","10 Rillington Place"
"429",1718200,1719269,"Huh?","10 Rillington Place"
"430",1719559,1721993,"About the baby, you know.","10 Rillington Place"
"431",1722200,1723837,"Oh?","10 Rillington Place"
"432",1724319,1725548,"What's he think he can do?","10 Rillington Place"
"433",1726839,1729479,"Well, he's had experienceof things like that.","10 Rillington Place"
"434",1732680,1735557,"You mean... getting rid of it?","10 Rillington Place"
"435",1735759,1737511,"Termination, it's called.","10 Rillington Place"
"436",1738960,1740075,"Oh, I...","10 Rillington Place"
"437",1740480,1741595,"No, I don't know about that,Beryl.","10 Rillington Place"
"438",1741839,1744637,"No, no. I don't think he wantsmoney or anything like that.","10 Rillington Place"
"439",1744880,1746438,"That's not what I mean.","10 Rillington Place"
"440",1747400,1748548,"Tim.","10 Rillington Place"
"441",1748759,1752877,"We can't have anotherkiddie now. You know
we can't.","10 Rillington Place"
"442",1753480,1757314,"Well, l...I know I could always get a...","10 Rillington Place"
"443",1757559,1759471,"bigger job, pays more cash.","10 Rillington Place"
"444",1759720,1762916,"You know, I could go tonight school. Get qualified
in something.","10 Rillington Place"
"445",1771440,1772474,"What's he do, anyhow?","10 Rillington Place"
"446",1775119,1777111,"I don't know.","10 Rillington Place"
"447",1778079,1779832,"[SNIFFS]","10 Rillington Place"
"448",1780039,1782792,"[PIANO PLAYING]","10 Rillington Place"
"449",1783000,1784557,"Yeah.","10 Rillington Place"
"450",1797759,1799432,"All right, then.","10 Rillington Place"
"451",1801680,1804147,"Hey, mind the beer, girl.","10 Rillington Place"
"452",1809400,1811277,"[BABY GURGLING]","10 Rillington Place"
"453",1820599,1821794,"Tim.","10 Rillington Place"
"454",1822000,1825959,"Will you tell Mr. Christieit's all right when you go
down the stairs?","10 Rillington Place"
"455",1826160,1828992,"I don't like it, Beryl.Oh, Tim.","10 Rillington Place"
"456",1829200,1831509,"You can't go backon it now.","10 Rillington Place"
"457",1833039,1835348,"Okay, okay.","10 Rillington Place"
"458",1848559,1850391,"Mr. Christie?","10 Rillington Place"
"459",1855000,1856876,"Mr. Christie?","10 Rillington Place"
"460",1860240,1864471,"Oh, there you are, Mr. Christie.Oh, Tim. Come in, come in.","10 Rillington Place"
"461",1864680,1866635,"Look, Mr. Christie,Beryl's been telling...","10 Rillington Place"
"462",1866839,1868557,"Shut the door, will you?Do you mind?","10 Rillington Place"
"463",1868759,1870272,"Oh, no.","10 Rillington Place"
"464",1877759,1879239,"Tim...","10 Rillington Place"
"465",1880599,1884558,"I dislike this businessas much as you do.","10 Rillington Place"
"466",1884759,1887911,"Well, I don't know, Mr...It's just that I happen to have, uh,","10 Rillington Place"
"467",1888200,1892478,"picked up this knowledgewhilst I was in training
as a doctor, before the war.","10 Rillington Place"
"468",1892680,1894875,"Oh, I didn't know you didall this medical stuff.","10 Rillington Place"
"469",1895240,1896798,"Oh, yes.","10 Rillington Place"
"470",1897000,1903189,"Yes, yes. Unfortunately,my training was interrupted
by a motoring accident.","10 Rillington Place"
"471",1903400,1907551,"And, um... Then the war came and...Well, that's most...","10 Rillington Place"
"472",1907759,1911638,"I was browsing throughsome of my, uh,","10 Rillington Place"
"473",1911839,1915798,"medical texts before you came in,as a matter of fact.","10 Rillington Place"
"474",1916000,1918433,"Perhaps you'd like to, uh...","10 Rillington Place"
"475",1919720,1921118,"Um...","10 Rillington Place"
"476",1923559,1927189,"Yes, well, l... I don't knowabout all this stuff, see.","10 Rillington Place"
"477",1928000,1930069,"No. No, no.","10 Rillington Place"
"478",1931119,1934237,"But how do you, uh...?","10 Rillington Place"
"479",1934880,1936393,"I mean...","10 Rillington Place"
"480",1937200,1939919,"How do you actually do it?","10 Rillington Place"
"481",1940920,1944878,"Well, that's something only doctorsand myself know about.","10 Rillington Place"
"482",1945079,1947230,"It has to be secret,you understand. I mean...","10 Rillington Place"
"483",1947440,1951830,"We couldn't have everyTom, Dick and Harry going
around doing it, could we?","10 Rillington Place"
"484",1954119,1955758,"No, I understand that, but...","10 Rillington Place"
"485",1956279,1960796,"I won't conceal the dangersfrom you, mind.","10 Rillington Place"
"486",1961000,1963308,"The, um...","10 Rillington Place"
"487",1963519,1968150,"The, uh, stuff I use...","10 Rillington Place"
"488",1968359,1970156,"One in 10 might die from it.","10 Rillington Place"
"489",1971440,1972667,"Die?","10 Rillington Place"
"490",1973000,1976037,"Well, yes, that's an acceptablemedical risk. That's understood.","10 Rillington Place"
"491",1976240,1980631,"Mind you, they probably usetoo strong a dose.","10 Rillington Place"
"492",1981559,1983755,"If only you and, uh...","10 Rillington Place"
"493",1984200,1988990,"Beryl had come to meearlier, I could've done it
without any risk at all.","10 Rillington Place"
"494",1989200,1990712,"L...","10 Rillington Place"
"495",1990920,1994070,"Oh, I don't know.I don't know, Mr. Christie.","10 Rillington Place"
"496",1995279,1998113,"Well, Tim...","10 Rillington Place"
"497",1998400,2002951,"if you haven't got completeconfidence in my ability...","10 Rillington Place"
"498",2003799,2007759,"No, no, I...I trust you,
Mr. Christie.","10 Rillington Place"
"499",2007960,2010076,"Of course I do.","10 Rillington Place"
"500",2012359,2014156,"All right, then.","10 Rillington Place"
"501",2016039,2018599,"Good lad.Right, well, you...","10 Rillington Place"
"502",2018799,2021916,"cut along to work,otherwise you'll be late.","10 Rillington Place"
"503",2022119,2026477,"And, uh, Tim, remember...","10 Rillington Place"
"504",2027480,2029868,"we've never lost a father yet.","10 Rillington Place"
"505",2030079,2031512,"No?","10 Rillington Place"
"506",2034960,2036075,"Well...","10 Rillington Place"
"507",2036279,2038430,"Thank you, Mr. Christie.","10 Rillington Place"
"508",2068199,2070873,"[GLASSES CLINKING]","10 Rillington Place"
"509",2072519,2074032,"Ethel?","10 Rillington Place"
"510",2074360,2076237,"Ethel.Hm?","10 Rillington Place"
"511",2076440,2080148,"Ethel, I want you to goto the office for me, will you?
See Mr. Steadman.","10 Rillington Place"
"512",2080360,2083032,"Tell him my back's beenplaying me up, and I shan't
be in today.","10 Rillington Place"
"513",2083239,2085389,"Oh, Reg, are you goingto the doctor?","10 Rillington Place"
"514",2085599,2088831,"No. No, I'll be all right.I'll phone from the corner.","10 Rillington Place"
"515",2089039,2091190,"No, you'd better go.They'll want these bills","10 Rillington Place"
"516",2091400,2093833,"of lading and invoicesright away.","10 Rillington Place"
"517",2094039,2097112,"Go and get your coat on.All right.","10 Rillington Place"
"518",2108480,2112074,"[###]","10 Rillington Place"
"519",2113480,2116597,"[BREATHING UNEVENLY]","10 Rillington Place"
"520",2119800,2121710,"I'm ready, Reg.","10 Rillington Place"
"521",2136760,2139353,"Tell him I ought tobe better tomorrow.","10 Rillington Place"
"522",2139719,2141358,"All right.","10 Rillington Place"
"523",2232639,2234789,"[DOORBELL RINGS]","10 Rillington Place"
"524",2239480,2241869,"[DOORBELL RINGS]","10 Rillington Place"
"525",2246920,2249150,"[RINGING CONTINUES]","10 Rillington Place"
"526",2284320,2286594,"Yes, what is it?Mr. Christie?","10 Rillington Place"
"527",2286800,2288199,"Yes.Ah. Builders.","10 Rillington Place"
"528",2288400,2292836,"""Repair roof to outhouse, re-plasterwhere necessary and make good.""","10 Rillington Place"
"529",2293880,2296268,"Now? It's not convenient.","10 Rillington Place"
"530",2296719,2298277,"You are Mr. Christie?","10 Rillington Place"
"531",2298480,2301152,"You complained to the landlordabout this outhouse.","10 Rillington Place"
"532",2302639,2306235,"Well, l... I needto be informed
in advance.","10 Rillington Place"
"533",2306639,2310155,"But look, mate,I just take my orders
from the owners.","10 Rillington Place"
"534",2310719,2313916,"It is just the, uh,the washhouse, is it?","10 Rillington Place"
"535",2314119,2315472,"Just the outbuildings.Yeah.","10 Rillington Place"
"536",2318199,2320315,"Yes, well, you bettercome through.","10 Rillington Place"
"537",2321679,2322954,"Now...","10 Rillington Place"
"538",2323159,2325434,"Thank you very much.","10 Rillington Place"
"539",2326960,2328871,"I was just havinga cup of tea.","10 Rillington Place"
"540",2329079,2331355,"Oh.It's, uh...","10 Rillington Place"
"541",2331960,2334110,"back up here, on the right.","10 Rillington Place"
"542",2340760,2342159,"This is it.","10 Rillington Place"
"543",2342360,2344554,"The washhouse.Right.","10 Rillington Place"
"544",2346440,2349079,"All this lot will haveto come down, for a start.","10 Rillington Place"
"545",2350119,2352076,"How long will it take?","10 Rillington Place"
"546",2352559,2355278,"Oh, shouldn't take morethan a couple of days.","10 Rillington Place"
"547",2374239,2375195,"[THUNK]","10 Rillington Place"
"548",2375400,2376958,"Be careful.Do you mind?","10 Rillington Place"
"549",2377159,2378990,"Yeah, mindthe paintwork, mate.","10 Rillington Place"
"550",2379199,2381668,"And the pricelessantiques.","10 Rillington Place"
"551",2382639,2384436,"BERYL:Mr. Christie?","10 Rillington Place"
"552",2385400,2386958,"Are you...?","10 Rillington Place"
"553",2388519,2389793,"[WHISPERS]I've got the builders in.","10 Rillington Place"
"554",2390480,2392117,"Well, it doesn't matter.","10 Rillington Place"
"555",2392800,2395155,"[FOOTSTEPS CLIMBING STAIRS]","10 Rillington Place"
"556",2412440,2415000,"[FOOTSTEPS]","10 Rillington Place"
"557",2422400,2423798,"[FOOTSTEPS APPROACHING]","10 Rillington Place"
"558",2434679,2437273,"[DISTANT SAWING]","10 Rillington Place"
"559",2446920,2448911,"Ahem.Oh.","10 Rillington Place"
"560",2449119,2452873,"Here we are, then.Brought you a little cup of tea.","10 Rillington Place"
"561",2453480,2455117,"Oh. Thank you.","10 Rillington Place"
"562",2455480,2458630,"What are they doing,the builders?","10 Rillington Place"
"563",2458840,2463277,"Oh, they... They won't disturb us.","10 Rillington Place"
"564",2463840,2465478,"Baby asleep, is she?","10 Rillington Place"
"565",2465679,2468034,"Oh, yes, she's inthe other room.","10 Rillington Place"
"566",2468239,2471835,"Right, well, we can managein here then.","10 Rillington Place"
"567",2472039,2475112,"Just drink your teaand relax.","10 Rillington Place"
"568",2477480,2479231,"Is it going to hurt?","10 Rillington Place"
"569",2479440,2483557,"Just a little twinge,but we can help that.","10 Rillington Place"
"570",2483760,2486512,"Open the window for me6 inches, will you? And...","10 Rillington Place"
"571",2486719,2490030,"perhaps you'd betterpull down the blind.","10 Rillington Place"
"572",2507880,2509153,"Fast asleep.","10 Rillington Place"
"573",2512239,2513719,"Right.","10 Rillington Place"
"574",2516840,2520719,"Just pass me my bag,will you?","10 Rillington Place"
"575",2521880,2523438,"Ta.","10 Rillington Place"
"576",2528280,2531112,"Oh, what's that for?","10 Rillington Place"
"577",2531360,2534112,"Just a whiff of gas.Gas?","10 Rillington Place"
"578",2534320,2537550,"Like at the dentist's.Take away those little twinges.","10 Rillington Place"
"579",2537760,2540320,"But that's poisonous,isn't it?
Oh, now.","10 Rillington Place"
"580",2540519,2542237,"Not the way we use it.","10 Rillington Place"
"581",2543199,2546077,"Something we had to learnduring the war","10 Rillington Place"
"582",2546320,2549835,"for bomb victims","10 Rillington Place"
"583",2550559,2553358,"that needed urgent surgery.","10 Rillington Place"
"584",2553880,2559637,"It's a chemicallycompounded filter, you see.","10 Rillington Place"
"585",2559840,2561637,"The liquid.","10 Rillington Place"
"586",2562239,2567438,"Takes outthe carbon monoxide,
or CO-2...","10 Rillington Place"
"587",2568039,2570110,"as we call it.","10 Rillington Place"
"588",2573119,2574393,"There.","10 Rillington Place"
"589",2574719,2576277,"Right.","10 Rillington Place"
"590",2577679,2582231,"Right. I'll justget scrubbed up.","10 Rillington Place"
"591",2584519,2586396,"There isn't any cutting,is there?","10 Rillington Place"
"592",2586599,2590309,"Oh, no, no.No, no.","10 Rillington Place"
"593",2596559,2598072,"Ta.","10 Rillington Place"
"594",2599639,2601869,"I'm ever so nervous,Mr. Christie.","10 Rillington Place"
"595",2602679,2606831,"Oh, there's no need to be,no need at all.","10 Rillington Place"
"596",2607039,2609599,"Do you, um, have, uh...","10 Rillington Place"
"597",2609960,2612030,"undergarments on?","10 Rillington Place"
"598",2612559,2613788,"Yes.","10 Rillington Place"
"599",2614000,2616958,"Well, just slipthem off, will you?","10 Rillington Place"
"600",2633360,2634588,"Oh...","10 Rillington Place"
"601",2634800,2636152,"Should I takemy dress off?","10 Rillington Place"
"602",2636360,2638873,"No, no, just the, um...","10 Rillington Place"
"603",2639960,2642871,"And then lie downon the quilt.","10 Rillington Place"
"604",2653880,2657235,"Right down?Yes, just lie down and relax.","10 Rillington Place"
"605",2663480,2665072,"You ready?","10 Rillington Place"
"606",2665400,2666833,"Yes.","10 Rillington Place"
"607",2675320,2677311,"That's a good girl.","10 Rillington Place"
"608",2679639,2684155,"Now, just a little","10 Rillington Place"
"609",2684400,2686391,"whiff of the gas.","10 Rillington Place"
"610",2687119,2690590,"You've, uh, had gas beforeat the dentist, have you?","10 Rillington Place"
"611",2690800,2692791,"Well, you knowwhat it feels like, then.","10 Rillington Place"
"612",2693000,2696913,"You'll feel justa little bit dizzy,
I expect.","10 Rillington Place"
"613",2697119,2700873,"Right.Now, breathe deeply.","10 Rillington Place"
"614",2701079,2703673,"Breathe... Just relax,breathe deeply, close your eyes.","10 Rillington Place"
"615",2705320,2707550,"Olose your eyes,that's a good girl.","10 Rillington Place"
"616",2707760,2709989,"That's a good girl.","10 Rillington Place"
"617",2710239,2711878,"Breathe.","10 Rillington Place"
"618",2712920,2714672,"Breathe.","10 Rillington Place"
"619",2715000,2716228,"Breathe, Beryl.","10 Rillington Place"
"620",2717360,2719112,"That's it.","10 Rillington Place"
"621",2719320,2720958,"[BREATHING UNEVENLY]","10 Rillington Place"
"622",2721159,2722478,"That's it.[MUFFLED GASPING]","10 Rillington Place"
"623",2725719,2729759,"No. No. No, no, no, no. Quiet! Quiet![MUFFLED SCREAMING]","10 Rillington Place"
"624",2730679,2732829,"Be quiet! Be...","10 Rillington Place"
"625",2733039,2734791,"Be quiet! Quiet!","10 Rillington Place"
"626",2735920,2737398,"No, I don't want to!","10 Rillington Place"
"627",2737639,2739755,"Please! Please!Don't make me hurt you!
No! No!","10 Rillington Place"
"628",2740079,2741034,"No!Please!","10 Rillington Place"
"629",2749880,2752074,"Oh, Beryl.","10 Rillington Place"
"630",2752280,2755112,"Oh... Beryl.","10 Rillington Place"
"631",2755320,2757311,"Oh, Beryl.","10 Rillington Place"
"632",2758280,2759713,"Oh, Beryl.","10 Rillington Place"
"633",2759920,2761672,"[KISSING]","10 Rillington Place"
"634",2768280,2770748,"[PANTING]","10 Rillington Place"
"635",2785679,2787351,"[WHISTLING]","10 Rillington Place"
"636",2788280,2790157,"Howdy dowdie do?","10 Rillington Place"
"637",2791079,2793389,"Hey, come on, come on.","10 Rillington Place"
"638",2798880,2800108,"Beryl!","10 Rillington Place"
"639",2810400,2811628,"[TRIES HANDLE]","10 Rillington Place"
"640",2812400,2814117,"Beryl?","10 Rillington Place"
"641",2816519,2818590,"[HANDLE TURNING]","10 Rillington Place"
"642",2820960,2822552,"Beryl?","10 Rillington Place"
"643",2823480,2825675,"[HANDLE TURNING]","10 Rillington Place"
"644",2827920,2830592,"If you don't want to see me,you've only got to say so.","10 Rillington Place"
"645",2832159,2834150,"[HANDLE TURNING]","10 Rillington Place"
"646",2834360,2836077,"Beryl?","10 Rillington Place"
"647",2847960,2850757,"[###]","10 Rillington Place"
"648",2869119,2870074,"[BABY CRYING]","10 Rillington Place"
"649",2870280,2872157,"Mummy.","10 Rillington Place"
"650",2877920,2879797,"Mummy.","10 Rillington Place"
"651",2880000,2884231,"[CRYING]","10 Rillington Place"
"652",2909000,2911275,"Oh, hello, Mr. Christie.","10 Rillington Place"
"653",2912400,2914630,"It's bad news, Tim.","10 Rillington Place"
"654",2915039,2916996,"It didn't work.","10 Rillington Place"
"655",2917199,2918599,"[SNIFFS]","10 Rillington Place"
"656",2918800,2920278,"Oh.","10 Rillington Place"
"657",2920480,2922436,"Well,where's Beryl then?","10 Rillington Place"
"658",2922800,2924835,"She's upstairs on the bed.Oh, Tim.","10 Rillington Place"
"659",2925039,2926951,"Lying down.","10 Rillington Place"
"660",2929159,2931878,"Go on up.I'll come up with you.","10 Rillington Place"
"661",2945960,2947518,"Beryl?","10 Rillington Place"
"662",2956400,2957355,"What...?","10 Rillington Place"
"663",2957559,2961472,"She's got bloodall down her chin.","10 Rillington Place"
"664",2962320,2967440,"That's the concussion,I'm afraid. She would
struggle, you see.","10 Rillington Place"
"665",2967719,2971349,"Concussed her headagainst the bed head.","10 Rillington Place"
"666",2971559,2975268,"It's got sharp corners,that bed head.","10 Rillington Place"
"667",2977119,2978791,"Beryl?","10 Rillington Place"
"668",2986800,2989108,"She's not alive.","10 Rillington Place"
"669",2989719,2992188,"I told you it was bad.","10 Rillington Place"
"670",2992760,2998356,"But you... You never said...One out of 10 die of it. I told you that.","10 Rillington Place"
"671",2999679,3001989,"Oh, Christ.","10 Rillington Place"
"672",3004360,3006429,"I'm sorry, Tim.","10 Rillington Place"
"673",3006960,3009393,"These things happen,though.","10 Rillington Place"
"674",3010280,3012918,"She should haveapproached me earlier.","10 Rillington Place"
"675",3013119,3018239,"Oh, God.And she was only young.","10 Rillington Place"
"676",3019239,3021309,"Yes, it's a terrible thing.","10 Rillington Place"
"677",3021519,3024637,"But she'd have had to bein hospital by now, anyway.","10 Rillington Place"
"678",3024840,3027990,"Doctors couldn't havehelped her even.","10 Rillington Place"
"679",3029039,3033032,"Her tummywas septic poisoned.","10 Rillington Place"
"680",3033559,3035789,"All those pills she'd beendosing herself up with.","10 Rillington Place"
"681",3036000,3038753,"Oh, God. Oh, God.[BABY CRYING]","10 Rillington Place"
"682",3038960,3040188,"Those damn pills!","10 Rillington Place"
"683",3040400,3043311,"Don't... Don't wakethe baby, Tim.","10 Rillington Place"
"684",3045159,3046592,"What am I going to do?","10 Rillington Place"
"685",3046800,3048710,"Come with me, come on.","10 Rillington Place"
"686",3049480,3050913,"Come on.","10 Rillington Place"
"687",3058519,3060192,"Sit down.","10 Rillington Place"
"688",3062960,3065076,"But you'll getthe doctor?","10 Rillington Place"
"689",3066519,3070990,"Doctors can't do much now,I'm afraid, Tim.","10 Rillington Place"
"690",3071519,3076355,"Well, we gotta do something.The police or something.","10 Rillington Place"
"691",3077360,3079635,"Yes, you may be right.","10 Rillington Place"
"692",3079840,3082307,"Well, that's whatI think anyhow.","10 Rillington Place"
