"id","startTime","endTime","text","title"
"693",3084320,3087356,"It'll be criminal manslaughterfor me, of course.","10 Rillington Place"
"694",3089440,3094230,"Oh, God, I don't want to getyou into trouble, Mr. Christie.","10 Rillington Place"
"695",3094639,3097711,"No, I'm not just thinkingabout me so much.","10 Rillington Place"
"696",3097920,3100559,"I'm not the only one involved.","10 Rillington Place"
"697",3100880,3103838,"You knew all about it,didn't you?","10 Rillington Place"
"698",3106000,3107876,"Well, of course I knew about it.","10 Rillington Place"
"699",3108559,3111153,"Well, don't get huffy with me, my lad.","10 Rillington Place"
"700",3112320,3114958,"You knew about it,that's the point.","10 Rillington Place"
"701",3115559,3117550,"You're an accessory before the act.","10 Rillington Place"
"702",3120719,3123438,"Well, I done nothing.","10 Rillington Place"
"703",3124360,3126715,"Oh, God, I done nothing.","10 Rillington Place"
"704",3128320,3130150,"But you knew about it, Tim.","10 Rillington Place"
"705",3131159,3132797,"You consented.","10 Rillington Place"
"706",3133199,3135588,"That's all they'll want to know.","10 Rillington Place"
"707",3136559,3139472,"All right, all right, then, I'll...I'll not tell them nothing.","10 Rillington Place"
"708",3139679,3142034,"I'll just say I don't know nothingand just keep clammed up.","10 Rillington Place"
"709",3142239,3145197,"[BABY CRYING]","10 Rillington Place"
"710",3145400,3149393,"You'd better go and seeto the baby, you can't
leave her crying like that.","10 Rillington Place"
"711",3167480,3169675,"Poor old Tim, eh?","10 Rillington Place"
"712",3172320,3176199,"I could get you out of this,if only you didn't keep
talking so silly.","10 Rillington Place"
"713",3179000,3182514,"I just don't know what to do.","10 Rillington Place"
"714",3184280,3187670,"Well, we could keep quiet about it,couldn't we?","10 Rillington Place"
"715",3190519,3194034,"She's just lying there.","10 Rillington Place"
"716",3196440,3197918,"Well,","10 Rillington Place"
"717",3198280,3200429,"there are ways of...","10 Rillington Place"
"718",3200679,3203193,"disposing of bodies.","10 Rillington Place"
"719",3204000,3207072,"What? Not be buried, you mean?","10 Rillington Place"
"720",3207360,3209315,"No proper service?","10 Rillington Place"
"721",3209599,3211318,"What good woulda proper service do?","10 Rillington Place"
"722",3212039,3217353,"Well, she'd want it, that's what.And me too, I want... I want it.","10 Rillington Place"
"723",3219079,3221798,"You want it?She'd want it?","10 Rillington Place"
"724",3222559,3224516,"You want to be hung?","10 Rillington Place"
"725",3226119,3227438,"Is that what you want?","10 Rillington Place"
"726",3247880,3251873,"You better see to thebaby's supper. She'll be
crying for it in a minute.","10 Rillington Place"
"727",3258840,3261831,"They don't hang youfor manslaughter, anyhow.","10 Rillington Place"
"728",3262159,3263387,"No.","10 Rillington Place"
"729",3265159,3266559,"They do for murder, though.","10 Rillington Place"
"730",3269440,3272909,"They'll just think you killed herin one of those fights of yours.","10 Rillington Place"
"731",3273119,3275759,"She's got that knock on the head.","10 Rillington Place"
"732",3275960,3279554,"The whole street knows aboutthe fights you have all the time.","10 Rillington Place"
"733",3279760,3281954,"The police know, even.","10 Rillington Place"
"734",3283159,3286152,"What do you mean? I didn't...I mean,","10 Rillington Place"
"735",3286360,3288954,"you start going to the policeor whatever,","10 Rillington Place"
"736",3289159,3293311,"and I'm going to have to denyI had anything to do with it.","10 Rillington Place"
"737",3294079,3295307,"Oh, they'll know.","10 Rillington Place"
"738",3297320,3299275,"They'll know fromthe operation you did.","10 Rillington Place"
"739",3299480,3301356,"Oh, no, my lad.","10 Rillington Place"
"740",3301559,3304552,"There are no visible signs,not the way I do it.","10 Rillington Place"
"741",3304760,3309753,"All right, then. All right,I'll tell them and then they'll know.","10 Rillington Place"
"742",3309960,3312427,"Who do you thinkthey'll believe, Tim?","10 Rillington Place"
"743",3312719,3314789,"Everyone around hereknows the stories
you come out with","10 Rillington Place"
"744",3315039,3318429,"about your father beingan Italian count and everything.","10 Rillington Place"
"745",3318639,3321757,"Oh, it's just storyfying,everyone knows that.","10 Rillington Place"
"746",3326840,3329797,"Anyhow, he wasan Italian, my father.","10 Rillington Place"
"747",3330000,3332797,"Well, he may nothave been a count,
I don't know about that.","10 Rillington Place"
"748",3333000,3335036,"An Italian named Evans?","10 Rillington Place"
"749",3335239,3339152,"That's just a name he usedso as people wouldn't
know who he was.","10 Rillington Place"
"750",3340559,3344677,"Well, he was in this secretbusiness, see? Well, that's
why we were so rich.","10 Rillington Place"
"751",3344880,3348588,"He had all his moneyin shares and everything.","10 Rillington Place"
"752",3348800,3351632,"Only he lost it, becausehe was killed in the war.","10 Rillington Place"
"753",3352039,3355349,"So who are the policegoing to believe, eh?","10 Rillington Place"
"754",3355559,3357039,"You?","10 Rillington Place"
"755",3357360,3360829,"Or me, that was a specialconstable for four years?","10 Rillington Place"
"756",3361039,3362836,"Well, me, of course! Me.","10 Rillington Place"
"757",3364480,3365753,"All right, then, Tim.","10 Rillington Place"
"758",3365960,3369190,"Well, you go to the policeand tell them. Go on.","10 Rillington Place"
"759",3370199,3371838,"Off you go.","10 Rillington Place"
"760",3372360,3374635,"All right, I will too.","10 Rillington Place"
"761",3374920,3376512,"Well, they'll haveto believe the truth.","10 Rillington Place"
"762",3378639,3380914,"Well, go on then,if you're going.","10 Rillington Place"
"763",3382159,3383592,"Well, I can't go now, can I?","10 Rillington Place"
"764",3383840,3385637,"I've got the baby to feedand everything.","10 Rillington Place"
"765",3385840,3389833,"I'll do that. I'll do that for youwhile you're gone.","10 Rillington Place"
"766",3401320,3404311,"Well, you tell me.","10 Rillington Place"
"767",3405360,3407748,"Tell me what to doand then I won't go.","10 Rillington Place"
"768",3407960,3410076,"No, no, you've got to dowhat you think's right.","10 Rillington Place"
"769",3410280,3412349,"Well, let's just shutthe door and talk, eh?","10 Rillington Place"
"770",3417000,3418193,"All right.","10 Rillington Place"
"771",3421679,3423318,"You're gonna beguided by me, hm?","10 Rillington Place"
"772",3423519,3425909,"Yes, okay, Mr. Christie.","10 Rillington Place"
"773",3426519,3429353,"Right. Sit down.","10 Rillington Place"
"774",3434559,3440795,"Now, first of all,there's Beryl.
I'll look after that.","10 Rillington Place"
"775",3441639,3442833,"I'll, uh...","10 Rillington Place"
"776",3443039,3445190,"I'll dispose of her.","10 Rillington Place"
"777",3446159,3448594,"I'll wait till I get a chance.You know the, uh...","10 Rillington Place"
"778",3448800,3453351,"the big manhole coverby the front door?","10 Rillington Place"
"779",3453719,3455869,"Lay her to rest there.Oh. Oh, God.","10 Rillington Place"
"780",3456079,3459833,"This is no time for you to break down.Yes, I know, I know, I'm sorry.","10 Rillington Place"
"781",3462119,3467034,"It'd look better if you wentaway for a bit. Right away,
tonight, out of London.","10 Rillington Place"
"782",3467239,3469594,"I don't...Listen to me.","10 Rillington Place"
"783",3470519,3472715,"Then I could tell people","10 Rillington Place"
"784",3472920,3476036,"that you and Berylhad gone away together.","10 Rillington Place"
"785",3479159,3481992,"And what about the baby?Geraldine?","10 Rillington Place"
"786",3482199,3485271,"Oh, she'll be all right.It's very lucky, as a matter of fact.","10 Rillington Place"
"787",3485480,3490076,"There's a young coupleover at Acton I know
who'll look after her for you.","10 Rillington Place"
"788",3490280,3493954,"East Acton, to be precise.","10 Rillington Place"
"789",3494159,3499677,"They can't have any of their own,so it's handy, really.","10 Rillington Place"
"790",3499880,3503269,"So you just, uh, leaveall her things packed up,","10 Rillington Place"
"791",3503480,3505994,"and I'll get them to come overand collect her in the morning.","10 Rillington Place"
"792",3507400,3510472,"But I'll be ableto have her back, won't I?","10 Rillington Place"
"793",3510679,3512954,"I mean, when...When all this has blown over?","10 Rillington Place"
"794",3513159,3517438,"Oh, yes, yes.Yes, I daresay.","10 Rillington Place"
"795",3520480,3523074,"Right, then,you get the baby fed.","10 Rillington Place"
"796",3523280,3527989,"Oh, God, Mr. Christie.And she was only young.","10 Rillington Place"
"797",3528400,3531710,"If she'd come to me earlier...","10 Rillington Place"
"798",3554840,3558992,"[RUSTLINGAND THUDDING]","10 Rillington Place"
"799",3567280,3569271,"[CHRISTIE PANTING]","10 Rillington Place"
"800",3574400,3576356,"Come and give me a hand.","10 Rillington Place"
"801",3583280,3585952,"Grab her,grab her legs.","10 Rillington Place"
"802",3605320,3607356,"Let her down,let her down.","10 Rillington Place"
"803",3609360,3611112,"We'll put herin Kitchener's place.","10 Rillington Place"
"804",3611320,3614835,"The old man's in hospital.He won't be back for days.","10 Rillington Place"
"805",3634159,3635512,"She'll be all rightin there for tonight.","10 Rillington Place"
"806",3636480,3638947,"Take this.What's this?","10 Rillington Place"
"807",3639159,3642277,"Wedding ring.Sell it.","10 Rillington Place"
"808",3642519,3647115,"It'll make her lesseasy to identify,
if they do ever find her.","10 Rillington Place"
"809",3648440,3650351,"Oh...","10 Rillington Place"
"810",3650559,3655713,"Now, you get packed,and then get a night
train anywhere,","10 Rillington Place"
"811",3655920,3658275,"and I'll get those peopleover from East Acton","10 Rillington Place"
"812",3658480,3661597,"first thing in the morningfor the baby.","10 Rillington Place"
"813",3661800,3663074,"[BABY CRYING]","10 Rillington Place"
"814",3663280,3666510,"You'd better goand finish feeding her.","10 Rillington Place"
"815",3666719,3669028,"Yes, Mr. Christie.","10 Rillington Place"
"816",3669239,3670719,"[CRYING CONTINUES]","10 Rillington Place"
"817",3670920,3673070,"Go on, go on.","10 Rillington Place"
"818",3699079,3700990,"[FLOORBOARDS CREAKING]","10 Rillington Place"
"819",3715840,3717398,"[DOOR CLOSES]","10 Rillington Place"
"820",3749639,3751914,"[BABY CRYING]","10 Rillington Place"
"821",3757199,3760112,"[CRYING CONTINUES]","10 Rillington Place"
"822",3782119,3784588,"[TRAIN ENGINE CHUGGING]","10 Rillington Place"
"823",3801559,3803516,"[TRAIN WHISTLE BLOWING]","10 Rillington Place"
"824",3803719,3806280,"[CLOCK CHIMING]","10 Rillington Place"
"825",3820639,3823358,"Hello, Auntie Vi.Tim.","10 Rillington Place"
"826",3823559,3828588,"Well, what are youdoing down here?
Come in, come in.","10 Rillington Place"
"827",3831800,3834677,"It's Tim.","10 Rillington Place"
"828",3834880,3839351,"Tim, boy. What are you doingin this neck of the woods?","10 Rillington Place"
"829",3839559,3841277,"Sit down, Tim,take your coat off.","10 Rillington Place"
"830",3841480,3843835,"Well, me and the bossis, uh, touring round,","10 Rillington Place"
"831",3844039,3847715,"trying to find new branches,only the car broke down
in Cardiff.","10 Rillington Place"
"832",3847920,3851070,"There's tea. Fresh brewed, Tim.You still like egg and fried bread?","10 Rillington Place"
"833",3851280,3853668,"Oh, smashing.","10 Rillington Place"
"834",3853880,3857110,"Uh, it'll bea few days, the car.","10 Rillington Place"
"835",3857320,3860039,"The big end's gone, they said.How's Beryl?","10 Rillington Place"
"836",3860239,3862708,"We can put you upon the settee in the
back room if you like.","10 Rillington Place"
"837",3862920,3864353,"Thanks, Auntie.","10 Rillington Place"
"838",3864559,3866152,"How's Beryl and the baby?","10 Rillington Place"
"839",3866360,3869909,"Oh, fine, fine.They've gone
to Brighton for a bit","10 Rillington Place"
"840",3870119,3872713,"to stay with Beryl's father.","10 Rillington Place"
"841",3879679,3882318,"I've just been upstairs.","10 Rillington Place"
"842",3882519,3885318,"He's gone.Tim?","10 Rillington Place"
"843",3885519,3887237,"Packed up and left.","10 Rillington Place"
"844",3887440,3891068,"His clothes and everything.Scarpered.","10 Rillington Place"
"845",3892320,3895311,"And that's not the worst part.","10 Rillington Place"
"846",3896000,3898639,"What's the matter, Reg?","10 Rillington Place"
"847",3899119,3901713,"You know whathe's gone and done?","10 Rillington Place"
"848",3901920,3904070,"What?","10 Rillington Place"
"849",3904719,3907757,"He's killed the baby.","10 Rillington Place"
"850",3909519,3911556,"I don't believe it.I'm telling you, strangled,","10 Rillington Place"
"851",3911760,3913954,"if you must know, with his tie.He'd never do that.","10 Rillington Place"
"852",3914159,3915956,"Never mindwhat he'd never do.
It's what he's done.","10 Rillington Place"
"853",3916159,3917309,"He worshippedthat child.","10 Rillington Place"
"854",3917519,3922594,"When I think of all the things...Reg, what are we going to do?","10 Rillington Place"
"855",3925519,3926793,"Nothing.","10 Rillington Place"
"856",3935480,3938152,"[THUDDING]","10 Rillington Place"
"857",3970599,3972750,"[DOG BARKING]","10 Rillington Place"
"858",3988840,3991307,"[GRUNTING]","10 Rillington Place"
"859",4034079,4038550,"Hey, see whatI bought Geraldine
in Cardiff.","10 Rillington Place"
"860",4038760,4040715,"Did you go into the garageabout the car?","10 Rillington Place"
"861",4040920,4045117,"Oh, yes, yes,they say it'll be a bit.
They'll let me know.","10 Rillington Place"
"862",4045320,4047197,"There.","10 Rillington Place"
"863",4047599,4051228,"Woolworths, I got it.Oh, it's lovely, Tim.","10 Rillington Place"
"864",4051880,4056112,"Tim, your uncleand I wrote a letter
to Mr. Thorley on Monday.","10 Rillington Place"
"865",4056320,4057719,"Thorley?","10 Rillington Place"
"866",4057920,4059911,"Beryl's father.","10 Rillington Place"
"867",4060119,4063748,"What do you want to write to him for?We got a telegram this morning.","10 Rillington Place"
"868",4063960,4067509,"He said he hasn't seen Beryland the baby since the summer.","10 Rillington Place"
"869",4067719,4069675,"What do you want to gopoking around for?","10 Rillington Place"
"870",4069880,4072313,"But where is she, Tim?What's happened?","10 Rillington Place"
"871",4072519,4074396,"I don't want to talk about it.","10 Rillington Place"
"872",4074599,4077478,"And none of your business anyhow!","10 Rillington Place"
"873",4077880,4079552,"She's...","10 Rillington Place"
"874",4079760,4082114,"She's gone off.Gone off?","10 Rillington Place"
"875",4082880,4085952,"With some fellow.I don't know, do I?","10 Rillington Place"
"876",4086159,4089596,"In a car.But what about little Geraldine?","10 Rillington Place"
"877",4089800,4092360,"Look, just stop askingquestions at me, will you?","10 Rillington Place"
"878",4092559,4094914,"Now, then, Tim...Don't you ""now, then"" me.","10 Rillington Place"
"879",4095119,4097838,"She's gone off with some rich fellow,and that's all there is about it.","10 Rillington Place"
"880",4098039,4099359,"Oh, Tim, we're only...Never mind that!","10 Rillington Place"
"881",4099560,4101073,"She's not thatsort of a girl, Tim.","10 Rillington Place"
"882",4101279,4104238,"Well, I'm going out.I'm bloody going out!","10 Rillington Place"
"883",4108640,4111837,"[TRAIN ENGINE CHUGGINGIN DISTANCE]","10 Rillington Place"
"884",4112039,4114679,"[TRAIN WHISTLE BLOWING]","10 Rillington Place"
"885",4145960,4148632,"Yeah, I thinkthat's the number.","10 Rillington Place"
"886",4150159,4151717,"Yeah, that's okay.There's the record card.","10 Rillington Place"
"887",4151920,4153319,"Ta.","10 Rillington Place"
"888",4158920,4160831,"I...","10 Rillington Place"
"889",4161039,4162268,"Yes, sir?","10 Rillington Place"
"890",4162479,4166472,"Is there an inspectoror sergeant or somebody here?","10 Rillington Place"
"891",4166680,4169194,"There's nobody availableat the moment, sir.","10 Rillington Place"
"892",4169399,4171755,"Can I help you?","10 Rillington Place"
"893",4172199,4176431,"I'd like to have a bitof a chat with you,
alone, like.","10 Rillington Place"
"894",4177800,4179118,"All right.","10 Rillington Place"
"895",4179319,4181515,"Excuse me, sir.","10 Rillington Place"
"896",4184760,4187114,"Well, now.","10 Rillington Place"
"897",4188279,4190918,"I want to give myself up.","10 Rillington Place"
"898",4191119,4193429,"I've disposed of my wife.","10 Rillington Place"
"899",4193640,4196073,"Now, wait a minute.Do you realize what you're saying?","10 Rillington Place"
"900",4196640,4198278,"Oh, I know what I'm saying.","10 Rillington Place"
"901",4198479,4202074,"I can't sleep for it.I want to get it off my chest.","10 Rillington Place"
"902",4203399,4205993,"She was expecting, see.","10 Rillington Place"
"903",4206199,4209192,"And we have one already.","10 Rillington Place"
"904",4209600,4211591,"Anyhow, I met this fellow in Ipswich.","10 Rillington Place"
"905",4211800,4215155,"He just come up to me in a caféand give me this bottle of stuff.","10 Rillington Place"
"906",4215359,4218796,"Well, I told her notto take it, but she said
she was going to anyhow.","10 Rillington Place"
"907",4219000,4222355,"So I come home from work,and there she is, dead.","10 Rillington Place"
"908",4222560,4225393,"She had the empty bottlebeside her.","10 Rillington Place"
"909",4225600,4228557,"And I didn't knowwhat to do, so I got...","10 Rillington Place"
"910",4228760,4232069,"I didn't know what to do,so at 2 in the morning,
I got her downstairs,","10 Rillington Place"
"911",4232279,4236557,"and I opened the drainoutside the front door,
and I put her body","10 Rillington Place"
"912",4236760,4239432,"down the drain.","10 Rillington Place"
"913",4241680,4244432,"And then I come down here.","10 Rillington Place"
"914",4244640,4246676,"Do you want to makea statement, in writing?","10 Rillington Place"
"915",4247880,4249949,"Uh...","10 Rillington Place"
"916",4250159,4253913,"Well, I'll tell you about it,and you write it down, eh?","10 Rillington Place"
"917",4254119,4257828,"I'm not all that educated.I can't do this reading and writing.","10 Rillington Place"
"918",4283640,4284868,"Well, yeah.","10 Rillington Place"
"919",4285079,4287469,"That's what he said.","10 Rillington Place"
"920",4287680,4290274,"He's a bit simple, you know.","10 Rillington Place"
"921",4290640,4295077,"Yeah, okay, I'll haveanother go at him.
Yeah, goodbye.","10 Rillington Place"
"922",4301920,4304194,"Well, now...","10 Rillington Place"
"923",4305079,4308833,"The drain where you saidyou put your wife's body,
it's been examined.","10 Rillington Place"
"924",4310439,4313000,"There's nothing there.","10 Rillington Place"
"925",4315920,4317751,"Well, I put it there.","10 Rillington Place"
"926",4319520,4321750,"I see.","10 Rillington Place"
"927",4321960,4324314,"It's a manhole, is it?","10 Rillington Place"
"928",4326079,4327957,"I expect so.","10 Rillington Place"
"929",4328159,4331072,"Who helped youlift the lid off?","10 Rillington Place"
"930",4331359,4333668,"I did it myself.","10 Rillington Place"
"931",4333880,4336519,"Who are you trying to kid?","10 Rillington Place"
"932",4336720,4339279,"It took three men to lift it.","10 Rillington Place"
"933",4339479,4341868,"Well, I don't knowabout that. I did it.","10 Rillington Place"
"934",4343399,4347279,"I don't think your wife's bodywas ever down that drain.","10 Rillington Place"
"935",4348920,4350716,"All right.","10 Rillington Place"
"936",4351479,4355314,"All right. I only said thatto protect a man named Christie.","10 Rillington Place"
"937",4355520,4357475,"Christie?Yes.","10 Rillington Place"
"938",4357680,4360637,"It's not trueabout the man in the café.","10 Rillington Place"
"939",4363199,4365315,"Now I'll tell you the truth.","10 Rillington Place"
"940",4368720,4373555,"She wasn't very goodwith money, I'm afraid.
Run up a lot of bad debts.","10 Rillington Place"
"941",4373760,4377354,"That was one of the reasonsthey were always fighting.","10 Rillington Place"
"942",4382399,4387109,"This was theirlittle domain.","10 Rillington Place"
"943",4387560,4391394,"What is it? Just the two rooms?Just the two rooms, yes.","10 Rillington Place"
"944",4394920,4399118,"You'd only have to ask the neighboursabout the fights they had, I'm afraid.","10 Rillington Place"
"945",4399319,4402278,"One of your chaps from thestation had to come round
one night, as a matter of fact.","10 Rillington Place"
"946",4402479,4404868,"You saw them go, did you?No.","10 Rillington Place"
"947",4405079,4407594,"No, they just crept off.","10 Rillington Place"
"948",4408479,4411949,"Who has the flat below this?Mr. Kitchener, an old gentleman.","10 Rillington Place"
"949",4412159,4413717,"Worked on the railways.","10 Rillington Place"
"950",4420479,4426077,"Inspector, you'd, uh...You'd want to look at his flat,
Mr. Kitchener's, I expect.","10 Rillington Place"
"951",4426279,4427507,"Oh, yes.Yes, well,","10 Rillington Place"
"952",4427720,4430792,"he's in hospital at the moment,so he'll not mind.","10 Rillington Place"
"953",4432079,4434514,"I just found these, sir.","10 Rillington Place"
"954",4436880,4439234,"They're all aboutthe torso murder case.","10 Rillington Place"
"955",4439439,4441953,"Oh, yes, a bit morbidabout that case, Tim was.","10 Rillington Place"
"956",4442159,4445037,"Kept all the newspaper cuttings.Cant think why.","10 Rillington Place"
"957",4445239,4446389,"I thought he couldn't read.","10 Rillington Place"
"958",4447039,4449634,"No. He used to get, uh,Beryl to read them to him.","10 Rillington Place"
"959",4449880,4450948,"Ah.","10 Rillington Place"
"960",4451159,4452479,"I'd better take a lookin here first.","10 Rillington Place"
"961",4452680,4456559,"I've just left the kettleon in the kitchen. I'll just...","10 Rillington Place"
"962",4461479,4464198,"Shoo! Go on,get out! Shoo!","10 Rillington Place"
"963",4465319,4467037,"[KICKING DIRT]","10 Rillington Place"
"964",4474479,4477313,"This is the back garden.","10 Rillington Place"
"965",4483159,4484672,"Cant seemto get this open.","10 Rillington Place"
"966",4484880,4488030,"It, uh, gets jammed occasionally.","10 Rillington Place"
"967",4488239,4489992,"Go and get the poker, Ethel.","10 Rillington Place"
"968",4518399,4520152,"There's a sort of bundleunder the sink here.","10 Rillington Place"
"969",4520359,4522920,"What's that, Mrs. Christie,under the sink? Do you know?","10 Rillington Place"
"970",4523119,4525350,"Well, take a look.It's a bundle of something.","10 Rillington Place"
"971",4525560,4527948,"Do you know what's in it?No.","10 Rillington Place"
"972",4528159,4530548,"It's a tablecloth or something.It's all wrapped up.","10 Rillington Place"
"973",4530760,4532989,"Is that yours?No, I don't think so.","10 Rillington Place"
"974",4533199,4536555,"Well, feel it.Feel if you recognize it.","10 Rillington Place"
"975",4538079,4542789,"No, I've never seen it before.Take it out. Let's have a look at it.","10 Rillington Place"
"976",4543000,4545115,"Weighs a ton.","10 Rillington Place"
"977",4545920,4548877,"[RUSTLING]","10 Rillington Place"
"978",4554920,4557479,"Better cut the cord,if you've no objection,
madam.","10 Rillington Place"
"979",4558319,4561710,"No, not at all.It isn't mine anyway.","10 Rillington Place"
"980",4568880,4572667,"SECOND CONSTABLE:There's another one here.
It's a baby.","10 Rillington Place"
"981",4577319,4579913,"Did they ask Mr. Christieif he could get the baby back","10 Rillington Place"
"982",4580119,4582759,"from the people in Acton,do you know?","10 Rillington Place"
"983",4586760,4589832,"Well, bloody hell,are you going to keep this up
all the way to London?","10 Rillington Place"
"984",4597399,4601597,"""At 11:50 a.m. Today,I found the dead body
of your wife, Beryl Evans,","10 Rillington Place"
"985",4601800,4605235,"concealed in a washhouseat 10 Rillington Place,
Notting Hill.","10 Rillington Place"
"986",4605439,4609149,"Also, the body of yourbaby daughter, Geraldine,
in the same outbuilding,","10 Rillington Place"
"987",4609359,4611395,"and this clothingwas found on them.","10 Rillington Place"
"988",4611600,4614159,"Later today, I was presentat Kensington mortuary","10 Rillington Place"
"989",4614359,4617556,"when it was establishedthat the cause of death
was strangulation","10 Rillington Place"
"990",4617760,4619398,"in both cases.","10 Rillington Place"
"991",4619600,4625037,"I have reason to believethat you were responsible
for their deaths.""","10 Rillington Place"
"992",4634479,4636515,"Yes.","10 Rillington Place"
"993",4644159,4645592,"Right, then.","10 Rillington Place"
"994",4645800,4649155,"""She was incurringone debt after another,","10 Rillington Place"
"995",4649359,4651715,"and I could notstand it any longer,","10 Rillington Place"
"996",4651920,4654592,"so I strangled herwith a piece of rope","10 Rillington Place"
"997",4654800,4657552,"and took her downto the flat below
the same night","10 Rillington Place"
"998",4657760,4660592,"whilst the old manwas in hospital.","10 Rillington Place"
"999",4660800,4664314,"I waited untilthe Christies downstairs
had gone to bed,","10 Rillington Place"
"1000",4664520,4667556,"then I took herto the washhouse
after midnight.","10 Rillington Place"
"1001",4667760,4671354,"Then I strangled my babyin our bedroom with my tie,","10 Rillington Place"
"1002",4671560,4674836,"and took herto the washhouse.""","10 Rillington Place"
"1003",4675239,4677548,"Sign there, lad.","10 Rillington Place"
"1004",4679319,4682835,"If you don't knowhow to write your name,
just put a cross.","10 Rillington Place"
