"id","startTime","endTime","text","title"
"736",2646059,2647811,"He says unlesswe stop planes","Airport"
"737",2647894,2650146,"from taking off over their houses by midnight,","Airport"
"738",2650231,2651815,"he's startinga damage suit,","Airport"
"739",2651898,2654693,"first thing in the morning,for $10 million.","Airport"
"740",2655737,2658322,"That's a nice, round figure,but he hasn't got a prayer.","Airport"
"741",2658405,2660574,"He might not win,but he can sue.","Airport"
"742",2660657,2662992,"And any legal action will only make our public relations","Airport"
"743",2663077,2664994,"worse thanthey already are.","Airport"
"744",2665079,2668706,"And that's something the othercommissioners and I don't want to risk.","Airport"
"745",2670293,2671835,"What do youpropose to do?","Airport"
"746",2671918,2672918,"There's only one answer.","Airport"
"747",2673003,2675880,"Shut down runway two-two andcut out the noise over Meadowood.","Airport"
"748",2676632,2679134,"With two-niner out,that closes down the airport completely.","Airport"
"749",2679217,2680385,"Only until morning.","Airport"
"750",2680469,2682679,"You've promised themdozens of times","Airport"
"751",2682764,2684681,"you wouldn't disturbtheir sleep.","Airport"
"752",2684766,2686724,"I promised them we wouldn't take off over their houses","Airport"
"753",2686809,2687976,"unless there was an emergency,","Airport"
"754",2688061,2690186,"and I promised themsomething else.","Airport"
"755",2690271,2693315,"In the foreseeable future,the noise problem would not get any better.","Airport"
"756",2694567,2696275,"lf you don't want to spend a couple of months in court,","Airport"
"757",2696360,2698778,"you'd better startconning them a little.","Airport"
"758",2698862,2700780,"You think lying to themis the answer, huh?","Airport"
"759",2700864,2702239,"Oh, Mel.","Airport"
"760",2702324,2704034,"There's your answer.","Airport"
"761",2704117,2706202,"A modern, expanded airport,","Airport"
"762",2706286,2707329,"big and efficient enough","Airport"
"763",2707413,2709831,"to take anything the designers can throw at us.","Airport"
"764",2709916,2713085,"That means buying up Meadowoodand rezoning it for industrial use","Airport"
"765",2713168,2714710,"so the noise won'tmake any difference.","Airport"
"766",2714795,2718130,"I didn't come here to talk about the future of aviation.","Airport"
"767",2718215,2719715,"You better start.","Airport"
"768",2719800,2721885,"And you better start looking ahead a few years.","Airport"
"769",2721969,2725597,"What are we gonna do about thesejumbos that seat 500 passengers?","Airport"
"770",2725681,2727974,"How will we get the people to and from the airport?","Airport"
"771",2728059,2729684,"Save that forthe women's clubs","Airport"
"772",2729768,2731061,"and the Rotary luncheons.","Airport"
"773",2731144,2732478,"We've got to be practical.","Airport"
"774",2732563,2734021,"Sure, sure. Ignore it.","Airport"
"775",2734106,2735731,"Don't stickyour neck out.","Airport"
"776",2735817,2737775,"It's about time that you and the other commissioners","Airport"
"777",2737860,2742239,"began fighting for a bond issueto finance this kind of an airport,","Airport"
"778",2742322,2744990,"instead of running aroundchecking to see if the toilets flush.","Airport"
"779",2745076,2747452,"I don't think insulting mewill solve anything","Airport"
"780",2747536,2749579,"so why don't we get backto our immediate problem?","Airport"
"781",2749664,2752039,"We've got to makea decision about tonight.","Airport"
"782",2752125,2753208,"I've made it.","Airport"
"783",2753291,2754333,"The airport's staying open.","Airport"
"784",2754418,2756753,"Stop being so bull-headed.Think of the consequences.","Airport"
"785",2756838,2759255,"Don't talk to meabout consequences.","Airport"
"786",2759340,2761800,"When Congress voted to cut airport appropriations","Airport"
"787",2761884,2764260,"you never even sentin a letter of protest.","Airport"
"788",2764344,2767012,"Where were you when the airlinesand the pilots and the rest of us","Airport"
"789",2767097,2770434,"were pleading for more airportsand better traffic control?","Airport"
"790",2770518,2773103,"You were picking out the colors in the ladies' lounge.","Airport"
"791",2773186,2776398,"So now you've got your consequences,congested air traffic","Airport"
"792",2776481,2779900,"where Sunday pilots hold up airlinerswith thousands of people aboard","Airport"
"793",2779985,2783737,"and force us to stack up planes boundfor New York as far away as Denver.","Airport"
"794",2783822,2786490,"When it comes to politics,you're a child.","Airport"
"795",2786576,2788617,"Two of our councilmenlive in Meadowood.","Airport"
"796",2788702,2790786,"Think what they cando to us downtown.","Airport"
"797",2790871,2793831,"I'm thinking of those pilots upstairs waiting to land,","Airport"
"798",2793916,2796835,"flying blind in that muck and circling in holding patterns","Airport"
"799",2797545,2799463,"and praying to God thatsome tired, overworked,","Airport"
"800",2799547,2801297,"underpaid controllerin the tower","Airport"
"801",2801382,2803507,"doesn't have another planeon the same course.","Airport"
"802",2803592,2806302,"You can call it pigheaded,call it anything you want.","Airport"
"803",2806387,2809722,"But as long as we're not below FAA minimums,we're not closing down.","Airport"
"804",2811224,2813476,"All right, if that'sthe way you want it.","Airport"
"805",2813561,2815936,"I'm calling the other commissioners and I'll let you know","Airport"
"806",2816021,2818356,"what our decisionis within an hour.","Airport"
"807",2818440,2819440,"That's your privilege.","Airport"
"808",2819525,2821693,"You hired me.You've got the right to fire me.","Airport"
"809",2821777,2824153,"But until you do,this airport is staying open.","Airport"
"810",2873246,2874871,"Do you wish tomake a reservation?","Airport"
"811",2874956,2876373,"No, I don't.","Airport"
"812",2876456,2879208,"Could you please tell me ifthere's a flight to Rome tonight?","Airport"
"813",2879293,2883713,"Yes. Our Golden Argosy,Flight Two. It departs at 10:00 p.m.","Airport"
"814",2883797,2886967,"Only tonight,it's delayed one hour due to weather conditions.","Airport"
"815",2888302,2891721,"It's very important to me to findout if somebody's on that flight.","Airport"
"816",2891806,2894099,"His name isD.O. Guerrero.","Airport"
"817",2894182,2897561,"I'm terribly sorry.We're not allowed to give out that information.","Airport"
"818",2897644,2899186,"You don't understand.","Airport"
"819",2899271,2900981,"The person I'm askingabout is my husband.","Airport"
"820",2901065,2903900,"Well, I'm sorry,but it's a company rule.","Airport"
"821",2903985,2906360,"You might goout to the airport,","Airport"
"822",2906445,2908905,"if you can get there before they board the flight,","Airport"
"823",2908989,2910574,"you could see your husband if he's there.","Airport"
"824",2910657,2912117,"I see.","Airport"
"825",2913286,2916413,"That's the only way,I suppose. Thank you.","Airport"
"826",2918416,2921001,"Thank you forcalling Trans Global.","Airport"
"827",2936474,2939059,"Why didn't youtell me this before?","Airport"
"828",2939144,2940353,"I tried.","Airport"
"829",2941021,2942856,"But we werein a hurry, and...","Airport"
"830",2943356,2944983,"You're sure?","Airport"
"831",2945067,2946900,"Do you mean am Isure I'm pregnant,","Airport"
"832",2946985,2949112,"or am I sureyou're the father?","Airport"
"833",2949195,2950614,"Come on, Gwen.I didn't...","Airport"
"834",2950697,2952574,"The answer to bothquestions is yes.","Airport"
"835",2952657,2953742,"You knowI wasn't asking...","Airport"
"836",2953826,2955201,"You havea perfect right to.","Airport"
"837",2955994,2958079,"I want you to knowsomething, Vern.","Airport"
"838",2959039,2961541,"That there hasn't beenanyone else but you.","Airport"
"839",2962585,2965128,"You see, there couldn't be.I happen to love you.","Airport"
"840",2968257,2969382,"I'm afraidI was careless.","Airport"
"841",2969467,2970967,"I stoppedtaking the pills","Airport"
"842",2971052,2972885,"because they weremaking me gain weight.","Airport"
"843",2973596,2975929,"So instead of beingplump, I'm pregnant.","Airport"
"844",2977974,2980393,"Stop twistingyour wedding ring.","Airport"
"845",2980478,2982394,"I knowyou've got a wife.","Airport"
"846",2982480,2984688,"I knowyou can't marry me.","Airport"
"847",2984773,2986900,"I knew itin the beginning.","Airport"
"848",2988402,2990820,"I won't make thingsdifficult for you.","Airport"
"849",2990905,2992197,"I'll work it out myself.","Airport"
"850",2992280,2993530,"Don't be ridiculous.","Airport"
"851",2993615,2996409,"You don't think I'd walk out and ignore the whole thing?","Airport"
"852",2996911,2998619,"I'll take care of you.","Airport"
"853",2998704,3000579,"I'll make sure you don'tgo to some butcher","Airport"
"854",3000664,3002498,"two flights upover a drugstore.","Airport"
"855",3003083,3005335,"I hear Sweden'sthe best place.","Airport"
"856",3005418,3008588,"Good doctors, good hospitals,medically safe.","Airport"
"857",3009297,3011507,"It's very quick,very simple.","Airport"
"858",3011592,3014010,"One minute you have it,next minute you don't.","Airport"
"859",3014552,3016637,"There's no dangerof complications.","Airport"
"860",3016722,3018597,"That is,no physical complications.","Airport"
"861",3019934,3022351,"I'm not so sureabout the moral ones.","Airport"
"862",3023144,3025355,"You have religious scruples?","Airport"
"863",3025773,3027356,"No. No.","Airport"
"864",3029360,3030985,"But the strangest thinghappened to me today,","Airport"
"865",3031070,3032612,"when the doctor told me.","Airport"
"866",3033114,3036157,"I mean,I've known other girls in the same situation...","Airport"
"867",3036242,3040452,"toss it off with bad jokes like,""I've got a bun in the oven,""","Airport"
"868",3040538,3042831,"or, ""Captain,we've got an extra passenger on board.""","Airport"
"869",3043623,3045875,"I knew I'd reactthe same way.","Airport"
"870",3046501,3048836,"Very modern,very sophisticated.","Airport"
"871",3051798,3053675,"But I certainly didn't.","Airport"
"872",3055010,3058847,"I was suddenly filled with a sense of wonder and awe.","Airport"
"873",3059889,3062391,"I don't want to soundmystical or anything","Airport"
"874",3062476,3065978,"but I am carryingsomeone who's part of us.","Airport"
"875",3067565,3069606,"I'm not so sureI want to lose it.","Airport"
"876",3071735,3074070,"And if you havethe baby, then what?","Airport"
"877",3076949,3079909,"Well, I suppose adoptionwould be the answer.","Airport"
"878",3081369,3082996,"They're verycareful nowadays.","Airport"
"879",3083496,3085164,"They findthe right family.","Airport"
"880",3085248,3089085,"They're very careful,all the arrangements are made beforehand.","Airport"
"881",3089170,3092005,"And the records arekept secret, you know.","Airport"
"882",3093007,3094840,"And you'll neversee the baby.","Airport"
"883",3102432,3104184,"I suppose in timeI'll be sensible,","Airport"
"884",3104268,3106769,"but I've gottahave time to think.","Airport"
"885",3113860,3116612,"Vern, thank you for caring.","Airport"
"886",3118364,3121326,"Most men would have said,""So long, girl. Tough luck.""","Airport"
"887",3122244,3123702,"Not this one.","Airport"
"888",3132545,3134922,"You know,I think you really do love me a little.","Airport"
"889",3137050,3141262,"It makes it harder to decide,but easier to bear.","Airport"
"890",3150396,3153065,"- Something wrong?- The air vent was stuck.","Airport"
"891",3153150,3154943,"The captain fixed it.","Airport"
"892",3166956,3168581,"Full throttle.","Airport"
"893",3178050,3179425,"All the way.","Airport"
"894",3196277,3197735,"You chickened out on me.","Airport"
"895",3197820,3199528,"I told you I wantedall the power you got.","Airport"
"896",3199612,3201822,"Full throttle and this planewould be standing on its nose.","Airport"
"897",3201907,3203282,"You may flythese things,","Airport"
"898",3203367,3205326,"but I take them apartand put them together.","Airport"
"899",3205411,3207536,"lf you had any guts,we'd be on the runway by now.","Airport"
"900",3207621,3208788,"You felt it vibrating?","Airport"
"901",3208873,3211291,"Another ten seconds and we'dhave had structural damage.","Airport"
"902",3211375,3212958,"Who do you thinkyou're talking to,","Airport"
"903",3213043,3214835,"some kid thatfixes bicycles?","Airport"
"904",3214920,3216838,"I know everyinch of the 707.","Airport"
"905",3216922,3219548,"Take the wings off this and you could use it as a tank.","Airport"
"906",3219632,3221550,"This plane is builtto withstand anything,","Airport"
"907",3221635,3223552,"except a bad pilot.","Airport"
"908",3223637,3226681,"All right, hold it.This kind of talk will get us nowhere.","Airport"
"909",3226764,3228224,"You might tellyour mechanic","Airport"
"910",3228309,3230101,"I've got three millionmiles in the air.","Airport"
"911",3230184,3231811,"And two and a halffeet in the ground.","Airport"
"912",3231896,3233896,"Let's stop wasting time.","Airport"
"913",3233981,3235398,"What do we do now?","Airport"
"914",3235481,3237233,"Now we gotta diga lot deeper,","Airport"
"915",3237318,3238400,"put lumberunder the wheels.","Airport"
"916",3238485,3241570,"But the next time we try,since he's afraid, I'll drive it out.","Airport"
"917",3241655,3243072,"I'm not turning thisship over to anybody","Airport"
"918",3243157,3245240,"without authorizationfrom our chief pilot.","Airport"
"919",3245326,3247327,"I phoned Kettering,but there's no answer.","Airport"
"920",3247411,3249036,"I guess we just sithere till you get him.","Airport"
"921",3249121,3250954,"No, we don't,we haven't got time.","Airport"
"922",3251039,3252748,"You're not in the air,you're on the ground.","Airport"
"923",3252833,3255083,"My ground.And you're blocking my primary runway.","Airport"
"924",3255168,3257878,"I'm not using full power.It's too risky.","Airport"
"925",3257963,3259422,"Then I'll make the decision.","Airport"
"926",3259505,3261590,"I'll take the responsibilityfor the aircraft.","Airport"
"927",3261675,3264010,"Mr. Patroni is licensed to taxi.He'll take over.","Airport"
"928",3281070,3284655,"lf he tears this ship apart,I hope you've got $8 million to pay for it.","Airport"
"929",3290036,3293664,"Joe, my neck'sout about 14 feet.","Airport"
"930",3294123,3295541,"You sure it'll work?","Airport"
"931",3295626,3296960,"Let's put it this way.","Airport"
"932",3297043,3299461,"You promised me a box ofcigars if I pulled this off, right?","Airport"
"933",3299545,3301922,"What are you standing here for?Go get them.","Airport"
"934",3307887,3311431,"The bus from downtown terminal is just coming in.","Airport"
"935",3311516,3313141,"Your attention, please.","Airport"
"936",3313226,3316813,"Trans Global Airlines, the Golden Argosy,Flight Two, non-stop to Rome","Airport"
"937",3316896,3318981,"is now ready for boarding.","Airport"
"938",3319065,3320983,"AII passengers holding confirmed reservations","Airport"
"939",3321068,3324737,"please proceed to Gate 33on Concourse D.","Airport"
"940",3334706,3335789,"Rome.","Airport"
"941",3338085,3342505,"The Colosseum, the Sistine Chapel.The Catacombs.","Airport"
"942",3344090,3348385,"My dear late husband and Ialways planned to visit there.","Airport"
"943",3348469,3350972,"""See Rome and die,""he always said.","Airport"
"944",3352266,3355018,"But he died just whenwe were packing.","Airport"
"945",3355768,3357769,"Gee. That's too bad.Yes.","Airport"
"946",3358396,3360565,"So near and yet so far.","Airport"
"947",3370451,3371784,"What's wrong?","Airport"
"948",3372286,3374119,"Oh, dear. Oh, dear.","Airport"
"949",3374204,3375871,"What is it?I'm sorry.","Airport"
"950",3375956,3378041,"I'm afraid I'm havingone of my spells.","Airport"
"951",3378125,3380293,"I'll get help.I'll call for a doctor.","Airport"
"952",3380376,3381918,"I'll be all right.","Airport"
"953",3382003,3386007,"I've had these foryears. It'll pass.","Airport"
"954",3386090,3389552,"Oh, dear.lf I could just lie down for a little while.","Airport"
"955",3390262,3395307,"I saw a cot in the ladies' room a little while ago.","Airport"
"956",3396268,3398853,"I'll help you.Come on. Take it easy.","Airport"
"957",3402148,3403273,"Sure you're gonnabe all right?","Airport"
"958",3403358,3405193,"Sit down along theway if you're not.","Airport"
"959",3405277,3408320,"...Flight 45 from Pittsburgh","Airport"
"960",3408405,3413409,"are notified that the flight has beencanceled due to weather conditions.","Airport"
"961",3414536,3416454,"You'll be all right.We'll be there in a second.","Airport"
"962",3416538,3418581,"I'm much better.Much better.","Airport"
"963",3418664,3420416,"Are you sure you don't want me to call the doctor?","Airport"
"964",3420501,3423920,"No. I've been enough trouble already.But don't go away.","Airport"
"965",3424003,3426672,"You will stay right here like you did before,won't you?","Airport"
"966",3426757,3429092,"Certainly.I'll stay right here.","Airport"
"967",3435056,3437349,"Perhaps you're right.You'd better get a doctor.","Airport"
"968",3437434,3439018,"Of course.Right away.","Airport"
"969",3439103,3442771,"But don't worry.I'll be all right.","Airport"
"970",3442856,3445023,"There's an attendant in there,and she'll take care of you.","Airport"
"971",3445108,3446858,"I won't be a minute.","Airport"
"972",3447860,3449195,"Thank you.","Airport"
"973",3476347,3478349,"That is E-R-O.","Airport"
"974",3479016,3481726,"And what amount policy were you considering,Mr. Guerrero?","Airport"
"975",3481811,3484480,"$150,000.","Airport"
"976",3484565,3486773,"That'll be $5.Yes. I know.","Airport"
"977",3486858,3490735,"But for $2.50 more,you could take out $225,000.","Airport"
"978",3490820,3493239,"It isn't much for all that protection.No.","Airport"
"979",3493322,3495949,"I don't know if I have that much left.American money.","Airport"
"980",3496034,3497742,"I exchangedall my dollars to lira.","Airport"
"981",3497827,3499536,"We accept foreign currency.","Airport"
"982",3499621,3502414,"Well, I've gotthat all in big bills.","Airport"
"983",3502498,3504833,"Or we'll take a personalcheck if you like.","Airport"
"984",3504918,3509297,"No. When I go to Europe,I always leave my checkbook at home.","Airport"
"985",3509380,3512048,"You know, it's too muchof a temptation.","Airport"
"986",3512134,3514552,"Wait a minute.I may have enough.","Airport"
"987",3515179,3516846,"I didn't meanto push you,","Airport"
"988",3516929,3518431,"but we're havinga sales contest","Airport"
"989",3518514,3520182,"and I've gota chance for the prize.","Airport"
"990",3520266,3521766,"Every little bit helps.Yeah.","Airport"
"991",3521851,3523643,"Could you hurrythat up, please?","Airport"
"992",3523728,3525478,"They've alreadycalled my flight.","Airport"
"993",3525563,3528190,"It's just the first call.You still have time.","Airport"
"994",3528275,3530985,"Delta Airlines, Flight 299...","Airport"
"995",3537242,3539784,"But I distinctly askedfor the fourth row.","Airport"
"996",3541996,3544539,"I'm terribly sorry, but thisis the best we can do.","Airport"
"997",3544625,3546333,"Give it to me.","Airport"
"998",3548503,3550922,"Did you say this is some kind of exchange program?","Airport"
"999",3551005,3554050,"Yes. You see,the Italian girl will be living with my folks","Airport"
"1000",3554134,3555550,"and I'll be livingwith them.","Airport"
"1001",3555635,3557637,"That should bequite an experience.","Airport"
"1002",3574987,3577239,"I'm sorry.Could you hurry, please?","Airport"
"1003",3577324,3578907,"There's the terminal, lady.","Airport"
"1004",3578992,3580242,"Over there.","Airport"
"1005",3580327,3582577,"Just be a couplemore minutes now.","Airport"
"1006",3583829,3586289,"Now, how about letting mebuy you a cup of coffee?","Airport"
"1007",3586375,3588333,"Good. Mr. Bakersfeld'sin there having dinner.","Airport"
"1008",3588418,3589835,"We can join him.","Airport"
"1009",3589961,3592255,"Let me check the counter first.Right.","Airport"
"1010",3592338,3594090,"Here you are, sir.Seat 23-A.","Airport"
"1011",3594173,3595840,"Have a good flight.Thank you.","Airport"
"1012",3599596,3601764,"Just two no-showsin first class, huh?","Airport"
"1013",3601847,3604684,"They're on their way.They've been waiting in the Commander's Club.","Airport"
"1014",3607396,3610898,"No. I'm just a visitor.I work downstairs.","Airport"
"1015",3612025,3613192,"Sorry.","Airport"
"1016",3621117,3622284,"Ready?","Airport"
"1017",3622869,3626163,"Say, did you see that man withthe attach case just now?","Airport"
"1018",3626248,3627373,"No.","Airport"
"1019",3630043,3632210,"lf he was coming in from abroad instead of going out,","Airport"
"1020",3632295,3634005,"I'd want to inspect it.","Airport"
"1021",3634422,3635715,"You think he's smuggling?","Airport"
"1022",3635798,3638884,"It was the way he held the case,the look in his eye.","Airport"
"1023",3638969,3641052,"He tried to handme his ticket.","Airport"
"1024",3653442,3655192,"Thank you.Sorry about the delay.","Airport"
"1025",3655277,3657320,"It's all right.Excuse me, young man.","Airport"
"1026",3657403,3660655,"My son dropped his wallet.All his money's in it. He went on board.","Airport"
"1027",3660740,3663159,"Blonde hair, no hat,camel hair coat. I wonder...","Airport"
"1028",3663242,3664994,"I'm not allowed to accept a wallet with money.","Airport"
"1029",3665077,3666619,"See the stewardessabout it, please.","Airport"
"1030",3666704,3667704,"Oh.","Airport"
"1031",3716713,3719130,"But you seeif someone is smuggling","Airport"
"1032",3719215,3721592,"they usually start to get nervous when they land,","Airport"
"1033",3721675,3723094,"not before they take off.","Airport"
"1034",3723177,3724804,"This guy wasreally shaken.","Airport"
"1035",3724887,3726639,"lf it is contrabandand he's a trembler,","Airport"
"1036",3726722,3728724,"Italian customswill nail him.","Airport"
"1037",3728809,3731018,"Besides, there's not much wecan do about it at this end.","Airport"
"1038",3731103,3733813,"I don't know.I think somebody ought to.","Airport"
"1039",3734731,3736356,"Maybe you oughtto tell your boss.","Airport"
"1040",3736440,3739318,"Just in case he might want to notify the captain.","Airport"
"1041",3739402,3742320,"I guess you're right.I'll be right back.","Airport"
"1042",3748161,3750913,"International Flight 49 for Dallas","Airport"
"1043",3750996,3754541,"now boarding at Gate 19,the Red Concourse.","Airport"
"1044",3755001,3757710,"AII passengers holdingconfirmed reservations","Airport"
"1045",3757795,3762090,"please proceed to Gate 19,the Red Concourse.","Airport"
"1046",3803215,3804425,"23-B?","Airport"
"1047",3804509,3805592,"Yes.","Airport"
"1048",3825739,3827322,"What are you doing here?","Airport"
"1049",3827407,3828657,"She got away.","Airport"
"1050",3828742,3830326,"She what?","Airport"
"1051",3830409,3831952,"Well, what she did was...","Airport"
"1052",3832036,3833621,"I don't carehow she got away.","Airport"
"1053",3833704,3836498,"Get on that phone and call every airline and every gate.","Airport"
"1054",3836583,3838708,"I'll see if Securitycan round her up.","Airport"
"1055",3843255,3844882,"Forward jet way'sstill in place.","Airport"
"1056",3845425,3847092,"It's your decision, Captain.","Airport"
"1057",3848094,3849719,"Make some noise.","Airport"
"1058",3861525,3862525,"Miss Meighen?","Airport"
"1059",3863485,3864693,"Yes, Captain?","Airport"
"1060",3865277,3866695,"What's the delay?","Airport"
"1061",3866780,3868697,"The tourist headcount won't tally.","Airport"
"1062",3868782,3870615,"Where's the ramp supervisor?","Airport"
"1063",3870699,3872784,"He's back there, counting.Get him.","Airport"
"1064",3880168,3881668,"The plane to Rome,is it gone?","Airport"
"1065",3881753,3883128,"No. But you'll have to hurry.Which way?","Airport"
"1066",3883213,3884838,"Go to the waiting roomand turn right.","Airport"
"1067",3884922,3886340,"Green concourse, Gate 33.","Airport"
"1068",3886423,3888007,"Thank you.","Airport"
"1069",3889635,3891554,"Look, I know you got problems,and so have we,","Airport"
"1070",3891637,3893054,"but how longwe gonna sit here?","Airport"
"1071",3893139,3896016,"I've ordered a ticket recheck.We should have 81 in tourist.","Airport"
"1072",3896101,3897101,"It seems we've got 82.","Airport"
"1073",3897184,3900061,"Every second we sit here,we're burning fuel on three and four","Airport"
"1074",3900146,3901563,"which you gavethe okay to start.","Airport"
"1075",3901648,3903231,"Precious fuel we'llneed in the air tonight.","Airport"
"1076",3903315,3904400,"I know...","Airport"
"1077",3904483,3905858,"Unless this plane leaves now,","Airport"
"1078",3905943,3909237,"I'm gonna shut down and we'll sendfor fuelling to top off our tanks.","Airport"
"1079",3909322,3910489,"So you make up your mind.","Airport"
"1080",3910574,3912490,"It'll only take anotherfew minutes or so.","Airport"
"1081",3912576,3913826,"And I'll tell yousomething else.","Airport"
"1082",3913909,3916036,"The tower just told usthey have a temporary gap,","Airport"
"1083",3916121,3918914,"so if we taxi out right away,we can take off fast.","Airport"
"1084",3918998,3921416,"But five minutes from nowmay mean a half-hour delay.","Airport"
"1085",3921501,3923793,"So you take the responsibility.What do we do?","Airport"
"1086",3925880,3929132,"Cancel the ticket recheck.Okay. You're leaving now.","Airport"
"1087",3932721,3934972,"Continental Airlines Flight 41","Airport"
"1088",3935056,3938182,"for Los Angeles nowboarding at Gate 26.","Airport"
"1089",3939184,3941686,"May I see yourticket, please?","Airport"
"1090",3945233,3946858,"Thank you.","Airport"
"1091",3947235,3950820,"Ruth. Cancel the ticket check.We're leaving.","Airport"
"1092",3952197,3953532,"Fine.","Airport"
"1093",3960789,3963000,"Commander, start two.","Airport"
"1094",3965253,3966670,"Turning two.","Airport"
"1095",3973010,3974719,"Okay to start one?","Airport"
"1096",3989568,3993280,"Braniff International Flight252 from Houston","Airport"
