"id","startTime","endTime","text","title"
"330",1394359,1396486,"What did they die of, the three?","Contagion"
"331",1396661,1399255,"Reports are vague. Seizures, comas.","Contagion"
"332",1399431,1403026,"We've reached out to the WHO,see what they know.","Contagion"
"333",1403201,1405795,"If you were gonna plan it,can't think of a better time.","Contagion"
"334",1405971,1408303,"- Plan what?- An attack.","Contagion"
"335",1411710,1414645,"Is there any waysomeone could weaponize the bird flu?","Contagion"
"336",1414813,1417680,"Someone doesn't have to weaponizethe bird flu.","Contagion"
"337",1417849,1419908,"The birds are doing that.","Contagion"
"338",1420085,1423145,"NEWSCASTER: Officials are reportingthe closing of Mondale Elementary School...","Contagion"
"339",1423321,1424845,"...in suburban Minneapolis...","Contagion"
"340",1425023,1428083,"...in response to the recent outbreakof a still-unknown disease...","Contagion"
"341",1428260,1432196,"...that has so far taken the lifeof a school nurse and three students.","Contagion"
"342",1432364,1434855,"Other schools in District 281will remain open...","Contagion"
"343",1435033,1439129,"...but parents have been notifiedto keep home any children with symptoms.","Contagion"
"344",1439304,1441704,"The Department of Healthis awaiting confirmation...","Contagion"
"345",1441873,1445309,"...but sources say these new casesmay be connected to the sudden death...","Contagion"
"346",1445477,1448071,"...of a 34-year-oldAIMM Alderson executive...","Contagion"
"347",1448246,1450976,"...and her 6-year-old sonthis holiday weekend.","Contagion"
"348",1452050,1454678,"Hello. I'm Dr. Mears.","Contagion"
"349",1454853,1457117,"I'm an Epidemic Intelligence Serviceofficer...","Contagion"
"350",1457289,1462659,"...and I'm here from Atlanta to find outwhat happened to Beth Emhoff.","Contagion"
"351",1462828,1465456,"Okay, I'm gonna ask you some questionsand see if...","Contagion"
"352",1465630,1467962,"There was a package she messengeredfrom Hong Kong.","Contagion"
"353",1468133,1472035,"- I opened it with scissors. I'm not sure if...- No. It shouldn't be an issue.","Contagion"
"354",1472204,1474035,"Virus can't live for days on a box.","Contagion"
"355",1474206,1475696,"We did Pilates together.","Contagion"
"356",1475874,1478638,"I called her after she got back.I never heard from her.","Contagion"
"357",1478810,1481005,"- So you had no contact with her?- No.","Contagion"
"358",1481179,1484615,"- Did she go to the class?- I didn't see her there.","Contagion"
"359",1484783,1486808,"We had coffee the day she left.","Contagion"
"360",1486985,1490978,"I think she might have moved my cupbecause it was on some papers.","Contagion"
"361",1491156,1494284,"- I can't remember.- How many days ago?","Contagion"
"362",1494459,1496723,"About 10 days.","Contagion"
"363",1496895,1501855,"That's okay.The incubation period is less than that.","Contagion"
"364",1502033,1504729,"Is there anyone elsewho might have had contact with her?","Contagion"
"365",1504903,1507463,"- This was everyone.MAN 1: Aaron Barnes did.","Contagion"
"366",1507973,1509600,"MAN 2:Barnes? He worked on another floor.","Contagion"
"367",1509774,1512709,"MAN 1: There were documents she needed.He picked her up from the airport.","Contagion"
"368",1512878,1513902,"[CELL PHONE RINGING]","Contagion"
"369",1514079,1516741,"MEARS: He picked her up from the airport?Where is he?","Contagion"
"370",1516915,1517939,"Hello?","Contagion"
"371",1518116,1520983,"- Hello? Mr. Barnes?BARNES: Hello? Yes.","Contagion"
"372",1521152,1524588,"This is Dr. Mearsfrom the Centers for Disease Control.","Contagion"
"373",1524756,1525780,"- I believe...- Hi.","Contagion"
"374",1525957,1529984,"Hi. I believe you may have had contactwith Beth Emhoff last week.","Contagion"
"375",1530161,1532527,"Yeah, I picked her up at the airport.What's this about?","Contagion"
"376",1532697,1533721,"[BARNES COUGHS]","Contagion"
"377",1533899,1536959,"- And how are you feeling today?- Uh, pretty cruddy, to be honest.","Contagion"
"378",1537135,1539467,"My head is pounding.I probably picked up some bug.","Contagion"
"379",1539638,1542869,"- Where are you right now?- I'm on the bus, heading to work.","Contagion"
"380",1543041,1545066,"- I'd like you to get off immediately.- What?","Contagion"
"381",1545243,1546904,"- He's on a bus.DAVE: Where?","Contagion"
"382",1547078,1551014,"- Where? Where's the bus, Aaron?- Um... Uh...","Contagion"
"383",1551182,1553673,"- Lake and Lyndale. What's going on?- Lake and Lyndale.","Contagion"
"384",1553852,1555649,"I really need you to get off that bus.","Contagion"
"385",1555820,1558880,"It's possible you've come in contactwith an infectious disease...","Contagion"
"386",1559057,1561491,"...and you're highly contagious.Do you understand?","Contagion"
"387",1561660,1564561,"I want you to get off now.And stay away from other people.","Contagion"
"388",1564729,1565753,"Now what do I do?","Contagion"
"389",1565931,1568331,"Don't talk to anyone, don't touch anyone.","Contagion"
"390",1568500,1570400,"That's the most important thing.","Contagion"
"391",1570569,1573561,"- We'll send somebody to meet the bus.- Okay.","Contagion"
"392",1573738,1576206,"I'm on my way to you now, Aaron.","Contagion"
"393",1576374,1578274,"[COUGHING]","Contagion"
"394",1579811,1583611,"What about my kids? I touched them.","Contagion"
"395",1616848,1620807,"It was a groundbreaking ceremonyfor a new factory.","Contagion"
"396",1620986,1623887,"She traveled a lot for work.","Contagion"
"397",1624055,1626615,"Did her work involve contact with livestockin any way?","Contagion"
"398",1626791,1629555,"- Did you keep any pets at home?- No.","Contagion"
"399",1630795,1632228,"No.","Contagion"
"400",1633431,1636332,"Did she mention seeing anyonewho was sick?","Contagion"
"401",1636868,1639166,"Anyone on a plane?","Contagion"
"402",1640372,1641805,"No.","Contagion"
"403",1642374,1647209,"She went through customs in Chicagoat 11:15 a. M...","Contagion"
"404",1647379,1651406,"...and then took a flight to Minneapolisat 6 p.m.","Contagion"
"405",1651583,1654279,"Any idea what she did in Chicagoduring that layover?","Contagion"
"406",1654452,1655476,"Did she have meetings?","Contagion"
"407",1655654,1660751,"Is there any reasonshe might have left the airport?","Contagion"
"408",1662927,1667364,"Why? I mean, is theresomeone sick in Chicago?","Contagion"
"409",1673805,1677639,"Uh, before we were married,my wife had a relationship...","Contagion"
"410",1677809,1680744,"...with a man in Chicago named Jon Neal.","Contagion"
"411",1685750,1687843,"Is Jon Neal sick?","Contagion"
"412",1688019,1690112,"Did we get this from him?","Contagion"
"413",1691923,1695620,"- We're investigating all the possibilities.- No. I think I have a right to know.","Contagion"
"414",1695794,1698456,"Look at where I am here.Look at where I am here.","Contagion"
"415",1698630,1702964,"- I can't disclose that information. I'm sorry.- No, I'm just... I'm just trying to understand.","Contagion"
"416",1703134,1704226,"I know.","Contagion"
"417",1704402,1706393,"HEXTALL:We're getting the same results as Sussman.","Contagion"
"418",1706571,1708903,"We've sequenced the virus,determined its origin...","Contagion"
"419",1709074,1712532,"...and we've modeled the wayit enters the cells of the lung and the brain.","Contagion"
"420",1712711,1714941,"The virus containsboth bat and pig sequences.","Contagion"
"421",1715113,1717911,"The dark green is pig,and the light green is bat.","Contagion"
"422",1718083,1720108,"And here you can seethe crossover event.","Contagion"
"423",1720285,1723777,"Uh, bat, bat, and pig, bat.","Contagion"
"424",1723955,1727755,"And here is a model of the virusand how it attaches to its host.","Contagion"
"425",1727926,1732920,"The blue is virus, and the gold is human,and the red is the viral attachment protein...","Contagion"
"426",1733098,1735692,"...and the green is its receptorin the human cells.","Contagion"
"427",1735867,1739769,"These receptors are found in the cellsof both the respiratory tract...","Contagion"
"428",1739938,1741530,"...and the central nervous system.","Contagion"
"429",1741706,1747508,"And the virus attaches to the celllike a key slipping into a lock.","Contagion"
"430",1747679,1750978,"Somewhere in the world,the wrong pig met up with the wrong bat.","Contagion"
"431",1751149,1755552,"- You ever seen anything like this before?- No. And it's still changing.","Contagion"
"432",1755720,1758245,"It's figuring us outfaster than we're figuring it out.","Contagion"
"433",1758423,1760653,"It doesn't have anything else to do.","Contagion"
"434",1760825,1763794,"So we have a novel viruswith a mortality rate in the low 20s...","Contagion"
"435",1763962,1766692,"...no treatment protocol,and no vaccine at this time.","Contagion"
"436",1766865,1768560,"That is correct.","Contagion"
"437",1768733,1770462,"[CHEEVER SIGHS]","Contagion"
"438",1771336,1775329,"From here on out, I want no one workingon this except at BSL-4.","Contagion"
"439",1775507,1780103,"Last thing we need is for this to walk out ofthe lab on the bottom of someone's shoe.","Contagion"
"440",1781579,1784412,"[CELL PHONE RINGING]","Contagion"
"441",1792323,1794348,"Dr. Sussman's office.","Contagion"
"442",1794526,1796721,"HEXTALL:Lan, hi. Ally Hextall.","Contagion"
"443",1796895,1800353,"We need to shut you down.This thing's too hot. Uh...","Contagion"
"444",1800532,1804525,"- BSL-4 only at this point.- I think that's a mistake.","Contagion"
"445",1805937,1808565,"Cook your samples.Uh, destroy everything.","Contagion"
"446",1809040,1811907,"- We can't risk it.- We're making progress.","Contagion"
"447",1812076,1815910,"You limit this to government-run BSL-4s,it'll take forever.","Contagion"
"448",1816080,1817604,"I can do this.","Contagion"
"449",1818383,1820010,"I'm sorry.","Contagion"
"450",1821486,1822510,"[SIGHS]","Contagion"
"451",1822687,1824177,"Yeah.","Contagion"
"452",1824355,1825879,"Sure, Ally.","Contagion"
"453",1832163,1834324,"REPORTER 1 [ON TV]:Can you repeat the affected cities so far?","Contagion"
"454",1834499,1836126,"CHEEVER:Again, the affected cities are...","Contagion"
"455",1836301,1841295,"...Minneapolis, Chicago, Los Angeles,Boston and Salt Lake.","Contagion"
"456",1841472,1844202,"We expect that list to grow...","Contagion"
"457",1844375,1846673,"...as people return homefrom their holidays.","Contagion"
"458",1846845,1848107,"Yes?","Contagion"
"459",1848279,1850747,"REPORTER 2: Dr. Cheever,how many people are infected...","Contagion"
"460",1850915,1852109,"...and how many have died?","Contagion"
"461",1852283,1854945,"CHEEVER:Those numbers are changing as we speak...","Contagion"
"462",1855119,1857587,"...so any figure I give youis likely to be low.","Contagion"
"463",1857755,1860315,"We're still calculating the mortality rateat this time.","Contagion"
"464",1860959,1863120,"REPORTER 3:Uh, Dr. Cheever, are you concerned...","Contagion"
"465",1863294,1865592,"...that the CDC facesa credibility issue here...","Contagion"
"466",1865763,1868630,"...after the perceived overreactionto H1 N1?","Contagion"
"467",1868800,1870961,"I'd rather the story bethat we overreacted...","Contagion"
"468",1871135,1874366,"...than that many people lost their livesbecause we didn't do enough.","Contagion"
"469",1874539,1875733,"That's why we're here.","Contagion"
"470",1875907,1881004,"It's also why the World Health Organizationis sending an epidemiologist to Hong Kong.","Contagion"
"471",1881179,1883579,"Hard to know what it iswithout where it came from.","Contagion"
"472",1883748,1886876,"Our first job with these thingsis to find ground zero.","Contagion"
"473",1887051,1889485,"Figure out how it jumpedinto the population.","Contagion"
"474",1889654,1892885,"We do know that a patient in Minnesota...","Contagion"
"475",1893057,1895025,"...traveled to that part of the world.","Contagion"
"476",1904269,1906737,"[INAUDIBLE DIALOGUE]","Contagion"
"477",1964762,1969563,"We believe that there areapproximately 89,000 cases at this point...","Contagion"
"478",1970101,1974162,"...and that we are headingtoward 267,000.","Contagion"
"479",1974939,1980309,"And from there, using our model,based on an R-nought of two...","Contagion"
"480",1980478,1983606,"...here is where we expect to bein 48 hours.","Contagion"
"481",1983781,1987217,"Dr. Cheever, perhaps you can update uson the research.","Contagion"
"482",1987819,1991482,"As of right now, no one has founda good way to grow the virus in cells.","Contagion"
"483",1991656,1993283,"ORANTES [OVER MONITOR]:Why is that?","Contagion"
"484",1993458,1997519,"Because it kills every cell we put it in.A pig, a chicken, everything.","Contagion"
"485",1997695,2001256,"Until we can grow it, and a great deal of it,we can't experiment with it.","Contagion"
"486",2001432,2003559,"And until then,we can't vaccinate against it.","Contagion"
"487",2003735,2009139,"Have you found any treatment at all?Any antivirus? Anything?","Contagion"
"488",2009640,2011164,"No.","Contagion"
"489",2012810,2016610,"ORANTES: Beth Emhoff used an ATMat a casino in Macao.","Contagion"
"490",2016781,2018749,"Citibank released her records.","Contagion"
"491",2018916,2024513,"We have her using the machine at 10:43just off the casino floor.","Contagion"
"492",2024689,2029353,"I wanna see the casino security footagefor two hours on either side of that.","Contagion"
"493",2029527,2030755,"[BOTH SPEAKING IN CHINESE]","Contagion"
"494",2030928,2032486,"Is there a problem?","Contagion"
"495",2032663,2036155,"Oh, they're from my village.They found a new cluster there.","Contagion"
"496",2036601,2037693,"Oh.","Contagion"
"497",2037869,2042169,"- Is your family still there?- My mother has symptoms.","Contagion"
"498",2042340,2045571,"I'll get you the footage you require.Excuse me.","Contagion"
"499",2058056,2060251,"[CHATTERING]","Contagion"
"500",2060958,2063188,"[WOMAN COUGHING]","Contagion"
"501",2083548,2086278,"[PHONE RINGS]","Contagion"
"502",2088419,2091445,"Dr. Sussman, I heard that they wereshutting us down.","Contagion"
"503",2091622,2093817,"Yeah, I just have to dealwith the samples.","Contagion"
"504",2093991,2096482,"If it's just a matter of destroying them,I can do it.","Contagion"
"505",2096661,2098561,"No, I'll take care of it. You go on home.","Contagion"
"506",2098729,2101562,"I'll do that,and then I just want to recheck some data.","Contagion"
"507",2133297,2134321,"CHEEVER:He grew it.","Contagion"
"508",2134499,2136933,"HEXTALL: He tried antibodiesand immunological MAC outlines...","Contagion"
"509",2137101,2139695,"...but the key was a fetal-bat cell linefrom Geelong.","Contagion"
"510",2139871,2142465,"- We didn't have it.- He grew it in a BSL-3.","Contagion"
"511",2142640,2145404,"Ally, what the hell was he doingworking with it in a BSL-3?","Contagion"
"512",2145576,2146838,"Ignoring me.","Contagion"
"513",2147011,2148842,"[CHEEVER SIGHS]","Contagion"
"514",2149947,2152916,"He's gonna publish.Shit. What does he want?","Contagion"
"515",2153084,2155382,"A box of cigars. He had a choice, Ellis.","Contagion"
"516",2155553,2157646,"He could have gone into businessfor himself.","Contagion"
"517",2157822,2160723,"There's no doubt he was approached,but he gave it to us.","Contagion"
"518",2160892,2164293,"- And we're supposed to trust him?- We don't have a choice.","Contagion"
"519",2166030,2169124,"NEWSCASTER: The Centers for DiseaseControl and Prevention in the United States...","Contagion"
"520",2169300,2171427,"...and the World Health Organizationin Switzerland...","Contagion"
"521",2171602,2174162,"...confirmed today that Dr. Lan Sussmanof San Francisco...","Contagion"
"522",2174338,2178399,"...has succeeded in growingthe MEV-1 virus in a laboratory setting.","Contagion"
"523",2178576,2182444,"Officials at the CDC cautioned thatthe breakthrough is only the first step...","Contagion"
"524",2182613,2184240,"...toward developing a vaccine...","Contagion"
"525",2184415,2187350,"...which is likely still months awayfrom human trials.","Contagion"
"526",2187518,2192251,"The WHO estimates the number of peopleinfected worldwide to be over 8 million.","Contagion"
"527",2192423,2194891,"ALAN:Now it all changes.","Contagion"
"528",2195326,2198261,"Sussman gets anointedby the National Academy of Sciences...","Contagion"
"529",2198429,2201330,"...and every pharmaceutical executivegets a hard-on.","Contagion"
"530",2201499,2203831,"They'll be growing the virusin every lab on Earth.","Contagion"
"531",2204001,2206561,"It's a bad day to be a rhesus monkey.","Contagion"
"532",2206737,2211800,"Crikey, first we shoot them into space,now we'll be shooting them full of virus.","Contagion"
"533",2211976,2213841,"So this is where we need your expertise.","Contagion"
"534",2214011,2216343,"Pharmaceutical stocksare already through the roof.","Contagion"
"535",2216514,2219881,"What's next? Where's the opportunity?","Contagion"
"536",2220051,2222611,"Now, you saw that Shinko bus thingday one.","Contagion"
"537",2222787,2224812,"That's why we wanted this meeting.","Contagion"
"538",2225590,2227581,"When I turned on my computerthis morning...","Contagion"
"539",2227758,2232252,"...I had over 2 million unique visitors,all looking for the truth.","Contagion"
"540",2232964,2236525,"You think they wanna see metalking to some hedge-fund guy?","Contagion"
"541",2236701,2239898,"Mr. Krumwiede,we don't invent need here.","Contagion"
"542",2240071,2244007,"We just analyze it, predict it.","Contagion"
"543",2244976,2248002,"You tell me what it coststo look into your crystal ball.","Contagion"
"544",2250982,2253450,"You're familiar with forsythia?","Contagion"
"545",2253951,2256579,"- No, I'm not.- What I'm about to tell you is backed up...","Contagion"
"546",2256754,2259382,"...by testimonials that will appear shortlyin the media.","Contagion"
"547",2259557,2263118,"I'll be talking about it extensivelyin the days ahead.","Contagion"
"548",2263294,2265888,"What does forsythia do?","Contagion"
"549",2267465,2268659,"It's the cure.","Contagion"
"550",2268833,2272360,"MITCH: If I'm immune,can't you use my blood to cure this?","Contagion"
"551",2272536,2275869,"MEARS: Blood serums can take a long timeto make, and are very expensive.","Contagion"
"552",2276040,2279532,"But the good news hereis that you're not going to get sick.","Contagion"
"553",2280645,2282806,"Okay. Um...","Contagion"
"554",2282980,2285778,"Then that would mean thatmy daughter can't get it either, right?","Contagion"
"555",2285950,2288180,"I can't promise you that.","Contagion"
"556",2288352,2291549,"But isn't that somethingthat she would inherit from me?","Contagion"
"557",2291722,2294213,"Well, half her immune systemcame from you...","Contagion"
"558",2294392,2297122,"...but the other halfcame from her mother.","Contagion"
"559",2303401,2304425,"[CLAMORING AND COUGHING]","Contagion"
"560",2304602,2305626,"MAN:- Almost three hours.","Contagion"
"561",2305803,2307964,"I need to see a doctoror a supervisor or something.","Contagion"
"562",2308139,2310869,"I wanna know if he has this thingon the news.","Contagion"
"563",2311042,2314034,"NURSE: I'm sorry, sir,we're doing the best we can.","Contagion"
"564",2314211,2316736,"MAN: Can I just speak to an administratoror something? Anybody.","Contagion"
"565",2316914,2318848,"NURSE:Sir, please be patient. We'll get you in...","Contagion"
"566",2319016,2320347,"MAN:He's sick!","Contagion"
"567",2321218,2323652,"DAVE: My wife makes me take offmy clothes in the garage.","Contagion"
"568",2323821,2326756,"Then she leaves out a bucket of warm waterand some soap.","Contagion"
"569",2326924,2331020,"And then she douses everythingin hand sanitizer after I leave.","Contagion"
"570",2331195,2333493,"I mean, she's overreacting, right?","Contagion"
"571",2333664,2337532,"Not really.And stop touching your face, Dave.","Contagion"
"572",2344375,2346275,"Okay, we'll put the air lock here.","Contagion"
"573",2346444,2350904,"I want 25 rows of 10 beds apiece.The most febrile cases at this end.","Contagion"
"574",2351082,2355314,"We'll set up triage outside,FEMA can handle food in the basement...","Contagion"
"575",2355486,2359513,"...and we'll need to be operationalwithin the next 24 to 48 hours.","Contagion"
"576",2359690,2361157,"Gotcha.","Contagion"
"577",2361325,2362417,"[MEARS SIGHS]","Contagion"
"578",2362593,2365585,"- Nice job, Dave. This will work.- Thanks.","Contagion"
"579",2365763,2367196,"Now find me three more just like it.","Contagion"
"580",2367365,2368389,"[FOOTSTEPS APPROACHING]","Contagion"
"581",2368566,2372696,"Excuse me, Dr. Mears.Is this coming out of your budget or ours?","Contagion"
"582",2372870,2374132,"[SIGHS]","Contagion"
"583",2374305,2376500,"WHO has confirmedthat the Hong Kong sample...","Contagion"
"584",2376674,2378539,"...matches London,Tokyo and Abu Dhabi...","Contagion"
"585",2378709,2382611,"...and we're seeing large clusters infrom Frankfurt and Cairo.","Contagion"
"586",2382780,2385214,"MEARS [OVER SPEAKER]:Are we any closer to an index patient?","Contagion"
"587",2385383,2388944,"Could be your Beth Emhoffor the guy on the bus in Japan.","Contagion"
"588",2389120,2392283,"Someone else who crawled off the grid.How you doing?","Contagion"
"589",2392456,2394515,"Yeah, good.I'm going into a meeting with...","Contagion"
"590",2394692,2397684,"No, I didn't ask what you were doing,I asked how you were doing.","Contagion"
"591",2397862,2399056,"How are you doing?","Contagion"
"592",2400331,2401662,"I'm, uh...","Contagion"
"593",2402767,2404291,"I'm fine.","Contagion"
"594",2404468,2406231,"Fine?","Contagion"
"595",2406404,2408065,"You know, I was in the field for 15 years.","Contagion"
"596",2408239,2412141,"I've seen a lot of shit.If you're not doing fine, you can tell me.","Contagion"
"597",2412443,2415435,"You ever have to tell a manwho just lost his wife and stepson...","Contagion"
"598",2415613,2418582,"...that his wife was cheating on himbefore she died?","Contagion"
"599",2418749,2420307,"No, I haven't.","Contagion"
"600",2420484,2422452,"I'm sure you did the best you could.","Contagion"
"601",2422620,2426112,"- Uh-uh.- You sound tired.","Contagion"
"602",2426290,2428281,"You gotta try to remember to sleeponce in a while.","Contagion"
"603",2428459,2429483,"[SIGHS]","Contagion"
"604",2429660,2433289,"When was the last time you had somethingthat didn't come out of a vending machine?","Contagion"
"605",2434932,2436331,"Taco Bell.","Contagion"
"606",2436500,2440027,"Local officials are now sayingover 3000 cases have been confirmed...","Contagion"
"607",2440204,2441535,"...in the western suburbs...","Contagion"
"608",2441705,2445197,"...as well as the first cases reported inRamsey, Carlton and Saint Louis counties...","Contagion"
"609",2445376,2446809,"...as the virus continues to spread.","Contagion"
"610",2446977,2448001,"[DOORBELL RINGS]","Contagion"
"611",2448179,2450374,"JORY: Got it!- A state Health Department spokesperson...","Contagion"
"612",2450548,2453915,"...at this hour is appealing to hospitalsas far away as Iowa for medicine.","Contagion"
"613",2454084,2456609,"MITCH: No, don't open that door.Don't open the door.","Contagion"
"614",2456787,2460917,"- It's Andrew.- Uh, sorry, Andrew, I can't let you in.","Contagion"
"615",2461091,2463286,"I just came to give my condolences,Mr. Emhoff.","Contagion"
"616",2463461,2466624,"I understand. Thank you.Uh, but I can't let you in.","Contagion"
"617",2468165,2469826,"I'll just leave them, then.","Contagion"
"618",2470000,2473128,"No, actually, you should take them.Uh, thank you, though.","Contagion"
"619",2475172,2477402,"- I'll call you later.MITCH: Bye.","Contagion"
"620",2481045,2483843,"We just, you know,aren't gonna take any chances.","Contagion"
"621",2486951,2488077,"[CHATTERING OVER MONITOR]","Contagion"
"622",2498362,2501559,"WOMAN: Do you know how to play this?- No, I have no idea what's going on.","Contagion"
"623",2501732,2502756,"[CHUCKLING]","Contagion"
"624",2502933,2504764,"But it looks fun.","Contagion"
"625",2504935,2506994,"WOMAN:You wanna try?","Contagion"
"626",2508739,2509797,"Okay.","Contagion"
"627",2509974,2511532,"[WOMEN CHUCKLING]","Contagion"
"628",2511709,2513336,"We'll see.","Contagion"
"629",2513511,2515479,"Hello. Hi.","Contagion"
"630",2515646,2517136,"Oh, yeah, my turn, okay.","Contagion"
"631",2517815,2520147,"This one. Crab. Okay.","Contagion"
"632",2524321,2525788,"MAN: Hey.- Oh! Aah!","Contagion"
"633",2525956,2526980,"WOMEN:Oh...","Contagion"
"634",2527157,2530126,"Oh, my God.I'll do... What is that? Which one is this?","Contagion"
"635",2530294,2531761,"WOMAN: Coin.MAN: It's a coin.","Contagion"
"636",2531929,2532953,"[SPEAKS INDISTINCTLY]","Contagion"
"637",2533130,2536622,"Oh, okay, okay, okay.","Contagion"
"638",2536800,2539928,"ORANTES: It's transmission.So we just need to know which direction.","Contagion"
"639",2540604,2543038,"[SPEAKS IN CHINESE]","Contagion"
"640",2543207,2544970,"But we don't know where it comes from.","Contagion"
"641",2545609,2549773,"I would like to suggestthat the virus started before Macao...","Contagion"
"642",2549947,2551710,"...and maybe here in Hong Kong.","Contagion"
"643",2551882,2553406,"[IN CHINESE]","Contagion"
"644",2553584,2557076,"MAN [IN CHINESE]:","Contagion"
"645",2559890,2563951,"[IN ENGLISH] You're consideringpronouncements with serious implications.","Contagion"
"646",2564728,2568994,"A virus is too small to be seenon video camera.","Contagion"
"647",2569466,2570933,"[MEARS COUGHING]","Contagion"
"648",2582379,2585041,"[PANTING]","Contagion"
"649",2589019,2590509,"[THERMOMETER BEEPS]","Contagion"
"650",2593991,2595754,"Please, God.","Contagion"
"651",2595926,2597723,"Please, God.","Contagion"
"652",2606003,2608301,"No, no, no.","Contagion"
"653",2609440,2611567,"[SOBBING]","Contagion"
"654",2624822,2626483,"Hello?","Contagion"
"655",2626657,2630058,"This is Dr. Erin Mears in Room 821.","Contagion"
