"id","startTime","endTime","text","title"
"343",1358294,1361388,"Wait. Don't you believe in equalityamongst the sexes?","Daddy Day Care"
"344",1361497,1363727,"Can't men do everything women can do?","Daddy Day Care"
"345",1364433,1366765,"No, we can't. It's unnatural.","Daddy Day Care"
"346",1368237,1369761,"Little bit eeky.","Daddy Day Care"
"347",1370072,1371232,"You're guys?","Daddy Day Care"
"348",1371340,1373331,"What did you think Daddy Day Care meant?","Daddy Day Care"
"349",1373442,1376002,"I thought maybe one guy. Not only guys.","Daddy Day Care"
"350",1376111,1377669,"I just thought it was a clever name.","Daddy Day Care"
"351",1377780,1380476,"- Is this the day care place?- They're all guys.","Daddy Day Care"
"352",1380582,1381640,"They're what?","Daddy Day Care"
"353",1381750,1385686,"Excuse me. Listen.We are two loving, caring parents.","Daddy Day Care"
"354",1385788,1387187,"We run a day care center.","Daddy Day Care"
"355",1387289,1389223,"You're a couple of sickos!","Daddy Day Care"
"356",1389325,1391691,"How about a free trial offer?","Daddy Day Care"
"357",1392094,1393220,"Sickos!","Daddy Day Care"
"358",1394596,1396928,"- Oh, dear.- Come on!","Daddy Day Care"
"359",1398567,1400967,"Hi, Peggy! Hi, Nicky. How you doing?","Daddy Day Care"
"360",1401070,1403504,"Nicky is so excited for his big day.","Daddy Day Care"
"361",1403605,1406335,"- How old are you? Oh, yeah, five.- I got it.","Daddy Day Care"
"362",1406442,1409275,"Wait. You're leaving Nicky herewith these guys?","Daddy Day Care"
"363",1410112,1413172,"You have trouble with them being guys?Are you from the Dark Ages?","Daddy Day Care"
"364",1413282,1415648,"Aren't you for gender equalityand all that jazz?","Daddy Day Care"
"365",1415751,1418185,"Peggy, come on. Of course we are.","Daddy Day Care"
"366",1418287,1421017,"So can't women do what men doand men do what women do?","Daddy Day Care"
"367",1421123,1422750,"These guys can do the job.","Daddy Day Care"
"368",1422858,1426487,"- You'll vouch for these two?- Yeah, I'll vouch for them.","Daddy Day Care"
"369",1428731,1430289,"- I'll try it.- You're doing it?","Daddy Day Care"
"370",1430399,1432264,"They'll have a great time.","Daddy Day Care"
"371",1432368,1433460,"- Okay.- Right, kids?","Daddy Day Care"
"372",1433569,1435230,"You're a real lifesaver.","Daddy Day Care"
"373",1435604,1438835,"You screw this up,I'll kill you with my bare hands.","Daddy Day Care"
"374",1439942,1443275,"- Here, now, go to Phil.- No, I don't want to go.","Daddy Day Care"
"375",1443379,1445404,"- Come on. Let go.- I don't want to go!","Daddy Day Care"
"376",1445514,1448415,"He's got a little bit of separation anxiety.","Daddy Day Care"
"377",1449818,1451877,"- Dylan!- I don't want to go!","Daddy Day Care"
"378",1453522,1456320,"- I just stopped breastfeeding.- I'd freak out, too.","Daddy Day Care"
"379",1456425,1458825,"- Lf you could grab a leg.- I don't want to go.","Daddy Day Care"
"380",1458927,1460519,"- All right.- Here we go.","Daddy Day Care"
"381",1460996,1462896,"- Here we go.- Come on, Dylan.","Daddy Day Care"
"382",1462998,1465364,"- All right, sweetie.- I don't want to go.","Daddy Day Care"
"383",1467236,1469796,"Come on. Let go of Mom!","Daddy Day Care"
"384",1472174,1474233,"Thank you. Oh, man.","Daddy Day Care"
"385",1474343,1478211,"- No lactose, no peanuts, no shellfish.- Nothing high in fructose.","Daddy Day Care"
"386",1478313,1481942,"- Or sucrose or dextrose.- Or maltodextrose.","Daddy Day Care"
"387",1482050,1485383,"- Nothing with red dye number six.- Or number four.","Daddy Day Care"
"388",1485487,1488320,"Or yellow dye number two.","Daddy Day Care"
"389",1488424,1491655,"Will you say ""maltodextrose"" for me again?So cute.","Daddy Day Care"
"390",1491760,1493591,"Maltodextrose.","Daddy Day Care"
"391",1495664,1498792,"- Or yellow dye number two.- Two, right.","Daddy Day Care"
"392",1498901,1500300,"His name's Crispin.","Daddy Day Care"
"393",1500402,1501767,"My man, Crispin!","Daddy Day Care"
"394",1501870,1503531,"How's it going, big guy?","Daddy Day Care"
"395",1507509,1508976,"What time's pickup?","Daddy Day Care"
"396",1509077,1510567,"At 5:00.","Daddy Day Care"
"397",1511213,1513511,"I have laser treatment. Make it 6:00.","Daddy Day Care"
"398",1513615,1516015,"Sorry about the outfit. He won't take it off.","Daddy Day Care"
"399",1516118,1517813,"How long has he been wearing that?","Daddy Day Care"
"400",1517920,1519251,"Couple of weeks.","Daddy Day Care"
"401",1520022,1522547,"Who will you call if there are any problems?","Daddy Day Care"
"402",1522658,1524023,"911, Mommy.","Daddy Day Care"
"403",1524226,1526217,"That's such a good girl.","Daddy Day Care"
"404",1527296,1530356,"Come on. I'll let you hold my keys.","Daddy Day Care"
"405",1530466,1532866,"How about a Life Saver?You like Life Savers?","Daddy Day Care"
"406",1532968,1535368,"How about money? A dollar?","Daddy Day Care"
"407",1539241,1540503,"A dollar.","Daddy Day Care"
"408",1541043,1544206,"You are a smart man. That is yours.All right.","Daddy Day Care"
"409",1546181,1547614,"Welcome to Daddy Day Care.","Daddy Day Care"
"410",1547716,1551277,"We're your team facilitators.My name is Charlie and this is Phil.","Daddy Day Care"
"411",1551787,1554312,"Anybody ever seena mission statement before?","Daddy Day Care"
"412",1554423,1558223,"Here. Everybody take one.Take a mission statement.","Daddy Day Care"
"413",1558327,1560818,"Here we go. One for everybody. Slow down.","Daddy Day Care"
"414",1560929,1562590,"All right. Okay.","Daddy Day Care"
"415",1562965,1566332,"Who wants to be first oneto read the first sentence...","Daddy Day Care"
"416",1566435,1568403,"on the mission statement?","Daddy Day Care"
"417",1569171,1570832,"Okay, how about you?","Daddy Day Care"
"418",1570939,1572634,"I don't read yet.","Daddy Day Care"
"419",1573075,1574804,"I'm looking for someone who can read.","Daddy Day Care"
"420",1574910,1578778,"By a show of hands,how many of you can already read?","Daddy Day Care"
"421",1580682,1584243,"Raise your handif you don't know how to read.","Daddy Day Care"
"422",1585954,1587854,"Here's what we'll do.","Daddy Day Care"
"423",1587956,1590186,"I'll read the mission statement aloud...","Daddy Day Care"
"424",1590292,1594285,"and what I want you guys to dois just follow along as I read it.","Daddy Day Care"
"425",1595330,1598197,"Doesn't that sound like interesting fun?Here we go.","Daddy Day Care"
"426",1598300,1602634,"""As the members and facilitatorsof the Daddy Day Care team...","Daddy Day Care"
"427",1602871,1605738,"""we will collectively strive to provide...""","Daddy Day Care"
"428",1605841,1609902,"Sean, don't eat the mission statement.Get that out of your mouth.","Daddy Day Care"
"429",1610012,1612037,"""...will collectively strive to...""","Daddy Day Care"
"430",1612147,1616607,"Don't rip the mission statement, Little Flash.It's an important document.","Daddy Day Care"
"431",1619054,1620487,"Come back here!","Daddy Day Care"
"432",1622224,1624556,"What he's really trying to say is...","Daddy Day Care"
"433",1632534,1633933,"Stop running!","Daddy Day Care"
"434",1634770,1636067,"Come here.","Daddy Day Care"
"435",1638473,1640168,"You want the rocket ship?","Daddy Day Care"
"436",1641743,1644337,"- One more?- Rocket ship!","Daddy Day Care"
"437",1645280,1648681,"Everybody'll get the rocket ship.Slow down, everybody.","Daddy Day Care"
"438",1650686,1654349,"- I thought you said this would be easy.- You know what I'm thinking now?","Daddy Day Care"
"439",1654456,1656424,"This was a huge mistake.","Daddy Day Care"
"440",1656525,1660962,"I never quit anything in life,but I'm not sure if I can take this.","Daddy Day Care"
"441",1661730,1663891,"- I'll be right back.- Where you going?","Daddy Day Care"
"442",1663999,1666593,"- Help me do the rocket ship.- Trust me.","Daddy Day Care"
"443",1673108,1676407,"Four absent children. No explanation.","Daddy Day Care"
"444",1676511,1678376,"Maybe it's just a coincidence.","Daddy Day Care"
"445",1678480,1682644,"In a group this size,three absent children is a coincidence.","Daddy Day Care"
"446",1682884,1685114,"Four is a statistical anomaly.","Daddy Day Care"
"447",1688657,1689146,"Hello, Santa Luma!","Daddy Day Care"
"448",1689224,1690248,"Hello, Santa Luma!","Daddy Day Care"
"449",1691893,1694987,"Everybody! It's Big Phil with a guitar!","Daddy Day Care"
"450",1695097,1698624,"Why don't you guys enjoy Big Philwhile I rest my spine?","Daddy Day Care"
"451",1699234,1701293,"Max, bring your dad a chair.","Daddy Day Care"
"452",1703705,1705400,"They really like that rocket ship.","Daddy Day Care"
"453",1705507,1707600,"When I was a small boy","Daddy Day Care"
"454",1709077,1710840,"at the age of five","Daddy Day Care"
"455",1712280,1713770,"my mama said","Daddy Day Care"
"456",1715684,1717618,"I'd be the greatest man alive","Daddy Day Care"
"457",1718654,1719916,"I'm a man","Daddy Day Care"
"458",1722190,1723953,"I'm a full-grown man","Daddy Day Care"
"459",1725594,1727061,"I'm a fat man","Daddy Day Care"
"460",1729798,1731891,"Hey, come on into the kitchen.","Daddy Day Care"
"461",1732000,1735299,"Put the lime in the coconutand drink 'em all up","Daddy Day Care"
"462",1735404,1738635,"put the lime in the coconut, drink 'em all up","Daddy Day Care"
"463",1738740,1741937,"put the lime in the coconutyou drink 'em all up","Daddy Day Care"
"464",1742711,1745976,"I say, ""Doctor,ain't there nothing I can take?""","Daddy Day Care"
"465",1746081,1748914,"I say, ""Doctor, to relieve this belly ache?""","Daddy Day Care"
"466",1749184,1750742,"I say, ""Doctor...""","Daddy Day Care"
"467",1750852,1753753,"Like a rhinestone cowboy","Daddy Day Care"
"468",1755724,1757658,"Riding out on a horse","Daddy Day Care"
"469",1757759,1761024,"in a star-spangled rodeo","Daddy Day Care"
"470",1762531,1765728,"Hava nagila, hava nagila","Daddy Day Care"
"471",1765834,1767665,"Hava nagila","Daddy Day Care"
"472",1770439,1773067,"I am definitely out of songs.","Daddy Day Care"
"473",1773575,1775099,"Lunchtime.","Daddy Day Care"
"474",1782584,1785018,"I don't knowif we should be feeding them this stuff.","Daddy Day Care"
"475",1785120,1787315,"Why not? Look at them. They love it.","Daddy Day Care"
"476",1792060,1793721,"Yeah, but I'm a little worried.","Daddy Day Care"
"477",1793829,1795160,"About what?","Daddy Day Care"
"478",1801369,1802393,"911.","Daddy Day Care"
"479",1803238,1804762,"He tore off his head!","Daddy Day Care"
"480",1805574,1808270,"Crispin stole my doll. I need help.","Daddy Day Care"
"481",1811646,1813113,"Come on!","Daddy Day Care"
"482",1813415,1816441,"You know how old this piano is?Keep your feet off the piano.","Daddy Day Care"
"483",1816551,1819543,"Get your shoes off the couch.Get them off the couch!","Daddy Day Care"
"484",1822991,1824549,"Crispin. Please!","Daddy Day Care"
"485",1825494,1827018,"Give me the...","Daddy Day Care"
"486",1827796,1830230,"The meat ain't the only fresh thingaround here.","Daddy Day Care"
"487",1830332,1832493,"Don't play with that. Give me this.","Daddy Day Care"
"488",1838106,1839903,"Leave it alone, okay?","Daddy Day Care"
"489",1856625,1858252,"All right.","Daddy Day Care"
"490",1859094,1861062,"You get off those drapes.","Daddy Day Care"
"491",1861997,1864591,"Stop climbing the drapes. You stop it.","Daddy Day Care"
"492",1864733,1866223,"You come here!","Daddy Day Care"
"493",1869037,1870436,"Give me the vase!","Daddy Day Care"
"494",1870539,1872166,"Put down the vase!","Daddy Day Care"
"495",1878113,1880775,"Tomorrow, we give them all organic.","Daddy Day Care"
"496",1881850,1883408,"Don't worry, it'll be okay.","Daddy Day Care"
"497",1883518,1885509,"How can you say that? Look at this.","Daddy Day Care"
"498",1885620,1887178,"What goes up...","Daddy Day Care"
"499",1908577,1909908,"You guys are good.","Daddy Day Care"
"500",1910011,1913174,"What do you expect?You left your kids with professionals.","Daddy Day Care"
"501",1916418,1918386,"Sorry to leave you hanging.","Daddy Day Care"
"502",1918486,1921182,"Since we got laid off,Sheila's made me make dinner.","Daddy Day Care"
"503",1921289,1922984,"Really? How's that going?","Daddy Day Care"
"504",1924059,1925424,"It ain't napping.","Daddy Day Care"
"505",1925527,1928496,"- Can I take these snack cakes home?- Go ahead.","Daddy Day Care"
"506",1931066,1933057,"How you doing, little man?","Daddy Day Care"
"507",1933702,1935465,"That's how you doing?","Daddy Day Care"
"508",1936137,1937729,"Excuse me a second.","Daddy Day Care"
"509",1941243,1943211,"Give me that. That's too loud.","Daddy Day Care"
"510",1943311,1945040,"Let go, it's too loud.","Daddy Day Care"
"511",1945146,1946875,"I'm serious. Let go.","Daddy Day Care"
"512",1951319,1953082,"It's late. Where's your mom?","Daddy Day Care"
"513",1953188,1954519,"Shut up, butthead.","Daddy Day Care"
"514",1954623,1957285,"Shut... You stop that.You know something?","Daddy Day Care"
"515",1957392,1960884,"Your mommy and daddywould not like you talking like that.","Daddy Day Care"
"516",1960996,1963226,"When your mommy comes,I'll tell her that you...","Daddy Day Care"
"517",1963331,1964855,"Let's go. Motor's running.","Daddy Day Care"
"518",1964966,1968493,"- Get out of here. Hey, I wish you would.- Stop, Crispin!","Daddy Day Care"
"519",1968703,1970830,"- Don't make that face.- What?","Daddy Day Care"
"520",1971172,1973538,"Don't make lines. Quiet the face.","Daddy Day Care"
"521",1973742,1976233,"Relax the face. Quiet the face.","Daddy Day Care"
"522",1976344,1979245,"Yes, calm your face.Show no lines, you know.","Daddy Day Care"
"523",1981182,1982206,"You got early drop-off?","Daddy Day Care"
"524",1982317,1984478,"No, we don't have anything...","Daddy Day Care"
"525",1984586,1986816,"I'm going to see you tomorrow.","Daddy Day Care"
"526",1986922,1989186,"I'll see you tomorrow, Crispin.","Daddy Day Care"
"527",1990258,1991953,"You'll be just like your father.","Daddy Day Care"
"528",1992060,1995518,"Look at him.Hanging off of him, his skin. Hanging off.","Daddy Day Care"
"529",1996865,1999095,"- Hey, little man.- Hey, Dad.","Daddy Day Care"
"530",1999601,2001296,"What are you up to?","Daddy Day Care"
"531",2004239,2006332,"Just trying to read a story.","Daddy Day Care"
"532",2007475,2008942,"Listen, man...","Daddy Day Care"
"533",2009244,2012839,"I know I was really busy todaytaking care of those other kids.","Daddy Day Care"
"534",2012948,2016315,"I know it probably wasn't easy for yousharing your toys...","Daddy Day Care"
"535",2016418,2019945,"and watching Daddydo rocket ship with everybody, but...","Daddy Day Care"
"536",2020188,2022782,"Now it's just us,we can do whatever you want to do.","Daddy Day Care"
"537",2022891,2026793,"- Can we read this story?- We sure can read this story.","Daddy Day Care"
"538",2026995,2028223,"All right.","Daddy Day Care"
"539",2028496,2031260,"""There once was a herd of elephants.","Daddy Day Care"
"540",2031433,2035802,"""Elephants young, elephants old,elephants tall and short, fat and thin.","Daddy Day Care"
"541",2036805,2041174,"""All were different, but all were happy,and almost all were the same color.","Daddy Day Care"
"542",2041276,2044507,"""And they all made the elephant sound.""They all said...","Daddy Day Care"
"543",2046815,2048806,"Let me hear you make that sound.","Daddy Day Care"
"544",2051286,2052378,"Do it again?","Daddy Day Care"
"545",2052487,2056321,"No, I can't do it again,because Daddy might have an aneurysm.","Daddy Day Care"
"546",2063031,2065022,"Hey, guys, sorry I'm late.","Daddy Day Care"
"547",2071539,2073507,"I'm not cleaning this up.","Daddy Day Care"
"548",2093028,2095622,"Hey, take this in there. Go sit down.","Daddy Day Care"
"549",2096364,2100391,"Maybe I haven't had my coffee yet,but it seems like these kids are multiplying.","Daddy Day Care"
"550",2100502,2103164,"- Yeah, we got two new kids.- Oh, come on!","Daddy Day Care"
"551",2103271,2106638,"We'll have to up our game.We need structure and planned activities.","Daddy Day Care"
"552",2106741,2109642,"No, we need Ritalin and leashes,that's what we need.","Daddy Day Care"
"553",2109744,2111405,"All we'll need is this.","Daddy Day Care"
"554",2113882,2115315,"Everybody, let's do this.","Daddy Day Care"
"555",2115417,2117282,"Everybody, come in here.","Daddy Day Care"
"556",2117385,2120013,"Okay, let's try another play. Let's try this.","Daddy Day Care"
"557",2120121,2121952,"Let's try this. Here's what we'll do.","Daddy Day Care"
"558",2122057,2124582,"This new play's called the Baby Blitz.","Daddy Day Care"
"559",2124692,2126990,"I want you to hang back and do a lateral.","Daddy Day Care"
"560",2127095,2129723,"I want you to go down the middlefor a buttonhook.","Daddy Day Care"
"561",2129831,2131628,"I want you to be my blocker.","Daddy Day Care"
"562",2131733,2134429,"How about we just run in a circle?","Daddy Day Care"
"563",2134569,2138300,"We can do that. That's an even better play.Everybody run in a circle.","Daddy Day Care"
"564",2138406,2142342,"Yes? All right, let's run in a circle.Come on, run in a circle.","Daddy Day Care"
"565",2142477,2145537,"Tony, you'll see the ball a lot betterif you take your mask off.","Daddy Day Care"
"566",2145647,2147615,"I'm not Tony, I'm Flash.","Daddy Day Care"
"567",2158860,2161556,"How come you're not playing, little man?","Daddy Day Care"
"568",2162130,2164928,"Come on, it's football. You love football.","Daddy Day Care"
"569",2165200,2166292,"Help!","Daddy Day Care"
"570",2167268,2168860,"Help! Stuck!","Daddy Day Care"
"571",2173408,2175205,"I live in California.","Daddy Day Care"
"572",2175410,2177503,"- Where do you live?- I am in Hong Kong.","Daddy Day Care"
"573",2177612,2179341,"Where's Hong Kong?","Daddy Day Care"
"574",2182117,2184881,"- Can you hear me now?- I can't hear you.","Daddy Day Care"
"575",2186855,2188618,"Can you hear me now?","Daddy Day Care"
"576",2188823,2190154,"What is it?","Daddy Day Care"
"577",2190358,2194055,"I thought you liked football.You're telling me you don't like...","Daddy Day Care"
"578",2201035,2204095,"I'll be right back, little man. I got to go...","Daddy Day Care"
"579",2208977,2211639,"You got a little problem over there with Max.","Daddy Day Care"
"580",2211746,2214078,"- It's happening.- What's happening? What is it?","Daddy Day Care"
"581",2214182,2217709,"It! It's happening.He hasn't gone for a week. That's it.","Daddy Day Care"
"582",2218086,2220987,"Oh, no. That's... It's happening?","Daddy Day Care"
"583",2221089,2223353,"It's happening. I know the face. Look.","Daddy Day Care"
"584",2226361,2229228,"- You got to go and deal with that.- I can't.","Daddy Day Care"
"585",2229564,2231191,"- What do you mean, you can't?- I can't.","Daddy Day Care"
"586",2231299,2233494,"- Come on, you have to do it.- I can't.","Daddy Day Care"
"587",2233601,2235364,"- Yes, you can.- I can't.","Daddy Day Care"
"588",2235470,2236835,"- Yes, you can.- All right, I will!","Daddy Day Care"
"589",2236938,2237962,"Good. Come on.","Daddy Day Care"
"590",2259060,2260288,"I can't.","Daddy Day Care"
"591",2260628,2263290,"Listen. I see you got issues about this...","Daddy Day Care"
"592",2263398,2265798,"so I'll take care of it this time, all right?","Daddy Day Care"
"593",2266434,2269801,"- In the future, you got to work it out.- I got to work it out.","Daddy Day Care"
"594",2269904,2273305,"That's your son. God willing,when you get older, he'll do this for you.","Daddy Day Care"
"595",2273408,2275706,"So you want to know he owes that to you.","Daddy Day Care"
"596",2275810,2277778,"- He owes me.- He owes you.","Daddy Day Care"
"597",2280248,2283945,"- Don't get cute with the thing.- I'm not assuming you're doing it.","Daddy Day Care"
"598",2284085,2287612,"- So how you want to do this?- I can do this myself.","Daddy Day Care"
"599",2287722,2289121,"- You sure?- Yes.","Daddy Day Care"
"600",2289224,2293456,"Okay, well, you go and do itwith your bad self. You go and do it now.","Daddy Day Care"
"601",2293661,2296562,"All right. You need anything,I'm right out here.","Daddy Day Care"
"602",2308810,2311301,"Hey, big guy, how'd it go in there?","Daddy Day Care"
"603",2311646,2312840,"I missed.","Daddy Day Care"
"604",2312947,2314175,"What does that mean?","Daddy Day Care"
"605",2314282,2315544,"I missed.","Daddy Day Care"
"606",2316751,2317911,"Oh, hell, no.","Daddy Day Care"
"607",2354989,2356456,"- Come on!- No.","Daddy Day Care"
"608",2358126,2361220,"Come on. Put this down.You don't play with this.","Daddy Day Care"
"609",2361329,2363524,"And you ripped up my wife's flowers.","Daddy Day Care"
"610",2363631,2367294,"Give me this. You're not supposed to.Go play with something else.","Daddy Day Care"
"611",2367402,2370235,"- What's going on here?- It's spiraling out of control.","Daddy Day Care"
"612",2370338,2373000,"Don't panic. They're like animals.They can smell fear.","Daddy Day Care"
"613",2373107,2375166,"I don't know what to do.I've run out of ideas.","Daddy Day Care"
"614",2375276,2377107,"I'll tell you what...","Daddy Day Care"
"615",2381816,2383977,"Quietly, children. Follow me.","Daddy Day Care"
"616",2384552,2386076,"Six absences.","Daddy Day Care"
"617",2387889,2389288,"Single file.","Daddy Day Care"
"618",2390024,2392288,"I have to go make a phone call.","Daddy Day Care"
"619",2394962,2396486,"Let's get ready...","Daddy Day Care"
"620",2396597,2399225,"to rumble!","Daddy Day Care"
"621",2401269,2403794,"Let me tell you something,I have never liked carrots.","Daddy Day Care"
"622",2403905,2406601,"And today as I stand hereand look at you before me...","Daddy Day Care"
"623",2406708,2409973,"having the audacity to thinkthat you can defeat me...","Daddy Day Care"
"624",2410111,2414480,"let me tell you something, brother,I am about to kick your carrot butt!","Daddy Day Care"
"625",2414582,2416914,"Let me tell you something, Mr. Broccoli.","Daddy Day Care"
"626",2417018,2421352,"When The Carrot is done with you,you will be nothing but a kumquat!","Daddy Day Care"
"627",2421456,2424823,"I will destroy everything in this worldthat is broccoli.","Daddy Day Care"
"628",2424926,2427417,"The carrot is the lowest form of vegetable!","Daddy Day Care"
"629",2428730,2429822,"What about me?","Daddy Day Care"
"630",2429931,2431159,"Nobody likes broccoli.","Daddy Day Care"
"631",2431265,2434428,"Really? Well, Ben likes broccoli, don't you?","Daddy Day Care"
"632",2435470,2436494,"No.","Daddy Day Care"
"633",2437438,2441101,"You turned my own sprout against me?Now you're gonna die!","Daddy Day Care"
"634",2459260,2461285,"Okay, come on. I felt that.","Daddy Day Care"
"635",2461462,2462656,"Come on.","Daddy Day Care"
"636",2467001,2468332,"Will you stop it?","Daddy Day Care"
"637",2470538,2471664,"That's it.","Daddy Day Care"
"638",2476477,2478468,"- What's that about?- I'm sorry.","Daddy Day Care"
"639",2478579,2480706,"- You made me crazy!- You little maniac!","Daddy Day Care"
"640",2480815,2483181,"You're wrecking my wife's tables.","Daddy Day Care"
"641",2484085,2485416,"Somebody's at the door.","Daddy Day Care"
"642",2485520,2486748,"My back.","Daddy Day Care"
"643",2492927,2495919,"Is this the Hinton residence?","Daddy Day Care"
"644",2496864,2498957,"I'm Dan Kubitz, Child Services.","Daddy Day Care"
"645",2499066,2502160,"I'm here to conducta compliance inspection.","Daddy Day Care"
"646",2502270,2504465,"No one said anything about any inspection.","Daddy Day Care"
"647",2504572,2506631,"We only do it if we receive a complaint.","Daddy Day Care"
"648",2506741,2508971,"A complaint?Somebody complained about...","Daddy Day Care"
"649",2509076,2512068,"Come on in. You can inspect us.We have nothing to hide.","Daddy Day Care"
"650",2512180,2515115,"You caught us at a crazy time.We're playing with the kids.","Daddy Day Care"
"651",2515216,2517377,"Somebody complained about us?","Daddy Day Care"
"652",2519587,2521817,"So, where is the nap area?","Daddy Day Care"
"653",2522790,2524553,"- The nap area?- Right.","Daddy Day Care"
"654",2524792,2526384,"We don't have a nap area.","Daddy Day Care"
"655",2526494,2529463,"We just let them fall asleepwherever they drop.","Daddy Day Care"
"656",2529564,2533398,"""Sleep where they drop.""Well, I think that should just about do it.","Daddy Day Care"
"657",2534101,2535295,"What's the bottom line?","Daddy Day Care"
"658",2535403,2539703,"Well, you need to correctthe deficiencies on this form.","Daddy Day Care"
"659",2541008,2542236,"And also...","Daddy Day Care"
"660",2542343,2546177,"you need to fill outthese compliance certification documents.","Daddy Day Care"
"661",2546514,2548539,"Who wants these, the carrot or the broccoli?","Daddy Day Care"
"662",2548649,2549911,"Carrot.","Daddy Day Care"
"663",2550551,2552542,"There's a lot of stuff on here.","Daddy Day Care"
"664",2553020,2554214,"So we can stay open, right?","Daddy Day Care"
"665",2554322,2556847,"As long you've done that by 9:00 a.m.Tomorrow morning.","Daddy Day Care"
"666",2556958,2558186,"9:00 a.m.","Daddy Day Care"
"667",2558993,2561757,"Good luck with this.I like what you're doing.","Daddy Day Care"
"668",2561863,2563694,"I'd hate to be the guy to shut you down.","Daddy Day Care"
"669",2563798,2565857,"We'd hate for you to be that guy.","Daddy Day Care"
"670",2565967,2568060,"I will be. Don't want to be.","Daddy Day Care"
"671",2569070,2571937,"Okay. Safety gatesat the bottom of the stairs...","Daddy Day Care"
"672",2572039,2574940,"top of the stairs, bedrooms, bathrooms.","Daddy Day Care"
"673",2575042,2577169,"I've gone safety gate crazy.","Daddy Day Care"
"674",2578079,2579671,"How many kids have we got?","Daddy Day Care"
"675",2579780,2582010,"I've lost track, they run so fast.","Daddy Day Care"
"676",2582116,2584846,"You can get started on this batch over here.","Daddy Day Care"
"677",2584952,2588888,"- It's getting late. Let's just call it a night.- We can't call it a night.","Daddy Day Care"
"678",2588990,2591083,"We got a bunch of kids comingin five hours.","Daddy Day Care"
