"id","startTime","endTime","text","title"
"987",3808241,3810732,"Mr. Kubitz. What are you doing here?","Daddy Day Care"
"988",3810944,3813811,"- Is this a bad time?- No, it's a great time.","Daddy Day Care"
"989",3814247,3817478,"Is the man of the house at home?","Daddy Day Care"
"990",3817684,3819379,"""Man of the house.""","Daddy Day Care"
"991",3820053,3823580,"Charlie! Mr. Kubitz is herefrom Child Services!","Daddy Day Care"
"992",3823823,3825552,"I'll be right there.","Daddy Day Care"
"993",3825658,3828821,"So, let me ask you. Where are the kids?","Daddy Day Care"
"994",3828928,3831192,"Outside. Marvin's giving thema puppet show.","Daddy Day Care"
"995",3831297,3834266,"Nice. What's on the program? Pinocchio?Little Red Riding Hood?","Daddy Day Care"
"996",3834367,3836392,"No, Wrath of Khan.","Daddy Day Care"
"997",3836569,3838196,"- Mr. Kubitz. Hi!- Hi.","Daddy Day Care"
"998",3838304,3841171,"- Wait! What are you doing?- What?","Daddy Day Care"
"999",3841508,3843669,"- What's wrong with your face?- My face?","Daddy Day Care"
"1000",3843777,3847713,"What's all that stuff, man? Come on.What's the matter with you?","Daddy Day Care"
"1001",3848948,3850506,"Becca and Jamie.","Daddy Day Care"
"1002",3851417,3855148,"If you'll excuse me,I have to see two little girls...","Daddy Day Care"
"1003",3855255,3856722,"because now I'm a big girl.","Daddy Day Care"
"1004",3856823,3860919,"He's having fun with...Mr. Kubitz, so what brings you here today?","Daddy Day Care"
"1005",3861027,3865828,"- I've received another complaint...- I guess we know who that came from.","Daddy Day Care"
"1006",3867000,3870993,"I understand that you've acquiredthree more children since my last visit.","Daddy Day Care"
"1007",3871104,3872901,"Yes. We're 14 altogether now.","Daddy Day Care"
"1008",3873006,3875736,"It's still three adults,so we're still under the 5:1 ratio.","Daddy Day Care"
"1009",3875842,3878709,"Right. But you see,it's a totally different issue this time.","Daddy Day Care"
"1010",3878812,3880712,"Charlie, can I talk to you for a second?","Daddy Day Care"
"1011",3880814,3884272,"Mr. Kubitz, excuse me a second.I'm going to go handle this.","Daddy Day Care"
"1012",3884384,3885715,"- Have a cookie.- Sure. Thanks.","Daddy Day Care"
"1013",3885819,3887377,"What's going on?","Daddy Day Care"
"1014",3895295,3896990,"- What's up?- Flash is gone.","Daddy Day Care"
"1015",3897096,3899894,"- What do you mean, gone? Gone where?- I can't find him.","Daddy Day Care"
"1016",3899999,3903025,"- You looked everywhere? In the garage?- Everywhere.","Daddy Day Care"
"1017",3903570,3904594,"What we going to do?","Daddy Day Care"
"1018",3904704,3907798,"- Is there some kind of problem out here?- Not at all, Mr. Kubitz.","Daddy Day Care"
"1019",3907907,3910341,"We're just having a little conversationabout the...","Daddy Day Care"
"1020",3910443,3913469,"- Okay, because if it's...- No problem at all. Why don't you...","Daddy Day Care"
"1021",3913580,3916515,"Kids! Why don't you meetour good friend, Mr. Kubitz.","Daddy Day Care"
"1022",3916616,3919380,"- Say hi.- Hi, Mr. Kubitz.","Daddy Day Care"
"1023",3919485,3920713,"Hi, guys.","Daddy Day Care"
"1024",3920920,3923480,"Wouldn't it be niceif Mr. Kubitz played with you guys...","Daddy Day Care"
"1025",3923590,3925683,"while we had an important conversation?","Daddy Day Care"
"1026",3925792,3927885,"- Would you be so kind?- Is that a good idea?","Daddy Day Care"
"1027",3927994,3931259,"We're having a grown-up conversationthe kids shouldn't be privy to.","Daddy Day Care"
"1028",3931364,3934390,"- So just for a second. Please.- Sure. That's different.","Daddy Day Care"
"1029",3936236,3938170,"- I'll check the back yard.- I'll go upstairs.","Daddy Day Care"
"1030",3938271,3940205,"I'll check the basement.","Daddy Day Care"
"1031",3941107,3942938,"Do we have a basement?","Daddy Day Care"
"1032",3968334,3970598,"We have to do the laundry. God!","Daddy Day Care"
"1033",3985585,3987849,"Oh, my God! They vaporized him!","Daddy Day Care"
"1034",3989822,3991949,"He couldn't have got far. I'll call the police.","Daddy Day Care"
"1035",3992058,3996290,"- I'll call his parents.- Lf only I were a Betazoid, I could sense him.","Daddy Day Care"
"1036",3998765,4002030,"- Which kid is this?- I don't know. What's your name?","Daddy Day Care"
"1037",4003002,4004094,"Tony.","Daddy Day Care"
"1038",4006472,4010272,"- Flash's name is Tony.- Actually, Flash's name is Wally West...","Daddy Day Care"
"1039",4016983,4021420,"- Why aren't you wearing your Flash suit?- I don't want to be Flash anymore.","Daddy Day Care"
"1040",4021521,4024718,"- You don't? Who you want to be?- Tony.","Daddy Day Care"
"1041",4024824,4027588,"- Hear that? He wants to be Tony.- He wants to be Tony.","Daddy Day Care"
"1042",4027694,4031323,"That's nice. You want to be Tony.That's great.","Daddy Day Care"
"1043",4031431,4033558,"Tony, have a cookie. Have a fresh one.","Daddy Day Care"
"1044",4033900,4038599,"What are you talking about? I do love you.I'm just not in love with you.","Daddy Day Care"
"1045",4038838,4041363,"Fifteen months of therapy,that's the best you can do?","Daddy Day Care"
"1046",4041474,4044341,"That is the dumbest line I have ever heard.","Daddy Day Care"
"1047",4045878,4048108,"My mother was right about you.","Daddy Day Care"
"1048",4050750,4051808,"Wait.","Daddy Day Care"
"1049",4052352,4055287,"For what? You think this will change?You think I'll change?","Daddy Day Care"
"1050",4055388,4057481,"You think this is what I had in mind?","Daddy Day Care"
"1051",4057590,4059854,"Being a 55-year-old man,living with his mother?","Daddy Day Care"
"1052",4059959,4062621,"You think that's my idea of a good time?","Daddy Day Care"
"1053",4062729,4064890,"I love passive-aggressive losers.","Daddy Day Care"
"1054",4068534,4072903,"According to state regulations,a child-care center in a family home...","Daddy Day Care"
"1055",4073006,4076032,"is limited to a maximum of 12 children.","Daddy Day Care"
"1056",4076709,4081237,"- We have plenty of room here for these kids.- I don't make the rules, I enforce them.","Daddy Day Care"
"1057",4081347,4084544,"You can't have more than 12 kidsat this kind of location.","Daddy Day Care"
"1058",4084650,4087676,"So if we want to stay in business,we have to fire two kids.","Daddy Day Care"
"1059",4087787,4092190,"Unless you want to move to a permanentfacility somewhere else, then yes.","Daddy Day Care"
"1060",4098564,4100725,"So, who do we cut loose?","Daddy Day Care"
"1061",4101134,4103125,"How about Becca and Jamie?","Daddy Day Care"
"1062",4104303,4105793,"I can't do it.","Daddy Day Care"
"1063",4106739,4108639,"We got to do something.","Daddy Day Care"
"1064",4109409,4111707,"Why don't we get a bigger space?","Daddy Day Care"
"1065",4112211,4115374,"""Space. The Final Frontier.""","Daddy Day Care"
"1066",4115481,4118177,"I'm serious. Harridan said we're not real.Let's get real.","Daddy Day Care"
"1067",4118284,4120946,"Let's get a bigger space, more kids,hire more people...","Daddy Day Care"
"1068",4121054,4122817,"and give this woman a run for her money.","Daddy Day Care"
"1069",4122922,4125789,"- Great. Let's get a new space.- Yeah, Final Frontier!","Daddy Day Care"
"1070",4125892,4129794,"If you don't stop with that Star Trek,I'll push you in that sticker bush. Stop!","Daddy Day Care"
"1071",4129896,4134333,"No! I'm saying that there is a space availablecalled ""The Final Frontier.""","Daddy Day Care"
"1072",4135101,4137467,"This used to be my home away from home.","Daddy Day Care"
"1073",4137837,4142570,"Jerry, the guy who owned this place,had the ultimate collection of memorabilia.","Daddy Day Care"
"1074",4143409,4145707,"You know what he had? Tricorder.","Daddy Day Care"
"1075",4146279,4149271,"That Ensign Riley worein The Doomsday Machine.","Daddy Day Care"
"1076",4149449,4151713,"Yeah. I never saw that episode.","Daddy Day Care"
"1077",4152518,4154884,"I was with him, not watching also.","Daddy Day Care"
"1078",4157690,4159180,"Needs a lot of work.","Daddy Day Care"
"1079",4159292,4162193,"That just means we can fix it uphow we want to fix it up.","Daddy Day Care"
"1080",4162295,4164855,"But we'll need some money to do that.","Daddy Day Care"
"1081",4165698,4167689,"To make money, you got to spend money.","Daddy Day Care"
"1082",4167800,4170428,"To spend money, you got to have money.","Daddy Day Care"
"1083",4171404,4173463,"""Rock for Daddy Day Care.","Daddy Day Care"
"1084",4173906,4176875,"""Help us finance our new permanent home.""","Daddy Day Care"
"1085",4177477,4179570,"Do you know what this means?","Daddy Day Care"
"1086",4180313,4183749,"It's a chance to improve ourselvesthrough a little healthy competition?","Daddy Day Care"
"1087",4183850,4187149,"No, you bubbleheaded idiot.It's a death sentence.","Daddy Day Care"
"1088",4187520,4190546,"If they get their handson a big enough space, they'll ruin me.","Daddy Day Care"
"1089",4190656,4193682,"They're selling fun. I can't compete with fun.","Daddy Day Care"
"1090",4196729,4199823,"I should've crushed themin the beginning when they were weak.","Daddy Day Care"
"1091",4199932,4203891,"It'll be harder now, but I have no choice.I've got to stop them.","Daddy Day Care"
"1092",4205471,4207462,"How are you gonna do that?","Daddy Day Care"
"1093",4208341,4210138,"By any means necessary.","Daddy Day Care"
"1094",4227460,4229189,"Yeah, ride the pony.","Daddy Day Care"
"1095",4230496,4231929,"Pet the goat.","Daddy Day Care"
"1096",4232932,4235492,"Get a T-shirt made. Something to eat.","Daddy Day Care"
"1097",4236169,4237500,"Enjoy the music!","Daddy Day Care"
"1098",4288054,4291820,"- They're showing Logan's Run, Friday...- Friday night at 8:00.","Daddy Day Care"
"1099",4294060,4296153,"If you're not busy Friday nights...","Daddy Day Care"
"1100",4297196,4300131,"- maybe you'd like to...- Yeah, sure.","Daddy Day Care"
"1101",4300766,4301790,"Great.","Daddy Day Care"
"1102",4301901,4304836,"So we're talking, like,just dinner, bath, bed?","Daddy Day Care"
"1103",4304937,4307235,"- The works?- What?","Daddy Day Care"
"1104",4307340,4310434,"You want me to baby-sitso you can go to the movie, right?","Daddy Day Care"
"1105",4310543,4313205,"Marvin, I want you to go with me.","Daddy Day Care"
"1106",4316549,4317641,"Okay.","Daddy Day Care"
"1107",4318484,4322352,"- Okay. Great.- All right. Here's your thing.","Daddy Day Care"
"1108",4328694,4332186,"Thank you very much. Okay. There you go.","Daddy Day Care"
"1109",4341641,4343074,"I don't think we should do this.","Daddy Day Care"
"1110",4343175,4346611,"Jennifer, my dear, in life there arewinners and there are losers.","Daddy Day Care"
"1111",4346712,4349806,"And if you want to be a winner,sometimes you have to play dirty.","Daddy Day Care"
"1112",4374273,4378505,"I'll show you. I'll paint my face first.And then you paint yourself.","Daddy Day Care"
"1113",4378678,4381772,"See? Put a little paint.And I'm just going to...","Daddy Day Care"
"1114",4382248,4383772,"What's wrong?","Daddy Day Care"
"1115",4385484,4388180,"That's not paint! It's glue!","Daddy Day Care"
"1116",4409008,4411636,"Could I have some moreof this delicious potato salad?","Daddy Day Care"
"1117",4411744,4414679,"Have you tried it? Really. It is so good.","Daddy Day Care"
"1118",4417583,4420074,"- What's up?- Look.","Daddy Day Care"
"1119",4420353,4423186,"And they got into everythingexcept for the pies.","Daddy Day Care"
"1120",4423356,4426985,"Okay, but don't panic.We'll just sell the people pies, that's all.","Daddy Day Care"
"1121",4429228,4431321,"Wow. Goats really love pie.","Daddy Day Care"
"1122",4436936,4439029,"Leave them on for two hours.","Daddy Day Care"
"1123",4439438,4440769,"You got it.","Daddy Day Care"
"1124",4442475,4446502,"Everybody just take a deep breathand let's go back to having fun.","Daddy Day Care"
"1125",4447213,4448271,"Okay?","Daddy Day Care"
"1126",4462995,4466692,"- How'd we do?- We haven't even put a dent in it.","Daddy Day Care"
"1127",4472805,4475330,"- Hello?- Charlie, Jim Fields.","Daddy Day Care"
"1128",4475474,4478466,"How's your vacation going?No, I'm just pulling your leg.","Daddy Day Care"
"1129",4478577,4481273,"Listen, buddy,are you still looking for work?","Daddy Day Care"
"1130",4481414,4484178,"I've got a job for you,unless you've got other offers.","Daddy Day Care"
"1131",4484283,4487446,"No, that's really interesting.","Daddy Day Care"
"1132",4487553,4489578,"But I've got something going on right now.","Daddy Day Care"
"1133",4489789,4492189,"Before you say no,let me fax you over the proposal.","Daddy Day Care"
"1134",4492291,4495124,"You can take a look at the numbers,you think about it...","Daddy Day Care"
"1135",4495227,4496785,"then you get back to me.","Daddy Day Care"
"1136",4496896,4499262,"- Yeah.- Okay. Great.","Daddy Day Care"
"1137",4499498,4502399,"You say hi to the wife and daughter... Son.","Daddy Day Care"
"1138",4516215,4519048,"Let me guess. You couldn't getchild services to come back...","Daddy Day Care"
"1139",4519151,4520413,"so you're doing the inspection.","Daddy Day Care"
"1140",4520519,4523181,"I apologize. I don't like to be sneaky.","Daddy Day Care"
"1141",4523422,4525287,"Still, rules are rules.","Daddy Day Care"
"1142",4525524,4529620,"- May I come in? I've a proposition for you.- Yeah, please do.","Daddy Day Care"
"1143",4531330,4535767,"Can I get you some coffee or tea or water...","Daddy Day Care"
"1144",4536669,4538864,"- or eye of newt, maybe?- Water would be lovely.","Daddy Day Care"
"1145",4538971,4541599,"- Thank you.- Water. That's an easy one.","Daddy Day Care"
"1146",4541907,4546173,"You don't mind tap water, do you?We're out of the bottled water.","Daddy Day Care"
"1147",4551917,4554408,"So, Miss Harridan, why are you here?","Daddy Day Care"
"1148",4555588,4559422,"You seem smart, talented, highly ambitious.","Daddy Day Care"
"1149",4559825,4562350,"What on earth are you doingrunning a day care center?","Daddy Day Care"
"1150",4562461,4564861,"Maybe I enjoy running a day care center.","Daddy Day Care"
"1151",4564964,4568798,"Obviously. But is this really how you wantto spend the rest of your life?","Daddy Day Care"
"1152",4568901,4572598,"As a businessman,you'd have money, power, respect.","Daddy Day Care"
"1153",4573172,4576471,"You going to throw that all awayto baby-sit a bunch of 3-year-olds?","Daddy Day Care"
"1154",4576575,4580534,"I said I'd listen to your proposition.I'm all ears, and I got other things to do.","Daddy Day Care"
"1155",4580646,4583638,"- So if you'd be so kind...- All right. Here it is:","Daddy Day Care"
"1156",4584116,4587517,"If Daddy Day Care should close,for whatever reason...","Daddy Day Care"
"1157",4587920,4591253,"I'll take all your childrenfor the price you charge.","Daddy Day Care"
"1158",4591390,4594621,"Topflight education at rock-bottom prices.","Daddy Day Care"
"1159",4595127,4596617,"Think about it.","Daddy Day Care"
"1160",4600566,4602193,"Now wait a minute.","Daddy Day Care"
"1161",4602868,4605496,"You're blowing us offfor Cottony Cotton Balls?","Daddy Day Care"
"1162",4605604,4609870,"No, Cotton Candy Puffs.Apparently the whole thing was my idea.","Daddy Day Care"
"1163",4609975,4612443,"They'll double my salaryand let me run the division.","Daddy Day Care"
"1164",4612545,4614513,"So, yes, I am taking myself back.","Daddy Day Care"
"1165",4614613,4617514,"Go ahead,if that's what's important to you. I mean...","Daddy Day Care"
"1166",4617616,4621313,"Phil and I can manage.We'll just find somebody else. Right?","Daddy Day Care"
"1167",4621854,4623321,"I'm going, too.","Daddy Day Care"
"1168",4624623,4628821,"This is worse thanwhen Spock betrayed Kirk...","Daddy Day Care"
"1169",4628928,4631556,"- on Star Trek V.- It's not like that.","Daddy Day Care"
"1170",4631664,4635623,"Come back with us. Not in the mailroom,but to be part of our team.","Daddy Day Care"
"1171",4635734,4638703,"I don't want to be on that team.I want to be on this team.","Daddy Day Care"
"1172",4638804,4642331,"We thought a lot about this, man.It's a great opportunity.","Daddy Day Care"
"1173",4642441,4645410,"No, this right here is a great opportunity.","Daddy Day Care"
"1174",4645511,4649811,"This business is the one that has limits.And we've reached them, okay?","Daddy Day Care"
"1175",4649915,4652213,"Me and Phil,we got responsibilities to think about.","Daddy Day Care"
"1176",4652318,4657153,"- We got futures to take into consideration.- What about now? What about the kids?","Daddy Day Care"
"1177",4658557,4660525,"These kids were fine before Daddy Day Care.","Daddy Day Care"
"1178",4660626,4664653,"- They'll be fine when it's over.- You tell yourself that, Charlie.","Daddy Day Care"
"1179",4665364,4667958,"I finally found a place where I fit in...","Daddy Day Care"
"1180",4668067,4671332,"where I feel like I'm doing something good,and you guys just...","Daddy Day Care"
"1181",4671437,4673268,"You just spoil it all.","Daddy Day Care"
"1182",4680112,4682012,"That couldn't have gone worse.","Daddy Day Care"
"1183",4682114,4685277,"If you think that went bad,wait till we tell the kids.","Daddy Day Care"
"1184",4701567,4703330,"Can I go to work with you?","Daddy Day Care"
"1185",4703435,4706893,"No, you can't go to work with me,but you can come visit me at work.","Daddy Day Care"
"1186",4707006,4709668,"And Daddy will be home at nightand on the weekends.","Daddy Day Care"
"1187",4709775,4714337,"- We'll still have lots of fun together.- Will Phil and Marvin still be here?","Daddy Day Care"
"1188",4714513,4718005,"No, I'm sorry, little man.They won't be around anymore.","Daddy Day Care"
"1189",4718884,4721478,"It's just for a while, right?","Daddy Day Care"
"1190",4721587,4725250,"Then you're going to come backand do Daddy Day Care again.","Daddy Day Care"
"1191",4726725,4729159,"No, this is from now on.","Daddy Day Care"
"1192",4729261,4732458,"Daddy Day Care,we're not doing that anymore, Ben.","Daddy Day Care"
"1193",4734566,4736431,"Let me explain it to you like this:","Daddy Day Care"
"1194",4736535,4739663,"If Daddy does this, I can get money for us.","Daddy Day Care"
"1195",4739938,4743840,"And I can use that moneyto take care of the house and to buy food...","Daddy Day Care"
"1196",4743942,4746740,"and clothes and toys for you to play with.","Daddy Day Care"
"1197",4747179,4749511,"I'll sell all my toys.","Daddy Day Care"
"1198",4750015,4752483,"Why you want to sell all your toys?","Daddy Day Care"
"1199",4752685,4757452,"If I don't have toys, we don't need money,and you can stay with me.","Daddy Day Care"
"1200",4760726,4762990,"I wish it was that simple, Ben.","Daddy Day Care"
"1201",4766498,4770127,"The development department will havethe first samples ready by next week.","Daddy Day Care"
"1202",4770235,4772294,"Okay, let's kick it around.","Daddy Day Care"
"1203",4772638,4775573,"What do you think ofwhen you think of cotton candy?","Daddy Day Care"
"1204",4775674,4777665,"- Clowns.- Chocolate.","Daddy Day Care"
"1205",4779244,4780472,"Cavities.","Daddy Day Care"
"1206",4781980,4784881,"Hyperactivity, cavities, and dentist bills.That's what I...","Daddy Day Care"
"1207",4784983,4787679,"I've been to the other sideand I've seen firsthand.","Daddy Day Care"
"1208",4787786,4791745,"When kids eat this stuff, they crash downso hard they need an air bag.","Daddy Day Care"
"1209",4791857,4794223,"You know whatthe ingredients are to these balls?","Daddy Day Care"
"1210",4794326,4796294,"- Puffs.- They're ""puffs."" I'm sorry.","Daddy Day Care"
"1211",4796395,4798989,"You know what's in here?Red dye number four and sugar.","Daddy Day Care"
"1212",4799098,4802590,"You know what? Charlie is absolutely right.You can't ignore the reality.","Daddy Day Care"
"1213",4802701,4805795,"Parents are not going to want to buythis product for their kids.","Daddy Day Care"
"1214",4805904,4809032,"Not unless those kids stomp and scream...","Daddy Day Care"
"1215",4809241,4813803,"and bang their little heads on the floortill blood comes out of their ears.","Daddy Day Care"
"1216",4813946,4816210,"Charlie, you got those figuresthat I gave you?","Daddy Day Care"
"1217",4816315,4819443,"Yeah, I got them right here.Just give me a second to...","Daddy Day Care"
"1218",4820352,4823810,"We had an independent marketing firmdo some preliminary research...","Daddy Day Care"
"1219",4823922,4826857,"to sort out the core value of this product.","Daddy Day Care"
"1220",4827459,4830223,"The subjects that were tested,aged two to six...","Daddy Day Care"
"1221",4830329,4832559,"which are key branding years...","Daddy Day Care"
"1222",4834032,4838264,"- Charlie, you want to join us?- I'm sorry about that, Jim. Yeah.","Daddy Day Care"
"1223",4839304,4842762,"Why don't you tell everybodywhat the core value is?","Daddy Day Care"
"1224",4843008,4845306,"What's the most important thing?","Daddy Day Care"
"1225",4849047,4850207,"My kid.","Daddy Day Care"
"1226",4855654,4858623,"My kid, Jim, that's the most important thing.","Daddy Day Care"
"1227",4859491,4862392,"And I think I've made a tremendous mistake.","Daddy Day Care"
"1228",4862961,4865987,"And so, I quit.","Daddy Day Care"
"1229",4870335,4872769,"What are you doing to me? You scared me.","Daddy Day Care"
"1230",4872871,4875533,"- How was the marketing meeting?- I quit.","Daddy Day Care"
"1231",4876608,4878075,"- What?- I quit.","Daddy Day Care"
"1232",4878544,4880307,"- You quit?- I quit and I feel great.","Daddy Day Care"
"1233",4880412,4882312,"- You should quit with me.- I should quit?","Daddy Day Care"
"1234",4882414,4884473,"- You should quit right now.- We just got here.","Daddy Day Care"
"1235",4884583,4887074,"You want to feel how I'm feeling?Quit. Come on.","Daddy Day Care"
"1236",4887186,4889654,"- Quit!- Quit with me.","Daddy Day Care"
"1237",4898030,4901466,"You weren't going to sell the carrot suit,were you? The kids love that.","Daddy Day Care"
"1238",4912744,4914177,"This stuff...","Daddy Day Care"
"1239",4915480,4917573,"is not for sale!","Daddy Day Care"
"1240",4918750,4918784,"A literal reader of the text might say...","Daddy Day Care"
"1241",4918784,4921548,"A literal reader of the text might say...","Daddy Day Care"
"1242",4921653,4924884,"that Goldilocks ate the ""porridge""...","Daddy Day Care"
"1243",4924990,4927754,"because she was ""hungry.""","Daddy Day Care"
"1244",4928460,4930428,"But what would Freud say?","Daddy Day Care"
"1245",4931129,4935156,"Language skills are a critical componentof childhood development.","Daddy Day Care"
"1246",4935267,4938100,"They're part of the core curriculumhere at Chapman.","Daddy Day Care"
"1247",4938203,4940068,"If you'll follow me this way.","Daddy Day Care"
"1248",4941240,4945233,"On the path of life,the proper first steps are essential.","Daddy Day Care"
"1249",4945878,4948904,"With our firm guidance, your children...","Daddy Day Care"
"1250",4949248,4952183,"will take those steps right here at Chapman.","Daddy Day Care"
"1251",4952484,4956113,"Our philosophy is thata child is like a climbing vine.","Daddy Day Care"
"1252",4956688,4959885,"With structure to cling to,and the right gardener to tend them...","Daddy Day Care"
"1253",4959992,4963951,"- they'll grow to the sky.- That's the dumbest thing I ever heard.","Daddy Day Care"
"1254",4964997,4967659,"We're not talking about plants,we're talking about kids.","Daddy Day Care"
"1255",4967766,4971896,"I know you don't want this woman pruningand cutting and weeding your 3-year-olds.","Daddy Day Care"
"1256",4972004,4974438,"Some people are uncomfortablewith achievement.","Daddy Day Care"
"1257",4974539,4979101,"No, what I'm uncomfortable withis treating a little kid like it's an adult.","Daddy Day Care"
"1258",4979344,4982905,"If your kids come here, they'll bemiserable in four different languages.","Daddy Day Care"
"1259",4983015,4985882,"Five. We start Portuguese in the fall.","Daddy Day Care"
"1260",4987786,4989947,"How many languagesdo you listen to them in?","Daddy Day Care"
"1261",4990055,4993855,"You ever stop trying to shove knowledgedown their throat and just talk to them?","Daddy Day Care"
"1262",4993959,4995449,"Listen to what they want.","Daddy Day Care"
"1263",4995560,4997755,"They're children,they don't know what they want.","Daddy Day Care"
"1264",4997863,5001663,"Yes, they do know what they want.All of them. And they're all different.","Daddy Day Care"
"1265",5001767,5004668,"We took some time, talked to the kids,got to know them a bit.","Daddy Day Care"
"1266",5004770,5008866,"- It made a difference. It helped them.- Please. Share your success.","Daddy Day Care"
"1267",5008974,5013104,"Why don't you tell these people exactlyhow you help their children?","Daddy Day Care"
"1268",5018417,5021614,"Max over here is potty-trained now, okay?","Daddy Day Care"
"1269",5021720,5022948,"- I don't miss.- That's right.","Daddy Day Care"
"1270",5023055,5026513,"- And Becca learned how to read.- Yes, I did.","Daddy Day Care"
"1271",5026925,5030656,"And Crispin is the most polite kidyou'd ever want to meet.","Daddy Day Care"
"1272",5030963,5034399,"- Thank you, Charlie.- You are most welcome, Crispin.","Daddy Day Care"
"1273",5034766,5037064,"And I made friends.","Daddy Day Care"
"1274",5039538,5042632,"That's right, little man,you made some friends.","Daddy Day Care"
"1275",5043475,5048208,"As of this moment Daddy Day Careis back in business.","Daddy Day Care"
"1276",5051283,5056152,"- Don't be a fool. You won't make a nickel.- We might not get rich, but we'll manage.","Daddy Day Care"
"1277",5056254,5058188,"Excuse me. All right.","Daddy Day Care"
"1278",5058757,5060247,"How about that?","Daddy Day Care"
"1279",5065864,5070426,"Any boob can run a child-care center.It takes a family to raise some children.","Daddy Day Care"
"1280",5070535,5075199,"- We're going to be a family from now on.- Family? What a laughable concept!","Daddy Day Care"
"1281",5075640,5077665,"We'll just laugh our way down the driveway.","Daddy Day Care"
