"id","startTime","endTime","text","title"
"679",2591192,2594218,"I'm serious. We know nothingabout running a day care center.","Daddy Day Care"
"680",2594328,2596728,"We don't know anything.We're not even good parents!","Daddy Day Care"
"681",2596831,2598492,"I'm a good parent.","Daddy Day Care"
"682",2600201,2601600,"- What does that mean?- What?","Daddy Day Care"
"683",2601702,2603693,"That thing. What is that?","Daddy Day Care"
"684",2604605,2608701,"You know that rocket ship thing you do?Ben doesn't even like that.","Daddy Day Care"
"685",2608876,2611845,"That just happens to be Ben's favorite thing.","Daddy Day Care"
"686",2611946,2616747,"He lets you do it because you like it.It's the one time you pay him attention.","Daddy Day Care"
"687",2616851,2619615,"- You don't change your kid's diapers.- I don't like diapers.","Daddy Day Care"
"688",2619720,2622518,"You should teach your kidhow to go to the toilet and aim...","Daddy Day Care"
"689",2622623,2625057,"so we don't have to redecorate the placewhen he goes.","Daddy Day Care"
"690",2625159,2626319,"You're right.","Daddy Day Care"
"691",2626427,2627519,"Let me tell you something.","Daddy Day Care"
"692",2627628,2630062,"My kid is 4 years old,and for the first time today...","Daddy Day Care"
"693",2630164,2633361,"I saw him playing with the other kids,just being a normal kid.","Daddy Day Care"
"694",2633467,2635867,"It felt great knowingI had something to do with it.","Daddy Day Care"
"695",2635970,2636959,"We did that!","Daddy Day Care"
"696",2637071,2640905,"If we can do that, we can definitelyget this place up to code by dawn.","Daddy Day Care"
"697",2642376,2644139,"Let's go safety gate crazy.","Daddy Day Care"
"698",2644612,2646443,"Don't worry, he'll be fine.","Daddy Day Care"
"699",2646647,2648046,"It's all right.","Daddy Day Care"
"700",2652420,2655082,"- All I got is $5.- I can break that.","Daddy Day Care"
"701",2656357,2660384,"Listen, I left the paperworkon the kitchen table. It's not there.","Daddy Day Care"
"702",2660494,2661984,"Please tell me you have it.","Daddy Day Care"
"703",2662096,2663393,"I don't have it.","Daddy Day Care"
"704",2673140,2675370,"- Hey, guys.- Marvin, what are you doing here?","Daddy Day Care"
"705",2675476,2678934,"The door was unlocked.I got your final paychecks here.","Daddy Day Care"
"706",2679246,2680440,"Thanks.","Daddy Day Care"
"707",2681549,2683244,"So, what's going on here?","Daddy Day Care"
"708",2686020,2687510,"Don't even ask.","Daddy Day Care"
"709",2702003,2703595,"You can understand him?","Daddy Day Care"
"710",2703704,2705569,"Yeah, he's speaking Klingon.","Daddy Day Care"
"711",2705673,2708369,"That's Klingon.I thought the kid was an idiot.","Daddy Day Care"
"712",2708476,2711104,"God, how much Star Trekdoes that kid watch?","Daddy Day Care"
"713",2711212,2714306,"- Too much.- The guy from Child Services is here.","Daddy Day Care"
"714",2715449,2717679,"- Sorry.- No, listen. Why don't you do me a favor?","Daddy Day Care"
"715",2717785,2720481,"Why don't you take the kids in the backand play with them?","Daddy Day Care"
"716",2720588,2723523,"Keep their attention for a while,while I talk to this guy.","Daddy Day Care"
"717",2723624,2727720,"Whatever you do, don't let this big bruiserget near the lawnmower. Thanks.","Daddy Day Care"
"718",2729296,2731856,"- Mr. Kubitz. Hi.- I thought I was early, but...","Daddy Day Care"
"719",2731966,2735231,"- I was just getting the paperwork.- Great.","Daddy Day Care"
"720",2736203,2738398,"- You dropped something.- Yeah.","Daddy Day Care"
"721",2740207,2742971,"- The kids wanted to help out.- That's sweet.","Daddy Day Care"
"722",2743077,2745136,"So here's everything for you.","Daddy Day Care"
"723",2745246,2748807,"What I'll need is your signatureon the back of her head.","Daddy Day Care"
"724",2749483,2751678,"And on the elbow of this kid.","Daddy Day Care"
"725",2751786,2754277,"- Do you have a pen?- I do have a pen.","Daddy Day Care"
"726",2755256,2757622,"- This is my lucky pen.- Thank you.","Daddy Day Care"
"727",2758192,2761184,"- And where's on the...- Initial the elbow.","Daddy Day Care"
"728",2762063,2764429,"- Sign the back of her head.- On her neck?","Daddy Day Care"
"729",2765366,2767994,"- Great. That should just about do it.- Here we go.","Daddy Day Care"
"730",2768102,2771367,"- You're ready to roll.- Let's go in and get started.","Daddy Day Care"
"731",2772807,2776038,"Well, you know,everything looks okay here...","Daddy Day Care"
"732",2776177,2779203,"but it says herethat you now have 11 children.","Daddy Day Care"
"733",2779714,2781079,"That's correct.","Daddy Day Care"
"734",2781182,2784447,"So I assume that you've hireda third care provider.","Daddy Day Care"
"735",2785786,2787151,"Why would you just assume that?","Daddy Day Care"
"736",2787254,2791418,"Well, section 768 of the Child Welfare Codespecifically states...","Daddy Day Care"
"737",2791759,2795627,"that the ratio of children to care providerscannot exceed 5:1.","Daddy Day Care"
"738",2796163,2798063,"- The 768.04.- 768.04.","Daddy Day Care"
"739",2798165,2801862,"The ratio thingy.We resolved that this morning.","Daddy Day Care"
"740",2801969,2803061,"- Good.- Yes.","Daddy Day Care"
"741",2803170,2805900,"We hired someone. We hired Marvin.","Daddy Day Care"
"742",2808242,2812941,"- Marvin was hired! He's with the kids.- He's an excellent child-care worker.","Daddy Day Care"
"743",2813047,2815982,"I'd love to take a look,if that's okay with you.","Daddy Day Care"
"744",2816083,2819883,"- You want to go out there?- It'll be good for me to see for myself.","Daddy Day Care"
"745",2819987,2822114,"Let's go and have a look at Marvin.","Daddy Day Care"
"746",2827995,2830657,"Now, put your hands up. Now, wave them.","Daddy Day Care"
"747",2833534,2836628,"He certainly seems likehe knows what he's doing.","Daddy Day Care"
"748",2836737,2837897,"Of course.","Daddy Day Care"
"749",2838005,2841463,"- I've got to say that.- Yeah, we interviewed a lot of people.","Daddy Day Care"
"750",2841575,2845204,"Yeah, it was a really long, gruelingsingling-out process.","Daddy Day Care"
"751",2851018,2852713,"And now, I'm a chicken.","Daddy Day Care"
"752",2852820,2855687,"I'm a bird. Look, I'm a bird.","Daddy Day Care"
"753",2856590,2859787,"You can never be too carefulwhen it comes to kids.","Daddy Day Care"
"754",2859894,2864388,"And here at Daddy Day Care we'll only workwith the best, so we got Marvin.","Daddy Day Care"
"755",2867134,2868260,"Sorry.","Daddy Day Care"
"756",2871071,2873301,"- What did you do to these kids?- What?","Daddy Day Care"
"757",2873407,2876843,"- Are they on drugs?- Well, there's this one kid, maybe.","Daddy Day Care"
"758",2876944,2879242,"How'd you get them to behave like this?","Daddy Day Care"
"759",2879346,2882406,"- Got to know how to handle them.- How do you know that?","Daddy Day Care"
"760",2882516,2885383,"I readDr. Spock's Baby and Child Care book.","Daddy Day Care"
"761",2887087,2889055,"It's not about Star Trek.","Daddy Day Care"
"762",2891592,2893059,"- Finish.- Yeah.","Daddy Day Care"
"763",2897064,2899362,"You know, when I was in the back...","Daddy Day Care"
"764",2899466,2902867,"I spotted, under the eaves of the porch...","Daddy Day Care"
"765",2902970,2904835,"what looked like a beehive.","Daddy Day Care"
"766",2904939,2907737,"- A big one.- Don't worry. All taken care of.","Daddy Day Care"
"767",2907842,2910208,"- I don't want anybody getting hurt.- No hurt. Gone.","Daddy Day Care"
"768",2910311,2913940,"- You really have turned this around.- Thank you very much.","Daddy Day Care"
"769",2914048,2916278,"- I'm impressed. I really am.- Thank you.","Daddy Day Care"
"770",2916383,2917873,"For our own curiosity...","Daddy Day Care"
"771",2917985,2921318,"any chance you couldtell us where the complaint came from?","Daddy Day Care"
"772",2921422,2925950,"I really would love to,but I have a relationship with the state.","Daddy Day Care"
"773",2926060,2929393,"- Just for our own curiosity.- That was Miss Harridan.","Daddy Day Care"
"774",2929597,2932589,"- I'm sure she'll see us.- We need to talk to you.","Daddy Day Care"
"775",2932700,2936727,"- Sorry. They just barged right in.- That's quite all right, Jenny.","Daddy Day Care"
"776",2936871,2938930,"Gentlemen, please sit down.","Daddy Day Care"
"777",2942643,2944804,"Now, what can I do for you?","Daddy Day Care"
"778",2945312,2949612,"We wanted to thank you for helpingto expedite our accreditation process.","Daddy Day Care"
"779",2949717,2952914,"Thanks to your tip, somebodyfrom child services came to see us.","Daddy Day Care"
"780",2953020,2956456,"I had heard you openedsome sort of day care program...","Daddy Day Care"
"781",2956924,2958653,"and I was concerned.","Daddy Day Care"
"782",2958759,2961523,"That's nice of you.You don't have to be concerned about us.","Daddy Day Care"
"783",2961629,2965497,"It's not you I'm concerned about.It's the children you're looking after.","Daddy Day Care"
"784",2965599,2969763,"- Wait a minute. We're parents. That's a start.- Any boob can be a parent.","Daddy Day Care"
"785",2969870,2972532,"If you want to screw up your own child,that's your right.","Daddy Day Care"
"786",2972640,2976736,"But when it comes to other people's kids,there's a higher standard to answer to.","Daddy Day Care"
"787",2976844,2981042,"Mr. Kubitz seems to think that we metthat standard. Show her the thing.","Daddy Day Care"
"788",2981148,2983810,"That piece of paper doesn't impress me.","Daddy Day Care"
"789",2984485,2986476,"We're getting it laminated.","Daddy Day Care"
"790",2986587,2990751,"You two are just some fly-by-nightoperation looking to make a fast buck.","Daddy Day Care"
"791",2990858,2993486,"You're just afraid of the competition.Let's go.","Daddy Day Care"
"792",2993594,2996188,"Competition? Don't flatter yourselves.","Daddy Day Care"
"793",2996563,3000693,"Daddy Day Care will never bein the same league as this institution.","Daddy Day Care"
"794",3001869,3003166,"Laminated!","Daddy Day Care"
"795",3004471,3007031,"That wasn't as satisfying as I thought.","Daddy Day Care"
"796",3007141,3010838,"I think we can take her. All we needis some garlic and a wooden stake.","Daddy Day Care"
"797",3010945,3013277,"You know what she said that was right?","Daddy Day Care"
"798",3013380,3016679,"These kids need more than watching.Tomorrow we'll take it up a notch.","Daddy Day Care"
"799",3016784,3019048,"We got to start stimulating their minds.","Daddy Day Care"
"800",3022022,3024388,"- But I'm not a daddy.- You don't have to be a daddy.","Daddy Day Care"
"801",3024491,3028086,"You're a male-type humanoid.That fits in with the philosophy of the place.","Daddy Day Care"
"802",3028195,3031596,"I don't know, guys. I mean,I guess I like hanging out with the kids.","Daddy Day Care"
"803",3031699,3032927,"It's kind of cool.","Daddy Day Care"
"804",3033033,3036332,"But I guess child-care wasn't necessarily...","Daddy Day Care"
"805",3036437,3039531,"an avenue that I felt professionallyI was headed towards.","Daddy Day Care"
"806",3039640,3042165,"- That's exactly what I said.- Excuse me.","Daddy Day Care"
"807",3042276,3043607,"Yes, come on in!","Daddy Day Care"
"808",3045879,3047972,"- How are you?- Hey, guys.","Daddy Day Care"
"809",3048082,3051108,"I am so sorry.I forgot to write you a check this week.","Daddy Day Care"
"810",3051218,3054346,"Ever since the divorce,my head's just been like...","Daddy Day Care"
"811",3059693,3062355,"- Are you the new daddy?- I'm your daddy.","Daddy Day Care"
"812",3065399,3067094,"I'm not your daddy.","Daddy Day Care"
"813",3067901,3070495,"Well, I'm your baby's daddy. I'm not...","Daddy Day Care"
"814",3071105,3074541,"I'm not your baby's daddy.I'm going to be...","Daddy Day Care"
"815",3077344,3078811,"You're Marvin.","Daddy Day Care"
"816",3082316,3086184,"Well, it's nice to meet you, Marvin. I'm Kelli.","Daddy Day Care"
"817",3087054,3088419,"Dylan's mom.","Daddy Day Care"
"818",3093861,3095556,"- I got to run.- Thank you.","Daddy Day Care"
"819",3095662,3097892,"- All right. Bye, guys.- Have a good one.","Daddy Day Care"
"820",3097998,3099795,"- Thanks.- Bye.","Daddy Day Care"
"821",3099900,3102300,"I'm in. Do you have a dental plan?","Daddy Day Care"
"822",3103270,3104498,"All right.","Daddy Day Care"
"823",3104805,3108172,"Your first assignment is to show ushow you handle kids the way you do.","Daddy Day Care"
"824",3108275,3109264,"Teach us.","Daddy Day Care"
"825",3109376,3111901,"If this were a business,and they were customers...","Daddy Day Care"
"826",3112012,3113536,"how do you find out what they want?","Daddy Day Care"
"827",3113647,3116707,"- I'd put together a focus group.- All right, let's do it.","Daddy Day Care"
"828",3116817,3116850,"We'd like you to tell us what you'd liketo get out of Daddy Day Care.","Daddy Day Care"
"829",3116850,3120445,"We'd like you to tell us what you'd liketo get out of Daddy Day Care.","Daddy Day Care"
"830",3120554,3123318,"Help us to help you.","Daddy Day Care"
"831",3123724,3125453,"Who'd like to start?","Daddy Day Care"
"832",3127461,3129929,"We need more learning about things.","Daddy Day Care"
"833",3130264,3133062,"- More learning about things?- Yes.","Daddy Day Care"
"834",3133167,3135863,"We're at a very critical age.","Daddy Day Care"
"835",3135969,3140565,"- You have to feed our minds.- All right. You want to write that down?","Daddy Day Care"
"836",3140674,3143472,"""Feed our minds.""","Daddy Day Care"
"837",3143710,3146508,"Great. Okay, what else?","Daddy Day Care"
"838",3147548,3150608,"Dolphins. Dolphins are good.","Daddy Day Care"
"839",3150784,3153184,"- Dolphins are fish.- No, they're not.","Daddy Day Care"
"840",3153287,3156415,"- They live in water.- That doesn't mean they're fish.","Daddy Day Care"
"841",3156523,3160960,"Calm down and talk about something else.What else would you like to talk about?","Daddy Day Care"
"842",3161061,3163052,"Where do babies come from?","Daddy Day Care"
"843",3164565,3167398,"Let's go back to the dolphin subjectand discuss dolphins...","Daddy Day Care"
"844",3167501,3170629,"or if there's anything elseon someone's mind we can talk about...","Daddy Day Care"
"845",3170737,3173433,"- other than that.- Write that down.","Daddy Day Care"
"846",3174141,3176701,"- Okay, what else?- Could we...","Daddy Day Care"
"847",3178112,3180410,"What were you going to say, Ben?","Daddy Day Care"
"848",3180881,3184078,"I can see you were going to say something.What is it, son?","Daddy Day Care"
"849",3184218,3185412,"More...","Daddy Day Care"
"850",3187121,3189419,"- drawing?- More drawings?","Daddy Day Care"
"851",3189523,3193687,"Yeah! Like pictures and stuff. It's really fun.","Daddy Day Care"
"852",3195562,3199589,"- Okay, yeah, great. More drawings.- Yeah!","Daddy Day Care"
"853",3199700,3202897,"- More chasing bad guys.- Excellent idea.","Daddy Day Care"
"854",3203003,3204436,"We can chase Joker.","Daddy Day Care"
"855",3204538,3207132,"Well, wait a second, buddy.That's Batman's bad guy.","Daddy Day Care"
"856",3207241,3210074,"You're Flash,so you want to be chasing...","Daddy Day Care"
"857",3210177,3213340,"- Lex Luthor?- No. That's Superman.","Daddy Day Care"
"858",3213447,3217850,"You want to be chasing Captain Boomerang,Gorilla Grodd, Reverse Flash.","Daddy Day Care"
"859",3217951,3219316,"The Riddler?","Daddy Day Care"
"860",3220554,3222317,"What have you been doing to these kids?","Daddy Day Care"
"861",3344845,3349612,"Starting tomorrow, Phil will be hostinga Three Stooges film festival in the TV room.","Daddy Day Care"
"862",3349716,3352048,"I know everybody's looking forwardto that, right?","Daddy Day Care"
"863",3352152,3353141,"Thanks, Daddy!","Daddy Day Care"
"864",3353253,3356711,"Last but not least, the Thumb SuckersSupport Group will have a meeting...","Daddy Day Care"
"865",3356823,3358757,"under the tree after nap time...","Daddy Day Care"
"866",3358859,3361054,"which starts right afteryou finish your snack.","Daddy Day Care"
"867",3361161,3365063,"So after you finish, grab a blanket,get a spot, and we have that.","Daddy Day Care"
"868",3365165,3367929,"Also, next week is goingto be Alpha Girls Group.","Daddy Day Care"
"869",3368068,3370935,"And we're going to haveTai Chi under the tree.","Daddy Day Care"
"870",3371038,3374303,"And we're going to also have pet day,so you bring your pets in.","Daddy Day Care"
"871",3374408,3375841,"We'll have pet show-and-tell.","Daddy Day Care"
"872",3376943,3380401,"This is my bunny. His name is Tiny.","Daddy Day Care"
"873",3381014,3384211,"I feed him a lot. Five times a day.","Daddy Day Care"
"874",3384351,3387548,"He poops a lot, too. Six times a day.","Daddy Day Care"
"875",3387888,3389617,"It's like little marbles.","Daddy Day Care"
"876",3390057,3392048,"This is my turtle, Sparks.","Daddy Day Care"
"877",3392292,3396353,"He's fast. He's the fastest turtle in the world.","Daddy Day Care"
"878",3400133,3402897,"Go! Go, Sparks!","Daddy Day Care"
"879",3406606,3410770,"This is my parrot, Paulie.I'm teaching him to talk. Talk.","Daddy Day Care"
"880",3410911,3412538,"Shut up, butthead.","Daddy Day Care"
"881",3420287,3421777,"Okay, Becca, where's your pet?","Daddy Day Care"
"882",3421888,3424948,"I had a tarantula,but I don't know where he is.","Daddy Day Care"
"883",3425859,3428919,"Okay, all right, don't panic.","Daddy Day Care"
"884",3429029,3431930,"What do you mean, don't panic?There's a big spider in here.","Daddy Day Care"
"885",3432032,3433727,"I got a spider on my head!","Daddy Day Care"
"886",3437437,3441396,"- So what are we betting on today?- I'm going to do a diaper stroke, okay?","Daddy Day Care"
"887",3441508,3442805,"All right.","Daddy Day Care"
"888",3443009,3446968,"Well, if it isn't the geniusesthat brought the world Veggie-Os.","Daddy Day Care"
"889",3448148,3452312,"- So, how's unemployment?- Actually, I've got the best job I've ever had.","Daddy Day Care"
"890",3452419,3454216,"Yeah, it's a start-up.","Daddy Day Care"
"891",3454321,3458621,"We offer time-management facilitationto mostly working professionals.","Daddy Day Care"
"892",3458759,3461387,"That's a tough market.Sounds pretty cutthroat.","Daddy Day Care"
"893",3461495,3464794,"- Yeah. It's a real blood sport.- What's the money like?","Daddy Day Care"
"894",3464898,3467196,"Bruce! Let's go, I got Botox.","Daddy Day Care"
"895",3468101,3470001,"Hi, Charlie. Hi, Phil.","Daddy Day Care"
"896",3470570,3472868,"- Hey, Crispin.- What's up, little man?","Daddy Day Care"
"897",3472973,3474133,"How do you know my kid?","Daddy Day Care"
"898",3474241,3477369,"They're his day care teachers,what do you think?","Daddy Day Care"
"899",3478211,3480907,"Day care? That's what it is?","Daddy Day Care"
"900",3481014,3484643,"Oh, my God.You're wiping boogers for a living.","Daddy Day Care"
"901",3487721,3488915,"Losers.","Daddy Day Care"
"902",3490891,3493587,"You're paying us to do it, too, you know.","Daddy Day Care"
"903",3494828,3496022,"Losers.","Daddy Day Care"
"904",3498064,3500089,"""Do you like green eggs and ham?","Daddy Day Care"
"905",3502302,3507069,"""I do not like them, Sam-l-Am.I do not like green eggs and ham.","Daddy Day Care"
"906",3507707,3510175,"""Would you like to eat them here or there?","Daddy Day Care"
"907",3512179,3516047,"""I would not like to eat them anywhere.I do not like green eggs and ham.","Daddy Day Care"
"908",3516149,3519448,"""I do not like them, Sam-l-Am."" Okay?","Daddy Day Care"
"909",3520520,3523455,"Now see, he was going to punch Sam-l-Am,but he walked away.","Daddy Day Care"
"910",3523557,3525752,"You don't punch, see?He walked away with it.","Daddy Day Care"
"911",3528962,3530429,"Where's Mommy?","Daddy Day Care"
"912",3531798,3533732,"Mommy had to work today.","Daddy Day Care"
"913",3535635,3538229,"Remember when you usedto work all the times?","Daddy Day Care"
"914",3538338,3540704,"Yeah, back when I had a real job.","Daddy Day Care"
"915",3541274,3542866,"Do you miss work?","Daddy Day Care"
"916",3544778,3547144,"I guess. I suppose so. I miss it.","Daddy Day Care"
"917",3548114,3551743,"But don't get me wrong. It's not likeI don't like hanging out with you guys.","Daddy Day Care"
"918",3551852,3555344,"It's just that Daddy used to bea big shot down at work.","Daddy Day Care"
"919",3555989,3560858,"I had my own office and a big, pretty view.Remember that big, pretty view Daddy had?","Daddy Day Care"
"920",3560961,3563953,"I like it when you spin me aroundin that cool chair.","Daddy Day Care"
"921",3564064,3566055,"Yeah, that's a cool chair.","Daddy Day Care"
"922",3566333,3570167,"A lot of cool things about that job.Cool chair...","Daddy Day Care"
"923",3570971,3573405,"I had people working underneath me...","Daddy Day Care"
"924",3573507,3577204,"and, just between you and I,the pay wasn't that bad either.","Daddy Day Care"
"925",3578144,3581580,"- Put that down. What do you think of that?- What is it?","Daddy Day Care"
"926",3581748,3584216,"What do you mean?It's a dog in the sunshine.","Daddy Day Care"
"927",3584317,3587081,"- It doesn't look like one.- That's because it's abstract.","Daddy Day Care"
"928",3587187,3589849,"You have to squint when you look at it.","Daddy Day Care"
"929",3590390,3593052,"And when you see it like this,that's abstract.","Daddy Day Care"
"930",3593159,3594751,"Yeah? You see it?","Daddy Day Care"
"931",3595795,3598320,"How about if you tilt your head to the side?","Daddy Day Care"
"932",3598431,3601229,"- No, the other way.- Still doesn't look like one.","Daddy Day Care"
"933",3601334,3604462,"Okay, well, what are you over thereworking on, Michelangelo?","Daddy Day Care"
"934",3604571,3606004,"What is that?","Daddy Day Care"
"935",3614180,3616842,"There's nothing abstractabout that now, is it?","Daddy Day Care"
"936",3617651,3618811,"Thanks.","Daddy Day Care"
"937",3619886,3621478,"That's pretty good.","Daddy Day Care"
"938",3621588,3623954,"You got Daddy's headlooking kind of round, though.","Daddy Day Care"
"939",3624057,3625615,"Is my head that round?","Daddy Day Care"
"940",3625759,3630059,"- No. But I got your mustache.- Yeah, I see. A nice green mustache.","Daddy Day Care"
"941",3630630,3632461,"That's all right, son.","Daddy Day Care"
"942",3632999,3636230,"I just paid the mortgage,the car loan and the electric bill.","Daddy Day Care"
"943",3636336,3638827,"Look at the balancein the checking account.","Daddy Day Care"
"944",3639039,3642839,"- 74 cents.- Yeah. That's right, 74 cents.","Daddy Day Care"
"945",3642943,3645707,"- You are my Superman.- You got that right.","Daddy Day Care"
"946",3645812,3649942,"I've worked hard, and I thinkit's time to let off a little of my frustration.","Daddy Day Care"
"947",3650050,3652450,"It's time for youto take care of your Superman.","Daddy Day Care"
"948",3652552,3654986,"- My Superman. Come here, baby.- That's right.","Daddy Day Care"
"949",3655088,3658080,"No! The monster's going to get me!","Daddy Day Care"
"950",3660760,3662694,"It's probably a nightmare.","Daddy Day Care"
"951",3663797,3666857,"- Be right back.- Okay, hurry up. Mommy's coming!","Daddy Day Care"
"952",3667167,3668759,"No, I want Daddy.","Daddy Day Care"
"953",3670670,3674106,"- Did everything go okay?- Yeah, everything's just fine.","Daddy Day Care"
"954",3679980,3681743,"What's that face for?","Daddy Day Care"
"955",3682015,3684506,"Since when does he like youbetter than he likes me?","Daddy Day Care"
"956",3684618,3686449,"No, don't even trip. It's not like that.","Daddy Day Care"
"957",3686553,3690250,"I've just been spending more time with him,so he wanted me.","Daddy Day Care"
"958",3690690,3692157,"He's getting much more confident.","Daddy Day Care"
"959",3692258,3694783,"Remember how he wouldn't playwith anyone else at first?","Daddy Day Care"
"960",3694894,3697920,"Now, he's even playing withthat kid, Crispin.","Daddy Day Care"
"961",3698031,3701762,"Crispin happened to say ""thank you""at lunch today without being told.","Daddy Day Care"
"962",3701868,3704632,"And that little girl Becca, she can read.She's just a baby.","Daddy Day Care"
"963",3704738,3709300,"I seen her pick up a Curious George book,sit down and read like a grownup.","Daddy Day Care"
"964",3709542,3711134,"What's that face?","Daddy Day Care"
"965",3712612,3716480,"I haven't seen you this excitedabout something in a long time.","Daddy Day Care"
"966",3717984,3720282,"Yeah, I ain't going to front.","Daddy Day Care"
"967",3720387,3722981,"Them little crumb snatchersgot under my skin.","Daddy Day Care"
"968",3723690,3727649,"Mrs. Plager, I cannot continueto expose the other children...","Daddy Day Care"
"969",3727861,3731228,"to such dangerous, self-destructive,highly addictive behavior.","Daddy Day Care"
"970",3731331,3733492,"So either Juliette stops the thumb sucking...","Daddy Day Care"
"971",3733600,3737036,"or you'll just have to findyourself another preschool.","Daddy Day Care"
"972",3744444,3745502,"Are you busy?","Daddy Day Care"
"973",3745612,3748945,"Just pruning a few weeds from the garden.What is it?","Daddy Day Care"
"974",3749249,3751911,"Okay, I just thought you should know...","Daddy Day Care"
"975",3752786,3755118,"we've lost three more students.","Daddy Day Care"
"976",3755388,3758289,"Are you seriously suggestingyou don't know where they are?","Daddy Day Care"
"977",3758391,3759449,"No, ma'am.","Daddy Day Care"
"978",3760226,3762854,"- I know where they are.- So do I.","Daddy Day Care"
"979",3765732,3767222,"Daddy Day Care.","Daddy Day Care"
"980",3767867,3769698,"First, it was amusing.","Daddy Day Care"
"981",3770403,3772166,"Then it was annoying.","Daddy Day Care"
"982",3772839,3775535,"Now it's really starting to tick me off.","Daddy Day Care"
"983",3776776,3779836,"Get me a copy ofChild Day Care Services Regulations.","Daddy Day Care"
"984",3795962,3797395,"Phil, get the door.","Daddy Day Care"
"985",3798398,3799865,"Get the door!","Daddy Day Care"
"986",3801601,3803501,"All right, I got it.","Daddy Day Care"
