"id","startTime","endTime","text","title"
"893",3692400,3695892,"- Lucky! What are you doin' here?- Do you have a tissue?","Doctor Dolittle"
"894",3696004,3699337,"Yes, l do.Right in the back in that pocket over there.","Doctor Dolittle"
"895",3699441,3702137,"Listen. l'm sorry l ignored youback at the house.","Doctor Dolittle"
"896",3704145,3707114,"You were the one who said''Be who you are.'' You were right.","Doctor Dolittle"
"897",3709251,3713415,"Put me back in touch with the part of methat l'd forgotten years ago, Lucky.","Doctor Dolittle"
"898",3714889,3717881,"Can you take it easy?l'm tryin' to say somethin'.","Doctor Dolittle"
"899",3717959,3721451,"- Well, then just say it.- l'm trying to say it.","Doctor Dolittle"
"900",3721529,3724657,"- What do you think l'm tryin' to say?- ''l love you, Lucky.''","Doctor Dolittle"
"901",3724733,3727293,"- That's not what l'm tryin' to say.- Yes, it is.","Doctor Dolittle"
"902",3727369,3729462,"That is not what l'm tryin' to tell you.","Doctor Dolittle"
"903",3729537,3733268,"Come on. Deep down insidethat's exactly what you want to say.","Doctor Dolittle"
"904",3733341,3736276,"Come on, now.You'll feel a lot better. Come on.","Doctor Dolittle"
"905",3736344,3739711,"Let it out. Go ahead. You know it. l know it.","Doctor Dolittle"
"906",3739781,3742375,"- l love you.- You love me?","Doctor Dolittle"
"907",3743518,3745645,"l'm gonna need another tissue.","Doctor Dolittle"
"908",3745720,3748917,"- Where are we offto?- We are offto ruin my life.","Doctor Dolittle"
"909",3751526,3754086,"Wake up!","Doctor Dolittle"
"910",3755063,3757930,"Hey, doc. You came back.","Doctor Dolittle"
"911",3758566,3760761,"You need help. l wanna take you for tests.","Doctor Dolittle"
"912",3760869,3764999,"- Tests? That's good, right? Tests?- Yeah. Come on.","Doctor Dolittle"
"913",3766941,3769102,"l hate these stairs.","Doctor Dolittle"
"914",3769711,3772407,"Take good care of him, doc. He's our star.","Doctor Dolittle"
"915",3772514,3774311,"He'll be OK.","Doctor Dolittle"
"916",3774382,3776577,"- Great. More steps.- Come on. Get in.","Doctor Dolittle"
"917",3778386,3781947,"Wait a minute. The dog gets to ride up front?","Doctor Dolittle"
"918",3782023,3786187,"- Stop looking at me like l'm a side dish.- Don't flatter yourself.","Doctor Dolittle"
"919",3786328,3789354,"- Now, you two guys shut up. Quiet.- Hey, look. Jerry.","Doctor Dolittle"
"920",3789431,3792025,"- Can you keep your voice down?- He's a big fan.","Doctor Dolittle"
"921",3792133,3796729,"Hey, Jerry. How you doin', dude?Just goin' for some tests.","Doctor Dolittle"
"922",3797739,3801231,"l'm fine! ''The tiger's fine.'' l'm sick.","Doctor Dolittle"
"923",3802644,3805909,"- l told you they'd get away.- No thanks to you.","Doctor Dolittle"
"924",3805980,3809848,"No? Three armed guardsversus a pigeon - that's a fair fight?","Doctor Dolittle"
"925",3812520,3816388,"He's not at home and he's notanswering his pager. l'm worried.","Doctor Dolittle"
"926",3816925,3818358,"- Mom.- Yes?","Doctor Dolittle"
"927",3818426,3821554,"Guess who Maya brought to the party.","Doctor Dolittle"
"928",3822030,3824464,"Rodney. Rodney, there you are.","Doctor Dolittle"
"929",3826034,3828264,"- Man...- Where the hell is Dolittle?","Doctor Dolittle"
"930",3828403,3833238,"You know, l just talked to him. He stoppedat an orphanage to take care of a sick child.","Doctor Dolittle"
"931",3833375,3837175,"That is so John. lt's so typical ofthe man.He just cares.","Doctor Dolittle"
"932",3837245,3843480,"Weller. Take your lips off my buttlong enough to hear what l'm going to say.","Doctor Dolittle"
"933",3843585,3847783,"lf Dolittle's not here in ten minutes,","Doctor Dolittle"
"934",3847856,3850222,"- l'm pulling the plug.- You won't have to.","Doctor Dolittle"
"935",3850291,3852657,"He's gonna be here in five minutes.","Doctor Dolittle"
"936",3852761,3857198,"- l hope so.- He will be. He'll be here in five minutes.","Doctor Dolittle"
"937",3859033,3861058,"Hey.","Doctor Dolittle"
"938",3861169,3865401,"Where's the kitchenette? l gotta get in here.Where's the food?","Doctor Dolittle"
"939",3866608,3869634,"- Rodney.- She's comin' to get me.","Doctor Dolittle"
"940",3870278,3872405,"Rodney.","Doctor Dolittle"
"941",3880422,3884119,"- Who's Rodney?- Sorry.","Doctor Dolittle"
"942",3889297,3893495,"This ain't no kitchen. Smell bad.Must be cookin' chitlins.","Doctor Dolittle"
"943",3896471,3899065,"Now what's this for?","Doctor Dolittle"
"944",3901743,3903836,"Somebody help me.","Doctor Dolittle"
"945",3908049,3910108,"l can't swim.","Doctor Dolittle"
"946",3912821,3914652,"Aaaggghhh yourself!","Doctor Dolittle"
"947",3921029,3924430,"Where you goin'? Get me outta here.","Doctor Dolittle"
"948",3927902,3933738,"Somebody get the license plate number.l have just been violated.","Doctor Dolittle"
"949",3943952,3947649,"- This is where you work?- Come on.","Doctor Dolittle"
"950",3951459,3956954,"Don't throw that away. That'sthe marrow - it's the best part ofthe bone.","Doctor Dolittle"
"951",3958132,3961693,"- Look who's here.- Well, if it isn't Siegfried and Roy!","Doctor Dolittle"
"952",3961769,3962929,"Quiet.","Doctor Dolittle"
"953",3963004,3966667,"- Lucky, keep an eye out. You rats help him.- We don't work for you.","Doctor Dolittle"
"954",3966741,3970336,"- Gimme a break. l saved your life.- That's yesterday's news.","Doctor Dolittle"
"955",3971312,3973371,"You want gratitude, get a hamster.","Doctor Dolittle"
"956",3973515,3976882,"''Get a hamster.'' You kill me!","Doctor Dolittle"
"957",3976951,3978578,"l gotta get help.","Doctor Dolittle"
"958",3978686,3981621,"Yeah, l got a plate lD on the catnapper.","Doctor Dolittle"
"959",3981723,3983588,"Do something.","Doctor Dolittle"
"960",3983691,3986683,"The heart of a hawk.The heart of a hawk.","Doctor Dolittle"
"961",3986761,3990629,"- A chicken hawk- The heart of a hawk.","Doctor Dolittle"
"962",4001242,4003972,"That feels good.","Doctor Dolittle"
"963",4004045,4008379,"l enjoy my personal relationshipswith my patients.","Doctor Dolittle"
"964",4008516,4011041,"- You'll get over that.- l just might not.","Doctor Dolittle"
"965",4011152,4013313,"l'm joking. Gene, l'm...","Doctor Dolittle"
"966",4014722,4020820,"This is the kind of guy who would rather betrudging through the snow with a black bag","Doctor Dolittle"
"967",4020929,4023659,"- makin' house calls.- Exactly.","Doctor Dolittle"
"968",4025433,4028061,"- That hurt me.- Oh, my gosh, l'm sorry.","Doctor Dolittle"
"969",4028169,4031036,"- l may have broken my nose.- l think l broke his nose.","Doctor Dolittle"
"970",4031139,4033334,"- ls it broken?- Let me check.","Doctor Dolittle"
"971",4033408,4036434,"Oh, my God! l broke his nose.","Doctor Dolittle"
"972",4037078,4040570,"- Let me take him to X-ray.- l'm blackin' out.","Doctor Dolittle"
"973",4049857,4056023,"Thaaaat feeeeels goooood!","Doctor Dolittle"
"974",4057098,4059999,"- This really hurts. l think...- Of course it hurts.","Doctor Dolittle"
"975",4060068,4062263,"You walked right into a door.","Doctor Dolittle"
"976",4062370,4064463,"Oh, God, l'm bleeding.","Doctor Dolittle"
"977",4064606,4067803,"l'm bleeding.Do we have any morphine in the vault?","Doctor Dolittle"
"978",4067875,4070002,"- Hey, guys.- John.","Doctor Dolittle"
"979",4070378,4072778,"- What happened to you?- l walked into a door.","Doctor Dolittle"
"980",4072847,4075179,"- l crushed his septum.- Really?","Doctor Dolittle"
"981",4075249,4078685,"Look, this is not really a good time.l'm kinda","Doctor Dolittle"
"982",4078786,4080879,"- here with somebody.- Oh, my God.","Doctor Dolittle"
"983",4080989,4084857,"l-l-l do not approve.Lisa is a wonderful woman!","Doctor Dolittle"
"984",4086828,4088261,"- Jesus.- lt's OK.","Doctor Dolittle"
"985",4088329,4090422,"- lt's a friggin' tiger.- He won't hurt you.","Doctor Dolittle"
"986",4091633,4094830,"- l know him.- Be afraid. Be very afraid.","Doctor Dolittle"
"987",4094902,4097393,"Oh, my goodness. l have to sit.","Doctor Dolittle"
"988",4099474,4103308,"Here's what we do. We tell Johnnywe're gonna fix his little tiger up","Doctor Dolittle"
"989",4103411,4105504,"after he signs. OK?","Doctor Dolittle"
"990",4105647,4109743,"Then we'll have him committed.lt's perfect! That way we get our money.","Doctor Dolittle"
"991",4115490,4119119,"lt's shifted to the left.So there's something applying pressure to it.","Doctor Dolittle"
"992",4119227,4123425,"You can't operate on a tiger.Especially as you don't know the symptoms.","Doctor Dolittle"
"993",4123498,4128060,"- Double vision and headaches. He told me.- You'll wind up back at Hammersmith's.","Doctor Dolittle"
"994",4128136,4130070,"l've been supportive,","Doctor Dolittle"
"995",4130138,4133904,"but ifyou expect me to believethat a tiger told you his symptoms,","Doctor Dolittle"
"996",4134308,4136538,"l might have to draw the line.","Doctor Dolittle"
"997",4138646,4141137,"You have to do something. Quick.","Doctor Dolittle"
"998",4141249,4144548,"We gotta get him into OR fast.lt's the only chance he's got.","Doctor Dolittle"
"999",4144686,4147780,"What about the press conference?","Doctor Dolittle"
"1000",4147889,4150289,"20 bucks says this guy never shows.","Doctor Dolittle"
"1001",4150358,4153657,"Watch your back.Trying to get to the operating room.","Doctor Dolittle"
"1002",4153728,4159360,"- Outta the way, please.- Clear a spot. We have an emergency here.","Doctor Dolittle"
"1003",4159467,4162095,"Clear the way, please. Comin' through.","Doctor Dolittle"
"1004",4162170,4166539,"- There you are. Let's do this.- Mr Calloway, Mark broke his nose.","Doctor Dolittle"
"1005",4166674,4170770,"- The nose can wait. The press is waiting.- l-l-l-l...","Doctor Dolittle"
"1006",4170878,4175315,"- We're announcing.- l really don't know ifwe should...","Doctor Dolittle"
"1007",4176384,4178579,"- Where were you?- l'll explain.","Doctor Dolittle"
"1008",4178720,4183589,"Thank you all for coming,and thank you all for being so patient.","Doctor Dolittle"
"1009",4183725,4188355,"As you all know, the practice of medicineand the business of medicine","Doctor Dolittle"
"1010",4188429,4192092,"have been undergoingvery big changes in this country.","Doctor Dolittle"
"1011",4192166,4196227,"We at Calnet strive to beat the forefront ofthese changes.","Doctor Dolittle"
"1012",4196337,4199898,"That is why l'm proud to announcethe acquisition of...","Doctor Dolittle"
"1013",4199974,4204138,"This is the life! Hot wings, nuts.l love nuts.","Doctor Dolittle"
"1014",4205046,4208709,"Oh, my! Live prey.","Doctor Dolittle"
"1015",4215056,4219459,"- That's a big cat!- lt's all right. lt's OK.","Doctor Dolittle"
"1016",4219961,4222521,"lt's OK. He's not gonna hurt anybody.","Doctor Dolittle"
"1017",4223998,4226057,"He's just a very, very sick tiger.","Doctor Dolittle"
"1018",4226167,4229261,"You'd better have a rationalexplanation for all this.","Doctor Dolittle"
"1019",4229370,4234569,"Mr Calloway, l don't have a rationalexplanation. l wish l did, but l don't.","Doctor Dolittle"
"1020",4234842,4239370,"Right now l got a sick tiger on my hands. l'mgonna try to save it. That's all that matters.","Doctor Dolittle"
"1021",4239447,4241608,"Dolittle, you go through with this...","Doctor Dolittle"
"1022",4246154,4248486,"So ifyou'll excuse me...","Doctor Dolittle"
"1023",4250224,4252988,"- Stupid cat. Ruined the party.- Shut up.","Doctor Dolittle"
"1024",4253060,4255893,"What do you mean, shut up?l was gonna do karaoke!","Doctor Dolittle"
"1025",4270077,4272807,"What the hell is this?","Doctor Dolittle"
"1026",4272880,4275713,"- No more bacon.- One, two, three, four.","Doctor Dolittle"
"1027",4275817,4278911,"You ain't gettin' through this door.","Doctor Dolittle"
"1028",4279020,4281113,"Make love, not war.","Doctor Dolittle"
"1029",4281656,4284784,"Fur is murder. Free Willy.","Doctor Dolittle"
"1030",4284859,4289262,"Pigs go home. Pigs go home. Pigs go home.","Doctor Dolittle"
"1031",4289330,4290627,"Huh?","Doctor Dolittle"
"1032",4290731,4293131,"No, no, not you. The police.","Doctor Dolittle"
"1033",4293234,4295464,"Wow, this is great.","Doctor Dolittle"
"1034",4295536,4298903,"- Are you OK?- The man's comin' down hard, but","Doctor Dolittle"
"1035",4299006,4302533,"- we're holdin' strong.- l got such a chill.","Doctor Dolittle"
"1036",4302643,4305669,"l'm gonna give you a local.lt's not gonna hurt.","Doctor Dolittle"
"1037",4305813,4308304,"lt'll feel like a little bee sting.","Doctor Dolittle"
"1038",4308416,4311852,"A little pressure. That's about it.","Doctor Dolittle"
"1039",4311919,4314012,"OK? Here l come.","Doctor Dolittle"
"1040",4316490,4317514,"There you go.","Doctor Dolittle"
"1041",4317758,4319692,"He can't do this.","Doctor Dolittle"
"1042",4319760,4325130,"- He still thinks he can talk to animals.- He can, Lisa. He can talk to animals.","Doctor Dolittle"
"1043",4325233,4328464,"lt all started when he was a kid.l didn't know what to do.","Doctor Dolittle"
"1044",4328536,4331903,"- What are you saying, Dad?- l thought it was a handicap,","Doctor Dolittle"
"1045",4331973,4334066,"but it's a gift, Lisa.","Doctor Dolittle"
"1046",4334141,4337269,"Don't you believe it? Look. See for yourself.","Doctor Dolittle"
"1047",4341716,4346517,"l need you to stay alert and tell me ifyou feelnumbness in your paws or on your right side.","Doctor Dolittle"
"1048",4346587,4350853,"Have you ever done this operation before?","Doctor Dolittle"
"1049",4350925,4353325,"Yeah, once in medical school.","Doctor Dolittle"
"1050",4353394,4355658,"But it was to a cadaver.","Doctor Dolittle"
"1051",4355730,4359723,"My professor told me that had my patientnot been dead, he would have lived.","Doctor Dolittle"
"1052",4360167,4362397,"Very comforting, doc.","Doctor Dolittle"
"1053",4369577,4373343,"lt's like Noah's ark out here.lt truly is a remarkable sight.","Doctor Dolittle"
"1054",4373414,4379148,"This collection of animals has prevented SanFrancisco's finest from entering the building.","Doctor Dolittle"
"1055",4379220,4382519,"Which is apparentlywhere the stolen tiger is being held.","Doctor Dolittle"
"1056",4382690,4382723,"OK, we're open. Gene, irrigate, please.","Doctor Dolittle"
"1057",4382723,4386090,"OK, we're open. Gene, irrigate, please.","Doctor Dolittle"
"1058",4390231,4394429,"All right, Jake, l need you to be alert.Tell me ifyou feel anything at all.","Doctor Dolittle"
"1059",4394535,4396628,"- Can you feel anything now?- No.","Doctor Dolittle"
"1060",4396737,4398830,"Just the same old pain.","Doctor Dolittle"
"1061",4400174,4404133,"How about now?You feeling any numbness at all?","Doctor Dolittle"
"1062",4404211,4407408,"l... l can't. l don't know!","Doctor Dolittle"
"1063",4407515,4410382,"Just relax and listen tothe sound of my voice, OK?","Doctor Dolittle"
"1064",4410451,4414785,"- l'm scared.- Don't be scared. l'm not gonna let you go.","Doctor Dolittle"
"1065",4414922,4416981,"John?","Doctor Dolittle"
"1066",4418993,4422986,"- What did he say?- He said he's a little scared.","Doctor Dolittle"
"1067",4465473,4468772,"Pulse is dropping fast.","Doctor Dolittle"
"1068",4468843,4472973,"His dura is bulging.There's too much pressure.","Doctor Dolittle"
"1069",4473047,4475607,"- My left side went numb.- Pulse still dropping.","Doctor Dolittle"
"1070",4475683,4479619,"All right. Hey, you just hang in there,OK, Jacob? Hang in there for me.","Doctor Dolittle"
"1071",4479687,4482815,"- OK, doc.- lt's a blood clot. lt has to be.","Doctor Dolittle"
"1072",4482923,4487383,"All l gotta do is find it. We're too closeto his motor strip. More suction, Gene.","Doctor Dolittle"
"1073",4487461,4490794,"- We're losin' him. We gotta relieve pressure.- Come on, Jake.","Doctor Dolittle"
"1074",4490865,4495325,"- Don't let go yet. We're almost there.- l can feel it.","Doctor Dolittle"
"1075",4495436,4497267,"- There.- There?","Doctor Dolittle"
"1076",4497338,4499738,"OK. OK, here we go.","Doctor Dolittle"
"1077",4505312,4508145,"lt's gone. The pain is gone.","Doctor Dolittle"
"1078",4508249,4511446,"Blood pressure stabilising.","Doctor Dolittle"
"1079",4511519,4514818,"lt's gone. lt's really gone.","Doctor Dolittle"
"1080",4515122,4517682,"He's OK.","Doctor Dolittle"
"1081",4524131,4527726,"- Thank you.- You are very welcome.","Doctor Dolittle"
"1082",4527835,4532636,"You just lay back and relax. We're gonnahave you back in the centre ring in no time.","Doctor Dolittle"
"1083",4537845,4539710,"Why'd you do that?","Doctor Dolittle"
"1084",4539780,4543716,"lf he tries to eat me again, l'm gonnasmack that moustache offyour face.","Doctor Dolittle"
"1085",4547488,4551185,"He's a lunatic.He has a history of mental illness.","Doctor Dolittle"
"1086",4551292,4553385,"- He's frankly...- He's the most","Doctor Dolittle"
"1087",4553494,4558397,"- remarkable surgeon l have ever seen.- He's here to stay.","Doctor Dolittle"
"1088",4558499,4562799,"- He is the straw that stirs the drink.- l want exclusive rights to him.","Doctor Dolittle"
"1089",4562903,4565599,"He's dynamic, caring. l can't imagine...","Doctor Dolittle"
"1090",4565706,4568504,"- What's the matter?- Dolittle. Wonderful work.","Doctor Dolittle"
"1091",4568576,4572672,"- Bravo. Bravo, Johnny. l'm so inspired.- Welcome aboard.","Doctor Dolittle"
"1092",4572746,4576739,"- l feel like l bought a winning franchise.- Yeah.","Doctor Dolittle"
"1093",4577151,4580416,"You haven't bought anything.We're not for sale.","Doctor Dolittle"
"1094",4580588,4585525,"Look. We don't need these namby-pambywacko freaks. lt's you and me,","Doctor Dolittle"
"1095",4586093,4590120,"- straight to the top.- You want pigeon? You'll get pigeon.","Doctor Dolittle"
"1096",4595836,4600637,"- Are ya happy now?- l'm right behind ya.","Doctor Dolittle"
"1097",4610117,4612415,"Hey. Somebody come here.","Doctor Dolittle"
"1098",4612520,4615114,"l think we got birth here.","Doctor Dolittle"
"1099",4615189,4618852,"Hey, hey! Somebody!l see some shakin' in that egg.","Doctor Dolittle"
"1100",4618959,4621154,"l see shakin' in the egg.","Doctor Dolittle"
"1101",4621228,4623719,"Hey, how's it goin', McGruff?","Doctor Dolittle"
"1102",4623797,4626197,"You know what? A Tic Tac wouldn't kill you.","Doctor Dolittle"
"1103",4626267,4629395,"Hey, girl, get up. We got birth comin'.","Doctor Dolittle"
"1104",4629470,4631597,"A swan egg. This is gonna be great.","Doctor Dolittle"
"1105",4631672,4634163,"- Come on, girl.- One question. What is a swan?","Doctor Dolittle"
"1106",4634241,4636971,"- That's my egg hatching.- OK, just breathe.","Doctor Dolittle"
"1107",4637077,4640069,"Yeah, here it come, the magic moment.","Doctor Dolittle"
"1108",4640181,4643548,"Oh, no. Just like Jurassic Park.lt's gonna kill us.","Doctor Dolittle"
"1109",4643617,4646347,"My swan egg's hatching. lt's hatching. lt...","Doctor Dolittle"
"1110",4648556,4651150,"Good lord, doc. What on earth is that?","Doctor Dolittle"
"1111",4651692,4655355,"That would be Maya'sbrand-new baby alligator.","Doctor Dolittle"
"1112",4655429,4657294,"Cool.","Doctor Dolittle"
"1113",4657398,4659832,"- Momma?- Momma? l'm not your momma.","Doctor Dolittle"
"1114",4661569,4665164,"- Momma?- Oh, no, don't look at me.","Doctor Dolittle"
"1115",4665239,4669801,"Although there was that one timel got drunk in the Everglades...","Doctor Dolittle"
"1116",4671011,4672501,"Doc, wait up.","Doctor Dolittle"
"1117",4672613,4675446,"So, you're gonna treat humans andanimals.l love it.","Doctor Dolittle"
"1118",4675516,4678178,"lt's no big thing. We're all basically the same.","Doctor Dolittle"
"1119",4678252,4682279,"My thoughts exactly. First l want tomove my bowl up on the dining-room table.","Doctor Dolittle"
"1120",4682389,4685381,"Second, no more dog food.That stuff's just gross.","Doctor Dolittle"
"1121",4685459,4688724,"l want my own room, with a TV.Basic cable will be fine.","Doctor Dolittle"
"1122",4689029,4691998,"l hate stories with happy endings.","Doctor Dolittle"
"1123",4692099,4693896,"- Yoo-hoo.- What?","Doctor Dolittle"
"1124",4694001,4697129,"- l didn't say nothin'.- Then who...?","Doctor Dolittle"
"1125",4697238,4701106,"Run for your lives.Oh, my God. l don't wanna die.","Doctor Dolittle"
"1126",4701208,4704109,"Hang a left. No, hang a right.","Doctor Dolittle"
"1127",4704211,4710275,"- Legs, do your thing. Outta my way.- This circle of life really stinks.","Doctor Dolittle"
"1128",5114054,5116045,"Subtitles by Visiontext","Doctor Dolittle"
"1129",5118058,5119286,"AMERlCAN","Doctor Dolittle"