"id","startTime","endTime","text","title"
"1",37453,39515,"I'm not sure if we're even on the air.","Edge of Tomorrow"
"2",39539,40539,"Uh... this is uh...","Edge of Tomorrow"
"3",40706,42332,"a series of explosions...","Edge of Tomorrow"
"4",42875,44520,"This is a major incident...","Edge of Tomorrow"
"5",44543,46128,"The emergency is a major incident...","Edge of Tomorrow"
"6",47671,49673,"That's a meteor hit.","Edge of Tomorrow"
"7",49798,53094,"It does now appear to be a major attack...","Edge of Tomorrow"
"8",53219,55762,"Since they landed outsideHamburg five years ago,","Edge of Tomorrow"
"9",55762,57848,"they have steadily advanced across Europe.","Edge of Tomorrow"
"10",57973,59951,"We've suffered millionsof casualties and yet...","Edge of Tomorrow"
"11",59975,63395,"The evacuation of key governmentofficials continuing...","Edge of Tomorrow"
"12",63396,65980,"Nothing we have donehas been able to stop their advance...","Edge of Tomorrow"
"13",65981,67649,"Human costs, the Europeans...","Edge of Tomorrow"
"14",67650,68858,"- have paid the highest...- They appear to mimic...","Edge of Tomorrow"
"15",68859,70986,"and even anticipate our actions...","Edge of Tomorrow"
"16",71528,73114,"We could not defeat them in France,","Edge of Tomorrow"
"17",73239,75118,"we'll be fighting them inthe streets of London,","Edge of Tomorrow"
"18",75143,76686,"then New York, then Tokyo.","Edge of Tomorrow"
"19",77659,79054,"All of humanity is at stake.","Edge of Tomorrow"
"20",79078,82039,"After five years, wefinally have a victory.","Edge of Tomorrow"
"21",82164,84498,"These pictures are just in from Verdun.","Edge of Tomorrow"
"22",84500,87420,"And the coalition victorywas how low casualties were...","Edge of Tomorrow"
"23",87712,90088,"We have seen a stunning victory here today.","Edge of Tomorrow"
"24",90631,91966,"The United Defense Force...","Edge of Tomorrow"
"25",92091,93251,"How do you convince people...","Edge of Tomorrow"
"26",93275,96361,"that this is a fight that can be won?","Edge of Tomorrow"
"27",96512,98231,"This is an alien invasion and a global war.","Edge of Tomorrow"
"28",98256,100883,"With the new jack in technologyand limited amount of training,","Edge of Tomorrow"
"29",101057,103019,"we've been able to create super soldiers.","Edge of Tomorrow"
"30",103561,105563,"Look at Rita Vrataski,The Angel of Verdun...","Edge of Tomorrow"
"31",105688,107448,"They're calling her ""TheAngel of Verdun""...","Edge of Tomorrow"
"32",108481,111359,"You can see that's thenew hope for this war...","Edge of Tomorrow"
"33",112777,115258,"With the new jack in technologyand limited amount of training,","Edge of Tomorrow"
"34",115281,118409,"Rita Vrataski was able tokill hundreds of Mimics...","Edge of Tomorrow"
"35",128711,132566,"She was able to kill hundreds of Mimicson only her first day in combat.","Edge of Tomorrow"
"36",132590,135134,"Imagine any army of Rita Vrataski's.","Edge of Tomorrow"
"37",135259,137969,"We're managing to hold them backat the English Channel,","Edge of Tomorrow"
"38",138137,139856,"- but for how long?- It is a dangerous task","Edge of Tomorrow"
"39",139881,142658,"and it's easy to understandwhy people are so suspicious about this...","Edge of Tomorrow"
"40",142682,144963,"Over seventy nationsare joining the United Defense Force,","Edge of Tomorrow"
"41",145088,146929,"which hopes to push themback once and for all.","Edge of Tomorrow"
"42",146953,150650,"We've got 'em contained, and with thisnew technology, we're gonna defeat 'em.","Edge of Tomorrow"
"43",150775,152743,"Operation Downfall isgoing to be the largest","Edge of Tomorrow"
"44",152756,154736,"mechanized invasion inthe history of mankind.","Edge of Tomorrow"
"45",154861,156197,"We will be victorious.","Edge of Tomorrow"
"46",156447,157447,"We fight.","Edge of Tomorrow"
"47",157740,158740,"That's what we do.","Edge of Tomorrow"
"48",159199,163454,"LONDON","Edge of Tomorrow"
"49",214546,215923,"Major William Cage.","Edge of Tomorrow"
"50",216132,218259,"United Stated military.","Edge of Tomorrow"
"51",218466,219610,"Welcome to London, Major.","Edge of Tomorrow"
"52",219634,221679,"UNITED DEFENSE FORCE HEADQUARTERS","Edge of Tomorrow"
"53",227350,228769,"The General will see you now.","Edge of Tomorrow"
"54",230271,231271,"Thank you.","Edge of Tomorrow"
"55",233064,234317,"Operation Downfall,","Edge of Tomorrow"
"56",234974,237810,"the entire might of theUDF invading from France,","Edge of Tomorrow"
"57",237811,239050,"the Mediterranean, Scandinavia,","Edge of Tomorrow"
"58",239687,241728,"relieving pressure in theEastern front and allowing","Edge of Tomorrow"
"59",241752,243942,"the Russians and Chineseto push the enemy back,","Edge of Tomorrow"
"60",244485,245685,"and we all meet in the middle,","Edge of Tomorrow"
"61",246069,248864,"exterminating this Mimicscourge along the way.","Edge of Tomorrow"
"62",250032,252231,"A lot of good soldiersare going to die tomorrow, Major,","Edge of Tomorrow"
"63",252256,254888,"and when the smoke clearsand the body bags start coming home,","Edge of Tomorrow"
"64",254912,256764,"people tend to look for someone to blame,","Edge of Tomorrow"
"65",256788,258122,"someone like me.","Edge of Tomorrow"
"66",258499,260334,"Ideally I'd prefer a different scenario.","Edge of Tomorrow"
"67",262127,263127,"Please.","Edge of Tomorrow"
"68",263879,265964,"A best selling memoir perhaps?","Edge of Tomorrow"
"69",268050,269218,"Maybe a career in politics?","Edge of Tomorrow"
"70",271971,274305,"Off the top of my head,I would go with the...","Edge of Tomorrow"
"71",274305,276141,"""The Sense of Manifest Destiny.""","Edge of Tomorrow"
"72",276516,278643,"""Rags to Riches: RagsRise Through The Ranks.""","Edge of Tomorrow"
"73",278644,280353,"""Born to Deliver.""You see people.","Edge of Tomorrow"
"74",281021,282500,"Well, they'd love that sort of thing.","Edge of Tomorrow"
"75",282523,283707,"You misunderstand, Major.","Edge of Tomorrow"
"76",283731,286485,"I didn't ask you here to sell me,I want you to sell the invasion.","Edge of Tomorrow"
"77",287004,288004,"Okay.","Edge of Tomorrow"
"78",288028,289548,"You ship out to the coast in one hour.","Edge of Tomorrow"
"79",289654,291240,"Your comrade is standing by.","Edge of Tomorrow"
"80",291615,293367,"You'll be on the beach with the first wave.","Edge of Tomorrow"
"81",296245,297305,"I'm sorry.","Edge of Tomorrow"
"82",297329,298413,"The first wave, the beach?","Edge of Tomorrow"
"83",298413,300081,"You mean... The front?","Edge of Tomorrow"
"84",300081,301081,"France.","Edge of Tomorrow"
"85",301709,303877,"Satellite show minimumenemy movement down the coast.","Edge of Tomorrow"
"86",304502,305502,"Little resistance.","Edge of Tomorrow"
"87",306338,308497,"It'd be exciting,something to tell your grandchildren.","Edge of Tomorrow"
"88",308521,311093,"Well, I appreciate the confidence, General.","Edge of Tomorrow"
"89",311427,313887,"I do... I do this to avoid doing that.","Edge of Tomorrow"
"90",318016,319976,"I...I... I was an ROTC in college,","Edge of Tomorrow"
"91",320101,323396,"and war broke out,I lost my advertising firm and...","Edge of Tomorrow"
"92",324332,325332,"here I am.","Edge of Tomorrow"
"93",325356,326481,"I do what I do.","Edge of Tomorrow"
"94",326483,328819,"You... you do what you do.","Edge of Tomorrow"
"95",329653,333990,"But... I'm not a soldier really.","Edge of Tomorrow"
"96",335199,336284,"No, of course you're not.","Edge of Tomorrow"
"97",336409,339610,"That's why I'm embedding you with severalhundred thousand men and women who are.","Edge of Tomorrow"
"98",340288,342930,"Well it is an honor, General.I'm afraid I'm gonna have to decline.","Edge of Tomorrow"
"99",343459,344959,"I can't stand the sight of blood,","Edge of Tomorrow"
"100",345418,346795,"not so much as a paper cut.","Edge of Tomorrow"
"101",352009,353944,"Uh... but,","Edge of Tomorrow"
"102",353968,356721,"uh... it's sitting herethinking about this,","Edge of Tomorrow"
"103",357723,362077,"a couple of names come to mind that I feellike I could recommend to you inste...","Edge of Tomorrow"
"104",362101,364062,"It's not an offer, Major,it's an order.","Edge of Tomorrow"
"105",366982,370778,"General, I'm an officer inthe United States Military.","Edge of Tomorrow"
"106",371069,372550,"You don't even have that authority...","Edge of Tomorrow"
"107",372574,374113,"I've spoken to your C.O.","Edge of Tomorrow"
"108",374322,375824,"You are now under my command.","Edge of Tomorrow"
"109",376783,378619,"You will retain yourpresent rank of course.","Edge of Tomorrow"
"110",379954,381329,"My secretary has all the details.","Edge of Tomorrow"
"111",384207,385584,"Do a good job, Major.","Edge of Tomorrow"
"112",386728,387728,"Good luck.","Edge of Tomorrow"
"113",387752,388795,"Dismissed.","Edge of Tomorrow"
"114",403185,404185,"General.","Edge of Tomorrow"
"115",407064,409274,"I just inspired millions of people...","Edge of Tomorrow"
"116",409942,411110,"to join your army.","Edge of Tomorrow"
"117",413528,415572,"And when the body bags come home,","Edge of Tomorrow"
"118",415697,418158,"and they're looking for someone to blame.","Edge of Tomorrow"
"119",418826,422036,"How hard do you thinkit would be for me to convince people...","Edge of Tomorrow"
"120",422161,423663,"to blame you?","Edge of Tomorrow"
"121",425456,428377,"I'd imagine a General wouldprefer to avoid that.","Edge of Tomorrow"
"122",432047,433507,"Are you blackmailing me, Major?","Edge of Tomorrow"
"123",435341,436759,"I would prefer...","Edge of Tomorrow"
"124",437468,441307,"not to be filming acts of heroismand valor on that beach tomorrow.","Edge of Tomorrow"
"125",455237,456237,"You won't be.","Edge of Tomorrow"
"126",459283,461658,"I'm glad we could uh... work this out.","Edge of Tomorrow"
"127",461659,463221,"Now, if you'll excuse me, General, I...","Edge of Tomorrow"
"128",468709,469709,"Thank you.","Edge of Tomorrow"
"129",471295,472295,"Arrest this man.","Edge of Tomorrow"
"130",473797,474797,"What?","Edge of Tomorrow"
"131",478636,479636,"Stop running!","Edge of Tomorrow"
"132",509375,511418,"Flight closing in 10 minutes.","Edge of Tomorrow"
"133",528184,529184,"On your feet, maggot!","Edge of Tomorrow"
"134",533065,535482,"Now that's no way to addressan officer, Sergeant.","Edge of Tomorrow"
"135",535484,537432,"That's how I address aslack-jawed recruit right","Edge of Tomorrow"
"136",537445,539404,"before I bust his holewith my boot heel.","Edge of Tomorrow"
"137",539613,540613,"Maggot!","Edge of Tomorrow"
"138",540614,541614,"Hold up there, son.","Edge of Tomorrow"
"139",544033,545033,"Can I help you, sir?","Edge of Tomorrow"
"140",546662,547870,"Where the hell am I, Sergeant?","Edge of Tomorrow"
"141",548205,549831,"Forward Operating Base, Heathrow.","Edge of Tomorrow"
"142",550164,552125,"You just came in with the fresh recruits.","Edge of Tomorrow"
"143",552250,553918,"Do I strike you as a fresh recruit?","Edge of Tomorrow"
"144",555546,556547,"No, sir, you do not.","Edge of Tomorrow"
"145",556879,559631,"My name is Major William Cage,I'm an American officer...","Edge of Tomorrow"
"146",559633,560384,"Officer?","Edge of Tomorrow"
"147",560551,561592,"This is Processing.","Edge of Tomorrow"
"148",562094,564346,"There's no officers down here.I got this, Sergeant.","Edge of Tomorrow"
"149",565556,567975,"How the hell did you end up in Processing?","Edge of Tomorrow"
"150",569350,570351,"What was it?","Edge of Tomorrow"
"151",570476,572687,"Poker night? Bachelor party?","Edge of Tomorrow"
"152",572895,574648,"If it's all the same to you, Sergeant.","Edge of Tomorrow"
"153",574856,577985,"I'd like to explain that to myCommanding Officer in Washington.","Edge of Tomorrow"
"154",578110,579629,"So if you just take me to the phone...","Edge of Tomorrow"
"155",579653,580653,"Haven't you heard?","Edge of Tomorrow"
"156",580738,582405,"We're t-minusing our whole S.H. out,","Edge of Tomorrow"
"157",583490,585451,"we're fixing to invade France.","Edge of Tomorrow"
"158",585658,589370,"This whole F.O.P is on lockdown,no calls, in or out.","Edge of Tomorrow"
"159",592459,593459,"You're name's Farell?","Edge of Tomorrow"
"160",593460,594602,"That's right.","Edge of Tomorrow"
"161",594626,595753,"Master Sergeant Farell.","Edge of Tomorrow"
"162",595878,597557,"Master Sergeant Farell,you're an American.","Edge of Tomorrow"
"163",597581,599792,"No, sir. I'm from Kentucky.","Edge of Tomorrow"
"164",600883,603594,"Okay, well... Look at me.","Edge of Tomorrow"
"165",604052,605511,"And look at where I am.","Edge of Tomorrow"
"166",607472,608472,"I've been railroaded.","Edge of Tomorrow"
"167",609892,611809,"It's obvious, I don't belong here.","Edge of Tomorrow"
"168",613312,614355,"So please, Sergeant.","Edge of Tomorrow"
"169",615022,617066,"There has to be a wayI can make a phone call.","Edge of Tomorrow"
"170",622988,624490,"I'll get you sorted out, sir.","Edge of Tomorrow"
"171",624615,625615,"Thank you.","Edge of Tomorrow"
"172",625783,626825,"Right this way.","Edge of Tomorrow"
"173",633456,636537,"- Where are you from in Kentucky, Sergeant?- Little town called Science Hill.","Edge of Tomorrow"
"174",636561,637645,"- Heard of it?- I have now.","Edge of Tomorrow"
"175",637961,639922,"- How about you, where are you from?- Cranberry, New Jersey.","Edge of Tomorrow"
"176",640047,641756,"They grow our cranberries there, do they?","Edge of Tomorrow"
"177",641881,643567,"Tomatoes, best I've ever had.","Edge of Tomorrow"
"178",643591,645052,"Why do they called Cranberry then?","Edge of Tomorrow"
"179",645635,647011,"Why do they call it Science Hill?","Edge of Tomorrow"
"180",647136,648681,"Never asked, don't care.","Edge of Tomorrow"
"181",653268,654352,"After you.","Edge of Tomorrow"
"182",659191,661191,"You're not taking me to a phone,are you, Sergeant?","Edge of Tomorrow"
"183",661215,662258,"No, I'm not.","Edge of Tomorrow"
"184",663570,666782,"Seems about the only honest thingyou've said to me so far is your name.","Edge of Tomorrow"
"185",669243,670744,"Says here you're a deserter.","Edge of Tomorrow"
"186",671537,673998,"Says here you were caughtimpersonating an officer,","Edge of Tomorrow"
"187",674289,676893,"It says here you'd likely tryto make an outside call,","Edge of Tomorrow"
"188",676917,678793,"even compromise security of this operation.","Edge of Tomorrow"
"189",678918,681422,"Anything to get out ofcombat duty tomorrow.","Edge of Tomorrow"
"190",681879,683465,"But that's not gonna happen.","Edge of Tomorrow"
"191",684091,685091,"Ever.","Edge of Tomorrow"
"192",685384,686677,"Private Cage.","Edge of Tomorrow"
"193",698938,700441,"Rumor is a terrible thing.","Edge of Tomorrow"
"194",700732,703443,"And not following these men,we'll all reach the same conclusion.","Edge of Tomorrow"
"195",704278,707447,"That you're a coward and a liar,putting your life above theirs.","Edge of Tomorrow"
"196",707615,709456,"The good new is there'shope for you, Private.","Edge of Tomorrow"
"197",710033,711951,"Hope in the form of glorious combat,","Edge of Tomorrow"
"198",713162,714495,"battle is the great redeemer,","Edge of Tomorrow"
"199",714705,717707,"fire and crucible in which theonly true heroes are forged.","Edge of Tomorrow"
"200",718250,720753,"The one place where all mentruly share the same rank,","Edge of Tomorrow"
"201",721211,723964,"regardless of what kind of parasiticscum they were going in.","Edge of Tomorrow"
"202",726235,727235,"Squad!","Edge of Tomorrow"
"203",727259,729094,"This here is Private Cage.","Edge of Tomorrow"
"204",729886,730928,"Private Cage.","Edge of Tomorrow"
"205",731054,732056,"J Squad.","Edge of Tomorrow"
"206",732472,733753,"Isn't that an Officer's uniform?","Edge of Tomorrow"
"207",734850,736601,"Or he's showing off us the cufflinks.","Edge of Tomorrow"
"208",739229,742292,"I see everyone is havinga productive morning.","Edge of Tomorrow"
"209",742316,745693,"You know it gives me a swell of prideknowing soldiers of your...","Edge of Tomorrow"
"210",746695,749322,"caliber will be leadingthe charge tomorrow.","Edge of Tomorrow"
"211",749657,750740,"Tip of the spear.","Edge of Tomorrow"
"212",751533,752659,"Edge of the knife.","Edge of Tomorrow"
"213",753619,755370,"Crack of my ass.","Edge of Tomorrow"
"214",757789,760584,"Private Kimmel, what is my viewof gambling in the barracks?","Edge of Tomorrow"
"215",760709,762062,"Dislike it, Sergeant Farell.","Edge of Tomorrow"
"216",762086,763586,"Nance, why do I dislike it?","Edge of Tomorrow"
"217",763711,766732,"Cause it maintains the notion that our fateis in hands other than our own.","Edge of Tomorrow"
"218",766756,769841,"And what is my definitiveposition on the concept of fate?","Edge of Tomorrow"
"219",769842,770842,"Chorus.","Edge of Tomorrow"
"220",770970,774097,"Through readiness and discipline,we are masters of our fate.","Edge of Tomorrow"
"221",776600,779102,"You might call that notion ironic,","Edge of Tomorrow"
"222",779477,780645,"but trust me,","Edge of Tomorrow"
"223",781355,782355,"you'll come around.","Edge of Tomorrow"
"224",784732,786275,"Private Cage is a deserter.","Edge of Tomorrow"
"225",787695,790697,"I'm making you all personallyresponsible for his deliverance.","Edge of Tomorrow"
"226",791322,793826,"He will be combat ready at 06:00 tomorrow.","Edge of Tomorrow"
"227",793951,794576,"Combat ready?","Edge of Tomorrow"
"228",794701,797221,"Private Cage is under the delusionthat he does not belong here,","Edge of Tomorrow"
"229",797245,799956,"we must dissuade him of this delusion.","Edge of Tomorrow"
"230",800164,801291,"If he tries to run,","Edge of Tomorrow"
"231",801292,804126,"feel free dissuade him untilhe can't piss standing up.","Edge of Tomorrow"
"232",804128,805419,"You have to listen to me,","Edge of Tomorrow"
"233",805421,806273,"I will never be combat ready...","Edge of Tomorrow"
"234",806297,807297,"I envy you, Cage.","Edge of Tomorrow"
"235",808465,812010,"Tomorrow morning you will be baptized,born again.","Edge of Tomorrow"
"236",813886,815139,"PT, ten minutes!","Edge of Tomorrow"
"237",826107,829193,"You're not in uniform... Private.","Edge of Tomorrow"
"238",838162,839913,"It's a new day, people!","Edge of Tomorrow"
"239",840623,841874,"Destiny calls.","Edge of Tomorrow"
"240",842291,844708,"The world expects only one thing from us,","Edge of Tomorrow"
"241",844710,845711,"that we will win!","Edge of Tomorrow"
"242",886918,888544,"Come on, Kimmel! Let's have it!","Edge of Tomorrow"
"243",894176,895510,"Oh, for Christ's sakes, Kimmel!","Edge of Tomorrow"
"244",896010,897303,"I gotta be free, man!","Edge of Tomorrow"
"245",900138,902765,"Alright, man. Let's get this showon the road, I gotta suite up.","Edge of Tomorrow"
"246",903767,905393,"What's that noise? That...","Edge of Tomorrow"
"247",905769,906769,"Let's go!","Edge of Tomorrow"
"248",907187,908206,"Listen, man!","Edge of Tomorrow"
"249",908230,909509,"I've never been in one of these.","Edge of Tomorrow"
"250",909522,912162,"Yeah, well, I've never been with two girlsat the same time before.","Edge of Tomorrow"
"251",912186,914355,"But you can bet when that day comes,I'll make it work.","Edge of Tomorrow"
"252",915236,916236,"Uh... Kimmel?","Edge of Tomorrow"
"253",916863,917863,"It's Griff.","Edge of Tomorrow"
"254",917864,919740,"Griff. Griff, listen to me.","Edge of Tomorrow"
"255",920075,921076,"Think about this, man.","Edge of Tomorrow"
"256",921618,923284,"I could hurt somebody.","Edge of Tomorrow"
"257",923286,925038,"Not with the safety on your one.","Edge of Tomorrow"
"258",925956,926956,"What?","Edge of Tomorrow"
"259",928041,929041,"Where is the safety?","Edge of Tomorrow"
"260",929292,930292,"Exactly!","Edge of Tomorrow"
"261",930668,932044,"DO NOT CROSS","Edge of Tomorrow"
"262",941096,942138,"It's time.","Edge of Tomorrow"
"263",968664,971000,"Bloody hell! It's the full metal...","Edge of Tomorrow"
"264",972418,973418,"Move!","Edge of Tomorrow"
"265",975087,976463,"- Griff.- Serge?","Edge of Tomorrow"
"266",976590,977966,"Take care of Private Cage!","Edge of Tomorrow"
"267",978341,979402,"What, all day?","Edge of Tomorrow"
"268",979426,981635,"Something tells me he won'tbe needing it that long.","Edge of Tomorrow"
"269",1022988,1023988,"Griff!","Edge of Tomorrow"
"270",1024011,1026222,"Cage!","Edge of Tomorrow"
"271",1049996,1051623,"We lost Germany.","Edge of Tomorrow"
"272",1051830,1052830,"We lost France.","Edge of Tomorrow"
"273",1053415,1056854,"If we lose today we won'tget to fight in battle.","Edge of Tomorrow"
"274",1056877,1059713,"Now I know the pressure on you is enormous.","Edge of Tomorrow"
"275",1060589,1061590,"Two minutes to drop.","Edge of Tomorrow"
"276",1062550,1064194,"It's alright to be scared..","Edge of Tomorrow"
"277",1064219,1066555,"Remember, there's no courage without fear.","Edge of Tomorrow"
"278",1069182,1070182,"Hey!","Edge of Tomorrow"
"279",1070767,1071934,"Oy, mate!","Edge of Tomorrow"
"280",1072059,1073940,"I think there's somethingwrong with his suite!","Edge of Tomorrow"
"281",1074729,1075729,"Yeah!","Edge of Tomorrow"
"282",1075939,1077606,"There's a dead guy in it.","Edge of Tomorrow"
"283",1079108,1082153,"Hey, watch your back out there, sir.","Edge of Tomorrow"
"284",1082695,1083864,"No one else will.","Edge of Tomorrow"
"285",1085615,1086675,"One minute!","Edge of Tomorrow"
"286",1086700,1087826,"One minute to drop!","Edge of Tomorrow"
"287",1094332,1095332,"Hey!","Edge of Tomorrow"
"288",1095685,1096685,"Hey!","Edge of Tomorrow"
"289",1096710,1097710,"What?","Edge of Tomorrow"
"290",1098878,1101631,"How do I turn the safety off of my weapon?","Edge of Tomorrow"
"291",1101964,1102382,"What?","Edge of Tomorrow"
"292",1102383,1104675,"How do I turn the safety off...","Edge of Tomorrow"
"293",1105885,1107136,"Oh, my God!","Edge of Tomorrow"
"294",1112349,1113602,"Everybody!","Edge of Tomorrow"
"295",1113977,1115394,"Thirty seconds to drop!","Edge of Tomorrow"
"296",1116270,1117980,"On my mark!","Edge of Tomorrow"
"297",1118647,1120357,"Standby to deploy!","Edge of Tomorrow"
"298",1120525,1122086,"Activate drop ride!","Edge of Tomorrow"
"299",1122109,1123109,"Remember...","Edge of Tomorrow"
"300",1130035,1131411,"Drop! Drop!","Edge of Tomorrow"
"301",1133663,1134955,"Drop! Go!","Edge of Tomorrow"
"302",1135498,1137250,"Let's go! Let's go!","Edge of Tomorrow"
"303",1139877,1141337,"Drop! Drop!","Edge of Tomorrow"
"304",1145133,1146968,"Cage, drop or die!","Edge of Tomorrow"
"305",1190886,1192346,"Yeah! Wooh!","Edge of Tomorrow"
"306",1192596,1193846,"We made it!","Edge of Tomorrow"
"307",1193847,1195808,"Squad, we made it! Yeah...","Edge of Tomorrow"
"308",1215871,1216871,"What the...?!","Edge of Tomorrow"
"309",1338242,1339951,"Private Cage!","Edge of Tomorrow"
"310",1339952,1341663,"You're going the wrong way!","Edge of Tomorrow"
"311",1341788,1343163,"You're gonna miss your moment!","Edge of Tomorrow"
"312",1344207,1345207,"What the hell?","Edge of Tomorrow"
"313",1346041,1347922,"They're not supposed toknow we're even coming.","Edge of Tomorrow"
"314",1348461,1349962,"It's a slaughter house, man!","Edge of Tomorrow"
"315",1350212,1351212,"It's a slaughter house!","Edge of Tomorrow"
"316",1352339,1353592,"Pull yourself together, Ford!","Edge of Tomorrow"
"317",1353717,1355050,"On your feet, people!","Edge of Tomorrow"
"318",1356510,1357510,"Get in line!","Edge of Tomorrow"
"319",1357761,1359138,"Nance, get me a sitrep!","Edge of Tomorrow"
"320",1359346,1360365,"Safety?","Edge of Tomorrow"
"321",1360390,1361599,"Griff, Ford, go to the front!","Edge of Tomorrow"
"322",1362726,1363934,"My safety?","Edge of Tomorrow"
"323",1364978,1366688,"How do I get my safety...?","Edge of Tomorrow"
"324",1367708,1368708,"I'm waiting, Nance!","Edge of Tomorrow"
"325",1368731,1371734,"I got traces! Five hundred metersand they're coming in fast!","Edge of Tomorrow"
"326",1372152,1373236,"Son of a bitch.","Edge of Tomorrow"
"327",1375113,1377406,"Put a line if you want to stay that way.","Edge of Tomorrow"
"328",1378407,1379407,"On your position!","Edge of Tomorrow"
"329",1379992,1380992,"Move!","Edge of Tomorrow"
"330",1382746,1383763,"Here they come.","Edge of Tomorrow"
"331",1383788,1385999,"Mean as hell and filthy as grass.","Edge of Tomorrow"
"332",1386165,1387487,"Wait till the other ride's on us!","Edge of Tomorrow"
"333",1388084,1389085,"Few more seconds!","Edge of Tomorrow"
"334",1391546,1393672,"Hey!","Edge of Tomorrow"
"335",1399679,1400679,"Fall back!","Edge of Tomorrow"
"336",1465036,1466036,"Reload!","Edge of Tomorrow"
"337",1466746,1467747,"Reload!","Edge of Tomorrow"
"338",1498694,1499694,"On your feet, maggot!","Edge of Tomorrow"
"339",1505451,1507892,"Get in line before I bust your holewith my boot heel, maggot!","Edge of Tomorrow"
"340",1508329,1509538,"Hold up there, son.","Edge of Tomorrow"
"341",1513335,1514586,"Can I help you, sir?","Edge of Tomorrow"
"342",1516003,1518214,"Sergeant Farell...","Edge of Tomorrow"
"343",1519132,1520467,"That is my name.","Edge of Tomorrow"
"344",1522384,1523428,"I think I get it.","Edge of Tomorrow"
"345",1524637,1525763,"What was it?","Edge of Tomorrow"
"346",1525931,1526931,"Poker night?","Edge of Tomorrow"
"347",1527057,1528057,"Bachelor party?","Edge of Tomorrow"
"348",1529017,1530143,"I'm not sure.","Edge of Tomorrow"
"349",1531936,1532936,"It happens.","Edge of Tomorrow"
"350",1535065,1536482,"I'll get you sorted out, sir.","Edge of Tomorrow"
"351",1537358,1538442,"Let me take those for you.","Edge of Tomorrow"
"352",1541238,1542238,"What... what day is it?","Edge of Tomorrow"
"353",1542822,1543822,"For you...","Edge of Tomorrow"
"354",1546451,1547451,"Judgment day.","Edge of Tomorrow"
"355",1548869,1550750,"The good new is there'shope for your, Private.","Edge of Tomorrow"
"356",1551455,1553333,"Hope in the form of glorious combat,","Edge of Tomorrow"
"357",1553959,1555544,"battle is the great redeemer,","Edge of Tomorrow"
"358",1556336,1557336,"the fire and crucible...","Edge of Tomorrow"
