"id","startTime","endTime","text","title"
"1",54679,66679,"Fixed & Synced by bozxphd. Enjoy The Flick.","Guardians of the Galaxy Vol. 2"
"2",67680,71228,"There's a girl in this harbor town.","Guardians of the Galaxy Vol. 2"
"3",71400,74358,"And she works layin' whiskey down.","Guardians of the Galaxy Vol. 2"
"4",75079,78867,"They say, ""Brandy, fetch another round"".","Guardians of the Galaxy Vol. 2"
"5",79039,81998,"And she serves them whiskey and wine.","Guardians of the Galaxy Vol. 2"
"6",82239,86198,"The sailors say""Brandy, you're a fine girl"".","Guardians of the Galaxy Vol. 2"
"7",86359,90147,"""What a good wife you would be"".","Guardians of the Galaxy Vol. 2"
"8",101280,103156,"- Come on!- Slow down!","Guardians of the Galaxy Vol. 2"
"9",103240,105230,"This way, my river lily! Come on!","Guardians of the Galaxy Vol. 2"
"10",108039,109188,"Where are you taking me?","Guardians of the Galaxy Vol. 2"
"11",109359,110359,"Come on, come on.","Guardians of the Galaxy Vol. 2"
"12",110879,112710,"Look. Look!","Guardians of the Galaxy Vol. 2"
"13",112920,114876,"Oh, it's beautiful!","Guardians of the Galaxy Vol. 2"
"14",115039,117031,"I was afraidit wouldn't take to the soil...","Guardians of the Galaxy Vol. 2"
"15",117240,118514,"but it rooted quickly.","Guardians of the Galaxy Vol. 2"
"16",118719,121280,"And soon, it'll be everywhere.","Guardians of the Galaxy Vol. 2"
"17",121519,124512,"All across the universe.","Guardians of the Galaxy Vol. 2"
"18",125879,127870,"Well, I don't know whatyou're talking about...","Guardians of the Galaxy Vol. 2"
"19",128039,129632,"but I like the way you say it.","Guardians of the Galaxy Vol. 2"
"20",130080,131478,"My heart is yours...","Guardians of the Galaxy Vol. 2"
"21",132599,134192,"Meredith Quill.","Guardians of the Galaxy Vol. 2"
"22",135400,138710,"I can't believe I fell in lovewith a spaceman.","Guardians of the Galaxy Vol. 2"
"23",191439,193475,"Showtime, a-holes!","Guardians of the Galaxy Vol. 2"
"24",194039,196429,"It will be here any minute.","Guardians of the Galaxy Vol. 2"
"25",196599,198352,"Which will be its loss.","Guardians of the Galaxy Vol. 2"
"26",198560,199959,"I thought your thing was a sword?","Guardians of the Galaxy Vol. 2"
"27",200199,202280,"We've been hired to stopan interdimensional beast...","Guardians of the Galaxy Vol. 2"
"28",202439,205120,"from feeding on those batteries,and I'm gonna stop it with a sword?","Guardians of the Galaxy Vol. 2"
"29",205280,207360,"It's just, swords were your thingand guns were mine.","Guardians of the Galaxy Vol. 2"
"30",207400,210118,"But I guess we're both doing guns now.I just didn't know that.","Guardians of the Galaxy Vol. 2"
"31",210360,213635,"Drax, why aren't you wearingone of Rocket's aero-rigs?","Guardians of the Galaxy Vol. 2"
"32",213879,215108,"It hurts.","Guardians of the Galaxy Vol. 2"
"33",215280,216280,"It hurts?","Guardians of the Galaxy Vol. 2"
"34",217960,219473,"I have sensitive nipples.","Guardians of the Galaxy Vol. 2"
"35",220680,223319,"""My nipples hurt! Oh, goodness me!""","Guardians of the Galaxy Vol. 2"
"36",223479,225038,"What about him? What's he doing?","Guardians of the Galaxy Vol. 2"
"37",225240,227753,"I'm finishing this so we can listento tunes while we work.","Guardians of the Galaxy Vol. 2"
"38",227920,229147,"How is that a priority?","Guardians of the Galaxy Vol. 2"
"39",229319,231675,"Blame Quill. He's the onewho loves music so much.","Guardians of the Galaxy Vol. 2"
"40",231840,233432,"No, I actually agree with Drax on this.","Guardians of the Galaxy Vol. 2"
"41",233599,234998,"That's hardly important right now.","Guardians of the Galaxy Vol. 2"
"42",235159,237435,"Oh, okay. Sure, Quill.","Guardians of the Galaxy Vol. 2"
"43",237680,240513,"No, seriously, I side with Drax.","Guardians of the Galaxy Vol. 2"
"44",240840,244150,"No, I understand that.You're being very serious right now.","Guardians of the Galaxy Vol. 2"
"45",244719,246358,"I can clearly see you winking.","Guardians of the Galaxy Vol. 2"
"46",246759,248751,"Damn it. I'm using my left eye?","Guardians of the Galaxy Vol. 2"
"47",254879,256153,"I am Groot.","Guardians of the Galaxy Vol. 2"
"48",256399,258920,"They were not looking at you funny.","Guardians of the Galaxy Vol. 2"
"49",263040,264792,"Well, that's intense.","Guardians of the Galaxy Vol. 2"
"50",327199,328199,"Groot!","Guardians of the Galaxy Vol. 2"
"51",343600,345908,"Groot, get out of the way!You're gonna get hurt!","Guardians of the Galaxy Vol. 2"
"52",346079,347079,"Hi.","Guardians of the Galaxy Vol. 2"
"53",389519,391795,"No! Spit it out!","Guardians of the Galaxy Vol. 2"
"54",391959,393108,"Come on!","Guardians of the Galaxy Vol. 2"
"55",396120,397519,"Disgusting!","Guardians of the Galaxy Vol. 2"
"56",459199,462033,"The beast's hide is too thickto be pierced from the outside.","Guardians of the Galaxy Vol. 2"
"57",462560,464231,"I must cut through it from the inside.","Guardians of the Galaxy Vol. 2"
"58",464519,465519,"Huh?","Guardians of the Galaxy Vol. 2"
"59",465600,468033,"No, no! Drax, wait a minute!","Guardians of the Galaxy Vol. 2"
"60",468199,469199,"Drax!","Guardians of the Galaxy Vol. 2"
"61",478879,480199,"What is he doing?","Guardians of the Galaxy Vol. 2"
"62",480360,483120,"He said the skin is too thickto be pierced from the outside, so he...","Guardians of the Galaxy Vol. 2"
"63",483240,485216,"- That doesn't make any sense!- I tried telling him that!","Guardians of the Galaxy Vol. 2"
"64",485240,487896,"Skin is the same level of thicknessfrom the inside as from the outside!","Guardians of the Galaxy Vol. 2"
"65",487920,489478,"I realize that.","Guardians of the Galaxy Vol. 2"
"66",493240,495389,"There is a cut on its neck.","Guardians of the Galaxy Vol. 2"
"67",495560,497790,"Rocket, get it to look up.","Guardians of the Galaxy Vol. 2"
"68",500040,502713,"Hey, you giant Sea-Monkey! Up here!","Guardians of the Galaxy Vol. 2"
"69",511600,513078,"Watch it, Quill!","Guardians of the Galaxy Vol. 2"
"70",559919,561831,"Yes! I have single-handedly...","Guardians of the Galaxy Vol. 2"
"71",562919,564559,"vanquished the beast!","Guardians of the Galaxy Vol. 2"
"72",567200,568349,"What?","Guardians of the Galaxy Vol. 2"
"73",578360,579712,"What are they called again?","Guardians of the Galaxy Vol. 2"
"74",580240,581514,"Anulax batteries.","Guardians of the Galaxy Vol. 2"
"75",581840,584034,"Harbulary batteries.","Guardians of the Galaxy Vol. 2"
"76",584200,586509,"That's nothing like what I just said.","Guardians of the Galaxy Vol. 2"
"77",586679,588480,"But they're worththousands of units apiece...","Guardians of the Galaxy Vol. 2"
"78",588519,590559,"which is why the Sovereignhired us to protect them.","Guardians of the Galaxy Vol. 2"
"79",590679,594195,"Careful what you say around these folks.They're easily offended.","Guardians of the Galaxy Vol. 2"
"80",594399,595991,"The cost of transgression is death.","Guardians of the Galaxy Vol. 2"
"81",597519,601479,"We thank you, Guardians,for putting your lives on the line.","Guardians of the Galaxy Vol. 2"
"82",601639,605633,"We could not risk the livesof our own Sovereign citizens.","Guardians of the Galaxy Vol. 2"
"83",606480,610234,"Every citizen is bornexactly as designed by the community.","Guardians of the Galaxy Vol. 2"
"84",610519,613636,"Impeccable,both physically and mentally.","Guardians of the Galaxy Vol. 2"
"85",613840,616070,"We control the DNA of our progeny...","Guardians of the Galaxy Vol. 2"
"86",616159,618355,"germinating them in birthing pods.","Guardians of the Galaxy Vol. 2"
"87",618679,622149,"I guess I prefer to make peoplethe old-fashioned way.","Guardians of the Galaxy Vol. 2"
"88",623679,625799,"Perhaps someday,you could give me a history lesson...","Guardians of the Galaxy Vol. 2"
"89",626360,629510,"in the archaic ways of our ancestors.","Guardians of the Galaxy Vol. 2"
"90",629679,631671,"For academic purposes.","Guardians of the Galaxy Vol. 2"
"91",631960,633756,"I would be honored, yes.","Guardians of the Galaxy Vol. 2"
"92",633919,635911,"In the name of research...","Guardians of the Galaxy Vol. 2"
"93",636080,638594,"I think that could be pretty, uh...","Guardians of the Galaxy Vol. 2"
"94",638759,640033,"repulsive.","Guardians of the Galaxy Vol. 2"
"95",640840,642240,"I'm not into that kind of casual...","Guardians of the Galaxy Vol. 2"
"96",642480,643514,"Oh, please.","Guardians of the Galaxy Vol. 2"
"97",643679,646990,"Your people promised somethingin exchange for our services.","Guardians of the Galaxy Vol. 2"
"98",647159,648433,"Bring it...","Guardians of the Galaxy Vol. 2"
"99",648600,650238,"and we shall gladly be on our way.","Guardians of the Galaxy Vol. 2"
"100",664159,666594,"Family reunion. Yay.","Guardians of the Galaxy Vol. 2"
"101",666759,669193,"I understand she is your sister.","Guardians of the Galaxy Vol. 2"
"102",669360,673557,"She's worth no more to methan the bounty due for her on Xandar.","Guardians of the Galaxy Vol. 2"
"103",674039,678192,"Our soldiers apprehended herattempting to steal the batteries.","Guardians of the Galaxy Vol. 2"
"104",679240,681116,"Do with her as you please.","Guardians of the Galaxy Vol. 2"
"105",684639,686437,"We thank you, High Priestess Ayesha.","Guardians of the Galaxy Vol. 2"
"106",686840,689399,"What is your heritage, Mr. Quill?","Guardians of the Galaxy Vol. 2"
"107",692679,694078,"My mother is from Earth.","Guardians of the Galaxy Vol. 2"
"108",694440,696158,"And your father?","Guardians of the Galaxy Vol. 2"
"109",697799,700792,"He ain't from Missouri. That's all I know.","Guardians of the Galaxy Vol. 2"
"110",700960,702278,"I see it within you.","Guardians of the Galaxy Vol. 2"
"111",702919,705991,"An unorthodox genealogy.","Guardians of the Galaxy Vol. 2"
"112",706279,710398,"A hybrid that seems particularly...","Guardians of the Galaxy Vol. 2"
"113",711480,712959,"reckless.","Guardians of the Galaxy Vol. 2"
"114",714039,717032,"You know, they told me you peoplewere conceited douchebags...","Guardians of the Galaxy Vol. 2"
"115",718399,720470,"but that isn't true at all.","Guardians of the Galaxy Vol. 2"
"116",724799,725799,"Oh, shit.","Guardians of the Galaxy Vol. 2"
"117",725919,727956,"I'm using my wrong eye again,aren't I?","Guardians of the Galaxy Vol. 2"
"118",728159,730389,"I'm sorry. That was meant to bebehind your back.","Guardians of the Galaxy Vol. 2"
"119",732519,734240,"Count yourself blessedthey didn't kill you.","Guardians of the Galaxy Vol. 2"
"120",734320,736072,"You're telling me.","Guardians of the Galaxy Vol. 2"
"121",736240,738434,"You wanna buy some batteries?","Guardians of the Galaxy Vol. 2"
"122",750120,752587,"All right,let's get baldy to Xandar","Guardians of the Galaxy Vol. 2"
"123",752679,754113,"and collect that bounty.","Guardians of the Galaxy Vol. 2"
"124",806360,808395,"That stuff about my father...","Guardians of the Galaxy Vol. 2"
"125",808679,810671,"Who does she think she is?","Guardians of the Galaxy Vol. 2"
"126",810840,813149,"I know you're sensitive about that.","Guardians of the Galaxy Vol. 2"
"127",813320,815519,"I'm not sensitive about it.I just don't know who he is.","Guardians of the Galaxy Vol. 2"
"128",817200,820077,"Sorry if it seemed likeI was flirting with the High Priestess.","Guardians of the Galaxy Vol. 2"
"129",820559,821913,"I wasn't.","Guardians of the Galaxy Vol. 2"
"130",822120,824190,"I don't care if you were.","Guardians of the Galaxy Vol. 2"
"131",824360,826157,"Well, I feel like you do care.","Guardians of the Galaxy Vol. 2"
"132",826320,828549,"That's why I'm apologizing. So, sorry!","Guardians of the Galaxy Vol. 2"
"133",828879,830950,"Gamora is not the one for you, Quill.","Guardians of the Galaxy Vol. 2"
"134",831879,832995,"Damn shadow.","Guardians of the Galaxy Vol. 2"
"135",833279,835191,"There are two types of beingsin the universe...","Guardians of the Galaxy Vol. 2"
"136",835279,837032,"those who dance, and those who do not.","Guardians of the Galaxy Vol. 2"
"137",837440,839077,"Mmm-hmm.","Guardians of the Galaxy Vol. 2"
"138",839440,841431,"I first met my beloved at a war rally.","Guardians of the Galaxy Vol. 2"
"139",841600,842600,"Oh, God.","Guardians of the Galaxy Vol. 2"
"140",842679,845513,"Everyone in the villageflailed about, dancing.","Guardians of the Galaxy Vol. 2"
"141",845679,847238,"Except one woman.","Guardians of the Galaxy Vol. 2"
"142",847600,849033,"My Ovette.","Guardians of the Galaxy Vol. 2"
"143",849840,851875,"I knew immediatelyshe was the one for me.","Guardians of the Galaxy Vol. 2"
"144",852200,854634,"The most melodic song in the worldcould be playing.","Guardians of the Galaxy Vol. 2"
"145",855279,857554,"She wouldn't even tap her foot.","Guardians of the Galaxy Vol. 2"
"146",858399,860515,"Wouldn't move a muscle.","Guardians of the Galaxy Vol. 2"
"147",860679,863399,"One might assume she was dead.","Guardians of the Galaxy Vol. 2"
"148",863559,864958,"That does sound pretty hot.","Guardians of the Galaxy Vol. 2"
"149",865559,868198,"It would makemy nether regions engorge.","Guardians of the Galaxy Vol. 2"
"150",868360,870236,"Okay. I get it, yes.","Guardians of the Galaxy Vol. 2"
"151",870399,872311,"I'm a dancer, Gamora is not.","Guardians of the Galaxy Vol. 2"
"152",872480,875915,"You just need to find a womanwho is pathetic... like you.","Guardians of the Galaxy Vol. 2"
"153",877240,878240,"Mmm.","Guardians of the Galaxy Vol. 2"
"154",881480,884153,"I'm hungry.Hand me some of that yaro root.","Guardians of the Galaxy Vol. 2"
"155",884360,885793,"No. It's not ripe yet...","Guardians of the Galaxy Vol. 2"
"156",885960,886995,"and I hate you.","Guardians of the Galaxy Vol. 2"
"157",887240,888467,"You hate me?","Guardians of the Galaxy Vol. 2"
"158",888639,891359,"You left me therewhile you stole that stone for yourself.","Guardians of the Galaxy Vol. 2"
"159",891519,893590,"And yet here you stand, a hero.","Guardians of the Galaxy Vol. 2"
"160",893799,896552,"I will be free of these shacklessoon enough, and I will kill you.","Guardians of the Galaxy Vol. 2"
"161",897120,898313,"I swear.","Guardians of the Galaxy Vol. 2"
"162",898480,899595,"No.","Guardians of the Galaxy Vol. 2"
"163",899759,901557,"You're gonna live outthe rest of your days","Guardians of the Galaxy Vol. 2"
"164",901639,903153,"in a prison on Xandar...","Guardians of the Galaxy Vol. 2"
"165",903320,904639,"wishing you could.","Guardians of the Galaxy Vol. 2"
"166",911600,912668,"This is weird.","Guardians of the Galaxy Vol. 2"
"167",912840,914696,"We've got a Sovereign fleetapproaching from the rear.","Guardians of the Galaxy Vol. 2"
"168",914720,915855,"Why would they do that?","Guardians of the Galaxy Vol. 2"
"169",915879,917495,"Probably because Rocket stolesome of their batteries.","Guardians of the Galaxy Vol. 2"
"170",917519,918519,"Dude!","Guardians of the Galaxy Vol. 2"
"171",919039,920039,"Right.","Guardians of the Galaxy Vol. 2"
"172",920120,921320,"He didn't steal some of those.","Guardians of the Galaxy Vol. 2"
"173",921360,923640,"I don't know why they're after us.What a mystery this is.","Guardians of the Galaxy Vol. 2"
"174",934360,936191,"What were you thinking?","Guardians of the Galaxy Vol. 2"
"175",936360,937735,"Dude, they were really easy to steal!","Guardians of the Galaxy Vol. 2"
"176",937759,939192,"- That's your defense?- Come on!","Guardians of the Galaxy Vol. 2"
"177",939360,941634,"You saw how that High Priestesstalked down to us.","Guardians of the Galaxy Vol. 2"
"178",941799,943518,"Now I'm teaching her a lesson!","Guardians of the Galaxy Vol. 2"
"179",944320,946913,"Oh, I didn't realize your motivationwas altruism.","Guardians of the Galaxy Vol. 2"
"180",947080,949576,"It's really a shame the Sovereignhave mistaken your intentions...","Guardians of the Galaxy Vol. 2"
"181",949600,951279,"- and they're trying to kill us.- Exactly!","Guardians of the Galaxy Vol. 2"
"182",951360,953111,"I was being sarcastic!","Guardians of the Galaxy Vol. 2"
"183",953279,954349,"Oh, no!","Guardians of the Galaxy Vol. 2"
"184",954519,955696,"You're supposed to usea sarcastic voice!","Guardians of the Galaxy Vol. 2"
"185",955720,956754,"Now I look foolish!","Guardians of the Galaxy Vol. 2"
"186",957200,958536,"Can we put the bickering on hold...","Guardians of the Galaxy Vol. 2"
"187",958559,960596,"until after we survivethis massive space battle?","Guardians of the Galaxy Vol. 2"
"188",960879,962518,"- More incoming!- Good!","Guardians of the Galaxy Vol. 2"
"189",962679,964158,"I wanna kill some guys!","Guardians of the Galaxy Vol. 2"
"190",972039,973399,"You're not killing anyone.","Guardians of the Galaxy Vol. 2"
"191",973559,975072,"All those ships are remotely piloted.","Guardians of the Galaxy Vol. 2"
"192",978600,979600,"Damn it!","Guardians of the Galaxy Vol. 2"
"193",990240,992150,"What is the delay, Admiral?","Guardians of the Galaxy Vol. 2"
"194",992320,996393,"High Priestess, the batteries,they are exceptionally combustible...","Guardians of the Galaxy Vol. 2"
"195",996559,997855,"and could destroy the entire fleet.","Guardians of the Galaxy Vol. 2"
"196",997879,1000599,"Our concern is their slightagainst our people.","Guardians of the Galaxy Vol. 2"
"197",1001320,1004437,"We hired them and they steal from us.","Guardians of the Galaxy Vol. 2"
"198",1005559,1006919,"It is heresy of the highest order.","Guardians of the Galaxy Vol. 2"
"199",1008919,1010911,"All command modules...","Guardians of the Galaxy Vol. 2"
"200",1011080,1013673,"fire with the intent to kill.","Guardians of the Galaxy Vol. 2"
"201",1023080,1024798,"What's the nearest habitable planet?","Guardians of the Galaxy Vol. 2"
"202",1025799,1027153,"It's called Berhert.","Guardians of the Galaxy Vol. 2"
"203",1027400,1029038,"- How many jumps?- Only one.","Guardians of the Galaxy Vol. 2"
"204",1029200,1032192,"But the access point is 47 clicks away.","Guardians of the Galaxy Vol. 2"
"205",1032359,1035192,"And you have to go throughthat quantum asteroid field.","Guardians of the Galaxy Vol. 2"
"206",1044720,1046039,"Quill, to make it through that...","Guardians of the Galaxy Vol. 2"
"207",1046119,1047816,"you'd have to be the greatestpilot in the universe.","Guardians of the Galaxy Vol. 2"
"208",1047839,1048875,"Lucky for us, I...","Guardians of the Galaxy Vol. 2"
"209",1049119,1050472,"I am.","Guardians of the Galaxy Vol. 2"
"210",1063279,1063996,"What are you doing?","Guardians of the Galaxy Vol. 2"
"211",1064279,1066319,"I've been flying this rigsince I was 10 years old.","Guardians of the Galaxy Vol. 2"
"212",1066480,1069392,"I was cybernetically engineeredto pilot a spacecraft.","Guardians of the Galaxy Vol. 2"
"213",1069559,1072313,"You were cybernetically engineeredto be a douchebag!","Guardians of the Galaxy Vol. 2"
"214",1072839,1073839,"Stop it.","Guardians of the Galaxy Vol. 2"
"215",1073960,1075816,"Later on tonight, you're gonna belaying down in your bed...","Guardians of the Galaxy Vol. 2"
"216",1075839,1077976,"and there's gonna be something squishyin your pillow case.","Guardians of the Galaxy Vol. 2"
"217",1078000,1079415,"And you're gonna be like, ""What's this?""","Guardians of the Galaxy Vol. 2"
"218",1079440,1081319,"And it's gonna be becauseI put a turd in there!","Guardians of the Galaxy Vol. 2"
"219",1083000,1085069,"You put your turd in my bed,I shave you.","Guardians of the Galaxy Vol. 2"
"220",1085319,1086798,"Oh, it won't be my turd.","Guardians of the Galaxy Vol. 2"
"221",1086960,1088313,"It will be Drax's.","Guardians of the Galaxy Vol. 2"
"222",1090960,1092632,"I have famously huge turds.","Guardians of the Galaxy Vol. 2"
"223",1092920,1095513,"We're about to die,and this is what we're discussing?","Guardians of the Galaxy Vol. 2"
"224",1098000,1099000,"Son of a...","Guardians of the Galaxy Vol. 2"
"225",1099200,1100598,"Dude! Seriously!","Guardians of the Galaxy Vol. 2"
"226",1101200,1102200,"Hey! Let me...","Guardians of the Galaxy Vol. 2"
"227",1116640,1117913,"Idiots!","Guardians of the Galaxy Vol. 2"
"228",1118160,1119160,"Well, that's what you get","Guardians of the Galaxy Vol. 2"
"229",1119200,1120633,"when Quill flies.","Guardians of the Galaxy Vol. 2"
"230",1120759,1122272,"Ow!","Guardians of the Galaxy Vol. 2"
"231",1122519,1124714,"We still have a Sovereign craftbehind us.","Guardians of the Galaxy Vol. 2"
"232",1127640,1129471,"Our weapons are down.","Guardians of the Galaxy Vol. 2"
"233",1129640,1131710,"20 clicks to the jump!","Guardians of the Galaxy Vol. 2"
"234",1134720,1135720,"Hold on.","Guardians of the Galaxy Vol. 2"
"235",1146079,1148115,"It's not ripe.","Guardians of the Galaxy Vol. 2"
"236",1156039,1158190,"Come on, Zylak. You can do this.","Guardians of the Galaxy Vol. 2"
"237",1161720,1163392,"Yes!","Guardians of the Galaxy Vol. 2"
"238",1164599,1166590,"15 clicks to the jump!","Guardians of the Galaxy Vol. 2"
"239",1167079,1168194,"Come on!","Guardians of the Galaxy Vol. 2"
"240",1169000,1170479,"Keep going!","Guardians of the Galaxy Vol. 2"
"241",1184799,1185914,"10 clicks!","Guardians of the Galaxy Vol. 2"
"242",1189599,1191317,"Die, spaceship!","Guardians of the Galaxy Vol. 2"
"243",1196119,1197394,"You suck, Zylak.","Guardians of the Galaxy Vol. 2"
"244",1197559,1198595,"Typical.","Guardians of the Galaxy Vol. 2"
"245",1201279,1202279,"Five clicks!","Guardians of the Galaxy Vol. 2"
"246",1208119,1209633,"Son of a...","Guardians of the Galaxy Vol. 2"
"247",1210079,1211911,"They went around the field!","Guardians of the Galaxy Vol. 2"
"248",1226279,1228474,"Someone destroyed all our ships!","Guardians of the Galaxy Vol. 2"
"249",1228640,1229867,"What?","Guardians of the Galaxy Vol. 2"
"250",1232759,1234557,"Who?","Guardians of the Galaxy Vol. 2"
"251",1235519,1237032,"One click!","Guardians of the Galaxy Vol. 2"
"252",1238200,1239997,"- What is that?- Who cares?","Guardians of the Galaxy Vol. 2"
"253",1240160,1241433,"That's the jump point! Go!","Guardians of the Galaxy Vol. 2"
"254",1245200,1246917,"It's a guy.","Guardians of the Galaxy Vol. 2"
"255",1254039,1254869,"Oh, my God.","Guardians of the Galaxy Vol. 2"
"256",1255039,1256472,"He's still out there?","Guardians of the Galaxy Vol. 2"
"257",1283559,1285789,"Groot, put your seatbelt on!","Guardians of the Galaxy Vol. 2"
"258",1286680,1288875,"Prepare for a really bad landing!","Guardians of the Galaxy Vol. 2"
"259",1329559,1331516,"That was awesome!","Guardians of the Galaxy Vol. 2"
"260",1332839,1333909,"Yes!","Guardians of the Galaxy Vol. 2"
"261",1336079,1337354,"Look at this!","Guardians of the Galaxy Vol. 2"
"262",1338119,1339711,"Where is the other half of our ship?","Guardians of the Galaxy Vol. 2"
"263",1339880,1340880,"My ship.","Guardians of the Galaxy Vol. 2"
"264",1341039,1344749,"Either one of you could havegotten us through that field...","Guardians of the Galaxy Vol. 2"
"265",1344920,1346135,"had you flown withwhat's between your ears","Guardians of the Galaxy Vol. 2"
"266",1346160,1347638,"instead of what's between your legs!","Guardians of the Galaxy Vol. 2"
"267",1348319,1351153,"If what's between my legshad a hand on it...","Guardians of the Galaxy Vol. 2"
"268",1351319,1353435,"I guarantee I could have landedthis ship with it.","Guardians of the Galaxy Vol. 2"
"269",1354519,1356400,"Peter, we almost diedbecause of your arrogance.","Guardians of the Galaxy Vol. 2"
"270",1356920,1358079,"More like because he stole...","Guardians of the Galaxy Vol. 2"
"271",1358240,1359308,"the Anulax batteries!","Guardians of the Galaxy Vol. 2"
"272",1359480,1361755,"They're called Harbulary batteries.","Guardians of the Galaxy Vol. 2"
"273",1361960,1363551,"No, they're not!","Guardians of the Galaxy Vol. 2"
"274",1363720,1365392,"Do you know why I did it,Star-Munch? Hmm?","Guardians of the Galaxy Vol. 2"
"275",1366200,1367680,"I'm not gonna answer to ""Star-Munch.""","Guardians of the Galaxy Vol. 2"
"276",1367799,1369711,"I did it because I wanted to!","Guardians of the Galaxy Vol. 2"
"277",1369880,1370517,"Dick.","Guardians of the Galaxy Vol. 2"
"278",1370720,1372596,"What are we even talking about this for?","Guardians of the Galaxy Vol. 2"
"279",1372759,1375228,"We just had a little man save usby blowing up 50 ships!","Guardians of the Galaxy Vol. 2"
"280",1375400,1376400,"How little?","Guardians of the Galaxy Vol. 2"
"281",1376440,1378634,"Well, I don't know, like this?","Guardians of the Galaxy Vol. 2"
"282",1378839,1380478,"A little one-inch man saved us?","Guardians of the Galaxy Vol. 2"
"283",1380640,1382880,"Well, if he got closer,I'm sure he would be much larger.","Guardians of the Galaxy Vol. 2"
"284",1382960,1385315,"That's how eyesight works,you stupid raccoon.","Guardians of the Galaxy Vol. 2"
"285",1385480,1386798,"Don't call me a raccoon!","Guardians of the Galaxy Vol. 2"
"286",1387200,1389634,"I'm sorry. I took it too far.","Guardians of the Galaxy Vol. 2"
"287",1390480,1391753,"I meant trash panda.","Guardians of the Galaxy Vol. 2"
"288",1394119,1395314,"Is that better?","Guardians of the Galaxy Vol. 2"
"289",1395799,1397551,"I don't know.","Guardians of the Galaxy Vol. 2"
"290",1397720,1399950,"It's worse. It's so much worse.","Guardians of the Galaxy Vol. 2"
"291",1400119,1401347,"You son of a...","Guardians of the Galaxy Vol. 2"
"292",1401519,1402236,"Hey!","Guardians of the Galaxy Vol. 2"
"293",1402400,1403895,"- I've had it with you!- No! Back up!","Guardians of the Galaxy Vol. 2"
"294",1403920,1405960,"Someone followed youthrough the jump point.","Guardians of the Galaxy Vol. 2"
"295",1407680,1409875,"Set me free, you'll need my help.","Guardians of the Galaxy Vol. 2"
"296",1410039,1411154,"I'm not a fool, Nebula.","Guardians of the Galaxy Vol. 2"
"297",1411319,1413336,"You are a fool if you deprive yourselfa hand in combat.","Guardians of the Galaxy Vol. 2"
"298",1413359,1414695,"You'll attack me the moment I let you go.","Guardians of the Galaxy Vol. 2"
"299",1414720,1415720,"No, I won't.","Guardians of the Galaxy Vol. 2"
