"id","startTime","endTime","text","title"
"1179",5393439,5396876,"Who in the hell do you think you are?","Guardians of the Galaxy Vol. 2"
"1180",5397039,5398597,"You killed my mother!","Guardians of the Galaxy Vol. 2"
"1181",5398760,5399795,"I tried...","Guardians of the Galaxy Vol. 2"
"1182",5399960,5401712,"so hard...","Guardians of the Galaxy Vol. 2"
"1183",5401880,5403359,"to find the form...","Guardians of the Galaxy Vol. 2"
"1184",5403520,5405908,"that best suited you...","Guardians of the Galaxy Vol. 2"
"1185",5406079,5408389,"and this is the thanks I get?","Guardians of the Galaxy Vol. 2"
"1186",5410199,5412588,"You really need to grow up.","Guardians of the Galaxy Vol. 2"
"1187",5416279,5419078,"I wanted to do this together...","Guardians of the Galaxy Vol. 2"
"1188",5419239,5421195,"but I suppose you'll have to learn","Guardians of the Galaxy Vol. 2"
"1189",5421279,5424590,"by spending the next thousand yearsas a battery!","Guardians of the Galaxy Vol. 2"
"1190",5426319,5427992,"Finally! Rocket?","Guardians of the Galaxy Vol. 2"
"1191",5428159,5430993,"Keep that transmitter nearby,so I can find you.","Guardians of the Galaxy Vol. 2"
"1192",5431159,5434356,"We're in an old piece of constructionequipment Yondu once used...","Guardians of the Galaxy Vol. 2"
"1193",5434520,5435935,"to slice open the Bank of A 'askavaria.","Guardians of the Galaxy Vol. 2"
"1194",5435960,5436960,"Ego's unhinged.","Guardians of the Galaxy Vol. 2"
"1195",5437000,5438479,"I know. Get ready.","Guardians of the Galaxy Vol. 2"
"1196",5438640,5439913,"Drop her, Kraglin.","Guardians of the Galaxy Vol. 2"
"1197",5458520,5459668,"No.","Guardians of the Galaxy Vol. 2"
"1198",5470840,5473672,"My life, my love.","Guardians of the Galaxy Vol. 2"
"1199",5473840,5476034,"My lady is the sea","Guardians of the Galaxy Vol. 2"
"1200",5478199,5479314,"Peter...","Guardians of the Galaxy Vol. 2"
"1201",5480119,5482314,"this is the sea.","Guardians of the Galaxy Vol. 2"
"1202",5484399,5485399,"Oh...","Guardians of the Galaxy Vol. 2"
"1203",5525600,5527192,"Hey, there, jackass!","Guardians of the Galaxy Vol. 2"
"1204",5537520,5539033,"What is that thing?","Guardians of the Galaxy Vol. 2"
"1205",5546560,5548390,"Out of the way, dumber, smaller Groot!","Guardians of the Galaxy Vol. 2"
"1206",5553239,5555912,"I told you something didn't feel right.","Guardians of the Galaxy Vol. 2"
"1207",5556079,5558389,"""I told you so.""Just what I need to hear right now.","Guardians of the Galaxy Vol. 2"
"1208",5558560,5560231,"Well, I came back, didn't I?","Guardians of the Galaxy Vol. 2"
"1209",5560880,5562239,"Because there's an unspoken thing.","Guardians of the Galaxy Vol. 2"
"1210",5562359,5564430,"There is no unspoken thing.","Guardians of the Galaxy Vol. 2"
"1211",5564600,5566439,"What are you doing?You could've killed us all!","Guardians of the Galaxy Vol. 2"
"1212",5566920,5568478,"Uh... ""Thank you, Rocket""?","Guardians of the Galaxy Vol. 2"
"1213",5568640,5569833,"We had it under control.","Guardians of the Galaxy Vol. 2"
"1214",5570039,5572314,"We did not.That is only an extension...","Guardians of the Galaxy Vol. 2"
"1215",5572479,5574515,"of his true self.He will be back soon.","Guardians of the Galaxy Vol. 2"
"1216",5574680,5575953,"What's Smurfette doing here?","Guardians of the Galaxy Vol. 2"
"1217",5576119,5578030,"Whatever I need to do to geta damn ride home.","Guardians of the Galaxy Vol. 2"
"1218",5578199,5579427,"She tried to murder me!","Guardians of the Galaxy Vol. 2"
"1219",5579600,5581591,"I saved you, you stupid fox!","Guardians of the Galaxy Vol. 2"
"1220",5581800,5583028,"He's not a fox.","Guardians of the Galaxy Vol. 2"
"1221",5583199,5585270,"- I am Groot.- I'm not a raboon, either.","Guardians of the Galaxy Vol. 2"
"1222",5585439,5586439,"I am Groot.","Guardians of the Galaxy Vol. 2"
"1223",5586640,5588038,"""Raccoon."" Whatever.","Guardians of the Galaxy Vol. 2"
"1224",5591560,5592878,"How do we kill a Celestial?","Guardians of the Galaxy Vol. 2"
"1225",5593039,5594472,"There's a center to him.","Guardians of the Galaxy Vol. 2"
"1226",5594640,5596756,"His brain, his soul, whatever it is...","Guardians of the Galaxy Vol. 2"
"1227",5596840,5598039,"Some sort of protective shell.","Guardians of the Galaxy Vol. 2"
"1228",5598479,5599515,"It's in the caverns...","Guardians of the Galaxy Vol. 2"
"1229",5599680,5600680,"below the surface.","Guardians of the Galaxy Vol. 2"
"1230",5603359,5604872,"Yondu?","Guardians of the Galaxy Vol. 2"
"1231",5613560,5614675,"Thrusters are out.","Guardians of the Galaxy Vol. 2"
"1232",5615239,5617070,"Guess I should be gladI was a skinny kid.","Guardians of the Galaxy Vol. 2"
"1233",5617239,5619199,"Otherwise, you'd havedelivered me to this maniac.","Guardians of the Galaxy Vol. 2"
"1234",5619239,5620496,"You still reckon that's the reason","Guardians of the Galaxy Vol. 2"
"1235",5620520,5621680,"I kept you around, you idiot?","Guardians of the Galaxy Vol. 2"
"1236",5621840,5623439,"That's what you told me, you old doofus.","Guardians of the Galaxy Vol. 2"
"1237",5623960,5626079,"Once I figured outwhat happened to them other kids...","Guardians of the Galaxy Vol. 2"
"1238",5626199,5627792,"I wasn't just gonna hand you over.","Guardians of the Galaxy Vol. 2"
"1239",5627960,5629551,"You said you were gonna eat me.","Guardians of the Galaxy Vol. 2"
"1240",5629720,5631118,"That was being funny!","Guardians of the Galaxy Vol. 2"
"1241",5631960,5633154,"Not to me!","Guardians of the Galaxy Vol. 2"
"1242",5633319,5634547,"You people have issues.","Guardians of the Galaxy Vol. 2"
"1243",5634720,5636438,"Of course I have issues.","Guardians of the Galaxy Vol. 2"
"1244",5637399,5640198,"That's my freakin' father!","Guardians of the Galaxy Vol. 2"
"1245",5640399,5641957,"Thrusters are back up.","Guardians of the Galaxy Vol. 2"
"1246",5655560,5657710,"- We should be going up!- We can't!","Guardians of the Galaxy Vol. 2"
"1247",5657920,5660387,"Ego wants to eradicatethe universe as we know it.","Guardians of the Galaxy Vol. 2"
"1248",5660560,5661958,"We have to kill him.","Guardians of the Galaxy Vol. 2"
"1249",5662119,5662791,"Rocket!","Guardians of the Galaxy Vol. 2"
"1250",5662960,5663960,"Got it!","Guardians of the Galaxy Vol. 2"
"1251",5670239,5672673,"Whoo-hoo!","Guardians of the Galaxy Vol. 2"
"1252",5677880,5679711,"So, we're saving the galaxy again?","Guardians of the Galaxy Vol. 2"
"1253",5679880,5680914,"I guess.","Guardians of the Galaxy Vol. 2"
"1254",5681079,5682079,"Awesome!","Guardians of the Galaxy Vol. 2"
"1255",5684239,5686390,"We're really gonna be able tojack up our prices...","Guardians of the Galaxy Vol. 2"
"1256",5686560,5688198,"if we're two-time galaxy savers.","Guardians of the Galaxy Vol. 2"
"1257",5688359,5690920,"I seriously can't believethat's where your mind goes.","Guardians of the Galaxy Vol. 2"
"1258",5691119,5693838,"It was just a random thought, man.I thought we were friends.","Guardians of the Galaxy Vol. 2"
"1259",5694039,5696279,"Of course, I care about the planets,and the buildings...","Guardians of the Galaxy Vol. 2"
"1260",5696439,5698192,"and all the animals on the planets.","Guardians of the Galaxy Vol. 2"
"1261",5698359,5699554,"And the people.","Guardians of the Galaxy Vol. 2"
"1262",5699720,5700913,"Meh.","Guardians of the Galaxy Vol. 2"
"1263",5701439,5705479,"The crabby puppy is so cute.He makes me wanna die!","Guardians of the Galaxy Vol. 2"
"1264",5743239,5744239,"Pilots...","Guardians of the Galaxy Vol. 2"
"1265",5744399,5745752,"release envoy units.","Guardians of the Galaxy Vol. 2"
"1266",5748039,5752078,"Our sensors detect the batteriesare below the surface of the planet.","Guardians of the Galaxy Vol. 2"
"1267",5753960,5755029,"Dive!","Guardians of the Galaxy Vol. 2"
"1268",5771880,5773359,"Um... Captain?","Guardians of the Galaxy Vol. 2"
"1269",5774159,5775559,"Captain?","Guardians of the Galaxy Vol. 2"
"1270",5780520,5782192,"Tell me why Ego wants you here?","Guardians of the Galaxy Vol. 2"
"1271",5782720,5784496,"He needs my genetic connectionto the light...","Guardians of the Galaxy Vol. 2"
"1272",5784520,5786715,"to help destroy the universe.","Guardians of the Galaxy Vol. 2"
"1273",5786920,5789069,"He tried to teach mehow to control the power.","Guardians of the Galaxy Vol. 2"
"1274",5789239,5790354,"So, could you?","Guardians of the Galaxy Vol. 2"
"1275",5790520,5791713,"A little.","Guardians of the Galaxy Vol. 2"
"1276",5791880,5793108,"I made a ball.","Guardians of the Galaxy Vol. 2"
"1277",5793279,5794279,"A ball?","Guardians of the Galaxy Vol. 2"
"1278",5794439,5796158,"I thought as hard as I could.","Guardians of the Galaxy Vol. 2"
"1279",5796239,5797797,"It was all that I could come up with.","Guardians of the Galaxy Vol. 2"
"1280",5797960,5799279,"You ""thought""?","Guardians of the Galaxy Vol. 2"
"1281",5799479,5801550,"You think when I make this arrow fly...","Guardians of the Galaxy Vol. 2"
"1282",5801720,5803551,"I use my head?","Guardians of the Galaxy Vol. 2"
"1283",5815039,5816359,"Whoa.","Guardians of the Galaxy Vol. 2"
"1284",5825119,5826119,"There.","Guardians of the Galaxy Vol. 2"
"1285",5826279,5828235,"That's Ego's core.","Guardians of the Galaxy Vol. 2"
"1286",5830600,5832238,"That ore is thick, Rocket.","Guardians of the Galaxy Vol. 2"
"1287",5832399,5834037,"I got it covered.","Guardians of the Galaxy Vol. 2"
"1288",5840520,5841838,"We must hurry.","Guardians of the Galaxy Vol. 2"
"1289",5842000,5844036,"It will not take Ego long to find us.","Guardians of the Galaxy Vol. 2"
"1290",5848359,5849554,"Keep it steady.","Guardians of the Galaxy Vol. 2"
"1291",5856039,5857996,"We drill into the center, we kill him!","Guardians of the Galaxy Vol. 2"
"1292",5864520,5865747,"Captain?","Guardians of the Galaxy Vol. 2"
"1293",5866159,5867194,"What is it, Kraglin?","Guardians of the Galaxy Vol. 2"
"1294",5867359,5869315,"Hey, remember that Ayesha chick?","Guardians of the Galaxy Vol. 2"
"1295",5869880,5871791,"- Yeah, why?- Uh...","Guardians of the Galaxy Vol. 2"
"1296",5872079,5873274,"Oh, hell!","Guardians of the Galaxy Vol. 2"
"1297",5893880,5895471,"Why aren't you firing the lasers?","Guardians of the Galaxy Vol. 2"
"1298",5895920,5897637,"They blew out the generator.","Guardians of the Galaxy Vol. 2"
"1299",5897800,5900597,"I think I packed a small detonator.","Guardians of the Galaxy Vol. 2"
"1300",5900760,5902456,"A detonator is worthlesswithout explosives.","Guardians of the Galaxy Vol. 2"
"1301",5902479,5903958,"Well, we got these.","Guardians of the Galaxy Vol. 2"
"1302",5904720,5906756,"Is that thing strong enough to kill Ego?","Guardians of the Galaxy Vol. 2"
"1303",5906960,5908837,"If it is, it'll cause a chain reaction...","Guardians of the Galaxy Vol. 2"
"1304",5909000,5910671,"throughout his entire nervous system.","Guardians of the Galaxy Vol. 2"
"1305",5910880,5911630,"Meaning what?","Guardians of the Galaxy Vol. 2"
"1306",5911840,5913353,"The entire planet will explode.","Guardians of the Galaxy Vol. 2"
"1307",5913520,5914953,"We'll have to get out of here fast.","Guardians of the Galaxy Vol. 2"
"1308",5915119,5916712,"I rigged a timer.","Guardians of the Galaxy Vol. 2"
"1309",5917680,5918748,"Go!","Guardians of the Galaxy Vol. 2"
"1310",5932960,5934677,"He's coming.","Guardians of the Galaxy Vol. 2"
"1311",5936119,5937837,"Didn't you sayyou could make him sleep?","Guardians of the Galaxy Vol. 2"
"1312",5938359,5940748,"When he wants. He's too powerful.","Guardians of the Galaxy Vol. 2"
"1313",5940920,5942238,"I can't!","Guardians of the Galaxy Vol. 2"
"1314",5942760,5944636,"You don't have to believe in yourself...","Guardians of the Galaxy Vol. 2"
"1315",5945359,5947395,"because I believe in you.","Guardians of the Galaxy Vol. 2"
"1316",5959800,5960800,"Sleep!","Guardians of the Galaxy Vol. 2"
"1317",5968199,5969840,"I never thought she'd be able to do it...","Guardians of the Galaxy Vol. 2"
"1318",5969920,5972149,"with as weak and skinnyas she appears to be.","Guardians of the Galaxy Vol. 2"
"1319",5973079,5975992,"I don't know how long I can hold him.","Guardians of the Galaxy Vol. 2"
"1320",5979319,5980992,"The metal's too thick.","Guardians of the Galaxy Vol. 2"
"1321",5981199,5984475,"For the bomb to work, we'd actuallyneed to place it on Ego's core.","Guardians of the Galaxy Vol. 2"
"1322",5984640,5986960,"And our fat butts ain't gonna fitthrough those tiny holes.","Guardians of the Galaxy Vol. 2"
"1323",5987600,5988600,"Well...","Guardians of the Galaxy Vol. 2"
"1324",5991399,5993230,"That's a terrible idea.","Guardians of the Galaxy Vol. 2"
"1325",5993399,5995675,"Which is the only kind of ideawe have left.","Guardians of the Galaxy Vol. 2"
"1326",5996680,5998158,"Unbelievable.","Guardians of the Galaxy Vol. 2"
"1327",5998319,6000515,"""Rocket, do this. Rocket, do that.""","Guardians of the Galaxy Vol. 2"
"1328",6002119,6003599,"What a day.","Guardians of the Galaxy Vol. 2"
"1329",6011159,6014755,"All right, first you flick this switch,then this switch.","Guardians of the Galaxy Vol. 2"
"1330",6014920,6016069,"That activates it.","Guardians of the Galaxy Vol. 2"
"1331",6016279,6018077,"Then you push this button...","Guardians of the Galaxy Vol. 2"
"1332",6018279,6021317,"which will give you five minutesto get out of there.","Guardians of the Galaxy Vol. 2"
"1333",6021479,6022753,"Now, whatever you do...","Guardians of the Galaxy Vol. 2"
"1334",6023399,6025788,"don't push this button...","Guardians of the Galaxy Vol. 2"
"1335",6025960,6028029,"because that will set offthe bomb immediately","Guardians of the Galaxy Vol. 2"
"1336",6028119,6029599,"and we'll all be dead.","Guardians of the Galaxy Vol. 2"
"1337",6029720,6032154,"Now, repeat back what I just said.","Guardians of the Galaxy Vol. 2"
"1338",6032319,6033992,"- I am Groot.- Uh-huh.","Guardians of the Galaxy Vol. 2"
"1339",6034279,6036235,"- I am Groot.- That's right.","Guardians of the Galaxy Vol. 2"
"1340",6036399,6037515,"- I am Groot.- No!","Guardians of the Galaxy Vol. 2"
"1341",6037960,6040269,"No, that's the buttonthat will kill everyone!","Guardians of the Galaxy Vol. 2"
"1342",6040439,6041439,"Try again.","Guardians of the Galaxy Vol. 2"
"1343",6042680,6043828,"Hmm...","Guardians of the Galaxy Vol. 2"
"1344",6044479,6046231,"- I am Groot.- Mmm-hmm.","Guardians of the Galaxy Vol. 2"
"1345",6046479,6048550,"- I am Groot.- Uh-huh.","Guardians of the Galaxy Vol. 2"
"1346",6048720,6049720,"I am Groot.","Guardians of the Galaxy Vol. 2"
"1347",6049800,6051631,"No! That's exactly what you just said!","Guardians of the Galaxy Vol. 2"
"1348",6051800,6053391,"How is that even possible?","Guardians of the Galaxy Vol. 2"
"1349",6053560,6055789,"Which button is the buttonyou're supposed to push?","Guardians of the Galaxy Vol. 2"
"1350",6055960,6057029,"Point to it.","Guardians of the Galaxy Vol. 2"
"1351",6057199,6058199,"No!","Guardians of the Galaxy Vol. 2"
"1352",6058520,6060271,"Hey, you're making him nervous!","Guardians of the Galaxy Vol. 2"
"1353",6060439,6062192,"Shut up and get me some tape!","Guardians of the Galaxy Vol. 2"
"1354",6062359,6063840,"Does anybody have any tape out there?","Guardians of the Galaxy Vol. 2"
"1355",6063880,6065631,"I wanna put some tapeover the death button.","Guardians of the Galaxy Vol. 2"
"1356",6065800,6068677,"I don't have any tape. Let me check.","Guardians of the Galaxy Vol. 2"
"1357",6068840,6071512,"Yo, Yondu... Ow!","Guardians of the Galaxy Vol. 2"
"1358",6071640,6073789,"Do you have any tape?","Guardians of the Galaxy Vol. 2"
"1359",6076119,6079157,"Gamora? Do you have any tape?","Guardians of the Galaxy Vol. 2"
"1360",6079319,6080354,"Tape!","Guardians of the Galaxy Vol. 2"
"1361",6080520,6082953,"Never mind. Ow!","Guardians of the Galaxy Vol. 2"
"1362",6083880,6086394,"Drax, do you have any tape?","Guardians of the Galaxy Vol. 2"
"1363",6086479,6089153,"Yes, Scotch tape would work.","Guardians of the Galaxy Vol. 2"
"1364",6089439,6091399,"Then why did you ask meif Scotch tape would work,","Guardians of the Galaxy Vol. 2"
"1365",6091520,6092998,"if you don't have any?","Guardians of the Galaxy Vol. 2"
"1366",6094000,6095228,"Nobody has any tape!","Guardians of the Galaxy Vol. 2"
"1367",6095439,6096759,"Not a single person has tape?","Guardians of the Galaxy Vol. 2"
"1368",6097159,6098159,"Nope!","Guardians of the Galaxy Vol. 2"
"1369",6098359,6099475,"Did you ask Nebula?","Guardians of the Galaxy Vol. 2"
"1370",6100359,6101030,"Yes!","Guardians of the Galaxy Vol. 2"
"1371",6101239,6102514,"Are you sure?","Guardians of the Galaxy Vol. 2"
"1372",6102680,6103998,"I asked Yondu...","Guardians of the Galaxy Vol. 2"
"1373",6104199,6106376,"- and she was sitting next to him.- I knew you were lying!","Guardians of the Galaxy Vol. 2"
"1374",6106399,6108655,"You have priceless batteriesand an atomic bomb in your bag.","Guardians of the Galaxy Vol. 2"
"1375",6108680,6111069,"If anybody's gonna have tape, it's you!","Guardians of the Galaxy Vol. 2"
"1376",6111239,6114755,"That's exactly my point!I have to do everything!","Guardians of the Galaxy Vol. 2"
"1377",6114960,6117427,"You are wasting a lot of time here!","Guardians of the Galaxy Vol. 2"
"1378",6119920,6121034,"Whee!","Guardians of the Galaxy Vol. 2"
"1379",6123800,6125711,"We're all gonna die.","Guardians of the Galaxy Vol. 2"
"1380",6127439,6129555,"Rear thrusters are out again!","Guardians of the Galaxy Vol. 2"
"1381",6129800,6132472,"We're done for without that generator!","Guardians of the Galaxy Vol. 2"
"1382",6145840,6147068,"Guardians...","Guardians of the Galaxy Vol. 2"
"1383",6147880,6149551,"perhaps it will provide you solace...","Guardians of the Galaxy Vol. 2"
"1384",6149720,6152314,"that your deathsare not without purpose.","Guardians of the Galaxy Vol. 2"
"1385",6152880,6154438,"They will serve as a warning...","Guardians of the Galaxy Vol. 2"
"1386",6154600,6156988,"to all of those tempted with betraying us.","Guardians of the Galaxy Vol. 2"
"1387",6157520,6160318,"Don't screw with the Sovereign.","Guardians of the Galaxy Vol. 2"
"1388",6164079,6165149,"This is gonna hurt.","Guardians of the Galaxy Vol. 2"
"1389",6165319,6166832,"Promises, promises.","Guardians of the Galaxy Vol. 2"
"1390",6177279,6178279,"Hey!","Guardians of the Galaxy Vol. 2"
"1391",6189920,6190920,"No!","Guardians of the Galaxy Vol. 2"
"1392",6191520,6193636,"No! No! No!","Guardians of the Galaxy Vol. 2"
"1393",6199119,6200119,"We're gonna blow!","Guardians of the Galaxy Vol. 2"
"1394",6205399,6207310,"Peter! No!","Guardians of the Galaxy Vol. 2"
"1395",6227239,6228239,"What?","Guardians of the Galaxy Vol. 2"
"1396",6228560,6230551,"You look like Mary Poppins.","Guardians of the Galaxy Vol. 2"
"1397",6230720,6232118,"Is he cool?","Guardians of the Galaxy Vol. 2"
"1398",6233920,6235557,"Hell, yeah, he's cool.","Guardians of the Galaxy Vol. 2"
"1399",6236319,6238197,"I'm Mary Poppins, y'all!","Guardians of the Galaxy Vol. 2"
"1400",6265640,6267595,"Mantis, look out!","Guardians of the Galaxy Vol. 2"
"1401",6279720,6281311,"She's just unconscious.","Guardians of the Galaxy Vol. 2"
"1402",6297359,6298917,"How long until the bomb goes off?","Guardians of the Galaxy Vol. 2"
"1403",6299079,6301435,"In the unlikely eventthat Groot doesn't kill us all...","Guardians of the Galaxy Vol. 2"
"1404",6301600,6302748,"about six minutes.","Guardians of the Galaxy Vol. 2"
"1405",6307800,6310314,"Kraglin, we need the quadrantfor an extraction.","Guardians of the Galaxy Vol. 2"
"1406",6310479,6311479,"T-minus five minutes.","Guardians of the Galaxy Vol. 2"
"1407",6311640,6312788,"Aye, Captain.","Guardians of the Galaxy Vol. 2"
"1408",6316680,6318560,"Somebody's gotta be up topwhen Kraglin arrives.","Guardians of the Galaxy Vol. 2"
"1409",6319840,6321353,"Drax, take Mantis.","Guardians of the Galaxy Vol. 2"
"1410",6324239,6325514,"Ow! My nipples!","Guardians of the Galaxy Vol. 2"
"1411",6334199,6335394,"Gamora!","Guardians of the Galaxy Vol. 2"
"1412",6338720,6339755,"Peter!","Guardians of the Galaxy Vol. 2"
"1413",6366079,6367399,"Get over it.","Guardians of the Galaxy Vol. 2"
"1414",6367880,6371588,"Come now, Peter.I know this isn't what you want.","Guardians of the Galaxy Vol. 2"
"1415",6373760,6378117,"What kind of father would I beto let you make this choice?","Guardians of the Galaxy Vol. 2"
"1416",6407680,6409671,"Yeah!","Guardians of the Galaxy Vol. 2"
"1417",6409760,6413389,"Soon, Peter, we will be all there is.","Guardians of the Galaxy Vol. 2"
"1418",6414079,6417152,"So stop pissing me off!","Guardians of the Galaxy Vol. 2"
"1419",6437399,6439039,"We have to get upto the extraction point!","Guardians of the Galaxy Vol. 2"
"1420",6447159,6448159,"Go!","Guardians of the Galaxy Vol. 2"
"1421",6567560,6569152,"I told you...","Guardians of the Galaxy Vol. 2"
"1422",6569319,6573154,"I don't want to do this alone.","Guardians of the Galaxy Vol. 2"
"1423",6576359,6577395,"You cannot deny...","Guardians of the Galaxy Vol. 2"
"1424",6577520,6581832,"the purpose the universehas bestowed upon you.","Guardians of the Galaxy Vol. 2"
"1425",6591079,6592797,"Everyone,I need you to stay back!","Guardians of the Galaxy Vol. 2"
"1426",6592960,6593960,"What is that?","Guardians of the Galaxy Vol. 2"
"1427",6609720,6611914,"It doesn't need to belike this, Peter.","Guardians of the Galaxy Vol. 2"
"1428",6614079,6617072,"Why are you destroying our chance?","Guardians of the Galaxy Vol. 2"
"1429",6619840,6622957,"Stop pretending you aren'twhat you are.","Guardians of the Galaxy Vol. 2"
"1430",6624800,6625800,"One in billions.","Guardians of the Galaxy Vol. 2"
"1431",6627560,6629390,"Trillions. Even more.","Guardians of the Galaxy Vol. 2"
"1432",6631760,6636117,"What greater meaningcan life possibly have to offer?","Guardians of the Galaxy Vol. 2"
"1433",6638800,6642872,"I don't use my head to fly the arrow, boy!","Guardians of the Galaxy Vol. 2"
"1434",6643479,6645356,"I use my heart...","Guardians of the Galaxy Vol. 2"
"1435",6680600,6684309,"You shouldn't have killed my mom,and squished my Walkman.","Guardians of the Galaxy Vol. 2"
"1436",6684479,6688074,"And if you don't love me now.","Guardians of the Galaxy Vol. 2"
"1437",6688279,6690588,"You will never love me again","Guardians of the Galaxy Vol. 2"
"1438",6690800,6693632,"I can still hear you saying.","Guardians of the Galaxy Vol. 2"
"1439",6693840,6697752,"You would never break the chain.","Guardians of the Galaxy Vol. 2"
"1440",6697960,6699871,"And if you don't love me now.","Guardians of the Galaxy Vol. 2"
"1441",6700119,6702680,"You will never love me again.","Guardians of the Galaxy Vol. 2"
"1442",6703439,6707591,"I can still hear you saying.","Guardians of the Galaxy Vol. 2"
"1443",6707800,6710552,"You would never break the chain.","Guardians of the Galaxy Vol. 2"
"1444",6710760,6713194,"And if you don't love me now.","Guardians of the Galaxy Vol. 2"
"1445",6713359,6716351,"You will never love me again","Guardians of the Galaxy Vol. 2"
"1446",6716560,6719279,"I can still hear you saying.","Guardians of the Galaxy Vol. 2"
"1447",6719399,6721960,"You would never break the chain.","Guardians of the Galaxy Vol. 2"
"1448",6724640,6727551,"Groot? If you can hear me, hurry up!","Guardians of the Galaxy Vol. 2"
"1449",6727720,6730756,"I'm not sure how long Quillcan keep him distracted!","Guardians of the Galaxy Vol. 2"
"1450",6731239,6732797,"Groot, hurry!","Guardians of the Galaxy Vol. 2"
"1451",6788560,6790710,"Yondu, we're about to blow!","Guardians of the Galaxy Vol. 2"
"1452",6791000,6792353,"Get to the ship!","Guardians of the Galaxy Vol. 2"
"1453",6792520,6793555,"Not without Quill!","Guardians of the Galaxy Vol. 2"
"1454",6794000,6795877,"You need to take care of the twig!","Guardians of the Galaxy Vol. 2"
"1455",6797239,6798957,"Not without you!","Guardians of the Galaxy Vol. 2"
"1456",6800199,6803510,"I ain't done nothin' rightmy whole damn life, rat.","Guardians of the Galaxy Vol. 2"
"1457",6806880,6808996,"You need to give me this.","Guardians of the Galaxy Vol. 2"
"1458",6817239,6818239,"Uh...","Guardians of the Galaxy Vol. 2"
"1459",6819319,6821787,"A spacesuit and an aero-rig.","Guardians of the Galaxy Vol. 2"
"1460",6822000,6824069,"I only have one of each.","Guardians of the Galaxy Vol. 2"
"1461",6836399,6837957,"I am Groot.","Guardians of the Galaxy Vol. 2"
"1462",6838760,6839828,"What's that?","Guardians of the Galaxy Vol. 2"
"1463",6841560,6845757,"He says, ""Welcome to the frickin'Guardians of the Galaxy.""","Guardians of the Galaxy Vol. 2"
"1464",6846359,6848635,"Only he didn't use ""frickin'.""","Guardians of the Galaxy Vol. 2"
"1465",6854960,6856029,"Bye, twig.","Guardians of the Galaxy Vol. 2"
"1466",6857960,6861430,"We're gonna need to havea real discussion about your language.","Guardians of the Galaxy Vol. 2"
"1467",6916159,6917159,"Where's Peter?","Guardians of the Galaxy Vol. 2"
"1468",6918000,6919956,"Rocket, where is he?","Guardians of the Galaxy Vol. 2"
"1469",6920680,6921680,"Rocket.","Guardians of the Galaxy Vol. 2"
"1470",6921840,6923398,"Rocket, look at me! Where is he?","Guardians of the Galaxy Vol. 2"
"1471",6926039,6927039,"Mmm...","Guardians of the Galaxy Vol. 2"
"1472",6929840,6932194,"No. I'm not leaving without him.","Guardians of the Galaxy Vol. 2"
"1473",6939199,6940199,"I'm sorry.","Guardians of the Galaxy Vol. 2"
"1474",6941000,6943797,"I can only afford to loseone friend today.","Guardians of the Galaxy Vol. 2"
"1475",6944359,6945359,"Kraglin, go!","Guardians of the Galaxy Vol. 2"
"1476",6946239,6947239,"Wait...","Guardians of the Galaxy Vol. 2"
"1477",6948000,6949557,"Is Quill back?","Guardians of the Galaxy Vol. 2"
"1478",6951079,6953514,"Rocket, where's Quill?","Guardians of the Galaxy Vol. 2"
"1479",6954640,6957916,"Rocket, where's Quill?","Guardians of the Galaxy Vol. 2"
"1480",6959079,6960307,"Rocket!","Guardians of the Galaxy Vol. 2"
"1481",6961359,6962359,"Where's Quill?","Guardians of the Galaxy Vol. 2"
"1482",6964399,6966310,"Where's Quill?","Guardians of the Galaxy Vol. 2"
