"id","startTime","endTime","text","title"
"1413",4334064,4335697,"Well, thanks.","Identity Thief"
"1414",4335698,4336764,"SANDY: That'snot a compliment.","Identity Thief"
"1415",4336765,4337765,"I know.","Identity Thief"
"1416",4339768,4342502,"DIANA: Here we go.Here we go.","Identity Thief"
"1417",4342938,4344939,"Aw, come on!","Identity Thief"
"1418",4344940,4347942,"You are goingto have to hide
on the next one.","Identity Thief"
"1419",4347944,4349444,"It's clearly you.","Identity Thief"
"1420",4349445,4350978,"Oh, it's me.(SIGHING)","Identity Thief"
"1421",4350979,4354082,"I have never been passed upwhen I got this thing out.","Identity Thief"
"1422",4354083,4356650,"(SCOFFS) I don't doubtthat you do real well
on the side of the road.","Identity Thief"
"1423",4356653,4357952,"But I don't know whyyou're not trusting this.","Identity Thief"
"1424",4357953,4361521,"It is only two milesstraight through there.","Identity Thief"
"1425",4361524,4364359,"Two miles through the woods?","Identity Thief"
"1426",4364360,4366493,"Yeah.Are you allergic
to woods or something?","Identity Thief"
"1427",4366496,4368462,"Come on, you want to go10 more miles on this road?","Identity Thief"
"1428",4368465,4369430,"Get some more blisters?","Identity Thief"
"1429",4369431,4371565,"Come on, that's a shortcut.","Identity Thief"
"1430",4374036,4377137,"Yes? There's a yes. Finally.","Identity Thief"
"1431",4377140,4379373,"DIANA: I knew youwere probably wrong.","Identity Thief"
"1432",4379376,4380807,"I knew your phonewas going to die.","Identity Thief"
"1433",4380810,4382377,"I should've said something.","Identity Thief"
"1434",4382378,4384511,"You knew it.What are you?
You're like a psychic, huh?","Identity Thief"
"1435",4384514,4386713,"Well,you know what?
I am.","Identity Thief"
"1436",4386716,4388082,"I'm not going toget into it, but I am.","Identity Thief"
"1437",4388083,4390851,"Really?On top of everything else,
you're a psychic.","Identity Thief"
"1438",4390854,4392686,"That's amazing.","Identity Thief"
"1439",4392689,4394421,"Pick a numberbetween one and 10.","Identity Thief"
"1440",4397826,4399060,"Four.Four.","Identity Thief"
"1441",4401863,4403564,"I know. It was a gift.","Identity Thief"
"1442",4403565,4405932,"Your gifts abound.That's amazing.","Identity Thief"
"1443",4405935,4408168,"DIANA: I think so, too.","Identity Thief"
"1444",4408171,4411005,"Then why don't yourest your talents,
Megamind.","Identity Thief"
"1445",4411006,4412907,"The sun is going tobe up in a few hours,","Identity Thief"
"1446",4412908,4414708,"and we'll take itthe rest of the way.","Identity Thief"
"1447",4415010,4416511,"(SIGHS)","Identity Thief"
"1448",4417979,4419579,"(YAWNING)","Identity Thief"
"1449",4419582,4421582,"Hey, hey, hey. Spread out.","Identity Thief"
"1450",4421583,4423451,"You've gotthe whole forest,
what are you doing?","Identity Thief"
"1451",4423453,4425886,"It's cold. This is whatthey do on  Survivor.","Identity Thief"
"1452",4425889,4427889,"When they wantto get punched?
Get off of me.","Identity Thief"
"1453",4432194,4433828,"Do you usuallylisten to music","Identity Thief"
"1454",4435063,4436564,"before you go to bed?","Identity Thief"
"1455",4436565,4438698,"No, just a lot of silence.","Identity Thief"
"1456",4440469,4442203,"(SINGING HIP HOP SONG)","Identity Thief"
"1457",4442204,4443503,"Oh, my God.","Identity Thief"
"1458",4448510,4450877,"Hey, hey, hey, hey.","Identity Thief"
"1459",4452180,4453547,"You're like a four-year-old.","Identity Thief"
"1460",4455551,4458786,"You know, this lightis very flattering
on your chin.","Identity Thief"
"1461",4462224,4464658,"Oh, my God. Diana.","Identity Thief"
"1462",4464661,4467161,"I'm serious,get your hand off.
I don't want to play footsies.","Identity Thief"
"1463",4467162,4468729,"I'm not doing anything.","Identity Thief"
"1464",4468730,4471698,"Snake! Snake! Snake!Oh, my God!","Identity Thief"
"1465",4471701,4472867,"DIANA: Shit.","Identity Thief"
"1466",4472868,4474534,"Get away from me!","Identity Thief"
"1467",4477139,4478038,"Throw him! Throw him!","Identity Thief"
"1468",4482644,4483743,"Oh, God, it wasso close to me.","Identity Thief"
"1469",4485012,4486713,"Thanks for the help.You're welcome.","Identity Thief"
"1470",4486716,4488114,"This is no longerour sleeping spot.","Identity Thief"
"1471",4488117,4489750,"There's probablya fucking ton of them.","Identity Thief"
"1472",4489752,4491819,"They're notpack animals, Sandy.","Identity Thief"
"1473",4491820,4493753,"I know they're notpack animals, okay?","Identity Thief"
"1474",4493756,4495155,"But have you ever heardof a snake nest?
(HISSING)","Identity Thief"
"1475",4495158,4498626,"Just the mere thought of thatis going to keep me up...","Identity Thief"
"1476",4498993,4500528,"Oh, God.","Identity Thief"
"1477",4500529,4501695,"Don't move.","Identity Thief"
"1478",4501698,4503197,"Not a problem.I'm not moving.","Identity Thief"
"1479",4503198,4504998,"Shit, it's huge!","Identity Thief"
"1480",4505001,4506667,"No shit. Get him off me.","Identity Thief"
"1481",4506668,4508935,"Okay. I got it.","Identity Thief"
"1482",4509704,4510904,"What's the planwith the fire?","Identity Thief"
"1483",4510907,4512105,"What are youdoing with the fire?","Identity Thief"
"1484",4512108,4515676,"I saw iton a television show.
Snakes hate fire.","Identity Thief"
"1485",4515677,4518246,"Unless that wasabout spiders.
I don't know.","Identity Thief"
"1486",4518247,4519947,"You're going to burn me,and you're going to
piss him off.","Identity Thief"
"1487",4519948,4522283,"Get away from me.Be quiet and stay still.","Identity Thief"
"1488",4522284,4523551,"Get away from mewith that thing.","Identity Thief"
"1489",4524152,4525786,"(HISSING)Oh, God!","Identity Thief"
"1490",4526287,4527755,"That's not helping.","Identity Thief"
"1491",4527756,4529990,"It just keeps looking at me.","Identity Thief"
"1492",4530658,4531759,"Oh, he's tightening.","Identity Thief"
"1493",4532293,4533994,"(WHIMPERING)","Identity Thief"
"1494",4534930,4536631,"Turn your face away.","Identity Thief"
"1495",4536632,4537765,"Okay.","Identity Thief"
"1496",4537766,4539966,"It's almost over.","Identity Thief"
"1497",4543037,4544905,"(GRUNTS) Trouble.He's got the neck.","Identity Thief"
"1498",4544908,4545840,"(SCREAMING)","Identity Thief"
"1499",4546975,4548208,"(GROANING)","Identity Thief"
"1500",4550177,4551779,"God! Don't let itcome near me.","Identity Thief"
"1501",4551780,4552880,"That hurts!","Identity Thief"
"1502",4553215,4554548,"(SANDY YELLING)","Identity Thief"
"1503",4554551,4557051,"That hurt. That hurts!","Identity Thief"
"1504",4557052,4558085,"Oh, God.","Identity Thief"
"1505",4577104,4578171,"(GROANING)Okay.","Identity Thief"
"1506",4578173,4580574,"Okay. Go slow, fella.","Identity Thief"
"1507",4580577,4582944,"Just go slow. Easy.","Identity Thief"
"1508",4585680,4587113,"Where are we?What is this?","Identity Thief"
"1509",4587115,4589684,"Bus station,middle of nowhere.","Identity Thief"
"1510",4590618,4591851,"Whose pants are these?","Identity Thief"
"1511",4591854,4593354,"I got them out ofthe lost and found.","Identity Thief"
"1512",4594323,4595890,"It's a good fit, huh?","Identity Thief"
"1513",4595891,4599025,"Yeah. Okay.Better get on a bus.","Identity Thief"
"1514",4599028,4602697,"We're not getting onany bus for three days,
not to Denver.","Identity Thief"
"1515",4602698,4606033,"There's not a busfrom here to Denver
for three days.","Identity Thief"
"1516",4607101,4609670,"Hey. When'sthe next bus to Denver?","Identity Thief"
"1517",4610639,4611905,"Wednesday.","Identity Thief"
"1518",4614109,4616676,"Fuck! That's too late.","Identity Thief"
"1519",4622050,4625386,"Phone's gone, wallet's gonebecause the pants are gone.","Identity Thief"
"1520",4625886,4627054,"(SIGHING)","Identity Thief"
"1521",4635663,4637097,"We're done. I'm done.","Identity Thief"
"1522",4639134,4642069,"I lose, you win.You're a great thief.","Identity Thief"
"1523",4643037,4644904,"I got nothing left.","Identity Thief"
"1524",4647175,4651112,"I got no money, I got no time,I got no job, I got no chance.","Identity Thief"
"1525",4657853,4661756,"I've got these weird pants on,out in the middle of nowhere.","Identity Thief"
"1526",4664826,4666127,"How did we get here anyway?","Identity Thief"
"1527",4667662,4669162,"I carried you.","Identity Thief"
"1528",4669164,4670064,"You what?","Identity Thief"
"1529",4671166,4673900,"I carried you.It's not a big deal.","Identity Thief"
"1530",4673903,4676270,"You were unconscious.","Identity Thief"
"1531",4676271,4677872,"We were like, a half milefrom the main road.","Identity Thief"
"1532",4677873,4679439,"Jesus Christ.","Identity Thief"
"1533",4679442,4682208,"So, I just...I scooped you up
and flagged down a truck,","Identity Thief"
"1534",4682211,4684811,"and he gave us a ride here,dropped us off.","Identity Thief"
"1535",4686414,4689283,"You carried me a half mile.That's, uh...","Identity Thief"
"1536",4689284,4692118,"Probably not even that far.(CLEARING THROAT AWKWARDLY)","Identity Thief"
"1537",4692121,4694387,"You get these shoesthe same place
you got the pants?","Identity Thief"
"1538",4694390,4697891,"No. Yeah.","Identity Thief"
"1539",4697894,4699827,"The clerk saidan EMT took them
off a dead hobo, so...","Identity Thief"
"1540",4700395,4703064,"He's not goingto need them back, so...","Identity Thief"
"1541",4703065,4705032,"A guy died in these?","Identity Thief"
"1542",4705033,4706167,"Because you needed shoes.","Identity Thief"
"1543",4706168,4707467,"What is the matter with you?","Identity Thief"
"1544",4709738,4711471,"My socks, though...","Identity Thief"
"1545",4711474,4713274,"They're your socks,they're not dead guy socks.","Identity Thief"
"1546",4713275,4715376,"I've got money in here.I've got money.
I got sock money.","Identity Thief"
"1547",4715377,4716243,"We don't have...","Identity Thief"
"1548",4717746,4719479,"What the hell?Hey.","Identity Thief"
"1549",4719481,4722349,"Why are we livinglike animals if you've got
money in your socks?","Identity Thief"
"1550",4722350,4724784,"I've got $300and I need to be in
Denver by Tuesday.","Identity Thief"
"1551",4724787,4727253,"You can get a pretty cheap carover there at Andrew's.","Identity Thief"
"1552",4727256,4729122,"Tell him Carl sent you.He's a good man, Andrew.","Identity Thief"
"1553",4729125,4730291,"He was with mysister for a bit.","Identity Thief"
"1554",4730292,4732792,"Oh, yeah?","Identity Thief"
"1555",4732795,4736262,"You got a beautifulyard here, Andrew.
Here's 200 of the finest.","Identity Thief"
"1556",4736265,4737931,"Keys? Thank you.","Identity Thief"
"1557",4737934,4740367,"Ooh! And it's got satellite.","Identity Thief"
"1558",4740368,4743470,"SANDY: I'm glad we're notbuying that one. Jesus.","Identity Thief"
"1559",4749243,4750310,"(ENGINE CHOKING)","Identity Thief"
"1560",4762457,4764759,"(SKIPTRACER PANTING)","Identity Thief"
"1561",4766828,4768194,"Morning.","Identity Thief"
"1562",4769163,4770997,"Morning.","Identity Thief"
"1563",4771000,4774068,"I'm supposed to bemeeting some friends here.","Identity Thief"
"1564",4774069,4776871,"Was there a man and a ladycome through here?","Identity Thief"
"1565",4776872,4778506,"Both answer to the name Sandy.","Identity Thief"
"1566",4779440,4780940,"Well,","Identity Thief"
"1567",4780943,4782342,"we get tons ofpeople through here.","Identity Thief"
"1568",4788550,4790317,"Ahhh!I've had a shitty day","Identity Thief"
"1569",4790319,4793487,"and you got a facethat looks like
a dog's asshole.","Identity Thief"
"1570",4793488,4797123,"They came through earlier.I sent them to get a car.","Identity Thief"
"1571",4797126,4798259,"Where?","Identity Thief"
"1572",4798261,4799793,"Andrew's Auto Salvage.","Identity Thief"
"1573",4799796,4801095,"Write it down.","Identity Thief"
"1574",4802063,4803396,"(WHIMPERING)","Identity Thief"
"1575",4809104,4810537,"I wasn't here.","Identity Thief"
"1576",4811439,4812506,"(GUNSHOT)","Identity Thief"
"1577",4813341,4815242,"(GROANING)","Identity Thief"
"1578",4820081,4822082,"Thank you.","Identity Thief"
"1579",4822083,4825452,"MARISOL: Consider thata warning. We need her
more than you do.","Identity Thief"
"1580",4825453,4827287,"Better lucknext time, old man.","Identity Thief"
"1581",4827289,4828454,"Fuck you.","Identity Thief"
"1582",4830057,4831125,"Shh!","Identity Thief"
"1583",4832828,4833927,"(MARISOL CHUCKLING)","Identity Thief"
"1584",4845472,4847207,"That's whatI always thought,
but then I thought,","Identity Thief"
"1585",4847210,4850543,"""I'm going towallpaper the garage.""
And I found...","Identity Thief"
"1586",4850546,4852579,"First I thought,""Well, is that
going to be crazy?""","Identity Thief"
"1587",4852582,4854280,"But it's notreally that crazy,","Identity Thief"
"1588",4854283,4856283,"because I found somethingkind of thematically on point.","Identity Thief"
"1589",4856284,4858519,"You wouldn't ratherjust listen to this?
That's a good song.","Identity Thief"
"1590",4858520,4861956,"Oh, it is a good song.I like that.
It's got tires on it.","Identity Thief"
"1591",4861957,4864625,"It's wallpaper with tires,which I thought was...","Identity Thief"
"1592",4864627,4866126,"Ow!","Identity Thief"
"1593",4866127,4867927,"You okay?Yeah, I'm okay.","Identity Thief"
"1594",4867930,4871131,"I think it would be so cute.It's red and...","Identity Thief"
"1595",4871132,4872966,"God damn it!","Identity Thief"
"1596",4872969,4874501,"It was one ofthose badgers.
Oh.","Identity Thief"
"1597",4896358,4898926,"How great is the rideon this Caprice, huh?","Identity Thief"
"1598",4898927,4900493,"You know this isthe last tank, right?","Identity Thief"
"1599",4900496,4902395,"This is not goingto get us to Denver.","Identity Thief"
"1600",4902398,4904198,"You know, I couldhelp us out.","Identity Thief"
"1601",4905300,4907234,"How? Did you findsome sock money?","Identity Thief"
"1602",4907235,4910904,"No, I didn't find sock money.But I've got my
credit card burner.","Identity Thief"
"1603",4910907,4913239,"I can get a card,fill this tank up
in 15 minutes.","Identity Thief"
"1604",4913242,4916042,"I told you, this tripwill not turn me into you.","Identity Thief"
"1605",4916045,4918112,"I am not sayingthat we have to go out","Identity Thief"
"1606",4918113,4920213,"and steal from orphansand baby puppies.","Identity Thief"
"1607",4920216,4921916,"No one deservesto get stolen from.","Identity Thief"
"1608",4921917,4923650,"I don't know whyyou don't get that.
Just drop it.","Identity Thief"
"1609",4923653,4926020,"I get it,I just find it bizarre","Identity Thief"
"1610",4926021,4928154,"that you don't haveany kind of shit list.","Identity Thief"
"1611",4928157,4930490,"that you can't comeup with one person","Identity Thief"
"1612",4930493,4933260,"that deserves the wrathof Sandy Patterson.","Identity Thief"
"1613",4938265,4940100,"My old boss,Harold Cornish,","Identity Thief"
"1614",4940101,4943136,"is a partner hereat this major
financial institution.","Identity Thief"
"1615",4943139,4946006,"They have got a branchhere in St. Louis.
Here is the plan.","Identity Thief"
"1616",4946007,4948408,"We're gonna go inside,we're gonna get his
financial information","Identity Thief"
"1617",4948411,4955082,"it's all stored onhard copies in there,
in the Record Room.","Identity Thief"
"1618",4955083,4959052,"DIANA:  Yeah, but we can'tget in there with you
looking like that.","Identity Thief"
"1619",4959055,4961287,"SANDY:  That's a great point.There is a way around that.","Identity Thief"
"1620",4961289,4963323,"Oh! (GROANING)","Identity Thief"
"1621",4964158,4965391,"Are you okay?","Identity Thief"
"1622",4966127,4967661,"What is it? What is it?","Identity Thief"
"1623",4967662,4970096,"My fibromyalgia.Oh, God, my leg
is cramping up.","Identity Thief"
"1624",4970099,4971398,"What can I do?What can I do?
Oh, God. Rub it.","Identity Thief"
"1625",4971399,4972565,"Rub it?Rub it! Rub it!","Identity Thief"
"1626",4972568,4973500,"Rub it! It's cramping.","Identity Thief"
"1627",4975403,4976270,"Oh!","Identity Thief"
"1628",4977238,4978305,"SECURITY GUARD: Up?","Identity Thief"
"1629",4978306,4980640,"Higher, higher, higher.","Identity Thief"
"1630",4980643,4982042,"Higher.A little higher.","Identity Thief"
"1631",4982043,4983077,"Oh, God, it's in my glutes.","Identity Thief"
"1632",4988248,4989515,"Get in there!","Identity Thief"
"1633",4989518,4990717,"How is this helping you?","Identity Thief"
"1634",4990720,4993420,"Oh, God! (GRUNTING)","Identity Thief"
"1635",4998225,4999760,"God, get in there!All right, get off me.","Identity Thief"
"1636",4999761,5001028,"Get off me.","Identity Thief"
"1637",5010771,5013207,"I thought it was gonnabe a couple of offices.","Identity Thief"
"1638",5013208,5014574,"No. Come on.","Identity Thief"
"1639",5016712,5022082,"That's Accounts Processing.That's the ""me""
of this branch. Come on.","Identity Thief"
"1640",5022083,5023550,"Oh. That shouldn'tbe any problem.","Identity Thief"
"1641",5023551,5025319,"No offense, but justkeep your mouth shut.","Identity Thief"
"1642",5025320,5027186,"This will be overin a minute.","Identity Thief"
"1643",5027189,5030189,"Hi. Good morning.","Identity Thief"
"1644",5030192,5034461,"Tina... Van Westengarden.How are you?","Identity Thief"
"1645",5035563,5038064,"I'm fine. Can I help you?","Identity Thief"
"1646",5038067,5041534,"I'm here with my boss,Harold Cornish.
We're in from Denver.","Identity Thief"
"1647",5041537,5043270,"Oh. I'm familiarwith the name.","Identity Thief"
"1648",5043271,5044671,"DIANA: I'm sure you are.","Identity Thief"
"1649",5044672,5047341,"We're gonna needto get into
your Accounts Room.","Identity Thief"
"1650",5047342,5048509,"Do you havean authorization letter?","Identity Thief"
"1651",5055516,5057551,"(SOFTLY) I'm gonna bereal honest with you.","Identity Thief"
"1652",5057552,5059720,"I fucked up.","Identity Thief"
"1653",5059721,5063756,"I just kind ofcompletely blanked
on that authorization letter.","Identity Thief"
"1654",5063759,5067094,"He basically runs me 24-7.He's...","Identity Thief"
"1655",5067095,5069695,"Cornish is...He's a handful.
I mean...","Identity Thief"
"1656",5069698,5071465,"Honestly, he's an asshole.","Identity Thief"
"1657",5072332,5076069,"And I'm just hopingthat we can","Identity Thief"
"1658",5076072,5080606,"figure something out,and you can do me
a solid and...","Identity Thief"
"1659",5080609,5082509,"You know,I don't think you want
to see me shit-canned.","Identity Thief"
"1660",5084311,5085378,"On my birthday.","Identity Thief"
"1661",5087748,5089315,"'Cause I'm getting married.","Identity Thief"
"1662",5090417,5091484,"This weekend...","Identity Thief"
"1663",5093087,5094555,"'Cause I got pregnant.","Identity Thief"
"1664",5095355,5096722,"Just a sec.","Identity Thief"
"1665",5096725,5099359,"Twins. And my cat died.","Identity Thief"
"1666",5099360,5100661,"How are wedoing over there?","Identity Thief"
"1667",5100662,5102595,"We doing good?You calling security?","Identity Thief"
"1668",5102597,5104864,"You better not becalling security.
Hang up the phone right now.","Identity Thief"
"1669",5104867,5106233,"I wasn't calling security.","Identity Thief"
"1670",5106234,5107600,"Yes, you were. Hang it up.","Identity Thief"
"1671",5107603,5110270,"Right now.","Identity Thief"
"1672",5110271,5113372,"I'm sorry, but you'renot allowed back there
without authorization.","Identity Thief"
"1673",5113375,5114875,"I'm not... You're notallowed back there
without authorization.","Identity Thief"
"1674",5114877,5116676,"I can do whateverthe hell I want.","Identity Thief"
"1675",5116679,5119113,"I don't have to tellyou that we suspect","Identity Thief"
"1676",5119114,5120480,"that there are somepeople at this branch","Identity Thief"
"1677",5120483,5122381,"that are doing somevery, very bad things.","Identity Thief"
"1678",5122384,5123850,"And I don't have to tell youthat I've been sent here","Identity Thief"
"1679",5123853,5127421,"to look very quietlyat some records.","Identity Thief"
"1680",5127422,5131390,"Mr. Cornish,I don't mean any offense,
but we have rules.","Identity Thief"
"1681",5131393,5133193,"I know you have rules.","Identity Thief"
"1682",5133194,5135261,"Like never backdate a 5590","Identity Thief"
"1683",5135264,5139565,"or don't stampa 33-B transfer without
telling a client first.","Identity Thief"
"1684",5139568,5141534,"I bet you do thatone twice a month,
don't you?","Identity Thief"
"1685",5142737,5144738,"Tanya, can you giveus a minute, please?","Identity Thief"
"1686",5144739,5147274,"It's Tina, but...","Identity Thief"
"1687",5147275,5148774,"See what I mean?What did I say?","Identity Thief"
"1688",5148777,5149909,"Nothing. You said that.","Identity Thief"
"1689",5151311,5153412,"I have you at a disadvantage.","Identity Thief"
"1690",5153414,5155716,"You don't know me,but I know you, Ken.","Identity Thief"
"1691",5155717,5160820,"I know that youmake $49,395 a year.","Identity Thief"
"1692",5160823,5164158,"I know that you workvery hard for that wife
and child right there.","Identity Thief"
"1693",5164159,5165591,"I know that you'rereal good at your job,","Identity Thief"
"1694",5165594,5167360,"that you take careof this company","Identity Thief"
"1695",5167363,5169930,"and you do thingsthat they'll
never know about,","Identity Thief"
"1696",5169931,5171364,"that they'llnever appreciate.","Identity Thief"
"1697",5171367,5172832,"So, you're very proud, right?","Identity Thief"
"1698",5173667,5175536,"But you're scared.","Identity Thief"
"1699",5175537,5177837,"You're scared becauseyou're dispensable.","Identity Thief"
"1700",5177840,5181341,"You're scared becauseyou know that,
more than likely, one day,","Identity Thief"
"1701",5181342,5184677,"you're gonna be replacedby somebody younger,
somebody cheaper,","Identity Thief"
"1702",5184680,5185612,"maybe even by an app.","Identity Thief"
"1703",5186581,5188181,"But not me.","Identity Thief"
"1704",5188184,5190583,"I'll be fine,'cause I'm on
a different level.","Identity Thief"
"1705",5192753,5196556,"So if I don't getinto that room today,
I'll be okay. But not you.","Identity Thief"
"1706",5197859,5199359,"You're stillgoing to be scared.","Identity Thief"
"1707",5201229,5202496,"And that's not fair, is it?","Identity Thief"
"1708",5204199,5208801,"You can help me todayand someday I might
be able to help you.","Identity Thief"
"1709",5210204,5211537,"But you're gonna haveto break the rules.","Identity Thief"
"1710",5213240,5214408,"9488.","Identity Thief"
"1711",5234429,5235595,"Got it.","Identity Thief"
"1712",5242537,5244304,"Let me see it.","Identity Thief"
"1713",5244305,5245605,"This is it. Right there.","Identity Thief"
"1714",5247341,5248542,"We got it.","Identity Thief"
"1715",5248543,5249842,"All right.That's what I need.","Identity Thief"
"1716",5265525,5267293,"Shit.","Identity Thief"
"1717",5267296,5268795,"(BEEPING)","Identity Thief"
"1718",5273600,5274835,"Got it.","Identity Thief"
"1719",5276304,5277738,"Got it.Wow.","Identity Thief"
"1720",5294823,5298925,"Let's put this baby to use,get some gasoline
and hit the road again.","Identity Thief"
"1721",5298926,5301662,"Wait, wait, wait.Hit the road? No, no.","Identity Thief"
"1722",5301663,5304930,"I am exhausted.I need to sleep for
at least a couple of hours.","Identity Thief"
"1723",5304932,5307768,"I need something to eatthat doesn't come out of a bag","Identity Thief"
"1724",5307770,5310404,"and I need to putat least some of
my parts into a shower.","Identity Thief"
"1725",5310405,5311837,"I bet you're a real mess.","Identity Thief"
"1726",5311840,5313372,"Do we get youa Motel 6, or something?","Identity Thief"
"1727",5314074,5317610,"Motel 6? No, no, no.","Identity Thief"
"1728",5317613,5319479,"Mr. Cornish, we gowherever we want.","Identity Thief"
"1729",5321315,5323317,"Come on. Let's go.","Identity Thief"
"1730",5331525,5332693,"I need a room, please.","Identity Thief"
"1731",5332694,5333827,"How about a suite?","Identity Thief"
"1732",5333828,5336029,"Thank you, Mr. Cornish.","Identity Thief"
"1733",5336030,5336997,"Yes, hello.","Identity Thief"
"1734",5345972,5347573,"(EXCLAIMING IN AWE)","Identity Thief"
"1735",5350845,5353646,"God, they're real.They're real.
Yeah.","Identity Thief"
"1736",5377771,5379805,"(MOANING)","Identity Thief"
"1737",5381042,5383810,"Just get there!Get there! Get there!","Identity Thief"
"1738",5384444,5385845,"(MOANS)","Identity Thief"
"1739",5385847,5387514,"(DIANA SCREAMS)","Identity Thief"
"1740",5388048,5389682,"I miss you.","Identity Thief"
"1741",5389685,5391417,"SANDY:  I miss you,too, sweetheart.","Identity Thief"
"1742",5391420,5393619,"We're just gonnarest for a little bit,","Identity Thief"
"1743",5393622,5395654,"and then one lasthaul to get home.","Identity Thief"
"1744",5395657,5396856,"Thank God.","Identity Thief"
"1745",5396859,5400926,"Yeah, spoke to Daniel.Everything's gonna be fine.","Identity Thief"
"1746",5400929,5403896,"Oh! This place hasa shopping arcade.","Identity Thief"
"1747",5403899,5405865,"Reservation's at 8:00, okay?","Identity Thief"
"1748",5405868,5407167,"And no jewelry.","Identity Thief"
"1749",5407168,5409136,"I'll get cash for tips.","Identity Thief"
"1750",5409137,5411505,"Is that her?Yeah, that's her.","Identity Thief"
"1751",5411506,5413407,"Okay. Drive safely, will you?","Identity Thief"
"1752",5413408,5415442,"Okay. I'll see you soon.","Identity Thief"
"1753",5443703,5445872,"Oh, that's a nice match.","Identity Thief"
"1754",5445873,5447807,"Now, that is a nice match.","Identity Thief"
"1755",5455550,5456882,"Oh, that's nice.","Identity Thief"
"1756",5460154,5462855,"No, dear. More is not more.","Identity Thief"
"1757",5466226,5467993,"Oh, that's better. Okay.","Identity Thief"
"1758",5469831,5471096,"(GIGGLING) She is the best.","Identity Thief"
"1759",5471099,5472631,"(ALL GIGGLING)","Identity Thief"
"1760",5495489,5497056,"Um...","Identity Thief"
"1761",5497059,5499960,"Maybe you could help me.","Identity Thief"
"1762",5501162,5502962,"Oh, honey.","Identity Thief"
