"id","startTime","endTime","text","title"
"698",2124155,2125155,"Your job?That's right.","Identity Thief"
"699",2125157,2126655,"I didn't fire you.","Identity Thief"
"700",2126657,2128692,"Effectively, you did.I don't think I did.","Identity Thief"
"701",2128693,2131128,"And I don't wannago to Colorado
and meet your anxious wife.","Identity Thief"
"702",2131130,2132561,"You're right,she is anxious.
She's very anxious.","Identity Thief"
"703",2132563,2136432,"Because we have two daughtersand a third on the way.","Identity Thief"
"704",2136434,2137833,"We live in a very,very small apartment,","Identity Thief"
"705",2137835,2140269,"about half the sizeof that house
I bet you stole.","Identity Thief"
"706",2140271,2145775,"I'm proud of it.I have a seven-year
amorticized sub-rate...","Identity Thief"
"707",2145777,2150246,"Well, I can't get into that.You're not gonna get it.","Identity Thief"
"708",2150248,2151581,"Enough, all right?","Identity Thief"
"709",2151583,2154851,"This is a free trip, okay?It's on me, all right?","Identity Thief"
"710",2154853,2156318,"No cops.","Identity Thief"
"711",2156320,2158155,"All you need to dois talk to my boss,
that's it.","Identity Thief"
"712",2158157,2160690,"And then we're done.That's all.
It's very simple.","Identity Thief"
"713",2160692,2161858,"Come on, it's in Denver.You're gonna love it.","Identity Thief"
"714",2161860,2163425,"There's nobodyshooting at you there.","Identity Thief"
"715",2163427,2164594,"You stay here,they're gonna find you.","Identity Thief"
"716",2166764,2167731,"Hey, hey, hey!","Identity Thief"
"717",2170835,2172501,"Come on.","Identity Thief"
"718",2172503,2174704,"This is ridiculous.","Identity Thief"
"719",2174706,2175804,"(GROANING)","Identity Thief"
"720",2176407,2177474,"Shit.","Identity Thief"
"721",2177476,2178541,"You blow a tire?","Identity Thief"
"722",2179543,2181411,"Yeah, I blew a fucking tire.","Identity Thief"
"723",2181413,2182579,"Why don't yourest that in the car?","Identity Thief"
"724",2183181,2184614,"Put the air on.","Identity Thief"
"725",2185349,2186849,"I won't talk to the cops.","Identity Thief"
"726",2186851,2188851,"Right, no cops.I said that.","Identity Thief"
"727",2188853,2190186,"And don't lie to me.","Identity Thief"
"728",2190188,2191855,"I'm not.I'm not lying, I swear.","Identity Thief"
"729",2191856,2193389,"Yeah? You swearon your kids?","Identity Thief"
"730",2193824,2195192,"(SCOFFING)","Identity Thief"
"731",2195193,2196927,"Yeah, swear on your kids.","Identity Thief"
"732",2196929,2199563,"Yes, I swear on my kids.","Identity Thief"
"733",2202867,2204568,"Shotgun.","Identity Thief"
"734",2205603,2206869,"I'll need the keys.","Identity Thief"
"735",2206871,2207971,"Here you go.","Identity Thief"
"736",2207972,2209739,"Thank you.","Identity Thief"
"737",2215579,2217213,"(MACHINES WHIRRING)","Identity Thief"
"738",2219983,2221585,"(CELL PHONE RINGING)","Identity Thief"
"739",2222853,2224788,"Yeah?PAOLO:  Did you get her?","Identity Thief"
"740",2224789,2225855,"Almost.","Identity Thief"
"741",2225856,2227489,"Almost?","Identity Thief"
"742",2227492,2231460,"Okay, then Ialmost won't kill you
when I get out of here.","Identity Thief"
"743",2231463,2234931,"She's a nobodywho sells credit cards
she already used.","Identity Thief"
"744",2234932,2236365,"We'll get the money back.","Identity Thief"
"745",2236367,2238268,"It is beyond that, Marisol.","Identity Thief"
"746",2238269,2242271,"Now, this nobody of yours iscausing me a big problem.","Identity Thief"
"747",2242273,2244641,"She's become a liability.","Identity Thief"
"748",2244643,2247443,"One of her cardstipped off the cops.","Identity Thief"
"749",2247445,2250847,"She gotta go.You get Julian
and you get it done.","Identity Thief"
"750",2251815,2254851,"Okay, but she'swith some guy.","Identity Thief"
"751",2254853,2257753,"You kill her, you kill him,you kill anyone you need to.","Identity Thief"
"752",2258255,2259588,"Okay.","Identity Thief"
"753",2259590,2262525,"Speed thisshit up, we gotta go.","Identity Thief"
"754",2262527,2263994,"I don't work for you.MARISOL: Oh, yes, you do.","Identity Thief"
"755",2264594,2265795,"Hank!","Identity Thief"
"756",2267264,2268498,"HANK: You got it, Paolo.","Identity Thief"
"757",2270001,2272735,"So, I was wondering,","Identity Thief"
"758",2272737,2275771,"how is it that we'regetting on that plane?","Identity Thief"
"759",2275773,2279041,"I already have my ticket,and I brought cash for yours.","Identity Thief"
"760",2279043,2281945,"Are we both goingto show our Sandy
Bigelow Patterson,","Identity Thief"
"761",2281947,2284547,"same birthday, everything,at the same time?","Identity Thief"
"762",2284548,2287817,"Let the airline justhave a field day
with that, or...","Identity Thief"
"763",2287818,2288952,"Yeah, that's what I thought.","Identity Thief"
"764",2290288,2291688,"Son of a bitch!","Identity Thief"
"765",2295626,2296960,"Well, we're driving now.We're driving, then.","Identity Thief"
"766",2296961,2298628,"Okay.","Identity Thief"
"767",2300297,2302599,"Oh! I can't believeI missed that.","Identity Thief"
"768",2302967,2304300,"(SIGHING)","Identity Thief"
"769",2304302,2305969,"You've gotta feel so dumb.","Identity Thief"
"770",2305971,2307603,"Please don't.","Identity Thief"
"771",2308639,2310673,"Think we just needa little music.","Identity Thief"
"772",2311909,2313876,"(SINGING ALONGTO HIP HOP SONG)","Identity Thief"
"773",2324387,2325989,"(POP SONG PLAYING)","Identity Thief"
"774",2325990,2327623,"(SINGING ALONG)","Identity Thief"
"775",2337434,2339101,"(CHANGES RADIO STATION)","Identity Thief"
"776",2341371,2342838,"(SINGING ALONG TO ROCK MUSIC)","Identity Thief"
"777",2343807,2345041,"Dude, I can hit this.","Identity Thief"
"778",2345043,2346909,"(SINGING HIGH NOTES)","Identity Thief"
"779",2358356,2359722,"(CELL PHONE RINGING)","Identity Thief"
"780",2362393,2364126,"Hello? Yeah?What do you got?","Identity Thief"
"781",2364128,2366596,"WOMAN:  Got a runner.Pays 50 K.","Identity Thief"
"782",2366597,2368431,"50 K?Uh-huh.","Identity Thief"
"783",2368432,2371967,"Sandy Patterson.She skipped
a few court dates.","Identity Thief"
"784",2371969,2373503,"Any leads?","Identity Thief"
"785",2373505,2376940,"at a place near youcalled Lady's Choice.","Identity Thief"
"786",2389887,2391487,"Oh, I'm sorry, sir.We're closed.","Identity Thief"
"787",2391489,2394490,"Do you knowa Sandy Patterson?
A customer?","Identity Thief"
"788",2394492,2397494,"Used a credit cardhere earlier today
around 4:00?","Identity Thief"
"789",2397496,2398628,"You her boyfriendor something?","Identity Thief"
"790",2398630,2399695,"(CHUCKLING) Oh, no, no.","Identity Thief"
"791",2401065,2404467,"No. I'm a skiptracer.A collector.","Identity Thief"
"792",2404469,2406635,"Like a bounty hunter.","Identity Thief"
"793",2406637,2410606,"I find people that owe moneyand I bring them back
to where they belong.","Identity Thief"
"794",2410608,2412909,"Oh, this Sandy,she owe a lot?","Identity Thief"
"795",2412911,2416012,"Yeah, well, they don'tsend me for a little.","Identity Thief"
"796",2416014,2420150,"No, she jumped bailand I've been hired
to bring her back.","Identity Thief"
"797",2420152,2421784,"I would liketo help you out,","Identity Thief"
"798",2421786,2424119,"but I ain't supposed toshare client information,
so...","Identity Thief"
"799",2424121,2426489,"Of course, I understand.","Identity Thief"
"800",2428958,2430427,"This is a nice place.","Identity Thief"
"801",2430429,2431494,"Yeah.","Identity Thief"
"802",2439969,2441804,"I hear this stuff'spretty flammable.","Identity Thief"
"803",2446476,2449579,"Be a shame if yourplace of employment
burned to shit.","Identity Thief"
"804",2450914,2453016,"You want to show mewhere that
appointment book is?","Identity Thief"
"805",2454150,2455217,"There you go.","Identity Thief"
"806",2468632,2469865,"Oh, jeez.","Identity Thief"
"807",2483112,2484780,"I really doappreciate your help.","Identity Thief"
"808",2489186,2490052,"Go on. Take it.","Identity Thief"
"809",2492556,2493755,"Now, how about a smile?","Identity Thief"
"810",2495759,2498862,"Look at youlight up a room.","Identity Thief"
"811",2498864,2500128,"I'm gonna have a hard timeforgetting that face.","Identity Thief"
"812",2501831,2503900,"You go on and forgetabout this one.","Identity Thief"
"813",2512842,2515143,"SANDY: Yeah,not what I was planning,","Identity Thief"
"814",2515146,2518248,"but I will be homeon Sunday or Monday
by the latest.","Identity Thief"
"815",2518250,2520849,"It is what it is, I guess.How are the girls?","Identity Thief"
"816",2520851,2521985,"(CHUCKLING)","Identity Thief"
"817",2521987,2523786,"Okay. I love you, too.","Identity Thief"
"818",2523788,2526222,"I'll call you later. Bye.","Identity Thief"
"819",2528791,2531193,"How long have youguys been together?","Identity Thief"
"820",2532795,2533896,"I'm not going totalk about myself.","Identity Thief"
"821",2535733,2538201,"Or my family.You're never going to
know anything about me.","Identity Thief"
"822",2538202,2541204,"There's nothing wrongwith being a simple guy.","Identity Thief"
"823",2541206,2543572,"I'm just a simple gal.","Identity Thief"
"824",2543574,2546775,"From Wisconsin.You know?
I'm a cheesehead.","Identity Thief"
"825",2546777,2547876,"Fascinating.","Identity Thief"
"826",2547878,2549045,"I'm from Morganville.","Identity Thief"
"827",2549047,2551813,"It's a little, tiny town,but charming.","Identity Thief"
"828",2551815,2552949,"I don't care.","Identity Thief"
"829",2552951,2555684,"Mom's 70. Still working.","Identity Thief"
"830",2555686,2558588,"Dad retired about,I guess, two and a...
(SIGHING)","Identity Thief"
"831",2558590,2560690,"I want to say twoand a half years.
Two, two and a half...","Identity Thief"
"832",2560692,2562724,"Jesus Christ.Two and a half years ago.","Identity Thief"
"833",2562726,2564693,"He was a principalat a middle school.","Identity Thief"
"834",2564695,2566228,"They sound so normal.","Identity Thief"
"835",2566231,2568231,"How'd they havea criminal asshole
for a daughter","Identity Thief"
"836",2568233,2569331,"who just goes aroundwrecking people's lives?","Identity Thief"
"837",2569333,2571134,"How'd that work out?","Identity Thief"
"838",2571135,2576338,"I think you'repainting it with the most
negative brush possible.","Identity Thief"
"839",2576340,2579175,"I bet thatthey would paint it
the same exact way.","Identity Thief"
"840",2579177,2582110,"I mean, what you do is...I use the system.","Identity Thief"
"841",2582112,2584981,"I use the systemthat's provided...
You cheat the system.","Identity Thief"
"842",2584983,2587050,"Now, the fact that I...No, I do not cheat
the system.","Identity Thief"
"843",2587052,2588985,"I use the system.If there's a loophole,","Identity Thief"
"844",2588987,2590652,"and I go throughthe loophole,","Identity Thief"
"845",2590655,2592155,"I'm not doinganything wrong.","Identity Thief"
"846",2592157,2594356,"You create a lotof destruction.","Identity Thief"
"847",2594358,2597327,"You know, it's not my faultif people don't check
their own finances.","Identity Thief"
"848",2597329,2600362,"All you do is make one callto the credit card company,","Identity Thief"
"849",2600364,2602297,"they take the charge off.It's a victimless crime...","Identity Thief"
"850",2602300,2605867,"It's not a victimless...I'm a victim!","Identity Thief"
"851",2605869,2609005,"We're kind of in the midstof a pivotal moment
here, you know?","Identity Thief"
"852",2609007,2611007,"This is...","Identity Thief"
"853",2611009,2613643,"I think we might wantto take stock of this.","Identity Thief"
"854",2613644,2617347,"We're kind of bonding.","Identity Thief"
"855",2617349,2620016,"It's kind of like family,or brother and sister,","Identity Thief"
"856",2621684,2623286,"if brother and sister were","Identity Thief"
"857",2624621,2626623,"pretty attractedto each other.","Identity Thief"
"858",2626625,2629692,"We are justdriving to Denver.
There will be nothing else.","Identity Thief"
"859",2630159,2632061,"I just thought,","Identity Thief"
"860",2632063,2634163,"in the spirit of honesty,I'd put out there","Identity Thief"
"861",2634164,2635632,"that I visually enjoy you.","Identity Thief"
"862",2636032,2637400,"Hmm.","Identity Thief"
"863",2637402,2641971,"And I've always, you know,really liked tall men.","Identity Thief"
"864",2643239,2646708,"What are you talking...I'm average height.","Identity Thief"
"865",2646710,2647809,"Not to me, stretch.","Identity Thief"
"866",2648878,2650213,"Great.(GASPING)","Identity Thief"
"867",2650215,2652715,"Look at that.See that? ""Adventure.""","Identity Thief"
"868",2652717,2654751,"I love that.","Identity Thief"
"869",2654753,2655717,"When are wegoing to pull over?","Identity Thief"
"870",2655719,2657387,"We're not.","Identity Thief"
"871",2657389,2660922,"You know, they say drivingtired is more dangerous
than driving drunk","Identity Thief"
"872",2660925,2663259,"and that'sa statistical fact.","Identity Thief"
"873",2664360,2666228,"I doubt it.","Identity Thief"
"874",2666231,2669132,"You know,I drive drunk all the time.","Identity Thief"
"875",2669134,2672434,"Never had a problem.I slept-drove once
and I smashed into an Arby's.","Identity Thief"
"876",2672436,2674070,"Take a nap.","Identity Thief"
"877",2674072,2677373,"All right. Whatever you say.Going down.
Thank you.","Identity Thief"
"878",2679309,2680376,"Uh-oh.","Identity Thief"
"879",2680378,2682010,"What happened?","Identity Thief"
"880",2682012,2683278,"You look tallerfrom down here.","Identity Thief"
"881",2687985,2689418,"WAITRESS: Welcometo the Colonnade.","Identity Thief"
"882",2689420,2690952,"How y'all doing?","Identity Thief"
"883",2690954,2692954,"(IN SOUTHERN ACCENT) Good.We're famished, though.","Identity Thief"
"884",2692956,2696726,"We just drove allthe way from Gibson, so.","Identity Thief"
"885",2696728,2700862,"You know what, do you thinkwe can maybe have a booth
instead of a table?","Identity Thief"
"886",2700864,2703932,"It's just it's real hardfor Walt there to sit
on a hard chair,","Identity Thief"
"887",2703934,2706135,"'cause of his accidentand he, uh...","Identity Thief"
"888",2706137,2707003,"(WHISPERING)","Identity Thief"
"889",2709239,2710873,"You know what I mean?He doesn't...","Identity Thief"
"890",2710875,2711940,"(MUTTERING)","Identity Thief"
"891",2712943,2714744,"Just right at the base.","Identity Thief"
"892",2719949,2722050,"Okay?Okay. Yeah.","Identity Thief"
"893",2722385,2723452,"Come on.","Identity Thief"
"894",2726389,2729092,"Oh! This is nice.","Identity Thief"
"895",2729094,2732027,"It's nice and soft, Walt.You like that.","Identity Thief"
"896",2733329,2734996,"Just leave me out ofthe school plays, okay?","Identity Thief"
"897",2734998,2736164,"I'm not comfortable with it.","Identity Thief"
"898",2736166,2739202,"Now, I have allottedus each $8 per meal,","Identity Thief"
"899",2739204,2742237,"(SIGHING)so it looks like you
can get one of the...","Identity Thief"
"900",2742239,2744206,"One of the saladsor a soup or...","Identity Thief"
"901",2744208,2748110,"The tomato soup for me,please. That'll do it.","Identity Thief"
"902",2748112,2750980,"I'm going to takea full slab
of the baby backs,","Identity Thief"
"903",2750981,2753949,"and I'm going to take thatwith mashed taters,","Identity Thief"
"904",2753952,2757853,"hushpuppiesand I'm going to
have a sweet tea.","Identity Thief"
"905",2757856,2759822,"The fuck you are.","Identity Thief"
"906",2759824,2762125,"(CHUCKLING) I don't knowwhat that means.","Identity Thief"
"907",2762126,2763760,"I asked youto eat less food.","Identity Thief"
"908",2766195,2767896,"What is wrong with you?","Identity Thief"
"909",2767898,2769465,"This is a beautiful woman.","Identity Thief"
"910",2769467,2770465,"You let her eat.","Identity Thief"
"911",2771802,2773969,"No, he's right.","Identity Thief"
"912",2773972,2777373,"You know, I've put ona little bit of weight
because of all the stress.","Identity Thief"
"913",2777375,2779474,"Walter is a fireman.(GROANING)","Identity Thief"
"914",2779476,2782311,"Yeah. It's okay, it's okay.","Identity Thief"
"915",2782313,2785114,"He was in a pretty intense...","Identity Thief"
"916",2785115,2786516,"She doesn't care.","Identity Thief"
"917",2786518,2790952,"...accident last year,and he injured
his male parts.","Identity Thief"
"918",2790954,2792954,"Oh.They're just
shredded down there.","Identity Thief"
"919",2792956,2794523,"And now he can't work.","Identity Thief"
"920",2794525,2796192,"He wants to fight fires,","Identity Thief"
"921",2797427,2799896,"and he wants topee standing up.","Identity Thief"
"922",2799898,2803266,"Don't you want topee standing up?
I know you do, but he can't.","Identity Thief"
"923",2803268,2808371,"And he can't lay with melike a husband should,","Identity Thief"
"924",2808373,2810039,"on account of the injury.","Identity Thief"
"925",2810041,2814543,"but he gets mad at me,and takes his anger out on me.","Identity Thief"
"926",2814545,2816179,"And then I feelbad about myself","Identity Thief"
"927",2816181,2818079,"and I feel ugly,and then I eat.","Identity Thief"
"928",2818081,2820449,"Lord knows, I know I eat.I know I do.","Identity Thief"
"929",2820451,2824119,"No, no. You just waitright here, sweetheart, okay?","Identity Thief"
"930",2824121,2825487,"(SNIFFLING) Okay.","Identity Thief"
"931",2825489,2826489,"I'm going towait right here.","Identity Thief"
"932",2826490,2827956,"SANDY: God.","Identity Thief"
"933",2827958,2829324,"You're breaking the rules.","Identity Thief"
"934",2829327,2830860,"You understand that?You're breaking the rules.","Identity Thief"
"935",2830862,2832295,"Society can't functionwithout rules.","Identity Thief"
"936",2832297,2833896,"Ah.","Identity Thief"
"937",2833898,2834831,"You follow the rules, right?","Identity Thief"
"938",2834833,2836264,"I sure do.","Identity Thief"
"939",2836266,2837567,"Oh, yeah, how's thatworking out for you?","Identity Thief"
"940",2838869,2840869,"Yeah. Hold on just a minute.","Identity Thief"
"941",2841505,2842538,"(WEEPING)","Identity Thief"
"942",2843940,2848143,"This is from the buffet,and it is on the house.","Identity Thief"
"943",2848146,2849177,"That's so sweet.","Identity Thief"
"944",2851481,2853882,"Enjoy your soup.","Identity Thief"
"945",2853885,2856152,"And if you have to pee,the ladies' room
is right back there.","Identity Thief"
"946",2857554,2860289,"God bless you.God bless you.
All right. Okay, okay.","Identity Thief"
"947",2860291,2861423,"(SNIFFLING)","Identity Thief"
"948",2864393,2865894,"You know whata sociopath is?","Identity Thief"
"949",2866530,2868231,"Do they like ribs?","Identity Thief"
"950",2870400,2873436,"Hey, how you doing?I need one room,
two beds, please.","Identity Thief"
"951",2873438,2874536,"Oh, sorry.","Identity Thief"
"952",2874539,2877072,"We only havesingle beds left tonight.","Identity Thief"
"953",2877074,2878474,"Are you kidding me?Nope.","Identity Thief"
"954",2878476,2880610,"We don't really mind.I mean, it's an inconvenience,","Identity Thief"
"955",2880612,2883980,"but my husband can't reallydigest stuff anyway
(SIGHING)","Identity Thief"
"956",2883981,2886882,"because of hisintestinal surgery,
so just comp us the mini-bar.","Identity Thief"
"957",2886885,2888251,"He can digest Pringles.","Identity Thief"
"958",2888253,2890385,"Right, that's right. I'm Walt.This is the wife, Myra.","Identity Thief"
"959",2890387,2893255,"She's a functional idiot.Wears diapers like a chimp.","Identity Thief"
"960",2893257,2894623,"I'm running herdown to Disneyland.","Identity Thief"
"961",2894626,2896157,"She loves the noiseand the sugar.","Identity Thief"
"962",2896159,2897927,"He's just tiredfrom the drive.","Identity Thief"
"963",2897929,2899128,"We're going tohave to figure out
the mattress thing","Identity Thief"
"964",2899130,2900463,"because even thoughI can't have sex with her","Identity Thief"
"965",2900465,2902264,"due to my cock and ballsgetting shot off","Identity Thief"
"966",2902266,2903498,"in an apparentwarehouse fire...","Identity Thief"
"967",2903501,2906369,"I wouldn't sharea bed with her anyway.","Identity Thief"
"968",2906371,2908971,"I'd much rathersleep on the floor.
Do you want to know why?","Identity Thief"
"969",2908972,2910139,"Because you got no dick?","Identity Thief"
"970",2910141,2913608,"Close. It's becauseshe repulses me.","Identity Thief"
"971",2913610,2916144,"She's the worstperson I've ever met.","Identity Thief"
"972",2916146,2918614,"Screw you. You got a bar?","Identity Thief"
"973",2918615,2920483,"Yeah, the Foxhole.It's across the lot.","Identity Thief"
"974",2920485,2922952,"Thank you.You're not going
to the Foxhole.","Identity Thief"
"975",2922954,2925655,"Hey. I don't need to goto Denver. You need me
to go to Denver.","Identity Thief"
"976",2925657,2927956,"No splitting up.","Identity Thief"
"977",2927958,2928925,"Do you stillwant the room?","Identity Thief"
"978",2928927,2930992,"Yeah, I do, real quick.","Identity Thief"
"979",2930994,2934996,"It's not my business,I'm really sorry
about your dick,","Identity Thief"
"980",2934998,2939235,"but you got totreat your lady better,
or somebody else is gonna.","Identity Thief"
"981",2939237,2941170,"Appreciate it. Are weon the set of your
talk show right now?","Identity Thief"
"982",2942306,2944106,"Do you know what?Being nice is a choice.","Identity Thief"
"983",2944108,2945173,"Can I just getthe fucking key?","Identity Thief"
"984",2946043,2947409,"Uh... Oh!Are you in a hurry?","Identity Thief"
"985",2948210,2949711,"Oh, no.","Identity Thief"
"986",2949713,2951547,"I have to go getthis magnetized,","Identity Thief"
"987",2951548,2953449,"because it wasn'tmagnetized properly.","Identity Thief"
"988",2953451,2954516,"This might take a while.(SIGHING)","Identity Thief"
"989",2956420,2957652,"Can I havea double melon ball?","Identity Thief"
"990",2962224,2963259,"Thanks.","Identity Thief"
"991",2965027,2966329,"Is that a melon ball?","Identity Thief"
"992",2966697,2967996,"Yep.","Identity Thief"
"993",2970733,2972101,"Do you like milkshakes?","Identity Thief"
"994",2973338,2978340,"Sorry, that probably soundedlike a dumb pickup line,
I apologize.","Identity Thief"
"995",2984380,2986014,"I don't like milkshakes,I love them.","Identity Thief"
"996",2986016,2987349,"(CHUCKLING)","Identity Thief"
"997",2988552,2990018,"You're going toflip out over these.","Identity Thief"
"998",2990021,2991753,"Stu, mix us uptwo grasshoppers.","Identity Thief"
"999",2992621,2993989,"Oh!","Identity Thief"
"1000",2996226,2997592,"I'm Big Chuck.","Identity Thief"
"1001",2997594,2998693,"Yes, you are.","Identity Thief"
"1002",2999664,3003398,"Pleasure to makeyour acquaintance.
You, too.","Identity Thief"
"1003",3003400,3006001,"I love a manthat wears jewelry.","Identity Thief"
"1004",3006003,3008670,"Thank you very much.","Identity Thief"
"1005",3008672,3011507,"I like my turquoiselike I like my women,","Identity Thief"
"1006",3011509,3013442,"American and top-grade.Oh!","Identity Thief"
"1007",3013744,3015210,"100%.","Identity Thief"
"1008",3015213,3016644,"(BOTH CHUCKLING)100%.","Identity Thief"
"1009",3017179,3018414,"To you.","Identity Thief"
"1010",3024221,3025588,"You know what they sayabout grasshoppers?","Identity Thief"
"1011",3025590,3029525,"Hard on the outsideand soft and creamy
on the inside.","Identity Thief"
"1012",3029527,3032094,"Oh, I always likesoft and creamy.","Identity Thief"
"1013",3032096,3033661,"I'm soft and creamy.I know you are.","Identity Thief"
"1014",3036666,3038701,"Why don't we go make surethat table's okay?","Identity Thief"
"1015",3040137,3041103,"Looks like it's in danger.","Identity Thief"
"1016",3041105,3042771,"(BOTH LAUGH)","Identity Thief"
"1017",3042773,3044139,"Let me get your bag.","Identity Thief"
"1018",3045442,3048643,"I'd like you to get that,like you to get that.","Identity Thief"
"1019",3052715,3054250,"I'll just getyour drink for you.","Identity Thief"
"1020",3054251,3056117,"Why don't you get that?I'll get that.","Identity Thief"
"1021",3063460,3065193,"(CHUCKLES)","Identity Thief"
"1022",3065195,3067797,"You wait here.I'll be right back.","Identity Thief"
"1023",3070766,3071833,"I'm back.","Identity Thief"
"1024",3072568,3073436,"Agile.","Identity Thief"
"1025",3074637,3075771,"Quick like a panther.","Identity Thief"
"1026",3075773,3077505,"(LAUGHING)","Identity Thief"
"1027",3077507,3079407,"Cheers to you.Cheers to you.","Identity Thief"
"1028",3081177,3082777,"(CHUCKLING DRUNKENLY)","Identity Thief"
"1029",3086650,3089150,"Release it. Let it burn.(WHOOPING)","Identity Thief"
"1030",3090753,3092487,"BIG CHUCK: Mmm!Mmm mmm mmm.","Identity Thief"
"1031",3093090,3094190,"Down it goes.","Identity Thief"
"1032",3094192,3096458,"(BOTH GIGGLING)","Identity Thief"
"1033",3098594,3100262,"Hey.","Identity Thief"
"1034",3100264,3101630,"You're here five minutes,you already made
a friend, huh?","Identity Thief"
"1035",3102498,3104099,"This must be Walter.","Identity Thief"
"1036",3104101,3105201,"Walter.SANDY: Hello.","Identity Thief"
"1037",3105202,3107436,"Howdy, Walt.I'm Big Chuck.
Hi, there.","Identity Thief"
"1038",3107438,3110639,"I got to tell you,this little Margie
is quite a lady.","Identity Thief"
"1039",3110641,3112775,"Oh, ""Margie""?BIG CHUCK: Sit your ass down.","Identity Thief"
"1040",3112777,3115677,"Drinks are on me.Stu's going to set you up.
I wish I could.","Identity Thief"
"1041",3115679,3117813,"Stu, let's get Walt a round.His dick's broken.","Identity Thief"
"1042",3117815,3120782,"It's much, much too late.Never mind, Stu. I got to...","Identity Thief"
"1043",3120784,3123318,"Honey, I got toget you out of here.","Identity Thief"
"1044",3123320,3127188,"Here's the thing,I don't want to go.","Identity Thief"
"1045",3127190,3130559,"We got to get all the wayto St. Louis tomorrow, so...","Identity Thief"
"1046",3130561,3133128,"Then you should go, honey.","Identity Thief"
"1047",3133130,3135597,"But you are with me, honey.","Identity Thief"
