"id","startTime","endTime","text","title"
"1203",5553256,5556716,"a big fat PBY comes downand starts to pick us up.","Jaws"
"1204",5556801,5559636,"That was the timeI was most frightened.","Jaws"
"1205",5560305,5562139,"Waiting for my turn.","Jaws"
"1206",5563515,5566268,"I'll never put ona life jacket again.","Jaws"
"1207",5567979,5570439,"So, 1, 100 men wentinto the water","Jaws"
"1208",5571149,5573067,"316 men come out.","Jaws"
"1209",5573150,5577112,"The sharks took the rest,June 29, 1945.","Jaws"
"1210",5580074,5583827,"Anyway,we delivered the bomb.","Jaws"
"1211",5596048,5598175,"What's that?","Jaws"
"1212",5598260,5599510,"It's a whale.","Jaws"
"1213",5601512,5606475,"Farewell and adieuto you fair Spanish ladies","Jaws"
"1214",5607978,5612898,"Farewell and adieu,you ladies of Spain","Jaws"
"1215",5617194,5621239,"Show me the wayto go home","Jaws"
"1216",5622701,5626828,"I'm tiredand I want to go to bed","Jaws"
"1217",5628206,5633127,"I had a little drinkabout an hour ago","Jaws"
"1218",5633211,5637338,"And it's gone rightto my head","Jaws"
"1219",5638591,5642594,"Wherever I may roam","Jaws"
"1220",5643595,5647390,"By land, or sea or foam","Jaws"
"1221",5648268,5652938,"You will always hear mesinging this song","Jaws"
"1222",5654024,5662030,"Show me the wayto go home","Jaws"
"1223",5662114,5665242,"I'm tiredand I want to go to bed","Jaws"
"1224",5665327,5667911,"I had a little drinkabout an hour ago","Jaws"
"1225",5667996,5670331,"And it's gone rightto my head","Jaws"
"1226",5670582,5672832,"Wherever I may roam","Jaws"
"1227",5673251,5675586,"On land or sea or foam","Jaws"
"1228",5675670,5679006,"You can alwayshear me singing...","Jaws"
"1229",5682010,5683594,"Start the engines.","Jaws"
"1230",5693771,5696148,"- Fire her up!- Right in the middle!","Jaws"
"1231",5696274,5698609,"He's busting the shaft.","Jaws"
"1232",5703655,5705490,"Put out the fire,will you?","Jaws"
"1233",5715126,5716793,"Pump her out.Done.","Jaws"
"1234",5725552,5726720,"Everybody on deck.","Jaws"
"1235",5726805,5727930,"He ate the light.","Jaws"
"1236",5728014,5729597,"- Terrific.- Excuse me.","Jaws"
"1237",5732143,5735104,"Quint, what are you doing?Don't waste your time.","Jaws"
"1238",5735188,5736563,"Quint, come on.","Jaws"
"1239",5736648,5738356,"What's wrong with this?","Jaws"
"1240",5740734,5744570,"Hooper, take the wheel.Brody, follow that.
Watch for him.","Jaws"
"1241",5762297,5763631,"You okay?","Jaws"
"1242",5791118,5793119,"Chief,more left rudder!","Jaws"
"1243",5794122,5795706,"Pull your left hand down.","Jaws"
"1244",5795789,5798833,"I can't. It'll only goabout three inches.","Jaws"
"1245",5799002,5800793,"All of ourinjectors got scored","Jaws"
"1246",5800878,5802796,"from the salt waterin the fuel.","Jaws"
"1247",5803672,5806257,"Yeah,the housing's bent,
you can hear it.","Jaws"
"1248",5807135,5811596,"Try the left rudder again.More left. Good.
Once again now.","Jaws"
"1249",5814809,5816310,"Quint, there it is.","Jaws"
"1250",5817270,5818979,"What do you say, Chief?","Jaws"
"1251",5819189,5821773,"The barrel is up,it's right in the stern.","Jaws"
"1252",5825778,5829198,"I think he'sright under the keg.
Grab the boat hook.","Jaws"
"1253",5840542,5843002,"Quint, if we canget close enough...","Jaws"
"1254",5844421,5846172,"I've got things on boardthat'll kill it.","Jaws"
"1255",5846256,5849134,"Just want togoose him up.
Come on.","Jaws"
"1256",5860979,5864690,"When he runs,you drop that rope
or you'll lose your hands.","Jaws"
"1257",5866027,5868194,"I've seen fingerstorn out at the knuckles.","Jaws"
"1258",5868279,5870279,"Whole sea's bones,full of them.","Jaws"
"1259",5870364,5872282,"Give it to me a minute.","Jaws"
"1260",5887756,5890259,"Haul in that lineor it'll foul us.","Jaws"
"1261",5890969,5892426,"Start the engine.","Jaws"
"1262",5894764,5896347,"Where are you going?","Jaws"
"1263",5896431,5897975,"I'm going tomake a phone call.","Jaws"
"1264",5904399,5906899,"Hello, mayday, Orca.Coast Guard?","Jaws"
"1265",5908235,5910737,"Coast Guard,this is the Orca.
Do you read me?","Jaws"
"1266",5910822,5913323,"Coast Guard,this is the Orca.
Do you...","Jaws"
"1267",5919413,5920956,"Excuse me, Chief.","Jaws"
"1268",5921332,5924751,"That's great!That's just great!","Jaws"
"1269",5924836,5926502,"Now, where the hellare we, eh?","Jaws"
"1270",5927921,5931675,"You're certifiable,Quint, you know that?
You're certifiable!","Jaws"
"1271",5932010,5933801,"You're certifiable,but I'll tell you this!","Jaws"
"1272",5933886,5935177,"Boys,","Jaws"
"1273",5936847,5939515,"I think he's come backfor his noon feeding.","Jaws"
"1274",5941019,5942810,"Hook me upanother barrel.","Jaws"
"1275",5973426,5975260,"Bring her aroundafter him.","Jaws"
"1276",5992110,5994570,"Full throttle!Get me right up
alongside of him!","Jaws"
"1277",5994697,5997948,"I can't rev it up that high,it's not going to take it!","Jaws"
"1278",6015676,6017260,"Five degrees port.","Jaws"
"1279",6024143,6026103,"All right,hold your course.","Jaws"
"1280",6032443,6034360,"Five degrees port now.","Jaws"
"1281",6037864,6039282,"Hold your course.","Jaws"
"1282",6040952,6042202,"Fast fish.","Jaws"
"1283",6042286,6043453,"Watch my hand.","Jaws"
"1284",6044663,6048207,"Be sure you watchmy hand! Follow me.","Jaws"
"1285",6049460,6052045,"Lad, you watch him now!Starboard!","Jaws"
"1286",6053296,6055131,"Run him down, Hooper.","Jaws"
"1287",6062305,6063640,"Hard aport.","Jaws"
"1288",6067478,6069145,"Watch him. Starboard.","Jaws"
"1289",6093962,6097298,"I can't believe it.Two barrels and
he's going down again.","Jaws"
"1290",6102930,6104346,"It's incredible.","Jaws"
"1291",6110395,6112314,"They're up again!Now what?","Jaws"
"1292",6121573,6123949,"Why don't we leadthe shark into shore","Jaws"
"1293",6124034,6125827,"instead of himleading us out to sea?","Jaws"
"1294",6130291,6132000,"Grab a couple of poles.","Jaws"
"1295",6134295,6136421,"Hang on now,we're going around.","Jaws"
"1296",6137215,6139716,"Into starboard. Easy.","Jaws"
"1297",6140676,6142719,"I'm going toback her off now.","Jaws"
"1298",6142804,6144595,"Watch those barrels, boys.Watch them.","Jaws"
"1299",6149143,6151228,"All right, gentlemen,snag them.","Jaws"
"1300",6156484,6158859,"Now then, tie themto the stern cleats.","Jaws"
"1301",6162113,6164740,"Brody, bring your endaround the cleat.","Jaws"
"1302",6165784,6169328,"That's right,it'll lock itself off.
Give him room, Brody.","Jaws"
"1303",6171414,6173123,"Stay clear of the line!","Jaws"
"1304",6180882,6182591,"Watch it. Stand clear.","Jaws"
"1305",6192728,6195229,"Stand away fromthose stern cleats!","Jaws"
"1306",6208368,6210453,"Back home we gota taxidermy man.","Jaws"
"1307",6210537,6211997,"He's going tohave a heart attack","Jaws"
"1308",6212081,6214748,"when he seeswhat I brought him.","Jaws"
"1309",6220631,6223466,"Throttle back.You're losing a cleat.","Jaws"
"1310",6226177,6228846,"My God, this one, too.They're both going.","Jaws"
"1311",6229097,6231015,"He's eating his waythrough that line.","Jaws"
"1312",6231100,6232975,"He's working his wayright up to us.","Jaws"
"1313",6233101,6235936,"Quint!Come on, Quint. Hurry!","Jaws"
"1314",6238481,6239774,"Out of my way.","Jaws"
"1315",6244988,6245988,"Watch it.","Jaws"
"1316",6250036,6252662,"Untie this.He'll pull out
the transom.","Jaws"
"1317",6256500,6258460,"Make it fast! We gotanother line in him!","Jaws"
"1318",6258543,6260502,"I can't,it's trying to run!","Jaws"
"1319",6261881,6263590,"We betterget another line!","Jaws"
"1320",6263673,6265675,"Pull,you son of a bitch!","Jaws"
"1321",6265967,6268177,"I hope your back breaks!","Jaws"
"1322",6268261,6270137,"Go ahead. Pull yourbloody heart out.","Jaws"
"1323",6270805,6272181,"Tie him off!","Jaws"
"1324",6277354,6279689,"It's impossible!","Jaws"
"1325",6280899,6282567,"Boys, it's too tight!","Jaws"
"1326",6283027,6284819,"He's pulling us!","Jaws"
"1327",6286738,6288657,"We're breaking upover here!","Jaws"
"1328",6295247,6297539,"We're breaking up!Cut it!","Jaws"
"1329",6298376,6299833,"Watch your hands!","Jaws"
"1330",6301212,6303253,"- Cut it quick.- I can't hold it!","Jaws"
"1331",6324402,6326778,"He can't stay downwith three barrels
on him.","Jaws"
"1332",6326904,6329072,"Not with three barrels,he can't.","Jaws"
"1333",6329239,6330739,"What about us?","Jaws"
"1334",6331283,6334953,"Hooper, get the pumpout of the locker
in front of you, will you?","Jaws"
"1335",6335412,6337162,"We're going to sink,aren't we?","Jaws"
"1336",6337247,6340207,"Keep an eye on the barrels.Pump it out, Chief.","Jaws"
"1337",6346716,6348257,"Starting to go under.","Jaws"
"1338",6348426,6351886,"He can't withthree barrels on him.
Not with three he can't.","Jaws"
"1339",6386756,6388922,"You ever haveone do this before?","Jaws"
"1340",6391135,6392260,"No.","Jaws"
"1341",6423917,6426627,"- He's chasing us.- I don't believe it.","Jaws"
"1342",6431759,6434260,"I'm going to draw himinto the shallows.","Jaws"
"1343",6434345,6435552,"Draw him intothe shallow water.","Jaws"
"1344",6435637,6438430,"I'm going to draw him inand drown him.","Jaws"
"1345",6438681,6439890,"We're heading in, Brody.","Jaws"
"1346",6439975,6441141,"Thank Christ!","Jaws"
"1347",6448943,6450025,"You ever hada great white do that?","Jaws"
"1348",6450110,6451444,"No.","Jaws"
"1349",6457534,6459618,"How far do wehave to go?","Jaws"
"1350",6462206,6464791,"Don't put that muchpressure on it.","Jaws"
"1351",6474969,6476051,"God damn it.","Jaws"
"1352",6476136,6477845,"Shut up.Get back there.","Jaws"
"1353",6483560,6484726,"Hold on.","Jaws"
"1354",6499743,6504997,"Farewell and adieuto you fair Spanish ladies","Jaws"
"1355",6507251,6512087,"Farewell and adieu,you ladies of Spain","Jaws"
"1356",6513673,6518845,"For we received orderfor to sail back to Boston","Jaws"
"1357",6519220,6521597,"You idiot,you burned out
the bearings.","Jaws"
"1358",6523266,6526728,"All right,stop the boat. Stop it.","Jaws"
"1359",6626537,6629913,"What exactly can you dowith these things of yours?","Jaws"
"1360",6633752,6637838,"I think I can pump 20 ccof strychnine nitrate
into him.","Jaws"
"1361",6638215,6640425,"If I can getclose enough.","Jaws"
"1362",6642886,6645387,"Get this little needlethrough his skin?","Jaws"
"1363",6647181,6648765,"No, I can't do that.","Jaws"
"1364",6650728,6652645,"If I can get himclose to the cage,","Jaws"
"1365",6652729,6653895,"I can get himin the mouth.","Jaws"
"1366",6653980,6655523,"That shark will ripthat cage to pieces.","Jaws"
"1367",6655606,6658025,"You got anybetter suggestions?","Jaws"
"1368",6683260,6684301,"Easy.","Jaws"
"1369",6686889,6688096,"Up she goes.","Jaws"
"1370",6689475,6691225,"Ease her up.","Jaws"
"1371",6743112,6744569,"Ain't got no spit.","Jaws"
"1372",6759920,6762421,"Try and keep him off meuntil I'm lower.","Jaws"
"1373",6765175,6766634,"Okay, I'm ready.","Jaws"
"1374",6943311,6947023,"Bring him up, God damn it.Bring him up now!","Jaws"
"1375",6952613,6954363,"Pull it up. Pull it.","Jaws"
"1376",6964291,6966876,"Pull him up.Come on, Quint,
bring him in.","Jaws"
"1377",6970171,6971546,"It's giving way!","Jaws"
"1378",6983560,6985519,"Rig something!","Jaws"
"1379",6988523,6989689,"Got it?","Jaws"
"1380",6993904,6995070,"It's coming.","Jaws"
"1381",6995738,6997364,"Slow it down.","Jaws"
"1382",6997740,6999033,"Slower.","Jaws"
"1383",7190975,7193685,"All right, come on.","Jaws"
"1384",7193770,7195311,"Show me the tank.","Jaws"
"1385",7213789,7215123,"Blow up!","Jaws"
"1386",7218295,7220087,"Smile, you son of a bitch!","Jaws"
"1387",7309260,7310386,"Quint?","Jaws"
"1388",7311720,7312805,"No.","Jaws"
"1389",7322064,7323731,"Can we get inon those?","Jaws"
"1390",7330407,7331823,"What day is this?","Jaws"
"1391",7334284,7336662,"- It's Wednesday.- It's Tuesday, I think.","Jaws"
"1392",7338288,7340416,"I think the tide'swith us.","Jaws"
"1393",7341001,7342583,"Keep kicking.","Jaws"
"1394",7345963,7348090,"I used tohate the water.","Jaws"
"1395",7350301,7352136,"I can't imagine why.","Jaws"
"1396",7353000,7356127,"","Jaws"