"id","startTime","endTime","text","title"
"1",1000,4073,"Subtitles downloaded from Podnapisi.NET","Jaws"
"2",149191,150399,"Chrissie.","Jaws"
"3",151151,152317,"Where are we going?","Jaws"
"4",152401,153485,"Swimming.","Jaws"
"5",156323,159574,"Slow up. Slow down.","Jaws"
"6",160076,163287,"I'm not drunk!Slow down!","Jaws"
"7",164956,166665,"Wait. I'm coming.","Jaws"
"8",168085,169460,"I'm coming.","Jaws"
"9",170586,172504,"I'm definitely coming.","Jaws"
"10",172631,173673,"Whoa.","Jaws"
"11",173757,175299,"Hold on. Whoa!","Jaws"
"12",184810,186269,"I can swim.","Jaws"
"13",187104,189813,"I just can't walkor undress myself.","Jaws"
"14",210127,211877,"Come on in the water!","Jaws"
"15",211961,213795,"Take it easy.","Jaws"
"16",249917,252877,"Oh, God, help!","Jaws"
"17",260509,262052,"Please help me!","Jaws"
"18",262346,264180,"I'm coming.","Jaws"
"19",266432,267766,"It hurts!","Jaws"
"20",305639,307514,"Localfishing reported good.","Jaws"
"21",307598,309684,"Amity Boat Rental Yard'sopening early","Jaws"
"22",309768,311851,"to prepare forthe annual seasonal rush.","Jaws"
"23",311937,313603,"This is WISS...","Jaws"
"24",317817,320903,"How come the sundidn't use to shine
in here?","Jaws"
"25",323781,327283,"We boughtthe house in the fall,
and this is summer.","Jaws"
"26",331581,333665,"Somebody feed the dogs.","Jaws"
"27",333750,334959,"Right.","Jaws"
"28",339505,341340,"Do you see the kids?","Jaws"
"29",347430,349432,"They must bein the back yard.","Jaws"
"30",349516,351516,"In Amity you say ""yard.""","Jaws"
"31",353019,356980,"They're in the ""yard,""not too ""far""
from the ""car.""","Jaws"
"32",359817,361026,"How's that?","Jaws"
"33",361110,362278,"Like you'refrom New York.","Jaws"
"34",364156,367449,"Mum, I got cut.I got hit by a vampire.","Jaws"
"35",367533,368701,"You were playingon those swings,
weren't you?","Jaws"
"36",369870,371036,"Those swingsare dangerous.","Jaws"
"37",371120,372704,"Stay off there.I haven't fixed them yet.","Jaws"
"38",373956,375499,"I think you'regoing to live.","Jaws"
"39",375625,378209,"It's not the prettiestthing I've ever seen.
Hello.","Jaws"
"40",378295,380086,"Yes.Can I go swimming?","Jaws"
"41",380172,382464,"Yeah, but let me cleanthis thing off first.","Jaws"
"42",382548,385718,"What do they usually do?Wash up, or float up,
or what?","Jaws"
"43",387971,389180,"Oh, no.","Jaws"
"44",390223,393183,"Keep them there.I'll be out in about","Jaws"
"45",394144,396562,"15, 20 minutes.All right?","Jaws"
"46",396646,398146,"Dry you off.Okay.","Jaws"
"47",398314,399899,"Go on,get a Band-Aid.","Jaws"
"48",400733,402567,"- Got to go.- Missing person.","Jaws"
"49",402819,405862,"Season hasn't started.Nobody's even here yet.","Jaws"
"50",409326,410909,"Listen, Chief...","Jaws"
"51",411577,412702,"be careful, will you?","Jaws"
"52",412788,413829,"In this town?","Jaws"
"53",413913,415497,"Hi, Dad.","Jaws"
"54",415581,417374,"Wait a minute.Let me get on.","Jaws"
"55",417709,419125,"I want my cup back!","Jaws"
"56",419211,420418,"You'll get it.","Jaws"
"57",421713,423923,"Wave goodbye. Bye.","Jaws"
"58",454538,456413,"Nobody saw hergo into the water?","Jaws"
"59",456540,459959,"Somebody could've.I was sort of passed out.","Jaws"
"60",460627,462168,"You mean,she ran out on you?","Jaws"
"61",462254,463379,"No, sir.","Jaws"
"62",465715,467550,"She must've drowned.","Jaws"
"63",468050,470718,"Look, I reported itto you, didn't I?","Jaws"
"64",470803,471928,"You live here?","Jaws"
"65",472012,473096,"No. Hartford.","Jaws"
"66",473557,476016,"I go to Trinity.My folks live
in Greenwich.","Jaws"
"67",476100,477350,"Your folks wereborn here, right?","Jaws"
"68",477435,478894,"Yeah, I'm an Islander.","Jaws"
"69",479019,480980,"They moved offwhen my dad retired.","Jaws"
"70",481064,482064,"You an Islander?","Jaws"
"71",482149,483232,"No. New York City.","Jaws"
"72",483358,485860,"You here for the summer?Come on.","Jaws"
"73",499456,500749,"Hold it.","Jaws"
"74",513429,514763,"Oh, Jesus.","Jaws"
"75",539623,543583,"Well, you're up awful early.Is the Chief in there?","Jaws"
"76",545003,547922,"Chief, what haveyou got on?","Jaws"
"77",548005,549923,"If this new filing systemis to work,","Jaws"
"78",550008,551926,"you must keepoutdated stuff
off my desk.","Jaws"
"79",552009,554010,"Just the pending,all right?
Yes, Chief.","Jaws"
"80",554136,556846,"We got a bunch of callsabout that karate school.","Jaws"
"81",556972,559807,"It seems that the 9-year-oldsfrom the school have been","Jaws"
"82",559893,562311,"karate-ingthe picket fences.","Jaws"
"83",563480,567024,"Chief Brody's office.The medical inspector.","Jaws"
"84",579037,581871,"The Fire Chiefwants you to go over
the Fourth of July...","Jaws"
"85",581998,584165,"Polly, I want a listof the water activities","Jaws"
"86",584250,586418,"that the city fathersare planning for today.","Jaws"
"87",586503,587878,"Right away.Hendricks!","Jaws"
"88",588004,590172,"Where do we keepthe ""Beach Closed"" signs?","Jaws"
"89",590256,591506,"We never had any.No?","Jaws"
"90",591591,595009,"There's a dead truckwith New Hampshire plates
in front of my store.","Jaws"
"91",596011,599682,"Just have himfill out the form.
Just fill it out.","Jaws"
"92",621370,624831,"Look whatthe kids did to my fence.
8 and 9-year-olds...","Jaws"
"93",624916,626625,"Glasses?Yeah, glasses.","Jaws"
"94",627751,630586,"I'll call you laterin the afternoon.
I promise.","Jaws"
"95",635884,638511,"This stuff ain't goingto help me in August.","Jaws"
"96",638596,640972,"The summer ginkscome down here in June.","Jaws"
"97",641307,643933,"You haven't gotone thing on here
I ordered.","Jaws"
"98",644059,648272,"Not a beach umbrella,not a sun lounger,
no beach balls.","Jaws"
"99",648398,650274,"If I can't get service...","Jaws"
"100",657323,659991,"Chief, Polly sent meto tell you","Jaws"
"101",660076,662076,"that there's a bunchof Boy Scouts
out in Avril Bay","Jaws"
"102",662162,664120,"doing the mile swimfor their merit badges.","Jaws"
"103",664246,666664,"I couldn't call them in,there's no phones out there.","Jaws"
"104",666750,668458,"Okay. Come on,get out of there.","Jaws"
"105",668585,670085,"Take this stuffback to the office","Jaws"
"106",670211,671711,"and get to workon those signs.","Jaws"
"107",671796,675173,"""Beaches Closed. No Swimming.By order of the Amity P. D.""","Jaws"
"108",675258,676799,"Let Pollydo the printing.","Jaws"
"109",676926,677967,"What's the matterwith my printing?","Jaws"
"110",678052,680386,"Let Pollydo the printing.","Jaws"
"111",680471,681889,"Chief Brody!","Jaws"
"112",685434,686726,"What have you got there?","Jaws"
"113",686811,688312,"Listen, we hada shark attack","Jaws"
"114",688395,690022,"at South Beachthis morning, Mayor.","Jaws"
"115",690105,691731,"Fatal. I have tobatten down the beach.","Jaws"
"116",692399,695443,"Albert,come on, you kook.
Keep your arms up.","Jaws"
"117",702118,704827,"Charlie, take me outto those kids, will you?","Jaws"
"118",728311,731605,"Martin, you're goingto shut down the beaches
on your own authority?","Jaws"
"119",731688,733399,"What other authoritydo I need?","Jaws"
"120",733482,734899,"Technically, you needa civic ordinance","Jaws"
"121",734984,736485,"or a resolutionby a board of...","Jaws"
"122",736610,737985,"That's just goingby the book.","Jaws"
"123",738113,739404,"We're reallya little anxious","Jaws"
"124",739489,742240,"that you're rushing intosomething serious here.","Jaws"
"125",742325,744368,"This is your firstsummer, you know.","Jaws"
"126",744451,746161,"What does that mean?","Jaws"
"127",746620,750206,"I'm only tryingto say that Amity
is a summer town.","Jaws"
"128",750875,752835,"We need summer dollars.","Jaws"
"129",753043,754461,"If they can'tswim here","Jaws"
"130",754546,756379,"they'll be glad toswim at the beaches","Jaws"
"131",756463,758715,"of Cape Cod,the Hamptons,
Long Island.","Jaws"
"132",758841,761134,"That doesn't meanwe serve them
a smorgasbord.","Jaws"
"133",761219,764638,"But we've never hadthat kind of trouble
in these waters.","Jaws"
"134",764721,766557,"What else could'vedone that to that girl?","Jaws"
"135",766640,767724,"A boat propeller?","Jaws"
"136",767850,771061,"I think possibly,yes, a boating accident.","Jaws"
"137",771187,772729,"That's notwhat you told me
on the phone.","Jaws"
"138",772813,774273,"I was wrong.","Jaws"
"139",774356,776274,"We'll have toamend our reports.","Jaws"
"140",776359,777359,"And you'llstand by that?","Jaws"
"141",777443,779068,"I'll stand by that.","Jaws"
"142",779403,783865,"Martin, a summer girlgoes swimming,
swims out a little far.","Jaws"
"143",784366,786493,"She tires,fishing boat
comes along...","Jaws"
"144",786577,787702,"It's happened before.","Jaws"
"145",787828,790246,"I don't thinkyou appreciate
the gut reaction","Jaws"
"146",790331,791498,"people haveto these things.","Jaws"
"147",791582,794543,"Larry, I appreciate it.I'm just reacting
to what I was told.","Jaws"
"148",794668,797171,"Martin,it's all psychological.","Jaws"
"149",797754,801549,"You yell, ""Barracuda!""And everybody says,
""Huh? What?""","Jaws"
"150",803510,805386,"You yell, ""Shark!""...","Jaws"
"151",806556,809682,"we've gota panic on our hands
on the Fourth of July.","Jaws"
"152",811686,813895,"Okay. You cantake us back now.","Jaws"
"153",824032,825532,"Here's mommy, here.","Jaws"
"154",826576,829327,"I'm going to get my raftand go back out in the water.","Jaws"
"155",829412,831413,"Let me seeyour fingers.","Jaws"
"156",832248,834415,"Alex Kintner,they're beginning
to prune.","Jaws"
"157",834500,836418,"Just let me go outa little longer.","Jaws"
"158",836543,837668,"Just 10 more minutes.","Jaws"
"159",837754,838879,"Thanks.","Jaws"
"160",841090,842591,"There are no Islanders.","Jaws"
"161",842674,843841,"None of them arefrom the island.","Jaws"
"162",843927,844967,"It's just a big bother.","Jaws"
"163",845052,846010,"They're bringing in...","Jaws"
"164",846095,847346,"All I want to know...","Jaws"
"165",847429,849472,"I just want toknow one simple thing.","Jaws"
"166",849557,851099,"When do I get tobecome an Islander?","Jaws"
"167",851183,853309,"Ellen, never.","Jaws"
"168",853394,855854,"You're not born here,you're not an Islander.
That's it.","Jaws"
"169",889556,891306,"Nantucket Ferries...","Jaws"
"170",891474,893892,"...to Amity,Martha's Vineyard
and Nantucket islands.","Jaws"
"171",893976,897395,"Monday to Thursday,8:40, 1: 15, 5:45
and 6:00 p.m.","Jaws"
"172",897480,900148,"Starting July 1,8:30 p.m...","Jaws"
"173",903945,905236,"Come back here.","Jaws"
"174",913620,916789,"But don'tbother him. Come right back.
Okay. I won't.","Jaws"
"175",919001,921753,"Martin, I know you gota lot of problems downtown","Jaws"
"176",921837,924923,"but I've gotproblems at the house
I wish you'd take care of.","Jaws"
"177",925008,926591,"One, I've gotsome cats parking","Jaws"
"178",926676,927759,"in front of the house,I can't get...","Jaws"
"179",929011,932471,"And that garbage trucknext to the office,
that's terrible.","Jaws"
"180",932639,936183,"What I need is a red zone.It's a simple thing
you can take care of.","Jaws"
"181",936269,939312,"You've done it before.Come here a minute,
please.","Jaws"
"182",942859,944109,"Are you okay?","Jaws"
"183",944192,946278,"Yeah, I'm fine.","Jaws"
"184",946361,949364,"Listen, if the kidsgoing in the water
is worrying you","Jaws"
"185",949490,952491,"they can play out hereon the beach.","Jaws"
"186",952659,954536,"It's all right.Let them go.","Jaws"
"187",964172,965339,"It's cold.","Jaws"
"188",967133,969301,"We know allabout you, Chief.","Jaws"
"189",969384,971510,"You don't go in the waterat all, do you?","Jaws"
"190",972179,974056,"That's somebad hat, Harry.","Jaws"
"191",979519,981855,"Chief Brody,you are uptight.","Jaws"
"192",983482,986234,"Come on. That's it.","Jaws"
"193",994159,997328,"Oh, do you knowthe muffin man","Jaws"
"194",997413,998663,"The muffin man","Jaws"
"195",999539,1001165,"Tippet!","Jaws"
"196",1031279,1033030,"Did you see that?","Jaws"
"197",1041457,1042708,"Blood!","Jaws"
"198",1047630,1049047,"Everybody out!","Jaws"
"199",1052300,1053801,"Get them out!","Jaws"
"200",1060143,1062477,"Michael,get out of the water!","Jaws"
"201",1075407,1076490,"Alex?","Jaws"
"202",1095510,1098262,"We don't even knowif there's a shark
around here.","Jaws"
"203",1098346,1101016,"I can't argue with you.I can't talk to you.","Jaws"
"204",1101768,1103477,"I have to talkto Mrs. Kintner.","Jaws"
"205",1103560,1105269,"Because this isturning into a contest.","Jaws"
"206",1105354,1109148,"It's not just the Gazette.She's advertising in
out-of-town papers.","Jaws"
"207",1109608,1113361,"I suggest we move backto council chambers where
we'll have more room.","Jaws"
"208",1113488,1115447,"I'm responsible forpublic safety here.","Jaws"
"209",1115530,1118532,"Then go out tomorrowand see that
no one gets hurt.","Jaws"
"210",1118867,1121368,"It's a small story.I'll bury it as deep
as I can.","Jaws"
"211",1121496,1124205,"The ad will run on the backalong with the grocery ads.","Jaws"
"212",1125540,1127209,"Right in here, please.","Jaws"
"213",1128877,1130503,"Move on in, please.","Jaws"
"214",1144684,1146644,"Why do you insiston playing the heavy?","Jaws"
"215",1146729,1150856,"I have a point of viewand I think it speaks for
many of the people here.","Jaws"
"216",1153861,1157489,"Not only me,because I have the motel.
How do you feel about it?","Jaws"
"217",1157656,1159365,"Let's havesome order.","Jaws"
"218",1161368,1163369,"Let's have order,please.","Jaws"
"219",1164497,1166080,"Any special questions?","Jaws"
"220",1167083,1170669,"Is that $3,000bounty on the shark
in cash or check?","Jaws"
"221",1172380,1173462,"I don't thinkthat's funny.","Jaws"
"222",1173548,1175757,"I don't thinkthat's funny at all.","Jaws"
"223",1175842,1177259,"All right.","Jaws"
"224",1178094,1181680,"That's private businessbetween you fishermen
and Mrs. Kintner.","Jaws"
"225",1183849,1186226,"Martin,would you please...","Jaws"
"226",1186935,1188353,"Chief Brody.","Jaws"
"227",1190105,1193525,"I just want to tell youwhat we're planning so far.","Jaws"
"228",1193608,1195359,"What aboutthe beaches, Chief?","Jaws"
"229",1195443,1199530,"We're going to put onthe extra summer deputies
as soon as possible.","Jaws"
"230",1199781,1202951,"And then we're going to tryand use shark spotters
on the beach.","Jaws"
"231",1203035,1205412,"Are you going toclose the beaches?","Jaws"
"232",1209083,1210291,"Yes, we are.","Jaws"
"233",1212961,1215046,"We also plan tobring in experts","Jaws"
"234",1215131,1217632,"from the OceanographicInstitute on the mainland.","Jaws"
"235",1218259,1220594,"Only 24 hours.","Jaws"
"236",1220678,1221760,"I didn't agree to that.","Jaws"
"237",1223890,1225390,"Only 24 hours.","Jaws"
"238",1225932,1228768,"Twenty-four hoursis like three weeks!","Jaws"
"239",1252417,1255961,"You all know me.Know how I earn a living.","Jaws"
"240",1257298,1258923,"I'll catch this birdfor you.","Jaws"
"241",1259008,1261343,"It ain't going tobe easy. Bad fish.","Jaws"
"242",1262303,1263678,"Not like goingdown to the pond","Jaws"
"243",1263762,1266181,"and chasing bluegillsor tommy cods.","Jaws"
"244",1267642,1270143,"This shark,swallow you whole.","Jaws"
"245",1271269,1275690,"Shaking, tenderizing.Down you go.","Jaws"
"246",1276358,1278108,"And we got todo it quick.","Jaws"
"247",1278193,1279527,"Got to bring backthe tourists","Jaws"
"248",1279612,1282696,"that'll putall your businesses
on a paying basis.","Jaws"
"249",1283531,1285784,"But it's notgoing to be pleasant.","Jaws"
"250",1285867,1289037,"I value my necka lot more than
$3,000, Chief.","Jaws"
"251",1289872,1294375,"I'll find him for $3,000,but I'll catch him and
kill him for $10,000.","Jaws"
"252",1295001,1297002,"You got tomake up your minds.","Jaws"
"253",1297546,1299547,"Gonna stay aliveand ante up,","Jaws"
"254",1299632,1303218,"gonna play it cheapand be on welfare
the whole winter.","Jaws"
"255",1304720,1307055,"I don't want no volunteers.I don't want no mates.","Jaws"
"256",1307181,1310057,"There's too many captainson this island.","Jaws"
"257",1310558,1312894,"$10,000 for me,by myself.","Jaws"
"258",1313729,1318400,"For that,you get the head, the tail,
the whole damn thing.","Jaws"
"259",1322363,1324739,"Thank you very much,Mr. Quint.","Jaws"
"260",1326075,1328910,"We'll take itunder advisement.","Jaws"
"261",1331788,1334457,"Mr. Mayor, Chief,","Jaws"
"262",1336626,1338545,"ladies and gentlemen.","Jaws"
"263",1371787,1374497,"Oh, God, you scared me.","Jaws"
"264",1375332,1376624,"Oh.Oh.","Jaws"
"265",1378294,1382047,"You know, Ellen,people don't even know
how old sharks are.","Jaws"
"266",1382131,1385299,"I mean, if they live2,000, 3,000 years...
They don't know.","Jaws"
"267",1385425,1387594,"Enough.","Jaws"
"268",1387678,1389471,"You're not going toeven be able to go
to sleep tonight.","Jaws"
"269",1389596,1391806,"Here. Come on.","Jaws"
"270",1393017,1394308,"Thanks.","Jaws"
"271",1396269,1398063,"Oh.","Jaws"
"272",1399815,1401982,"Oh.","Jaws"
"273",1403152,1405319,"Want to get drunkand fool around?","Jaws"
"274",1405403,1406653,"Oh, yeah.","Jaws"
"275",1410951,1413286,"Mikey reallyloves his present.","Jaws"
"276",1414622,1416122,"Where is he?","Jaws"
"277",1416207,1417332,"Sitting in it.","Jaws"
"278",1420502,1421836,"Good God.","Jaws"
"279",1425673,1427967,"All right, Michael,out of the boat!","Jaws"
"280",1428969,1432180,"Tied up to the jetties,sitting in the boat.","Jaws"
"281",1432263,1433722,"I'm helping Michael.","Jaws"
"282",1434141,1435432,"Get out of that boat!","Jaws"
"283",1435518,1438185,"Hi, Dad. Just a littlelonger. Please?","Jaws"
"284",1438311,1439770,"It's his birthday.","Jaws"
"285",1439855,1440855,"I don't want himon the ocean!","Jaws"
"286",1440980,1442731,"He's not on the ocean,he is in a boat.","Jaws"
"287",1442817,1444192,"He won't goin the water.","Jaws"
"288",1444317,1448695,"I don't think he'llgo in the water again,
after what happened yesterday.","Jaws"
"289",1450074,1452407,"All right,now don't say that.","Jaws"
"290",1452742,1455744,"I don't want thatto happen,
you know that.","Jaws"
"291",1457205,1459124,"I want him to readthe boating regulations,","Jaws"
"292",1459208,1462376,"the rules, before hegoes out on his own.","Jaws"
"293",1462545,1466839,"Michael,did you hear your father?
Out of the water now!","Jaws"
"294",1467048,1468215,"Now!","Jaws"
"295",1475098,1478058,"I'm tired.Let's stop before
someone reports us.","Jaws"
"296",1479353,1483021,"Don't worry.The Chief lives on the other
side of the island.","Jaws"
"297",1483190,1485400,"Am I coming in straight?","Jaws"
"298",1485483,1487067,"Don't worry about it.Just keep rowing.","Jaws"
"299",1496036,1497162,"We bettercatch something,","Jaws"
"300",1497246,1499413,"this is my wife'sholiday roast.","Jaws"
"301",1500082,1501207,"Don't worry about it.","Jaws"
"302",1501291,1503292,"$3,000 buysan awful lot of roast.","Jaws"
"303",1511259,1514429,"Come and get it.","Jaws"
"304",1517932,1519976,"The tide'staking it right out.","Jaws"
"305",1522938,1524271,"Can't we go home?","Jaws"
"306",1585000,1587167,"He's taking it.","Jaws"
"307",1588336,1589921,"Go!","Jaws"
"308",1619951,1622327,"Charlie,take my word for it,
don't look back!","Jaws"
"309",1622413,1624038,"Swim, Charlie!","Jaws"
"310",1626375,1630169,"Come on! To me, boy!Come on, Charlie! Swim!","Jaws"
"311",1630253,1632422,"Come on, Charlie,keep coming.
Keep swimming.","Jaws"
"312",1632548,1634715,"Come on, a little more.Atta boy.","Jaws"
"313",1636384,1638010,"I can't get up.","Jaws"
"314",1638095,1639721,"Give me your hand,Charlie.","Jaws"
"315",1641056,1642807,"Help me!","Jaws"
"316",1642891,1644976,"Get your feetout of the water!","Jaws"
"317",1658281,1660074,"Can we go home now?","Jaws"
"318",1669084,1672836,"So then Denherder and Charliesat there trying to
catch their breath","Jaws"
"319",1672921,1675173,"and figure out howto tell Charlie's wife","Jaws"
"320",1675257,1677215,"what happened to herfreezer full of meat.","Jaws"
"321",1677300,1679969,"That's not funny.That's not funny at all.","Jaws"
"322",1680095,1682721,"Mrs. Kintnermust've put her ad
in Field & Stream.","Jaws"
"323",1682806,1685098,"Looks more likeThe National Enquirer.","Jaws"
"324",1687102,1690480,"All right, hold it.Hold everything.
I said, hold it!","Jaws"
"325",1696778,1697737,"Hello.","Jaws"
"326",1697820,1700280,"Hello back, young fellow.How are you?","Jaws"
"327",1701115,1704451,"Say, I hopeyou're not going out
with those nuts, are you?","Jaws"
"328",1708624,1710583,"The Weetock boatsgotta move out first.","Jaws"
"329",1710666,1713544,"You have to move outor he can't get out
at all.","Jaws"
"330",1713961,1716923,"Don't raise sail,you're going to luff it.
You got a paddle?","Jaws"
"331",1717007,1718758,"I got a paddle.Scull it out of here.","Jaws"
"332",1718842,1721385,"Officer, wait a second.","Jaws"
"333",1723471,1725890,"How many guysare you going to
put aboard that boat?","Jaws"
"334",1725973,1727392,"Whatever's safe,right?","Jaws"
"335",1727476,1728726,"Yeah,well that ain't safe.","Jaws"
"336",1728810,1730811,"Watch it,that's dynamite.","Jaws"
"337",1730895,1732355,"What are you doingwith that?","Jaws"
"338",1732480,1733480,"Where are you goingwith that?","Jaws"
"339",1733565,1735316,"I'm going on the boat.","Jaws"
"340",1735401,1738152,"Please, help meget those guys out
of the boat, will you?","Jaws"
"341",1738237,1739528,"Sure.Come on.","Jaws"
"342",1739822,1743240,"Gentlemen, the officerasked me to tell you","Jaws"
"343",1743325,1744575,"that you'reoverloading that boat!","Jaws"
"344",1745493,1747077,"Go on, get out of here.","Jaws"
"345",1747162,1748788,"- You ain't going.- What do you care?","Jaws"
"346",1748872,1752750,"Can you tell me if there'sa good restaurant or hotel
on the island?","Jaws"
"347",1752835,1754085,"Yeah, you walkstraight ahead.","Jaws"
"348",1755837,1757922,"They're allgoing to die.","Jaws"
"349",1758507,1761592,"Listen to me.We've got some road
block signs outside.","Jaws"
"350",1761676,1763845,"You've got to getsomebody to help us.","Jaws"
"351",1763929,1766806,"Yeah,get those road block signs
out on the highway.","Jaws"
"352",1766890,1770183,"Because we've gotmore people down here
than we can handle.","Jaws"
"353",1770269,1773438,"What're you doing there?These are your people.
Go talk to them.","Jaws"
"354",1773521,1775440,"They aren't my people.They're from all over.","Jaws"
"355",1775523,1777400,"You see allthe license plates?","Jaws"
"356",1777526,1780903,"Connecticut,Rhode Island, New Jersey.
I'm all by myself out there.","Jaws"
"357",1780988,1782488,"What happened tothe extra help...","Jaws"
"358",1782573,1783990,"It's not untilthe Fourth of July.","Jaws"
"359",1784074,1785575,"Till then,it's you and me.","Jaws"
"360",1785659,1787951,"You know those guysin the fan-tail launch?","Jaws"
"361",1788036,1790371,"None of them are gettingout of the harbor alive.","Jaws"
"362",1790455,1791955,"That's what I'm saying.","Jaws"
"363",1792039,1794125,"You know their names.Talk to those clowns.","Jaws"
"364",1794209,1795667,"Everyone's havinga good time today.","Jaws"
"365",1795751,1796877,"Tell me about it.","Jaws"
"366",1796961,1798171,"Polly, I'll getback to you.","Jaws"
"367",1798255,1800923,"Could you tell mehow I could find
Chief Brody?","Jaws"
"368",1801008,1802048,"Who are you?","Jaws"
"369",1802134,1805094,"Matt Hooper. I'm fromthe Oceanographic Institute.","Jaws"
"370",1805429,1808722,"Oh, for Christ's sakes.You're the guy we called.
I'm Brody.","Jaws"
"371",1808848,1810849,"Oh. I'm gladto meet you.
Me, too.","Jaws"
"372",1810933,1812727,"I know you gota lot on your hands.","Jaws"
"373",1812810,1813935,"What can we dofor you?","Jaws"
"374",1814020,1816814,"The best thing to dois to see the remains","Jaws"
"375",1816898,1818441,"of the first victim,the girl on the beach.","Jaws"
"376",1818525,1820151,"Okay, fine.Just bear with me,
will you?","Jaws"
"377",1820234,1821359,"Sure.","Jaws"
"378",1822863,1825865,"Wait till we getthem silly bastards
down in that rock pile.","Jaws"
"379",1825949,1827325,"There'll be some fun.","Jaws"
"380",1827409,1829743,"They'll wishtheir fathers hadn't
met their mothers","Jaws"
"381",1829869,1831578,"when they startdigging the bottoms out","Jaws"
"382",1831663,1833830,"and slamming intothem rocks, boy.","Jaws"
"383",1833915,1837000,"Get away from there,you goddamn fool!","Jaws"
"384",1837085,1838251,"What's the matterwith you?","Jaws"
"385",1838336,1841087,"You want to swamp us,you crazy son of a bitch?","Jaws"
"386",1841673,1843924,"What arethese guys doing out here?","Jaws"
"387",1844800,1846301,"What are theydoing back there?","Jaws"
"388",1846385,1847845,"They're chummingright now.","Jaws"
"389",1847930,1849055,"What the hellis that?","Jaws"
"390",1849138,1850640,"They're trackingthe shark.","Jaws"
"391",1850766,1853683,"$3,000 dividedfour ways is what?","Jaws"
"392",1855269,1857355,"Watch your starboard. Jesus!","Jaws"
"393",1862611,1865195,"Let's show Mr. Hooperour accident.","Jaws"
"394",1867950,1871451,"""Victim identifiedas Christine Watkins,
female Caucasian.""","Jaws"
"395",1871702,1872827,"And here's the waywe have it.","Jaws"
"396",1872913,1875498,"""Probableboating accident.""","Jaws"
"397",1881337,1883047,"The height and weightof the victim","Jaws"
"398",1883131,1886174,"can only be estimatedfrom the partial remains.","Jaws"
"399",1891181,1893641,"The torso has beensevered in mid-thorax.","Jaws"
"400",1893724,1895226,"There are no majororgans remaining.","Jaws"
"401",1895309,1896894,"May I have a glassof water?","Jaws"
"402",1896979,1898186,"The right armhas been severed","Jaws"
"403",1898271,1901691,"above the elbowwith massive tissue loss","Jaws"
"404",1902025,1903817,"in the upper musculature.","Jaws"
"405",1904486,1906069,"Thank you very much.","Jaws"
"406",1908656,1911826,"Partiallydenuded bone remaining.
This was no boat accident.","Jaws"
"407",1911910,1913952,"Did you notifythe Coast Guard about this?","Jaws"
"408",1914037,1916830,"No. It was onlylocal jurisdiction.","Jaws"
