"id","startTime","endTime","text","title"
"1020",4101912,4104301,"You can't do that to Rocky.I won't let you.","Mother!"
"1021",4105312,4106711,"It's not his fauIt, Father.","Mother!"
"1022",4106872,4110547,"He was just a kid who made a mistakeand got sent to reform school.","Mother!"
"1023",4110712,4112225,"They made a criminal out of him.","Mother!"
"1024",4112392,4115589,"But he's not bad, not really bad.You know that.","Mother!"
"1025",4115752,4118425,"And whatever they've done to him,no matter what he is now. . .","Mother!"
"1026",4118592,4120503,". . .no matterwhether he's right or wrong. . .","Mother!"
"1027",4120672,4122071,". . .we both love him, Father.","Mother!"
"1028",4123792,4126147,"Yes, Laury, we both love him.","Mother!"
"1029",4126312,4129145,"I've loved him since we were kids,6 years old.","Mother!"
"1030",4129312,4132065,"We worked together, fought together.","Mother!"
"1031",4132232,4134109,"Stole together.","Mother!"
"1032",4134432,4137469,"Oh, I'm not blaming Rockyfor what he is today.","Mother!"
"1033",4137672,4140584,"But for the grace of God,there walk I.","Mother!"
"1034",4140792,4143022,"I'd do anything for him, Laury. . .","Mother!"
"1035",4143192,4145626,". . .anything in the world to help him.","Mother!"
"1036",4145792,4148101,"I'd give my life if I thoughtit would do any good. . .","Mother!"
"1037",4148272,4150103,". . .but it wouldn't.","Mother!"
"1038",4150432,4152821,"You see, Laury,there's all those other kids. . .","Mother!"
"1039",4152992,4157304,". . .hundreds of them, in the streetsand bad environment. . .","Mother!"
"1040",4157552,4160624,". . .whom I don't want to seegrow up like Rocky did.","Mother!"
"1041",4161072,4163984,"I can't sacrifice them for Rocky.","Mother!"
"1042",4164592,4167265,"You see, Laury, they have lives too.","Mother!"
"1043",4167792,4170067,"I can't throw them away.","Mother!"
"1044",4170752,4172708,"I can't.","Mother!"
"1045",4186592,4190028,"And the very fact that countlessthousands of you are listening tonight...","Mother!"
"1046",4190192,4193025,"...is proof to fling in the teethof these cynics and skeptics...","Mother!"
"1047",4193192,4195990,"... that the public does careand does propose to do something...","Mother!"
"1048",4196152,4199508,"...about the appalling conditionsI have tried to describe tonight.","Mother!"
"1049",4199672,4202948,"And do not doubt that our efforts so farhave not struck fear and panic...","Mother!"
"1050",4203112,4205831,"...into the cesspool of officialand near-official corruption.","Mother!"
"1051",4205992,4208142,"Yeah, I'm shaking like a leaf.","Mother!"
"1052",4208312,4211668,"""This very afternoon, I was approachedwith a sugarcoated proposition. . .","Mother!"
"1053",4211832,4214346,". . .a bribe offered meby this corrupt officialdom.","Mother!"
"1054",4214512,4218949,"$ 100,000 for the building and equipmentof a recreation center in my parish. . .","Mother!"
"1055",4219112,4221467,". . .if I would agree to refrainfrom further attacks. . .","Mother!"
"1056",4221952,4224102,"...if I would sabotage this campaign...","Mother!"
"1057",4224272,4228106,"...if I would shut my eyes, stop my earsand hold my tongue.","Mother!"
"1058",4228272,4231628,"But the building of an isolated playgroundto shield my boys from crime. . .","Mother!"
"1059",4231792,4233544,". . .is not rooting out the crime itseIf.","Mother!"
"1060",4233712,4236988,"We must rid ourselvesof the criminal parasites that feed on us.","Mother!"
"1061",4237152,4239541,"We must wipe out thosewe have ignorantly elected...","Mother!"
"1062",4239712,4243671,"...and those who manipulate thisdiseased officialdom behind locked doors.","Mother!"
"1063",4244152,4246905,"Tonight, we have in our powerto ask definitely...","Mother!"
"1064",4247072,4249666,"...incriminating questionsof these officials.","Mother!"
"1065",4249832,4252266,"And the power to demandsatisfactory answers.","Mother!"
"1066",4252432,4257426,"What really is the truth in the case of theracketeer and gunman Rocky Sullivan?","Mother!"
"1067",4257592,4261585,"Why did the police release him suddenlywith the evidence they had against him?","Mother!"
"1068",4261832,4265427,"Why did the notorious Mac Keeferpay Sullivan $ 100,000 in cash...","Mother!"
"1069",4265592,4268629,"...and what political sword does he holdover the trembling hands...","Mother!"
"1070",4268792,4271226,"...of district attorneys, judgesand police officials?","Mother!"
"1071",4271392,4273508,"But tomorrow,the new grand jury will meet. . .","Mother!"
"1072",4273672,4275469,". . .and these questionsmust be answered.","Mother!"
"1073",4275952,4278785,"Therefore, I ask all of youwho are listening in--""","Mother!"
"1074",4278952,4280624,"And you thought you couldbuy him off?","Mother!"
"1075",4280792,4283989,"-I told you you were wasting your time.-We ain't wasting any more time.","Mother!"
"1076",4284152,4285585,"That was that guy's last chance.","Mother!"
"1077",4285752,4287504,"We're gonna take care of him tonight.","Mother!"
"1078",4287672,4290425,"You're talking through your hat.You can't bump off a priest.","Mother!"
"1079",4290592,4291786,"Forget it.","Mother!"
"1080",4291952,4294944,"I'll forget it. Tomorrow morning,when he's floating down the river.","Mother!"
"1081",4295112,4296625,"Now, get this straight, Sullivan.","Mother!"
"1082",4296792,4299943,"Even if he is an old pal of yours,I'm still running the works.","Mother!"
"1083",4300392,4302667,"I'm not taking orders from youall of a sudden.","Mother!"
"1084",4303072,4305427,"He's not gonna appearat no grand jury tomorrow.","Mother!"
"1085",4305592,4309221,"Shooting off his mouth--I say he gets it tonight.","Mother!"
"1086",4310192,4313070,"-Not if I'm around.-Now, wait a minute, gentlemen.","Mother!"
"1087",4313232,4315826,"There's no sense in runningtoo far ahead of ourselves.","Mother!"
"1088",4316032,4318865,"Don't forget, there are all kindsof grand juries. . .","Mother!"
"1089",4319032,4321307,". . .and there's all kinds of waysof handling them.","Mother!"
"1090",4321472,4322825,"That's what you got me for.","Mother!"
"1091",4322992,4326382,"-If you can do it legally, why take a--?-Sure, only I want action.","Mother!"
"1092",4326552,4329385,"I don't care how we stop that guy,I only want him stopped.","Mother!"
"1093",4329552,4331429,"All right, then leave it to me.","Mother!"
"1094",4331592,4333150,"You know, Rocky. . .","Mother!"
"1095",4333312,4336065,". . .this is no penny-ante reform wavethis priest is starting.","Mother!"
"1096",4336232,4338541,"This is a tidal wave,and unless we stop it quick. . .","Mother!"
"1097",4338712,4340543,". . .we're gonna find ourselves in the pen.","Mother!"
"1098",4340712,4344466,"Look, Frazier, nobody knows better thanme that we're in a spot. I know that.","Mother!"
"1099",4344632,4348705,"And, Mac, as far as I'm concerned,you can settle it any way you like.","Mother!"
"1100",4348872,4351067,"But lay off the rough stuff, you see?That's out.","Mother!"
"1101",4352712,4354350,"I'll see you later.","Mother!"
"1102",4354512,4358221,"Don't worry, Mac. I've got an ideahow we can stymie that grand jury.","Mother!"
"1103",4358392,4361464,"That preacher won't get to first base.","Mother!"
"1104",4370312,4372303,"I hope you were stalling.I meant what I said.","Mother!"
"1105",4372472,4374030,"Sure. This is the way I figure it.","Mother!"
"1106",4374192,4376945,"-Connelly is Rocky's pal, who's a priest.-So what?","Mother!"
"1107",4377112,4380024,"Where would be the logical placefor Rocky to keep those accounts?","Mother!"
"1108",4380192,4383025,"With a priest, to make them publicif anything happens to Rocky.","Mother!"
"1109",4383192,4384750,"That ain't news to me.I knew that.","Mother!"
"1110",4384912,4387062,"-That's why he can be a wise guy.-All right.","Mother!"
"1111",4387232,4390668,"If we're gonna get that preacher tonight,why not get those accounts too?","Mother!"
"1112",4390832,4392311,"Yeah.","Mother!"
"1113",4393352,4396264,"Only this time, no drugstore mistakes.","Mother!"
"1114",4396432,4398423,"I'm taking care of this job myseIf.","Mother!"
"1115",4398912,4400311,"Get Blackie up here right away.","Mother!"
"1116",4400472,4402827,"Now listen, Mac. I don't care howyou handle Sullivan.","Mother!"
"1117",4402992,4405142,"It's got to look like an accidentwith the priest.","Mother!"
"1118",4405312,4406461,"Leave that to me.","Mother!"
"1119",4418312,4421145,"Rocky! Don't! Don't!","Mother!"
"1120",4421312,4423382,"-I'll do anything.-Oh, no, you won't.","Mother!"
"1121",4423552,4425747,"You've had your last chance.Take this with you.","Mother!"
"1122",4425912,4427311,"I never let go of those papers.","Mother!"
"1123",4427472,4429622,"All you had to do was bump me off.","Mother!"
"1124",4460112,4462387,"-It's locked.-Come on, stand back. Shoot it off.","Mother!"
"1125",4472912,4474504,"Gunfight at the El Toro.","Mother!"
"1126",4500752,4503744,"ls Father Connelly still there?I must talk to him. It's urgent.","Mother!"
"1127",4536392,4538747,"-Well?-Rocky Sullivan, captain.","Mother!"
"1128",4538912,4543030,"He got Frazier and Keefer. They'vechased him up on the roof of the El Toro.","Mother!"
"1129",4543192,4544989,"MacMahon, throw a cordonaround the block.","Mother!"
"1130",4545152,4546380,"Come on, you men, with me.","Mother!"
"1131",4548872,4551181,"Here's the microphone, captain.","Mother!"
"1132",4552392,4555464,"O'Flannigan, hook up those searchlightsand play them on the building.","Mother!"
"1133",4559432,4561343,"Galavan, cover the warehouse skylights.","Mother!"
"1134",4628312,4629506,"There he is!","Mother!"
"1135",4646152,4650145,"Sullivan, are you coming out,or must we smoke you out?","Mother!"
"1136",4655272,4657740,"All right, give him the tear gas.","Mother!"
"1137",4677032,4678590,"Please.","Mother!"
"1138",4687352,4688580,"Captain.","Mother!"
"1139",4688752,4691107,"I'm Father Connelly,an old friend of Rocky's.","Mother!"
"1140",4691272,4693103,"He'll come out for me.He'll listen to me.","Mother!"
"1141",4693272,4696184,"This is a job for the police, Father.He'll need a priest later.","Mother!"
"1142",4696352,4699424,"-You wanna kill him, or keep him alive?-What do you mean by that?","Mother!"
"1143",4699592,4702186,"He'll listen to me, I'm sure.Won't you let me talk to him?","Mother!"
"1144",4702352,4704308,"-Go ahead.-Thank you.","Mother!"
"1145",4704472,4708590,"Rocky! Rocky, this is Jerry.Please come out.","Mother!"
"1146",4709272,4711991,"Tell him we'll get him, if we have toblow up the whole block.","Mother!"
"1147",4712152,4714950,"Rocky, you've got to come out!","Mother!"
"1148",4724952,4726704,"I'm coming up.","Mother!"
"1149",4728792,4729986,"Officers, hold your fire.","Mother!"
"1150",4774392,4776303,"Rocky?","Mother!"
"1151",4788312,4791349,"-Rocky.-What are you doing up here? Beat it!","Mother!"
"1152",4791512,4792911,"I'm coming in, Rocky.","Mother!"
"1153",4793072,4794824,"You wanna get your skull full of lead?","Mother!"
"1154",4795392,4797348,"Get out of here!","Mother!"
"1155",4797912,4800346,"You're smarter than to stick your kisserin this place.","Mother!"
"1156",4800512,4802787,"I couldn't watch them shoot you down,Rocky.","Mother!"
"1157",4802952,4806627,"They've got you covered from everyangle. Your only chance is to give up.","Mother!"
"1158",4806792,4809181,"You're through, Rocky. You're finished.","Mother!"
"1159",4809352,4811183,"Yeah, I was until you stepped into it.","Mother!"
"1160",4811832,4815029,"Father Connelly, are you all right?","Mother!"
"1161",4815512,4816786,"Go on.","Mother!"
"1162",4816952,4819512,"Get over there and tell themto call off their dogs.","Mother!"
"1163",4819672,4821628,"I'm going down with you.","Mother!"
"1164",4821792,4823589,"Sure, you are.","Mother!"
"1165",4831512,4834026,"Call off your men, all of them!","Mother!"
"1166",4834192,4835944,"Sullivan's coming out with me.","Mother!"
"1167",4836112,4839184,"Hold your fire, men, but stand by.","Mother!"
"1168",4841312,4842870,"Let's go.","Mother!"
"1169",4848472,4850667,"Come on, get them up, Jerry.","Mother!"
"1170",4850832,4854905,"Sorry it has to be you, kid,but get going.","Mother!"
"1171",4856192,4858387,"Get away, or I'll let him have it!Get away!","Mother!"
"1172",4859112,4860989,"Back around.","Mother!"
"1173",4862392,4864030,"Come on.","Mother!"
"1174",4882872,4885750,"Get them up high. High!","Mother!"
"1175",4895152,4898269,"Get back, all of you.I'll give it to him right in the head!","Mother!"
"1176",4899592,4901105,"Back!","Mother!"
"1177",4907312,4908870,"Duck, Jerry!","Mother!"
"1178",4921632,4922985,"Got him in the leg.","Mother!"
"1179",4926912,4928630,"Empty.","Mother!"
"1180",4929592,4932470,"So is your thick skull, copper.","Mother!"
"1181",4933392,4934461,"Extra! ldentify killer!","Mother!"
"1182",4935912,4937982,"Papers! Get your papers! Extra!","Mother!"
"1183",4938152,4939824,"Extra! Get your papers!","Mother!"
"1184",4939992,4942142,"ldentify killer!","Mother!"
"1185",4942592,4943866,"Gee, that's tough.","Mother!"
"1186",4944032,4947104,"Boy, I'd like to get my handson those squealers.","Mother!"
"1187",4947872,4954027,"""Special prosecutor for trial of Rockytoday. State builds strong case. ""","Mother!"
"1188",4954192,4958231,"That dope of a governor's so scared ofRocky, he's appointing a special shyster.","Mother!"
"1189",4958592,4961948,"""Rocky guiIty. To die. ""","Mother!"
"1190",4962832,4964982,"Gee, you think they'll burn himin the chair?","Mother!"
"1191",4965232,4967871,"No, they can't build no death housethat'll hold Rocky.","Mother!"
"1192",4968032,4971388,"-You mean he'll blow it?-Just wait, that's all. Just wait.","Mother!"
"1193",4972992,4975028,"He'll show those mugs how to diein a big way.","Mother!"
"1194",4975192,4977228,"Sure, he will.They'll never make him crack.","Mother!"
"1195",4977392,4979383,"-There's nothing yellow about Rocky.-You bet.","Mother!"
"1196",4979552,4981144,"Remember what he said at the trial?","Mother!"
"1197",4981312,4982745,"He said he'd spit in their eye.","Mother!"
"1198",4982912,4984709,"He'll do it too. He'll laugh at them.","Mother!"
"1199",4984872,4988103,"Sure. Sure, he'll show those phonies up.","Mother!"
"1200",4990872,4992430,"Sullivan.","Mother!"
"1201",4997192,5000628,"Rocky, Father Connelly has receivedpermission to be with you.","Mother!"
"1202",5000792,5003022,"He just arrived.You'll see him, won't you?","Mother!"
"1203",5003192,5004784,"Yeah, sure, send him in.","Mother!"
"1204",5004952,5008308,"But tell him none of that incenseand holy-water stuff, will you?","Mother!"
"1205",5008472,5010622,"Whatever you say, Rocky.","Mother!"
"1206",5018392,5020781,"Did you enjoy your dinner, Mr. Sullivan?","Mother!"
"1207",5020952,5022829,"Yeah, it was good,only the meat was burnt.","Mother!"
"1208",5022992,5024550,"And I don't like burnt meat,do you?","Mother!"
"1209",5026392,5028462,"Listen, big shot, you got only10 minutes to go.","Mother!"
"1210",5028632,5030941,"Don't try stalling aroundwith that priest pal of yours.","Mother!"
"1211",5032712,5034748,"Ten minutes till that hot seat.","Mother!"
"1212",5035192,5039185,"I'm gonna tell the electrician to give itto you slow and easy, wise guy.","Mother!"
"1213",5039352,5041070,"Somebody get me out of here,will you!","Mother!"
"1214",5041232,5044144,"-Come on! Take him out of there!-Get him out of there!","Mother!"
"1215",5047392,5049622,"Let him alone, Herbert.","Mother!"
"1216",5050552,5051951,"Quiet.","Mother!"
"1217",5052912,5054391,"Quiet, now! Quiet.","Mother!"
"1218",5056512,5057786,"-How are you?-How much time?","Mother!"
"1219",5057952,5059863,"About 10 minutes.","Mother!"
"1220",5066792,5069022,"Hi, Jerry. What do you hear?What do you say?","Mother!"
"1221",5069192,5072867,"-Hello, Rocky. How do you feel?-Like a million.","Mother!"
"1222",5075432,5077992,"-How's Soapy and the kids?-Pulling for you all the way. . .","Mother!"
"1223",5078152,5080746,". . .as long as there'sthe slightest hope from the governor.","Mother!"
"1224",5080912,5084461,"-They'll be easier to handle without me.-That's up to you, Rocky.","Mother!"
"1225",5087672,5089151,"We haven't got a lot of time.","Mother!"
"1226",5089312,5090984,"I want to ask one last favor.","Mother!"
"1227",5091152,5093985,"-There's not much left that I can do, kid.-Yes, there is, Rocky.","Mother!"
"1228",5094152,5096825,"Perhaps more than you could dounder any other circumstances.","Mother!"
"1229",5096992,5099347,"If you have the courage for it,and I know you have.","Mother!"
"1230",5099512,5101628,"Walking in there?That's not gonna take much.","Mother!"
"1231",5101792,5103987,"-I know that, Rocky.-It's like a barber chair.","Mother!"
"1232",5104152,5105949,"They're gonna ask, ""Anything to say?""","Mother!"
"1233",5106112,5110151,"I'll say, ""Give me a haircut, a shave andone of those new electric massages. ""","Mother!"
"1234",5110312,5113270,"-But you're not afraid, Rocky?-No. They'd like me to be.","Mother!"
"1235",5113432,5115582,"But I'm afraid I can't oblige them, kid.","Mother!"
"1236",5115752,5118789,"You know, Jerry, I think to be afraid,you gotta have a heart.","Mother!"
"1237",5118952,5122342,"I don't think I got one.I had that cut out of me a long time ago.","Mother!"
"1238",5123752,5125902,"Suppose I asked youto have the heart, huh?","Mother!"
"1239",5126072,5127869,"-To be scared?-What do you mean?","Mother!"
"1240",5128032,5131183,"Suppose the guards dragged you outof here screaming for mercy.","Mother!"
"1241",5131352,5134230,"-Suppose you went to the chair yellow.-Yellow?","Mother!"
"1242",5134392,5137589,"Say, what's the matter with you?You've been worrying about my courage.","Mother!"
"1243",5137752,5138901,"I know that.","Mother!"
"1244",5139072,5140949,"This is a different kind of courage,Rocky.","Mother!"
"1245",5141112,5144149,"The kind that's--Well, it's born in heaven.","Mother!"
"1246",5144312,5146746,"Not the courage of heroics and bravado.","Mother!"
"1247",5146912,5149790,"The kind that you and Iand God know about.","Mother!"
"1248",5151112,5152306,"I don't know what you mean.","Mother!"
"1249",5152792,5156467,"Look, Rocky, just before I came up here,the boys saw me off on the train.","Mother!"
"1250",5156632,5158702,"Soapy and several of the others.","Mother!"
"1251",5158872,5160590,"You can well imagine what they told me.","Mother!"
"1252",5161432,5165391,"""Father, tell Rocky to show the worldwhat he's made of.","Mother!"
"1253",5165552,5167782,"Tell him not to be afraid. . .","Mother!"
"1254",5167952,5170386,"-. . .and to go out laughing--""-Well, what do you want?","Mother!"
"1255",5170552,5172224,"I'm not gonna let them down.","Mother!"
"1256",5172392,5175828,"That's what I want you to do.I want you to let them down.","Mother!"
"1257",5175992,5180065,"You've been a hero to these kids andhundreds of others, all through your life.","Mother!"
"1258",5180232,5184111,"Now you're gonna be a glorified hero indeath, and I want to prevent that, Rocky.","Mother!"
"1259",5184272,5186627,"They've gotta despise your memory.","Mother!"
"1260",5186792,5189989,"-They've got to be ashamed of you.-You're asking me to pull an act?","Mother!"
"1261",5190152,5193030,"Turn yellow so those kidswill think I'm no-good?","Mother!"
"1262",5193192,5196980,"You're asking me to throw away the onlything I got left that they can't take.","Mother!"
"1263",5197152,5200349,"To give those newspapers a chanceto say, ""Another rat turned yellow. ""","Mother!"
"1264",5200512,5202184,"You and I will know you're not.","Mother!"
"1265",5202352,5203990,"You ask a nice little favor, Jerry.","Mother!"
"1266",5204152,5206382,"Asking me to crawl on my bellythe last thing I do.","Mother!"
"1267",5206552,5207985,"I know what I'm asking.","Mother!"
"1268",5208152,5211349,"The reason I'm asking is becausebeing kids together gave me the idea. . .","Mother!"
"1269",5211512,5213742,". . .that you might like tojoin hands with me. . .","Mother!"
"1270",5213912,5216870,". . .and save some of those other boysfrom ending up here.","Mother!"
"1271",5217032,5219341,"You're asking too much.You wanna help those kids. . .","Mother!"
"1272",5219512,5223027,"-. . .figure out some other way.-It's impossible without your help.","Mother!"
"1273",5223192,5224864,"I can't reach all of those boys.","Mother!"
"1274",5225032,5227307,"Thousands of hero-worshiping kidsall over the country.","Mother!"
"1275",5227472,5229190,"Don't give me thathumanity stuff again.","Mother!"
"1276",5229352,5231991,"I had enough in the courtroom.Told everything. Named names.","Mother!"
"1277",5232152,5234143,"Told the whole mess.What more do you want?","Mother!"
"1278",5234712,5236862,"What I've always wanted, Rocky.","Mother!"
"1279",5237032,5238670,"Straighten yourseIf out with God.","Mother!"
"1280",5240352,5243708,"Outside of that,I can't ask for anything else.","Mother!"
"1281",5243872,5245749,"Well, don't!","Mother!"
"1282",5252352,5254422,"It's time, Rocky. Are you ready?","Mother!"
"1283",5254592,5256071,"Yeah.","Mother!"
"1284",5259632,5261429,"You figure on going in with me?","Mother!"
"1285",5261592,5264902,"-I'd like to, Rocky. That is, if. . . .-You can if you wish.","Mother!"
"1286",5265072,5267028,"-Do you mind, Father?-Certainly not.","Mother!"
"1287",5267192,5270980,"That's better. Be kind of lonesomegoing down that last mile.","Mother!"
"1288",5273912,5275265,"Promise me something.","Mother!"
"1289",5275432,5277263,"Promise me you won't let mehear you pray.","Mother!"
"1290",5277432,5279627,"I promise you won't hear me.","Mother!"
"1291",5283072,5286030,"Get away from me, screw,or I'll bust your face in.","Mother!"
"1292",5286352,5288946,"It'll be the last face you see, big shot,laughing at you.","Mother!"
"1293",5289112,5291068,"Don't get near me now.I'll spit in your eye.","Mother!"
"1294",5292072,5294142,"Herbert, stand back.","Mother!"
"1295",5294712,5296703,"Thompson, take care of him.","Mother!"
"1296",5297632,5298951,"Lay off.","Mother!"
"1297",5299112,5301421,"I don't need anybody.Come on.","Mother!"
"1298",5302032,5304785,"Attaboy, Rocky.Pick your own company.","Mother!"
"1299",5304952,5308388,"So long, Rocky. We won't be long.","Mother!"
"1300",5308552,5310543,"So long, Rocky.","Mother!"
"1301",5349352,5351024,"Rocky, please.","Mother!"
"1302",5351192,5352784,"No.","Mother!"
"1303",5368152,5369471,"So long, kid.","Mother!"
"1304",5369632,5371190,"Goodbye, Rocky.","Mother!"
"1305",5371352,5373502,"May God have mercy on you.","Mother!"
"1306",5391352,5395027,"No. I don't want to die!Oh, please!","Mother!"
"1307",5395632,5398590,"I don't want to die!Oh, please!","Mother!"
"1308",5399512,5402072,"Don't make me burn in hell!","Mother!"
"1309",5403592,5408427,"Oh, please let go of me!Please don't kill me!","Mother!"
"1310",5408592,5411868,"Oh, don't kill me, please!","Mother!"
"1311",5420352,5421910,"Okay, hold him down there!","Mother!"
"1312",5423872,5425225,"Please don't kill me!","Mother!"
"1313",5434592,5437106,"The yellow rat was gonnaspit in my eye.","Mother!"
"1314",5445112,5446830,"""At the fatal stroke of 11 p.m. . .","Mother!"
"1315",5446992,5450462,". . .Rocky was ledthrough the little green door of death.","Mother!"
"1316",5450632,5452623,"No sooner had he enteredthe death chamber. . .","Mother!"
"1317",5452792,5455101,". . .than he tore himseIffrom the guards' grasp. . .","Mother!"
"1318",5455272,5458184,". . .flung himseIf on the floor,screaming for mercy.","Mother!"
"1319",5458832,5461346,"And as they dragged himto the electric chair. . .","Mother!"
"1320",5461512,5464982,". . .he clawed wildly the concrete floorwith agonized shrieks.","Mother!"
"1321",5465552,5468624,"In contrast to his former heroics. . .","Mother!"
"1322",5469792,5473228,". . .Rocky Sullivan died a coward. ""","Mother!"
"1323",5474232,5476188,"I don't believe it.","Mother!"
"1324",5476472,5479589,"-I don't believe one rotten word of it.-I don't believe it either.","Mother!"
"1325",5479752,5481822,"If anybody says it's true, I'll. . . .","Mother!"
"1326",5482072,5484188,"He couldn't die that way, not Rocky!He couldn't.","Mother!"
"1327",5484352,5486786,"It's all lies! Lies, I tell you!","Mother!"
"1328",5487512,5489230,"Hey, fellas.","Mother!"
"1329",5489392,5490950,"Here's Father Connelly.","Mother!"
"1330",5491112,5492989,"Let's ask him. He ought to know.","Mother!"
"1331",5493152,5495382,"He'll tell us everything.","Mother!"
"1332",5502872,5504908,"You were there, Father.","Mother!"
"1333",5505392,5507223,"You saw everything.","Mother!"
"1334",5507392,5509064,"What happened?","Mother!"
"1335",5509712,5511464,"Did Rocky die like they said?","Mother!"
"1336",5512112,5514228,"Like a yellow rat?","Mother!"
"1337",5517312,5521191,"It's true, boys. Every word of it.","Mother!"
"1338",5521352,5523627,"He died like they said.","Mother!"
"1339",5526552,5528543,"All right, fellas.","Mother!"
"1340",5529272,5530864,"Let's go and. . .","Mother!"
"1341",5531352,5535140,". . .say a prayer for a boywho couldn't run as fast as I could.","Mother!"