"id","startTime","endTime","text","title"
"688",2963512,2966026,"-That's what you shouldn't have done.-It's already done.","Mother!"
"689",2966192,2968467,"You don't understand.Sullivan got me at my home.","Mother!"
"690",2968632,2970190,"He's got everything in my safe:","Mother!"
"691",2970352,2973389,"Account books, receipts, names,addresses, everything.","Mother!"
"692",2973552,2977386,"If he's prosecuted for this kidnapping,he'll talk. He's got evidence to back it.","Mother!"
"693",2977552,2979383,"He'll tear this whole town wide open.","Mother!"
"694",2979552,2983181,"-We gotta pull him out of there.-If anybody pulled a boner, you did.","Mother!"
"695",2986072,2988586,"-Get me Buckley.-Let me talk to him.","Mother!"
"696",2989272,2991024,"Hello. Hello?","Mother!"
"697",2991192,2992830,"Buckley? This is Mac.","Mother!"
"698",2992992,2995267,"Listen, you'll have to spring Sullivan.","Mother!"
"699",2995432,2998265,"Yes, I just learned it's all beena little mistake.","Mother!"
"700",2998432,2999990,"Little mistake, what do you mean?","Mother!"
"701",3000152,3004430,"A mistake in a pig's eye!You can't pull a thing like this on me.","Mother!"
"702",3005712,3007623,"-See you soon, Rocky.-Not if I can help it.","Mother!"
"703",3007792,3008747,"Drive west.","Mother!"
"704",3008912,3011710,"Extra! Extra! Read all about it!Lawyer kidnapped!","Mother!"
"705",3011872,3013942,"Extra! Extra! Lawyer kidnapped!","Mother!"
"706",3014112,3015591,"Yes, sir.","Mother!"
"707",3016472,3017825,"Thank you, sir. Extra!","Mother!"
"708",3021632,3023748,"""Two-gun Rocky Sullivan,well-known gangster. . .","Mother!"
"709",3023912,3026221,". . .perpetrated the snatchand received the money.","Mother!"
"710",3026392,3029065,"Sullivan evidently returneddirectly to his boyhood haunt. . .","Mother!"
"711",3029232,3031746,". . .following his release and washere a few days. . .","Mother!"
"712",3031912,3035143,". . .before he kidnapped James Frazier,the prominent attorney and playboy.","Mother!"
"713",3035312,3037667,"Ransom asked was 100,000 smackers. ""","Mother!"
"714",3037832,3042144,"-Boy, you don't find that in poor boxes.-Yeah. Leave it to Rocky.","Mother!"
"715",3042312,3045270,"-I'll bet that dough's in the envelope.-Maybe it is. So what?","Mother!"
"716",3045432,3047070,"So the kid has an idea.","Mother!"
"717",3047232,3050065,"And if Rocky does go up,it all belongs to us.","Mother!"
"718",3050232,3052143,"That envelope goes to Rocky, see?","Mother!"
"719",3052472,3054940,"Even if it gotta wait 20 years.","Mother!"
"720",3055112,3056591,"You won't have to wait that long.","Mother!"
"721",3057512,3059946,"-Rocky!-Hey, Rocky!","Mother!"
"722",3060112,3062148,"Glad to see you.We was just talking about you.","Mother!"
"723",3062312,3063984,"-Did you break out?-No. I walked out.","Mother!"
"724",3064152,3066541,"-It said in the papers---Never believe them.","Mother!"
"725",3066712,3071228,"First you're in, and then you're out. Boy,they certainly can't hold you, Rocky.","Mother!"
"726",3071952,3074512,"-Come on. Where's that envelope?-I got it. I got it.","Mother!"
"727",3074672,3076344,"All right, let's have it!","Mother!"
"728",3088352,3090422,"Wait a minute, Rocky.I'll get it for you.","Mother!"
"729",3091832,3094505,"Here you are, Rocky.Just like you give it to me.","Mother!"
"730",3094672,3097869,"Hey, that's the 100 grandthe paper said you got, ain't it?","Mother!"
"731",3102032,3103988,"Asking questions again, huh?","Mother!"
"732",3105632,3109466,"Someday you're gonna stick your noseand you're gonna get something in it.","Mother!"
"733",3109632,3112146,"-I only thought it was---Shut up!","Mother!"
"734",3112632,3115829,"Now, look, you don't know anythingabout this, see?","Mother!"
"735",3116472,3118827,"No. No. No, I don't know nothing.","Mother!"
"736",3118992,3120744,"But you do know what guysget who talk.","Mother!"
"737",3120912,3123187,"Yeah. Yeah. Yeah.","Mother!"
"738",3124712,3126270,"Now, look. . .","Mother!"
"739",3128352,3130502,". . .that goes for the rest of you.You understand?","Mother!"
"740",3130672,3132469,"-Certainly.-Sure!","Mother!"
"741",3132632,3135783,"-Now we're pals.-Put her there, Rocky!","Mother!"
"742",3142712,3144145,"All right, Soapy.","Mother!"
"743",3144312,3146064,"Here you are.","Mother!"
"744",3147312,3149428,"Cut that up any way you like.","Mother!"
"745",3149592,3152265,"-It's okay. I just saw it made.-Thanks, Rocky.","Mother!"
"746",3152432,3154229,"Yeah, don't have to worryabout the guys.","Mother!"
"747",3154392,3157589,"We once had a squealer in the gang,but now he ain't got no teeth.","Mother!"
"748",3157752,3159629,"-I'll see you in a couple days.-Hey, Rock!","Mother!"
"749",3159792,3162181,"-So long, Rocky!-Bye, Rock!","Mother!"
"750",3162352,3164104,"Hey, Rocky!","Mother!"
"751",3165752,3167868,"-Have a good time!-Come on, guys!","Mother!"
"752",3169112,3171148,"-You ought to join the circus.-Yeah!","Mother!"
"753",3171312,3172711,"Here's your cut.","Mother!"
"754",3172992,3175711,"-Come on. Give me some of that.-Fifty bucks!","Mother!"
"755",3176392,3177711,"""Fifty bucks! ""","Mother!"
"756",3177912,3181871,"-Yeah! And the same for the rest of you.-Oh, boy, 50 simoleon.","Mother!"
"757",3182032,3184182,"My old man never madethat much in his life. . .","Mother!"
"758",3184352,3186422,". . .working for theDepartment of Sanitation.","Mother!"
"759",3186592,3188947,"-Hey, how much you got there, Soapy?-About 100.","Mother!"
"760",3189112,3191751,"A hundred? How come?It's twice as much as I got.","Mother!"
"761",3191912,3194904,"-You wanna make something out of it?-No. No.","Mother!"
"762",3195072,3197302,"He deserves it.Why you starting trouble?","Mother!"
"763",3197472,3199224,"You pull in your ears.","Mother!"
"764",3199392,3200745,"What are we gonna do with it?","Mother!"
"765",3200912,3202550,"It's burning a hole through my hands.","Mother!"
"766",3202712,3205988,"I'm gonna get me a pairof chromium-plated brass knuckles.","Mother!"
"767",3206152,3208302,"-Come on!-Let's go!","Mother!"
"768",3226312,3228303,"-Can I come in, Rocky?-Yeah. Yeah.","Mother!"
"769",3228472,3230224,"Wait a minute, Jerry.","Mother!"
"770",3235192,3237865,"Just a second! I wanna dry me hands.","Mother!"
"771",3242832,3244311,"-Hello, Jerry.-Hello, Rocky.","Mother!"
"772",3244472,3247430,"-What do you hear? What do you say?-What do you say?","Mother!"
"773",3247832,3249902,"You know, you gave me a terrific scare.","Mother!"
"774",3250632,3253669,"Before I finished reading about yourarrest, they said you were out.","Mother!"
"775",3253832,3256630,"Nothing to it. You know how it iswith a guy with a record.","Mother!"
"776",3256792,3258862,"Haul him in because you havenothing else to do.","Mother!"
"777",3259032,3261751,"-They didn't keep you very long.-What are you worried about?","Mother!"
"778",3261912,3264187,"-Plenty.-What's up?","Mother!"
"779",3264352,3267105,"The boys had a return game today,and they haven't shown up.","Mother!"
"780",3267272,3270230,"I can't locate them. Thought youmight know where they were.","Mother!"
"781",3270672,3274187,"-How would I? Am I a nursemaid?-No, Rocky. I didn't mean that.","Mother!"
"782",3274352,3276866,"Thought they might be up herecelebrating your release.","Mother!"
"783",3277632,3279748,"With them, it's kind of a hero worship.","Mother!"
"784",3280552,3282463,"You can't blame them for that, can you?","Mother!"
"785",3282632,3286671,"Rocky, why don't you tell mewhat it's all about.","Mother!"
"786",3286832,3290142,"Look, Jerry, I've been answeringa lot of questions all morning, see.","Mother!"
"787",3290312,3292109,"A lot of them.","Mother!"
"788",3293712,3295862,"Frazier and me were just awayon a business trip.","Mother!"
"789",3299712,3303705,"Some dope wanted to start troubleand laugh at the cops at the same time.","Mother!"
"790",3303872,3307182,"-Spread a false alarm, that's all.-I'm glad it wasn't any more than that.","Mother!"
"791",3307352,3308705,"I'm gonna run along.","Mother!"
"792",3308872,3310908,"-Yeah? Hello, Laury!-Hello, Father.","Mother!"
"793",3311072,3313791,"What do you say? This looks likeit's getting to be a big day.","Mother!"
"794",3313952,3315908,"I have to admit, I was pretty worried.","Mother!"
"795",3316072,3318188,"Sounds very nice to hear.","Mother!"
"796",3319072,3321506,"Well, Father, I finally locatedour precious angels.","Mother!"
"797",3321672,3323264,"-You did? Where?-Murphy's poolroom.","Mother!"
"798",3323432,3325423,"-What?-Yeah, Soapy and the gang.","Mother!"
"799",3325592,3329505,"Passing out beer to the neighborhoodkids. Throwing dollar bills like confetti.","Mother!"
"800",3329672,3332903,"-Wonder where they got the money.-Well, you might ask them.","Mother!"
"801",3333952,3337308,"-Well, I'm gonna be going, Rocky.-So soon?","Mother!"
"802",3338672,3340151,"-Coming, Laury?-No, Father.","Mother!"
"803",3340312,3342780,"I want to stay and talk to Rockyfor a while.","Mother!"
"804",3344432,3345911,"When will I see you, Rocky?","Mother!"
"805",3347112,3349387,"-I'll catch up with you.-Okay.","Mother!"
"806",3349552,3351144,"Bye.","Mother!"
"807",3357472,3359508,"-Well, Rocky, I guess---Wait a minute.","Mother!"
"808",3360072,3363621,"You're the kind of gal that's smartenough to mind her own business.","Mother!"
"809",3364072,3365949,"-Am I right or wrong?-Don't worry.","Mother!"
"810",3366112,3367784,"I know all the rules.","Mother!"
"811",3368112,3370307,"Get your one here. Five.Get your 10 here.","Mother!"
"812",3370472,3372542,"All bets covered! Come on, put it in.","Mother!"
"813",3372712,3375021,"Where'd you get the dough, Pasty?","Mother!"
"814",3375192,3376466,"We wrote to Santa Claus, see.","Mother!"
"815",3376632,3379510,"Then when we woke up this morning,there it was in our socks.","Mother!"
"816",3379672,3381628,"All bets covered. Come on, boys.","Mother!"
"817",3386352,3388149,"-Give me another one.-What do you mean?","Mother!"
"818",3388312,3389665,"All I bet was 5 bucks!","Mother!"
"819",3389832,3392949,"-You trying to gyp the kid or something?-He owes me 5 bucks.","Mother!"
"820",3393112,3394670,"Shut up!","Mother!"
"821",3397632,3400669,"-Dirty tables aggravate me.-You're gonna make this shot, you know.","Mother!"
"822",3400832,3403505,"-Put your eight ball on the corner.-Okay.","Mother!"
"823",3403832,3406062,"-All right.-Hey, bury that beef, will you?","Mother!"
"824",3406232,3408621,"Pull in your headand get that off the table!","Mother!"
"825",3408792,3410783,"Got a three ball off the corner.","Mother!"
"826",3415032,3417500,"Nice shot, boy!Eight bucks!","Mother!"
"827",3418152,3421781,"Eight bucks! My mother has to workalmost all week to make this much.","Mother!"
"828",3421952,3423590,"Give, give, give.","Mother!"
"829",3423752,3425470,"All right. All right.","Mother!"
"830",3426712,3428862,"All gamblers die broke.","Mother!"
"831",3430192,3433229,"Hey, Soapy, you promised usanother round of beers if you won.","Mother!"
"832",3433392,3435348,"Okay, go on, bring up another case.","Mother!"
"833",3435512,3438948,"What's the difference?Those chumps are paying for it.","Mother!"
"834",3440392,3442189,"-What is this, a raid?-No.","Mother!"
"835",3442432,3444741,"Maybe they're gonna makea Sunday school out of it.","Mother!"
"836",3446072,3448347,"-Come on. I'll take two.-I got that covered.","Mother!"
"837",3448512,3451026,"-Give me two.-I got it covered.","Mother!"
"838",3451192,3453262,"Weren't you boys going overto start that game?","Mother!"
"839",3453432,3457186,"Sure, Father, we just wanted to seewhat was going on in here.","Mother!"
"840",3457752,3461108,"Come on, Joe. Come on, kids.Let's go to the gym.","Mother!"
"841",3467352,3469104,"Giving a party, Soapy?","Mother!"
"842",3471312,3472825,"Everybody invited?","Mother!"
"843",3473872,3475385,"Yeah.","Mother!"
"844",3476152,3477665,"Why don't you give it at the gym.","Mother!"
"845",3479072,3480824,"Because we're having it here.","Mother!"
"846",3481112,3482943,"What about that game you asked for?","Mother!"
"847",3484192,3485750,"Hey, Small Change. . .","Mother!"
"848",3485912,3489427,"-. . .double that bet on that shot, okay?-Okay. It's your murder.","Mother!"
"849",3490392,3492906,"Where did you get this moneyyou've been spending?","Mother!"
"850",3493552,3496624,"Hasn't anything I've told you for the lastthree years meant anything?","Mother!"
"851",3496792,3498828,"You think that spendingthis kind of money. . .","Mother!"
"852",3498992,3502223,". . .with a lot of hoodlumsis gonna get you anyplace but jail?","Mother!"
"853",3504952,3507068,"Come on, fellas, what do you say?","Mother!"
"854",3507992,3510870,"Why not go with me, and we'll figurethis whole thing out.","Mother!"
"855",3511032,3513068,"Come on. Let's go over to the gym.","Mother!"
"856",3514192,3516911,"-How about it, Swing?-I don't know, Father.","Mother!"
"857",3517672,3519583,"I got a sore leg.","Mother!"
"858",3520192,3521784,"What do you say, Bim?","Mother!"
"859",3522832,3526222,"Father, there ain't no futurein playing basketball.","Mother!"
"860",3527392,3530304,"-Well, how about you fellas?-Can't a guy even have any fun?","Mother!"
"861",3530472,3532030,"It's a waste of time.","Mother!"
"862",3532792,3534464,"Look, Father. . .","Mother!"
"863",3535752,3538869,". . .we don't fall for that pie-in-the-skystuff no more, see.","Mother!"
"864",3548752,3551425,"What's wrong? Can't you get themto go to heaven with you?","Mother!"
"865",3555712,3558943,"You got the wrong slant, honey.You got a bad break a long time ago. . .","Mother!"
"866",3559112,3561262,". . .and you're still figuringthat's the only way.","Mother!"
"867",3561432,3563388,"You're reading stuff about""crime don't pay. ""","Mother!"
"868",3563552,3567545,"Don't be a sucker. That's for smalItimerson shoestrings. Not people like us.","Mother!"
"869",3567712,3570067,"You belong in the bigshot class.Both of us do.","Mother!"
"870",3570232,3571790,"I wonder.","Mother!"
"871",3571952,3574705,"Got any glad rags, something fancy,an evening gown?","Mother!"
"872",3575392,3577986,"-A very old one.-Well, come on, get it on.","Mother!"
"873",3578152,3580950,"-We'll go out and celebrate.-What will we be celebrating?","Mother!"
"874",3581112,3583580,"All this! You don't get onthe front pages every day.","Mother!"
"875",3583752,3585629,"You don't get awayfrom the cops every day.","Mother!"
"876",3585792,3587942,"You do if you're smart. Come here.","Mother!"
"877",3589432,3591502,"See those white lights up there?","Mother!"
"878",3592472,3595145,"That's where you belong,and that's where you're going.","Mother!"
"879",3595312,3597542,"Come on, I'll show you whothis town's made for.","Mother!"
"880",3597712,3600784,"Well, I hope that old gown of minehangs together.","Mother!"
"881",3603632,3605270,"-Wants an eight.-Wants an eight.","Mother!"
"882",3605432,3607866,"-Here's 10,000 on red.-You got a bet!","Mother!"
"883",3608672,3610981,"Thirty-six, red.","Mother!"
"884",3611152,3613620,"-Place your bets.-Give the lady a stack of black chips.","Mother!"
"885",3613792,3614986,"-For whom?-For me.","Mother!"
"886",3615152,3617382,"-Rocky Sullivan.-Oh, yes. Sure, of course.","Mother!"
"887",3617552,3620908,"Try your luck. I got some business.I'll be back in a while.","Mother!"
"888",3621072,3623984,"-Look, Rocky, I'm not lucky.-Don't be afraid. Let your hair down.","Mother!"
"889",3624152,3626620,"-Have some fun. Go ahead.-Place your bets.","Mother!"
"890",3626792,3628464,"-How much are these?-Fifty dollars.","Mother!"
"891",3628632,3631021,"-Change them to dollar chips.-But he wants black.","Mother!"
"892",3631192,3633547,"-I don't like black.-Oh, you don't like black.","Mother!"
"893",3634272,3637105,"After I knew the facts, and seeing howJim owed you the dough. . .","Mother!"
"894",3637272,3641185,". . .and it being a misunderstanding, we'llcall it square, with no hard feelings. . .","Mother!"
"895",3641352,3643820,". . .especially now that you'rein the know of things.","Mother!"
"896",3643992,3646222,"-You boys really want to talk business?-Yeah.","Mother!"
"897",3646392,3647620,"Come on, let's talk.","Mother!"
"898",3647872,3651182,"Look here, Rocky, what aboutthose accounts you took from my safe?","Mother!"
"899",3651352,3654583,"Those are very good insurance,just in case you boys change your minds.","Mother!"
"900",3654752,3657186,"-Okay. What do you want, Rocky?-Nothing from you, Mac.","Mother!"
"901",3657352,3660469,"Just my original agreement with Frazier:50 percent of everything.","Mother!"
"902",3660952,3662670,"That sounds fair enough, Jim.","Mother!"
"903",3664232,3666302,"All right. It's a deal.","Mother!"
"904",3666832,3669426,"Now, look, I'm gonna take very goodcare of those accounts.","Mother!"
"905",3669592,3672060,"If I was you, I wouldn't do anythingI'd be sorry for. . .","Mother!"
"906",3672232,3675304,". . .because I'm gonna pay specialattention to those books, understand?","Mother!"
"907",3675472,3678350,"A deal between you guys is a deal,just like it was on paper.","Mother!"
"908",3678512,3682027,"-That's me, Rocky. I do everything legal.-Oh, yeah. I know that.","Mother!"
"909",3682192,3685264,"If you don't mind, partners,my accountant will go over the books. . .","Mother!"
"910",3685432,3687992,". . .just to make sure you boysain't cheating. Fair enough?","Mother!"
"911",3688152,3689744,"-Yeah.-Okay.","Mother!"
"912",3694312,3696985,"How long do you think I'll let that guysit in my chair?","Mother!"
"913",3697152,3700508,"Just as long as he hangs onto that information.","Mother!"
"914",3709792,3712670,"-You like this place?-Sure. Why wouldn't I?","Mother!"
"915",3712832,3714743,"-Just got a piece of it.-Rocky.","Mother!"
"916",3714912,3717028,"-Yeah.-Maybe you are smart enough.","Mother!"
"917",3717192,3720707,"How'd you like to give up thattwo-for-nickel job and move in here?","Mother!"
"918",3720872,3722191,"Doing what?","Mother!"
"919",3722352,3725822,"Just sitting, looking pretty, dancea little, play a little. Kind of a hostess.","Mother!"
"920",3725992,3727789,"Give you 100 a week and expenses.","Mother!"
"921",3727952,3732468,"And it'll be very nice to haveat least one friend in this place.","Mother!"
"922",3747832,3749026,"Come in.","Mother!"
"923",3750232,3751665,"Yes, Mrs. McGee, what is it?","Mother!"
"924",3751832,3755666,"Well, I've had lunch waiting since noon,then this package came by messenger.","Mother!"
"925",3755832,3758141,"I thought maybe it was important,so I brought it up.","Mother!"
"926",3758312,3759540,"All right. Thank you.","Mother!"
"927",3759712,3761623,"ls there anything wrong, Father?","Mother!"
"928",3761792,3764625,"No, no, nothing.Oh, I won't have any lunch.","Mother!"
"929",3764792,3768751,"If I'd known that this morning,I could've saved some money.","Mother!"
"930",3797072,3799028,"You wait. I'll tell him you're here.","Mother!"
"931",3800792,3802191,"Make yourseIf at home.","Mother!"
"932",3802352,3803501,"Thanks.","Mother!"
"933",3814312,3817110,"Hi, Jerry. What do you hear?What do you say? Trying your luck?","Mother!"
"934",3817272,3819467,"Yes, I'd like to,but I haven't got any money.","Mother!"
"935",3819632,3822021,"Except this, and it's not mine.","Mother!"
"936",3822192,3824945,"-Say, where did you get ahold of that?-Where did you?","Mother!"
"937",3826472,3828542,"Here, Rocky.Thanks, but I can't accept it.","Mother!"
"938",3828712,3831021,"What's the matter? You silly?That ain't mine.","Mother!"
"939",3831192,3833547,"I know it isn't.That's why I can't take it.","Mother!"
"940",3833712,3834861,"What is this?","Mother!"
"941",3835032,3838627,"You flash this wad on me,then try to tell me the dough is mine.","Mother!"
"942",3838792,3842501,"-What's it all about?-You've got a great poker face, Rocky.","Mother!"
"943",3842672,3845664,"But don't forget, I've known that facefor a long time.","Mother!"
"944",3845832,3848744,"I know you forced Frazier to get you$ 100,000. Everybody knows it.","Mother!"
"945",3848912,3850982,"What's the differencewhere the dough came from?","Mother!"
"946",3851152,3853108,"First place, Frazier owed it to me.It's mine.","Mother!"
"947",3853272,3855786,"Second, it's a lot better you geta chunk of it than him.","Mother!"
"948",3855952,3858705,"And suppose the dough is hot?Nobody knows that but you and me.","Mother!"
"949",3858872,3860100,"That's just it.","Mother!"
"950",3860272,3862263,"Oh, come on. Don't be such an angel.","Mother!"
"951",3862432,3864741,"You want to get the center buiIt?Go get it started!","Mother!"
"952",3864912,3867028,"I don't want to build iton rotten foundations.","Mother!"
"953",3867192,3868910,"Oh, don't be a sucker!","Mother!"
"954",3869072,3870869,"All right, Rocky.","Mother!"
"955",3871032,3872624,"Supposing I take the money.","Mother!"
"956",3872792,3876626,"And I kid myseIf it's a means to an end.Well, it isn't. Never will be.","Mother!"
"957",3876792,3879465,"Inside the center, my boys will be clean,and outside. . .","Mother!"
"958",3879632,3883068,". . .they'd be surrounded by the samecorruption and crime and criminals.","Mother!"
"959",3883232,3884631,"Yes, yourseIf included.","Mother!"
"960",3884912,3888382,"Criminals on all sides for my boysto look up to and revere. . .","Mother!"
"961",3888552,3891510,". . .and respect and admire and imitate.","Mother!"
"962",3891672,3894266,"What good is it to teachthat honesty is the best policy. . .","Mother!"
"963",3894432,3897265,". . .when all around, they seethat dishonesty is a better policy?","Mother!"
"964",3897432,3900504,"The hoodlum and gangsteris looked up to with the same respect. . .","Mother!"
"965",3900672,3903709,". . .as the successful businessmanor popular hero.","Mother!"
"966",3903872,3906670,"You, and the Fraziersand the Keefers. . .","Mother!"
"967",3906832,3910381,". . .and the rest of those rotten politiciansyou've got in the palm of your hand.","Mother!"
"968",3910552,3913112,"Yes, and you've got my boys too.","Mother!"
"969",3913432,3917027,"Whatever I teach them,you show me up.","Mother!"
"970",3917192,3919501,"You show them the easiest way.","Mother!"
"971",3919712,3921703,"The quickest wayis with a racket or a gun.","Mother!"
"972",3921872,3924102,"Well, it's so, ain't it?","Mother!"
"973",3925272,3928184,"Yes, it's so.God help us.","Mother!"
"974",3929112,3930864,"You see, Rocky. . .","Mother!"
"975",3931032,3933910,". . .I thought I could solvemy problems and. . . .","Mother!"
"976",3934432,3936900,"Problems with my boys,which, after all, they are. . .","Mother!"
"977",3937072,3938869,". . .from the bottom up.But I can't do it.","Mother!"
"978",3939032,3941227,"-I've got to start from the top down.-Yeah? How?","Mother!"
"979",3941832,3943743,"I'll tell you how.","Mother!"
"980",3943912,3946221,"I'm gonna use your kidnapping Frazieras a crowbar. . .","Mother!"
"981",3946392,3948144,". . .to pry open and uncoverthis cesspool.","Mother!"
"982",3948312,3950382,"I'm gonna force the law,corrupt or not. . .","Mother!"
"983",3950552,3953066,". . .to bring to the light of daythis fiIthy affair.","Mother!"
"984",3953232,3956065,"Now, there's gonna be a lot of peoplestepped on, Rocky. . .","Mother!"
"985",3956472,3959987,". . .and if you happen to get in the way. . .","Mother!"
"986",3960152,3963144,". . .I'll be sorry, but you'll be stepped onjust as hard.","Mother!"
"987",3963312,3967146,"All right, Jerry, go to it. But you have asmuch chance of getting an indictment. . .","Mother!"
"988",3967312,3969109,". . .as I have of gettinginto Bible Society.","Mother!"
"989",3969272,3970830,"You'll find nobody cares.","Mother!"
"990",3970992,3973745,"You'll find them laughing at you.End up a lot of blind alleys.","Mother!"
"991",3973912,3976221,"But go ahead, kid.","Mother!"
"992",3976392,3980146,"And if I'm in your way, why,keep on stepping just as hard.","Mother!"
"993",3981592,3984311,"For being honestand for old times' sake.","Mother!"
"994",3984472,3987350,"Rocky, there's one favor I'm gonnahave to ask you.","Mother!"
"995",3987512,3989787,"Maybe I won't be able to return it.","Mother!"
"996",3989952,3991908,"Well, go ahead. Anything you say.","Mother!"
"997",3992272,3995150,"Soapy and those kids,give them a break, will you?","Mother!"
"998",3995312,3997428,"Don't offer them any more money.","Mother!"
"999",3997592,4000664,"Don't encourage them to. . . .To admire you.","Mother!"
"1000",4002072,4003949,"All right. I'll do that.","Mother!"
"1001",4005232,4006904,"Sure, you will.","Mother!"
"1002",4028992,4032064,"Father Connelly, I'd like to help you.I really would.","Mother!"
"1003",4032232,4036305,"But we can't get away with it.The organization is too powerful to fight.","Mother!"
"1004",4041112,4042864,"You know what you're asking of me?","Mother!"
"1005",4043032,4044351,"Yes, Mr. White.","Mother!"
"1006",4044512,4047663,"The other papers have gone togreat lengths to explain the risks to me.","Mother!"
"1007",4047832,4051347,"You'll go into the fight personally?Devote your full time to it?","Mother!"
"1008",4051512,4054185,"Believe me when I say,nothing would please me any more.","Mother!"
"1009",4054352,4056263,"Very well, Father Connelly, I'm with you.","Mother!"
"1010",4056432,4058070,"The press will back you to the limit.","Mother!"
"1011",4058232,4060188,"Thank you, and I appreciate it.","Mother!"
"1012",4080352,4082820,"Get me the insideon Frazier and Keefer's bank accounts.","Mother!"
"1013",4082992,4085062,"I don't care where you get the dopebut get it.","Mother!"
"1014",4085232,4088542,"Pap, get me all the information you canon Frazier before he got to town.","Mother!"
"1015",4088712,4091704,"If he'd ever been mixed up with Sullivan.The leaders' expenses.","Mother!"
"1016",4091872,4094386,"Jenkins, go back through the police filesand find out. . .","Mother!"
"1017",4094552,4097624,". . .how many of Keefer's menhave been sprung since Frazier moved in.","Mother!"
"1018",4097792,4099111,"Why are you hounding Rocky?","Mother!"
"1019",4099272,4101740,"Why are you trying to send himto prison for life?","Mother!"
