"id","startTime","endTime","text","title"
"405",1132299,1134500,"Bet old Frank suredoes wish he was 21.","Paper Moon"
"406",1137299,1140000,"You don't like me, do you?","Paper Moon"
"407",1141200,1144000,"No, l don't like you.","Paper Moon"
"408",1151099,1152200,"Yes?","Paper Moon"
"409",1152299,1153700,"Afternoon, ma'am.l was wondering","Paper Moon"
"410",1153700,1155000,"if Mr. Bates might be at home.","Paper Moon"
"411",1155000,1156400,"Mr. Bates is dead.","Paper Moon"
"412",1156500,1158299,"He died over a week ago.","Paper Moon"
"413",1158299,1159799,"Oh, you mean he passed over,ma'am?","Paper Moon"
"414",1159799,1161099,"Why, l was just talking to him","Paper Moon"
"415",1161099,1162200,"not less than a month ago.","Paper Moon"
"416",1162200,1163700,"What was it you wanted?","Paper Moon"
"417",1163700,1166500,"Well, my name is Pray,Kansas Bible Company.","Paper Moon"
"418",1166599,1167900,"l'm just hereto deliver this bible","Paper Moon"
"419",1167900,1168900,"that Mr. Bates ordered.","Paper Moon"
"420",1169000,1169900,"Bible?","Paper Moon"
"421",1170000,1172099,"Who is it?What's the trouble?","Paper Moon"
"422",1172200,1174500,"Something about Benjamin","Paper Moon"
"423",1174599,1175500,"buying a bible.","Paper Moon"
"424",1175599,1177200,"Bible? What kind of Bible?","Paper Moon"
"425",1177200,1179099,"He said he talkedto Benjamin,","Paper Moon"
"426",1179099,1180599,"less than a month ago.","Paper Moon"
"427",1180599,1183400,"Well, l'm-l'm not exactly sureof the dates, ma'am.","Paper Moon"
"428",1183400,1184599,"Well, l don't see how.","Paper Moon"
"429",1184599,1186900,"Benjamin didn't go nowheresnear that shop","Paper Moon"
"430",1186900,1188900,"for more than a monthbefore he died.","Paper Moon"
"431",1189000,1191700,"Well, l may be a littlemixed up on the dates.","Paper Moon"
"432",1191799,1193400,"What company you sayyou're from?","Paper Moon"
"433",1193400,1196299,"The Kansas Bible Company,out of Wichita.","Paper Moon"
"434",1196299,1197799,"Kansas Bible Company?","Paper Moon"
"435",1197799,1200000,"l ain't never heard ofno Kansas Bible Company.","Paper Moon"
"436",1200099,1201400,"Daddy...","Paper Moon"
"437",1201400,1202400,"Can't we go now?","Paper Moon"
"438",1202500,1205299,"l want to get to churchand pray for Mama.","Paper Moon"
"439",1205299,1209700,"Oh, yeah, yeah.Sure we can, honey.","Paper Moon"
"440",1209799,1211299,"Daddy was just fixin' to leave.","Paper Moon"
"441",1211400,1212799,"This here is my little girl.","Paper Moon"
"442",1212799,1214099,"lt's just the two of us now.","Paper Moon"
"443",1214200,1215500,"My Mama's gone to the Lord.","Paper Moon"
"444",1215599,1217099,"Oh, so has poor Mr. Bates,honey.","Paper Moon"
"445",1217200,1218200,"l'll just, uh,","Paper Moon"
"446",1218200,1219400,"give you backhis dollar deposit,","Paper Moon"
"447",1219500,1221599,"and you let us know ifthere's anything we can do.","Paper Moon"
"448",1221599,1222599,"Hold on, there.","Paper Moon"
"449",1222599,1224299,"Wait one damn minute.","Paper Moon"
"450",1226799,1229200,"He actually doneordered a bible, huh?","Paper Moon"
"451",1229200,1230400,"Uh, he sure did... here it is,","Paper Moon"
"452",1230400,1232400,"right here in goldfor somebody named ""Marie.""","Paper Moon"
"453",1232400,1233900,"That's her. She's Marie.","Paper Moon"
"454",1234000,1236400,"Oh, she sure didmean a lot to him.","Paper Moon"
"455",1236400,1238900,"He especially had me getthe deluxe edition.","Paper Moon"
"456",1239000,1240000,"How much to keep this here book?","Paper Moon"
"457",1240000,1241099,"Oh, w-well,that one is the...","Paper Moon"
"458",1241099,1243500,"lt's the $12 one, Daddy.","Paper Moon"
"459",1243500,1244500,"- $12?- $12?","Paper Moon"
"460",1244500,1245599,"Uh, yeah, well, honey,w-we have","Paper Moon"
"461",1245700,1247099,"to have a little goodnessin our hearts,","Paper Moon"
"462",1247099,1248500,"l mean, consideringthe circumstances.","Paper Moon"
"463",1248500,1249500,"Never mind the circumstances.","Paper Moon"
"464",1249599,1251799,"And if it'll makethat woman happy...","Paper Moon"
"465",1251799,1254099,"l'll take it.","Paper Moon"
"466",1265200,1269900,"You owe me $85.74.","Paper Moon"
"467",1275700,1279799,"l mean, we're goingto Washington on the QT.","Paper Moon"
"468",1279799,1282000,"Molly, she sayswe can't go on the QT...","Paper Moon"
"469",1282000,1283900,"we're got to takethe Pennsylvania.","Paper Moon"
"470",1285099,1286200,"Hey, l'd better get going.","Paper Moon"
"471",1286200,1288200,"Hey, Molly, where's my suitcase?Do you know?","Paper Moon"
"472",1288200,1289599,"Uh, l'm sure l don't know,McGee.","Paper Moon"
"473",1289700,1291000,"You had it last night.","Paper Moon"
"474",1291099,1292700,"Oh, l know where it is.lt's right here in the hall...","Paper Moon"
"475",1292700,1294299,"He's going to open the closet!","Paper Moon"
"476",1301700,1303000,"Now he's going to say","Paper Moon"
"477",1303099,1305599,"how he's got to straightenthe closet out!","Paper Moon"
"478",1305599,1308400,"Got to straighten out thatcloset one of these days.","Paper Moon"
"479",1308500,1310900,"How'd you like to do a littlebusiness with me?","Paper Moon"
"480",1311000,1313599,"You mean insteadof paying me back?","Paper Moon"
"481",1313599,1315000,"Now, don't get nervous.l'll pay you back.","Paper Moon"
"482",1315099,1316400,"l'm just saying,while we're heading east,","Paper Moon"
"483",1316400,1318500,"how'd you like to do a littlebusiness together, that's all.","Paper Moon"
"484",1321299,1322299,"Well, you're looking at me","Paper Moon"
"485",1322299,1323900,"like l'm out to cheat youor something.","Paper Moon"
"486",1323900,1325500,"l am offering youa business proposition.","Paper Moon"
"487",1325599,1327400,"Take it or leave it,and turn off that radio!","Paper Moon"
"488",1327400,1329400,"You're like to drive us all deafwith that radio.","Paper Moon"
"489",1329400,1331500,"Maybe l'll be a big shot...","Paper Moon"
"490",1331500,1333000,"in an average way, of course.","Paper Moon"
"491",1339400,1342099,"Okay, l want youto remember one thing:","Paper Moon"
"492",1342099,1343599,"l decide on the price.","Paper Moon"
"493",1343700,1344900,"Maybe you don't know French,","Paper Moon"
"494",1344900,1346599,"but there's something in thisworld called ""fine-esse.""","Paper Moon"
"495",1346599,1348200,"$12! l never soldno bible for $12.","Paper Moon"
"496",1348299,1349500,"That man was a law officer.","Paper Moon"
"497",1349599,1351200,"You could've had meput me in jail.","Paper Moon"
"498",1351200,1353099,"We got it, didn't we?","Paper Moon"
"499",1353099,1354700,"l don't care if we got it.","Paper Moon"
"500",1354700,1356700,"Don't you go makingthe decisions.","Paper Moon"
"501",1356700,1357900,"l make the decisions.","Paper Moon"
"502",1357900,1360900,"All you got to do is looklike a pretty little girl.","Paper Moon"
"503",1365599,1367599,"You ain't got somethinglike a ribbon","Paper Moon"
"504",1367599,1369000,"in that cigar box, do you?","Paper Moon"
"505",1369000,1371400,"l got my mom's kimonoin my suitcase,","Paper Moon"
"506",1371500,1373000,"Chinamen with umbrellas.","Paper Moon"
"507",1373000,1376599,"That ain't quitewhat l had in mind.","Paper Moon"
"508",1385700,1387500,"You look real nicein that ribbon.","Paper Moon"
"509",1387599,1390299,"First off, l didn't knowwas she a boy or a girl?","Paper Moon"
"510",1390299,1391700,"l'm a girl.","Paper Moon"
"511",1391799,1394200,"Well, it makesall the difference.","Paper Moon"
"512",1394299,1397500,"Ain't she got a sweetlittle face, somehow.","Paper Moon"
"513",1397500,1399299,"Well, seeing how ljust got paid today,","Paper Moon"
"514",1399400,1400799,"we'll take aribbon in each color.","Paper Moon"
"515",1400799,1402299,"How much that goingto set me back?","Paper Moon"
"516",1402299,1403799,"Well, that'll be 15 cents.","Paper Moon"
"517",1403799,1406500,"Bought my grandchildrenribbons just like this","Paper Moon"
"518",1406599,1407700,"last holiday time.","Paper Moon"
"519",1407799,1409500,"Grandchildren?l don't believe it.","Paper Moon"
"520",1409500,1410500,"You break a five?","Paper Moon"
"521",1410599,1412700,"Well, you canbelieve it, all right.","Paper Moon"
"522",1412799,1415099,"l'm just as old as l look.","Paper Moon"
"523",1415099,1417200,"Well, now, here you be...","Paper Moon"
"524",1417299,1420400,"that's one, two,three, four, five.","Paper Moon"
"525",1420400,1422000,"You know, thisold wallet of mine","Paper Moon"
"526",1422099,1423400,"is about to bust its sides.","Paper Moon"
"527",1423400,1424799,"l'll give you five ones back,","Paper Moon"
"528",1424900,1426000,"you give me that $5 bill.","Paper Moon"
"529",1426099,1428299,"How many grandchildrenyou got all together?","Paper Moon"
"530",1428400,1430099,"Well, l got two littlegranddaughters...","Paper Moon"
"531",1430099,1431599,"a nine year old,a ten year old...","Paper Moon"
"532",1431700,1433599,"two grandsons near 16,","Paper Moon"
"533",1433700,1436799,"and l got a grandson35 years old.","Paper Moon"
"534",1436799,1438299,"Come on, you'repulling my leg.","Paper Moon"
"535",1439400,1441000,"Why don't you justgive me a $10 bill?","Paper Moon"
"536",1441099,1443000,"Here's the $5, andfive ones, there.","Paper Moon"
"537",1443000,1445700,"That way l won't be so quickto see it break apart.","Paper Moon"
"538",1445799,1447299,"Six children, huh?My, my, my...","Paper Moon"
"539",1447400,1448599,"l've got a daughter, 51.","Paper Moon"
"540",1448700,1449599,"Oh, now, l don't mean","Paper Moon"
"541",1449700,1450799,"to be handing you no line,","Paper Moon"
"542",1450799,1452500,"but that's just prettyhard to believe","Paper Moon"
"543",1452599,1453799,"you got a 51-year-old child.","Paper Moon"
"544",1453900,1455400,"You can believe it,all right.","Paper Moon"
"545",1455400,1458000,"Well, l'm afraid l'd haveto see it to believe it.","Paper Moon"
"546",1458000,1459500,"Much obliged.","Paper Moon"
"547",1459500,1460500,"See you again.","Paper Moon"
"548",1460500,1463099,"Y'all come back!","Paper Moon"
"549",1475900,1482299,"That just don't seemquite right... somehow.","Paper Moon"
"550",1486500,1487799,"Yes?","Paper Moon"
"551",1487799,1490099,"l'm looking for Mr. Stanley,ma'am.","Paper Moon"
"552",1490200,1491500,"Mr. Stanley's dead.","Paper Moon"
"553",1491500,1492700,"Oh, well, l'm looking","Paper Moon"
"554",1492799,1494700,"for Mr. WarrenM. Stanley, ma'am.","Paper Moon"
"555",1494700,1496000,"Warren's passed on, sir.","Paper Moon"
"556",1496099,1497500,"Oh, that's hard to believe.","Paper Moon"
"557",1497599,1500900,"l was just talking to Warrennot more than two weeks back.","Paper Moon"
"558",1500900,1502900,"He ordered this here biblefrom me.","Paper Moon"
"559",1502900,1504500,"Warren spent moneyon a bible?","Paper Moon"
"560",1504599,1507400,"Yes, ma'am, with the name Elvirain the corner.","Paper Moon"
"561",1507400,1509900,"Why would Warrenspend money on a bible?","Paper Moon"
"562",1509900,1511500,"He took fast to the idea, ma'am.","Paper Moon"
"563",1511599,1512700,"Only thing is,","Paper Moon"
"564",1512700,1514400,"he left a balance due of,well, let's see,","Paper Moon"
"565",1514400,1516000,"not counting the dollardeposit...","Paper Moon"
"566",1516000,1517599,"Daddy, this one'salready paid for.","Paper Moon"
"567",1517700,1519099,"Huh?","Paper Moon"
"568",1519099,1521299,"Mr. Stanley paidfor the whole thing,","Paper Moon"
"569",1521400,1522500,"don't you remember?","Paper Moon"
"570",1535900,1537000,"Afternoon, ma'am.","Paper Moon"
"571",1537099,1538299,"Mr. Huff at home?","Paper Moon"
"572",1538299,1541400,"Mr. Huff passed away,young man, a week ago.","Paper Moon"
"573",1541400,1542700,"Oh, gee, l'm sorry.","Paper Moon"
"574",1542700,1545400,"l was just talking to Mr. Huffnot more than a month ago.","Paper Moon"
"575",1545400,1546500,"What was it you wanted?","Paper Moon"
"576",1546599,1548799,"Oh, well, my name is Pray,Kansas Bible Company.","Paper Moon"
"577",1548900,1550200,"Mr. Huff ordered this bible","Paper Moon"
"578",1550200,1551700,"as a gift for someonenamed Edna.","Paper Moon"
"579",1551700,1553099,"Oh, that's my name.","Paper Moon"
"580",1553200,1555700,"You don't have to take itif you don't want to.","Paper Moon"
"581",1555700,1557000,"l'll just give you back","Paper Moon"
"582",1557000,1558700,"Amos's dollar deposit, and...","Paper Moon"
"583",1558700,1560599,"Of course l want to keep it.","Paper Moon"
"584",1560599,1561799,"He bought me a bible.","Paper Moon"
"585",1561799,1562799,"Yes, ma'am.","Paper Moon"
"586",1562799,1565099,"Now, l told Amosl could sell him a cheaper one,","Paper Moon"
"587",1565099,1566200,"but no, naturally,","Paper Moon"
"588",1566299,1567799,"he wanted the best...","Paper Moon"
"589",1567900,1569599,"the best, of course,being the deluxe edition","Paper Moon"
"590",1569599,1570599,"with the name printed","Paper Moon"
"591",1570700,1572099,"in child-in-the-mangergold letters,","Paper Moon"
"592",1572099,1573500,"bringing up a balance due of...","Paper Moon"
"593",1573599,1574700,"Of $24!","Paper Moon"
"594",1574799,1576799,"$24. l'll get my purse.","Paper Moon"
"595",1576799,1578900,"What's your name, honey?","Paper Moon"
"596",1578900,1580500,"Addie.","Paper Moon"
"597",1580500,1582200,"Addie. What a sweet little name.","Paper Moon"
"598",1582299,1583299,"Addie Pray, ma'am.","Paper Moon"
"599",1583299,1586799,"Well, Addie Pray, l'mgoing to give you $24,","Paper Moon"
"600",1586799,1590200,"and an extra $5 forjust coming to my door.","Paper Moon"
"601",1590200,1591700,"Praise the Lord.","Paper Moon"
"602",1591799,1593200,"Praise the Lord.","Paper Moon"
"603",1603099,1607400,"Keep your sunny sideup, up","Paper Moon"
"604",1607400,1610299,"Hide the sidethat gets blue...","Paper Moon"
"605",1623799,1626000,"Moze, let's give himsome money.","Paper Moon"
"606",1626099,1627200,"No.","Paper Moon"
"607",1627200,1629099,"Just a little bit.","Paper Moon"
"608",1629099,1630799,"We got $305.16.","Paper Moon"
"609",1630799,1632700,"Whole 'nother businessgiving it away.","Paper Moon"
"610",1632799,1634700,"lt's bad enoughyou give away bibles.","Paper Moon"
"611",1634700,1635799,"But they're poorly.","Paper Moon"
"612",1635799,1636900,"The whole country'spoorly...","Paper Moon"
"613",1636900,1638000,"l told you before.","Paper Moon"
"614",1638000,1639099,"But Frank D. Roosevelt says","Paper Moon"
"615",1639099,1640500,"we got to look outfor one another.","Paper Moon"
"616",1640500,1642000,"l don't care aboutFrank D. Roosevelt.","Paper Moon"
"617",1642099,1643099,"- But he says it.- That so?","Paper Moon"
"618",1643200,1644599,"Why don't you askFrank D. Roosevelt","Paper Moon"
"619",1644599,1646299,"what he thinks about takingcare of himself.","Paper Moon"
"620",1646400,1647900,"You think he don't eat offsilver trays?","Paper Moon"
"621",1648000,1649799,"He could eat off tabletopslike the rest of us,","Paper Moon"
"622",1649900,1651000,"but he don't... you know why?","Paper Moon"
"623",1651000,1652599,"Because that would make himlook common.","Paper Moon"
"624",1652599,1653799,"And besides, Frank D. Roosevelt","Paper Moon"
"625",1653799,1654799,"ain't running this thing.","Paper Moon"
"626",1654900,1656599,"l'm running it, so don'tyou make up no rules","Paper Moon"
"627",1656700,1658099,"about what we'regoing to give away.","Paper Moon"
"628",1658200,1659299,"lt's my money too,you know.","Paper Moon"
"629",1659299,1661200,"$200 belongs to me,and don't you forget that.","Paper Moon"
"630",1661200,1662200,"You want it?","Paper Moon"
"631",1662200,1663700,"Well, just put my sharein my pocket,","Paper Moon"
"632",1663799,1665400,"and l'll take youto a train station...","Paper Moon"
"633",1665400,1667700,"how do you like that?","Paper Moon"
"634",1667700,1668900,"Get the map.","Paper Moon"
"635",1669000,1670299,"Find out where thenearest depot is.","Paper Moon"
"636",1670299,1671599,"Nothing but trouble, anyway.","Paper Moon"
"637",1671700,1674000,"First you charge too much,then you want to give it away.","Paper Moon"
"638",1674000,1675000,"Where are we now?","Paper Moon"
"639",1675099,1676099,"We just left Plainville.","Paper Moon"
"640",1676099,1677799,"$12 for a bible,then it's up to $24.","Paper Moon"
"641",1677799,1678799,"lf l stay with you,","Paper Moon"
"642",1678799,1680400,"l'll spend the restof my life in jail.","Paper Moon"
"643",1680500,1681599,"There's a depot in Lincoln.","Paper Moon"
"644",1681599,1682700,"You can take me to Lincoln.","Paper Moon"
"645",1682700,1683799,"You bet l will.","Paper Moon"
"646",1683799,1684799,"Where's Lincoln?","Paper Moon"
"647",1684799,1685799,"Clear over there.","Paper Moon"
"648",1685799,1687299,"Oh, boy, you thinkl'm going to take you","Paper Moon"
"649",1687400,1689200,"clear over there just to get youto some depot?","Paper Moon"
"650",1689299,1690200,"Then keep going east.","Paper Moon"
"651",1690299,1691500,"We'll hit one in Sylvan Grove.","Paper Moon"
"652",1691599,1692900,"- Where's Sylvan Grove?- Right here.","Paper Moon"
"653",1693000,1694599,"Well, that'll take usdown through Lucas.","Paper Moon"
"654",1694599,1696700,"We got to go through somethingto get to Sylvan Grove.","Paper Moon"
"655",1696799,1697700,"l am not complaining.","Paper Moon"
"656",1697799,1699599,"l'm just saying that'll take youthrough Lucas.","Paper Moon"
"657",1699599,1701000,"You got to gothrough Paradox and Waldo","Paper Moon"
"658",1701000,1702200,"- and Lorraine and Lucas- Lorraine, huh?","Paper Moon"
"659",1702200,1703400,"if you want to getto Sylvan Grove.","Paper Moon"
"660",1703500,1704799,"Those are prettygood towns in there.","Paper Moon"
"661",1704900,1706099,"We could do somebusiness in there.","Paper Moon"
"662",1706200,1707200,"Well, it won't matter much.","Paper Moon"
"663",1707200,1708299,"We're near outof bibles anyway.","Paper Moon"
"664",1708400,1709599,"What do you mean,we're out of bibles?","Paper Moon"
"665",1709599,1711000,"Why didn't you tell mewe're out of bibles?","Paper Moon"
"666",1711000,1712099,"You look in the box too,don't you?","Paper Moon"
"667",1712200,1713500,"Well, you've got anexcuse for everything.","Paper Moon"
"668",1713500,1714599,"'Cause you blame mefor everything.","Paper Moon"
"669",1714700,1715799,"lf we were runningout of bibles,","Paper Moon"
"670",1715799,1716799,"you should have told me","Paper Moon"
"671",1716799,1717900,"we were runningout of bibles.","Paper Moon"
"672",1718000,1719099,"We're running outof bibles!","Paper Moon"
"673",1719099,1720500,"Well, then we gotto get new ones!","Paper Moon"
"674",1720500,1721500,"Then let's get new ones!","Paper Moon"
"675",1721500,1723099,"We can pick someup in Great Bend.","Paper Moon"
"676",1723200,1724299,"Great Bend's the other way.","Paper Moon"
"677",1724299,1725900,"Well, we got to havebibles, don't we?","Paper Moon"
"678",1726000,1728299,"Let's see, now, wecan veer down to Lucas,","Paper Moon"
"679",1728299,1730200,"and we'll veerover to Wilson.","Paper Moon"
"680",1730200,1732200,"Veer off to Lorraineand Bushton.","Paper Moon"
"681",1732299,1734500,"And we could veer offto Hoisington.","Paper Moon"
"682",1734599,1738400,"We'll just have to keepon veering, that's all.","Paper Moon"
"683",1739799,1741099,"l'm getting hungry.","Paper Moon"
"684",1741200,1742299,"You getting hungry?","Paper Moon"
"685",1742400,1744599,"Uh-huh.","Paper Moon"
"686",1767099,1771500,"Just one more chance","Paper Moon"
"687",1771599,1776299,"To proveit's you alone l care for","Paper Moon"
"688",1776400,1778700,"Each night l saya little prayer for...","Paper Moon"
"689",1781400,1783099,"You sweet thing.","Paper Moon"
"690",1783200,1784900,"Don't you tell me that.Ooh!","Paper Moon"
"691",1784900,1788099,"Sometimes l just don't know,with all the old doodly-doo.","Paper Moon"
"692",1788099,1789500,"Doodly-doo, doodly-doo.","Paper Moon"
"693",1790900,1792700,"Okay, now, you go on back, now.","Paper Moon"
"694",1792700,1794200,"l'll see you another time.","Paper Moon"
"695",1794299,1795400,"Don't send me back.","Paper Moon"
"696",1795400,1796900,"Oh, you got to go on back.","Paper Moon"
"697",1796900,1798400,"l'll see you another time,","Paper Moon"
"698",1798400,1799900,"- l promise.- l want to go in your place.","Paper Moon"
"699",1800000,1801099,"No, no.","Paper Moon"
"700",1802599,1804700,"You trying to keepsecrets from me?","Paper Moon"
"701",1804799,1807099,"You got diamonds andrubies in there?","Paper Moon"
"702",1807099,1808900,"Go on, go on.","Paper Moon"
"703",1808900,1810200,"Oh, Fido...","Paper Moon"
"704",1810200,1811500,"Night-night, old Fido.","Paper Moon"
"705",1811599,1813400,"- Woof-woof.- Woof-woof.","Paper Moon"
"706",1817099,1818900,"Woof-woof.","Paper Moon"
"707",1818900,1822599,"...Stilll'm holding on awhile","Paper Moon"
"708",1822599,1828000,"You'll give mejust one more word...","Paper Moon"
"709",1984099,1986799,"There it is.","Paper Moon"
"710",1989200,1990400,"Much obliged.","Paper Moon"
"711",1990500,1991900,"Thank you, sir.","Paper Moon"
"712",1994200,1996299,"All right, boy, you're next.","Paper Moon"
"713",1996299,1999500,"l ain't a boy.","Paper Moon"
"714",2002700,2004700,"Aw, don't let it bother you.","Paper Moon"
"715",2004700,2005700,"lt ain't funny.","Paper Moon"
"716",2005799,2007700,"No reason to get that sore.","Paper Moon"
"717",2007700,2009700,"He called me a boy, didn't he?","Paper Moon"
"718",2009799,2011500,"He just got mixed up,that's all.","Paper Moon"
"719",2011599,2014000,"He did not; he looked mestraight in the eye.","Paper Moon"
"720",2014000,2016599,"Yeah, well, l'm looking youstraight in the eye,","Paper Moon"
"721",2016700,2018200,"and l thinkyou're beautiful.","Paper Moon"
"722",2018200,2019299,"Oh, you're just saying that.","Paper Moon"
"723",2019400,2020400,"Would l made that up?","Paper Moon"
"724",2020400,2021900,"Why you're as beautifulas your mama,","Paper Moon"
"725",2021900,2024000,"and she put all the flowersin the world to shame.","Paper Moon"
"726",2024000,2026099,"You know, they wouldn'teven let her come to Holland","Paper Moon"
"727",2026200,2027400,"for fearshe'd droop the tulips,","Paper Moon"
"728",2027500,2029200,"and you got all the good looksshe ever had.","Paper Moon"
"729",2029299,2031299,"Then how come thatman called me a boy?","Paper Moon"
"730",2031299,2032700,"l don't know; maybe it's...","Paper Moon"
"731",2032799,2035099,"Maybe it's 'cause of whatyou got on, or something.","Paper Moon"
"732",2035099,2036900,"What's wrong with what l got on?","Paper Moon"
"733",2036900,2038400,"Oh, nothing wrong with it.","Paper Moon"
"734",2038400,2041000,"Just... don't exactlymake you look feminine.","Paper Moon"
"735",2041000,2042599,"Maybe it wouldn't bea bad idea","Paper Moon"
"736",2042599,2044299,"we get you fixed upa little bit...","Paper Moon"
"737",2044299,2046900,"get you a new dress,a fancy new hat, or something.","Paper Moon"
"738",2047000,2048099,"Come to think of it,","Paper Moon"
"739",2048099,2049900,"it wouldn't exactlyhurt business, either.","Paper Moon"
"740",2049900,2052099,"You really think l'mas pretty as my mama?","Paper Moon"
"741",2052099,2053500,"Of course l do.","Paper Moon"
"742",2053599,2055500,"How much moneywe got in the box?","Paper Moon"
"743",2055599,2057599,"$405.16.","Paper Moon"
"744",2057599,2058599,"Give me a $20.","Paper Moon"
"745",2058599,2059599,"What for?","Paper Moon"
"746",2059699,2061199,"Give me a $20.","Paper Moon"
"747",2063400,2064599,"Come on.","Paper Moon"
"748",2064599,2065900,"Where are we going?","Paper Moon"
"749",2065900,2067699,"We're going to get ussome fancy new outfits","Paper Moon"
"750",2067800,2069699,"with this money you gotfrom your Aunt Helen.","Paper Moon"
"751",2069800,2071099,"l don't have no Aunt Helen.","Paper Moon"
"752",2071099,2072300,"Oh, sure you do, honey.","Paper Moon"
"753",2072300,2074199,"Come on, let meexplain it to you.","Paper Moon"
"754",2075800,2076900,"Yes, sir?","Paper Moon"
"755",2077000,2078099,"l-l'd like","Paper Moon"
"756",2078199,2080300,"an lpana toothpaste,and a pack of Sen-Sen.","Paper Moon"
"757",2080400,2081599,"Uh, 20 and five.","Paper Moon"
"758",2081599,2082699,"Twenty-five.","Paper Moon"
"759",2082800,2083699,"Yes, sir.","Paper Moon"
"760",2083800,2084900,"Here you go.","Paper Moon"
"761",2091099,2092500,"75 makes one,","Paper Moon"
"762",2092599,2094900,"four makes five,and 15 makes 20.","Paper Moon"
"763",2094900,2096300,"Thank you very much.","Paper Moon"
"764",2096300,2097599,"l don't need a bag.","Paper Moon"
"765",2107699,2109099,"Thank you very much.","Paper Moon"
"766",2109099,2110699,"Thank you; bye, now.","Paper Moon"
"767",2110800,2112199,"How much is this?","Paper Moon"
"768",2112199,2113900,"That'll be 35 cents.","Paper Moon"
"769",2113900,2115199,"65 cents makes a dollar.","Paper Moon"
"770",2115300,2116400,"Thank you very much.","Paper Moon"
"771",2116400,2117500,"Thank you.","Paper Moon"
"772",2117599,2118900,"Yes?","Paper Moon"
"773",2118900,2121699,"May l have a bottleof purple toilet water, please?","Paper Moon"
"774",2121699,2124099,"That'll be 25 cents.","Paper Moon"
"775",2133199,2135400,"There you go.","Paper Moon"
"776",2141900,2144199,"Lady, you made a mistake.","Paper Moon"
"777",2144199,2147400,"Huh? l give you $4.75.","Paper Moon"
"778",2147400,2149400,"But l gave you a $20 bill.","Paper Moon"
"779",2149500,2151400,"Uh-uh. You give me a $5.","Paper Moon"
"780",2151500,2153699,"No, ma'am, it was a $20 bill.","Paper Moon"
"781",2153699,2157199,"You give me a $5,and l give you $4.75.","Paper Moon"
"782",2158900,2162300,"lt was a $20 bill.","Paper Moon"
"783",2164800,2167800,"Got no $20s in with no $5s.","Paper Moon"
"784",2167900,2168900,"What's all the turmoil?","Paper Moon"
"785",2168900,2169900,"What's going on here?","Paper Moon"
"786",2169900,2171500,"This little girlgive me a $5 bill,","Paper Moon"
"787",2171599,2172599,"and l give her change.","Paper Moon"
"788",2172699,2173800,"l gave her","Paper Moon"
"789",2173800,2175000,"a $20 bill... l know l did.","Paper Moon"
