"id","startTime","endTime","text","title"
"790",2175099,2177699,"lt was a birthday presentfrom my Aunt Helen in Wichita,","Paper Moon"
"791",2177800,2180400,"and she wrote ""Happy Birthday,Addie"" on the end of it.","Paper Moon"
"792",2180400,2182500,"You just go look and see.","Paper Moon"
"793",2183900,2185400,"That's it right there!","Paper Moon"
"794",2185400,2189300,"That's my $20 bill l got frommy Aunt Helen in Wichita.","Paper Moon"
"795",2189300,2190699,"Give the child her $20 bill.","Paper Moon"
"796",2190800,2192000,"l'm giving it.","Paper Moon"
"797",2192000,2194000,"Give the child her $20 bill,Miss Brownwell.","Paper Moon"
"798",2194099,2195300,"Yes, sir.","Paper Moon"
"799",2195300,2197300,"And give her a piece of candy,Miss Brownwell.","Paper Moon"
"800",2197400,2198699,"Yes, sir.","Paper Moon"
"801",2198800,2200699,"And pay attention to things,Miss Brownwell.","Paper Moon"
"802",2200800,2202800,"Yes, sir.","Paper Moon"
"803",2205400,2207900,"Come on in, getyour cotton candy.","Paper Moon"
"804",2208000,2211500,"Sweetheart, Cotton Candy.","Paper Moon"
"805",2211599,2213099,"Five cents.","Paper Moon"
"806",2213199,2214699,"Do you have changefor this five?","Paper Moon"
"807",2214699,2216099,"There you are, little girl.","Paper Moon"
"808",2216199,2218400,"Cotton candy,get your cotton candy.","Paper Moon"
"809",2218500,2220199,"Mister, this purseis sure full.","Paper Moon"
"810",2220199,2223199,"lf you give me the five back,l'll give you five ones.","Paper Moon"
"811",2223199,2226000,"Cotton candy, get yourcotton candy right here.","Paper Moon"
"812",2226000,2227800,"Mister, if you gota ten dollar bill","Paper Moon"
"813",2227800,2230500,"l'll give you the five backwith the five ones you have.","Paper Moon"
"814",2230500,2232300,"Would you give mea ten dollar bill?","Paper Moon"
"815",2233800,2236599,"There, now don't bother meany more, you understand?","Paper Moon"
"816",2236599,2238400,"Cotton candy!","Paper Moon"
"817",2238400,2241199,"Step up and getyour cotton candy.","Paper Moon"
"818",2241199,2243000,"Come and get it.","Paper Moon"
"819",2255199,2256900,"Get your tickets.","Paper Moon"
"820",2257000,2258699,"Only one fourth of a dollar.","Paper Moon"
"821",2258699,2260800,"The show goes onin five minutes.","Paper Moon"
"822",2260900,2262800,"Six unusual little ladies","Paper Moon"
"823",2262900,2265500,"unveiling the secretsof passion.","Paper Moon"
"824",2265599,2267400,"Found only a few years back","Paper Moon"
"825",2267400,2270500,"in the actually Egyptiantomb of Queen Nefereti.","Paper Moon"
"826",2270599,2274699,"And featuring the lusciousMiss Trixie Delight.","Paper Moon"
"827",2275900,2277199,"l had my photo took, Moze.","Paper Moon"
"828",2277300,2278699,"You did, huh?Ain't that fine.","Paper Moon"
"829",2278699,2280500,"Moze, can you come haveyour photo took with me?","Paper Moon"
"830",2280500,2281900,"Can't right now, sweetheart.","Paper Moon"
"831",2281900,2282900,"Only take a minute.","Paper Moon"
"832",2282900,2284000,"Not now, you hear me?","Paper Moon"
"833",2284000,2285400,"But it's almostdown here tonight.","Paper Moon"
"834",2285400,2286400,"lt wouldn't be here after...","Paper Moon"
"835",2286400,2287400,"l can't help that.","Paper Moon"
"836",2287400,2288400,"Now excuse me, you understand?","Paper Moon"
"837",2288500,2289699,"How many timesyou going to see it?","Paper Moon"
"838",2289699,2291400,"As many times as l like,that's how many times.","Paper Moon"
"839",2291400,2292500,"You seen it half a dozen times.","Paper Moon"
"840",2292599,2293900,"And l might see ita half dozen more.","Paper Moon"
"841",2293900,2295599,"Now why don't you goplay bingo or something?","Paper Moon"
"842",2295599,2296699,"l don't want to play bingo.","Paper Moon"
"843",2296800,2297699,"Well, then why don't you go","Paper Moon"
"844",2297800,2299300,"write another love noteto St. Roosevelt?","Paper Moon"
"845",2299300,2300400,"Maybe l will.","Paper Moon"
"846",2300400,2302099,"And stop standing aroundhere checking on me.","Paper Moon"
"847",2302199,2303199,"You don't have to worry.","Paper Moon"
"848",2303199,2304699,"l ain't about to leavesome poor little child","Paper Moon"
"849",2304800,2306000,"stranded in the middleof nowhere.","Paper Moon"
"850",2306000,2307000,"l got scruples, too,you know.","Paper Moon"
"851",2307099,2308300,"You know what that is,""scruples""?","Paper Moon"
"852",2308300,2309500,"No, l don't know what it is,","Paper Moon"
"853",2309500,2312500,"but if you got them, l sure betthey belong to somebody else.","Paper Moon"
"854",2314599,2317300,"And his name ain't Frank,it's Franklin.","Paper Moon"
"855",2329900,2332199,"Hey there,my little turtle-dee.","Paper Moon"
"856",2332300,2333699,"l wondered where you got to.","Paper Moon"
"857",2333699,2334699,"Where's your pa?","Paper Moon"
"858",2334699,2335800,"ls my picture ready?","Paper Moon"
"859",2335800,2336800,"Sure, it's...","Paper Moon"
"860",2336800,2338000,"Excuse me, folks,come right back.","Paper Moon"
"861",2338000,2339900,"Sit back in the moon there,l'll be right with you.","Paper Moon"
"862",2339900,2340900,"Let's see.","Paper Moon"
"863",2341000,2342500,"Here it is, here.","Paper Moon"
"864",2344400,2345800,"Hey, now, l thought you were","Paper Moon"
"865",2345900,2347900,"going to sit in the moonwith your pa.","Paper Moon"
"866",2347900,2349300,"He ain't my pa.","Paper Moon"
"867",2350900,2351800,"Hi, folks.","Paper Moon"
"868",2351900,2352900,"Get ready.","Paper Moon"
"869",2352900,2354300,"Smile. Hold it.","Paper Moon"
"870",2354300,2355699,"Hold it.","Paper Moon"
"871",2355699,2357599,"Beautiful.","Paper Moon"
"872",2373300,2375699,"l-l don't want you smokingin the car tomorrow.","Paper Moon"
"873",2375699,2377199,"What?","Paper Moon"
"874",2377199,2378500,"l didn't say nothing.","Paper Moon"
"875",2378599,2380300,"l'm just listening to you.","Paper Moon"
"876",2380300,2381300,"Well, there are going to be","Paper Moon"
"877",2381400,2382699,"a couple extra peopleriding with us,","Paper Moon"
"878",2382699,2384699,"and this particular persondon't like cigarette smoke.","Paper Moon"
"879",2384699,2386199,"What extra person?What?","Paper Moon"
"880",2386300,2388000,"l said what extra person?","Paper Moon"
"881",2388000,2389000,"A lady and her maid.","Paper Moon"
"882",2389099,2390400,"l'm giving them a rideto Topeka.","Paper Moon"
"883",2390400,2391900,"l didn't know we wasgoing to Topeka.","Paper Moon"
"884",2391900,2393500,"Well, that's because youdon't know everything.","Paper Moon"
"885",2393500,2395300,"What's the lady's name?","Paper Moon"
"886",2395300,2396699,"Miss Delight.","Paper Moon"
"887",2396699,2399300,"Miss Trixie Delight.","Paper Moon"
"888",2399300,2400699,"She's a real lady.","Paper Moon"
"889",2400699,2401800,"She comes from a good family","Paper Moon"
"890",2401800,2403400,"and l'm just giving hera ride, that's all.","Paper Moon"
"891",2403400,2405500,"Well, that's what you're alwaystalking about, ain't it?","Paper Moon"
"892",2405599,2406599,"Helping other people out.","Paper Moon"
"893",2423699,2426000,"Now don't you dropnothing, lmogene.","Paper Moon"
"894",2426000,2427800,"You take care of thosebreakables, understand?","Paper Moon"
"895",2427900,2429300,"Yes, Miss Trixie.","Paper Moon"
"896",2429400,2430500,"Morning.","Paper Moon"
"897",2430599,2432699,"Car is right over here.","Paper Moon"
"898",2439199,2442000,"You better ride inthe backseat a while.","Paper Moon"
"899",2457900,2459900,"And then l dancedin Tuscaloosa.","Paper Moon"
"900",2460000,2461000,"And the mayor was there,","Paper Moon"
"901",2461099,2463199,"and he just said the nicestthings about me.","Paper Moon"
"902",2463300,2465099,"The newspaper rana whole big photo on me.","Paper Moon"
"903",2465099,2467099,"l got a scrap booktelling stories on me","Paper Moon"
"904",2467199,2469099,"from towns all over.","Paper Moon"
"905",2469099,2470500,"Tell him 'bout the time that man","Paper Moon"
"906",2470599,2473199,"tried to crack your head openwith the bottle, Miss Trixie.","Paper Moon"
"907",2473300,2475300,"Why, lmogene,you silly old thing.","Paper Moon"
"908",2475400,2476900,"You know that's not true.","Paper Moon"
"909",2476900,2478000,"That old country boy","Paper Moon"
"910",2478099,2480199,"wasn't going to hit me overthe head with no bottle.","Paper Moon"
"911",2480199,2481400,"He was just horsing around.","Paper Moon"
"912",2481400,2484199,"Ask me real nice, maybe l'lltell you about that sometime.","Paper Moon"
"913",2484300,2485699,"Well, tell him about the time","Paper Moon"
"914",2485699,2487900,"you almost got thrownin jail, Miss Trixie.","Paper Moon"
"915",2497699,2499900,"l just don'tunderstand it, Daddy,","Paper Moon"
"916",2500000,2503500,"but this little baby has to gowinky-tinky all the time.","Paper Moon"
"917",2503500,2504699,"Well, don't you worry none.","Paper Moon"
"918",2504800,2506699,"We'll just plan onstopping here for dinner.","Paper Moon"
"919",2506800,2509099,"But we just stopped for herto winky-tink at lunch.","Paper Moon"
"920",2509099,2511599,"That's right, and now we'restopping for dinner.","Paper Moon"
"921",2511599,2512800,"Come on.","Paper Moon"
"922",2512900,2514500,"l ain't hungry.","Paper Moon"
"923",2524400,2525699,"Want one?","Paper Moon"
"924",2525800,2527199,"Okay.","Paper Moon"
"925",2531300,2532900,"How old are you?","Paper Moon"
"926",2533000,2534599,"l don't know, 15, why?","Paper Moon"
"927",2534599,2536300,"Just asking, that's all.","Paper Moon"
"928",2536400,2537300,"Where are you from?","Paper Moon"
"929",2537400,2538300,"Nowhere.","Paper Moon"
"930",2538400,2540000,"Well, you got to befrom somewhere.","Paper Moon"
"931",2540099,2542199,"Down by Troy, l guess.","Paper Moon"
"932",2542199,2543699,"How longhave you worked for her?","Paper Moon"
"933",2543699,2545599,"Ain't kept count.","Paper Moon"
"934",2545599,2547300,"A year, maybe.","Paper Moon"
"935",2547300,2548500,"How old you be?","Paper Moon"
"936",2548599,2550000,"Nine.","Paper Moon"
"937",2550099,2552199,"She really do all that dancing?","Paper Moon"
"938",2552300,2554599,"Well, if you wantto call it dancing.","Paper Moon"
"939",2554599,2556400,"All she do is wag her hips","Paper Moon"
"940",2556500,2558800,"and shake herold behind a little.","Paper Moon"
"941",2558900,2561400,"How come she'd leavethat job back there?","Paper Moon"
"942",2561400,2563500,"'Cause the boss mantried to make her","Paper Moon"
"943",2563500,2564900,"put out for his friends.","Paper Moon"
"944",2565000,2567400,"And she don't believein putting out for free.","Paper Moon"
"945",2567500,2568699,"She put out much?","Paper Moon"
"946",2568699,2570300,"Just like a gum machine.","Paper Moon"
"947",2570300,2572800,"You drop something in andshe'll put something out.","Paper Moon"
"948",2572900,2574300,"How much she charge?","Paper Moon"
"949",2574400,2576199,"Most she can get.","Paper Moon"
"950",2576199,2579000,"But she alwaysasks for $5.00.","Paper Moon"
"951",2579099,2580800,"She ain't putting outfor your pa, though.","Paper Moon"
"952",2580800,2583300,"Says she's going to waitand get all she can","Paper Moon"
"953",2583300,2584800,"before she put out for him.","Paper Moon"
"954",2584800,2586699,"He tell her he was my pa?","Paper Moon"
"955",2586800,2588599,"Well, not exactly.","Paper Moon"
"956",2588699,2589800,"l heard him mumblingsomething","Paper Moon"
"957",2589800,2591300,"like he didn't wantto talk about it.","Paper Moon"
"958",2591300,2592599,"Ain't he?","Paper Moon"
"959",2592599,2594099,"l'm with him, ain't l?","Paper Moon"
"960",2594099,2596800,"And how do you cometo be with her?","Paper Moon"
"961",2596800,2599699,"'Cause she promised to giveme $4.00 every week.","Paper Moon"
"962",2599699,2601300,"She ain't gave me nothing.","Paper Moon"
"963",2601400,2603599,"'Cept a nickel or dime,sometimes.","Paper Moon"
"964",2603699,2604699,"Why don't you quit?","Paper Moon"
"965",2604699,2605699,"Quit?","Paper Moon"
"966",2605699,2607300,"How am l going to quit?","Paper Moon"
"967",2607300,2609099,"And what if l do quit?","Paper Moon"
"968",2609099,2611500,"Ain't got no moneyto get home to Mom.","Paper Moon"
"969",2611500,2613099,"And what if l do get home?","Paper Moon"
"970",2613199,2615000,"They got hard timesas it is.","Paper Moon"
"971",2615099,2618000,"My mama say, ""You go workfor a white lady,","Paper Moon"
"972",2618099,2619900,"she'll takegood care of you.""","Paper Moon"
"973",2620000,2621500,"You want to knowwhat l think?","Paper Moon"
"974",2621500,2622800,"Yeah.","Paper Moon"
"975",2622900,2625099,"You know the little white speckon top chicken doo-doo?","Paper Moon"
"976",2625099,2626400,"Yeah.","Paper Moon"
"977",2626400,2628300,"Well, that's the kind of whitel think miss Trixie is.","Paper Moon"
"978",2628400,2630300,"She's just likethat little white speck","Paper Moon"
"979",2630400,2632500,"on top of old chicken shit.","Paper Moon"
"980",2636699,2640000,"Oh, l just love it,love it, love it.","Paper Moon"
"981",2640000,2641099,"All this white.","Paper Moon"
"982",2641099,2643199,"lt is absolutelythe proper thing","Paper Moon"
"983",2643199,2644900,"for my particular kindof appearance.","Paper Moon"
"984",2644900,2646099,"You know, it wouldn't be bad","Paper Moon"
"985",2646199,2647599,"for you to havea new dress, too.","Paper Moon"
"986",2647699,2650500,"The right kind of dress makesall the difference in the face.","Paper Moon"
"987",2650599,2653699,"Especially since you got theright kind of bone structure.","Paper Moon"
"988",2653699,2655199,"Oh...","Paper Moon"
"989",2655199,2657500,"Oh, my, oh, my.","Paper Moon"
"990",2657599,2659199,"Daddy, but wouldn'tyou look handsome","Paper Moon"
"991",2659199,2661400,"sitting behind the wheelof a thing like that?","Paper Moon"
"992",2661400,2664099,"'Course, you know, everythingis in the bone structure.","Paper Moon"
"993",2664099,2666199,"You know, a person cantell his whole life","Paper Moon"
"994",2666300,2667699,"on what his bonestructure is.","Paper Moon"
"995",2667800,2670300,"l tried pushing her outa window once in Little Rock.","Paper Moon"
"996",2671900,2674400,"Oh, l think there's bugsall over the...","Paper Moon"
"997",2674400,2677500,"l just hope there'sno snakes around here.","Paper Moon"
"998",2677599,2679699,"You know,l think we ought to go now.","Paper Moon"
"999",2679699,2682199,"Thank you so much.","Paper Moon"
"1000",2682199,2684199,"Now hurry... oh.","Paper Moon"
"1001",2684300,2686400,"Come on, hurry up.","Paper Moon"
"1002",2686500,2688000,"Get those things in there, now.","Paper Moon"
"1003",2688099,2689900,"Don't break anything, either.","Paper Moon"
"1004",2695500,2696900,"Let's go.","Paper Moon"
"1005",2696900,2699400,"Hurry up, doctor, this baby'sgot to go winky-tinky.","Paper Moon"
"1006",2699400,2700699,"Don't worry.","Paper Moon"
"1007",2700800,2702300,"Hey!","Paper Moon"
"1008",2706900,2708400,"Come on, we're ready.","Paper Moon"
"1009",2708400,2710199,"Come on, now.","Paper Moon"
"1010",2710199,2711300,"l ain't ready.","Paper Moon"
"1011",2711400,2713199,"Well, you don't lookreal busy with nothing,","Paper Moon"
"1012",2713199,2714400,"so you just come on down.","Paper Moon"
"1013",2714400,2715400,"l ain't coming.","Paper Moon"
"1014",2715400,2717300,"Now you listen here,child.","Paper Moon"
"1015",2717400,2718900,"No, l won't listen here.","Paper Moon"
"1016",2718900,2720500,"What the heck'sup with you, then?","Paper Moon"
"1017",2720500,2722000,"l want to sit in front.","Paper Moon"
"1018",2722099,2724599,"And how comewe ain't working no more?","Paper Moon"
"1019",2724699,2726400,"'Cause we're on vacation,that's why.","Paper Moon"
"1020",2726400,2728500,"And Miss Delight and meare sitting in front","Paper Moon"
"1021",2728500,2730099,"because we are two grown-ups,","Paper Moon"
"1022",2730199,2732199,"and that's where grown-upsdo the sitting.","Paper Moon"
"1023",2732300,2734099,"And little childrendo not tell grown-ups","Paper Moon"
"1024",2734199,2736400,"what to do with their lives,you understand that?","Paper Moon"
"1025",2736500,2737900,"Well, she ain't my grown-up,","Paper Moon"
"1026",2737900,2740300,"and l ain't planningno more to sit in the back.","Paper Moon"
"1027",2740300,2741800,"Not for no cow.","Paper Moon"
"1028",2741800,2743300,"Will you keep your voice down?","Paper Moon"
"1029",2743300,2744599,"And Miss Delight ain't no cow.","Paper Moon"
"1030",2744699,2745900,"She's a proper woman.","Paper Moon"
"1031",2745900,2747300,"She has a high school diploma,","Paper Moon"
"1032",2747300,2749300,"and right now she's gotto go to the bathroom,","Paper Moon"
"1033",2749300,2750900,"so you justget on down to the car.","Paper Moon"
"1034",2750900,2752500,"She always hasto go to the bathroom.","Paper Moon"
"1035",2752599,2755000,"She must have a bladderthe size of a peanut.","Paper Moon"
"1036",2755099,2757000,"Well, l ain't gettingback in that car.","Paper Moon"
"1037",2757099,2758699,"Not till she gets out of it.","Paper Moon"
"1038",2791599,2793699,"Hey, what's up, kiddo?","Paper Moon"
"1039",2793699,2795599,"Daddy says you'rewearing a sad face.","Paper Moon"
"1040",2795599,2797199,"Ain't good to havea sad face.","Paper Moon"
"1041",2797199,2799300,"Hey, how would you likea coloring book?","Paper Moon"
"1042",2799400,2800300,"Would you like that?","Paper Moon"
"1043",2800400,2801800,"You like Mickey the Mouse?","Paper Moon"
"1044",2801900,2803900,"Oh, son of a bitch.","Paper Moon"
"1045",2803900,2806800,"Ooh... oh.","Paper Moon"
"1046",2806800,2810400,"Now come on down to the carand let's all be friends.","Paper Moon"
"1047",2810500,2812300,"You see me smile?","Paper Moon"
"1048",2812300,2814500,"Come on, let's see you smilelike your Aunt Trixie.","Paper Moon"
"1049",2814500,2815599,"Now, come on.","Paper Moon"
"1050",2815599,2817800,"Come on down to the carwith mademoiselle.","Paper Moon"
"1051",2822000,2824599,"Kiddo, l understandhow you feel.","Paper Moon"
"1052",2824699,2826500,"Well, you don't have to worry.","Paper Moon"
"1053",2826500,2829000,"One of these days, you'regoing to be just as pretty","Paper Moon"
"1054",2829099,2831099,"as mademoiselle,maybe prettier.","Paper Moon"
"1055",2831199,2833300,"You already got bone structure.","Paper Moon"
"1056",2833400,2836300,"When l was your age, l didn'thave no bone structure.","Paper Moon"
"1057",2836300,2838599,"Took me yearsto get bone structure.","Paper Moon"
"1058",2838599,2840800,"And don't think bonestructure's not important.","Paper Moon"
"1059",2840800,2844300,"Nobody started to call memademoiselle till l was 17","Paper Moon"
"1060",2844400,2846199,"and gettinga little bone structure.","Paper Moon"
"1061",2846199,2849000,"When l was your age, l wasskinnier than a pole.","Paper Moon"
"1062",2849000,2851000,"l never thoughtl'd have nothing up here.","Paper Moon"
"1063",2851099,2854000,"You're going to have themup there, too.","Paper Moon"
"1064",2854099,2855599,"Look, l'll tell you what.","Paper Moon"
"1065",2855699,2857500,"Want me to show youhow to use cosmetics?","Paper Moon"
"1066",2857500,2860400,"Look, l'll let you put onmy earrings.","Paper Moon"
"1067",2860400,2862699,"You can see how prettyyou're going to be.","Paper Moon"
"1068",2862699,2865800,"And l'll show you howto make up your eyes.","Paper Moon"
"1069",2865800,2867000,"And your lips.","Paper Moon"
"1070",2867099,2870300,"And l'll see to it you geta little bra or something.","Paper Moon"
"1071",2870300,2872500,"But right now you're goingto pick your little ass up,","Paper Moon"
"1072",2872599,2874199,"you're going to drop itin the backseat","Paper Moon"
"1073",2874199,2876500,"and you're going to cut outthe crap, you understand?","Paper Moon"
"1074",2888500,2891099,"You're going to ruin it,ain't you?","Paper Moon"
"1075",2891199,2893699,"Look, l don't wantto wipe you out,","Paper Moon"
"1076",2893699,2896800,"and l don't want youwiping me out, you know?","Paper Moon"
"1077",2896800,2899400,"So l'm goingto level with you, okay?","Paper Moon"
"1078",2899500,2903000,"Now, you see, with me,it's just a matter of time.","Paper Moon"
"1079",2903099,2905099,"l don't know why, but somehow","Paper Moon"
"1080",2905199,2907900,"l just don't manageto hold on real long.","Paper Moon"
"1081",2908000,2911800,"So, if you wait it out a little,it'll be over, you know?","Paper Moon"
"1082",2911800,2914800,"l mean, even if l want a fella,","Paper Moon"
"1083",2914800,2918500,"somehow or other l manageto get it screwed up.","Paper Moon"
"1084",2918500,2923800,"Maybe l'll get a new pair ofshoes, nice dress, a few laughs.","Paper Moon"
"1085",2923800,2926099,"Times are hard.","Paper Moon"
"1086",2926199,2929900,"Now, if you fool aroundon the hill up here,","Paper Moon"
"1087",2929900,2932300,"then you don't get nothing,","Paper Moon"
"1088",2932400,2935300,"l don't get nothing,he don't get nothing.","Paper Moon"
"1089",2935400,2938400,"So how 'bout it, honey?","Paper Moon"
"1090",2938500,2940300,"Just for a little while,","Paper Moon"
"1091",2940300,2944800,"let old Trixie sit up frontwith her big tits.","Paper Moon"
"1092",2955099,2957500,"Hey, come on.","Paper Moon"
"1093",2959599,2961400,"We're coming, baby doll.","Paper Moon"
"1094",2961500,2964199,"And if you don't find mesome old gas station soon,","Paper Moon"
"1095",2964199,2967199,"this little old snowflake'sgoing to wet her pantaloons.","Paper Moon"
"1096",2969099,2971800,"Oh, my, l almost fell down.","Paper Moon"
"1097",2979900,2981099,"Yoo-hoo!","Paper Moon"
"1098",2981099,2982400,"Look what we got!","Paper Moon"
"1099",2982400,2984300,"Ain't she the sweetestlittle thing,","Paper Moon"
"1100",2984300,2986699,"and don't he looklike a prince on that wheel?","Paper Moon"
"1101",2986800,2987900,"Now, come on, lmogene.","Paper Moon"
"1102",2987900,2989099,"Now, get everything in here.","Paper Moon"
"1103",2989099,2991099,"We got more room thanthe whole state of Kansas.","Paper Moon"
"1104",2991199,2992300,"And listen to the horn.","Paper Moon"
"1105",2992300,2993300,"Blow the horn, Daddy.","Paper Moon"
"1106",2995300,2998099,"Oh, go ahead.","Paper Moon"
"1107",2998199,2999300,"Do it again.","Paper Moon"
"1108",3003400,3005300,"Sticks his tongueinto the water,","Paper Moon"
"1109",3005300,3007599,"and there's an alligatorin the river...","Paper Moon"
"1110",3010500,3011800,"Very funny.","Paper Moon"
"1111",3014500,3016000,"This girl's sittingon the trolley,","Paper Moon"
"1112",3016000,3017099,"and she reaches in her bag,","Paper Moon"
"1113",3017199,3018599,"and she takes outthis magazine,","Paper Moon"
"1114",3018599,3019699,"and she starts to read it.","Paper Moon"
"1115",3019800,3021800,"Well, she ain't read more thana couple of pages.","Paper Moon"
"1116",3021900,3024400,"And real slow and careful now,she takes her stockings down","Paper Moon"
"1117",3024500,3025400,"and takes off her shoes.","Paper Moon"
"1118",3026599,3028300,"Now, she turns the stockingswrong side out,","Paper Moon"
"1119",3028300,3029300,"and she puts them back on.","Paper Moon"
"1120",3029400,3030599,"And she puts her shoes back on.","Paper Moon"
"1121",3030599,3032099,"Well, all the passengersare watching.","Paper Moon"
"1122",3032099,3033099,"They wonder what's going on.","Paper Moon"
"1123",3033199,3034900,"This old guy,he-he leans over to her,","Paper Moon"
"1124",3035000,3036400,"and he asks her,he says, ""What's...?""","Paper Moon"
"1125",3036500,3038400,"""l saw you indulge in astrange procedure, ma'am.","Paper Moon"
"1126",3038400,3039400,"What-what were you doing?""","Paper Moon"
"1127",3039500,3040900,"And she said,""Well, l was reading","Paper Moon"
"1128",3041000,3042099,"""this here magazine, you know?","Paper Moon"
"1129",3042199,3043699,"""And l found it to besuch hot stuff","Paper Moon"
"1130",3043800,3045099,"""that l... well,l felt compelled","Paper Moon"
"1131",3045199,3046599,"to turn the hose on myself.""","Paper Moon"
"1132",3050400,3052599,"Oh, turn the hose on!","Paper Moon"
"1133",3052699,3054900,"When you said that, l...","Paper Moon"
"1134",3063000,3067300,"They wouldn't have a roomwith a canopy bed, would they?","Paper Moon"
"1135",3067300,3070599,"You wouldn't have a roomwith a canopy bed, would you?","Paper Moon"
"1136",3070699,3072000,"Uh, no.","Paper Moon"
"1137",3072099,3073400,"But l got one with a fireplace.","Paper Moon"
"1138",3073400,3075199,"Oh, l'd like that one, daddy.","Paper Moon"
"1139",3075300,3077599,"lt ain't no canopy bed,","Paper Moon"
"1140",3077599,3081800,"but it sure do open up a wholenew can of peas, don't it?","Paper Moon"
"1141",3081800,3083000,"Can of peas.","Paper Moon"
"1142",3084199,3085500,"Ain't that cute?","Paper Moon"
"1143",3085500,3086900,"- Huh? How's that?- Come on, lmogene.","Paper Moon"
"1144",3087000,3089300,"Now, help the boywith these things.","Paper Moon"
"1145",3089300,3093300,"Give them 234, 235, and 236.","Paper Moon"
"1146",3093300,3095099,"They're workingon the elevator right now,","Paper Moon"
"1147",3095199,3096500,"and it's the first flight up,","Paper Moon"
"1148",3096500,3097699,"if you don't mind.","Paper Moon"
"1149",3097699,3098800,"- lt's all right.- Thank you.","Paper Moon"
"1150",3098900,3100099,"- Thank you.- Can of peas.","Paper Moon"
"1151",3100199,3101500,"Yeah, what was that all about?","Paper Moon"
"1152",3101599,3102800,"- Did you hear that?- Can of peas.","Paper Moon"
"1153",3102900,3104400,"Well, you know,","Paper Moon"
"1154",3104400,3105900,"Canopy...can of pea...","Paper Moon"
"1155",3105900,3107300,"They rhyme, you know?","Paper Moon"
"1156",3107400,3108800,"Oh, l see... can of peas,","Paper Moon"
"1157",3108900,3110000,"- canopy!- Yeah.","Paper Moon"
"1158",3110000,3111199,"Oh, l get it now.","Paper Moon"
"1159",3113099,3116000,"l knew you'd get itif l explained it to you.","Paper Moon"
"1160",3116000,3119500,"Picture Henry Fordwithout a car","Paper Moon"
"1161",3119500,3123500,"Picture heaven's firmamentwithout a star","Paper Moon"
"1162",3123599,3127699,"Picture Grigsby Chryslerwithout a fiddle","Paper Moon"
"1163",3127800,3131900,"Picture poor Philadelphiawithout a Biddle","Paper Moon"
