"id","startTime","endTime","text","title"
"1566",4372899,4375399,"Who could it be?","Paper Moon"
"1567",4375399,4376699,"Christ!","Paper Moon"
"1568",4384899,4386199,"Don't stop, keep going!","Paper Moon"
"1569",4386199,4387300,"l can't keep going.","Paper Moon"
"1570",4387300,4388800,"The damn car's in front of me.","Paper Moon"
"1571",4388800,4390199,"Everything's going to beall right.","Paper Moon"
"1572",4390300,4391500,"You just let me do the talking.","Paper Moon"
"1573",4399199,4401300,"You playin' games with us,Mister?","Paper Moon"
"1574",4401399,4402600,"Oh, l-l didn't knowwho was back there.","Paper Moon"
"1575",4402699,4403800,"lt's a risky thing to do.","Paper Moon"
"1576",4403899,4405800,"Might get your tires shot off.","Paper Moon"
"1577",4405899,4407100,"Where you headin'?","Paper Moon"
"1578",4407100,4409500,"Me and my little girlare going to Saint Jo.","Paper Moon"
"1579",4409500,4410500,"Oh. Live there?","Paper Moon"
"1580",4410500,4411600,"Nearby.","Paper Moon"
"1581",4413699,4416000,"What's your business?","Paper Moon"
"1582",4416000,4417600,"Uh, livestock, mostly...mules and horses.","Paper Moon"
"1583",4417600,4418600,"Some cattle.","Paper Moon"
"1584",4418600,4420300,"That's funny.","Paper Moon"
"1585",4420399,4422500,"l heard you was a bootlegger.","Paper Moon"
"1586",4422500,4423800,"Oh, no, sir, not me, friend.","Paper Moon"
"1587",4423899,4425199,"Must be some mistake.","Paper Moon"
"1588",4425199,4427000,"Maybe.","Paper Moon"
"1589",4427000,4429199,"Maybe not.","Paper Moon"
"1590",4435600,4439399,"The way l hear it...","Paper Moon"
"1591",4439500,4442100,"you just had a transactionby the old barn.","Paper Moon"
"1592",4442100,4444000,"Where'd you heara thing like that?","Paper Moon"
"1593",4444100,4445899,"Oh, a... friend of the family.","Paper Moon"
"1594",4445899,4447399,"No, l'm sorry.","Paper Moon"
"1595",4447399,4449899,"l-l don't know whatyou're talking about.","Paper Moon"
"1596",4450000,4451100,"l'm talkin' about bootleggin'.","Paper Moon"
"1597",4451100,4454000,"l'm talkin' about $625.","Paper Moon"
"1598",4454000,4455399,"Now, just where might that be?","Paper Moon"
"1599",4455500,4456600,"l don't have no $625.","Paper Moon"
"1600",4456600,4458699,"l-l don't know whatyou're talking about.","Paper Moon"
"1601",4458800,4460899,"l don't even know wherethe old barn is.","Paper Moon"
"1602",4460899,4464100,"Well...","Paper Moon"
"1603",4464199,4465899,"l reckon we'll justhave to explain","Paper Moon"
"1604",4466000,4467800,"a little morethoroughly, won't we?","Paper Moon"
"1605",4467800,4468800,"Come on, Beau,","Paper Moon"
"1606",4468800,4470899,"you take a ride withthese nice people.","Paper Moon"
"1607",4470899,4471899,"Love to.","Paper Moon"
"1608",4471899,4473399,"We're all goin' back to town.","Paper Moon"
"1609",4485399,4486600,"Hmm.","Paper Moon"
"1610",4486699,4489100,"Damn.","Paper Moon"
"1611",4489199,4492000,"Just when you thinkyou got it made...","Paper Moon"
"1612",4492000,4494800,"just ain't made, is it?","Paper Moon"
"1613",4496100,4498000,"You pretty good atthis little thing?","Paper Moon"
"1614",4498000,4499300,"Not too good.","Paper Moon"
"1615",4499399,4500899,"Not too good, huh?","Paper Moon"
"1616",4501000,4504100,"Old bootlegger's sittin' therewith his own little game,","Paper Moon"
"1617",4504100,4507199,"and he ain't even goodat his own game.","Paper Moon"
"1618",4508600,4510399,"Yes, sir,that is some good joke.","Paper Moon"
"1619",4515500,4518100,"l found these on the front seat.","Paper Moon"
"1620",4518100,4519399,"Wasn't any money in the car.","Paper Moon"
"1621",4519600,4521800,"Went all through it,inside and out.","Paper Moon"
"1622",4521800,4524199,"Livestock business, huh?","Paper Moon"
"1623",4524300,4526899,"That w-whiskey's for a friend.","Paper Moon"
"1624",4526899,4529600,"Hold out your hands.","Paper Moon"
"1625",4529600,4530800,"Huh?","Paper Moon"
"1626",4530800,4531899,"l said, hold out your hands.","Paper Moon"
"1627",4532000,4533500,"You heard me.","Paper Moon"
"1628",4542199,4545000,"l didn't say put 'em down,did l?","Paper Moon"
"1629",4546600,4548199,"Mighty clean handsfor livestock.","Paper Moon"
"1630",4548199,4550800,"Them hands don't look likethey do nothin' in life","Paper Moon"
"1631",4550800,4553300,"except play a little casinoevery now and then.","Paper Moon"
"1632",4553399,4554600,"l told you,that whiskey's for a friend.","Paper Moon"
"1633",4554600,4555800,"l didn't see no harm in buyinga couple of bottles...","Paper Moon"
"1634",4555800,4556800,"Didn't see no harm?","Paper Moon"
"1635",4556800,4558600,"Hear that, Beau?","Paper Moon"
"1636",4558600,4561199,"Big bootlegger claimshe don't know the law.","Paper Moon"
"1637",4561300,4562500,"Well, Mr. Bootlegger,","Paper Moon"
"1638",4562600,4564500,"l don't needno couple of bottles","Paper Moon"
"1639",4564600,4566199,"to make a case against you.","Paper Moon"
"1640",4566300,4569199,"Law says all l need is justone little ol' drop.","Paper Moon"
"1641",4569199,4571000,"And law saysyou use a vehicle","Paper Moon"
"1642",4571100,4573000,"to transportalcoholic beverages,","Paper Moon"
"1643",4573000,4574899,"and said vehicleis confiscated","Paper Moon"
"1644",4574899,4577000,"to be soldat public auctions, so...","Paper Moon"
"1645",4577100,4578199,"you can just kiss","Paper Moon"
"1646",4578300,4580300,"that pretty little ol' carof yours good-bye.","Paper Moon"
"1647",4580300,4582300,"Hey, hold on! That seemspretty rough just because...","Paper Moon"
"1648",4582399,4583500,"Don't lower your hands.","Paper Moon"
"1649",4583600,4584800,"l didn't tell you tolower your hands.","Paper Moon"
"1650",4584899,4587100,"l tell you to lower your hands,then you lower your hands.","Paper Moon"
"1651",4587100,4588699,"You don't do nothin'until l tell you to.","Paper Moon"
"1652",4588800,4589899,"Understand?","Paper Moon"
"1653",4589899,4591300,"Answer me.You understand?","Paper Moon"
"1654",4591300,4594399,"Yes, sir.","Paper Moon"
"1655",4599600,4600899,"Ah, l already done that.","Paper Moon"
"1656",4600899,4602899,"Ain't nothin' in hisclothes 'cept him.","Paper Moon"
"1657",4602899,4605699,"He ain't worth five cents.","Paper Moon"
"1658",4605800,4608500,"No, she ain't gotnothin' on her, either.","Paper Moon"
"1659",4608500,4610100,"You don't know what kind","Paper Moon"
"1660",4610100,4612100,"of real badtrouble you're in.","Paper Moon"
"1661",4612100,4614199,"You better startthinking on it.","Paper Moon"
"1662",4614300,4615300,"l've got a case against you","Paper Moon"
"1663",4615399,4617100,"for possession andtransportin' whiskey,","Paper Moon"
"1664",4617100,4618300,"and l reckon if l try,","Paper Moon"
"1665",4618300,4619800,"l can thinkof a few other things.","Paper Moon"
"1666",4621500,4623100,"Better face it,you're going to be","Paper Moon"
"1667",4623199,4624800,"up in these partsfor quite a while,","Paper Moon"
"1668",4624800,4626500,"working on the county roads.","Paper Moon"
"1669",4626600,4629300,"Maybe you're lucky,you get out in six months.","Paper Moon"
"1670",4629399,4631699,"Six more months...influencing a child...","Paper Moon"
"1671",4631699,4633300,"maybe get six years for that.","Paper Moon"
"1672",4633399,4635300,"M-Maybe we could worksomething out.","Paper Moon"
"1673",4635399,4637399,"What's there to work out?","Paper Moon"
"1674",4637399,4641199,"...while l rustle one up,","Paper Moon"
"1675",4641199,4642500,"you all listento this little goodie","Paper Moon"
"1676",4642500,4644000,"from a couple of years ago...","Paper Moon"
"1677",4646699,4649100,"Ah, l sure don't liketo send a man","Paper Moon"
"1678",4649100,4650399,"to a road gang.Never have.","Paper Moon"
"1679",4650399,4653199,"Always felt sorryfor them poor devils.","Paper Moon"
"1680",4653199,4657199,"But l can't overlook the factthat you've been paid $625,","Paper Moon"
"1681",4657199,4659800,"and you ain't tellin' mewhere it is.","Paper Moon"
"1682",4659899,4661199,"Now, l knowyou're a bootlegger,","Paper Moon"
"1683",4661199,4662699,"so what's there for meto work out?","Paper Moon"
"1684",4664800,4665899,"All right.","Paper Moon"
"1685",4665899,4667899,"Let's cut thisring-around-the-rosy.","Paper Moon"
"1686",4667899,4669399,"Where's that... money?","Paper Moon"
"1687",4688199,4691899,"You think l'm foolin' around?","Paper Moon"
"1688",4691899,4694000,"l ain't foolin' around.","Paper Moon"
"1689",4702199,4703399,"Maybe you'll come around","Paper Moon"
"1690",4703399,4704699,"in time.","Paper Moon"
"1691",4704800,4707000,"Get a little thirstyand get a little hungry.","Paper Moon"
"1692",4707100,4709100,"Time sure does havea way with criminals,","Paper Moon"
"1693",4709100,4710199,"don't it, Beau?","Paper Moon"
"1694",4710300,4711399,"Sure do.","Paper Moon"
"1695",4711399,4712800,"Well, it's gettin'on to 5:00.","Paper Moon"
"1696",4712800,4715100,"Somebody ought to bestirring over at the cafe.","Paper Moon"
"1697",4715100,4716899,"l think l'll stepover there a while.","Paper Moon"
"1698",4716899,4719100,"See if that friend of the familyis there.","Paper Moon"
"1699",4719100,4720399,"l'll be on back 'fore long.","Paper Moon"
"1700",4720399,4721600,"l got all day, you know?","Paper Moon"
"1701",4721600,4723199,"l got all the time in the world.","Paper Moon"
"1702",4723300,4724899,"...let's haveanother piece of pie","Paper Moon"
"1703",4725000,4728600,"Trouble's just a bubble","Paper Moon"
"1704",4728600,4730100,"And the clouds will soon roll by","Paper Moon"
"1705",4730199,4733199,"So let's haveanother cup of coffee","Paper Moon"
"1706",4733199,4735100,"And let's haveanother piece of pie","Paper Moon"
"1707",4735100,4737699,"Let a smile be your umbrella","Paper Moon"
"1708",4737800,4740300,"For it's justan April shower","Paper Moon"
"1709",4740399,4742699,"Even John D. Rockefeller...","Paper Moon"
"1710",4742699,4746100,"Sir, may l get my things,please?","Paper Moon"
"1711",4746100,4748000,"Mr. Herbert Hoover saysthat now's the time to buy","Paper Moon"
"1712",4748000,4749000,"Okay.","Paper Moon"
"1713",4749100,4752300,"So let's haveanother cup of coffee","Paper Moon"
"1714",4752399,4755100,"And let's haveanother piece of pie.","Paper Moon"
"1715",4793800,4795100,"Daddy...","Paper Moon"
"1716",4795100,4797500,"l need to go to the shithouse.","Paper Moon"
"1717",4800500,4804399,"Well, uh, there's a placedown the hall.","Paper Moon"
"1718",4804500,4806100,"Daddy, l'm scared.","Paper Moon"
"1719",4806199,4809100,"l want youto come stand by the door.","Paper Moon"
"1720",4809100,4811300,"All right if l go with her?","Paper Moon"
"1721",4821699,4823399,"Down there.","Paper Moon"
"1722",4831899,4833199,"Run!","Paper Moon"
"1723",4833199,4834500,"You crazy?!","Paper Moon"
"1724",4834600,4835899,"Hey!","Paper Moon"
"1725",4836000,4837399,"Where are we running?","Paper Moon"
"1726",4837399,4838500,"Oh, my God.","Paper Moon"
"1727",4838600,4839699,"Stop them people!","Paper Moon"
"1728",4839699,4842899,"Hey, there'sbootleggers...!","Paper Moon"
"1729",4842899,4845399,"Jesus Christ,this is the craziest...","Paper Moon"
"1730",4845399,4846500,"Hurry!","Paper Moon"
"1731",4846600,4847699,"l'm hurryin'!","Paper Moon"
"1732",4858100,4859300,"Stop!","Paper Moon"
"1733",4859300,4860899,"Oh, Jesus!","Paper Moon"
"1734",4864300,4867600,"- l'm going to hit him!- Make him jump! Don't slow down!","Paper Moon"
"1735",4869699,4870600,"l could have killed him!","Paper Moon"
"1736",4870699,4872000,"They're going to have me upfor murder!","Paper Moon"
"1737",4873100,4874600,"They're shooting at us!","Paper Moon"
"1738",4874699,4876300,"- But they're missin'!- Keep going!","Paper Moon"
"1739",4885199,4886300,"We ain't gonna make it.","Paper Moon"
"1740",4886399,4887399,"Yes, we will.","Paper Moon"
"1741",4887399,4888399,"Not in this car, we ain't.","Paper Moon"
"1742",4888399,4889500,"Every two-bit lawman in Kansas","Paper Moon"
"1743",4889600,4891000,"is going to be lookingfor this car.","Paper Moon"
"1744",4891000,4892699,"We got to get acrossthe river to Missouri.","Paper Moon"
"1745",4892699,4894000,"Where's the bridge?","Paper Moon"
"1746",4894000,4895000,"Oh, Jesus!","Paper Moon"
"1747",4895000,4896300,"What's the matter?","Paper Moon"
"1748",4896399,4897699,"Damn bridge is the other way!","Paper Moon"
"1749",4897699,4899000,"- What?!- Hang on.","Paper Moon"
"1750",4924399,4925399,"Ah, this ain't no good.","Paper Moon"
"1751",4925399,4927300,"We're gonna make ittoo easy for 'em.","Paper Moon"
"1752",4927399,4929300,"We got to get off this road.Hang on!","Paper Moon"
"1753",4934300,4936699,"Holy smoke!","Paper Moon"
"1754",4936800,4938899,"Blow your horn!","Paper Moon"
"1755",4938899,4939899,"Won't do no good.","Paper Moon"
"1756",4939899,4941300,"He can't pull off the road.","Paper Moon"
"1757",4941300,4942600,"Ain't we got all the luck,","Paper Moon"
"1758",4942699,4944600,"selling whiskey toa sheriff's brother?!","Paper Moon"
"1759",4950800,4952199,"Hang onto your hat.","Paper Moon"
"1760",4952300,4953300,"- What?- Hold on, l said.","Paper Moon"
"1761",4953399,4954399,"Oh, God.","Paper Moon"
"1762",4965300,4967000,"You all right?","Paper Moon"
"1763",4967100,4968300,"Uh-huh.","Paper Moon"
"1764",4968300,4970000,"Okay, we threw a hobbleon 'em for a while,","Paper Moon"
"1765",4970000,4971199,"but we got to get off this road,","Paper Moon"
"1766",4971300,4973000,"or we're going to end upin a town for sure.","Paper Moon"
"1767",4973100,4974699,"And take that moneyout of there.","Paper Moon"
"1768",4974800,4976500,"You liked to giveme heart failure.","Paper Moon"
"1769",4976600,4978899,"We made it, didn't we?!","Paper Moon"
"1770",5032500,5034500,"Anybody 'thome?","Paper Moon"
"1771",5042000,5043800,"Howdy.","Paper Moon"
"1772",5043899,5046600,"Need to get rid of my car here.","Paper Moon"
"1773",5048699,5051300,"l need to get rid of my car!","Paper Moon"
"1774",5051300,5053500,"Sheriff wants to take awaymy little girl,","Paper Moon"
"1775",5053500,5054899,"put her in an orphanage.","Paper Moon"
"1776",5057399,5059399,"You know anybodywho might want to swap?","Paper Moon"
"1777",5061399,5064199,"How about that truck over there?","Paper Moon"
"1778",5071899,5074300,"Well, we'll just let himchew on it a while.","Paper Moon"
"1779",5078100,5081399,"Well, the rear tireslook new, anyway.","Paper Moon"
"1780",5096000,5097100,"The radio looks okay.","Paper Moon"
"1781",5097199,5098500,"Think this thing runs?","Paper Moon"
"1782",5098500,5101399,"lt better... we got to havesome way of traveling.","Paper Moon"
"1783",5101399,5102600,"Where we going to go?","Paper Moon"
"1784",5102600,5105800,"Out of Kansas, across the riverto Saint Jo, that's where.","Paper Moon"
"1785",5107899,5109100,"Here he comes.","Paper Moon"
"1786",5115600,5117600,"Look at 'em all.","Paper Moon"
"1787",5133699,5136300,"All l'm looking for is a swapand three days' head start","Paper Moon"
"1788",5136399,5138100,"before you take it outon the highway.","Paper Moon"
"1789",5141899,5143100,"lt's all legal.","Paper Moon"
"1790",5143199,5144500,"Got the papers right hereto prove it.","Paper Moon"
"1791",5144600,5146699,"Just have to fill out that formon the back, and you own it.","Paper Moon"
"1792",5151000,5153199,"Ain't gonna swap.","Paper Moon"
"1793",5154600,5155699,"Well, it's brand-new.","Paper Moon"
"1794",5155699,5158100,"That car ain't no good.","Paper Moon"
"1795",5158199,5159500,"What's the matter with it?","Paper Moon"
"1796",5159500,5162199,"Can't haul nothing in it.","Paper Moon"
"1797",5162300,5163899,"Oh, well, if that's allthat's bothering you,","Paper Moon"
"1798",5163899,5165000,"you can sell the car","Paper Moon"
"1799",5165100,5166699,"and get two truckst'do your hauling in.","Paper Moon"
"1800",5166800,5169600,"l ain't gonna swap.","Paper Moon"
"1801",5169600,5171000,"Wrassle you for it.","Paper Moon"
"1802",5172600,5173899,"- Are you crazy?- lf l win, we swap.","Paper Moon"
"1803",5174000,5176100,"You win, you can keep the carand the truck both.","Paper Moon"
"1804",5176100,5177100,"- Moze...- Quiet down.","Paper Moon"
"1805",5177100,5178699,"What kind of wrassling?","Paper Moon"
"1806",5178800,5179600,"You name it.","Paper Moon"
"1807",5179600,5181399,"Catch as can?","Paper Moon"
"1808",5181399,5182600,"Shoes or barefoot?","Paper Moon"
"1809",5183899,5185600,"Makes no nevermind to me.","Paper Moon"
"1810",5186699,5188300,"Barefoot.","Paper Moon"
"1811",5197199,5200199,"You're gonna get killedjust to give something away.","Paper Moon"
"1812",5200199,5202199,"l ain't got no choice.","Paper Moon"
"1813",5203000,5205600,"Get that city boy.","Paper Moon"
"1814",5205600,5207500,"Get the city boy.","Paper Moon"
"1815",5211800,5213300,"Let's go.","Paper Moon"
"1816",5213300,5215100,"Make him say ""calf rope,"" Leroy.","Paper Moon"
"1817",5219300,5220399,"Come on, Leroy.","Paper Moon"
"1818",5220399,5223800,"Get him, Leroy. Get him!","Paper Moon"
"1819",5226899,5228600,"That ain't fair!You stop that!","Paper Moon"
"1820",5228699,5230100,"You make him fight fair!","Paper Moon"
"1821",5230100,5232300,"Look out for that rake, Leroy.","Paper Moon"
"1822",5233000,5234500,"Watch out, Leroy.","Paper Moon"
"1823",5234600,5236899,"Let's go in the car. Come on!","Paper Moon"
"1824",5237000,5238899,"Yee-haw!","Paper Moon"
"1825",5256300,5257600,"Are you pushing?!","Paper Moon"
"1826",5257699,5259399,"Of course l'm pushing!","Paper Moon"
"1827",5263000,5264600,"Okay, it'll go now.","Paper Moon"
"1828",5264600,5267000,"Put your foot on the brake.","Paper Moon"
"1829",5268399,5270399,"The brake! The brake!","Paper Moon"
"1830",5270399,5272899,"lt don't work!","Paper Moon"
"1831",5275199,5277000,"The brake, goddamn it!","Paper Moon"
"1832",5277000,5278899,"The brake!","Paper Moon"
"1833",5298399,5300699,"Don't you even knowwhere the damn brake is?","Paper Moon"
"1834",5300699,5302399,"lt don't work.","Paper Moon"
"1835",5302399,5305600,"Oh. Well, it figures.","Paper Moon"
"1836",5307300,5308699,"Well, we're in Missouri anyway.","Paper Moon"
"1837",5308699,5311199,"What'll we do now,drop some 20s?","Paper Moon"
"1838",5312699,5314699,"How much money we got?","Paper Moon"
"1839",5314899,5317399,"837 and some change.","Paper Moon"
"1840",5317399,5319100,"42 cents, l think.","Paper Moon"
"1841",5319199,5321199,"Well, we're just outsideof St. Jo, ain't we?","Paper Moon"
"1842",5321300,5324000,"So what?","Paper Moon"
"1843",5324000,5326699,"So... it's a big town,ain't it?","Paper Moon"
"1844",5326699,5329000,"We can do better than 20s.","Paper Moon"
"1845",5333300,5334500,"Y'all know that one...","Paper Moon"
"1846",5334600,5335800,"""Let's haveanother cup of coffee,","Paper Moon"
"1847",5335899,5337100,"let's haveanother piece of pie.""","Paper Moon"
"1848",5337100,5339399,"Well, it's 10:30,and it's Sunday morning","Paper Moon"
"1849",5339399,5342100,"in St. Jo, and y'all getto church now, okay?","Paper Moon"
"1850",5342100,5343699,"Here's the news...","Paper Moon"
"1851",5345800,5347699,"- Moze?- Yeah?","Paper Moon"
"1852",5347699,5349300,"What if that old mandon't believe ya?","Paper Moon"
"1853",5349399,5350500,"He'll believe me, all right.","Paper Moon"
"1854",5350500,5352300,"He's in the marketfor making a killing,","Paper Moon"
"1855",5352399,5353300,"just like we are.","Paper Moon"
"1856",5353399,5355000,"Maybe he don't even havea silver mine.","Paper Moon"
"1857",5355000,5356699,"l had him checked outreal thorough.","Paper Moon"
"1858",5356699,5357699,"Where's the money?","Paper Moon"
"1859",5357699,5359300,"And he's just whatpeople say he is...","Paper Moon"
"1860",5359399,5360699,"rich and greedy.","Paper Moon"
"1861",5360699,5364500,"The independent candidatefor Senate this year...","Paper Moon"
"1862",5364500,5365800,"Pull up your socks.","Paper Moon"
"1863",5365899,5367300,"Moze, if we get a silver mine,","Paper Moon"
"1864",5367300,5369699,"we could get a houseand everything, couldn't we?","Paper Moon"
"1865",5369699,5372300,"Everything,just... everything.","Paper Moon"
"1866",5372399,5375100,"Just around the corner,there's a rainbow in the sky","Paper Moon"
"1867",5375100,5376899,"So let's haveanother cup of coffee...","Paper Moon"
"1868",5377000,5378199,"Okay, you gotit straight?","Paper Moon"
"1869",5378199,5380000,"Corner of East Warringand Burlington.","Paper Moon"
"1870",5380100,5382399,"11:00. Just show therewith tears in your eyes.","Paper Moon"
"1871",5382399,5385199,"- That's all.- Moze, don't forget the money.","Paper Moon"
"1872",5385300,5388800,"Of course l won't forgetthe money.","Paper Moon"
"1873",5388899,5390199,"l'll see you in 30 minutes.","Paper Moon"
"1874",5390199,5392300,"Moze, could we get a piano, too?","Paper Moon"
"1875",5392399,5393699,"A piano?","Paper Moon"
"1876",5393699,5395100,"We'll have a whole factory.","Paper Moon"
"1877",5399199,5402000,"Just around the corner","Paper Moon"
"1878",5402100,5404100,"There's a rainbow in the sky.","Paper Moon"
"1879",5404199,5406500,"...conservationof natural resources.","Paper Moon"
"1880",5430800,5435100,"l guess you just didn't makea good enough swap.","Paper Moon"
"1881",5435100,5437899,"My brother's real sore at ya.","Paper Moon"
"1882",5438000,5440899,"Seems you sold himsome of his own whiskey.","Paper Moon"
"1883",5440899,5443600,"You can't arrest me now.We're in Missouri.","Paper Moon"
"1884",5443699,5446000,"And your damn brother'sa bootlegger!","Paper Moon"
"1885",5446100,5450399,"You got an awful big mouth,mister.","Paper Moon"
"1886",5450500,5452699,"Maybe l can't arrest youin Missouri,","Paper Moon"
"1887",5452800,5454600,"and maybe l don't want to.","Paper Moon"
"1888",5454600,5455899,"But l sure can make sure","Paper Moon"
"1889",5456000,5459100,"that you ain't gonna feelreal good while you're here.","Paper Moon"
"1890",5465500,5466899,"Let's go!","Paper Moon"
"1891",5570100,5572399,"Addie...","Paper Moon"
"1892",5582300,5584100,"Addie...","Paper Moon"
"1893",5590000,5591899,"Moze.","Paper Moon"
"1894",5591899,5594100,"Moze...","Paper Moon"
"1895",5594100,5595100,"l sw...","Paper Moon"
"1896",5595100,5597399,"l swallowed my gold tooth.","Paper Moon"
"1897",5597399,5598399,"Aw, Moze.","Paper Moon"
"1898",5598399,5599500,"They took it all.","Paper Moon"
"1899",5599500,5600899,"Oh, Moze, you'reall beat up.","Paper Moon"
"1900",5600899,5602000,"Ain't nothing left.","Paper Moon"
"1901",5602100,5603199,"Don't worry none.","Paper Moon"
"1902",5603199,5605199,"l've been keeping tendollars for emergencies.","Paper Moon"
"1903",5605199,5606500,"Ten dollars?","Paper Moon"
"1904",5606600,5608199,"What the hell we dowith ten dollars?","Paper Moon"
"1905",5608300,5609600,"We could buy some Bibles,","Paper Moon"
"1906",5609699,5611199,"do a little widow business.","Paper Moon"
"1907",5611300,5614100,"Must be lots of goodtowns around here.","Paper Moon"
"1908",5614100,5616699,"Do some 20s, dropsome wallets...","Paper Moon"
"1909",5616699,5619300,"before you know it,we'll be real good again.","Paper Moon"
"1910",5619300,5620500,"l'll bet in no time","Paper Moon"
"1911",5620600,5623100,"we could have a wholenew car and everything.","Paper Moon"
"1912",5631199,5636000,"You're going to take meto Aunt Billie's now, ain't ya?","Paper Moon"
"1913",5638600,5640800,"- Aw, Moze...- Don't start crying.","Paper Moon"
"1914",5640800,5641800,"l won't.","Paper Moon"
"1915",5641800,5645100,"That's where we set out for,ain't it?","Paper Moon"
"1916",5660600,5661600,"Looks nice.","Paper Moon"
"1917",5661699,5664000,"Yeah, it looks real fine.","Paper Moon"
"1918",5668000,5669899,"That must beyour uncle Daniel.","Paper Moon"
"1919",5669899,5671699,"He looks nice, too, don't he?","Paper Moon"
"1920",5671800,5673500,"Yup. Real nice.","Paper Moon"
"1921",5676300,5677800,"Maybe ifFrank D. Roosevelt comes,","Paper Moon"
"1922",5677899,5680199,"he'll tell him to take meto the station to see him.","Paper Moon"
"1923",5680300,5681399,"Maybe you write, ol' Frankie'll","Paper Moon"
"1924",5681500,5682899,"have a place to write youback now.","Paper Moon"
"1925",5683000,5684300,"Yeah, he might, at that.","Paper Moon"
"1926",5684300,5685300,"'Course he will.","Paper Moon"
"1927",5685300,5687100,"Ain't no question but he will.","Paper Moon"
"1928",5689100,5691300,"All this talk's justwasting time.","Paper Moon"
"1929",5706399,5707399,"Here's your...","Paper Moon"
"1930",5707500,5709800,"here, your skates,your radio.","Paper Moon"
"1931",5709800,5711000,"Where you gonna go?","Paper Moon"
"1932",5711000,5712699,"Don't worry about me.l got plans.","Paper Moon"
"1933",5712800,5714500,"New ideas coming in every day.","Paper Moon"
"1934",5714500,5715600,"Get going.","Paper Moon"
"1935",5718500,5722300,"You know, if l knew for sureyou wasn't my pa...","Paper Moon"
"1936",5724300,5726699,"lt's for sure l ain't your pa.","Paper Moon"
"1937",5726699,5728300,"Although sometimesl used to figure","Paper Moon"
"1938",5728399,5730300,"Mr. Connorscould have been my pa,","Paper Moon"
"1939",5730399,5732199,"the way he touched my shoulder,","Paper Moon"
"1940",5732300,5735600,"get me thingsfrom the candy counter for free.","Paper Moon"
"1941",5735600,5739199,"And Mr. Pritchard,he smiled at me once real nice,","Paper Moon"
"1942",5739199,5742699,"except they don't have my jawor nothing.","Paper Moon"
"1943",5744500,5746600,"So long.","Paper Moon"
"1944",5746699,5749000,"Ain't you comingto the door with me?","Paper Moon"
"1945",5749000,5750500,"There it is, right there.","Paper Moon"
"1946",5750500,5753000,"How much closeram l supposed to bring you?","Paper Moon"
"1947",5753000,5754899,"They'll wonder how l got here.","Paper Moon"
"1948",5754899,5756699,"Tell 'em a family friendbrung you,","Paper Moon"
"1949",5756699,5759000,"and you-you hada little trouble on the way","Paper Moon"
"1950",5759000,5760399,"with your car and with finances.","Paper Moon"
"1951",5760500,5762800,"Now, get going.","Paper Moon"
"1952",5804800,5806800,"Yes?","Paper Moon"
"1953",5806800,5810500,"Yes?","Paper Moon"
"1954",5810600,5812500,"l'm Addie.","Paper Moon"
"1955",5812600,5814600,"Addie?","Paper Moon"
