"id","startTime","endTime","text","title"
"707",3405608,3406858,"Come with me.","Pixels"
"708",3408608,3411733,"Greenhorns, tell them what you saw.","Pixels"
"709",3413108,3417150,"It was horrible.It was like a monster movie.","Pixels"
"710",3417358,3419942,"But this time was the monster genuine.","Pixels"
"711",3420150,3423442,"And what was it a monster?","Pixels"
"712",3423567,3426692,"Pac-Man.- Pac-Man? How! It is totally me.","Pixels"
"713",3426942,3430233,"Find some lyskanoner so we canBlow him back into space.","Pixels"
"714",3430442,3434317,"No, lyskanoner not kill Pac-Man.It makes those small ghosts.","Pixels"
"715",3434442,3436733,"So let's grab some ghosts.","Pixels"
"716",3436942,3440483,"You want ghosts?- She has ghosts.","Pixels"
"717",3450400,3453400,"We used the force field technologyFrom The Cube -","Pixels"
"718",3453483,3457233,"- And put mini-power fieldsin the cars here. Ghosts.","Pixels"
"719",3457442,3460733,"We call them XM950 attacks modules.","Pixels"
"720",3461150,3464983,"And we call them mini-ghosts,for what we can not remember.","Pixels"
"721",3465349,3468016,"Why are there four cars?We are only three.","Pixels"
"722",3468182,3471599,"This is Professor Toru Iwatani.","Pixels"
"723",3474141,3476766,"The creator of Pac-Man.","Pixels"
"724",3490932,3493766,"Can you Japanese?- No.","Pixels"
"725",3494932,3500016,"What honor. Thanks for all the joy,They have given us. Fat.","Pixels"
"726",3501932,3504641,"I've done your gamemy little bitch boy.","Pixels"
"727",3507516,3512266,"What is a ... whore boy?- Just forget it. He is criminal.","Pixels"
"728",3517807,3519641,"Are you okay?- Yes.","Pixels"
"729",3519807,3523016,"If we assume,they play by the rules -","Pixels"
"730",3523182,3527016,"- We win if you hitPac-Man with the force field three times.","Pixels"
"731",3527349,3531141,"Ludlow's right. You smell good.","Pixels"
"732",3531349,3532849,"Good luck.","Pixels"
"733",3546557,3550641,"Gentlemen, I am sending Pac-Manposition your car GPSs.","Pixels"
"734",3550849,3552266,"Let us locate and eliminate.","Pixels"
"735",3554641,3555641,"Come on, guys.","Pixels"
"736",3575141,3577057,"Pac-Man is a villain?","Pixels"
"737",3582016,3584432,"Pac-Man is not a crook!","Pixels"
"738",3584641,3587891,"I created him,so he could bring joy to the world.","Pixels"
"739",3588141,3589349,"They have brainwashed him.","Pixels"
"740",3591766,3595641,"Deep down, he is kind and gentle.","Pixels"
"741",3596932,3600307,"One, you can say itsproblems or grab a burger with.","Pixels"
"742",3605641,3606932,"I'll see.","Pixels"
"743",3611266,3613432,"Professor Iwatani,Sit in the car again.","Pixels"
"744",3613641,3618016,"Professor Iwatani, what are you doing?- I speak with him. He is my son.","Pixels"
"745",3618182,3619557,"Never mind the idea.","Pixels"
"746",3627141,3628557,"Hi, -","Pixels"
"747",3629349,3631307,"- My sweet boy.","Pixels"
"748",3632182,3636599,"See how big you are.I am so proud of you.","Pixels"
"749",3637016,3639349,"How sweet. Where is he cute.","Pixels"
"750",3641307,3645016,"But all these destructiveactions, they are wrong.","Pixels"
"751",3646849,3648349,"I am your father.","Pixels"
"752",3651557,3654391,"I know that you are a good boy.","Pixels"
"753",3662141,3663182,"No!","Pixels"
"754",3665349,3668349,"Kill the lead whore boy!","Pixels"
"755",3669849,3674682,"It was a sick gamePinocchio Geppetto-shit.","Pixels"
"756",3677932,3682891,"Okay, losers.It's three against one. Give the bundgas.","Pixels"
"757",3712641,3715141,"Pac-Man is faster than I remember.","Pixels"
"758",3718057,3722641,"Pac-Man has always been faster thanghosts. We must outmaneuver him.","Pixels"
"759",3732016,3735349,"Wonderful Afro,you and Silver medal pulling outward.","Pixels"
"760",3736516,3738391,"I stick to him the yellow.","Pixels"
"761",3742592,3746717,"How did you do it so quickly?- I am the champion, Lieutenant Longshanks.","Pixels"
"762",3752717,3753467,"Nope!","Pixels"
"763",3755050,3755800,"So what?","Pixels"
"764",3759592,3761092,"How!","Pixels"
"765",3767132,3768132,"Good job, Eddie.","Pixels"
"766",3770342,3772550,"It was the first.- Two back.","Pixels"
"767",3778050,3782382,"Pac-Man number two has appeared fourblocks away. It is heading north.","Pixels"
"768",3782842,3785842,"Turn east at the next intersection.","Pixels"
"769",3786050,3788342,"Brenner, head straight.- Yep.","Pixels"
"770",3788507,3791132,"Ludlow, turn left.","Pixels"
"771",3791342,3794092,"Eddie, turn left next time.","Pixels"
"772",3795342,3798257,"We have him.He can not get away.","Pixels"
"773",3804007,3806050,"Oh god, no!","Pixels"
"774",3806257,3808717,"""Oh God, no""?- He ate power-tingling.","Pixels"
"775",3808842,3812132,"Pac-Man has ten seconds,where he can eat us.","Pixels"
"776",3814382,3815882,"Why me?","Pixels"
"777",3823592,3826967,"OG God! Do not eat me!Please do not eat me.","Pixels"
"778",3833550,3835550,"Help!","Pixels"
"779",3835717,3837842,"I die a virgin!","Pixels"
"780",3851842,3854632,"Why are you doing this to me?","Pixels"
"781",3856550,3861132,"You have been brainwashed!You are a good boy!","Pixels"
"782",3861467,3863507,"Running, Ludlow! Move your feet!","Pixels"
"783",3868382,3869882,"How, Eddie!","Pixels"
"784",3871507,3874132,"You were hit by a firestorm, loser.","Pixels"
"785",3877800,3878882,"What?","Pixels"
"786",3879507,3881800,"How did he get there quickly?","Pixels"
"787",3883717,3887342,"Way to go, champ.- Are not you glad you got me out?","Pixels"
"788",3887632,3889382,"Yes, enormously.","Pixels"
"789",3889550,3892132,"A, and then there's happy hour.","Pixels"
"790",3902800,3905550,"They leave me all here.","Pixels"
"791",3910800,3913092,"It's time for the hat trick.","Pixels"
"792",3926550,3930842,"Brenner, it is up to you. There isstill three power-dots there.","Pixels"
"793",3931007,3932507,"Be wary.","Pixels"
"794",3932717,3935592,"I it here.Because if not ...","Pixels"
"795",3935882,3939342,"... The world goes under.We can not have.","Pixels"
"796",3939708,3941791,"Come on, Brenner. Come on.","Pixels"
"797",3947541,3951916,"Brenner, he leads you directlytowards a power-dot. Get away.","Pixels"
"798",3959750,3962458,"A.- What is he doing?","Pixels"
"799",3964000,3964791,"Two.","Pixels"
"800",3965000,3968208,"I want to see my son grow up.","Pixels"
"801",3968333,3971166,"Three. It comes you also.","Pixels"
"802",3973708,3977291,"Four.- Brenner! Get away! He eats you!","Pixels"
"803",3979541,3980041,"Five.","Pixels"
"804",3983208,3983958,"Six.","Pixels"
"805",3986041,3987083,"Seven.","Pixels"
"806",3989250,3989791,"Eight.","Pixels"
"807",3991750,3992458,"Ni.","Pixels"
"808",3998416,3999041,"Ten.","Pixels"
"809",4009166,4012250,"You did it, Brenner!How, man.","Pixels"
"810",4023250,4024916,"He's over there!","Pixels"
"811",4037708,4039416,"Firestorm!","Pixels"
"812",4050041,4052291,"Firestorm, I love you.","Pixels"
"813",4052916,4056750,"Hey guys. Sorry, passport right on.I am one of the heroes.","Pixels"
"814",4060000,4062000,"Try to see.","Pixels"
"815",4062083,4064958,"I think I have found our trophy.","Pixels"
"816",4069449,4073242,"The Q * bert.- Yes I know.","Pixels"
"817",4073992,4076449,"Can I kill it?- No!","Pixels"
"818",4076657,4079742,"Let's get to know him.Ask him some questions.","Pixels"
"819",4079907,4081157,"And then we kill him.","Pixels"
"820",4082907,4085492,"It is gas.Throw the blanket over him again.","Pixels"
"821",4085742,4087117,"Mr. President.","Pixels"
"822",4087242,4088782,"Yes, Hal.- Mr. President.","Pixels"
"823",4088949,4092032,"They are three times more popularduring this crisis.","Pixels"
"824",4092242,4097449,"Do you feel the until now sanguinecausa will lead to a Victoire?","Pixels"
"825",4099158,4103492,"Clap, Hal.You tease him just with foreign words.","Pixels"
"826",4104742,4107283,"We love you.Thank you saved us.","Pixels"
"827",4108617,4110492,"Do not thank me.","Pixels"
"828",4110742,4114158,"It's Sam Brenner and his team,who has led us so close to victory.","Pixels"
"829",4114242,4116533,"And held a banquetin honor of them.","Pixels"
"830",4116742,4119949,"Is it a good idea,When a new attack may be headed?","Pixels"
"831",4120158,4124408,"Do not worry. They have arcade uniformon the field during the tux.","Pixels"
"832",4124533,4126658,"They are ready to move out.","Pixels"
"833",4126867,4131449,"And Hal, I know moreof the foreign words there.","Pixels"
"834",4132199,4135908,"I drank some cool sangvin,last time I was in Mexico.","Pixels"
"835",4136992,4138742,"Take it, Hal.","Pixels"
"836",4139033,4141867,"Dig! Dig! Dig! Dig!","Pixels"
"837",4148908,4153199,"I do not know what is worst.That they should fail, -","Pixels"
"838",4153742,4156199,"- Or that it actually succeed.","Pixels"
"839",4156283,4160242,"Excuse me, Jim?- Can not you just shut up?","Pixels"
"840",4164949,4166783,"We must be able to shoot faster.","Pixels"
"841",4166949,4169992,"You've already figured outin your beautiful mind, right?","Pixels"
"842",4171783,4177199,"There is no rhythm in this game.Where are the patterns? He attacks only.","Pixels"
"843",4177283,4181783,"Patterns? Is that why you were sogood to Pac-Man and Centipede?","Pixels"
"844",4181949,4186867,"Yes. Otherwise, you can not win. Countballs, calculate your speed, rain the next.","Pixels"
"845",4186992,4190117,"What's funny about it?- What do you do then?","Pixels"
"846",4190242,4193242,"You have to pretend that you areguy, and you will not die.","Pixels"
"847",4193408,4196908,"It sounds cool,but it seems not every time.","Pixels"
"848",4197033,4201742,"That's what you have to reset button.- The ones we had not when I was a child.","Pixels"
"849",4203199,4206783,"It is the most violent games, IViewed. It's been bad for you.","Pixels"
"850",4206949,4210492,"I can handle it.- I talk to my buddy here.","Pixels"
"851",4211908,4214408,"All that blood!","Pixels"
"852",4214742,4217117,"You know, what can cheer you up?","Pixels"
"853",4217242,4218992,"A cheese ball.- Yep.","Pixels"
"854",4220242,4223992,"Draw up.Take a handful.","Pixels"
"855",4225992,4229242,"Stiletto. Very stylish.","Pixels"
"856",4229408,4232992,"He'd better get some exercise.Put him on the trampoline.","Pixels"
"857",4233199,4235449,"Trampoline! Trampoline! Trampoline!","Pixels"
"858",4235617,4240242,"Okay, I do with him, and thenyou invite my mother to the banquet.","Pixels"
"859",4240408,4242658,"I'm not crazy about your mother.","Pixels"
"860",4242867,4246242,"Holy crap.- Okay, so I am.","Pixels"
"861",4246408,4250033,"Here. Eat.You put yourself out.","Pixels"
"862",4252942,4254108,"Hello.","Pixels"
"863",4254733,4256108,"Hello.","Pixels"
"864",4257149,4258317,"Well ...","Pixels"
"865",4259442,4260442,"Well?","Pixels"
"866",4267483,4271108,"Pardon.- Again! Again!","Pixels"
"867",4271942,4275817,"I have to show up tothe event tomorrow night.","Pixels"
"868",4275942,4281442,"When you show up there,will you then maybe hang out with me?","Pixels"
"869",4281608,4283858,"As on a date?- Yes.","Pixels"
"870",4284067,4287817,"I do not know.I am snobbish and mentally unstable.","Pixels"
"871",4287942,4290192,"Yes, you are.","Pixels"
"872",4290358,4292899,"But I can welldisregard an evening.","Pixels"
"873",4293233,4295317,"Okay.- Do you want to?","Pixels"
"874",4313858,4318108,"Thank you thank you. A warm welcomefor once, what?","Pixels"
"875",4323817,4326399,"Cool straight down Travolta.","Pixels"
"876",4329442,4332442,"They love him. It is good to see.","Pixels"
"877",4335733,4339649,"See, Serena. They hold a celebrationfor me, because I saved the world.","Pixels"
"878",4340233,4342649,"And you are allowedto stand beside me.","Pixels"
"879",4342858,4344733,"Champagne?- Thank you.","Pixels"
"880",4345233,4347442,"They said I was an island for it.","Pixels"
"881",4348067,4352649,"I would like to meet Sam's new girlfriend.- We just stuck out.","Pixels"
"882",4352899,4355649,"Definitely.- She sex, Will?","Pixels"
"883",4356649,4358942,"Define gender. You have sex.","Pixels"
"884",4359358,4361067,"Extremely sex.- Thank you.","Pixels"
"885",4361149,4365442,"She is ... Well the wordclassic sense, she ...","Pixels"
"886",4365649,4368442,"Help me, Brenner.- No, you are doing it as well.","Pixels"
"887",4369233,4372942,"For a military personas she ...","Pixels"
"888",4373108,4376358,"You're the first lady.She is perfect.","Pixels"
"889",4381649,4383317,"Hello, Brenner.","Pixels"
"890",4384983,4386442,"Hello, Brenner.","Pixels"
"891",4387442,4389442,"Excuse me a moment.","Pixels"
"892",4390108,4392442,"Come on, Matty. Let's dance.","Pixels"
"893",4397942,4402442,"You look good in a tuxedo.- Green is my favorite color now.","Pixels"
"894",4403358,4404983,"I have a question for you.","Pixels"
"895",4405149,4408608,"I was able to pull out,so I may only get half a beer.","Pixels"
"896",4409608,4412649,"You may well sufferdrinking of children cups -","Pixels"
"897",4412983,4416108,"- But we need to share a bottle?","Pixels"
"898",4416233,4417442,"What happened?","Pixels"
"899",4418067,4420149,"You have brushed your teeth.- Yes.","Pixels"
"900",4420317,4421442,"Okay. Lead.","Pixels"
"901",4421649,4422858,"How.","Pixels"
"902",4445483,4449858,"How do Canel out?- Are you kidding me?","Pixels"
"903",4449983,4452942,"She's a man-stealingPilates trainer. She is gorgeous.","Pixels"
"904",4453358,4456442,"And supple.- It does not mean anything.","Pixels"
"905",4456608,4460442,"Yes, it actually makes it.- But she is not perfect, is it?","Pixels"
"906",4460649,4464899,"Girls who steal other people's men,there is always something wrong with.","Pixels"
"907",4465149,4466817,"Came with it.","Pixels"
"908",4466942,4469399,"For large frying pan?- No.","Pixels"
"909",4469567,4470899,"Birthmark on the chin?- No.","Pixels"
"910",4471067,4475567,"Unequal nostrils?- No. She is perfect.","Pixels"
"911",4475899,4477149,"It is she.","Pixels"
"912",4477483,4481149,"Okay, her eyessits a little far apart.","Pixels"
"913",4482649,4486233,"She looks like a flounder.- Yes. Well.","Pixels"
"914",4486399,4489942,"So tonight looking your ex-husband intothe eyes and think:","Pixels"
"915",4490108,4494358,"""Oh no. I once had thebeautiful eyes looking at -","Pixels"
"916",4494483,4498442,"- And now stares me in a Filet-O-Fish. ""","Pixels"
"917",4498649,4502358,"Did you just say that I have beautiful eyes?- And gave her the other a mess.","Pixels"
"918",4502483,4506067,"Wow. It's really, really nice.","Pixels"
"919",4506192,4507442,"Thank you.","Pixels"
"920",4509567,4512817,"Can I have a sip? No?I thought we shared.","Pixels"
"921",4537442,4539567,"Everyone is just like that:","Pixels"
"922",4539733,4542149,"Brenner me here and Brenner me there.","Pixels"
"923",4542233,4546149,"Make no mistake. It is Ildstormen,leading the team.","Pixels"
"924",4546317,4551149,"Who is it Ildstormen is?- Me! Let me go straight to the point.","Pixels"
"925",4551233,4556149,"Ildstormen's been in eight years.He has not busted since 2005.","Pixels"
"926",4556649,4560149,"You'll soon have your life's best lap.","Pixels"
"927",4560233,4562983,"If you touch me,smoking you through the wall.","Pixels"
"928",4563442,4566608,"That is how it sounds.","Pixels"
"929",4567817,4570149,"I should have chosen Martha Stewart.","Pixels"
"930",4570233,4573899,"She would at leastmake a panini for me.","Pixels"
"931",4577149,4581192,"What will you do afterwards?To return to the Nerd Brigade?","Pixels"
"932",4582899,4584442,"Yes. Yes.","Pixels"
"933",4584608,4588567,"Probably. I think ...What else should I do?","Pixels"
"934",4588858,4594317,"One of your skills should inventtechnology, not install it.","Pixels"
"935",4594649,4598149,"I would love to do something else.","Pixels"
"936",4598567,4602233,"I had the chance as a child in the arcade.","Pixels"
"937",4602899,4604899,"But ...","Pixels"
"938",4605067,4606649,"... I missed it.","Pixels"
"939",4606858,4610149,"I always thought my life wouldhave been different ...","Pixels"
"940",4610233,4612983,"Every time somethingseems to succeed -","Pixels"
"941",4613149,4616649,"- Or I feel everything is going well -","Pixels"
"942",4617649,4620483,"- Throw the giant apea barrel after me.","Pixels"
"943",4623317,4626149,"But it's okay.","Pixels"
"944",4626317,4628317,"Do not worry.","Pixels"
"945",4631108,4635067,"Ladies and gentlemen, I canproudly present a message -","Pixels"
"946",4635192,4640942,"- For arcade playersfrom elementary school PS 427 in New York.","Pixels"
"947",4644149,4648608,"New York was in dangerPac-Man nor stayed not","Pixels"
"948",4648817,4653317,"arcade players saved us justwith hair back and stiff ...","Pixels"
"949",4657442,4661192,"Earthlings, I have broken the rulesof warfare.","Pixels"
"950",4661483,4666567,"Broken the rules?- Why have you lost your planet.","Pixels"
"951",4667608,4671817,"Guys, about 12 hours is initiatedthe destruction of Earth.","Pixels"
"952",4672817,4676983,"Afterwards, we sing it hereon your beloved planet:","Pixels"
"953",4677149,4679983,"she is gone","Pixels"
"954",4680149,4682942,"I must learn to l ...","Pixels"
"955",4685233,4687067,"What the heck are they talking about?","Pixels"
"956",4696649,4699733,"Where are you going, Firestorm?- Hey, kid.","Pixels"
"957",4700483,4702942,"I said to Serena,I had to have some fresh air.","Pixels"
"958",4703149,4707233,"Half an hour inside she's already:""Mrs. firestorm"" me here and there.","Pixels"
"959",4708108,4711233,"A cop fished them hereout of the river after you smoke.","Pixels"
"960",4711442,4716442,"I would give them to you again, but Iso something interesting on the glasses.","Pixels"
"961",4718067,4720483,"Cheat for super speed in Pac-Man.","Pixels"
"962",4720649,4722483,"You cheat.- So what?","Pixels"
"963",4723149,4729233,"I used cheats then,so why not now, I thought.","Pixels"
"964",4729399,4733233,"Have you cheated your whole life?- No.","Pixels"
"965",4733442,4735483,"Only since I was ten years.","Pixels"
"966",4735817,4739942,"That was howI beat Brenner for the World Cup then.","Pixels"
"967",4741942,4744942,"Everything I have,because these kodyle sunglasses.","Pixels"
"968",4750233,4751358,"What have you done?","Pixels"
"969",4751483,4754817,"Nothing. I thought,we complied with all the rules.","Pixels"
"970",4754942,4758733,"You were wrong, civilian. We wastedour only chance on you.","Pixels"
"971",4758942,4761567,"A radio repairman.- I swear ...","Pixels"
"972",4761733,4765067,"Shut up! You heard what Hall & Oatessaid! You fucked up.","Pixels"
"973",4765192,4768858,"I've seen your papers. You havenever performed anything in your life.","Pixels"
"974",4768983,4772108,"Brenner won two battles, Admiral.That's more than you.","Pixels"
"975",4772192,4776942,"Careful here, Lieutenant Colonel.You're part of this failure.","Pixels"
"976",4777108,4779733,"Sometimes I wonder,you are mars men's side.","Pixels"
"977",4779942,4782067,"Drop dead, Admiral.- You're done.","Pixels"
"978",4782192,4785858,"Okay, stop then.We tried, but it did not.","Pixels"
"979",4788608,4790983,"What is it? Matty!","Pixels"
"980",4802442,4804149,"Matty!","Pixels"
"981",4811117,4814367,"It is inconceivablethat they took Matty as a trophy.","Pixels"
"982",4814492,4817533,"We must be able to do anything.- Where's Eddie?","Pixels"
"983",4817742,4821117,"Eddie, he crawled into a hole.Him that we never see again.","Pixels"
"984",4821949,4826283,"Chewie does not answer.Violet was fired. There is only us.","Pixels"
"985",4826449,4831617,"This reminds of my planet.No fun, no laughter. Only war.","Pixels"
"986",4831908,4836449,"Wait. Wait a minute. Q * bert is away.He knows all their secrets.","Pixels"
"987",4836533,4840158,"Once, our planet ahappy place. But then you threaten us.","Pixels"
"988",4840367,4843742,"But we threatened you not.We played just video games.","Pixels"
"989",4843949,4848408,"They do not know it's games.- Why are you telling them not?","Pixels"
"990",4848533,4853033,"It is to late. And now createsmother ship millions of fighters -","Pixels"
"991",4853242,4854949,"- Which will destroy your planet.","Pixels"
"992",4855199,4858742,"We have just into the mother shipand stop them.","Pixels"
"993",4858908,4862617,"And then we can also save Matty.- Are you up there?","Pixels"
"994",4862742,4867867,"I know that is not true.They took our lyskanoner. Never mind the idea.","Pixels"
"995",4868033,4872699,"We have something that is better.An optimistic attitude.","Pixels"
"996",4874367,4877117,"It is gas.We must all die.","Pixels"
"997",4877949,4880492,"I'm just ... I'm sorry.","Pixels"
"998",4920033,4924033,"Are you sure of this? We could alsojust move to another planet.","Pixels"
"999",4924242,4926533,"Now the flap.We must be on board the ship.","Pixels"
"1000",4926742,4931117,"And therefore we need to fall below it.- It is the only way in.","Pixels"
"1001",4945908,4948033,"Arcade Players are coming! Do not worry!","Pixels"
"1002",4952949,4955533,"Come on! Move! Follow along!","Pixels"
"1003",4973949,4976242,"Nobody is bettercrane game than me.","Pixels"
"1004",4976533,4979867,"Chewie ?! Why are you dressed?","Pixels"
"1005",4980033,4983867,"They tried to catch me in a bunker,so I went solo.","Pixels"
"1006",4987867,4989533,"How!","Pixels"
"1007",4990858,4993817,"Wonderful boyStay down here and protect people.","Pixels"
"1008",4994108,4997858,"Oh, thank God.Live long, laugh a lot, love often.","Pixels"
"1009",4999442,5002108,"That's enough. No.","Pixels"
"1010",5002317,5003442,"Away.","Pixels"
"1011",5005016,5008141,"Thank you for being my friend.- Of course, mate. Love you.","Pixels"
"1012",5008307,5010141,"And then kick some ass.","Pixels"
"1013",5012850,5016182,"Mr. President,I must ask for a lyskanon?","Pixels"
"1014",5020432,5024307,"la la la lasmurf a little song","Pixels"
"1015",5024516,5026682,"la la la la ...","Pixels"
"1016",5032016,5034350,"I can not say,I have whacked one smurf.","Pixels"
"1017",5052350,5054350,"Stay away from the kids!","Pixels"
"1018",5056100,5057891,"Please do not?","Pixels"
"1019",5090641,5093850,"I have used itMost of my childhood -","Pixels"
"1020",5094016,5098600,"- Trying to awaken you to lifeas in ""Enter me, I am yours"".","Pixels"
"1021",5099432,5103850,"I spent all my wishes,when I blew the candle on the cake -","Pixels"
"1022",5103932,5107350,"- And every wishboneand each a ladybug.","Pixels"
"1023",5107932,5109600,"I asked for this.","Pixels"
"1024",5114641,5116891,"But how are you not with it.","Pixels"
"1025",5125350,5127932,"Okay, so we are below it,Q * bert. What now?","Pixels"
"1026",5132432,5135891,"Yes, yes, yes.Look who we have here.","Pixels"
"1027",5136100,5140141,"Betrayer Q * bert.And his cheating friends.","Pixels"
"1028",5140350,5142682,"If I cometo ask for a second chance?","Pixels"
"1029",5142850,5146182,"Luckily for you,the boss will want to meet with you.","Pixels"
"1030",5146850,5148600,"So just came up.","Pixels"
"1031",5148766,5153432,"If you defeat him, saves in yourplanet and destroy our warriors.","Pixels"
"1032",5153641,5156100,"But if you lose ...","Pixels"
"1033",5165891,5168516,"See you at the other side.","Pixels"
"1034",5182007,5184341,"You are just as powerful,as I thought.","Pixels"
"1035",5190007,5193550,"You win.I will not fight with you.","Pixels"
"1036",5193716,5195466,"I know you are loving -","Pixels"
"1037",5195632,5199007,"- And that I could make you happy,but if you must kill me -","Pixels"
"1038",5199091,5201632,"- Then you just do it.","Pixels"
"1039",5204050,5208341,"At least I die happyafter having found love.","Pixels"
"1040",5242800,5245591,"And Serena Williamswould not even shake my hand.","Pixels"
"1041",5245800,5249132,"Well, well, well. You thought I did not,I would see again.","Pixels"
"1042",5249341,5253382,"I had to prove that Ican do this without cheating.","Pixels"
"1043",5253591,5256050,"Wait, cheated you?- Let's talk about something else.","Pixels"
"1044",5262466,5265382,"Are not you introduce mefor your girlfriend?","Pixels"
"1045",5265591,5266966,"Fiance.","Pixels"
"1046",5281216,5283382,"Where are we, Q * bert?","Pixels"
"1047",5283591,5286757,"I do not know.But I'm afraid.","Pixels"
"1048",5287800,5289257,"Fat.","Pixels"
"1049",5297716,5299841,"What is that noise?","Pixels"
"1050",5308216,5309966,"What the hell was that?","Pixels"
"1051",5315550,5317341,"Donkey Kong.","Pixels"
"1052",5317550,5320716,"The only game you stink to.- Yes.","Pixels"
"1053",5321716,5323216,"Mother! I'm here!","Pixels"
"1054",5324091,5326800,"Matty!- Mother!","Pixels"
"1055",5326966,5330466,"Where the hell is my mother?- We will, baby!","Pixels"
"1056",5336632,5337966,"Oh no.","Pixels"
"1057",5356466,5358841,"There are too many of them.This way.","Pixels"
"1058",5361757,5364591,"There is only one way to win. Jump!","Pixels"
"1059",5365800,5367841,"Up the ladder. Fast!","Pixels"
"1060",5370007,5370757,"Beware!","Pixels"
"1061",5391757,5393300,"Q * bert! Beware!","Pixels"
"1062",5395050,5396966,"Q * bert!","Pixels"
"1063",5411132,5413632,"I can not.There is no pattern.","Pixels"
"1064",5413841,5416800,"Let as if you're the guy,and that you will not die.","Pixels"
"1065",5418800,5422300,"I will not die. I couldnot even beat Eddie Plant!","Pixels"
"1066",5422466,5426300,"Eddie Plant cheats. It is therefore,he was so good in New York.","Pixels"
"1067",5426466,5428550,"He used cheats.","Pixels"
"1068",5429050,5432007,"And he did the same against you,when you were children.","Pixels"
"1069",5433000,5436832,"You knowwhat that means, right?","Pixels"
"1070",5438582,5441500,"I am the world champion of Donkey Kong.","Pixels"
"1071",5441667,5444417,"And world championdo not need patterns.","Pixels"
"1072",5444667,5446750,"The reset button.","Pixels"
"1073",5459082,5460667,"Do not move, Chewie!","Pixels"
"1074",5467250,5468292,"Brenner!","Pixels"
"1075",5474957,5477042,"Mother! Mother! Q * bert is not dead!","Pixels"
"1076",5478082,5480042,"Help! Help!","Pixels"
"1077",5480207,5483207,"I think he is dead, Matty.- Mother!","Pixels"
"1078",5484207,5485917,"Help ...","Pixels"
"1079",5486042,5490082,"Okay, then.- What? No. No!","Pixels"
