"id","startTime","endTime","text","title"
"249",1910573,1915291,"Releasing the sand,turns back time.","Prince of Persia: The Sands of Time"
"250",1917249,1920848,"And only the holderof the Dagger is aware what's happened.","Prince of Persia: The Sands of Time"
"251",1922758,1926198,"He could go back and alter events,change time.","Prince of Persia: The Sands of Time"
"252",1926383,1928428,"And no one knows, but him.","Prince of Persia: The Sands of Time"
"253",1930685,1934205,"How much can it unliken?Answer me, princess.","Prince of Persia: The Sands of Time"
"254",1934394,1937480,"You destroyed my city.","Prince of Persia: The Sands of Time"
"255",1938615,1942454,"Our invasion wasn't about weaponsforges, it was about this Dagger.","Prince of Persia: The Sands of Time"
"256",1943873,1946313,"After the battle, Tus askedfor this Dagger as tribute,","Prince of Persia: The Sands of Time"
"257",1946454,1948825,"I didn't think anything of it,but now I see.","Prince of Persia: The Sands of Time"
"258",1948963,1952083,"With it, he could change anything. He couldchange the course of a critical moment in battle,","Prince of Persia: The Sands of Time"
"259",1952255,1955065,"He could foresee the blade of a rival.","Prince of Persia: The Sands of Time"
"260",1955222,1957623,"He wouldn't just be the king,he'd be the most powerful ruler Persia ever seen,","Prince of Persia: The Sands of Time"
"261",1957762,1961212,"greater even than my father.It was all about this dagger!","Prince of Persia: The Sands of Time"
"262",1961398,1964963," My treacherous brothermust be brought to justice.","Prince of Persia: The Sands of Time"
"263",1965154,1968400," And as such, I have doubledthe reward for his capture.","Prince of Persia: The Sands of Time"
"264",1968576,1973855," Meanwhile, I shall strive to protectour Empire, as my father would've demanded.","Prince of Persia: The Sands of Time"
"265",1974125,1977570,"A new reign has begun.","Prince of Persia: The Sands of Time"
"266",1977757,1980636,"- What are you doing?- Garsiv can't be far behind us.","Prince of Persia: The Sands of Time"
"267",1980803,1984442,"She is the most famous horse in the Empire,this would skew its tracks.","Prince of Persia: The Sands of Time"
"268",1984636,1988205,"- Tracks where, where are you going?- To Avrat, where my father will be buried.","Prince of Persia: The Sands of Time"
"269",1988397,1991196,"You're wanted for the King's murder,you're going to march into his funeral","Prince of Persia: The Sands of Time"
"270",1991318,1993439,"alongside thousands ofPersian soldiers.","Prince of Persia: The Sands of Time"
"271",1993567,1996491,"I hope Nizam will be there,he's the only one I can trust.","Prince of Persia: The Sands of Time"
"272",1996660,1999819,"He'll see I was set up by Tus,step aside, princess.","Prince of Persia: The Sands of Time"
"273",1999999,2002078,"Every road to Avratwill be covered with Persian troops.","Prince of Persia: The Sands of Time"
"274",2002204,2004654,"Well I a'm not taking roads,I'm going through the Valley of the Slaves.","Prince of Persia: The Sands of Time"
"275",2004798,2007676,"No one goes near that wasteland,it's filled with murderers and cutthroats.","Prince of Persia: The Sands of Time"
"276",2007837,2010682,"- Yes, so they say.- Your whole plan is suicide.","Prince of Persia: The Sands of Time"
"277",2010847,2012927,"My brother murdered my father,and left his blood on my hands.","Prince of Persia: The Sands of Time"
"278",2013055,2015220,"If I die trying to set that right,then so be it.","Prince of Persia: The Sands of Time"
"279",2018026,2021590,"So, you're going to leave me here,in the middle of nowhere?!","Prince of Persia: The Sands of Time"
"280",2021781,2024981,"Noble Dastan, abandoning a helplesswoman in the wilderness.","Prince of Persia: The Sands of Time"
"281",2025156,2029000,"What does your precioushonor have to say about that?","Prince of Persia: The Sands of Time"
"282",2031253,2034294,"Oh, give me the strength not to kill her.","Prince of Persia: The Sands of Time"
"283",2041519,2044400,"Mounts up, we can't be far behind him.","Prince of Persia: The Sands of Time"
"284",2050032,2053632,"Without the right sand, it's justanother knife. Not even very sharp.","Prince of Persia: The Sands of Time"
"285",2057960,2061880,"- This sand, is there more of it?- Of course not.","Prince of Persia: The Sands of Time"
"286",2063929,2066226,"- How can I get some?- Try standing on your head","Prince of Persia: The Sands of Time"
"287",2066327,2068547,"and holding your breath.","Prince of Persia: The Sands of Time"
"288",2075070,2078269,"Did you seewhat you're looking for, prince?","Prince of Persia: The Sands of Time"
"289",2078449,2081449,"Start walking.","Prince of Persia: The Sands of Time"
"290",2088255,2090536,"So, if you can't prove to your unclehow the Dagger works,","Prince of Persia: The Sands of Time"
"291",2090635,2092434,"why on the world wouldhe believe you?","Prince of Persia: The Sands of Time"
"292",2092548,2095233,"It's not your problem, princess.","Prince of Persia: The Sands of Time"
"293",2095387,2097911,"You know, you really walk like one.","Prince of Persia: The Sands of Time"
"294",2098063,2101862,"Head held high, chest out,long stomping strides.","Prince of Persia: The Sands of Time"
"295",2103153,2105833,"The walk of a self-satisfiedPersian prince.","Prince of Persia: The Sands of Time"
"296",2105990,2109070,"No doubt it comes from being toldsince birth, the world is yours,","Prince of Persia: The Sands of Time"
"297",2109240,2112971,"- And you actually believing it.- I wasn't born in a palace like you!","Prince of Persia: The Sands of Time"
"298",2113168,2117568,"I was born in the slums of Nasaf,where I lived if I fought and I clawed for it.","Prince of Persia: The Sands of Time"
"299",2118385,2123085,"- And how did you become a prince?- The king, marches the market one day,","Prince of Persia: The Sands of Time"
"300",2123289,2127628,"and he... I don't know, he...","Prince of Persia: The Sands of Time"
"301",2127851,2130742,"He found me.","Prince of Persia: The Sands of Time"
"302",2130903,2134983,"He took me in, he gave mea family, he gave me a home.","Prince of Persia: The Sands of Time"
"303",2141461,2148061,"What you're looking at is,the walk of a man, who just lost everything.","Prince of Persia: The Sands of Time"
"304",2153353,2157353,"Welcome to the Valley of Slaves,Your Highness.","Prince of Persia: The Sands of Time"
"305",2163244,2166244,"- I'm desperate for a drop of water.- Well, there's more than we have","Prince of Persia: The Sands of Time"
"306",2166409,2169139,"since you emptied our canteen hours ago.","Prince of Persia: The Sands of Time"
"307",2169295,2173775,"I wasn't born in this desert likeyou Persians, all shriveled and angry.","Prince of Persia: The Sands of Time"
"308",2174010,2180014,"- My constitution is much more... delicate.- I think you mean spoiled.","Prince of Persia: The Sands of Time"
"309",2180311,2184115,"The wells of Alamut are famefor their clean, cold water.","Prince of Persia: The Sands of Time"
"310",2184317,2188237,"Perhaps less time admiring your wells,and more time guarding your walls,","Prince of Persia: The Sands of Time"
"311",2188407,2190407,"and you wouldn't be here.","Prince of Persia: The Sands of Time"
"312",2195710,2199710,"Ah, a miracle, I've silenced a princess!","Prince of Persia: The Sands of Time"
"313",2201842,2205163,"Tamina?Tamina?","Prince of Persia: The Sands of Time"
"314",2208103,2210583,"Can you hear me?","Prince of Persia: The Sands of Time"
"315",2213862,2216942,"Yes, Dastan,I can hear you.","Prince of Persia: The Sands of Time"
"316",2235728,2238367,"Do you knowwhere you are Persian?","Prince of Persia: The Sands of Time"
"317",2239065,2241471,"And yet you're enter still?","Prince of Persia: The Sands of Time"
"318",2241610,2245255,"In the heart of Sudan there'sa tribe of warriors, known as the M'Baka.","Prince of Persia: The Sands of Time"
"319",2245451,2247971,"They strike fear into the heartsof all they cross.","Prince of Persia: The Sands of Time"
"320",2248115,2251326,"The M'Baka, are mastersof the throwing knife.","Prince of Persia: The Sands of Time"
"321",2251501,2256266,"Wielding blades, said to have been blessedby the Creator, Himself.","Prince of Persia: The Sands of Time"
"322",2256510,2261909,"Their aim is so murderously accurate,they can decapitate three men,","Prince of Persia: The Sands of Time"
"323",2262179,2264543,"with one strike.","Prince of Persia: The Sands of Time"
"324",2265481,2268481,"No. I wouldn't even bother doing that,if I were you. Do you know why?","Prince of Persia: The Sands of Time"
"325",2269362,2275121,"This is Seso, he is a M'Baka,I have the good fortune of saving his life,","Prince of Persia: The Sands of Time"
"326",2275413,2279371,"which means, he is nowenduringly indebted to me.","Prince of Persia: The Sands of Time"
"327",2279960,2283130,"So tell me Persian,is there any good reason why I shouldn't","Prince of Persia: The Sands of Time"
"328",2283268,2289097,"tell Seso, to put his next throwso little higher?","Prince of Persia: The Sands of Time"
"329",2326530,2329610,"So, this is the one, eh?","Prince of Persia: The Sands of Time"
"330",2330286,2333646,"Yes, you're right,she's not bad.","Prince of Persia: The Sands of Time"
"331",2339550,2343429,"She could smell better than that.Still we have a deal.","Prince of Persia: The Sands of Time"
"332",2343639,2347119,"- Clever princess.- Deal?","Prince of Persia: The Sands of Time"
"333",2347306,2349391,"What deal?","Prince of Persia: The Sands of Time"
"334",2350192,2353556,"- Such a noble prince.- Such a gentle princess.","Prince of Persia: The Sands of Time"
"335",2353739,2358237,"I've taken you over with my fainting act,eagerly leaping to assist the foreign beauty.","Prince of Persia: The Sands of Time"
"336",2358469,2360934,"- Who said you're a beauty?- There's must be a reason","Prince of Persia: The Sands of Time"
"337",2361041,2362041,"why you can't take youreyes off me.","Prince of Persia: The Sands of Time"
"338",2363164,2365494,"You're... I...","Prince of Persia: The Sands of Time"
"339",2365632,2368117,"I don't trust you,and you're not my type.","Prince of Persia: The Sands of Time"
"340",2368260,2372021,"Oh, I'm not some desperate slave girl!I'm actually capable of voicing my own folks!","Prince of Persia: The Sands of Time"
"341",2372224,2377224,"- Too many for my taste.- Oh yeah, she'll make a very nice addition.","Prince of Persia: The Sands of Time"
"342",2377476,2379686,"What you intend to do with her?","Prince of Persia: The Sands of Time"
"343",2379818,2383699,"Yes, do tell him.Can't you see how concerned he is?","Prince of Persia: The Sands of Time"
"344",2384617,2386938,"- Give me a moment.- Yeah.","Prince of Persia: The Sands of Time"
"345",2389125,2392884,"It's hard for me to admit,but you were right.","Prince of Persia: The Sands of Time"
"346",2395675,2400076,"- I did see what I was looking for.- Dastan, listen to me.","Prince of Persia: The Sands of Time"
"347",2400559,2404559,"When my uncle sees the powerof this Dagger, he'll believe me.","Prince of Persia: The Sands of Time"
"348",2404773,2408418,"Dastan, I know. I haven't beenentirely honest with you.","Prince of Persia: The Sands of Time"
"349",2408612,2413411,"- But your lies are so clever.- I'm the guardian of the divine covenant.","Prince of Persia: The Sands of Time"
"350",2413655,2417101,"That Dagger is sacred, it's beensmuggled to a safety when you stole it.","Prince of Persia: The Sands of Time"
"351",2417291,2420032,"- If the Dagger gets into the wrong hands....- I will take care of your knife.","Prince of Persia: The Sands of Time"
"352",2420186,2424856,"- You don't want to miss this.- You don't understand what's at stake!","Prince of Persia: The Sands of Time"
"353",2425096,2429096,"- This is the matter for the gods, not man!- Your gods, not mine. Come on!","Prince of Persia: The Sands of Time"
"354",2433023,2435224,"Come on!","Prince of Persia: The Sands of Time"
"355",2438135,2440945,"Run quickly. Come on, ostrich!","Prince of Persia: The Sands of Time"
"356",2446878,2449878,"- Ostrich racing?- Every Tuesday and Thursday.","Prince of Persia: The Sands of Time"
"357",2450467,2455347,"Whatever they like in beauty,they make up for it. Fighting spirit.","Prince of Persia: The Sands of Time"
"358",2456726,2461527,"- And the races are easy to fix.- I've heard all these terrible stories of this place.","Prince of Persia: The Sands of Time"
"359",2461771,2465300,"The bloodthirsty slaves,murdering their masters?","Prince of Persia: The Sands of Time"
"360",2465489,2469650,"That's a good story, it's well told,ever evolving, but alas untrue.","Prince of Persia: The Sands of Time"
"361",2469871,2473670,"- But the skeletons that we saw...- Ah, I bought those from a gypsy in Bukhara.","Prince of Persia: The Sands of Time"
"362",2473871,2479237,"I crafted our lurid reputation,in order to fend off the most insidious evil,","Prince of Persia: The Sands of Time"
"363",2479505,2481831,"that's been lurking thisforsaken country of ours.","Prince of Persia: The Sands of Time"
"364",2481972,2484253,"You know what I'm talkin' about?Taxes.","Prince of Persia: The Sands of Time"
"365",2486021,2491139,"Dirty Persians, their armies, their fortresses,their roads, who pays for it all, eh?","Prince of Persia: The Sands of Time"
"366",2491653,2493733,"The small businessmen.","Prince of Persia: The Sands of Time"
"367",2493865,2499065,"You see, that's why I starteda little campaign, to spread some false notoriety.","Prince of Persia: The Sands of Time"
"368",2500000,2504320,"I spread it like a venerabledisease in a Turkish harem.","Prince of Persia: The Sands of Time"
"369",2523494,2526373,"Behold the mighty ostrich!","Prince of Persia: The Sands of Time"
"370",2532757,2535677,"Come on, my beauty!","Prince of Persia: The Sands of Time"
"371",2541103,2543583,"I love this!","Prince of Persia: The Sands of Time"
"372",2543733,2550012,"And the tax collectors stay clear of me,and my customers, everybody's happy.","Prince of Persia: The Sands of Time"
"373",2550784,2555903,"Hey! Get the girls on! Get the girls on,come on. Crowd control!","Prince of Persia: The Sands of Time"
"374",2557586,2560586,"Don't you stand there!Run, don't walk!","Prince of Persia: The Sands of Time"
"375",2561885,2564644,"Hey, you drop anything, you pay for it!It's out of your wages.","Prince of Persia: The Sands of Time"
"376",2564806,2567485,"Don't look at me like that,you know what I'm talkin' about!","Prince of Persia: The Sands of Time"
"377",2567637,2570282,"Do your job, crowd control.Thank you!","Prince of Persia: The Sands of Time"
"378",2570438,2574639,"You know, I think our little arrangeis going to work out very well, young man.","Prince of Persia: The Sands of Time"
"379",2576782,2580661,"- Don't touch!- Oh, ho, ho! She's a lively one! Where did you find her?","Prince of Persia: The Sands of Time"
"380",2582833,2585717,"In the slave market to LursI was headed to Avrat.","Prince of Persia: The Sands of Time"
"381",2585878,2588759,"I trade her for a camel,when she attacked me!","Prince of Persia: The Sands of Time"
"382",2588920,2591764,"- The camels are safer.- Noble, Sheik Amar.","Prince of Persia: The Sands of Time"
"383",2591929,2595070,"I appreciate your hospitality,you run a fine establishment.","Prince of Persia: The Sands of Time"
"384",2595242,2598311,"- But if you could give me the supply...- You know something, Persian?","Prince of Persia: The Sands of Time"
"385",2598481,2605161,"You bear a remarkable resemblance to the disgrace prince,who fled after murdering the king.","Prince of Persia: The Sands of Time"
"386",2614630,2617670,"Have I told you aboutthe M'Baka?","Prince of Persia: The Sands of Time"
"387",2618219,2622065,"- Yes, you have.- Eh, nothing beats a good story. Eh, but yours however,","Prince of Persia: The Sands of Time"
"388",2622231,2626664,"trading her for a camel? Please.I mean look at her. She's worth at least, two.","Prince of Persia: The Sands of Time"
"389",2627900,2629179,"And as for you, young man,","Prince of Persia: The Sands of Time"
"390",2629465,2632545,"did you know your brothers offered rewardsfor you, it's quite frankly,","Prince of Persia: The Sands of Time"
"391",2632679,2637699,"between you and me, borders on the obscene.I traded my own mother for that kind of gold.","Prince of Persia: The Sands of Time"
"392",2637952,2640882,"What? You didn't knowwhat she was like?","Prince of Persia: The Sands of Time"
"393",2641045,2644045,"Take him down to the Persian outpost.","Prince of Persia: The Sands of Time"
"394",2644175,2646175,"Wait, wait, wait.  Look, that...","Prince of Persia: The Sands of Time"
"395",2649181,2651581,"- Nice knife.- It's nothing.","Prince of Persia: The Sands of Time"
"396",2653688,2656568,"- That's worthless.- Really?","Prince of Persia: The Sands of Time"
"397",2657528,2659929,"Melt it down for the jewels.","Prince of Persia: The Sands of Time"
"398",2682773,2685293,"What's the boy doing?!","Prince of Persia: The Sands of Time"
"399",2686320,2688920,"No, no,  you might kill a bird!","Prince of Persia: The Sands of Time"
"400",2691121,2694601,"Hey, over here!","Prince of Persia: The Sands of Time"
"401",2704181,2707141,"- I wouldn't do that, if I were you!- Get to the tunnel!","Prince of Persia: The Sands of Time"
"402",2708521,2711722,"Look at this! That's it.No more fermented goat's milk","Prince of Persia: The Sands of Time"
"403",2711902,2715101,"after the third race,do you hear me? Get off, come on!","Prince of Persia: The Sands of Time"
"404",2715277,2717722,"- The gate!- Get him!","Prince of Persia: The Sands of Time"
"405",2718197,2719842,"Stop!","Prince of Persia: The Sands of Time"
"406",2724711,2727597,"- Lift the lever, it opens the gate!- Give me the Dagger!","Prince of Persia: The Sands of Time"
"407",2727759,2731039,"- This isn't the time, lift that lever!- Give me the Dagger!","Prince of Persia: The Sands of Time"
"408",2735144,2738025,"Don't think it didn't cross my mind.","Prince of Persia: The Sands of Time"
"409",2742447,2744447,"Move, princess!","Prince of Persia: The Sands of Time"
"410",2745577,2746577,"Dastan!","Prince of Persia: The Sands of Time"
"411",2748289,2751090,"Persian!","Prince of Persia: The Sands of Time"
"412",2758931,2761929,"Looking for this?","Prince of Persia: The Sands of Time"
"413",2765106,2768067,"Next time, you...!","Prince of Persia: The Sands of Time"
"414",2776666,2780144,"They all come for my father's funeral.","Prince of Persia: The Sands of Time"
"415",2789893,2792693,"There are a hundred Persian soldierswatching that gate.","Prince of Persia: The Sands of Time"
"416",2792856,2795336,"Maybe more, if want you to stay closerto this Dagger,","Prince of Persia: The Sands of Time"
"417",2795445,2797443,"you're going to have to help mein the Avrat.","Prince of Persia: The Sands of Time"
"418",2803079,2807079,"All these foreign dignitaries,I'm guessing you're known up here.","Prince of Persia: The Sands of Time"
"419",2824112,2826797,"Couldn't you have foundsomebody lighter?","Prince of Persia: The Sands of Time"
"420",2826949,2830630,"The Mugals of the Hindu Kushare noble people, you should be honored.","Prince of Persia: The Sands of Time"
"421",2832166,2834846,"Oh yes, terribly.","Prince of Persia: The Sands of Time"
"422",2841889,2844969,"- Dastan, where's the Dagger?- You're welcome to search me for it.","Prince of Persia: The Sands of Time"
"423",2845137,2848503,"You'll have to be very thorough.","Prince of Persia: The Sands of Time"
"424",2860333,2863932,"Tus isn't here,he must be in Alamut.","Prince of Persia: The Sands of Time"
"425",2865675,2869675,"The Sand that fills the Dagger, there's morethat hidden somewhere in Alamut, isn't there?","Prince of Persia: The Sands of Time"
"426",2869884,2873728,"That's why Tus stays there.That's why he's got our army searching for.","Prince of Persia: The Sands of Time"
"427",2874188,2877226,"I have to get a messageto my uncle to meet me.","Prince of Persia: The Sands of Time"
"428",2877394,2880039,"That's impossible.","Prince of Persia: The Sands of Time"
"429",2939952,2942913,"- Difficult, not impossible.- One more proof, you're insane.","Prince of Persia: The Sands of Time"
"430",2943083,2945443,"Why do you look so impressed?","Prince of Persia: The Sands of Time"
"431",2945585,2948186,"Out of the way!Make way!","Prince of Persia: The Sands of Time"
"432",2953054,2955695,"- Turn around!- What?","Prince of Persia: The Sands of Time"
"433",2967077,2969876,"You used to buy those for me,when I was a boy.","Prince of Persia: The Sands of Time"
"434",2970034,2973443,"You used to spit the seedsat Garsiv.","Prince of Persia: The Sands of Time"
"435",2973628,2975967,"You shouldn't have broughtme here, Dastan.","Prince of Persia: The Sands of Time"
"436",2976106,2978411,"I had no choice uncle, follow me.","Prince of Persia: The Sands of Time"
"437",3001461,3005302,"I didn't kill father, you knowI'd never do such a thing..","Prince of Persia: The Sands of Time"
"438",3005505,3008150,"Your actions speak otherwise.","Prince of Persia: The Sands of Time"
"439",3008974,3011492,"I had no choice but to flee.","Prince of Persia: The Sands of Time"
"440",3011637,3013568,"Tus gave me that cloak.","Prince of Persia: The Sands of Time"
"441",3013688,3016487,"- He was the one who poisoned it. - Dastan...- But he's not here, is he?","Prince of Persia: The Sands of Time"
"442",3016902,3019387,"At his father's funeral,instead he remains in Alamut.","Prince of Persia: The Sands of Time"
"443",3019530,3021731,"Our allies will seeour invasion is just,","Prince of Persia: The Sands of Time"
"444",3021862,3024344,"the search for Alamut's weaponforges is important.","Prince of Persia: The Sands of Time"
"445",3024487,3028900,"Yes, but not if there were none.The invasion of Alamut was a lie.","Prince of Persia: The Sands of Time"
"446",3029128,3031648,"Tus is after power,that's why he murdered father,","Prince of Persia: The Sands of Time"
"447",3031757,3035757,"and now he searches not for weapons,but for the Sand,","Prince of Persia: The Sands of Time"
"448",3035967,3038577,"that fuels the mystical device.","Prince of Persia: The Sands of Time"
"449",3038726,3041005,"This is why you brought me here, Dastan?Mystical devices?","Prince of Persia: The Sands of Time"
"450",3041146,3045507,"Do you remember after the battleyou stopped Tus for taken the dagger I'd won?","Prince of Persia: The Sands of Time"
"451",3045737,3049516,"That dagger is the reason he invaded Alamut.","Prince of Persia: The Sands of Time"
"452",3049715,3053460,"This dagger, you have it with you?","Prince of Persia: The Sands of Time"
"453",3056253,3058253,"Yes.","Prince of Persia: The Sands of Time"
"454",3063556,3065876,"It has incredible powers.","Prince of Persia: The Sands of Time"
"455",3069313,3071592,"Is this some sort of a joke, Dastan?","Prince of Persia: The Sands of Time"
"456",3073152,3075632,"What? I know he was in there.","Prince of Persia: The Sands of Time"
"457",3076407,3079288,"And where is that so-called evidence?","Prince of Persia: The Sands of Time"
"458",3079449,3081414,"Tamina.","Prince of Persia: The Sands of Time"
"459",3089344,3091623,"- Your hands are burned.- Yes...","Prince of Persia: The Sands of Time"
"460",3094018,3097938,"From trying to pull the poisoned cloakof your father.","Prince of Persia: The Sands of Time"
"461",3099108,3101307,"- Is something wrong, Dastan?- No, no.","Prince of Persia: The Sands of Time"
"462",3101403,3103523,"You're certain?You know you can trust me, boy.","Prince of Persia: The Sands of Time"
"463",3108289,3110893,"It's just that a...","Prince of Persia: The Sands of Time"
"464",3111043,3115322,"Tus is my brother, how couldhe betray me like this?","Prince of Persia: The Sands of Time"
"465",3115545,3120190,"I can't say Dastan, perhaps he neverrespected you as you deserve,","Prince of Persia: The Sands of Time"
"466",3120432,3122432,"and he saw you as someone he could use.","Prince of Persia: The Sands of Time"
"467",3122556,3124485,"Someone to keep his wine glass filled.","Prince of Persia: The Sands of Time"
"468",3124606,3127050,"My service to your father was different.","Prince of Persia: The Sands of Time"
"469",3127192,3130711,"- We shared the same blood, Dastan.- How many times did father speak","Prince of Persia: The Sands of Time"
"470",3130865,3133864,"of you saving him from that lion?","Prince of Persia: The Sands of Time"
"471",3134030,3136956,"- That was his favorite story.- One of many, yes.","Prince of Persia: The Sands of Time"
"472",3137123,3141324,"- No, that was his favorite.- I'm afraid you're speaking in riddles, Dastan.","Prince of Persia: The Sands of Time"
"473",3145427,3148148,"Wait, Dastan!","Prince of Persia: The Sands of Time"
"474",3178498,3180518,"Over here!","Prince of Persia: The Sands of Time"
"475",3200427,3202427,"Murderer!","Prince of Persia: The Sands of Time"
"476",3210443,3212842,"I didn't kill father!","Prince of Persia: The Sands of Time"
"477",3282007,3284288,"What you're going to do now?!","Prince of Persia: The Sands of Time"
"478",3332376,3335016,"Where is he?!","Prince of Persia: The Sands of Time"
"479",3335610,3337148,"Hey!","Prince of Persia: The Sands of Time"
"480",3356996,3358996,"Garsiv...","Prince of Persia: The Sands of Time"
"481",3359916,3363637,"- I didn't kill father.- Then God will pardon you.","Prince of Persia: The Sands of Time"
"482",3363833,3365918,"After your head rolls.","Prince of Persia: The Sands of Time"
"483",3375483,3378402,"We don't fight with thesticks anymore, little brother.","Prince of Persia: The Sands of Time"
"484",3389045,3391244,"That's all you got?","Prince of Persia: The Sands of Time"
"485",3408990,3412190,"Your Majesty,I thought you were staying in Alamut.","Prince of Persia: The Sands of Time"
