"id","startTime","endTime","text","title"
"486",3412365,3415289,"Tell me about Dastan, uncle.","Prince of Persia: The Sands of Time"
"487",3416251,3420371,"Dastan came to Avrat to kill me,in the market place.","Prince of Persia: The Sands of Time"
"488",3420585,3422550,"I just got away.","Prince of Persia: The Sands of Time"
"489",3422637,3426916,"Tus, my death would weakenyour young reign.","Prince of Persia: The Sands of Time"
"490",3427143,3430123,"- Dastan hopes to start rebellion.- He wants the throne?","Prince of Persia: The Sands of Time"
"491",3430253,3431751,"I fear so, my Lord.","Prince of Persia: The Sands of Time"
"492",3436114,3439875,"Putting Dastan on trial would give hima stage for his sedition.","Prince of Persia: The Sands of Time"
"493",3440079,3444759,"My advice would be to avoid a trial.","Prince of Persia: The Sands of Time"
"494",3444998,3448362,"Don't bring him back to Nasaf alive.","Prince of Persia: The Sands of Time"
"495",3457396,3459161,"Whatever Dastan's crimes,","Prince of Persia: The Sands of Time"
"496",3459275,3463074,"a public trial will bestcommunicate the king I hope to be.","Prince of Persia: The Sands of Time"
"497",3463275,3466601,"Strong, honoring the rule of law.","Prince of Persia: The Sands of Time"
"498",3467579,3471898,"- We are not savages.- You grow more a king every day.","Prince of Persia: The Sands of Time"
"499",3472503,3476822,"Dastan must be found.He must be brought to justice.","Prince of Persia: The Sands of Time"
"500",3482184,3485503,"HASSASINS LAIR","Prince of Persia: The Sands of Time"
"501",3486356,3489717,"- I need to speak with our guests.- About them, my Lord,","Prince of Persia: The Sands of Time"
"502",3489898,3493400,"their practices are unusual,the servants have seen things.","Prince of Persia: The Sands of Time"
"503",3493588,3497056,"Heard strange sounds, lastweek one of the horses vanished.","Prince of Persia: The Sands of Time"
"504",3497248,3502648,"Just make sure that the servants keeptheir mouths shut, or I promise you,","Prince of Persia: The Sands of Time"
"505",3502918,3505443,"they will vanish as well.","Prince of Persia: The Sands of Time"
"506",3568563,3570768,"I have another taskfor you Hassansin,","Prince of Persia: The Sands of Time"
"507",3570900,3573061,"but you'll have to be quick,your prey has a head start.","Prince of Persia: The Sands of Time"
"508",3573195,3576755,"You brought what I requested?","Prince of Persia: The Sands of Time"
"509",3585590,3588688,"These practices,they don't interfere with your skills?","Prince of Persia: The Sands of Time"
"510",3588860,3591925,"In trance we can see visionsof far future.","Prince of Persia: The Sands of Time"
"511",3592094,3594458,"Visions of death.","Prince of Persia: The Sands of Time"
"512",3595813,3600092,"Destiny and the curse.","Prince of Persia: The Sands of Time"
"513",3606954,3611275,"In the trance we can find anything,including your nephew, prince Dastan.","Prince of Persia: The Sands of Time"
"514",3611498,3614663,"Then I hope you shall see more deaths.","Prince of Persia: The Sands of Time"
"515",3615300,3617300,"Soon.","Prince of Persia: The Sands of Time"
"516",3654108,3656829,"Get down, it's a Persian patrol.","Prince of Persia: The Sands of Time"
"517",3668965,3671844,"What aren't you telling me?","Prince of Persia: The Sands of Time"
"518",3672887,3677927,"The trail's been left, maybe they are tiredof your pawn shop for lies and backstabbing.","Prince of Persia: The Sands of Time"
"519",3678181,3680844,"I had no choice but to leave you.","Prince of Persia: The Sands of Time"
"520",3680996,3683623,"I take it your uncle didn't listen.","Prince of Persia: The Sands of Time"
"521",3683778,3687737,"It wasn't Tus that killed my father,it was Nizam.","Prince of Persia: The Sands of Time"
"522",3687951,3691110,"- Your uncle?- His hands were burned.","Prince of Persia: The Sands of Time"
"523",3691289,3693650,"He said it happened tryingto pull off the cloak that killed my father,","Prince of Persia: The Sands of Time"
"524",3693793,3697673,"I've gone over and over at my mind, he nevertouched the cloak, he must've handled it before.","Prince of Persia: The Sands of Time"
"525",3700762,3703726,"It was Nizam who poisoned it.","Prince of Persia: The Sands of Time"
"526",3703891,3708172,"What could this turning back a few momentsof time give my uncle? None.","Prince of Persia: The Sands of Time"
"527",3708398,3711643,"He murdered my father for morethan just a dagger.","Prince of Persia: The Sands of Time"
"528",3711820,3716740,"What aren't you telling me? You know,you've got quick hands, so do I.","Prince of Persia: The Sands of Time"
"529",3717454,3720255,"If you want it back,you tell me everything.","Prince of Persia: The Sands of Time"
"530",3720411,3723655,"No more games,no more lies.","Prince of Persia: The Sands of Time"
"531",3733103,3735302,"Can we get out of here?","Prince of Persia: The Sands of Time"
"532",3741449,3746128,"Oh...only a princess thinksshe can outrun a sandstorm.","Prince of Persia: The Sands of Time"
"533",3751047,3754047,"Nizam is coming to kill us,he needs me dead.","Prince of Persia: The Sands of Time"
"534",3755344,3757905,"I need to know why.","Prince of Persia: The Sands of Time"
"535",3761771,3766690,"In Alamut rests the beating heartof all life on earth.","Prince of Persia: The Sands of Time"
"536",3766940,3770105,"The Sand Glass of the gods.","Prince of Persia: The Sands of Time"
"537",3770867,3775907,"Long ago, the gods slipped down on manand saw nothing but greed and treachery.","Prince of Persia: The Sands of Time"
"538",3776163,3781166,"So they sent a great sandstorm,to destroy all, wipe clean the face of the earth.","Prince of Persia: The Sands of Time"
"539",3781425,3785704,"But one young girl begged the godsto give mankind another chance.","Prince of Persia: The Sands of Time"
"540",3785927,3788577,"Offering her life in exchange.","Prince of Persia: The Sands of Time"
"541",3788728,3794608,"Seeing the purity within, the gods werereminded of men's potentials for good.","Prince of Persia: The Sands of Time"
"542",3794898,3798864,"So they swept the sand into the Sand Glass.","Prince of Persia: The Sands of Time"
"543",3814349,3817949,"The Dagger was given to the girlwho saved Man.","Prince of Persia: The Sands of Time"
"544",3818148,3820391,"Making her the first guardian.","Prince of Persia: The Sands of Time"
"545",3820525,3823925,"The Dagger blade is the only thingthat can pierce the Sand Glass","Prince of Persia: The Sands of Time"
"546",3824108,3828559,"and remove the Sands of Time,but the handle only holds one minute.","Prince of Persia: The Sands of Time"
"547",3828788,3831447,"But if one were to place a Daggerin the Sand Glass, and pressed the","Prince of Persia: The Sands of Time"
"548",3831565,3833063,"jewel button at the same time?","Prince of Persia: The Sands of Time"
"549",3833170,3836250,"- Sand would flow through endlessly.- You could turn back time as far as you like.","Prince of Persia: The Sands of Time"
"550",3836420,3839184,"Yes, but it is forbidden.","Prince of Persia: The Sands of Time"
"551",3845646,3850367,"When my father was a boy,Nizam saved his life hunting.","Prince of Persia: The Sands of Time"
"552",3852032,3855032,"One day the two princeswere stalking a beautiful buck,","Prince of Persia: The Sands of Time"
"553",3855197,3858126,"but they weren't aware of a lionstalking them.","Prince of Persia: The Sands of Time"
"554",3858291,3864090,"Nizam saved Sharaman.My father told us the story over and over again.","Prince of Persia: The Sands of Time"
"555",3864378,3866822,"I don't understand.","Prince of Persia: The Sands of Time"
"556",3866971,3870771,"Nizam wishes to go back in timeand undo what he did.","Prince of Persia: The Sands of Time"
"557",3870972,3873416,"Not save my father,let him die.","Prince of Persia: The Sands of Time"
"558",3873559,3876648,"Then he will be king for a lifetime.","Prince of Persia: The Sands of Time"
"559",3876818,3879978,"And my brothers would never be born.","Prince of Persia: The Sands of Time"
"560",3886375,3888655,"The storm's passed.","Prince of Persia: The Sands of Time"
"561",3916586,3921626,"Dastan, the Sands contained withinthe Sand Glass are incredibly powerful.","Prince of Persia: The Sands of Time"
"562",3924932,3929452,"Opening the Dagger while it'sinside the glass breaks the seal","Prince of Persia: The Sands of Time"
"563",3929684,3933414,"and destroys the Sand Glass,causing it to crack and shatter.","Prince of Persia: The Sands of Time"
"564",3933612,3936577,"The Sands of Time would nolonger be contained,","Prince of Persia: The Sands of Time"
"565",3936742,3939561,"and they would carrythe gods' wrath with them once more,","Prince of Persia: The Sands of Time"
"566",3939684,3942583,"destroying everything in their path.","Prince of Persia: The Sands of Time"
"567",3945713,3949393,"And all of mankind would payfor Nizam's treachery.","Prince of Persia: The Sands of Time"
"568",3950804,3954289,"This is all that would be left of us.","Prince of Persia: The Sands of Time"
"569",3954476,3958077,"The secret guardian temple outsideAlamut is the sanctuary.","Prince of Persia: The Sands of Time"
"570",3958268,3960838,"The one place where the Daggercan be hidden safely,","Prince of Persia: The Sands of Time"
"571",3960987,3963626,"the only way to stop this Armageddon.","Prince of Persia: The Sands of Time"
"572",3964909,3968110,"That's the truth, Dastan.","Prince of Persia: The Sands of Time"
"573",3968873,3974472,"Give me back the Dagger, so thatI can take it there.","Prince of Persia: The Sands of Time"
"574",3976510,3979190,"I can't do that.","Prince of Persia: The Sands of Time"
"575",3982101,3986742,"- I'm coming with you.- You're going to help me!","Prince of Persia: The Sands of Time"
"576",3988362,3991802,"We can sit here and chat,or you can get on the horse.","Prince of Persia: The Sands of Time"
"577",4007474,4009639,"Our journey is blessed.","Prince of Persia: The Sands of Time"
"578",4009768,4013487,"We'll stop for the water and pushfor the mountain's pass by the nightfall.","Prince of Persia: The Sands of Time"
"579",4014775,4019056,"- You enjoy telling me what to do.- Only because you are so good at following orders.","Prince of Persia: The Sands of Time"
"580",4019282,4021643,"Don't press your luck.","Prince of Persia: The Sands of Time"
"581",4035097,4037097,"Persian!","Prince of Persia: The Sands of Time"
"582",4037226,4042385,"We parted under certain rush circumstances,I didn't get a chance to say goodbye.","Prince of Persia: The Sands of Time"
"583",4043695,4046059,"We've been tracking you for a week.","Prince of Persia: The Sands of Time"
"584",4046199,4049878,"That little riot you started,it went on for two days!","Prince of Persia: The Sands of Time"
"585",4051206,4056286,"My beloved racetrack,all washed away like the footprints in sand.","Prince of Persia: The Sands of Time"
"586",4056541,4058672,"See Lita there...Look at her?","Prince of Persia: The Sands of Time"
"587",4058800,4060880,"She's all that's leftof my gaming empire.","Prince of Persia: The Sands of Time"
"588",4061012,4064172,"And no matteryour skills as a promoter,","Prince of Persia: The Sands of Time"
"589",4064351,4069349,"you can't organize an ostrich racewith just one ostrich!","Prince of Persia: The Sands of Time"
"590",4069603,4071932,"Am I right?!","Prince of Persia: The Sands of Time"
"591",4072070,4075150,"Yes sir, come with me.","Prince of Persia: The Sands of Time"
"592",4081251,4084851,"Did you know that the ostricheshave suicidal tendencies?","Prince of Persia: The Sands of Time"
"593",4085925,4088405,"Look at this poor thing.","Prince of Persia: The Sands of Time"
"594",4088554,4092452,"She used to be a grand champion,and now I have to watch her","Prince of Persia: The Sands of Time"
"595",4092659,4096524,"night and day to make sureshe doesn't do anything stupid.","Prince of Persia: The Sands of Time"
"596",4102115,4105756,"Suddenly occurred to me, that the only wayto recoup my tragic losses,","Prince of Persia: The Sands of Time"
"597",4105949,4109519,"was to track down the two young loverswho cast this dark cloud upon me.","Prince of Persia: The Sands of Time"
"598",4109710,4114909,"Oh yes, I'm gonna need the prize on your head,your brother will be very pleased to see...","Prince of Persia: The Sands of Time"
"599",4118681,4121162,"The sand dervishes Persian,they are common as camel dirt...","Prince of Persia: The Sands of Time"
"600",4121270,4122869,"Sheik Amar, listen to me...!","Prince of Persia: The Sands of Time"
"601",4123564,4126449,"- I'd rather not.- Nice knife.","Prince of Persia: The Sands of Time"
"602",4126610,4129574,"Noble Sheik, we are on thesacred journey to the temple...","Prince of Persia: The Sands of Time"
"603",4129739,4133739,"Temple, the temple, there is nothingmore sacred than Persian's gold.","Prince of Persia: The Sands of Time"
"604",4181903,4184222,"Give me the Dagger,there are too many of them.","Prince of Persia: The Sands of Time"
"605",4186408,4189088,"You can't kill them all,you wanna live, give me the Dagger!!","Prince of Persia: The Sands of Time"
"606",4208818,4211217,"Give me the Dagger!","Prince of Persia: The Sands of Time"
"607",4224673,4227753,"Persian, how did you do that?","Prince of Persia: The Sands of Time"
"608",4230391,4232631,"Instinct.","Prince of Persia: The Sands of Time"
"609",4234273,4236472,"What?","Prince of Persia: The Sands of Time"
"610",4245247,4248046,"We have to get out of here.","Prince of Persia: The Sands of Time"
"611",4250255,4254015,"- What happened last night?- Those vipers were controlled by Hassansins.","Prince of Persia: The Sands of Time"
"612",4254219,4256384,"- Hassansins?- For years they were the covert","Prince of Persia: The Sands of Time"
"613",4256515,4259314,"killing force for the Persian kings,for my father ordered them disbanded.","Prince of Persia: The Sands of Time"
"614",4259471,4263595,"Nizam must've disobeyed my father's ordersand kept them intact.","Prince of Persia: The Sands of Time"
"615",4263817,4267197,"This is a secret government killing society.That's why I don't pay taxes!","Prince of Persia: The Sands of Time"
"616",4267380,4270725,"- We can't stop.- Oh perhaps you can't, but we can.","Prince of Persia: The Sands of Time"
"617",4270911,4273911,"We could use your helpgetting to the temple.","Prince of Persia: The Sands of Time"
"618",4274077,4276407,"Hah, by crossing the Hindu Kushwith the storm blowing?","Prince of Persia: The Sands of Time"
"619",4276545,4279744,"You attract troubles like flies aroundrotting mango and your insane...","Prince of Persia: The Sands of Time"
"620",4279884,4281881,"There's gold at the temple.","Prince of Persia: The Sands of Time"
"621",4282005,4284649,"More than ten horses can carry.","Prince of Persia: The Sands of Time"
"622",4284801,4287966,"- Tax-free.- Sir!","Prince of Persia: The Sands of Time"
"623",4317523,4322322,"- Do you have any idea where you're going?- I memorized this path as a child.","Prince of Persia: The Sands of Time"
"624",4322565,4326530,"Every princess must, it's sacred.","Prince of Persia: The Sands of Time"
"625",4329289,4332210,"It's here.","Prince of Persia: The Sands of Time"
"626",4339555,4343954,"The sanctuary, the one place the Daggercan be hidden safely.","Prince of Persia: The Sands of Time"
"627",4344181,4347747,"I was expecting golden statues, waterfalls.","Prince of Persia: The Sands of Time"
"628",4351740,4356060,"Give me back the Dagger, so thatI can take it there.","Prince of Persia: The Sands of Time"
"629",4373565,4376645,"Don't cut yourself, princess.","Prince of Persia: The Sands of Time"
"630",4381702,4383702,"Hey, here!","Prince of Persia: The Sands of Time"
"631",4386460,4390300,"Not long dead, last night maybe.Tortured first.","Prince of Persia: The Sands of Time"
"632",4390502,4394067,"- Hassansin.- Nizam knows this place.","Prince of Persia: The Sands of Time"
"633",4394257,4396981,"All dead.","Prince of Persia: The Sands of Time"
"634",4399395,4401515,"- The entire village, about my gold...- Where are you going?!","Prince of Persia: The Sands of Time"
"635",4402149,4404114,"- There is only one way to stop all of this.- What?!","Prince of Persia: The Sands of Time"
"636",4404235,4407836,"To make sure the Dagger is safe,the temple holds the stone the Dagger came from.","Prince of Persia: The Sands of Time"
"637",4408029,4410238,"What temple? This isa pile of stones and rocks!","Prince of Persia: The Sands of Time"
"638",4410371,4413270,"The first thing we learned, if all else fails,put the Dagger back into the stone,","Prince of Persia: The Sands of Time"
"639",4413396,4418295,"the stone will envelop it, pulling itinto the mountain, returning to the gods.","Prince of Persia: The Sands of Time"
"640",4426019,4433384,"- The original promise, must be paid.- What promise?","Prince of Persia: The Sands of Time"
"641",4433738,4437457,"The gods must take backthe life they spared.","Prince of Persia: The Sands of Time"
"642",4438244,4440444,"You'll die.","Prince of Persia: The Sands of Time"
"643",4450221,4453021,"- Stay there! Stay there!- Listen to me! Listen to me!","Prince of Persia: The Sands of Time"
"644",4454395,4457760,"Give me your sword, give me your swordor do you fortake given that honor.","Prince of Persia: The Sands of Time"
"645",4457942,4460862,"There are bodies down there,murdered by Hassansins, on Nizam's order!","Prince of Persia: The Sands of Time"
"646",4461024,4463750,"- He's the traitor!- Hassansins no longer exist!","Prince of Persia: The Sands of Time"
"647",4463908,4466389,"- You always thought you are so clever.- This is no trick, Garsiv.","Prince of Persia: The Sands of Time"
"648",4466533,4470898,"Sir, all dead inside Sir,more in the village.","Prince of Persia: The Sands of Time"
"649",4471123,4473809,"- There is only one way...- Stay there!","Prince of Persia: The Sands of Time"
"650",4478180,4480820,"Nizam wants me dead,wants me silenced.","Prince of Persia: The Sands of Time"
"651",4480970,4483576,"A trial will be too public.","Prince of Persia: The Sands of Time"
"652",4487862,4490346,"Do you know this?He said this much, didn't he?","Prince of Persia: The Sands of Time"
"653",4490490,4493970,"I know it hasn't been easybetween us Garsiv, but still...","Prince of Persia: The Sands of Time"
"654",4494454,4495734,"we are brothers.","Prince of Persia: The Sands of Time"
"655",4495791,4497789,"Touching wordswith my sword at your throat.","Prince of Persia: The Sands of Time"
"656",4497918,4500963,"You've often questioned whyfather has been so much time in prayer.","Prince of Persia: The Sands of Time"
"657",4501131,4502122,"Before he died,he told me that the bond","Prince of Persia: The Sands of Time"
"658",4502167,4505175,"between brothersis the sword that defends our empire.","Prince of Persia: The Sands of Time"
"659",4505341,4507787,"He was praying thatthat sword remains strong.","Prince of Persia: The Sands of Time"
"660",4507934,4511894,"Why would I go into Avrat for father'sfuneral, when I knew it was so dangerous?","Prince of Persia: The Sands of Time"
"661",4520202,4522202,"Nizam recommended your death,","Prince of Persia: The Sands of Time"
"662",4522331,4524975,"Tus disagreed, orderedyou brought back alive.","Prince of Persia: The Sands of Time"
"663",4525127,4530127,"Nizam wants me dead, and he's hiredHassansins to make sure that does happen.","Prince of Persia: The Sands of Time"
"664",4530380,4533743,"He's afraid of what I might say,","Prince of Persia: The Sands of Time"
"665",4533926,4536970,"and who I might tell.","Prince of Persia: The Sands of Time"
"666",4540483,4543243,"Tell me, brother.","Prince of Persia: The Sands of Time"
"667",4545783,4547783,"Garsiv?","Prince of Persia: The Sands of Time"
"668",4552041,4554041,"My Garsiv?","Prince of Persia: The Sands of Time"
"669",4558091,4560492,"Hassansins!","Prince of Persia: The Sands of Time"
"670",4578832,4580832,"Shut up!","Prince of Persia: The Sands of Time"
"671",4592935,4595015,"Protect the Dagger!","Prince of Persia: The Sands of Time"
"672",4611506,4613626,"Persian, behind you!","Prince of Persia: The Sands of Time"
"673",4624024,4626704,"Tamina!","Prince of Persia: The Sands of Time"
"674",4626863,4629862,"Forget them, throw these!","Prince of Persia: The Sands of Time"
"675",4630028,4632752,"Find her!","Prince of Persia: The Sands of Time"
"676",4640425,4642670,"Hey! Over here!","Prince of Persia: The Sands of Time"
"677",4642802,4645603,"You know what they say about menwith big swords!","Prince of Persia: The Sands of Time"
"678",4659703,4662304,"Tamina, let me do it.","Prince of Persia: The Sands of Time"
"679",4663376,4666475,"Only a guardian can return the Dagger.","Prince of Persia: The Sands of Time"
"680",4666646,4669711,"This isn't something you can do, Dastan.","Prince of Persia: The Sands of Time"
"681",4670970,4674569,"I'm ready for this.","Prince of Persia: The Sands of Time"
"682",4674762,4677847,"I'm not.","Prince of Persia: The Sands of Time"
"683",4691000,4693000,"Tamina!","Prince of Persia: The Sands of Time"
"684",4744204,4747005,"Out, enough, out!","Prince of Persia: The Sands of Time"
"685",4765612,4767612,"Garsiv!","Prince of Persia: The Sands of Time"
"686",4767990,4770470,"Dastan, I'm sorry.","Prince of Persia: The Sands of Time"
"687",4773625,4776824,"Save the empire.","Prince of Persia: The Sands of Time"
"688",4778716,4781916,"Brother... Brother.","Prince of Persia: The Sands of Time"
"689",4786143,4790222,"- Where is the Dagger?- It's gone.","Prince of Persia: The Sands of Time"
"690",4791652,4796452,"Protect the Dagger, no matter theconsequences, that was my sacred calling.","Prince of Persia: The Sands of Time"
"691",4797118,4799998,"That was my destiny.","Prince of Persia: The Sands of Time"
"692",4805338,4808738,"We make our own destiny, princess.","Prince of Persia: The Sands of Time"
"693",4808922,4811488,"We'll get it back.","Prince of Persia: The Sands of Time"
"694",4843313,4846033,"We're going to need another horse!","Prince of Persia: The Sands of Time"
"695",4848237,4851516,"- Where will you go?- To Alamut.","Prince of Persia: The Sands of Time"
"696",4854788,4859189,"Nizam will use that Dagger to piercethe Sand Glass, and he has to be stopped.","Prince of Persia: The Sands of Time"
"697",4859414,4862699,"He has to be stopped.He has to be stopped.","Prince of Persia: The Sands of Time"
"698",4865762,4867762,"What?","Prince of Persia: The Sands of Time"
"699",4868850,4871890,"Oh, a knife thrower with a conscience.","Prince of Persia: The Sands of Time"
"700",4891802,4893802,"Our friends in the palace saidthat the Persians have broken through","Prince of Persia: The Sands of Time"
"701",4893890,4895889,"to the first level of the tunnels.","Prince of Persia: The Sands of Time"
"702",4896016,4898661,"They will reach the Sand Glasswithin hours.","Prince of Persia: The Sands of Time"
"703",4898811,4902971,"Nizam's keeping the Dagger in the hightemple, guarded by some sort of demon,","Prince of Persia: The Sands of Time"
"704",4903189,4907314,"- covered in spikes.- The Hassansin that killed my brother.","Prince of Persia: The Sands of Time"
"705",4907529,4910939,"It's the only thing that stands betweenus and the Dagger.","Prince of Persia: The Sands of Time"
"706",4911122,4914122,"No man can stand withintwenty yards of him and live.","Prince of Persia: The Sands of Time"
"707",4914289,4918054,"Some don't need to get that close.","Prince of Persia: The Sands of Time"
"708",4937703,4940024,"Spare some water, sire.","Prince of Persia: The Sands of Time"
"709",4948470,4950570,"You sure about this?","Prince of Persia: The Sands of Time"
"710",4950698,4952728,"I owed the boy.","Prince of Persia: The Sands of Time"
"711",4952853,4955817,"But, you are a M'Baka, scourge ofthe Namibian plain.","Prince of Persia: The Sands of Time"
"712",4955981,4958702,"Me, I'm a slightly dishonorableentrepreneur, this...","Prince of Persia: The Sands of Time"
"713",4958819,4961819,"nobility businessis not the cloth we're cut from.","Prince of Persia: The Sands of Time"
"714",4961985,4963916,"Hurry.","Prince of Persia: The Sands of Time"
"715",4964036,4969515,"My friend, has anyone ever told youthat you talk too much?","Prince of Persia: The Sands of Time"
"716",4976345,4978345,"Come on.","Prince of Persia: The Sands of Time"
"717",5145641,5148640,"Have I told you about the M'Baka?","Prince of Persia: The Sands of Time"
"718",5149814,5153734,"- Yes, you have.- I hope your brother listens to you, Persian.","Prince of Persia: The Sands of Time"
"719",5162542,5164507,"He's here.","Prince of Persia: The Sands of Time"
"720",5164628,5168427,"Seal every gate!Find him!","Prince of Persia: The Sands of Time"
"721",5201685,5203765,"- It's clear.- Dastan, I don't...","Prince of Persia: The Sands of Time"
"722",5205315,5207835,"I don't think you should do this.","Prince of Persia: The Sands of Time"
"723",5207979,5210442,"Is that concern I hear?","Prince of Persia: The Sands of Time"
"724",5210585,5213012,"- Caution.- Sprinkled with concern.","Prince of Persia: The Sands of Time"
"725",5213159,5218640,"- You flatter yourself, prince.- And you used to be a better liar, princess.","Prince of Persia: The Sands of Time"
"726",5218913,5222043,"Perhaps I'm out of practice.","Prince of Persia: The Sands of Time"
"727",5222216,5225895,"This won't be the last timewe'll be together.","Prince of Persia: The Sands of Time"
"728",5235359,5239760,"- Where is the Dagger?- You Persian bureaucrats, such soft hands.","Prince of Persia: The Sands of Time"
"729",5248838,5253118,"- It's been found, my Lord.- The Sand Glass?","Prince of Persia: The Sands of Time"
"730",5254847,5257247,"I don't have the Dagger.","Prince of Persia: The Sands of Time"
"731",5258604,5260604,"Leave me.","Prince of Persia: The Sands of Time"
"732",5261440,5263520,"Hello, Tus.","Prince of Persia: The Sands of Time"
