"id","startTime","endTime","text","title"
"1126",2728719,2730403,"I didn't seethat coming, James.","Ride Along"
"1127",2730480,2731481,"Stop it!","Ride Along"
"1128",2731639,2734119,"You're here throwing allthis produce and shit. Stop!","Ride Along"
"1129",2734280,2735849,"Listen to me,what you going to do","Ride Along"
"1130",2736039,2738690,"is get on the ground and putyour hands behind your head.","Ride Along"
"1131",2738880,2740324,"I ain't doing shit.","Ride Along"
"1132",2740480,2742050,"Handle this!Don't embarrass me.","Ride Along"
"1133",2742199,2743405,"What am I doing? Do your job!","Ride Along"
"1134",2743494,2744614,"I'm not trying to do my job?","Ride Along"
"1135",2744639,2745766,"Do your job! Go!","Ride Along"
"1136",2745840,2747170,"Hey! Whoa, whoa, whoa!","Ride Along"
"1137",2747480,2749686,"Don't you take...Keep your clothes on!","Ride Along"
"1138",2749840,2752126,"They took everything else.Might as well take my clothes.","Ride Along"
"1139",2752199,2753326,"Hey! Uh-uh. Uh-uh!","Ride Along"
"1140",2753400,2756449,"Get this situation under control.Make him respect you.","Ride Along"
"1141",2756599,2758250,"You better not pull it out.It's getting pulled out.","Ride Along"
"1142",2758440,2759521,"He's going to pull it out!","Ride Along"
"1143",2759679,2760760,"Control the situation!","Ride Along"
"1144",2760920,2762001,"What am I supposed to do?","Ride Along"
"1145",2762159,2763969,"Arrest that man.You want me to arrest that?","Ride Along"
"1146",2764119,2765326,"He got his penis out!","Ride Along"
"1147",2765480,2766811,"He is packing, though.","Ride Along"
"1148",2766960,2768199,"I got nothing.","Ride Along"
"1149",2768400,2770481,"What are you doing? Stop. Stop!","Ride Along"
"1150",2770639,2772130,"Ben, what are you waiting on?","Ride Along"
"1151",2772280,2773849,"He has some freak honey shit!","Ride Along"
"1152",2774079,2775889,"What do you want me to do?Quit playing.","Ride Along"
"1153",2776079,2777445,"That's it.You're going to jail.","Ride Along"
"1154",2777599,2779489,"Honey Boo Boo!Stop it. You're going to jail.","Ride Along"
"1155",2779639,2781210,"Come on. Do your job.","Ride Along"
"1156",2781440,2782601,"Ow!","Ride Along"
"1157",2782719,2783960,"That's police brutality!","Ride Along"
"1158",2784119,2785804,"Let the dude go.His heart is broken.","Ride Along"
"1159",2785960,2787041,"Hold on. Hold on.","Ride Along"
"1160",2787199,2788610,"Ain't nobody hurting him.","Ride Along"
"1161",2790159,2791365,"Finish this, man.","Ride Along"
"1162",2795519,2796965,"Quit playing.What are you doing?","Ride Along"
"1163",2797119,2799282,"Eat this chip! Eat it, bitch!","Ride Along"
"1164",2802519,2803521,"You failing.","Ride Along"
"1165",2803599,2804760,"I'm gonna make you my bitch.","Ride Along"
"1166",2804840,2806443,"You ain't gonnamake me no bitch!","Ride Along"
"1167",2806599,2807726,"Come on, Ben.","Ride Along"
"1168",2807800,2808800,"You ain't going nowhere.","Ride Along"
"1169",2808960,2810007,"No! Get off me!","Ride Along"
"1170",2810480,2811561,"Ugh.","Ride Along"
"1171",2814840,2815840,"Yo, stop!","Ride Along"
"1172",2817159,2819003,"Get off. Get off of me!","Ride Along"
"1173",2819159,2820809,"- Oh, shit.- Stop, man!","Ride Along"
"1174",2821039,2822485,"I can't breathe!","Ride Along"
"1175",2822920,2825923,"James, he's choking me.It's not funny no more.","Ride Along"
"1176",2826079,2827126,"Drop the bottle!","Ride Along"
"1177",2827920,2829159,"Please don't do this.","Ride Along"
"1178",2829320,2830809,"Now you calm down!","Ride Along"
"1179",2833239,2834764,"Ben. You okay?","Ride Along"
"1180",2837360,2838360,"Stupid.","Ride Along"
"1181",2840360,2841885,"You Okay?","Ride Along"
"1182",2844760,2848286,"Book him on drunk and disorderly,resisting and assault.","Ride Along"
"1183",2848440,2849771,"I'll meet you up there.","Ride Along"
"1184",2856320,2858288,"I thought it'd be different.","Ride Along"
"1185",2858360,2859885,"I thought I'd be better.","Ride Along"
"1186",2871960,2874405,"I'm gonna go in hereand fill out this paperwork,","Ride Along"
"1187",2874480,2876766,"then I'll be backto take you home.","Ride Along"
"1188",2878320,2880561,"Don't worry about it,man, you'll be all right.","Ride Along"
"1189",2896159,2897650,"Hey, babe.","Ride Along"
"1190",2897760,2899250,"Hey, babe, how's it going?","Ride Along"
"1191",2899400,2901083,"Fine. It's going fine.","Ride Along"
"1192",2901239,2903128,"Okay-","Ride Along"
"1193",2903800,2907804,"So, it's the weekend andI was going to make plans.","Ride Along"
"1194",2907960,2910280,"I was thinking maybe we can goto that new restaurant or...","Ride Along"
"1195",2910360,2912010,"Babe,I don't want to do nothing.","Ride Along"
"1196",2912159,2913889,"I just want to stay in thehouse and play my game.","Ride Along"
"1197",2914039,2915121,"I don't feellike being bothered.","Ride Along"
"1198",2915280,2916327,"What's wrong?","Ride Along"
"1199",2917440,2919168,"Come on, babe, talk.","Ride Along"
"1200",2919320,2920923,"You want to know what's wrong?Everything is wrong.","Ride Along"
"1201",2921000,2922199,"I don't know if I can do this.","Ride Along"
"1202",2922280,2923327,"What happened?","Ride Along"
"1203",2923519,2925601,"It's not what happened,it's what didn't happen.","Ride Along"
"1204",2925760,2928684,"I met the damn devil todayin the form of a child.","Ride Along"
"1205",2928840,2930000,"Little boy was disrespectful.","Ride Along"
"1206",2930119,2932487,"He didn't respect me as a man,he had a foul mouth.","Ride Along"
"1207",2932639,2934483,"We could start off there,or if you want,","Ride Along"
"1208",2934639,2936802,"we could talk aboutthe fact that I got","Ride Along"
"1209",2936920,2939126,"confronted bya man-lady biker thing.","Ride Along"
"1210",2939280,2941726,"I didn't know what it was. All Iknow is she had a beard and breasts,","Ride Along"
"1211",2941880,2944360,"but the fact I thought it was aman and spoke on it, I'm wrong.","Ride Along"
"1212",2944599,2946010,"""You got the beard, not me!""","Ride Along"
"1213",2946159,2948481,"And to top it off,I go to the farmers' market,","Ride Along"
"1214",2948639,2951610,"I get into a disputewith a guy named Crazy Cody,","Ride Along"
"1215",2951800,2953403,"he started pouringhoney on his body,","Ride Along"
"1216",2953559,2954971,"I'm wrestling a man with honey!","Ride Along"
"1217",2955119,2958646,"No, wait a minute, Ben.Did you say Crazy Cody?","Ride Along"
"1218",2958800,2960403,"Yeah. What does thathave to do with anything?","Ride Along"
"1219",2960599,2964161,"Baby, James plays pokerwith a guy named Crazy Cody.","Ride Along"
"1220",2964599,2965601,"What? What?","Ride Along"
"1221",2965760,2968603,"He's a blonde-haired white guy.He's known him a long time.","Ride Along"
"1222",2969559,2970641,"Hey.","Ride Along"
"1223",2971119,2973599,"Question, babe,you ever heard of a 126?","Ride Along"
"1224",2973760,2977047,"Yeah. It's a cop code for anannoying situation nobody wants.","Ride Along"
"1225",2977239,2979561,"They do it to rookies.It's a joke.","Ride Along"
"1226",2979920,2980920,"Why?","Ride Along"
"1227",2981079,2982605,"Nothing.Babe, let me let you go.","Ride Along"
"1228",2982679,2985445,"I have to go. I'll call you later, okay?I love you.","Ride Along"
"1229",2985599,2987045,"I love you, too.","Ride Along"
"1230",2987199,2989646,"I got your damn 126.","Ride Along"
"1231",3002840,3004039,"So, I'm standing there, right?","Ride Along"
"1232",3004159,3007447,"The guy's coming at me, he's like,""I'm nervous, I'm nervous.""","Ride Along"
"1233",3007599,3008885,"He's like, ""Put your hands up.""","Ride Along"
"1234",3008960,3011121,"And the closer he gets,the shorter he gets.","Ride Along"
"1235",3011719,3014451,"And he's coming at me, then itwas like a Cabbage Patch doll.","Ride Along"
"1236",3014599,3016409,"I've never seen anything like it.Then he gets on me,","Ride Along"
"1237",3016559,3018085,"tries to putthe cuffs on me, barn.","Ride Along"
"1238",3018280,3021010,"I got honey on me, I'myelling, ""Oh, Honey Boo Boo!""","Ride Along"
"1239",3021199,3024329,"So, can we stop with these 126sor is this guy coming back?","Ride Along"
"1240",3024480,3027244,"Oh, no. He's done. You hear me?","Ride Along"
"1241",3027400,3029367,"Done. Anybody got a fork?","Ride Along"
"1242",3030679,3032284,"I'm serious, you know.Matter of fact,","Ride Along"
"1243",3032360,3035648,"I don't even think he goingto join the academy. Yeah.","Ride Along"
"1244",3035840,3037284,"All in all, I got to say,","Ride Along"
"1245",3038360,3040088,"today was a good day.","Ride Along"
"1246",3044559,3048166,"All right, let's getyou home. Tucked in.","Ride Along"
"1247",3048320,3050447,"Unit 19, 126 in progress.","Ride Along"
"1248",3050599,3053603,"Suspicious person,55 North Peachtree.","Ride Along"
"1249",3053760,3056331,"Hey, baby, cancel that 126.","Ride Along"
"1250",3056400,3058721,"As a matter of fact, I'm goingto be offline for about a hour.","Ride Along"
"1251",3058800,3060449,"No, you know what?On second thought, copy that.","Ride Along"
"1252",3060519,3062920,"Unit 19 en routeto 551 Peachtree.","Ride Along"
"1253",3063119,3064530,"Copy that. Copy that.","Ride Along"
"1254",3064679,3065681,"The hell you doing?","Ride Along"
"1255",3065840,3067967,"I told you I want to bea cop. I want to be a cop.","Ride Along"
"1256",3068119,3069849,"And that 126 might be serious.","Ride Along"
"1257",3070039,3071320,"I feel likeI got my second wind.","Ride Along"
"1258",3071440,3073521,"Like I'm Action Jacksonor somebody right now.","Ride Along"
"1259",3073639,3074641,"Let's go.","Ride Along"
"1260",3074800,3076528,"Whoa, whoa, whoa.We discussed this.","Ride Along"
"1261",3076614,3078454,"You not cut out for this work.That's not true.","Ride Along"
"1262",3078480,3079481,"I'm taking you home.","Ride Along"
"1263",3079559,3081927,"I'm not going home like this.It's not going to happen.","Ride Along"
"1264",3082079,3084764,"Now, if this doesn't go well, Iwill be out of your hair, James.","Ride Along"
"1265",3084920,3086809,"All this cop talkwill be finished.","Ride Along"
"1266",3086880,3088119,"Matter of fact, I'll go one up.","Ride Along"
"1267",3088599,3089885,"If this doesn't work,","Ride Along"
"1268",3090039,3093840,"I will call Angela right nowand tell her myself.","Ride Along"
"1269",3097519,3098567,"Your funeral.","Ride Along"
"1270",3098960,3100405,"Indeed it is.","Ride Along"
"1271",3109400,3110559,"What's the problem this time?","Ride Along"
"1272",3110639,3113041,"I don't like these guys.Something's wrong.","Ride Along"
"1273",3113199,3114644,"You're gonna haveto get a bouncer.","Ride Along"
"1274",3114840,3117605,"The department is gettingtired of doing this for free.","Ride Along"
"1275",3117800,3119244,"I'm serious this time.","Ride Along"
"1276",3119400,3121925,"The one by the bar.Other dude, blue jacket.","Ride Along"
"1277",3122079,3123764,"They've been casingthis place all week.","Ride Along"
"1278",3123840,3125079,"I think you're right this time.","Ride Along"
"1279",3125480,3128927,"I need you to go tothe car, call in 211,","Ride Along"
"1280",3129079,3130411,"tell them we need a backup.","Ride Along"
"1281",3131599,3133125,"Okay. Will do.","Ride Along"
"1282",3135199,3136201,"Ben!","Ride Along"
"1283",3136599,3137646,"What are you doing?","Ride Along"
"1284",3137800,3139289,"I want to go talk to him.","Ride Along"
"1285",3140159,3141206,"Gonna do it now.","Ride Along"
"1286",3141360,3142804,"Everybody on the floor!","Ride Along"
"1287",3144000,3146650,"Get on the ground.On the ground! Now!","Ride Along"
"1288",3146800,3149485,"Atlanta Vice!Everybody be cool.","Ride Along"
"1289",3151360,3153806,"No, no, no.Don't nobody be cool.","Ride Along"
"1290",3155320,3156606,"We're about to heat this up.","Ride Along"
"1291",3156760,3157840,"Ben! Yes?","Ride Along"
"1292",3157960,3159085,"Back to the car.Call for backup.","Ride Along"
"1293",3159199,3160280,"No!","Ride Along"
"1294",3160440,3162329,"Look, the situation'salready in progress.","Ride Along"
"1295",3162480,3163719,"I got this. Ben!","Ride Along"
"1296",3163880,3165005,"Get down! Yeah.","Ride Along"
"1297",3165159,3167811,"Get up, baby, stop.It's not real, it's fake.","Ride Along"
"1298",3167960,3169643,"Man, you got to be kidding me!","Ride Along"
"1299",3169800,3171961,"You gonna pull out a gunwhen you looking at this?","Ride Along"
"1300",3172534,3173934,"Get down, baby.I didn't know it was","Ride Along"
"1301",3173960,3175041,"this much ofa height difference.","Ride Along"
"1302",3175054,3176215,"Thank you. I'm gonna tip you.","Ride Along"
"1303",3176239,3177844,"Get 100 ones.I got you in a second.","Ride Along"
"1304",3178000,3179081,"You better chill, man.","Ride Along"
"1305",3179280,3180360,"Put the gun down.","Ride Along"
"1306",3180519,3181965,"- We got hostages.- Oh, no!","Ride Along"
"1307",3182119,3185010,"James, they got hostages.","Ride Along"
"1308",3185920,3187922,"You ain't gonna shoot me.","Ride Along"
"1309",3188119,3189246,"I'm gonna do it!","Ride Along"
"1310",3189400,3190400,"You do it, you next.","Ride Along"
"1311",3190480,3191481,"Ben! Yes?","Ride Along"
"1312",3191559,3192606,"Stand down!","Ride Along"
"1313",3192679,3193760,"I ain't gonna stand down.","Ride Along"
"1314",3194360,3195963,"I never stand down...","Ride Along"
"1315",3198000,3199922,"from a 126.","Ride Along"
"1316",3202960,3204927,"This ain't no joke, man.This is the real deal.","Ride Along"
"1317",3205000,3207525,"You right, James, this ain't no joke.This is dead serious.","Ride Along"
"1318",3207719,3209050,"We serious up in here.","Ride Along"
"1319",3209199,3211407,"Shut up! You're aboutto get us killed, cop.","Ride Along"
"1320",3211559,3213561,"Whoa, whoa, whoa!Hold on, cowboy.","Ride Along"
"1321",3213719,3215085,"Oh, God!","Ride Along"
"1322",3215239,3217766,"I got a way for you toget out of here. Okay?","Ride Along"
"1323",3217920,3219251,"Put the gun down.","Ride Along"
"1324",3219440,3222728,"I'll forget you had hostages, andy'all won't get that much time.","Ride Along"
"1325",3222880,3224005,"No! Overruled. No.","Ride Along"
"1326",3224119,3225280,"Overruled?","Ride Along"
"1327",3225440,3227480,"Overruled! I don't like it.I don't want to do that.","Ride Along"
"1328",3227639,3228721,"Why...","Ride Along"
"1329",3230119,3231201,"Why would I do that, man?","Ride Along"
"1330",3231360,3233282,"Why do that when we can handlethis right here, right now.","Ride Along"
"1331",3233440,3236045,"One winner, one loser.Let's get to shooting!","Ride Along"
"1332",3236199,3237804,"Ben! Let's shoot!Let's start shooting!","Ride Along"
"1333",3238000,3239525,"Man, you crazy!","Ride Along"
"1334",3239679,3240760,"Yeah, I am crazy.","Ride Along"
"1335",3240960,3243681,"Only thing that can kill crazy is a bullet.You got that bullet, huh?","Ride Along"
"1336",3243800,3245289,"Can you kill crazy? Kill crazy!","Ride Along"
"1337",3245440,3246487,"Ben, get out of there!","Ride Along"
"1338",3246559,3247891,"Come on, Tim, what's the move?","Ride Along"
"1339",3248039,3249201,"Yeah, what's the move, Tim?","Ride Along"
"1340",3249360,3252603,"He got to ask you because youcan't make no decisions.","Ride Along"
"1341",3252760,3255365,"The black man is followingthe white man once again.","Ride Along"
"1342",3255559,3257005,"Make a decision by yourself.","Ride Along"
"1343",3257159,3258400,"Tim, I'm back over here to you.","Ride Along"
"1344",3258440,3260248,"What you going to do?It's a chessboard.","Ride Along"
"1345",3260440,3262204,"I'm a rook. I'm aboutto take your bishop,","Ride Along"
"1346",3262400,3263561,"but I can'tbecause I got your queen.","Ride Along"
"1347",3263719,3264960,"Where I go? Where am I?","Ride Along"
"1348",3265119,3266644,"I'm gonna stopso you can see me.","Ride Along"
"1349",3266800,3268768,"You see me, huh?You see me? Shoot!","Ride Along"
"1350",3268920,3270570,"Ben! I'm going to do this fool!","Ride Along"
"1351",3270719,3272768,"Do me! Do me!","Ride Along"
"1352",3277159,3278400,"He tried to do me!","Ride Along"
"1353",3278559,3279606,"Freeze!","Ride Along"
"1354",3280920,3282360,"Bitch, you betterget down and shoot!","Ride Along"
"1355",3284079,3286447,"James, this is real!This shit is real!","Ride Along"
"1356",3286719,3287880,"Don't you move, boy.","Ride Along"
"1357",3288079,3289809,"Oh, Jesus! This is real!","Ride Along"
"1358",3289960,3293009,"Take it easy, man.I didn't even do anything.","Ride Along"
"1359",3293159,3295242,"Hey, don't say anything.","Ride Along"
"1360",3295760,3297125,"Keep me away from this psycho.","Ride Along"
"1361",3297199,3298690,"Ow! Come on, man.","Ride Along"
"1362",3301159,3302206,"Where do I start?","Ride Along"
"1363",3302360,3303360,"Could say ""good job.""","Ride Along"
"1364",3303440,3305282,"You think because you're betterthan the average riff-raff","Ride Along"
"1365",3305360,3307760,"that gives you the rightto do things your own way?","Ride Along"
"1366",3307920,3311242,"To tote that little civilian bastardinto an active crime scene?","Ride Along"
"1367",3311400,3314528,"L-T, I did not know it was goingdown like this, all right.","Ride Along"
"1368",3314679,3317411,"This owner right hereis always crying wolf.","Ride Along"
"1369",3317559,3319800,"We come by to check it out,it's going down.","Ride Along"
"1370",3320199,3323204,"Perp gets shot, no other fatalities.What's the big deal?","Ride Along"
"1371",3323559,3324606,"You want a medal for that?","Ride Along"
"1372",3324800,3326768,"Now I hear you tookhim to a gun range?","Ride Along"
"1373",3326920,3328809,"And something aboutmilitary weapons and Omar?","Ride Along"
"1374",3329320,3331288,"That dry,snitching-ass Santiago.","Ride Along"
"1375",3331360,3334250,"It's not Santiago! I got earsout here just like you do.","Ride Along"
"1376",3334880,3336210,"I told you to leave it alone.","Ride Along"
"1377",3336679,3338010,"But you're out hereon your own.","Ride Along"
"1378",3338400,3340561,"I don't know halfthe shit you're working.","Ride Along"
"1379",3340695,3341894,"And all you say is ""trust me""?","Ride Along"
"1380",3341920,3342967,"You should.","Ride Along"
"1381",3343840,3345603,"Haven't I earned that?","Ride Along"
"1382",3345760,3347284,"Let me be clear.","Ride Along"
"1383",3347719,3349449,"I can only coveryour ass so much.","Ride Along"
"1384",3349679,3350840,"So clean your shit up.","Ride Along"
"1385",3351280,3352690,"Or I'll clean it up for you.","Ride Along"
"1386",3359000,3360199,"You, get in the car, you done.","Ride Along"
"1387",3360239,3361365,"Why?","Ride Along"
"1388",3361960,3363563,"We got more important 126s?","Ride Along"
"1389",3363719,3364880,"You almost got me killed!","Ride Along"
"1390",3365039,3366565,"Almost don't count.","Ride Along"
"1391",3366719,3367960,"So, you done. Let's go.","Ride Along"
"1392",3368039,3369041,"No, I'm not done.","Ride Along"
"1393",3369360,3371248,"I want to talk some more, I gotsomething else I want to say.","Ride Along"
"1394",3371400,3373242,"I may not be a cop right now,","Ride Along"
"1395",3373400,3375800,"but I will be.You hear me? I will be.","Ride Along"
"1396",3375960,3378963,"And there is nothingthat you can do about that.","Ride Along"
"1397",3379119,3381009,"I tried to help you.Hey! Hey, man!","Ride Along"
"1398",3381159,3384481,"You came to me and said, give mea day to show me what you got.","Ride Along"
"1399",3384639,3385721,"I gave you a day.","Ride Along"
"1400",3386199,3387326,"It's not good enough.","Ride Along"
"1401",3387480,3390449,"So the answer toyour question is no!","Ride Along"
"1402",3390599,3392523,"I do not give you my blessing.","Ride Along"
"1403",3392679,3394329,"I don't need your blessing.","Ride Along"
"1404",3394519,3398570,"This isn't Afghanistan. I'm notabout to buy her with a goat.","Ride Along"
"1405",3398719,3400244,"That girl loves me, man.","Ride Along"
"1406",3400400,3403563,"That girl loves all of this.","Ride Along"
"1407",3403719,3406086,"Breathe it in,because it's in your face.","Ride Along"
"1408",3406320,3407684,"I'm taking careof her, not you.","Ride Along"
"1409",3408079,3409081,"You? Me.","Ride Along"
"1410",3409239,3411447,"You can't eventake care of yourself.","Ride Along"
"1411",3411760,3413568,"You wouldn't lastone day out here.","Ride Along"
"1412",3413760,3415648,"You think I'm gonna become acop and get myself killed?","Ride Along"
"1413",3415800,3416800,"Leave her by herself?","Ride Along"
"1414",3416880,3417927,"This conversation is over.","Ride Along"
"1415",3418000,3419001,"Get in the car.","Ride Along"
"1416",3419119,3420451,"This is your problem, man.","Ride Along"
"1417",3420639,3422289,"It's why you don'thave no damn partner.","Ride Along"
"1418",3422480,3423719,"You walk aroundhere by yourself","Ride Along"
"1419",3423840,3425126,"because you don't trust nobody.","Ride Along"
"1420",3425280,3427407,"Eventually you're gonna haveto trust somebody, James.","Ride Along"
"1421",3427559,3428971,"I'd never trust you.","Ride Along"
"1422",3429199,3430929,"I'd never trust youwith my life.","Ride Along"
"1423",3431360,3433043,"And my family's life?","Ride Along"
"1424",3433239,3434365,"Can you comprehend that?","Ride Along"
"1425",3434679,3436320,"You don't even knowwhy you don't like me.","Ride Along"
"1426",3436360,3438362,"Tell me why!You don't know why.","Ride Along"
"1427",3438599,3440045,"Because youdon't know me, James.","Ride Along"
"1428",3440199,3441280,"I know who you are.","Ride Along"
"1429",3441440,3443329,"You that clownthat's always trying","Ride Along"
"1430",3443440,3445362,"to talk yourself outof every situation.","Ride Along"
"1431",3445519,3446885,"No matter how deep you in it.","Ride Along"
"1432",3447519,3449601,"That's a bad character traitfor a cop.","Ride Along"
"1433",3450159,3452161,"So get your ass inthe car so we can go.","Ride Along"
"1434",3452320,3453650,"I ain't getting in no car.You getting in the car.","Ride Along"
"1435",3453760,3455170,"I'm not getting in no car.","Ride Along"
"1436",3455760,3456760,"Walk.","Ride Along"
"1437",3457280,3459168,"You think I've neverwalked before? I'll walk.","Ride Along"
"1438",3459320,3460440,"You think I'm gonna beg you?","Ride Along"
"1439",3460599,3462409,"Don't beg me. I'll walk.","Ride Along"
"1440",3466000,3468047,"Let me jump in because Idon't know where I'm at.","Ride Along"
"1441",3468280,3469485,"Back seat.","Ride Along"
"1442",3469880,3471847,"I'm not getting in no back seat.Back seat.","Ride Along"
"1443",3472559,3473641,"No.","Ride Along"
"1444",3478519,3479567,"James?","Ride Along"
"1445",3480519,3481567,"Hey, James?","Ride Along"
"1446",3482840,3483887,"James?","Ride Along"
"1447",3486400,3487561,"James?","Ride Along"
"1448",3487800,3489403,"Can you at least let me ridein the front seat, please?","Ride Along"
"1449",3489480,3490641,"Shut up.","Ride Along"
"1450",3491360,3492724,"Before I tase you in the mouth.","Ride Along"
"1451",3492920,3494603,"That's illegal.That's very illegal.","Ride Along"
"1452",3497840,3498840,"What?","Ride Along"
"1453",3498920,3500001,"Did you hear about Runflat?","Ride Along"
"1454",3500079,3501730,"Turned himself in toCounty this morning.","Ride Along"
"1455",3501920,3504240,"Confessed to vandalism.Weird. Weird.","Ride Along"
"1456",3504400,3506322,"That ain't weird.He just scared.","Ride Along"
"1457",3506519,3509329,"Trying to get offthe streets. It's Omar.","Ride Along"
"1458",3509519,3512251,"If he's onto Runflat,then he's definitely onto us.","Ride Along"
"1459",3512480,3513969,"We might want topull our skirts","Ride Along"
"1460",3514079,3515605,"over our faces andjust back off, huh?","Ride Along"
"1461",3515760,3517728,"It will never happen,all right?","Ride Along"
"1462",3517813,3518934,"So just keep your eyes open.","Ride Along"
"1463",3518960,3520007,"All right, copy that.","Ride Along"
"1464",3520119,3521485,"That's a damn shame.","Ride Along"
"1465",3521639,3524166,"Boy just got out of jail andnow he got to go back already.","Ride Along"
"1466",3524320,3526639,"See, that's where you don'tknow what you're talking about.","Ride Along"
"1467",3526760,3530128,"Runflat ain't been on theinside for about two years now.","Ride Along"
"1468",3530280,3532168,"That's not whathis brother said.","Ride Along"
"1469",3534760,3536568,"Ow, man! What did he say?","Ride Along"
"1470",3536735,3538255,"I'm not telling younothing after that.","Ride Along"
"1471",3538280,3539565,"What did he say?","Ride Along"
"1472",3541760,3544490,"He said, ""You think I'm gonna givehim up when he just got back?""","Ride Along"
"1473",3544679,3545806,"That's exactly what he said?","Ride Along"
"1474",3545960,3548007,"I got perfect conversationrecall. It's a gift.","Ride Along"
"1475",3548840,3550079,"I just got another clue.","Ride Along"
"1476",3550239,3551719,"This is a two-cluekind of day for me,","Ride Along"
"1477",3551760,3553000,"and being that that's the case,","Ride Along"
"1478",3553039,3554201,"I need to be inthe front seat right now.","Ride Along"
"1479",3554320,3555367,"No, it ain't. Yes, it is.","Ride Along"
"1480",3555440,3558648,"The kid's got another brotherthat drove for Omar, all right?","Ride Along"
"1481",3558800,3561166,"He escaped custody, left town.","Ride Along"
"1482",3561320,3565483,"Now, no way he'd risk comingback unless he had to be.","Ride Along"
"1483",3565639,3566800,"So, what's our move?","Ride Along"
"1484",3567000,3568650,"My move is to find the brother.","Ride Along"
"1485",3568800,3571643,"Oh, come on. Come on, James,after all I just did?","Ride Along"
"1486",3571719,3572721,"What'd you do?","Ride Along"
"1487",3572800,3573925,"I'm giving you cluesleft and right!","Ride Along"
"1488",3574000,3575809,"No. I can help!","Ride Along"
"1489",3576039,3577643,"I'll keep my distance.I'm serious.","Ride Along"
"1490",3577840,3579329,"Veto. You're done.","Ride Along"
"1491",3579480,3581005,"Fine. Take me home.I don't need this.","Ride Along"
"1492",3581159,3582521,"I'm going home.I'll take you home.","Ride Along"
"1493",3582639,3583721,"I'm going to go homeand use the phone,","Ride Along"
