"id","startTime","endTime","text","title"
"1",25960,28121,"They told me you are the man.","Ride Along"
"2",28280,30361,"They said that this guycan move anything.","Ride Along"
"3",33600,34600,"They said that?","Ride Along"
"4",34759,35761,"Yeah.","Ride Along"
"5",35920,37125,"I am the man.","Ride Along"
"6",42039,43804,"USA passport.","Ride Along"
"7",44880,46484,"The most valuablepiece of paper","Ride Along"
"8",46640,48210,"in the world andwe make it our own.","Ride Along"
"9",48399,49765,"That shit's artisanal.","Ride Along"
"10",50119,52121,"I'll be the judge of that.","Ride Along"
"11",55439,56441,"Not bad.","Ride Along"
"12",57560,60325,"What about Omar?The friendly ghost?","Ride Along"
"13",60960,62724,"He ain't gonna cutyour head off for this?","Ride Along"
"14",62880,64120,"I know he owns the city.","Ride Along"
"15",64319,66971,"Omar signed off personally.","Ride Along"
"16",69319,73006,"I don't know who you think you'rebullshitting, but it ain't me.","Ride Along"
"17",75799,77245,"Calling me a liar?","Ride Along"
"18",77920,79763,"With guns on your face?","Ride Along"
"19",80799,82688,"You crazy you don't trust me.","Ride Along"
"20",83280,85088,"Let me explainsomething to you.","Ride Along"
"21",85519,87682,"There's not a lot inthis world that I love,","Ride Along"
"22",87760,91730,"but the shit that I love,I don't trust with nobody.","Ride Along"
"23",92159,93685,"I'll buy 50 now","Ride Along"
"24",94159,98370,"and 500 after Omarlooks me in my eye","Ride Along"
"25",98520,101921,"and lets me know he's not goingto kill me over this deal.","Ride Along"
"26",102120,104201,"Is that somethingyou can arrange?","Ride Along"
"27",104799,106688,"Or is it more bullshit?","Ride Along"
"28",113319,114685,"You're crazy, bro.","Ride Along"
"29",114920,116728,"Yeah, I am crazy,","Ride Along"
"30",117280,118849,"but in a good way.","Ride Along"
"31",141560,142686,"Shit!","Ride Along"
"32",149560,151641,"Everybody down! Atlanta PD!","Ride Along"
"33",153400,154366,"There!","Ride Along"
"34",154439,155850,"Shit!","Ride Along"
"35",168599,169885,"Freeze!","Ride Along"
"36",182719,185007,"Freeze! I said freeze!","Ride Along"
"37",185120,186246,"Atlanta PD!","Ride Along"
"38",186319,187889,"Get down!","Ride Along"
"39",189159,191127,"See you, bitches!","Ride Along"
"40",198840,200204,"Freeze!","Ride Along"
"41",205280,207009,"Atlanta PD! Get me another car!","Ride Along"
"42",208159,210730,"A Prius? Get thisbullshit out of here!","Ride Along"
"43",214120,215121,"Damn!","Ride Along"
"44",216520,217805,"Valet. Get out.","Ride Along"
"45",217960,219644,"Get out! Yeah!","Ride Along"
"46",230800,232086,"Asshole!","Ride Along"
"47",236840,238079,"Move, trick!","Ride Along"
"48",238520,239600,"Get out the way!","Ride Along"
"49",241479,242969,"Here we go.","Ride Along"
"50",243800,244925,"Hey!","Ride Along"
"51",245360,247088,"Whoo!","Ride Along"
"52",251840,252966,"Oh, shit!","Ride Along"
"53",253840,255490,"How you like me now?","Ride Along"
"54",258120,259245,"Stop! Stop!","Ride Along"
"55",264240,265401,"Oh, shit!","Ride Along"
"56",272199,273281,"Yeah, baby!","Ride Along"
"57",278720,280050,"I got you.","Ride Along"
"58",288759,289761,"Yeah!","Ride Along"
"59",293040,294245,"I tried to be nice.","Ride Along"
"60",299840,303447,"You thought I was crazy?No, baby, I'm nuts.","Ride Along"
"61",306439,308567,"Does anybodyhave a twenty on Black Hammer?","Ride Along"
"62",309439,313286,"All right,let's get these bitches!","Ride Along"
"63",313439,315886,"The target's on the second floor.Let's switch it up.","Ride Along"
"64",316079,317764,"Assface, me and you,we'll go around back.","Ride Along"
"65",317959,319360,"Copy that.Watch your friendly fire.","Ride Along"
"66",319399,321160,"Hey! Guys, remember,if they throw a grenade,","Ride Along"
"67",321240,323129,"you got five seconds to pickit up and throw it back.","Ride Along"
"68",323199,324167,"Frag out.","Ride Along"
"69",324240,326129,"This is not a game,gentlemen, this is real.","Ride Along"
"70",326240,328129,"- Be on your toes at all times.- Copy that.","Ride Along"
"71",328279,329406,"How's my king this morning?","Ride Along"
"72",330079,331605,"Good. I'm fine, babe.","Ride Along"
"73",331759,334127,"Wasting his royal talentsin the kingdom, I see.","Ride Along"
"74",334279,335610,"Bogies at nine. Bogies at nine.","Ride Along"
"75",335759,337444,"I don't know if you're beingsarcastic, but I'm not.","Ride Along"
"76",337600,338840,"Right now I'm ona black bag op.","Ride Along"
"77",339240,340286,"Kick move!","Ride Along"
"78",340480,342322,"Can we talk? Babe, in a second.","Ride Along"
"79",342480,344209,"Did you call me ""babe""?I didn't call you ""babe.""","Ride Along"
"80",344319,345920,"Shut up, Assface.I'm talking to my lady.","Ride Along"
"81",346574,348735,"Do what you're supposed to do.Get eyes on that sniper.","Ride Along"
"82",348759,350922,"Does anybody haveeyes on the sniper?","Ride Along"
"83",351120,352360,"Ben, let's go.","Ride Along"
"84",352480,353766,"This is not the time.","Ride Along"
"85",353920,355444,"Stop. Ang, don't start.","Ride Along"
"86",355600,358000,"Oh, I'm sorry, guys,the real world needs Ben. Bye.","Ride Along"
"87",358159,359521,"Stop playing.Give me the joystick.","Ride Along"
"88",359639,361927,"Give me it back. Look atwhat you're doing right now.","Ride Along"
"89",362120,364009,"Stop. Seriously.Move me out of the thing.","Ride Along"
"90",364160,366447,"Put me in a bunker.You going to get me...","Ride Along"
"91",366920,369571,"Wow. Stop! Hey. Oh!","Ride Along"
"92",369759,370761,"Not again, Ben.","Ride Along"
"93",371079,372127,"No! No!","Ride Along"
"94",372240,373286,"That really hurts. ON. ON!","Ride Along"
"95",374000,375000,"Hi, Angela.","Ride Along"
"96",375120,376848,"Even soldiers have toget to work on time.","Ride Along"
"97",377000,378524,"You're pro-Taliban. You are.","Ride Along"
"98",378600,379600,"Stop.","Ride Along"
"99",379959,382610,"I'm sorry, guys. I had a blackbird in the living room.","Ride Along"
"100",382759,383807,"I didn't hear it chirp.","Ride Along"
"101",384079,385809,"It's not fair.Here's the thing,","Ride Along"
"102",385959,387404,"you have to understandhow easy it is for me","Ride Along"
"103",387519,388964,"to get caught upinto that world.","Ride Along"
"104",389120,391326,"I feel like I had been fighting inPakistan for the last eight hours.","Ride Along"
"105",391480,393925,"Okay,first of all, ""Black Hammer""?","Ride Along"
"106",394120,395167,"Speaking.","Ride Along"
"107",395279,396326,"What is that about?","Ride Along"
"108",396480,398322,"That's about when I pull my penisout and it hits the ground.","Ride Along"
"109",398639,400324,"Kaboom. Boom!","Ride Along"
"110",400399,402322,"What are you laughing for?","Ride Along"
"111",402480,404322,"You do know that you're goingto be Mrs. Black Hammer.","Ride Along"
"112",404480,406004,"The words every girlwants to hear.","Ride Along"
"113",406079,407081,"It better be.","Ride Along"
"114",407199,410329,"Mmm. And when exactlyis this Black Hammer wedding?","Ride Along"
"115",410480,412846,"Soon. Very, very soon. Mmm-hmm.","Ride Along"
"116",412920,414081,"Things aregetting close to where","Ride Along"
"117",414199,415360,"I want them to be.I'm figuring it out.","Ride Along"
"118",415439,417090,"Can you make me one? Mmm. Sure.","Ride Along"
"119",417159,420004,"So, is this aboutyou becoming a cop?","Ride Along"
"120",420079,421081,"Yes, it is.","Ride Along"
"121",421279,424124,"I got it all figured out.Here's what's going to happen.","Ride Along"
"122",424279,425360,"I'm going to getinto the police academy.","Ride Along"
"123",425560,427324,"After that I'mgoing to be on patrol.","Ride Along"
"124",427480,429163,"After that I'mgoing to be a detective.","Ride Along"
"125",429360,431009,"After being a detective,I'm going to be a lieutenant.","Ride Along"
"126",431120,432920,"That's how it happens.Boom, boom, boom, boom.","Ride Along"
"127",433000,435685,"You know that I love you withor without the academy, right?","Ride Along"
"128",435839,437490,"I understand that,but this is different.","Ride Along"
"129",437639,440211,"I got such a good feeling, babe.I did everything right.","Ride Along"
"130",440360,443920,"Did you tell my brotherthat you signed up?","Ride Along"
"131",444360,446408,"I'm going to be honest,and don't get mad at me,","Ride Along"
"132",446519,447567,"but I'm going to saywhat I want to say.","Ride Along"
"133",447920,449331,"Here's how I feel when itcomes to your brother.","Ride Along"
"134",449480,450845,"First of all, I've reached out,","Ride Along"
"135",450920,453286,"but I know that your brother isignoring me because of that incident.","Ride Along"
"136",453360,456807,"The barbeque incident was a first-degreeburn, not a third-degree burn.","Ride Along"
"137",456879,458370,"I've gotten past it, okay.","Ride Along"
"138",458720,460483,"He doesn't have to know. Idon't see why it's important.","Ride Along"
"139",460600,463524,"Seriously, Ben, if I'm evergoing to be Mrs. Hammer...","Ride Along"
"140",463720,465245,"Black Hammer. Black Hammer.","Ride Along"
"141",465399,466925,"Hammer. Got it.","Ride Along"
"142",467399,469562,"I need him to be on board.","Ride Along"
"143",469720,472007,"You two are the mostimportant men in my life.","Ride Along"
"144",472199,474043,"What you just saidhas been received.","Ride Along"
"145",474240,475730,"I will check in.","Ride Along"
"146",475879,476880,"Give me a kiss.","Ride Along"
"147",477053,478894,"Done. You know whatwe're doing tonight, right?","Ride Along"
"148",478920,480569,"Mmm... Yes. What?","Ride Along"
"149",480720,482721,"Dinner. Yeah.Dinner at Dominick's.","Ride Along"
"150",482879,486406,"A romantic dinner followed bysome sweet, sweet lovemaking,","Ride Along"
"151",486519,487521,"dirty style.","Ride Along"
"152",487920,488959,"That's right. Dirty style.","Ride Along"
"153",489079,492084,"Dirty style? What is that move?","Ride Along"
"154",492240,494367,"It's the move thatRihanna does in that video.","Ride Along"
"155",494519,495646,"I don't think that's it.","Ride Along"
"156",495800,497130,"This is it. It's very sexy.","Ride Along"
"157",497240,498240,"Is it? Yes.","Ride Along"
"158",498399,499920,"I actually saw itin a Kama Sutra book.","Ride Along"
"159",500040,501610,"They call itthe ""Lathered Lotus.""","Ride Along"
"160",501759,503762,"After I'm done doing that, I'mgoing to give you the Kawasaki.","Ride Along"
"161",503879,505723,"IDon't understand what that is.","Ride Along"
"162",505774,506935,"That's starting that bike up.","Ride Along"
"163",506959,508564,"After that, what doyou think comes last?","Ride Along"
"164",508720,509766,"Ah, let me guess. What?","Ride Along"
"165",509920,511524,"Black Hammer.","Ride Along"
"166",511639,513289,"That's right. Kaboom. Boom!","Ride Along"
"167",513440,515249,"Uh, dude, turnyour mic off. This is awkward.","Ride Along"
"168",515399,517129,"Is that why youcall yourself Black Hammer?","Ride Along"
"169",517279,519520,"I thought it had something todo with Thor from Avengers.","Ride Along"
"170",520240,521321,"No. Ben.","Ride Along"
"171",521399,522366,"Why didn't youturn the game off?","Ride Along"
"172",522440,523486,"You didn't turn the game off.","Ride Along"
"173",523559,524527,"Congratulations.","Ride Along"
"174",524600,526489,"They know we have a nasty household.Is that what you want?","Ride Along"
"175",526559,527765,"Because of you. Whatever.","Ride Along"
"176",529440,530804,"""BROOKS"". A car chase? Come on.","Ride Along"
"177",530960,533326,"I authorized this operationwith very clear guidelines.","Ride Along"
"178",533480,537086,"Instead, you shoot up a mall full ofcivilians like it's a damn video game.","Ride Along"
"179",537240,539846,"And for what? Fake passports?","Ride Along"
"180",540399,541924,"Thinking thosewould lead us to Omar.","Ride Along"
"181",542080,543081,"Of course you were.","Ride Along"
"182",543240,545606,"Do you know how many manhours we spent on this case?","Ride Along"
"183",545679,547159,"And in two and a half yearsyou've had","Ride Along"
"184",547200,548644,"no breaks,so enough of this shit.","Ride Along"
"185",548960,550849,"Your obsession aside,there's no criminal,","Ride Along"
"186",551000,552889,"nobody you get touse as an excuse","Ride Along"
"187",553000,554842,"for ignoringthe rules of engagement.","Ride Along"
"188",555000,556764,"Lieutenant, this was a special...Nobody!","Ride Along"
"189",556840,558250,"And especiallynot for some lowlife","Ride Along"
"190",558360,559770,"nobody's ever even seen before!","Ride Along"
"191",559960,561245,"We know what he looked likewhen he was nine.","Ride Along"
"192",561320,562321,"Shut up, Miggs.","Ride Along"
"193",562440,566161,"Look, these Serbs are dealingmore than just passports.","Ride Along"
"194",566320,570847,"The fact that they're still alive letsme know they got something Omar wants.","Ride Along"
"195",571000,572923,"Which was going tolead us right to him.","Ride Along"
"196",573000,575571,"Well, this Marko guy's alreadylawyered up and he's refusing to talk","Ride Along"
"197",575639,577369,"except to claim entrapment.","Ride Along"
"198",577519,579283,"Entrapment?How about attempted murder?","Ride Along"
"199",579440,580441,"Asshole tried to kill me.","Ride Along"
"200",580519,581806,"Oh, you little pussy.","Ride Along"
"201",581960,583404,"Someday somebody's goingto shoot you in the face","Ride Along"
"202",583519,584850,"and that vest isn'tgonna do you any good.","Ride Along"
"203",585000,586842,"The lawyer's alreadyclaiming self-defense.","Ride Along"
"204",587000,588125,"Says you guysfired the first shots.","Ride Along"
"205",588200,591807,"Self-defense? With alldue respect, that's bullshit.","Ride Along"
"206",591960,593529,"I'm shorteningyour leash, James.","Ride Along"
"207",593679,596159,"We all want Omar, but theseguys are a waste of time.","Ride Along"
"208",597000,598490,"That's all.Get out, all of you.","Ride Along"
"209",600799,602600,"Hey, James, how aboutnext time that you don't","Ride Along"
"210",602679,604443,"tell me thatthis is about Omar,","Ride Along"
"211",604519,605567,"you tell me, huh?","Ride Along"
"212",605840,608206,"I don't want you tostart worrying, Santiago.","Ride Along"
"213",608360,610249,"Worry? What are you, my mother?Come on, James.","Ride Along"
"214",610320,611970,"You go into a back room,out of contact,","Ride Along"
"215",612039,613610,"you come out with three armedguys and a motorcycle.","Ride Along"
"216",613679,615044,"You don't want me to worry?","Ride Along"
"217",615159,616490,"That isneed-to-know information.","Ride Along"
"218",616639,619120,"We're going in there with nobackup, I want to be scared, man.","Ride Along"
"219",619200,623046,"I want to be so terrified, I'm lettingout little involuntary shits. Okay?","Ride Along"
"220",623200,624725,"Who put this together?","Ride Along"
"221",624879,627530,"Me. All right? Follow my lead.","Ride Along"
"222",627679,630047,"I'm the brains, you the brawns.","Ride Along"
"223",630720,631846,"The ""bronze""?","Ride Along"
"224",632000,634240,"Yeah, it's the plural of brawn.","Ride Along"
"225",635720,636846,"I know.","Ride Along"
"226",638335,640215,"Since when do you needthe brother's permission?","Ride Along"
"227",640240,643049,"He is her only livingrelative, I get that.","Ride Along"
"228",643240,644960,"Her dad was a cop.He got killed on the job.","Ride Along"
"229",645120,646120,"Oh, that's terrible.","Ride Along"
"230",646200,647201,"I'm not takinganything away from that.","Ride Along"
"231",647414,649095,"But why do I have tosuck up to the brother","Ride Along"
"232",649120,650639,"just because shewants us to get along?","Ride Along"
"233",650919,653764,"It would be easier, but he's stillupset because I set him on fire.","Ride Along"
"234",653960,654961,"What? Here's the thing.","Ride Along"
"235",655120,657009,"Doggone propane knob. What I did...","Ride Along"
"236",657080,658570,"Hold on. Hold on.","Ride Along"
"237",659600,663240,"What did I tell you?Get down! Get down, boy!","Ride Along"
"238",663399,666927,"Hey! Hey! You're white!You're white!","Ride Along"
"239",667039,668041,"You don't fight.","Ride Along"
"240",668600,669681,"What's wrong with you?","Ride Along"
"241",669799,670926,"Come on, bro, let's roll.","Ride Along"
"242",672720,674448,"Hey, Ramon!","Ride Along"
"243",675240,677000,"You're not going to dothis today. Watch out.","Ride Along"
"244",677480,678765,"Kick move.","Ride Along"
"245",680399,683085,"Hey, Ramon! Hey, hey, hey!","Ride Along"
"246",683759,685409,"Ramon!Man, it's the rent-a-cop.","Ride Along"
"247",685559,687163,"I know you hear me.","Ride Along"
"248",687320,688321,"What are youdoing with these guys?","Ride Along"
"249",688440,689441,"Catch you later, Ramon.","Ride Along"
"250",689600,691090,"Don't you gotan English test today?","Ride Along"
"251",691159,692365,"You think they'regoing to let you","Ride Along"
"252",692480,693640,"play basketball ifyou fail that test?","Ride Along"
"253",693720,695051,"I already speak English.","Ride Along"
"254",695120,697929,"Okay. Well, go ahead.You got it figured out.","Ride Along"
"255",698960,702806,"Hey. Before you go,let's play this out. Okay?","Ride Along"
"256",702960,704644,"You go with them,you get drunk.","Ride Along"
"257",704799,706881,"Now that you're drunk,you can't play basketball.","Ride Along"
"258",707000,708159,"How long before you drop out?","Ride Along"
"259",709159,710286,"I give it a week.","Ride Along"
"260",710480,712129,"So now you'rea 17-year-old wino.","Ride Along"
"261",712279,714681,"When you're a wino,you do what winos do best.","Ride Along"
"262",714840,717161,"You're going to jail.Once, twice.","Ride Along"
"263",717360,720169,"Third time you get a hard judge.Judge gives you two choices.","Ride Along"
"264",720279,722639,"You got jail, you got the army.Which one you going to take?","Ride Along"
"265",723360,724566,"Army ain't so bad.","Ride Along"
"266",724639,725971,"You're right, it's not.","Ride Along"
"267",726159,728639,"Except you forgotabout one thing. War!","Ride Along"
"268",728960,730325,"So now you're in Afghanistan.","Ride Along"
"269",730480,733211,"You know what they got in Afghanistan?Landmines!","Ride Along"
"270",733360,735202,"Boom! You got no legs.","Ride Along"
"271",735360,737567,"So now what happens?You're right back here.","Ride Along"
"272",737639,740849,"You're in the streets, but let'sremember, you got no diploma,","Ride Along"
"273",741000,743128,"you got no feet,you got no job.","Ride Along"
"274",743360,745442,"That means you'reback at the liquor store","Ride Along"
"275",745639,747528,"getting drunk all damn day.","Ride Along"
"276",747720,751201,"Now that you're drunk all day, you tryto steal because you don't have a job,","Ride Along"
"277",751279,753681,"but your stealing ain't goingtoo good because you can't run.","Ride Along"
"278",753840,756047,"You know why you can't run?Because you got no feet!","Ride Along"
"279",756200,758806,"Now you're stuck livingin a refrigerator box.","Ride Along"
"280",758960,760849,"Here's the bad thing.You're lonely,","Ride Along"
"281",760960,762802,"you're in a gutter,and you're legless.","Ride Along"
"282",762960,764404,"Is that what you want, huh?","Ride Along"
"283",764559,766288,"Come on, let's go!","Ride Along"
"284",769480,771040,"I think I'm going togo back inside now.","Ride Along"
"285",771080,772683,"You going to walk. Run.","Ride Along"
"286",772840,774205,"Okay. All right. Sprint.","Ride Along"
"287",774360,776931,"Because if you didn't havelegs, you got to crawl.","Ride Along"
"288",777080,779207,"All right, man, go ahead.","Ride Along"
"289",779679,781408,"You're something else.","Ride Along"
"290",781559,784403,"About the dumbestdamn kid in this school.","Ride Along"
"291",786679,789159,"I can't do it. I ain't gonnabe everybody's mentor.","Ride Along"
"292",789320,790764,"I don't get paid for that.","Ride Along"
"293",792679,794886,"I've been waitingall day to look at this.","Ride Along"
"294",801720,802721,"I got in!","Ride Along"
"295",805879,807927,"I'm in the academy!","Ride Along"
"296",808080,809730,"Freeze. Get down.","Ride Along"
"297",809879,813123,"Freeze, you best put it downbecause I'm about to make change.","Ride Along"
"298",814240,816241,"I have to call James!","Ride Along"
"299",820519,821520,"Jesus Christ!","Ride Along"
"300",821600,822885,"Are you blowingup there, James?","Ride Along"
"301",822960,824165,"I have to ditch this phone.","Ride Along"
"302",824240,828164,"You can't stop Santiago's morn, man.You can only hope to contain.","Ride Along"
"303",828240,830921,"Hey, I know you're trying to insultme, but it's just too true, bro.","Ride Along"
"304",830960,832961,"No, it's that little clownthat's dating my sister.","Ride Along"
"305",833120,835520,"About a chromosome awayfrom being a midget.","Ride Along"
"306",836759,839000,"I should have put a stopto that a long time ago.","Ride Along"
"307",839080,840126,"So why didn't you, bro?","Ride Along"
"308",840240,841287,"I tried.","Ride Along"
"309",841480,845245,"She loves his little ass. I don'tknow what she sees in him.","Ride Along"
"310",845399,846924,"Maybe he's just a super lover.","Ride Along"
"311",847080,850447,"He's short but maybe when he takeshis pants off it's just like...","Ride Along"
"312",850600,852090,"""What is that?""","Ride Along"
"313",852200,853644,"Just right for her.She loves it.","Ride Along"
"314",863080,864605,"What? That's disgusting.","Ride Along"
"315",865600,867886,"Look, man, does she knowyou think this guy is a jerk?","Ride Along"
"316",867960,868961,"Have you told her that?","Ride Along"
"317",869159,870840,"I have to come ata different angle because","Ride Along"
"318",871159,872764,"she's not gonna wantme in her business.","Ride Along"
"319",872919,874570,"I have to ditch this dude.","Ride Along"
"320",874639,876323,"Look, man,maybe this guy is all right.","Ride Along"
"321",876440,878168,"Maybe he justwants into the family.","Ride Along"
"322",878799,880847,"I know exactly what he wants.","Ride Along"
"323",883080,884126,"I love you.","Ride Along"
"324",884320,885366,"Baby, congratulations.","Ride Along"
"325",887000,888683,"You know whatI want to do to you?","Ride Along"
"326",889639,891323,"What do you want to do?Let's go upstairs.","Ride Along"
"327",892000,893161,"No. No. Yeah, yeah.","Ride Along"
"328",893320,895971,"No, because if we go up there youknow what's going to happen.","Ride Along"
"329",896094,897695,"You'll want to brush your teeth.Mmm-hmm.","Ride Along"
"330",897720,899210,"After that you'regoing to wash your face.","Ride Along"
"331",899360,901488,"Then you got to put creamand stuff on your face.","Ride Along"
"332",901639,903448,"Let's be spontaneous.Let's do it right here.","Ride Along"
"333",903600,905080,"I want to be wild like a savage.Okay.","Ride Along"
"334",905200,907486,"Give you that Kawasaki.","Ride Along"
"335",907679,908841,"I'm about to giveit to you right now.","Ride Along"
"336",909000,910125,"You know what I want?What you want?","Ride Along"
"337",910279,911485,"I want that kaboom.","Ride Along"
"338",911679,914125,"Girl, you'retrying to crawl down...","Ride Along"
"339",914200,915246,"The Black Hammer.","Ride Along"
"340",915320,916605,"You want the hammer?I want the hammer.","Ride Along"
"341",916679,918125,"Then go get the hammer.","Ride Along"
"342",918200,919280,"Okay. Enough of that nastiness.","Ride Along"
"343",919360,920360,"Oh, my God!","Ride Along"
"344",920480,922322,"Babe, call 911! Now!","Ride Along"
"345",922679,924886,"Get out of my house,you son of a bitch!","Ride Along"
"346",928360,929645,"I can't believe this shit.","Ride Along"
"347",929720,931802,"Angela, what if Iwas a real intruder?","Ride Along"
"348",931879,934120,"Instead of my brothercreeping around my house?","Ride Along"
"349",934200,935201,"Wasn't nobody creeping.","Ride Along"
"350",935679,938125,"You were sitting in the darkwith a coke and a hot dog.","Ride Along"
"351",938200,939850,"If you'd lock the dooror close the window","Ride Along"
"352",940039,941610,"or bar that patiolike I told you.","Ride Along"
"353",941679,944763,"This is exactly why I didn't letyou install the alarm system.","Ride Along"
"354",944879,947120,"It's about who's going to protect you.This weenie?","Ride Along"
"355",947200,949282,"One, he is not a weenie!","Ride Along"
"356",949360,951043,"He can be weenie-ish,","Ride Along"
"357",951200,954124,"weenie-like, but I lovehim, so it doesn't matter.","Ride Along"
"358",954200,956965,"I picture you with somebodywith a little more prestige.","Ride Along"
"359",957159,958844,"Somebody who playsfor the Falcons","Ride Along"
"360",958919,960000,"or the Braves,or even the Hawks.","Ride Along"
"361",960120,961201,"Braves. Yeah.","Ride Along"
"362",961399,962730,"Not with the mascot.","Ride Along"
"363",963039,964485,"James, listen to me,","Ride Along"
"364",964559,966004,"you do not screwthis up for me.","Ride Along"
"365",966080,967524,"BENZ Hey, GUYS-","Ride Along"
"366",967679,970649,"I can hear what you're saying.So if you want to stop.","Ride Along"
"367",970720,971841,"Damn, it's Sir Scream-a-Lot.","Ride Along"
"368",971879,972927,"James...","Ride Along"
"369",973000,975844,"I was responding toa hostile situation, James.","Ride Along"
"370",976039,977086,"I have no shame in that.","Ride Along"
"371",977240,979447,"You call for backup whenthere's a hostile situation.","Ride Along"
"372",979519,980850,"That wasn't calling for backup.","Ride Along"
"373",980919,982570,"That was a high-pitched scream,","Ride Along"
"374",982679,984283,"and you pushedmy sister in the way.","Ride Along"
"375",984360,986647,"I pushed your sisterout of harm's way.","Ride Along"
"376",986720,988289,"You shined the light at us.","Ride Along"
"377",988440,990363,"It's different strokesfor different folks.","Ride Along"
"378",990440,992647,"Put the ice pack inhis mouth. No, on his head.","Ride Along"
