"id","startTime","endTime","text","title"
"1494",3583880,3585244,"call Lieutenant Brooksand tell him","Ride Along"
"1495",3585360,3586724,"you out herefreelancing this Omar case.","Ride Along"
"1496",3586880,3588324,"See what he thinks about that.","Ride Along"
"1497",3588519,3590204,"You better not. Oh, I am.","Ride Along"
"1498",3590320,3591400,"You'd callthe lieutenant and tell...","Ride Along"
"1499",3591480,3593164,"You damn rightI'll call the lieutenant.","Ride Along"
"1500",3594519,3596090,"You little snitch bitch.","Ride Along"
"1501",3596159,3598400,"Call me whatever you want.Snitch Bitch Ben.","Ride Along"
"1502",3617880,3620086,"Hey, man, you know whereI can get these things?","Ride Along"
"1503",3620239,3623322,"Oh, hell no! I got the rightto refuse service...","Ride Along"
"1504",3623480,3625402,"You better belucky it wasn't me.","Ride Along"
"1505",3626039,3627882,"James, you broke the glass!","Ride Along"
"1506",3629000,3630047,"Oh, shit!","Ride Along"
"1507",3630199,3632567,"What's up? Come here.Get your ass over here, boy.","Ride Along"
"1508",3632719,3633880,"Get your hands off me, pig!","Ride Along"
"1509",3634039,3635166,"What you doing? Hey!","Ride Along"
"1510",3635360,3638920,"How stupid are you to hide out in thesame place we found you before, Jay?","Ride Along"
"1511",3639079,3641242,"Plain sight.Classic tactic, man.","Ride Along"
"1512",3641400,3644210,"You better tell me where thatSerbian buy is going down, boy,","Ride Along"
"1513",3644280,3646009,"or I'm gonna give youa classic tactic.","Ride Along"
"1514",3646199,3647565,"I ain't telling you nothing!","Ride Along"
"1515",3647719,3649847,"Why'd you evencome back, Jay, huh?","Ride Along"
"1516",3650039,3651882,"This is becominga family tradition.","Ride Along"
"1517",3652079,3655925,"Tell me where that buy is, or yougoing to jail with a bullet wound.","Ride Along"
"1518",3656079,3658003,"You think he playing with you?You think he got time for games?","Ride Along"
"1519",3658079,3660481,"This man is crazy. If he pull thegun out, that means he serious.","Ride Along"
"1520",3660559,3661561,"Tell him wherethe buy is going down.","Ride Along"
"1521",3661639,3662766,"Where's it going down at?","Ride Along"
"1522",3663199,3664326,"Bullshit.","Ride Along"
"1523",3664559,3665891,"Bullshit?","Ride Along"
"1524",3666039,3667768,"Oh, no, this is real shit.","Ride Along"
"1525",3667920,3669684,"You better tell mewhere that buy going down!","Ride Along"
"1526",3669840,3673003,"Tell us where the buy is. You hear me?Tell us where the buy is!","Ride Along"
"1527",3673159,3674525,"Forget both of y'all!","Ride Along"
"1528",3674679,3675840,"Really? That's how you feel?","Ride Along"
"1529",3676000,3677400,"You want to feel this?That's right!","Ride Along"
"1530",3677440,3679601,"You want to see crazy?I'll show you crazy!","Ride Along"
"1531",3680039,3681768,"Tell me where the buy is!Tell me where...","Ride Along"
"1532",3683519,3684521,"Oh, shit.","Ride Along"
"1533",3684679,3686284,"He shot me!","Ride Along"
"1534",3686440,3687929,"I'm sorry.","Ride Along"
"1535",3688119,3689565,"Yeah, he shot your ass.","Ride Along"
"1536",3689679,3691204,"You damn right I shot your ass.","Ride Along"
"1537",3691360,3693043,"He going to shoot you again.No. No.","Ride Along"
"1538",3693199,3694849,"Because he crazy.I can't handle this one.","Ride Along"
"1539",3694960,3696041,"I'm crazy.","Ride Along"
"1540",3696119,3697690,"I can't handle this one.It's out of my hands.","Ride Along"
"1541",3697760,3698920,"You want to see crazy?","Ride Along"
"1542",3699000,3701400,"I'll show you crazy!You think it's a game?","Ride Along"
"1543",3701559,3702606,"Tell us where the buy is!","Ride Along"
"1544",3702679,3703840,"You better tell mewhere the buy is!","Ride Along"
"1545",3704000,3705331,"Okay-Okay-","Ride Along"
"1546",3706840,3709445,"It's at the old factory. Theabandoned one off of Huber.","Ride Along"
"1547",3709639,3711289,"Okay. Old abandoned factory.","Ride Along"
"1548",3711440,3713168,"What time? 9:00.","Ride Along"
"1549",3713679,3716126,"If you lying, Jay, I'm gonnashoot you in the other shoulder.","Ride Along"
"1550",3716280,3717485,"Just keep him away from me!","Ride Along"
"1551",3717639,3718971,"Boy, you want it hot?","Ride Along"
"1552",3719119,3721327,"You want to get somehot slugs up in you?","Ride Along"
"1553",3721480,3722641,"Slugfest, homie.","Ride Along"
"1554",3722800,3724643,"Chitty-chitty-bang-bang!","Ride Along"
"1555",3726440,3728487,"Hey, man, it's going down now.","Ride Along"
"1556",3728639,3729800,"Over at that oldfactory on Huber.","Ride Along"
"1557",3729960,3731166,"Shit.","Ride Along"
"1558",3731320,3732367,"Okay, I'm on my way.","Ride Along"
"1559",3732519,3734400,"I'm calling in for someheavy backup, all right?","Ride Along"
"1560",3734440,3735440,"All right.","Ride Along"
"1561",3735639,3736641,"Where'd you get that gun?","Ride Along"
"1562",3737039,3738485,"I kept it from the club.","Ride Along"
"1563",3738639,3740688,"You know the guyyou shot in the ass?","Ride Along"
"1564",3740880,3742643,"Come on, man! Now!","Ride Along"
"1565",3744000,3745489,"Here! Hey, mother...","Ride Along"
"1566",3746159,3749322,"I thought the safety was on. I gothim to talk though, didn't I?","Ride Along"
"1567",3749480,3752130,"Yeah, you got a very interestinginterrogation voice.","Ride Along"
"1568",3752320,3753684,"Nice and screechy.","Ride Along"
"1569",3753840,3755204,"Okay. It's all this intensity.","Ride Along"
"1570",3755360,3756885,"That's what it is.","Ride Along"
"1571",3775039,3776371,"Wait for me here.","Ride Along"
"1572",3776480,3777811,"Are you serious?","Ride Along"
"1573",3778000,3779161,"Of course I'm serious.","Ride Along"
"1574",3779320,3781360,"If I had time to drop youoff, I would, but I don't.","Ride Along"
"1575",3781519,3784090,"It's my clue that got us here.I've been helping you all day!","Ride Along"
"1576",3784239,3785480,"Oh, you have? Yes.","Ride Along"
"1577",3785639,3788085,"Is that why you just shot somebody?On accident?","Ride Along"
"1578",3788239,3789240,"That's not fair.","Ride Along"
"1579",3789320,3792289,"And before that, you asked asuspect to actually execute you.","Ride Along"
"1580",3792360,3794840,"That's because I thought it wasanother 126. You know that.","Ride Along"
"1581",3794920,3796762,"This is not another 126, Ben.","Ride Along"
"1582",3796920,3798570,"This is the real deal.","Ride Along"
"1583",3798719,3800688,"So the time for jokes is over.","Ride Along"
"1584",3800840,3803280,"So the kind of help you got, it'snot the kind of help I need.","Ride Along"
"1585",3803400,3804731,"I'm just trying to go...","Ride Along"
"1586",3804880,3806291,"Do I have to cuffyou to the wheel?","Ride Along"
"1587",3809360,3811407,"You ain't gotta do that.","Ride Along"
"1588",3818599,3819601,"Where's your ride-along?","Ride Along"
"1589",3819920,3822445,"He flamed out.I had to take him back.","Ride Along"
"1590",3822599,3823646,"Where's backup?","Ride Along"
"1591",3823719,3824766,"Probably running late.","Ride Along"
"1592",3824880,3826369,"Listen, I got a look inside.","Ride Along"
"1593",3826519,3828409,"They're all in there,it's going down right now.","Ride Along"
"1594",3828960,3830041,"We not waiting.","Ride Along"
"1595",3830119,3832771,"Just FYI, when I get in there I'mgonna start shooting people.","Ride Along"
"1596",3832920,3834159,"I haven't shot anybody all day.","Ride Along"
"1597",3834239,3835764,"We know, Santiago.Let's hit it.","Ride Along"
"1598",3856079,3859606,"Okay. Here's whatwe should do. I...","Ride Along"
"1599",3859760,3861409,"Man, what the... Oh!","Ride Along"
"1600",3861559,3862721,"Oh, hell no.","Ride Along"
"1601",3862960,3864007,"That's right. Stay still.","Ride Along"
"1602",3864159,3865445,"Yeah, surprise.","Ride Along"
"1603",3869079,3870206,"I don't want to hear that.","Ride Along"
"1604",3872239,3875289,"A-B-C-D-E-F-G-H-l-J-K-L-M-N-O-P...I can't do it.","Ride Along"
"1605",3878000,3882641,"I can't believe you two punks beenprotecting Omar this whole time.","Ride Along"
"1606",3882800,3883960,"Pays well.","Ride Along"
"1607",3884119,3887442,"No benefits, but we getthose from the day job.","Ride Along"
"1608",3887599,3888646,"I should have known.","Ride Along"
"1609",3888800,3889925,"Greedy bastards.","Ride Along"
"1610",3890079,3891809,"James, we're notgiving anything away.","Ride Along"
"1611",3891960,3893639,"We're selling itbecause we're businessmen.","Ride Along"
"1612",3893760,3896490,"And we're enterprising it so thatOmar won't have to hide no more.","Ride Along"
"1613",3896639,3899371,"And all you had to do wasjust let it go for one day.","Ride Along"
"1614",3899494,3900775,"If you had letit go for one day,","Ride Along"
"1615",3900800,3902039,"you wouldn't be here right now.","Ride Along"
"1616",3911000,3913128,"Now things are notgonna end well for you.","Ride Along"
"1617",3913280,3914360,"Yeah, don't be too sure.","Ride Along"
"1618",3914519,3916681,"You didn't want toplay ball, so here we are.","Ride Along"
"1619",3917360,3919840,"It's not easy on us either,believe me.","Ride Along"
"1620",3922679,3926161,"Oh, my God! Shit!","Ride Along"
"1621",3927480,3928811,"Thank you.","Ride Along"
"1622",3928960,3932521,"Omar appreciates thedelivery of his weapons.","Ride Along"
"1623",3932679,3933681,"What is this?","Ride Along"
"1624",3933840,3936730,"That's just a loose end that we'regonna take care of very soon.","Ride Along"
"1625",3936880,3938369,"Added bonus for Omar.","Ride Along"
"1626",3939000,3940842,"So, can wedo business now? Yeah.","Ride Along"
"1627",3941039,3942166,"Can I see the merchandise?","Ride Along"
"1628",3942280,3943440,"Victor.","Ride Along"
"1629",3945679,3947489,"Didn't have to be like this, James.Nice.","Ride Along"
"1630",3947559,3949121,"You could've hada little taste of that.","Ride Along"
"1631",3949239,3952130,"I for one, though, I feel hurt,because we never hung out.","Ride Along"
"1632",3952199,3954885,"We never watched sports orshared some chicks together.","Ride Along"
"1633",3955320,3957163,"It must be toughbeing an island though, huh?","Ride Along"
"1634",3957559,3958891,"Nobody to have your back.","Ride Along"
"1635",3959239,3961846,"You know what? You shouldsee a therapist about this,","Ride Along"
"1636",3962000,3964201,"because you don't want to spendthe rest of your life...","Ride Along"
"1637",3964840,3966364,"Oh, I'm sorry.","Ride Along"
"1638",3966559,3968880,"I forgot. You're about to die.","Ride Along"
"1639",3969039,3971804,"I want that one for myself.","Ride Along"
"1640",3982719,3984244,"Who the hell are you?","Ride Along"
"1641",3985119,3986360,"Who am I?","Ride Along"
"1642",3987360,3989088,"Who am I?","Ride Along"
"1643",3990559,3992130,"Oh, shit.","Ride Along"
"1644",3992280,3994043,"Yeah, that makes me laugh.","Ride Along"
"1645",3994199,3997043,"Especially considering thefact that this is my deal.","Ride Along"
"1646",3997119,3998166,"That these are my men.","Ride Along"
"1647",3998239,3999320,"Wait a minute.","Ride Along"
"1648",3999920,4000920,"You're Omar?","Ride Along"
"1649",4002719,4004130,"That's right.","Ride Along"
"1650",4004280,4005405,"Omar is here.","Ride Along"
"1651",4005760,4007364,"I know what you're thinking.","Ride Along"
"1652",4007559,4009449,"Nobody's everexpecting to see Omar,","Ride Along"
"1653",4009639,4011960,"but he's here. And why is that?","Ride Along"
"1654",4012119,4015726,"Nobody can tell me whybecause it's a surprise.","Ride Along"
"1655",4015880,4018041,"This is a surprise inspection.","Ride Along"
"1656",4018239,4020561,"So I suggest you allput a smile on your face,","Ride Along"
"1657",4020800,4024849,"because today is the day that Ifinally decided to let you see mine.","Ride Along"
"1658",4026280,4028806,"Welcome to me.","Ride Along"
"1659",4031079,4032161,"Where's Jay?","Ride Along"
"1660",4032320,4033844,"Oh, Jay?","Ride Along"
"1661",4034280,4037250,"I left Jay ass at the pawnshop because he wasn't prompt.","Ride Along"
"1662",4037800,4041690,"Everybody knows thatI like my shit prompt.","Ride Along"
"1663",4041960,4043199,"It's moreprofessional that way.","Ride Along"
"1664",4043760,4044920,"Ain't that right, my Serbs?","Ride Along"
"1665",4045960,4048644,"I've been keeping tabs on allof you for some time now.","Ride Along"
"1666",4048760,4049726,"You.","Ride Along"
"1667",4049800,4051039,"Oh...","Ride Along"
"1668",4051320,4054085,"Let me take the timeout to give you this.","Ride Along"
"1669",4056320,4057320,"Yeah.","Ride Along"
"1670",4057519,4060922,"You have been crushing allweek, you hear me? Yeah.","Ride Along"
"1671",4061079,4062844,"I need more men like you.","Ride Along"
"1672",4063000,4064280,"You're a good man,you know that?","Ride Along"
"1673",4064519,4066920,"I want you to keepkeeping on, young butt.","Ride Along"
"1674",4067480,4070005,"Matter of fact, do me afavor and give Omar a gun.","Ride Along"
"1675",4070159,4071206,"ASL-In?","Ride Along"
"1676",4071599,4072965,"Did I stutter, hmm?","Ride Along"
"1677",4073119,4074559,"You're gonnaembarrass me in front of","Ride Along"
"1678",4074639,4076050,"my crew after I justgave you a compliment?","Ride Along"
"1679",4076199,4078282,"I said, give Omar a gun.","Ride Along"
"1680",4087840,4090525,"Hold up. Now hold up.I thought Omar was 6'4"".","Ride Along"
"1681",4100520,4101567,"How tall is Omar now?","Ride Along"
"1682",4102880,4105239,"Anybody else want to weigh inon how tall he thinks Omar is?","Ride Along"
"1683",4105800,4108167,"No? Does anybodyelse want to test me?","Ride Along"
"1684",4108319,4110368,"We weren'texpecting to see you.","Ride Along"
"1685",4110520,4113409,"But it's better that we dealwith this business personally.","Ride Along"
"1686",4113560,4116722,"Of course it is. I'm sorryyou had to see that shit.","Ride Along"
"1687",4117039,4120203,"Hey, and I want to apologize forthis because that's not me, okay?","Ride Along"
"1688",4120359,4122680,"I don't want y'all thinking itis, and this is stupid, too.","Ride Along"
"1689",4122840,4124079,"So I'm sorry for that.","Ride Along"
"1690",4125039,4127884,"Now, I gotta take the time","Ride Along"
"1691",4128039,4131886,"to give a special shout-outto Miggs and Santiago.","Ride Along"
"1692",4132079,4133240,"Hell, yeah.","Ride Along"
"1693",4134720,4135881,"Yeah!","Ride Along"
"1694",4136039,4137201,"I'm clapping, ain't I?","Ride Along"
"1695",4137439,4138680,"Am I mapping?","Ride Along"
"1696",4140560,4142528,"Yeah!","Ride Along"
"1697",4142680,4144250,"My double agents.","Ride Along"
"1698",4144680,4147286,"You guys brought methe best prize of them all.","Ride Along"
"1699",4147760,4149444,"James Payton.","Ride Along"
"1700",4149600,4150725,"What you think you doing...","Ride Along"
"1701",4150880,4152086,"Shut your ass up, man!","Ride Along"
"1702",4154520,4157603,"You don't havethe right to talk.","Ride Along"
"1703",4158000,4159161,"I'm gonna kill you.","Ride Along"
"1704",4161239,4163242,"See, James,for those who don't know,","Ride Along"
"1705",4163399,4167246,"James has been chasing my ass dayand night for some time now.","Ride Along"
"1706",4167520,4170363,"But he can never catch me.You know why?","Ride Along"
"1707",4170560,4172403,"Because he's oneof those people","Ride Along"
"1708",4172600,4174443,"who thinks healways knows best.","Ride Along"
"1709",4174600,4176761,"Doesn't think that people aregood enough for certain people,","Ride Along"
"1710",4176920,4179082,"without even really knowingthose other people.","Ride Along"
"1711",4179760,4180921,"You with me?","Ride Along"
"1712",4181439,4185604,"Guess what today is, big man?Today is the day that you die.","Ride Along"
"1713",4185880,4187041,"Mmm-hmm.","Ride Along"
"1714",4187159,4189322,"I'm going to have to putsome tarps down and shit.","Ride Along"
"1715",4189720,4191721,"Now I might finishyou off with my gun,","Ride Along"
"1716",4191880,4192926,"I might.","Ride Along"
"1717",4193119,4195881,"But I'm going to start you off withthe cold steel of my katana blade.","Ride Along"
"1718",4196319,4198926,"I'm talking deathby a thousand cuts.","Ride Along"
"1719",4199079,4200240,"Oh, I'd like to see that.","Ride Along"
"1720",4202079,4203604,"Give us a little taste of that.","Ride Along"
"1721",4204319,4205605,"Yeah,I'd be entertained by that.","Ride Along"
"1722",4206000,4207039,"A little preview. Come on.","Ride Along"
"1723",4207079,4208081,"Hell yeah.","Ride Along"
"1724",4215079,4216081,"Okay-","Ride Along"
"1725",4216520,4218283,"You ready? Here it come.","Ride Along"
"1726",4218399,4219400,"Don't you.","Ride Along"
"1727",4219520,4221090,"I gotta cut you.Don't you cut me.","Ride Along"
"1728",4221159,4223367,"What you think I gotta do?I gotta do it!","Ride Along"
"1729",4240319,4241445,"Yeah!","Ride Along"
"1730",4241960,4243802,"That's what you get, po-po!","Ride Along"
"1731",4243960,4245640,"Maybe stab hima little more, cut him more.","Ride Along"
"1732",4245800,4248689,"Shut your ass up.I ain't no show pony.","Ride Along"
"1733",4248840,4250524,"This shit is over.","Ride Along"
"1734",4250840,4253207,"Now what I'm going to do isI'm gonna cut you loose.","Ride Along"
"1735",4253760,4255682,"Mmm-hmm. Yeah.","Ride Along"
"1736",4256319,4258003,"I'm going to let youall handle this shit,","Ride Along"
"1737",4258159,4260845,"while I take this piece of shit somewhere.Get your ass up.","Ride Along"
"1738",4261399,4263528,"Let's go. Walk!","Ride Along"
"1739",4263680,4265319,"Good, becausethis was getting ridiculous.","Ride Along"
"1740",4265399,4267003,"Thank you.","Ride Along"
"1741",4269560,4271005,"The hell are you looking at?","Ride Along"
"1742",4271199,4272645,"Nothing, Omar.","Ride Along"
"1743",4273359,4274850,"You can call me Omar now?","Ride Along"
"1744",4275039,4277565,"Can we just keep it moving?","Ride Along"
"1745",4277720,4281202,"I will not runa crew without respect.","Ride Along"
"1746",4282159,4283320,"What?","Ride Along"
"1747",4284520,4285680,"I won't do it.","Ride Along"
"1748",4286760,4288046,"Get in here.","Ride Along"
"1749",4288199,4289360,"Let me tell you something.","Ride Along"
"1750",4289439,4291680,"Let me tell everybody inhere something right now.","Ride Along"
"1751",4291760,4294206,"It's about respectin this game!","Ride Along"
"1752",4294560,4297564,"I will not tolerate a crewthat does not respect me.","Ride Along"
"1753",4297720,4300326,"Respect is best served cold!","Ride Along"
"1754",4300479,4301480,"It's revenge!","Ride Along"
"1755",4304439,4305565,"Who said that?","Ride Along"
"1756",4306039,4307246,"Was that you?","Ride Along"
"1757",4307560,4308685,"Hmm?","Ride Along"
"1758",4316079,4319208,"Revenge is a dish","Ride Along"
"1759",4319520,4321568,"best served cold.","Ride Along"
"1760",4321680,4323408,"Oh!","Ride Along"
"1761",4325560,4328564,"Who in the hell are you?","Ride Along"
"1762",4329600,4330965,"I'm Omar.","Ride Along"
"1763",4331920,4333444,"Who the hell are you?","Ride Along"
"1764",4333640,4335085,"What are youdoing in my warehouse?","Ride Along"
"1765",4335399,4337288,"What the hell's going onhere? Kill them both.","Ride Along"
"1766",4337439,4338965,"Fellas, please.","Ride Along"
"1767",4340239,4342845,"We don't want tomake Omar nervous.","Ride Along"
"1768",4355239,4358448,"Let me explain something to you.Omar is very comfortable.","Ride Along"
"1769",4358600,4360125,"You know why?","Ride Along"
"1770",4360279,4362725,"Because Omar doesn't have abunch of guns pointed at him,","Ride Along"
"1771",4363239,4364287,"new guy-","Ride Along"
"1772",4364720,4367326,"I really don't mind thatyou're pretending to be me,","Ride Along"
"1773",4367399,4369323,"whoever you are,","Ride Along"
"1774",4369479,4371846,"but what I do mind isthat any of these idiots","Ride Along"
"1775",4371920,4373809,"actually believe this clown!","Ride Along"
"1776",4373960,4376439,"Ask this guy right herewho he thinks Omar is.","Ride Along"
"1777",4376960,4378962,"I don't know, it just hurts.","Ride Along"
"1778",4379119,4380121,"You shot Roberto?","Ride Along"
"1779",4380279,4381319,"You damn right I shot him.","Ride Along"
"1780",4381479,4382605,"I'm impressed.","Ride Along"
"1781",4382920,4386685,"Problem is,if Omar shoots Roberto...","Ride Along"
"1782",4389960,4391121,"Oh, shit!","Ride Along"
"1783",4391319,4392810,"Omar shoots Roberto.","Ride Along"
"1784",4392960,4395439,"I like you, little man.You got balls.","Ride Along"
"1785",4395600,4397806,"So, you Omar!","Ride Along"
"1786",4398479,4399765,"Wait right there.","Ride Along"
"1787",4400359,4401440,"Damn, man!","Ride Along"
"1788",4402199,4403610,"You ain't what I pictured.","Ride Along"
"1789",4404039,4405609,"You ain't nothingbut a black dude.","Ride Along"
"1790",4405880,4407404,"Probably from Decatur.","Ride Along"
"1791",4409640,4412609,"That's what you get for thinking, James.That really ain't your thing.","Ride Along"
"1792",4412800,4414609,"See, if you was thinking,","Ride Along"
"1793",4414800,4416800,"you'd get the big picture.You'd see where you are.","Ride Along"
"1794",4416840,4418807,"Look around you, James.You see where you are?","Ride Along"
"1795",4419095,4421175,"You're in the middle ofone of the biggest arms deals","Ride Along"
"1796",4421199,4423850,"to ever go down in this town.You could be in on it.","Ride Along"
"1797",4424560,4426210,"But you playingcops and robbers.","Ride Along"
"1798",4426680,4429842,"You think you been looking forme, but I've been watching you.","Ride Along"
"1799",4430000,4431411,"I've been following you.","Ride Along"
"1800",4431560,4433846,"I've spent a lot of time, lotof money thinking about you.","Ride Along"
"1801",4434000,4436002,"I spent so much money in fact,","Ride Along"
"1802",4436175,4437454,"your boys arenow working for me.","Ride Along"
"1803",4437479,4438845,"Everything all rightwith your packages, fellas?","Ride Along"
"1804",4439159,4440969,"Come to the other side, man.","Ride Along"
"1805",4441095,4442375,"Let go of thisself-respect shit.","Ride Along"
"1806",4442399,4444163,"Last I heard, it ain't buyingyou a house in Florida.","Ride Along"
"1807",4444239,4446925,"See, everybody wants to beon the winning side, James.","Ride Along"
"1808",4447079,4448365,"That's what I want for you.","Ride Along"
"1809",4448520,4450363,"You out front,me in the shadows.","Ride Along"
"1810",4450520,4452328,"We could run this town.","Ride Along"
"1811",4453199,4455042,"Yeah, that's right,I see you're curious.","Ride Along"
"1812",4455199,4458408,"I'm gonna make you this offerone time, one last time.","Ride Along"
"1813",4458560,4460050,"What do you say?","Ride Along"
"1814",4465239,4466604,"I'm Omar!","Ride Along"
"1815",4466760,4468284,"Shut up! Would you please stop!","Ride Along"
"1816",4468479,4469810,"Nobody believes you.","Ride Along"
"1817",4469960,4471199,"Get over there.","Ride Along"
"1818",4472720,4474404,"I'm gonna get with you later.","Ride Along"
"1819",4476079,4477889,"Come on now.","Ride Along"
"1820",4478039,4479166,"What's it gonna be?","Ride Along"
"1821",4479720,4482087,"Get your goddamn hands off me.","Ride Along"
"1822",4485279,4487168,"Well, I tried to putthe man in the penthouse.","Ride Along"
"1823",4487600,4490079,"He wants to spend hislife in the poorhouse.","Ride Along"
"1824",4490159,4492039,"Guess we'll have toreinstate the death penalty.","Ride Along"
"1825",4493119,4494929,"You know what, Omar?It really don't matter.","Ride Along"
"1826",4495159,4496570,"You could smoke me right here,","Ride Along"
"1827",4496760,4498761,"because we all gonnadie up in here anyway.","Ride Along"
"1828",4498920,4500444,"What are you talking about?","Ride Along"
"1829",4500760,4502091,"You know whatI'm talking about.","Ride Along"
"1830",4503000,4504764,"Your boy Markotold me everything.","Ride Along"
"1831",4504920,4506159,"It's a big setup.","Ride Along"
"1832",4506319,4507845,"Them boxes right there,","Ride Along"
"1833",4507920,4509684,"ain't nothing inthere but replicas.","Ride Along"
"1834",4509760,4510761,"Not true.","Ride Along"
"1835",4510840,4512400,"You ain't gonna likehow this movie end.","Ride Along"
"1836",4512600,4515079,"You just walked intoyour own assassination.","Ride Along"
"1837",4515439,4518523,"We'll open the boxesand find out, won't we?","Ride Along"
"1838",4528319,4529810,"Which way do I go? Right here.","Ride Along"
"1839",4536880,4539405,"Yo, this is crazy, man!This shit is crazy!","Ride Along"
"1840",4539479,4541050,"Calm down! I can't calm down!","Ride Along"
"1841",4543640,4545961,"Holy shit! Oh, shit!","Ride Along"
"1842",4551800,4552801,"James, I see a gun!","Ride Along"
"1843",4553039,4554041,"Get it!","Ride Along"
"1844",4557800,4560484,"Shit! I got it! I got it!","Ride Along"
"1845",4561399,4564688,"Selective fire. Visual confirm target.Short bursts.","Ride Along"
"1846",4564800,4566324,"Just shoot!Come on, here we go.","Ride Along"
"1847",4566399,4568163,"One, two, three, go!","Ride Along"
"1848",4572399,4573480,"Shit!","Ride Along"
"1849",4573640,4576166,"I thought it was the extended mags!It's not the extended mags!","Ride Along"
"1850",4576319,4578162,"What you talking about?","Ride Along"
"1851",4579000,4580001,"Shit, I'm out.","Ride Along"
"1852",4580159,4581524,"What the hell are you doing?","Ride Along"
"1853",4581720,4584166,"In a game, you can pickup ammo off the ground!","Ride Along"
"1854",4584319,4586083,"This ain't no damn video game!","Ride Along"
"1855",4586239,4588322,"Hold on! I got one!","Ride Along"
"1856",4593520,4595090,"Oh, God! Let's go!","Ride Along"
"1857",4596359,4597885,"Same thing onthe count of three.","Ride Along"
"1858",4598520,4599680,"Watch out!","Ride Along"
"1859",4600239,4601445,"I just saved your life!","Ride Along"
"1860",4602520,4604283,"Shit! I just saved your life!","Ride Along"
"1861",4604359,4605407,"Shit.","Ride Along"
"1862",4605479,4607239,"Save my life andget me the hell out of here!","Ride Along"
"1863",4611239,4612365,"Yo, we can't go that way.","Ride Along"
"1864",4612479,4613560,"Why?","Ride Along"
"1865",4613720,4615529,"Because they gotAK-47s down there.","Ride Along"
