"id","startTime","endTime","text","title"
"751",1932400,1933401,"Thank you.","Ride Along"
"752",1933519,1935284,"I'm looking for a kid","Ride Along"
"753",1935359,1937282,"by the name of RunflatI need to talk to.","Ride Along"
"754",1937359,1939521,"Runflat. Like a tire?","Ride Along"
"755",1939599,1941010,"Long story. Okay.","Ride Along"
"756",1941079,1943241,"See that youngster over thereplaying basketball?","Ride Along"
"757",1943519,1944681,"Black shirt, striped pants?","Ride Along"
"758",1944799,1945925,"Right there?","Ride Along"
"759",1946079,1947650,"Yeah.That's his little brother.","Ride Along"
"760",1947839,1951083,"All I need you to dois go over there,","Ride Along"
"761",1951240,1952809,"find out where Runflat is.","Ride Along"
"762",1952960,1954121,"That's all I gotta do?","Ride Along"
"763",1954279,1955326,"Think you can handle it?","Ride Along"
"764",1955480,1958563,"Yes. And after this we'retaking off the training wheels.","Ride Along"
"765",1958640,1960688,"I'm sick of thisputt-putt shit.","Ride Along"
"766",1967119,1969248,"All right, over.","Ride Along"
"767",1969720,1971085,"I need y'all toget out of here.","Ride Along"
"768",1971759,1972921,"Let's move.","Ride Along"
"769",1973599,1975489,"Am I speaking French? Go!","Ride Along"
"770",1976000,1978001,"Uh-uh. You stay.What's up, little man?","Ride Along"
"771",1978200,1979565,"""What's up, little man.""","Ride Along"
"772",1979694,1982055,"What are you talking about? I'mnot the little man. You are.","Ride Along"
"773",1982079,1984320,"Hey, don't start this if youdon't want to finish it.","Ride Along"
"774",1984480,1986881,"Start what? What,you about 3'10 "", 3'11""?","Ride Along"
"775",1986960,1988644,"Yeah, but you knowwhat I'm gonna do. Grow.","Ride Along"
"776",1988720,1991290,"What you gonna do?Stretch? You hope!","Ride Along"
"777",1992319,1994209,"Understand something,boy. I'm a man.","Ride Along"
"778",1994279,1995280,"Whatever you say.","Ride Along"
"779",1995720,1996767,"I'm an officer of the law.","Ride Along"
"780",1996839,1998079,"She need to stop flirting, too.","Ride Along"
"781",1998119,1999326,"Ronald. Talk to you.","Ride Along"
"782",2000079,2001161,"Ball up.","Ride Along"
"783",2005200,2006201,"What happened, man?","Ride Along"
"784",2006279,2007805,"Where are you going, Ronald?Come on, man.","Ride Along"
"785",2007880,2009722,"Ronald, why are youwalking away, Ronald?","Ride Along"
"786",2009799,2011164,"Hey, that's my car!","Ride Along"
"787",2011359,2012930,"Get your ass back.I'm using it.","Ride Along"
"788",2013000,2014968,"Take your time. You got it.","Ride Along"
"789",2015039,2016451,"It's okay. Come on.","Ride Along"
"790",2016519,2017920,"Why you walkingoff from me, Ronald?","Ride Along"
"791",2018000,2020480,"Don't call me that around here.Call me Runflat, okay?","Ride Along"
"792",2020559,2021685,"Don't call me bymy government name.","Ride Along"
"793",2021759,2024808,"What you know aboutthat Serbian crew?","Ride Along"
"794",2025000,2026411,"Screw them, man.","Ride Along"
"795",2026480,2027924,"Coming over herethinking they own shit.","Ride Along"
"796",2028000,2029047,"How they tied into Omar?","Ride Along"
"797",2029160,2030207,"Who?","Ride Along"
"798",2030359,2031963,"Nigga, don't play with me.","Ride Along"
"799",2032039,2033529,"You still gotthem pins in your...","Ride Along"
"800",2033839,2035604,"Come on. God!","Ride Along"
"801",2035759,2037842,"Mamasay, mamasa, mamakusa! Oh!","Ride Along"
"802",2038000,2039411,"Man, you're not a cop.","Ride Along"
"803",2039839,2041682,"I've been empowered by a cop","Ride Along"
"804",2041759,2044763,"to come over here and ask you aboutthe whereabouts of your brother.","Ride Along"
"805",2044839,2045840,"Now give it up.","Ride Along"
"806",2046000,2049003,"You think I'm gonna give up mybrother again? He just got out.","Ride Along"
"807",2049079,2050206,"You're gonna give him up.","Ride Along"
"808",2050360,2051485,"You came to the wrong place.","Ride Along"
"809",2051559,2053050,"I ain't telling you nothing.","Ride Along"
"810",2053574,2055014,"What you just didwas spit on my lip.","Ride Along"
"811",2055039,2056086,"Yeah, I did.","Ride Along"
"812",2056280,2058043,"That just got youa little time in prison.","Ride Along"
"813",2058239,2059844,"You're gonna tell mewhat I need to know,","Ride Along"
"814",2059960,2061679,"or it's gonna get realugly for you, Ronald.","Ride Along"
"815",2061760,2062760,"I'm going to lock you up.","Ride Along"
"816",2062920,2063920,"This is bullshit.","Ride Along"
"817",2064079,2066242,"Bullshit is my middle name.","Ride Along"
"818",2066400,2069768,"I got a real shakyrelationship with the truth.","Ride Along"
"819",2069960,2071159,"What the hell you shaking for?","Ride Along"
"820",2071239,2072844,"Did you take a swing at me?","Ride Along"
"821",2073000,2074047,"You reached for my...","Ride Along"
"822",2074199,2075246,"Going for my gun?","Ride Along"
"823",2075320,2076606,"Now I got to defend myself.","Ride Along"
"824",2076800,2079166,"No! Hold on, man.I'll tell you what's up. Damn!","Ride Along"
"825",2079760,2081967,"All right. All I know is this.","Ride Along"
"826",2082119,2085840,"Serbs ran on Omar'sterritory. He got mad, okay?","Ride Along"
"827",2086000,2088889,"They trying to push something.They got a shipment coming in.","Ride Along"
"828",2089039,2090086,"That's all I know.","Ride Along"
"829",2090239,2091679,"I'm about to makea citizen's arrest.","Ride Along"
"830",2091800,2093403,"I'll makea citizen's arrest, too.","Ride Along"
"831",2093559,2094766,"For what?","Ride Along"
"832",2094880,2096119,"Impersonating an officer.","Ride Along"
"833",2096400,2097844,"What?","Ride Along"
"834",2097960,2099521,"You said you were a cop.That's illegal.","Ride Along"
"835",2100333,2102494,"That is it, boy. This is whatI'm going to do time for.","Ride Along"
"836",2102519,2104123,"You better give up your brother.Give me your brother!","Ride Along"
"837",2104280,2105280,"Stranger danger!","Ride Along"
"838",2105360,2106360,"What?","Ride Along"
"839",2106440,2108885,"Stranger danger!Stranger danger!","Ride Along"
"840",2109079,2110411,"Man, let me fix you up.","Ride Along"
"841",2110679,2113206,"I don't want to touch you there.You want to see my what?","Ride Along"
"842",2113360,2114724,"I don't want to see yours.He's playing.","Ride Along"
"843",2114920,2116045,"My mama says that's private.","Ride Along"
"844",2116159,2117240,"That's my nephew.","Ride Along"
"845",2117400,2119003,"He's trying to touchall the little boys.","Ride Along"
"846",2119079,2120081,"Get him!","Ride Along"
"847",2120159,2121570,"Who got next? Who playing?","Ride Along"
"848",2121719,2122766,"Let's see your badge!","Ride Along"
"849",2122880,2123927,"You got next? What's up?","Ride Along"
"850",2125360,2126963,"I'll be leaving herein a few minutes.","Ride Along"
"851",2127119,2128929,"Once this little midgetgets back in the car.","Ride Along"
"852",2129159,2130570,"Start the car!","Ride Along"
"853",2130679,2132045,"Run, shorty, run!","Ride Along"
"854",2132199,2135329,"Open the door!It's me! Open the door!","Ride Along"
"855",2136400,2137606,"Go cry home to your mama.","Ride Along"
"856",2138079,2139684,"- What took you so long?- We should go.","Ride Along"
"857",2140280,2141963,"Do the thing.Make the tires skirt!","Ride Along"
"858",2146599,2148728,"How did that workout for you back there?","Ride Along"
"859",2148800,2149880,"BENZ Uh...","Ride Along"
"860",2150295,2152695,"I think it would have worked outa lot better if I had a gun.","Ride Along"
"861",2152719,2154847,"So, you need a gun tointerrogate children?","Ride Along"
"862",2155000,2156206,"It's about having confidence.","Ride Along"
"863",2156360,2158719,"Me having a gun just gives mea certain level of confidence.","Ride Along"
"864",2158840,2161365,"Knowing that it's below my belt.That's all I'm saying, man.","Ride Along"
"865",2161519,2163284,"Have you ever evenheld a gun before?","Ride Along"
"866",2163440,2167081,"The PX-48R controller isextremely realistic. Okay?","Ride Along"
"867",2168519,2169601,"What are you laughing at?","Ride Along"
"868",2169719,2170800,"Are you talkingabout a video game?","Ride Along"
"869",2170880,2171880,"Yes.","Ride Along"
"870",2171960,2174565,"Don't mention those stupidvideo games to me, okay?","Ride Along"
"871",2174655,2176414,"Don't say stupid.Don't call my games stupid.","Ride Along"
"872",2176440,2177407,"It is stupid.","Ride Along"
"873",2177480,2180085,"In my world, do you knowwhat you would be considered?","Ride Along"
"874",2180239,2181650,"A newbie. A newbie?","Ride Along"
"875",2181800,2184530,"A newbie. You have any ideawhat level player I am?","Ride Along"
"876",2184599,2185601,"No.","Ride Along"
"877",2185679,2186681,"You have no idea.","Ride Along"
"878",2186760,2189603,"My gamer tag is spoken inhushed terms of awe and envy.","Ride Along"
"879",2190000,2191445,"When I log on, people go crazy.","Ride Along"
"880",2191599,2194331,"""Oh, my God! Black Hammer's in!Black Hammer.""","Ride Along"
"881",2194480,2195481,"Shit's not real.","Ride Along"
"882",2195559,2197289,"You would be lost in my world.","Ride Along"
"883",2197440,2199168,"Black Hammerwould not help you.","Ride Along"
"884",2199719,2203405,"Let me show you my world,all right? The real deal.","Ride Along"
"885",2207199,2208960,"Why don't we justgo to the department range?","Ride Along"
"886",2209719,2212802,"Because that's for cops only.Which you are not.","Ride Along"
"887",2212960,2214610,"Yet. Which I'm not yet.","Ride Along"
"888",2214760,2216250,"Hey, James.Hey, Val, how you doing?","Ride Along"
"889",2216440,2217679,"Good. How's it going?","Ride Along"
"890",2217840,2219489,"Pretty fair for a square.","Ride Along"
"891",2219639,2221528,"Got to train a new booty today.","Ride Along"
"892",2222119,2223121,"I'm new booty?","Ride Along"
"893",2223320,2225288,"I'm Val. How you doing?I'm Ben. New booty.","Ride Along"
"894",2225440,2227204,"Good to see you, Ben. You, too.","Ride Along"
"895",2227360,2229010,"They got everything you need here.Right. Right.","Ride Along"
"896",2229199,2230690,"But this the real deal.Mmm-hmm.","Ride Along"
"897",2230840,2233844,"It's not a Xbox.No video game controllers.","Ride Along"
"898",2234039,2235280,"Just real deal. Right.","Ride Along"
"899",2235440,2238284,"Here's the handguns.Val can hook you up.","Ride Along"
"900",2238440,2240840,"Beretta, Glock, whatever.","Ride Along"
"901",2241480,2242969,"I wish Assface was here.","Ride Along"
"902",2243119,2245440,"Because he's more of a suppressionfire disciple, you know?","Ride Along"
"903",2245519,2247329,"I'm glad Assface is not here.","Ride Along"
"904",2247480,2249641,"Why would you say that? He should be here.This is his world, too.","Ride Along"
"905",2249920,2250967,"Uh...","Ride Along"
"906",2251039,2252280,"I could choose whatever I want?","Ride Along"
"907",2252400,2253606,"Knock yourself out.","Ride Along"
"908",2253760,2256842,"All right. You said it.No take-back-sies.","Ride Along"
"909",2257599,2260570,"What do I want?What do I want...","Ride Along"
"910",2260719,2262608,"Hurry up. You act like you'relooking for doughnuts.","Ride Along"
"911",2262760,2264762,"Why are you so impatient?I got shit to do.","Ride Along"
"912",2264840,2266079,"Give me a second. Let's go!","Ride Along"
"913",2266239,2267570,"Fine, fine.","Ride Along"
"914",2269320,2270809,"I want to get...","Ride Along"
"915",2273414,2274934,"I don't want that one.I want this one.","Ride Along"
"916",2274960,2276007,"I want to go with this one.Pick it.","Ride Along"
"917",2276199,2277690,"Smith and Wesson 500.Let me get that.","Ride Along"
"918",2277840,2278965,"All right.It's a good choice, ain't it?","Ride Along"
"919",2279039,2280246,"500 Smith and Wesson.","Ride Along"
"920",2280320,2281400,"You like that choice.","Ride Along"
"921",2282000,2283603,"You like it. Here you go.","Ride Along"
"922",2283800,2284960,"Oh, ho, ho!","Ride Along"
"923",2285039,2286690,"Bang, bang. ShH!","Ride Along"
"924",2286840,2288807,"Problem? Did you feel that?No, no problem...","Ride Along"
"925",2288920,2289920,"Got it?","Ride Along"
"926",2290000,2292206,"Can I do that thing?Like how they do that...","Ride Along"
"927",2292400,2293400,"You know what?","Ride Along"
"928",2293599,2294931,"Can you do it?","Ride Along"
"929",2295014,2296175,"Let's just go with the Glock.","Ride Along"
"930",2296199,2297246,"All right.","Ride Along"
"931",2297320,2298969,"That's a good choice, boy.","Ride Along"
"932",2299039,2300041,"Don't touch me.","Ride Along"
"933",2300119,2301769,"That's a tap. I didn't touch you.There's a difference.","Ride Along"
"934",2301840,2303887,"This is touching.I didn't touch you.","Ride Along"
"935",2304000,2305001,"There we go.","Ride Along"
"936",2305079,2306730,"Hey, what's this? Shit! Oh!","Ride Along"
"937",2306800,2308449,"It's all right, I got it.","Ride Along"
"938",2308599,2309646,"You got it? Got it.","Ride Along"
"939",2309760,2311648,"You want me to help you set it up?No, Ben I got it.","Ride Along"
"940",2311800,2313643,"Should we get a book?","Ride Along"
"941",2319320,2320525,"Let's see what you got.","Ride Along"
"942",2320679,2323603,"Do we need goggles or earplugsor anything like that?","Ride Along"
"943",2323800,2327043,"No, usually the bad guys don't giveus time to put on that kind of stuff.","Ride Along"
"944",2327199,2329362,"Okay, right. That'sactually a good point.","Ride Along"
"945",2329494,2331735,"It makes a lot of sense, andit's better to keep it real.","Ride Along"
"946",2331760,2333409,"I would rather this be real.You know what I mean?","Ride Along"
"947",2333559,2335880,"Keep it real. Yeah. Okay.","Ride Along"
"948",2336239,2337525,"Here we go.","Ride Along"
"949",2338719,2341405,"Freeze! How do you say freeze?","Ride Along"
"950",2342440,2343851,"Freeze. Freeze.","Ride Along"
"951",2345280,2346280,"Freeze. Freeze.","Ride Along"
"952",2346360,2349364,"Okay. You know what it is? Youdon't move your top lip that much.","Ride Along"
"953",2349440,2351646,"I move my top lipso it doesn't come out stern.","Ride Along"
"954",2351760,2353887,"- You get what I'm saying?- Freeze.","Ride Along"
"955",2353960,2355041,"Freeze.","Ride Along"
"956",2355119,2356769,"Just shoot. Shoot.","Ride Along"
"957",2356920,2357920,"Shoot Shoot.","Ride Along"
"958",2358119,2360646,"You pronounce everything. I got you.You ready? Here we go.","Ride Along"
"959",2360920,2362887,"Freeze! Atlanta PD!","Ride Along"
"960",2363039,2365202,"Get on the ground!Hands behind your head!","Ride Along"
"961",2365360,2366440,"Fingers laced!","Ride Along"
"962",2366599,2368601,"You better lace them!Lace them!","Ride Along"
"963",2368800,2370085,"Shoot the gun. Okay. All right.","Ride Along"
"964",2370239,2371764,"Ready? Here we go.","Ride Along"
"965",2379880,2380960,"Damn it!","Ride Along"
"966",2382000,2385402,"I pinched it. I pinchedthe inside of my hand.","Ride Along"
"967",2385559,2387561,"I don't think the sight onthe gun is quite calibrated.","Ride Along"
"968",2387719,2389440,"The way I was shooting,it looks a little...","Ride Along"
"969",2393800,2396007,"Yeah, it's off bya centimeter or two.","Ride Along"
"970",2398840,2400887,"You right-handedor left-handed?","Ride Along"
"971",2401079,2403242,"You were doing both.You're ambidextrous.","Ride Along"
"972",2403400,2406005,"That's why I like shotguns. I'mmore of a shotgun specialist,","Ride Along"
"973",2406159,2407923,"because I need both of myhands, because my upper body...","Ride Along"
"974",2408079,2409969,"Let me use your 12-gauge, man.","Ride Along"
"975",2410119,2412487,"Be careful, it's gota magnum loaded in it.","Ride Along"
"976",2414760,2416887,"On, yeah.","Ride Along"
"977",2417639,2420722,"Now we're talking. The street sweeper.Just like Fallujah.","Ride Along"
"978",2420880,2422166,"Just like Fallujah.","Ride Along"
"979",2422320,2423764,"MY nigga.","Ride Along"
"980",2424679,2426250,"Denzel, Training Day.","Ride Along"
"981",2426440,2427851,"You might want tostep back a little bit.","Ride Along"
"982",2427920,2430570,"This thing gota little kick to it. Okay?","Ride Along"
"983",2430800,2434804,"Freeze! You better stop beforeI put a hole in your back!","Ride Along"
"984",2435159,2436445,"Oh, you think it's a game?","Ride Along"
"985",2436599,2438284,"Oh, it's on now!","Ride Along"
"986",2438440,2439771,"Oh, shit!","Ride Along"
"987",2441760,2443409,"Got a little bit of kick to it.","Ride Along"
"988",2444400,2446367,"My stomach in my ass.","Ride Along"
"989",2446960,2448882,"Oh, yeah, you'reready for the streets.","Ride Along"
"990",2449320,2451527,"This gun should be banned.","Ride Along"
"991",2455480,2456811,"I really appreciate everything.","Ride Along"
"992",2456960,2458485,"No problem, man.","Ride Along"
"993",2459039,2461519,"Well! How did it go?","Ride Along"
"994",2462639,2464563,"It was good. It was real good.","Ride Along"
"995",2465039,2466882,"I'm just alittle rusty, that's all, Val.","Ride Along"
"996",2467039,2469929,"A little more used to ahigher-grade military weapon","Ride Along"
"997",2470079,2472525,"like an RPG or a flame thrower.","Ride Along"
"998",2472760,2474728,"Yeah, we don't reallyget the exotic stuff.","Ride Along"
"999",2474960,2477644,"Though we did have a couple ofZastavas in here the other day.","Ride Along"
"1000",2477800,2478847,"Let's go.","Ride Along"
"1001",2478960,2480007,"Wait a minute,you had some Zastavas?","Ride Along"
"1002",2480159,2482208,"Mmm-hmm. M92 or the M93?","Ride Along"
"1003",2482280,2483485,"I had the M92.","Ride Along"
"1004",2483719,2485005,"Are you kidding me? No.","Ride Along"
"1005",2485079,2486525,"I was going to ask youabout the Black Arrow.","Ride Along"
"1006",2486599,2488280,"That's what I thoughtyou was going to say.","Ride Along"
"1007",2488614,2490494,"We're talking aboutthe Serbian submachine guns.","Ride Along"
"1008",2490519,2492409,"The M92 is a good gun,but that Black Arrow,","Ride Along"
"1009",2492480,2494369,"let me tell you something,take your back off.","Ride Along"
"1010",2494440,2496362,"Serbian? Serbian, yes.","Ride Along"
"1011",2496559,2498121,"How the hell youknow they were Serbian?","Ride Along"
"1012",2498159,2501289,"Uh, because I'm the Black Hammer.Platinum level. I told you that.","Ride Along"
"1013",2501440,2504284,"X-Y-C-Y. You press at the sametime and it gives you a...","Ride Along"
"1014",2505360,2506521,"Who had these guns?","Ride Along"
"1015",2506679,2509126,"Two guys. One white, one black.","Ride Along"
"1016",2509280,2510360,"Serbian?","Ride Along"
"1017",2510440,2512487,"Um, I don't know.","Ride Along"
"1018",2512599,2514090,"One had an accent.","Ride Along"
"1019",2515039,2516371,"Let's go.","Ride Along"
"1020",2517559,2518561,"Serbians?","Ride Along"
"1021",2518840,2520603,"One had an accent? Yeah.","Ride Along"
"1022",2520760,2523490,"If you could do it, what would it be?","Ride Along"
"1023",2523559,2524561,"What if you had the...","Ride Along"
"1024",2525760,2527409,"Let's go.I'm trying to figure this...","Ride Along"
"1025",2527559,2529289,"Let's go.","Ride Along"
"1026",2531760,2532885,"What was that about?","Ride Along"
"1027",2532960,2534291,"Wait for me in the car.","Ride Along"
"1028",2534360,2536123,"I just got a clue, didn't I?In the car.","Ride Along"
"1029",2536280,2538851,"I just figured something out.I'm gonna get in the car.","Ride Along"
"1030",2539400,2541289,"Can you at leastturn the car on?","Ride Along"
"1031",2541840,2543079,"Radio or nothing.","Ride Along"
"1032",2543239,2544240,"What's up, boss?","Ride Along"
"1033",2544360,2545646,"""JAMES"". Listen, them Serbians,","Ride Along"
"1034",2545840,2547251,"they gotsomething big going down.","Ride Along"
"1035",2547360,2548804,"I think they'reselling something to Omar.","Ride Along"
"1036",2548960,2551007,"I believe it'smilitary-grade weapons.","Ride Along"
"1037",2551159,2553811,"Damn, if Omar gets that kindof firepower, holy shit!","Ride Along"
"1038",2553880,2554880,"It'll never happen.","Ride Along"
"1039",2555039,2557804,"Matter of fact, I want you tofind your boy at the Airport PD,","Ride Along"
"1040",2557960,2559724,"tell him to keep hiseyes open for anything","Ride Along"
"1041",2559840,2561648,"strange coming outof Eastern Europe.","Ride Along"
"1042",2561800,2563244,"Did you listen to Brooks?He doesn't","Ride Along"
"1043",2563360,2564840,"want us anywherenear this Omar thing.","Ride Along"
"1044",2564880,2566369,"We just have tofall back, please.","Ride Along"
"1045",2566440,2568329,"Santiago,you sound like a rookie.","Ride Along"
"1046",2568480,2571005,"Let me do the thinkingfor both of us, okay?","Ride Along"
"1047",2571159,2572320,"You hook that other thing up?","Ride Along"
"1048",2572360,2573440,"Yeah, it's all set.","Ride Along"
"1049",2573599,2575204,"You're going to be hearingfrom dispatch any minute now.","Ride Along"
"1050",2575360,2577362,"Good. I need to getrid of this clown.","Ride Along"
"1051",2581840,2583079,"Sorry.","Ride Along"
"1052",2583239,2584730,"What are you doing? I'm sorry.","Ride Along"
"1053",2584880,2588248,"My fault. I didn't know. Ididn't expect that to happen.","Ride Along"
"1054",2588320,2589764,"Hey, I got a clue, didn't I?","Ride Along"
"1055",2589840,2590840,"No.","Ride Along"
"1056",2590920,2592001,"Yeah, I did. I got instincts.","Ride Along"
"1057",2592079,2593570,"You say what you want.You know I do.","Ride Along"
"1058",2593719,2596563,"You think just because youplay a little punk video game,","Ride Along"
"1059",2596719,2598643,"that you're ready to be a copout here in these streets?","Ride Along"
"1060",2598719,2599721,"Yes, I do.","Ride Along"
"1061",2599880,2603565,"You're ready to go toe-to-toe withthe biggest kingpin in Atlanta?","Ride Along"
"1062",2603679,2604646,"Yes.","Ride Along"
"1063",2604719,2608041,"You understand this guy haskilled cops, innocent people,","Ride Along"
"1064",2608119,2609405,"even his own crew.","Ride Along"
"1065",2609559,2612210,"And still he's got everybodythinking he's a ghost.","Ride Along"
"1066",2612760,2615047,"What's your little ass gonnado when we run up on Omar?","Ride Along"
"1067",2615199,2617168,"What a cop is supposed to do.","Ride Along"
"1068",2617320,2619163,"Why am I telling youwhat I would do?","Ride Along"
"1069",2619400,2621003,"How about we back up?","Ride Along"
"1070",2621159,2623519,"How about you tell me ""thankyou."" That could go a long way.","Ride Along"
"1071",2623719,2624925,"""Thank you, Ben.""","Ride Along"
"1072",2625079,2627367,"""You helped me with a clue.Good instincts.""","Ride Along"
"1073",2627440,2628521,"Unit 19, 126 in progress...","Ride Along"
"1074",2628559,2629561,"Shut up. Shut up.","Ride Along"
"1075",2629639,2631164,"Corner of State and Bellevue.","Ride Along"
"1076",2631239,2633128,"Let me say ""Copy.""Let me say it.","Ride Along"
"1077",2633880,2636007,"Please. Come on.Let me say ""Copy.""","Ride Along"
"1078",2637719,2639164,"Some cop stuff.","Ride Along"
"1079",2639360,2640360,"COPY-","Ride Along"
"1080",2640440,2642329,"19, repeat that, please.","Ride Along"
"1081",2642800,2643800,"COPY-","Ride Along"
"1082",2643920,2644967,"19, come again?","Ride Along"
"1083",2645159,2646605,"Hold up. Wait a minute. Copy...","Ride Along"
"1084",2646760,2648568,"Give me that.Stop it, she can't hear me!","Ride Along"
"1085",2648880,2651884,"Give me a second, dude.Get off, man!","Ride Along"
"1086",2652119,2653201,"Get off of it!","Ride Along"
"1087",2653360,2655885,"That's my wrist.Now that's unnecessary.","Ride Along"
"1088",2656039,2657326,"Copy that.","Ride Along"
"1089",2657480,2658561,"Copy that.","Ride Along"
"1090",2658760,2662003,"Copy that for real this time.The first one wasn't real.","Ride Along"
"1091",2662079,2663081,"19, please repeat.","Ride Along"
"1092",2663239,2664286,"You don't communicate,","Ride Along"
"1093",2664360,2666202,"because if you tell me say""that,"" I will say ""that.""","Ride Along"
"1094",2666280,2667884,"Man, shut up.","Ride Along"
"1095",2668039,2669610,"You bent my wrist.","Ride Along"
"1096",2672159,2674811,"No! She took everything!","Ride Along"
"1097",2676199,2677724,"She took my boat!","Ride Along"
"1098",2677880,2679802,"He's down there andhe won't stop throwing stuff.","Ride Along"
"1099",2679960,2681166,"Poor bastard's at it again.","Ride Along"
"1100",2681280,2682280,"She took my car!","Ride Along"
"1101",2682360,2683440,"This dude, again.","Ride Along"
"1102",2683599,2685010,"I just want my life back.","Ride Along"
"1103",2685199,2687248,"Cody Tillman, AKA Crazy Cody.","Ride Along"
"1104",2687400,2688561,"You know him? No.","Ride Along"
"1105",2688639,2690802,"Take that!","Ride Along"
"1106",2691239,2692650,"Hey, hey!","Ride Along"
"1107",2693440,2695487,"You better sit your ass down.","Ride Along"
"1108",2695639,2697164,"You stay right there,I'm going in.","Ride Along"
"1109",2697280,2698280,"No, let me go in.","Ride Along"
"1110",2698400,2699599,"You done. This one's mine. No.","Ride Along"
"1111",2699639,2701563,"You stay there.No. I want to talk to you.","Ride Along"
"1112",2701639,2702641,"No. Here I come.","Ride Along"
"1113",2702760,2704603,"Stay! Stay! No! No!","Ride Along"
"1114",2704719,2705925,"I'm coming in hot.","Ride Along"
"1115",2707039,2708963,"Grab me, James, grab me!","Ride Along"
"1116",2709800,2710847,"Okay. Okay.","Ride Along"
"1117",2711000,2712603,"What you doing over here?I want to talk to you.","Ride Along"
"1118",2712679,2714443,"I want to go.You can't handle Crazy Cody.","Ride Along"
"1119",2714519,2716726,"Can I please havesome of Crazy Cody? Please!","Ride Along"
"1120",2716800,2718688,"I'm breaking everyrule possible for you.","Ride Along"
"1121",2718800,2719800,"Please. Okay.","Ride Along"
"1122",2719960,2722610,"You get this rightor I'm taking your ass home.","Ride Along"
"1123",2722760,2724648,"That's a deal.Go in there. This is a layup.","Ride Along"
"1124",2724800,2726289,"Show and goddamn prove. Hey!","Ride Along"
"1125",2727400,2728481,"Oh!","Ride Along"
