"id","startTime","endTime","text","title"
"996",4665970,4668014,"- Reg, you want a Coke?- No, I can't.","Slap Shot"
"997",4668097,4672560,"I'm tapin' an interview at the station.They're playin' it at four. Don't miss it.","Slap Shot"
"998",4673019,4677064,"That was some road trip. Six straight winsand a whole new rash of penalty minutes.","Slap Shot"
"999",4677147,4679609,"Well, we got a whole new attitude.","Slap Shot"
"1000",4679692,4682778,"What about the Hanson brothers?They're not just bullies?","Slap Shot"
"1001",4682861,4685947,"Just bullies?They scare the bejesus outta everybody!","Slap Shot"
"1002",4686072,4688534,"- Deliberately?- Well...","Slap Shot"
"1003",4690077,4694872,"I'd like the folks to come down and watchus cream them punks from Syracuse.","Slap Shot"
"1004",4694956,4697250,"Anything new on the sale of the Chiefs?","Slap Shot"
"1005",4697334,4702296,"I think the negotiations are...you know, goin' pretty good.","Slap Shot"
"1006",4702421,4704466,"I have a personal announcement, though.","Slap Shot"
"1007",4704591,4708094,"I am placing a personal bountyon the head of Tim McCracken.","Slap Shot"
"1008",4708219,4711805,"He's the coachand chief punk on that Syracuse team.","Slap Shot"
"1009",4711889,4714016,"- A bounty?- Yeah.","Slap Shot"
"1010",4714141,4719020,"A hundred bucks of my own money forthe first of my men that nails that creep.","Slap Shot"
"1011",4719146,4722066,"That's eight o'clock at the War Memorial,","Slap Shot"
"1012",4722149,4725235,"the Syracuseand the all-new Charlestown Chiefs.","Slap Shot"
"1013",4725902,4728112,"- Thanks, Reg.- Not to worry, kid.","Slap Shot"
"1014",4728488,4732659,"I'm placing a personal bountyon the head ofTim McCracken.","Slap Shot"
"1015",4732742,4735912,"He's the coachand chiefpunk on that Syracuse team.","Slap Shot"
"1016",4736037,4738081,"- A bounty?- Yeah.","Slap Shot"
"1017",4738206,4741959,"A hundred bucks ofmy own moneyfor the first ofmy men that...","Slap Shot"
"1018",4781289,4783249,"- Yeah?- Are you nuts?","Slap Shot"
"1019",4783374,4785751,"- Bullshit!- A bounty!","Slap Shot"
"1020",4786210,4789797,"- We could all land in the clinker for this.- Oh, big deal, Joe.","Slap Shot"
"1021",4789880,4792341,"You can't put a bounty on a man's head!","Slap Shot"
"1022",4792799,4794844,"I just did.","Slap Shot"
"1023",4811401,4813194,"- Yeah?- Reg? It's Killer.","Slap Shot"
"1024",4813278,4816530,"- Oh. Hi, Killer.- I want that $100.","Slap Shot"
"1025",4816822,4819200,"Well, you gotta earn it, Killer.","Slap Shot"
"1026",4819617,4822286,"- My attitude's right.- Uh-huh. OK, kid.","Slap Shot"
"1027",4841596,4844308,"In-fucking-credible.","Slap Shot"
"1028",4844391,4846434,"Who is it?","Slap Shot"
"1029",4849103,4851147,"Yeah?","Slap Shot"
"1030",4855985,4858362,"- Hi.- Hi.","Slap Shot"
"1031",4858445,4860490,"- What's up?","Slap Shot"
"1032",4861240,4863033,"Jesus.","Slap Shot"
"1033",4863117,4865160,"Come on in.","Slap Shot"
"1034",4866078,4869498,"- Well, I did it.- You bet you did. You did, you bet.","Slap Shot"
"1035",4871291,4874377,"The wedding presents my side gave.50-50, right?","Slap Shot"
"1036",4874502,4876964,"Can you get my clothes?","Slap Shot"
"1037",4877089,4879216,"Sure.","Slap Shot"
"1038",4879299,4881342,"Jesus, did you write him a note?","Slap Shot"
"1039",4882385,4884513,"Do you think I should have?","Slap Shot"
"1040",4884638,4886848,"I don't know.","Slap Shot"
"1041",4886931,4888975,"He's sure gonna think the worst.","Slap Shot"
"1042",4892478,4895356,"- Hey, Lily, we're gonna have a ball.- We are?","Slap Shot"
"1043",4896732,4899193,"Except right now I gotta take a nap.","Slap Shot"
"1044",4899318,4903322,"I mean, I put a bounty on this guy's head.If I don't get some shuteye...","Slap Shot"
"1045",4906658,4910871,"If I don't get some shuteye,I'll get murdered out there on the ice.","Slap Shot"
"1046",4910954,4915583,"Otherwise I would've given you a night onthe town. We could've gone to the Aces.","Slap Shot"
"1047",4915667,4917961,"She won't mind. She's great to sleep with.","Slap Shot"
"1048",4918086,4920046,"Ned sleeps with her before every game.","Slap Shot"
"1049",4920130,4922673,"Her breathing makes himfeel more secure.","Slap Shot"
"1050",4922757,4924967,"Listen, Reg,I'm gonna get a grip on myself.","Slap Shot"
"1051",4925050,4928137,"I'm gonna start using my imagination,go with the traffic.","Slap Shot"
"1052",4928262,4931849,"I've been going about this all wrong.I probably am terrific.","Slap Shot"
"1053",4931932,4933977,"You want some spaghetti?","Slap Shot"
"1054",4934936,4936979,"Reg?","Slap Shot"
"1055",4952577,4956414,"Run the siren.Run the goddamn siren. I'm payin' for it.","Slap Shot"
"1056",4956497,4958792,"Let 'em knowthere's gonna be blood in there.","Slap Shot"
"1057",4958875,4961169,"I can circle, but it's gonna cost you more.","Slap Shot"
"1058",4961252,4963296,"Oh, for Christ's sake.","Slap Shot"
"1059",4964380,4966591,"- There.","Slap Shot"
"1060",4998954,5001416,"Don't ever play ""Lady of Spain"" again!","Slap Shot"
"1061",5003126,5004377,"Jesus Christ.","Slap Shot"
"1062",5016722,5021351,"- Hey, McCracken.- Dunlop, you suck cock.","Slap Shot"
"1063",5021434,5023394,"All I can get.","Slap Shot"
"1064",5037366,5041996,"$100 bounty on the head of famedSyracuse stick man Tim McCracken.","Slap Shot"
"1065",5042121,5046417,"McCracken, also known as Dr Hook forhis scalpel-like prowess with the stick,","Slap Shot"
"1066",5046542,5050379,"has been known to carve a man's eye outwith a flick of the wrist.","Slap Shot"
"1067",5052673,5054966,"There's a carnival-like atmosphere here.","Slap Shot"
"1068",5055050,5060263,"The crowd is gathered and, well, you canfeel it, there's an air of expectancy...","Slap Shot"
"1069",5062932,5066603,"Syracuse skating out now.We're looking forward to a real contest.","Slap Shot"
"1070",5066686,5070023,"We're ready to face off in themiddle circle. The referee is ready.","Slap Shot"
"1071",5070106,5072483,"The linesmen for tonight...","Slap Shot"
"1072",5082660,5085329,"Go, Chiefs, go! Go, Chiefs, go!","Slap Shot"
"1073",5092169,5094296,"$100 says you're gonna crack my skull.","Slap Shot"
"1074",5094379,5097633,"- I wouldn't crack your knuckles for $100.- So he's bluffin'.","Slap Shot"
"1075",5097758,5102554,"Somebody's gonna kill you, you dumbson of a bitch, but it's not gonna be me.","Slap Shot"
"1076",5131207,5132708,"Good pass!","Slap Shot"
"1077",5135877,5137837,"Go on, man! Hit him!","Slap Shot"
"1078",5137921,5140132,"What's the matter with you?You're a Chief!","Slap Shot"
"1079",5140257,5141883,"- Come on.- Whoa, whoa, whoa!","Slap Shot"
"1080",5141967,5143927,"Fight back!","Slap Shot"
"1081",5156481,5159024,"You son of a bitch! Get over here!","Slap Shot"
"1082",5159108,5162361,"- Chickenshit yellow-belly.- I scored, you fucking has-been.","Slap Shot"
"1083",5162486,5166782,"They don't want you to score goals.They want blood. They're booin' you.","Slap Shot"
"1084",5167366,5169326,"Go get him, Killer!","Slap Shot"
"1085",5172413,5174790,"Come on, you son of a bitch. Come on!","Slap Shot"
"1086",5176374,5179043,"- Come on, Killer!- We win cos I score goals.","Slap Shot"
"1087",5179127,5181671,"Oh, kiss my ass.We win cos I make 'em crazy.","Slap Shot"
"1088",5186592,5188720,"- Nail him!- You don't make me crazy.","Slap Shot"
"1089",5188845,5191222,"I will, cos you're benched.","Slap Shot"
"1090",5191597,5194683,"You want ice time, come and tell mewhen you wanna play it my way.","Slap Shot"
"1091",5194808,5198312,"- You're the biggest pussy in the league.- I like pussy.","Slap Shot"
"1092",5198396,5201898,"Oh, yeah? Well, that's not whatI hear from your wife. I hear...","Slap Shot"
"1093",5215036,5217163,"Go get him, Killer!","Slap Shot"
"1094",5233220,5236306,"Real old-fashioned guts,for Dave ""Killer"" Carlson","Slap Shot"
"1095",5236431,5239310,"to jump into that fightwith Tim ""Dr Hook"" McCracken.","Slap Shot"
"1096",5239393,5241687,"Ned Braden's come into the booth.Sit down.","Slap Shot"
"1097",5241812,5244189,"I noticeda slight discussion with Reg Dunlop.","Slap Shot"
"1098",5244314,5246191,"What are you doing? You been benched?","Slap Shot"
"1099",5246316,5249027,"Yes, a real first in my career.I've been benched.","Slap Shot"
"1100",5249110,5251154,"- Why is that?- I won't fight.","Slap Shot"
"1101",5251237,5255283,"- Well, you could play if you fought.- Let's just say I'm chickenshit.","Slap Shot"
"1102",5255951,5260830,"Ned, why would someone with yourbackground still be playing hockey?","Slap Shot"
"1103",5260955,5262332,"- I hate my father.- You do?","Slap Shot"
"1104",5262415,5264625,"- And I was having problems at home.- You are?","Slap Shot"
"1105",5264709,5268379,"I just said I was. Primarilysexual problems. I'm very perverse.","Slap Shot"
"1106",5268504,5271299,"- Holy shit!- I skate to get away from my wife!","Slap Shot"
"1107",5271382,5274885,"- This is Jim Carr...- We fight. She wants me to quit hockey.","Slap Shot"
"1108",5278889,5283351,"As you may have noticed, she's the onlygood-looking piece of ass in Charlestown!","Slap Shot"
"1109",5283435,5286939,"She also has a drinking problem,and I have no idea where she is.","Slap Shot"
"1110",5287064,5290066,"- Gimme that damn mike!- Why do you wear that rug?","Slap Shot"
"1111",5290650,5292610,"It's just sensationally ugly.","Slap Shot"
"1112",5292693,5295155,"You're going bald.Can't you face up to that?","Slap Shot"
"1113",5295238,5297532,"Well, at least I'm not chickenshit like you!","Slap Shot"
"1114",5297657,5299700,"What you're hearing is the truth!","Slap Shot"
"1115",5299784,5301910,"Jim Carr got angry...","Slap Shot"
"1116",5303288,5306374,"Joe McGrath here.The boys like to horse around.","Slap Shot"
"1117",5306499,5308709,"- Chickenshit bastard!- Sod off, old fart!","Slap Shot"
"1118",5308834,5312588,"- I may be bald, but I'm not chickenshit.- I wanna talk about violence.","Slap Shot"
"1119",5312713,5316299,"- Chick, chick, chick!- Gimme that!","Slap Shot"
"1120",5316425,5319053,"Son! Son!","Slap Shot"
"1121",5323014,5325058,"Take my guitar","Slap Shot"
"1122",5325141,5327436,"Forboard and room","Slap Shot"
"1123",5328311,5330438,"- Hey, Billy!","Slap Shot"
"1124",5332315,5336236,"Well, you're gonna be set, Lily.Taking your destiny by the throat.","Slap Shot"
"1125",5336361,5338571,"You're in the driver's seat.","Slap Shot"
"1126",5339322,5342658,"You're not havingsecond thoughts about this, are you?","Slap Shot"
"1127",5342741,5345911,"Sometimes I think I get it.Sometimes I think it's horseshit.","Slap Shot"
"1128",5345995,5349831,"Well, to doubt is human.You stick with Reg. I'm on a roll.","Slap Shot"
"1129",5351082,5355379,"- Bye, Francine. Come back and see us.- I will. Thank you, Mrs Vincent.","Slap Shot"
"1130",5358131,5360968,"You're gonna needanother 10 or 15 minutes.","Slap Shot"
"1131",5366014,5367807,"- Hiya.- Hi.","Slap Shot"
"1132",5367932,5370560,"This is Lily Braden, Ned Braden's wife.","Slap Shot"
"1133",5370643,5373980,"Well, actually she's... she's on waivers.","Slap Shot"
"1134",5374522,5377358,"Listen, she's in the marketfor a perm and I said to her","Slap Shot"
"1135",5377442,5380277,"""Hey, there's no one betterthan old Francine.""","Slap Shot"
"1136",5380361,5383447,"- Well, I don't think...- For the works. I'm buyin'.","Slap Shot"
"1137",5383572,5386492,"- I'll pay you back tomorrow.- No, that's not the problem.","Slap Shot"
"1138",5386575,5388535,"You see, the problem is...","Slap Shot"
"1139",5390120,5392790,"I never laid a hand on her.It was just a kid.","Slap Shot"
"1140",5392873,5396043,"Listen, it's a pathetic story. It's pathetic.","Slap Shot"
"1141",5396126,5398086,"You look terrific.","Slap Shot"
"1142",5401548,5403508,"Be careful, girls.","Slap Shot"
"1143",5408679,5412016,"- There's TVRadio Mirror, Modern Screen.- You were married to him?","Slap Shot"
"1144",5412141,5415019,"For about a hundred years. It's all over.","Slap Shot"
"1145",5416020,5418648,"He's completely off his rocker.","Slap Shot"
"1146",5418731,5421400,"- I left my husband, too.- Really?","Slap Shot"
"1147",5422026,5424945,"I'm only halfway out the revolving door,know what I mean?","Slap Shot"
"1148",5425028,5429283,"Oh, it's lousy at first. You thinkyou're dying. But then it's fabulous.","Slap Shot"
"1149",5429366,5432202,"- I mean, you become a new woman.- Yeah.","Slap Shot"
"1150",5432577,5436790,"You know, Reggie told meyou've gotten terrific since you left him.","Slap Shot"
"1151",5437749,5439709,"He said that?","Slap Shot"
"1152",5443004,5445465,"Well, you know whatyou have to do for yourself?","Slap Shot"
"1153",5445590,5447967,"You have to get out there and circulate.","Slap Shot"
"1154",5448050,5452513,"I mean, you just can't sink into it. Youhave to get out there on the firing line.","Slap Shot"
"1155",5452638,5454849,"- Oh, my God.- No, no, no, no, no.","Slap Shot"
"1156",5454932,5456892,"Really. It's not bad. Look.","Slap Shot"
"1157",5458018,5463232,"If you did your cheekbones better,you could look like Cher.","Slap Shot"
"1158",5464274,5466317,"Huh?","Slap Shot"
"1159",5508025,5510777,"- Amy, take this in the house.- Hello there.","Slap Shot"
"1160",5511528,5515531,"Hiya. I'm Reg Dunlop. The Chiefs?I came to see your husband.","Slap Shot"
"1161",5515866,5518785,"Oh, yes? I'm Anita McCambridge.How do you do?","Slap Shot"
"1162",5518868,5520995,"- Hi.- You think you can help with these?","Slap Shot"
"1163",5521120,5523414,"- Uh, yeah.- Mom, I'm late, I gotta go.","Slap Shot"
"1164",5523497,5529670,"Michael, stay in the yard, put your jacketon and carry one of these in first.","Slap Shot"
"1165",5529753,5531713,"Where's your husband?","Slap Shot"
"1166",5531838,5534216,"He's in puppy heaven.","Slap Shot"
"1167",5537219,5539179,"I own the Chiefs.","Slap Shot"
"1168",5541140,5543100,"This way.","Slap Shot"
"1169",5553651,5556822,"- What can I get you to drink?- Canadian Club and water.","Slap Shot"
"1170",5559365,5561742,"- Nice place you've got here.- Thanks.","Slap Shot"
"1171",5563744,5566414,"To tell the truth,Mrs McCambridge, the reason...","Slap Shot"
"1172",5566497,5568541,"Anita.","Slap Shot"
"1173",5571376,5573337,"OK, Anita.","Slap Shot"
"1174",5573462,5578800,"Uh... you know, we all readabout the possibility of a sale in Florida,","Slap Shot"
"1175",5578884,5582304,"and the guys are getting anxiousto find out what's going on.","Slap Shot"
"1176",5582429,5585223,"- Mm-hm.- I guess I'm their representative.","Slap Shot"
"1177",5588309,5592147,"- We've been doin' real good.- My accountant is certainly pleased.","Slap Shot"
"1178",5592272,5594065,"Oh. Uh...","Slap Shot"
"1179",5594148,5596108,"How is the sale goin'?","Slap Shot"
"1180",5597401,5599362,"Fine.","Slap Shot"
"1181",5600446,5603407,"- Oh. Good.- You think you're gonna like Florida?","Slap Shot"
"1182",5604783,5606828,"Yeah.","Slap Shot"
"1183",5611331,5613875,"- Oh, you are very clever.- What?","Slap Shot"
"1184",5614000,5618088,"It's been so much fun,waiting to see what you're gonna do next.","Slap Shot"
"1185",5618171,5622342,"The articles in the paperare very funny, that sports writer?","Slap Shot"
"1186",5622426,5625428,"- Dickie Dunn?- You've certainly got his number.","Slap Shot"
"1187",5626012,5631226,"The radio interviews are fantastic,and the Hanson brothers? Oh, my God!","Slap Shot"
"1188",5631309,5633436,"Well, attendance has quadrupled.","Slap Shot"
"1189",5633519,5636439,"Yes. I am in the blackfor the first time in four years.","Slap Shot"
"1190",5636522,5641235,"- Hey, that's great.- I guess I owe that to you. Thank you.","Slap Shot"
"1191",5641360,5644029,"You're welcome.So, you can sell us real easy, then?","Slap Shot"
"1192",5644113,5648159,"- I could probably get some interest.- Oh, boy. That's great!","Slap Shot"
"1193",5648576,5650786,"Oh, that's just great, Anita!","Slap Shot"
"1194",5650869,5654205,"You know, for five months now,I've been tryin' to prove to you,","Slap Shot"
"1195",5654330,5658085,"without ever really knowingwho you were, that you were wrong,","Slap Shot"
"1196",5658168,5661588,"and that we could get somebodyinterested in the Chiefs.","Slap Shot"
"1197",5662422,5664716,"We could sew that thing up tonight,you know.","Slap Shot"
"1198",5664841,5668177,"- We oughta cream those guys!- That's terrific.","Slap Shot"
"1199",5668302,5673433,"But I couldn't make enough of a profitto have a sale be worthwhile.","Slap Shot"
"1200",5674475,5679021,"My accountant tells me I'm better offfolding the team, taking a tax loss.","Slap Shot"
"1201",5681274,5684234,"You mean,you could sell us but you won't?","Slap Shot"
"1202",5684318,5686361,"I could probably sell you.","Slap Shot"
"1203",5687153,5689114,"But I can't.","Slap Shot"
"1204",5693660,5695620,"Oh.","Slap Shot"
"1205",5696330,5698790,"You know...","Slap Shot"
"1206",5698874,5700834,"We're human beings, you know.","Slap Shot"
"1207",5703669,5708132,"I have to confess that I've never letthe children watch a hockey game.","Slap Shot"
"1208",5708216,5712428,"I have a theory that childrenimitate what they see on a TV screen.","Slap Shot"
"1209",5713304,5715973,"They see violence, they'll become violent.","Slap Shot"
"1210",5716057,5719393,"They see someone stick up a bank,they'll stick up a bank.","Slap Shot"
"1211",5719518,5722063,"Heroin. You name it.","Slap Shot"
"1212",5722897,5725107,"- You're fucked.- What?","Slap Shot"
"1213",5725190,5727150,"You are totally fucked.","Slap Shot"
"1214",5728568,5731572,"You're garbagefor letting us all go down the drain.","Slap Shot"
"1215",5731697,5735200,"- Are you serious?- You could sell us. We're hot.","Slap Shot"
"1216",5735283,5737953,"People go nuts for us.You could find a buyer.","Slap Shot"
"1217",5738036,5740705,"I don't think you understand finance.","Slap Shot"
"1218",5750047,5753217,"Your son looks like a fag to me.You'd better get married again,","Slap Shot"
"1219",5753300,5756470,"cos he'll have somebody's cockin his mouth before you know it.","Slap Shot"
"1220",5756595,5759681,"How dare you! How dare you!","Slap Shot"
"1221",5761809,5766354,"Our listeners'll be surprised to learn thatyou're a soft-spoken young man, Killer.","Slap Shot"
"1222",5766480,5767856,"Yes, I am.","Slap Shot"
"1223",5767939,5770567,"I was watching some kidsplay hockey the other day,","Slap Shot"
"1224",5770651,5773028,"five- and six-year-olds, little mites.","Slap Shot"
"1225",5773153,5775280,"One kid said ""I'm Killer Carlson.""","Slap Shot"
"1226",5775363,5778533,"He picked up his little stick,and he creamed that other kid.","Slap Shot"
"1227",5778658,5780452,"How do you feel about that, Dave?","Slap Shot"
"1228",5780577,5784622,"Well, Jim, the way I see it is, the kidprobably would've done it anyway.","Slap Shot"
"1229",5784705,5786666,"Bad upbringing in the home.","Slap Shot"
"1230",5786749,5789752,"- That's very interesting.- Can I be serious for a minute?","Slap Shot"
"1231",5789835,5791337,"By all means.","Slap Shot"
"1232",5791420,5794757,"I'djust like to say that,no matterhow the game turns out tonight,","Slap Shot"
"1233",5794882,5798552,"I owe all that I amto our coach, Reg Dunlop.","Slap Shot"
"1234",5798677,5803057,"He's had the greatest influence on me,aside ofcourse from the Swami Baha,","Slap Shot"
"1235",5803182,5806935,"whose positive-thinking recordshave been a tremendous help.","Slap Shot"
"1236",5807018,5808978,"- Positive-thinking records?- Yeah.","Slap Shot"
"1237",5809103,5812107,"You can get 'emin any religious record store.","Slap Shot"
"1238",5812232,5815902,"And I know that thousands of peoplein Charlestown have lost their jobs,","Slap Shot"
"1239",5815985,5818279,"you know, with the mill closing and all.","Slap Shot"
"1240",5818404,5821658,"I see 'em walking around the streetsdepressed all the time.","Slap Shot"
"1241",5821783,5824869,"Well, I just wanna say to all youunemployed folks out there,","Slap Shot"
"1242",5824952,5827622,"you can get a new lease on lifewith these records.","Slap Shot"
"1243",5827705,5830166,"Nothing'll botheryou any more.","Slap Shot"
"1244",5830291,5833126,"You can go and clobberthe next guy in yourbusiness life.","Slap Shot"
"1245",5833210,5835588,"- That's very inspirational, Dave.- Thanks.","Slap Shot"
"1246",5835671,5839258,"- Take care ofyourself.- Yeah. We're gonna win tonight...","Slap Shot"
"1247",5839341,5841801,"Jesus Christ. What a fuckin' nightmare.","Slap Shot"
"1248",5876585,5878545,"Braden!","Slap Shot"
"1249",5882590,5884550,"Ned!","Slap Shot"
"1250",5885510,5887470,"Hey!","Slap Shot"
"1251",5899440,5901651,"Kid?","Slap Shot"
"1252",5904695,5906738,"Hey, come on back!","Slap Shot"
"1253",5906822,5911452,"You don't have to fight if you don't wanna.You can do whatever you wanna do.","Slap Shot"
"1254",5915163,5918500,"You know, I've had it withthe show business crap, too.","Slap Shot"
"1255",5919710,5922879,"I don't know what hit me!I'm drivin' up here, and I say to myself","Slap Shot"
"1256",5922962,5924922,"""Who cares about Florida?""","Slap Shot"
"1257",5925047,5928301,"Screw the sale.It's probably a bunch of crap anyway.","Slap Shot"
"1258",5930303,5932263,"No, that's bullshit.","Slap Shot"
"1259",5932388,5934349,"Hey?","Slap Shot"
"1260",5935183,5938769,"The team's history, kid.There ain't no next year.","Slap Shot"
"1261",5938894,5942482,"I'm tits-up after this gameno matter what happens.","Slap Shot"
"1262",5944733,5946693,"But I'll tell you one thing.","Slap Shot"
"1263",5947944,5950781,"We're gonna winthat fuckin' championship tonight.","Slap Shot"
"1264",5950865,5953158,"But we're gonna win it fair and square.","Slap Shot"
"1265",5953242,5956119,"Old-time hockey,none of this wrestling shit.","Slap Shot"
"1266",5957912,5960457,"You know? What the hell?It's my last game.","Slap Shot"
"1267",5960540,5963376,"I'm gonna go out with style!Play it straight!","Slap Shot"
"1268",5966128,5968256,"I'd like to have you there with me.","Slap Shot"
"1269",5978933,5982436,"Oh, uh... you know,Lily's been staying at my place.","Slap Shot"
"1270",5982561,5984522,"She's a terrific gal.","Slap Shot"
"1271",5988692,5990985,"We've been havin' a hell of a time.","Slap Shot"
"1272",6004332,6006292,"Reg! Hey, Reg!","Slap Shot"
"1273",6009254,6011797,"- What?- Want me to run in with stretchers?","Slap Shot"
"1274",6011922,6014925,"Get outta here, you goddamn parasite.","Slap Shot"
"1275",6018387,6023600,"This is Jim Carr. Jeff Hanson, I just can'ttell you the pleasure you've given us.","Slap Shot"
"1276",6023725,6026186,"I'd like to ask one question.Win, lose or draw,","Slap Shot"
"1277",6026270,6029022,"this is the Chiefs'last game before you leave.","Slap Shot"
"1278",6029105,6033652,"- Anything you want to say to Flood City?- What do you mean, Flood City?","Slap Shot"
"1279",6033777,6036321,"Never mind, Jeff.I guess that's before your time.","Slap Shot"
"1280",6036404,6038865,"Reg Dunlop! How about a statement?","Slap Shot"
"1281",6038990,6041201,"Good game, fella.Good luck to you tonight.","Slap Shot"
"1282",6041284,6043494,"Reg Dunlophas just asked us to come back...","Slap Shot"
"1283",6043620,6046288,"Girls! Outta here!","Slap Shot"
"1284",6066517,6068477,"No hittin'.","Slap Shot"
"1285",6078653,6082323,"The Chiefs are history, guys.There ain't no Florida deal.","Slap Shot"
"1286",6082449,6085243,"Come on, Reg.What are you talkin' about?","Slap Shot"
"1287",6086660,6090581,"I just made that shit up.We're deader than this stinkin' town is.","Slap Shot"
"1288",6091832,6093083,"Dead history!","Slap Shot"
"1289",6093209,6096628,"I conned you guys. I just lied to you.","Slap Shot"
"1290",6101383,6105136,"We were never anythingbut a rich broad's tax write-off.","Slap Shot"
"1291",6105261,6107472,"It made no differencewhether we won or lost.","Slap Shot"
"1292",6107597,6109557,"- Nail 'em!- Kill 'em!","Slap Shot"
"1293",6110683,6114354,"You know, we ain't hockey players.We've been clowns.","Slap Shot"
"1294",6114479,6118608,"We've been goons!We're the freaks in a fuckin' sideshow.","Slap Shot"
"1295",6118691,6123404,"We're nothing but a bunch of criminals.We oughta be in jail, that's all there is.","Slap Shot"
"1296",6123488,6127324,"- I'm ashamed.- Not you, Coach?","Slap Shot"
"1297",6127449,6130118,"Yeah. Really ashamed of myself.","Slap Shot"
"1298",6134706,6136666,"See, Ned was right.","Slap Shot"
"1299",6137209,6140629,"Violence is killin' this sport.It's draggin' it through the mud.","Slap Shot"
"1300",6140754,6145717,"If things keep up the way they are, hockeyplayers'll be nothing but actors, punks.","Slap Shot"
"1301",6147302,6149679,"Well, I'm not playin'my last game that way.","Slap Shot"
"1302",6149804,6152098,"- Last game?- Yeah.","Slap Shot"
"1303",6152181,6155435,"It's my last game,and I wanna play it straight.","Slap Shot"
"1304",6155518,6158604,"No more ""Nail 'em.""No more ""Fuck with 'em."" That's finished.","Slap Shot"
"1305",6158729,6162566,"I wanna win that championship tonight,but I wanna win it clean.","Slap Shot"
"1306",6162649,6166153,"Old-time hockey,like when I got started, you know?","Slap Shot"
"1307",6167738,6172535,"Jeez. Toe Blake, Dit Clapper,Eddie Shore, those guys were the greats.","Slap Shot"
"1308",6173494,6176371,"I don't know what to say.Christ, it's up to you.","Slap Shot"
"1309",6188967,6192220,"- Reg is our coach.- Yeah, sure. Old-time hockey!","Slap Shot"
"1310",6192345,6194305,"- Like Eddie Shore.- Yeah.","Slap Shot"
"1311",6195347,6197308,"Coach, our line starts?","Slap Shot"
"1312",6198559,6200603,"- Sure.- Yeah!","Slap Shot"
"1313",6200686,6204106,"We got a game to win.Everybody on the ice. Come on, guys.","Slap Shot"
"1314",6208235,6210362,"Evening, boys.","Slap Shot"
"1315",6210445,6214700,"Wimpy, how are ya?Crash, how are you? Scotty.","Slap Shot"
"1316",6214783,6217077,"Better than Philadelphia this time!","Slap Shot"
"1317",6217911,6220663,"You're gonna eyeballthe new Charlestown Chiefs.","Slap Shot"
"1318",6220746,6224918,"Well, ladies and gentlemen, this hasall the earmarks of a hockey classic.","Slap Shot"
