"id","startTime","endTime","text","title"
"655",3025570,3027613,"Somebody own the Chiefs.","Slap Shot"
"656",3027697,3029907,"We go to Florida and I get the money.","Slap Shot"
"657",3044087,3046131,"That's nice.","Slap Shot"
"658",3049259,3053722,"I don't like the way they cover their jugsall up with the feathers, you know, Reg?","Slap Shot"
"659",3053805,3056099,"They are so beautiful.","Slap Shot"
"660",3059978,3064691,"They oughta cut the costumes up higheron the thigh, so you can see more ass.","Slap Shot"
"661",3064816,3067985,"You make me sickwhen you speak, Morris.","Slap Shot"
"662",3068069,3070946,"This isn't art. This is sex.","Slap Shot"
"663",3081874,3083667,"Ooh!","Slap Shot"
"664",3083751,3085961,"Ogilthorpe fucked her, you know.","Slap Shot"
"665",3086711,3089089,"It's true. I heard it from a couple of guys.","Slap Shot"
"666",3089214,3093051,"Ogilthorpe fucked the last girlon the pinwheel of the lce Stravaganza.","Slap Shot"
"667",3093134,3095345,"That's her, right there.","Slap Shot"
"668",3104395,3107732,"Get your butt in gear, for the love of Mike.","Slap Shot"
"669",3138887,3141264,"- You gals like skatin', huh?- Sure.","Slap Shot"
"670",3141889,3146519,"I mean, dressed as bluebirds with all themfeathers on, racin' around the ice like that.","Slap Shot"
"671",3146603,3150606,"- You should talk.- No, well, I just asked out of curiosity.","Slap Shot"
"672",3150689,3154109,"- I like to see how the other half lives.- Renee, I like to skate too.","Slap Shot"
"673",3154235,3156529,"- But the hair is rotten here.- Hair?","Slap Shot"
"674",3156612,3158655,"Yeah. The hair.","Slap Shot"
"675",3159781,3161282,"- Air.- It make me sick.","Slap Shot"
"676",3161366,3164369,"- Your face is a mess.- I got in a fight. See?","Slap Shot"
"677",3165746,3167705,"I don't know. It looks sorta cute.","Slap Shot"
"678",3167789,3170876,"- Are you a fighter?- Nah. I'm a lover.","Slap Shot"
"679",3180843,3183471,"Is your team any good?","Slap Shot"
"680",3183554,3187058,"No. In fact, we're so badthat we're disbanding.","Slap Shot"
"681",3187141,3189602,"What about Florida, eh, Reg?","Slap Shot"
"682",3189727,3192813,"- Well, we got a win.- We won three games in a row, Reg.","Slap Shot"
"683",3192896,3195858,"- Yeah. We're on a roll.- We're on a roll. We're gonna win.","Slap Shot"
"684",3195941,3198318,"- How's Ogie Ogilthorpe?","Slap Shot"
"685",3198402,3201154,"- Who?- Ogie Ogilthorpe. You know old Ogie.","Slap Shot"
"686",3201613,3204783,"- Ogie.- You think he's all he's cracked up to be?","Slap Shot"
"687",3204866,3206910,"Is he a nice guy?","Slap Shot"
"688",3207243,3209203,"I'll be right back.","Slap Shot"
"689",3213249,3217503,"- You're doing great. You've got 'em...- Oh, yeah. You betcha.","Slap Shot"
"690",3219881,3221049,"Hey, Coach!","Slap Shot"
"691",3221174,3223134,"How you doin'?","Slap Shot"
"692",3231892,3233935,"Son of a bitch.","Slap Shot"
"693",3241276,3244153,"Ooh, and it's all right,and it's comin' on...","Slap Shot"
"694",3244237,3246698,"Hey, where the helldid all this beer come from?","Slap Shot"
"695",3246781,3248908,"- It's from the owner.- The owner?","Slap Shot"
"696",3249409,3250576,"Yeah.","Slap Shot"
"697",3250660,3252369,"How's his family, Reg?","Slap Shot"
"698",3252494,3254706,"He told me to say he's glad we're winnin',","Slap Shot"
"699",3254789,3257583,"cos it'll make it easierto close that Florida deal.","Slap Shot"
"700",3257666,3259793,"- You find the guy name?- Oh, yeah.","Slap Shot"
"701",3259918,3264715,"- He's neat. Looking to get us bonuses.- Hey, that's good news, eh?","Slap Shot"
"702",3264798,3267009,"- Yeah.","Slap Shot"
"703",3267134,3269428,"- What? What?- Beats me.","Slap Shot"
"704",3269512,3272598,"No one can take yourplace","Slap Shot"
"705",3275475,3277519,"lfyou get hurt","Slap Shot"
"706",3280438,3283107,"- What the fuck is that?","Slap Shot"
"707",3284567,3286611,"Hey!","Slap Shot"
"708",3286736,3288071,"Where? Oh, yeah!","Slap Shot"
"709",3295953,3299456,"- We thought it'd be a big surprise.- It's wonderful!","Slap Shot"
"710",3303085,3305754,"You look like my mother! You're beautiful!","Slap Shot"
"711",3307506,3309132,"Yeah! Billy!","Slap Shot"
"712",3313887,3317056,"Hey. It's me, Reg. How are you?","Slap Shot"
"713",3318433,3321436,"We're kickin' the shitoutta everybody. We're unbeatable.","Slap Shot"
"714",3321561,3323604,"Listen, I got a favour to ask ya.","Slap Shot"
"715",3323730,3326650,"Yeah. Remember Francine?","Slap Shot"
"716",3327317,3330736,"All together in one room. Why not?","Slap Shot"
"717",3331779,3336576,"My ex-wife. Yeah, the pretty one.Well, has she been in there?","Slap Shot"
"718",3337618,3341204,"- We're in the Chiefs!- It's against our policy.","Slap Shot"
"719",3341288,3344041,"Couple of tickets in it for you. Which bar?","Slap Shot"
"720",3346001,3350547,"Wait a minute. Hold it. No, it's justeverybody's going bananas in here.","Slap Shot"
"721",3354092,3356636,"- They convicted Ogilthorpe.- Help me.","Slap Shot"
"722",3356761,3359222,"Get the manager. Somebody help me.","Slap Shot"
"723",3359306,3362475,"Eddie? Listen, this guy she was with -what did he look like?","Slap Shot"
"724",3362600,3366187,"It's their rink, it's their iceand it's their fuckin' town.","Slap Shot"
"725",3366312,3368773,"- But tonight we got our fans with us!- Yeah!","Slap Shot"
"726",3368898,3372818,"They spent their own dough to get here,and they came here to see us.","Slap Shot"
"727",3372943,3377490,"Let's show 'em what we got. Get outon the ice and let 'em know you're there.","Slap Shot"
"728",3377615,3380576,"Get that stick in their side,let 'em know you're there.","Slap Shot"
"729",3380659,3383328,"Get that lumber in his teeth,let him know you're there!","Slap Shot"
"730",3383411,3385205,"Bleed all over 'em.Let 'em know you're there.","Slap Shot"
"731",3385289,3387416,"Give 'em a good warm-up, Danny.Let's go.","Slap Shot"
"732",3387499,3389542,"Come on, fellas.","Slap Shot"
"733",3389626,3392003,"Good game tonight, guys.","Slap Shot"
"734",3396090,3399510,"The Peterborough Patriotsversus the Charlestown Chiefs,","Slap Shot"
"735",3399635,3402347,"brought to you bySheehan's Rustproofing.","Slap Shot"
"736",3402430,3405349,"The Chiefs have come outon the ice for a warm-up period.","Slap Shot"
"737",3405433,3408310,"They're about to tryfor their fifth consecutive win.","Slap Shot"
"738",3408393,3410688,"They're applauded by their booster club,","Slap Shot"
"739",3410771,3415067,"who have travelled all the wayfrom Charlestown to be here tonight.","Slap Shot"
"740",3448473,3451894,"There's no one to stop it becausethere are no officials on the ice.","Slap Shot"
"741",3451977,3455480,"What has come overthe Charlestown Chiefs?","Slap Shot"
"742",3463071,3467367,"And the rockets' red glare","Slap Shot"
"743",3467492,3471788,"The bombs bursting in air","Slap Shot"
"744",3471913,3476793,"Gave proof through the night","Slap Shot"
"745",3476918,3481880,"That our flag was still there","Slap Shot"
"746",3482549,3485009,"I got my eye on you.You pull one thing, you're out.","Slap Shot"
"747",3485092,3487636,"I run a clean game.Any trouble, I'll suspend you.","Slap Shot"
"748",3487761,3489888,"I'm listening to the fucking song!","Slap Shot"
"749",3494101,3500357,"O'er the land of the free","Slap Shot"
"750",3500440,3506028,"No. No, no. To Mrs Reggie Dunlop,from Reggie Dunlop.","Slap Shot"
"751",3506112,3508073,"Collect.","Slap Shot"
"752",3509741,3513744,"Well, make it...Operator, I'll pay for the call here.","Slap Shot"
"753",3515789,3517749,"Whoa!","Slap Shot"
"754",3518249,3520542,"- What are you doin'?- Makin' it look mean.","Slap Shot"
"755",3520626,3522044,"Yeah!","Slap Shot"
"756",3526590,3531136,"Honey? We won last night. Yeah, we won.I got a good winning streak going...","Slap Shot"
"757",3531846,3534306,"- Who is this?","Slap Shot"
"758",3534389,3536433,"Hello?","Slap Shot"
"759",3537559,3539602,"Shit!","Slap Shot"
"760",3549779,3553616,"A little bit south ofSaskatoon","Slap Shot"
"761",3555200,3558537,"Me and Junie Mae, we got on fine","Slap Shot"
"762",3559038,3561582,"Till I had to move","Slap Shot"
"763",3561665,3563708,"Gin.","Slap Shot"
"764",3565878,3567921,"Eight.","Slap Shot"
"765",3570548,3572593,"- Hey, Reg?- Yeah?","Slap Shot"
"766",3574136,3576930,"- I think I'm gonna change my name.- Oh, yeah?","Slap Shot"
"767",3577013,3579057,"Yeah.","Slap Shot"
"768",3579932,3582143,"Killer.","Slap Shot"
"769",3582227,3585313,"Hey, that's got a nice ring to it, kid.","Slap Shot"
"770",3585438,3586939,"Yeah.","Slap Shot"
"771",3596448,3598576,"I'm not gonna do it.","Slap Shot"
"772",3599577,3602037,"- I'm not gonna goon it up for you.- No?","Slap Shot"
"773",3604039,3606417,"Nope.","Slap Shot"
"774",3607418,3609461,"I'll bench you.","Slap Shot"
"775",3610420,3612547,"I'll take my chances.","Slap Shot"
"776",3613674,3617093,"Keep on thinkin' ofmy honeymoon","Slap Shot"
"777",3617719,3622265,"A little bit south ofSaskatoon","Slap Shot"
"778",3625977,3628520,"Pick up the boosters!","Slap Shot"
"779",3628854,3630398,"Pull over, Walt!","Slap Shot"
"780",3630481,3633025,"Let's get the girls in here.","Slap Shot"
"781",3633109,3635486,"Come on, Walt!","Slap Shot"
"782",3636111,3638072,"Great.","Slap Shot"
"783",3660926,3663721,"My husband will kill mewhen he finds out.","Slap Shot"
"784",3663805,3664889,"Let's go.","Slap Shot"
"785",3666307,3669393,"Their bus is coming up the street!They're coming!","Slap Shot"
"786",3672188,3674648,"We don't need you here!","Slap Shot"
"787",3675065,3678068,"There's no room in sportsfor people like you.","Slap Shot"
"788",3678735,3680779,"Get outta town!","Slap Shot"
"789",3684157,3687911,"Keep thinkin' ofmy honeymoon","Slap Shot"
"790",3687995,3692290,"A little bit south ofSaskatoon","Slap Shot"
"791",3693666,3697504,"By a big old fire and honeymoon","Slap Shot"
"792",3697754,3699964,"A little bit south","Slap Shot"
"793",3700423,3702716,"7-1. There's the face-off.","Slap Shot"
"794",3703718,3708180,"Charlestown Chiefs seem to becoming down the ice with the puck.","Slap Shot"
"795",3711099,3713644,"Kill those Hanson creeps!","Slap Shot"
"796",3720276,3722152,"You goons! You can't skate!","Slap Shot"
"797",3723111,3726114,"We like to see an old-fashionedbrand of hockey played here.","Slap Shot"
"798",3726197,3729034,"You're a bunch of animals,you Hanson apes!","Slap Shot"
"799",3742880,3745883,"Get outta town, four-eyes!","Slap Shot"
"800",3763316,3766194,"- Is this the guy?- Yeah, that's him!","Slap Shot"
"801",3766277,3768404,"No, he's over there!","Slap Shot"
"802",3773367,3777539,"Ladies and gentlemen, look at that.You can't see that. I'm on radio.","Slap Shot"
"803",3779374,3781584,"No, no, not him. That's the one!","Slap Shot"
"804",3782876,3785253,"Go fuck a moose, froggy!","Slap Shot"
"805",3785337,3787381,"Think we should get into this?","Slap Shot"
"806",3788882,3790509,"Just a thought.","Slap Shot"
"807",3790592,3794513,"- It wasn't me!- No, Jeff, no. It's the other guy.","Slap Shot"
"808",3799851,3802604,"Think the old folks in Floridaare gonna like these guys?","Slap Shot"
"809",3802688,3805648,"I don't believe a word of that Florida shit.","Slap Shot"
"810",3805732,3809860,"The fans are standing up to them. Thesecurity guards are standing up to them.","Slap Shot"
"811",3809944,3812739,"The peanut vendorsare standing up to them!","Slap Shot"
"812",3812822,3815616,"If I could get down there,I'd be standing up to them!","Slap Shot"
"813",3826961,3829254,"- What hit you?- An object, right in the face.","Slap Shot"
"814",3829380,3832549,"- I know. What was it?- I don't know. Key chain, you know.","Slap Shot"
"815",3832674,3835219,"- Car keys, house keys.- Keys to the camper.","Slap Shot"
"816",3843894,3846271,"- Hi, guys.- The Hansons.","Slap Shot"
"817",3848731,3852235,"Guys? Put the fucking bus in gear.The cops have come for the Hansons.","Slap Shot"
"818",3852360,3855071,"- The cops?- How many are out there?","Slap Shot"
"819",3859659,3861702,"The Hansons.","Slap Shot"
"820",3864579,3868250,"I throw up my hands. I can't control'em any more. They gotta be punished.","Slap Shot"
"821",3868375,3871336,"Will you do me a favourand put 'em behind bars?","Slap Shot"
"822",3874964,3879594,"They're looking for you guys.There's gotta be some misunderstanding.","Slap Shot"
"823",3884140,3888769,"Look at his lip. Somebody threw a fuckingtyre chain, hit him right in the mouth.","Slap Shot"
"824",3888853,3891230,"Scratches, made by human fingernails.","Slap Shot"
"825",3891313,3893524,"This kid has taken a savage beating.","Slap Shot"
"826",3895276,3898153,"There's six of them out there for us.","Slap Shot"
"827",3898237,3902950,"They're gonna put you in the same jailwith Ogilthorpe. Come on, you guys.","Slap Shot"
"828",3903659,3906203,"They let you make one phone call.","Slap Shot"
"829",3906328,3909832,"They book you, then they give you a dimeand let you make one phone call.","Slap Shot"
"830",3909957,3914752,"- Call the pizza man!- Why don't you call a massage parlour?","Slap Shot"
"831",3915670,3918840,"- Hey, guys, we'll see you later.- Save me a piece of pizza.","Slap Shot"
"832",3918965,3923594,"- Don't eat my watermelon sticks.- Don't admit to nothing, you guys.","Slap Shot"
"833",3925889,3930059,"It's me - Reg. They're puttin' the Hansonsaway on a trumped-up charge.","Slap Shot"
"834",3930142,3934063,"Someone threw a monkey wrench.Yeah, it hit Jeff right in the face.","Slap Shot"
"835",3934146,3938192,"No, they were defending the honourof Charlestown at the time.","Slap Shot"
"836",3939109,3941946,"The boosters are behind us 100 per cent.","Slap Shot"
"837",3943447,3945490,"Dickie? Have you seen Francine?","Slap Shot"
"838",3945574,3950037,"Sergeant, you will never meet a greaterchampion of pure hockey than me.","Slap Shot"
"839",3950162,3952122,"Sergeant, I knew Eddie Shore!","Slap Shot"
"840",3952247,3954457,"- You guys back there?- Hey, Coach!","Slap Shot"
"841",3954582,3957836,"Peterborough lost tonight,so as of now we're in the play-offs!","Slap Shot"
"842",3959004,3963549,"Sergeant, I would like to see the bailjust a little more reasonable...","Slap Shot"
"843",3963632,3967553,"- Joe, hurry it up. Let's get outta here.- Sergeant, when is the trial?","Slap Shot"
"844",3967637,3969930,"You can't keep them here.They're folk heroes.","Slap Shot"
"845",3970055,3973016,"- They're criminals.- Most folk heroes start as criminals.","Slap Shot"
"846",3973100,3975936,"Sergeant, you're askingan exorbitant sum.","Slap Shot"
"847",3976020,3979606,"Joe, I got it right here. How muchare these goons gonna cost us?","Slap Shot"
"848",3979689,3982693,"- Hey, guys! Braden's bailin' you out!- $250 each.","Slap Shot"
"849",3982776,3987489,"This young fella is in a hurry because he'sgot the prettiest wife you ever saw waitin'.","Slap Shot"
"850",3987614,3990157,"- But she ain't happy.- Sam, let 'em out.","Slap Shot"
"851",3991201,3992827,"I want a receipt.","Slap Shot"
"852",3992911,3994787,"Hey, hey, hey!","Slap Shot"
"853",3994912,3997915,"Hey, Coach, look,we got to keep our bracelets.","Slap Shot"
"854",3998040,4000001,"Thanks a lot, Sarge.","Slap Shot"
"855",4001002,4003212,"- Let's get on the bus.- Look at that.","Slap Shot"
"856",4005047,4008718,"The boys and I want youto have this as a little memento.","Slap Shot"
"857",4008801,4012054,"It's a Chiefs key ring.You can't buy these in stores.","Slap Shot"
"858",4034450,4037870,"- Aren't those Hansons something?- Aren't they, though?","Slap Shot"
"859",4037995,4041582,"- They're sorta funny-looking.- Real funny-looking.","Slap Shot"
"860",4041707,4044418,"- They're probably real good guys.- Underneath.","Slap Shot"
"861",4044501,4048339,"- They couldn't be as dumb as they look.- Yes, they could.","Slap Shot"
"862",4048422,4050466,"They're just goons.","Slap Shot"
"863",4051133,4053927,"Johnny doesn't care for fighting.He told me so.","Slap Shot"
"864",4054010,4056305,"That's bullshit.","Slap Shot"
"865",4063728,4069108,"If we weren't so far below sea level,the radio reception here'd be much better.","Slap Shot"
"866",4070359,4072821,"Ooh, I'm getting tipsy!","Slap Shot"
"867",4072904,4075364,"I've been shitfaced for the past week.","Slap Shot"
"868",4075490,4077533,"I only drink in the afternoon.","Slap Shot"
"869",4078575,4082330,"Or before a game.Or when Johnny's away.","Slap Shot"
"870",4082997,4085124,"Me too.","Slap Shot"
"871",4085207,4087334,"If I'm not tight, I can't stand it.","Slap Shot"
"872",4087459,4089503,"That's terrible.","Slap Shot"
"873",4094424,4096134,"It's sad","Slap Shot"
"874",4096217,4098011,"So sad","Slap Shot"
"875",4098136,4101890,"It's a sad, sad situation","Slap Shot"
"876",4102015,4106311,"And it's getting more and more absurd","Slap Shot"
"877",4109439,4111232,"It's sad","Slap Shot"
"878",4111357,4113067,"So sad","Slap Shot"
"879",4113150,4116237,"Why can't we talk it over?.","Slap Shot"
"880",4117113,4119740,"Oh, it seems to me","Slap Shot"
"881",4120157,4125037,"That sorry seemsto be the hardest word","Slap Shot"
"882",4164700,4167160,"- How you doin', Lil?- Hey, Johnny.","Slap Shot"
"883",4177712,4180006,"Hey, Lil?","Slap Shot"
"884",4180131,4182175,"Lil!","Slap Shot"
"885",4188431,4191308,"Hiya. Let's go someplace.You know the Aces?","Slap Shot"
"886",4191392,4193936,"- Bully!- Let's start something.","Slap Shot"
"887",4194019,4196897,"- Get the fuck out. I'm going home.- Oh, yeah?","Slap Shot"
"888",4197648,4200025,"Where's Braden going?","Slap Shot"
"889",4205823,4208199,"I got a better idea. Let's die in bed.","Slap Shot"
"890",4208283,4210910,"- You're nuts.- Jeez.","Slap Shot"
"891",4211744,4214748,"You really married a weirdo.He don't run with the traffic.","Slap Shot"
"892",4214831,4217708,"- Speakin' of weirdos.- Me? I'm normal.","Slap Shot"
"893",4217792,4220085,"Yeah? Well, then, normal is fucked.","Slap Shot"
"894",4220712,4223256,"How come you talk dirty?","Slap Shot"
"895",4224465,4227217,"Cos my family has money.","Slap Shot"
"896",4228469,4230513,"Leave him.","Slap Shot"
"897",4232223,4234766,"My wife left me. I was drivin' her crazy.","Slap Shot"
"898",4235725,4239063,"All she could do wasdrink and cry, like you.","Slap Shot"
"899",4241773,4245527,"Every time she sees me, it drives menuts, cos I know she's askin' herself","Slap Shot"
"900",4245611,4248154,"""How did I get mixed upwith a bum like him?""","Slap Shot"
"901",4248280,4250323,"- Good question.- Oh, yeah?","Slap Shot"
"902",4251282,4254536,"Next year you'll ask yourselfthe same question about Braden.","Slap Shot"
"903",4254619,4256913,"He treats you like shit.","Slap Shot"
"904",4260082,4264629,"He told me you only paid attention to meto make him crazy, so that he'd fight.","Slap Shot"
"905",4264712,4267172,"Yeah. That's part of it.","Slap Shot"
"906",4268340,4271177,"But mainly it's cos I think you're a champ.","Slap Shot"
"907",4271260,4273720,"Only you gotta stop killin' yourself.","Slap Shot"
"908",4284314,4286525,"My place. Hm. That's a coincidence.","Slap Shot"
"909",4287776,4289819,"- Get out!- Hey.","Slap Shot"
"910",4290653,4295533,"You gotta roll with it, kid. Use yourimagination. That's what I've been doing.","Slap Shot"
"911",4295617,4297994,"I can get you straight.","Slap Shot"
"912",4298119,4300079,"Beat it.","Slap Shot"
"913",4302707,4304667,"Well, I'll see you later.","Slap Shot"
"914",4322142,4325061,"I'm proud of you.They're talkin' about you in the streets.","Slap Shot"
"915",4325144,4328982,"- Want a White Avenger?.- No. Gimme a cup of coffee.","Slap Shot"
"916",4329107,4333903,"- That was a nice tribute to the guys.- I tried to capture the spirit of the thing.","Slap Shot"
"917",4333986,4336656,"This is Dickie Dunn.He wrote the article on you.","Slap Shot"
"918",4336739,4340409,"Hi, guys. Nice to meet you. I was tryin'to capture the spirit of the thing.","Slap Shot"
"919",4343830,4345873,"Hi, guys.","Slap Shot"
"920",4352004,4354464,"See the game tonight,compliments of the Chiefs.","Slap Shot"
"921",4354548,4357092,"- Gee, thanks, Reggie.- Hey! Free tickets!","Slap Shot"
"922",4357175,4360345,"- Sure! Spread 'em around, guys!- Hey, thanks.","Slap Shot"
"923",4360429,4362555,"Come to the game,compliments of the Chiefs.","Slap Shot"
"924",4362639,4367268,"- Thanks, Reggie.- You taught that guy a lesson last night.","Slap Shot"
"925",4367351,4371105,"- He was sensational.- I guess that was a big fight?","Slap Shot"
"926",4371189,4373566,"- Are you in pain?- No. It hurt like hell.","Slap Shot"
"927",4373649,4376110,"Oh, you poor thing.","Slap Shot"
"928",4376194,4381323,"Look, I'll make you a double dose of thisstuff, and you won't feel anything.","Slap Shot"
"929",4381406,4382658,"Good.","Slap Shot"
"930",4382783,4384910,"What happened to you?","Slap Shot"
"931",4385036,4387955,"He got that in the fight last night.","Slap Shot"
"932",4388038,4390790,"That is a very deep cut.","Slap Shot"
"933",4391624,4396504,"Will you be at the game? If I seeyou in the stands, it make me feel better.","Slap Shot"
"934",4406305,4408349,"Hey, Killer! Get 'em tonight!","Slap Shot"
"935",4410143,4412186,"Fuckin' wearin' me out.","Slap Shot"
"936",4432205,4434583,"- Reggie.- Oh, hiya, honey! How are you?","Slap Shot"
"937",4435500,4440129,"- You look a thousand years old.- It was a long bus ride.","Slap Shot"
"938",4440254,4442549,"- Did you listen to the game?- Of course not.","Slap Shot"
"939",4442632,4444926,"We got a new attitude!It's bringin' success.","Slap Shot"
"940",4445009,4447636,"- Well, any fool can fight.- No, I swear to you.","Slap Shot"
"941",4447720,4452683,"The Chiefs will be sittin' pretty in Floridawhen this town is a stinkin' memory.","Slap Shot"
"942",4455018,4458189,"You see, I personallyhave been talkin' to the owner,","Slap Shot"
"943",4458272,4460316,"which is why I've beentoo busy to call you.","Slap Shot"
"944",4460441,4462984,"Every wakin' hourI'm on the phone with this guy...","Slap Shot"
"945",4463068,4465445,"Reggie, Reggie. I'm moving.","Slap Shot"
"946",4465570,4467781,"- What?- To Long lsland.","Slap Shot"
"947",4467865,4471117,"A gal who worksin a shop there has a space open.","Slap Shot"
"948",4471242,4473619,"Business here is just dead.","Slap Shot"
"949",4475872,4477749,"Are you really goin'?","Slap Shot"
"950",4477874,4481043,"You know, we haveto get divorced one of these days.","Slap Shot"
"951",4482044,4485965,"I mean, I could meet somebody,you could meet somebody, you know?","Slap Shot"
"952",4486048,4488509,"Yeah?","Slap Shot"
"953",4488634,4490928,"Well, don't look so sad.","Slap Shot"
"954",4496975,4499520,"It's gonna be a big one!","Slap Shot"
"955",4499603,4502064,"- See those guys?- Reggie, look. I'm late.","Slap Shot"
"956",4502189,4504316,"I'll write you when I get settled.","Slap Shot"
"957",4506484,4509571,"Hey. I'll try to call you before you go.","Slap Shot"
"958",4517662,4521582,"- It sucks!- No, son. It looks nice and sells hockey.","Slap Shot"
"959",4521707,4525461,"It ain't mean enough.Put some blood in there.","Slap Shot"
"960",4525545,4528255,"Show somebody gettin' hurt.A groin injury.","Slap Shot"
"961",4528339,4531591,"Put a fuckin' map of Floridain the background. Get some tits in!","Slap Shot"
"962",4531675,4533385,"Put a ""For Sale"" sign on the bottom.","Slap Shot"
"963",4533511,4537806,"I don't want any titsand I don't want any ""For Sale"" sign.","Slap Shot"
"964",4544479,4546689,"Jesus.","Slap Shot"
"965",4546773,4550610,"Remember that greatPeterborough game in... '68?","Slap Shot"
"966",4550735,4553362,"Yeah. What about it?","Slap Shot"
"967",4553571,4556449,"Jacky St Pierre's wife left him.","Slap Shot"
"968",4556533,4560202,"My God, it was snowing like hellbefore we even got to the motel.","Slap Shot"
"969",4560328,4564331,"- Yeah.- Jacky had a whole keg sent in.","Slap Shot"
"970",4564414,4568961,"Poor Jacky. He had a future.I told him to watch that drunk drivin'.","Slap Shot"
"971",4569044,4572297,"God, Joe, did we ever get shitfaced!","Slap Shot"
"972",4572380,4576843,"And Jacky told everybody he was gonnaget Jill back even if he had to beg her.","Slap Shot"
"973",4576927,4580513,"- I told him not to do that.- Oh, I think he shoulda.","Slap Shot"
"974",4580596,4582641,"She was a dynamite broad.","Slap Shot"
"975",4584100,4586978,"- God, did we get shitfaced.- I liked Jacky.","Slap Shot"
"976",4588020,4590648,"- Yeah. He could've been great.- Yeah.","Slap Shot"
"977",4593192,4595653,"And rememberI went up to your room afterwards","Slap Shot"
"978",4595736,4598406,"and you were dressedin chick's clothes?","Slap Shot"
"979",4599198,4602534,"Yeah, you had onthis black bra with tassels.","Slap Shot"
"980",4603660,4608374,"You were dancing in front of a mirrorwith this kinda zebra-skin jockstrap.","Slap Shot"
"981",4608457,4611877,"Remember how I screamed at youwhen you started comin' on to me","Slap Shot"
"982",4611960,4614963,"and I just said ""Jesus, stop it, Joe.I'm ashamed of you.""","Slap Shot"
"983",4615047,4617007,"Damn you.","Slap Shot"
"984",4617090,4619634,"I wanted to tell youthat I forgot the whole thing.","Slap Shot"
"985",4619717,4622721,"Years have passed.Now I'm sexually liberated.","Slap Shot"
"986",4622846,4625557,"I don't care who's a fag no more.I mean, who cares?","Slap Shot"
"987",4625640,4628559,"It's natural. It's all around us.","Slap Shot"
"988",4630228,4632438,"Who's the owner, Joe?","Slap Shot"
"989",4634106,4638235,"He's probably calling Florida.See how the sale is going.","Slap Shot"
"990",4638653,4641489,"I was in Florida once, on a Southern tour,","Slap Shot"
"991",4641572,4645951,"where I met this little redheadwho was an underwater specialist.","Slap Shot"
"992",4647078,4652123,"The first thing she says to mewas ""Come on out by the pool.""","Slap Shot"
"993",4652207,4657504,"So I went out, and she comesleaping out with this banner,","Slap Shot"
"994",4657587,4660757,"wearing nothingbut this little see-through wet suit.","Slap Shot"
"995",4662216,4665887,"- Hey, Reg, I want a chair by the pool.- I want some snatch by the pool.","Slap Shot"
