"id","startTime","endTime","text","title"
"602",2301694,2303332,"It's just a walk, Erica.","Something's Gotta Give"
"603",2303780,2305771,"Not a marriage proposal.","Something's Gotta Give"
"604",2306533,2307807,"You know my name.","Something's Gotta Give"
"605",2307951,2310146,"Erica Jane Barry.","Something's Gotta Give"
"606",2311246,2313601,"I looked you up on the Internet.","Something's Gotta Give"
"607",2316918,2320911,"Do you know that there are over8,000 web sites that mention you?","Something's Gotta Give"
"608",2321298,2323858,"- That's not possible.- No, it's true.","Something's Gotta Give"
"609",2324510,2328139,"I know everything about you now,and not because of last night.","Something's Gotta Give"
"610",2328389,2330141,"No, I understood.","Something's Gotta Give"
"611",2331141,2333860,"- Actually, I looked you up, too.- You did?","Something's Gotta Give"
"612",2334061,2337451,"Yeah. I know you grew up in LA,which I thought nobody did.","Something's Gotta Give"
"613",2337690,2340079,"You started your own record label at 29.","Something's Gotta Give"
"614",2340276,2343871,"Very impressive.Sold it at 40, even more impressive.","Something's Gotta Give"
"615",2344447,2347041,"Then you started a magazine,dabbled in the Internet.","Something's Gotta Give"
"616",2347241,2350438,"And then you investedin a small record company...","Something's Gotta Give"
"617",2350662,2354814,"which you turned into the second-largesthip-hop label in the world.","Something's Gotta Give"
"618",2355166,2359284,"- It's exhausting just hearing about it.- Yeah, I know...","Something's Gotta Give"
"619",2361757,2364510,"but the truth is, it goes by fast, doesn't it?","Something's Gotta Give"
"620",2364718,2367027,"- Like the blink of an eye.- Yeah.","Something's Gotta Give"
"621",2368680,2370159,"Look at this.","Something's Gotta Give"
"622",2374144,2377773,"I notice that you havebowls of those all over your house.","Something's Gotta Give"
"623",2378566,2380363,"It's so crazy, I know.","Something's Gotta Give"
"624",2380526,2382994,"But I just think they're beautiful.","Something's Gotta Give"
"625",2383321,2385755,"But why do you onlypick up the white ones?","Something's Gotta Give"
"626",2385948,2388416,"I don't pick up only the white ones.","Something's Gotta Give"
"627",2388618,2390574,"So you really are crazy.","Something's Gotta Give"
"628",2390787,2395178,"No, I only pick up the white ones. Oh, God.","Something's Gotta Give"
"629",2396960,2398757,"What does that mean?","Something's Gotta Give"
"630",2400088,2402886,"That I'm controlling?Unadventurous? What?","Something's Gotta Give"
"631",2403675,2407304,"So you're as hard on yourselfas you are on everyone else.","Something's Gotta Give"
"632",2415437,2417587,"Something to remember me by.","Something's Gotta Give"
"633",2423112,2425068,"Can I ask you something?","Something's Gotta Give"
"634",2425698,2427654,"Yeah, sure. Go ahead, shoot.","Something's Gotta Give"
"635",2427825,2431500,"What's with all the young girls?What's the story there, really?","Something's Gotta Give"
"636",2431746,2433782,"I just like to travel light.","Something's Gotta Give"
"637",2433956,2436311,"You just like to travel... God!","Something's Gotta Give"
"638",2437085,2439440,"I'm sorry, but what does that mean?","Something's Gotta Give"
"639",2439629,2442587,"Now, see, a 30-year-old gets that.","Something's Gotta Give"
"640",2442799,2444198,"You mean falls for it.","Something's Gotta Give"
"641",2444342,2447061,"I mean accepts it. Acceptance is key.","Something's Gotta Give"
"642",2447262,2449856,"Okay, if that's what you want.A non-threatening woman...","Something's Gotta Give"
"643",2450056,2453048,"doesn't get your number,you get to run the show.","Something's Gotta Give"
"644",2453476,2456627,"I think our relationship is growing,by the way.","Something's Gotta Give"
"645",2456855,2459494,"Have you noticed? I'm serious.","Something's Gotta Give"
"646",2460025,2462823,"Maybe we just needto get out of the house.","Something's Gotta Give"
"647",2463028,2467544,"Now, you may notice, interestingly,we're walking back toward the house...","Something's Gotta Give"
"648",2468158,2470718,"and it's getting a little rocky again.","Something's Gotta Give"
"649",2470911,2474381,"Of course it's getting rocky.We're talking about you.","Something's Gotta Give"
"650",2474623,2477774,"See, I'll accept that slight hostility...","Something's Gotta Give"
"651",2478377,2481016,"because I'm enjoyingyour company so much.","Something's Gotta Give"
"652",2486886,2488319,"Are you okay?","Something's Gotta Give"
"653",2489722,2491633,"Yeah.","Something's Gotta Give"
"654",2493685,2497724,"But I think I'll stay down hereand watch the sun set. You interested?","Something's Gotta Give"
"655",2497981,2499494,"Ringside seat.","Something's Gotta Give"
"656",2503111,2504260,"Big dinner date?","Something's Gotta Give"
"657",2504404,2507396,"Yeah, as a matter of fact,with your doctor.","Something's Gotta Give"
"658",2509034,2510387,"My doctor.","Something's Gotta Give"
"659",2511745,2513895,"- Because he's not too young for you?- No.","Something's Gotta Give"
"660",2514081,2515639,"He's totally too young for me.","Something's Gotta Give"
"661",2515791,2518385,"But we're just having dinner,it's not a date.","Something's Gotta Give"
"662",2518586,2519860,"Does he know that?","Something's Gotta Give"
"663",2520004,2523155,"I'm gonna tell him.But I doubt he thinks of it that way. Okay?","Something's Gotta Give"
"664",2523382,2525418,"I doubt that you doubt it.","Something's Gotta Give"
"665",2526218,2527810,"Anyway, you may like it.","Something's Gotta Give"
"666",2527970,2529801,"Think of it this way:","Something's Gotta Give"
"667",2530139,2533893,"He's non-threatening, won't getyour number, you get to run the show.","Something's Gotta Give"
"668",2534143,2535781,"- That is so unfair.- Trust me.","Something's Gotta Give"
"669",2535937,2537973,"It could be a great night.","Something's Gotta Give"
"670",2541985,2544135,"Look who's answering the door.","Something's Gotta Give"
"671",2544321,2546437,"And look who's at the door.","Something's Gotta Give"
"672",2547032,2548829,"I brought you something.","Something's Gotta Give"
"673",2548992,2551870,"A heart-healthy dinner from our cafeteria.","Something's Gotta Give"
"674",2552162,2553720,"Why, thank you.","Something's Gotta Give"
"675",2556833,2557982,"Hello.","Something's Gotta Give"
"676",2562506,2564781,"- You look beautiful.- Thank you.","Something's Gotta Give"
"677",2580566,2584479,"Hi, it's Marin. I'm not in right now,so leave a message and I'll call you back.","Something's Gotta Give"
"678",2584737,2585931,"Hey, it's me.","Something's Gotta Give"
"679",2586072,2589826,"Just sitting around,looking at your baby pictures.","Something's Gotta Give"
"680",2591161,2592799,"Thinking of you.","Something's Gotta Give"
"681",2598835,2600314,"You've reached Brooke and Shannon.","Something's Gotta Give"
"682",2600462,2603295,"For Brooke, push one,for Shannon, push two.","Something's Gotta Give"
"683",2605884,2608557,"Everybody is out but old Har.","Something's Gotta Give"
"684",2610306,2611375,"Old.","Something's Gotta Give"
"685",2618564,2620236,"Old Har.","Something's Gotta Give"
"686",2654101,2655693,"Top of the heap.","Something's Gotta Give"
"687",2657521,2660274,"- Julian, can I ask you something?- Anything.","Something's Gotta Give"
"688",2660816,2662408,"How old are you?","Something's Gotta Give"
"689",2663527,2664721,"I'm 36.","Something's Gotta Give"
"690",2664862,2667171,"So I'm almost 20 years older than you.","Something's Gotta Give"
"691",2667365,2670755,"Isn't that an enormous amount of yearsto be older than somebody?","Something's Gotta Give"
"692",2670993,2672506,"I don't think it matters at all.","Something's Gotta Give"
"693",2672662,2674414,"- You don't?- I don't.","Something's Gotta Give"
"694",2676457,2677572,"Okay.","Something's Gotta Give"
"695",2678960,2680951,"But in terms of us...","Something's Gotta Give"
"696",2681671,2684310,"you just want us to be friends, right?","Something's Gotta Give"
"697",2684632,2686827,"Honestly? No.","Something's Gotta Give"
"698",2687260,2691014,"- So what do you wanna be?- I think I'd embarrass you if I told you.","Something's Gotta Give"
"699",2691264,2694654,"I was embarrassedjust getting dressed to see you.","Something's Gotta Give"
"700",2695560,2699075,"This may surprise you, but some womenconsider me quite the guy.","Something's Gotta Give"
"701",2699314,2701270,"I've never been married. I'm a doctor.","Something's Gotta Give"
"702",2701442,2704240,"You wouldn't believewhat catnip that is for some women.","Something's Gotta Give"
"703",2704445,2708120,"Yes, I would.Don't you like girls your own age?","Something's Gotta Give"
"704",2708365,2711402,"I do, but I've never met oneI've reacted to...","Something's Gotta Give"
"705",2712703,2714295,"quite like this.","Something's Gotta Give"
"706",2714705,2719062,"And when something happens to youthat's never happened to you before...","Something's Gotta Give"
"707",2719335,2721644,"don't you have to at leastfind out what it is?","Something's Gotta Give"
"708",2721838,2724796,"I suppose. I don't know.This is an area that's tricky for me.","Something's Gotta Give"
"709",2725008,2728045,"See, I don't really date all that muchor all that well.","Something's Gotta Give"
"710",2728261,2730456,"Come on, you must beat them awaywith a stick.","Something's Gotta Give"
"711",2730680,2732955,"You're kidding, right?","Something's Gotta Give"
"712",2733850,2737604,"No. Men my age,or at least the ones I've met...","Something's Gotta Give"
"713",2738730,2742439,"I'm not that regular a person,and they really like regular.","Something's Gotta Give"
"714",2742693,2746402,"Men your age may be really stupid.Did you ever think of that?","Something's Gotta Give"
"715",2746655,2749408,"Yes, I have. Many times.","Something's Gotta Give"
"716",2759126,2761037,"I knew you'd smell good.","Something's Gotta Give"
"717",2761212,2762770,"It's just soap.","Something's Gotta Give"
"718",2763506,2765019,"- Erica...- What?","Something's Gotta Give"
"719",2765299,2767608,"...you're incredibly sexy.- No.","Something's Gotta Give"
"720",2769220,2771893,"I swear to God I'm not.","Something's Gotta Give"
"721",2816978,2818252,"I'm back!","Something's Gotta Give"
"722",2819772,2821046,"Have fun?","Something's Gotta Give"
"723",2822192,2823910,"It was interesting.","Something's Gotta Give"
"724",2827739,2829411,"Good night, Harry.","Something's Gotta Give"
"725",2831201,2832395,"Night.","Something's Gotta Give"
"726",2840002,2842197,"Get rid of that. That's good.","Something's Gotta Give"
"727",2853682,2854956,"Harry 37?","Something's Gotta Give"
"728",2864736,2866488,"Of course. Relentless.","Something's Gotta Give"
"729",2904277,2907110,"I don't understandhow he knows everything.","Something's Gotta Give"
"730",2925549,2927028,"In her pj's.","Something's Gotta Give"
"731",2934224,2937341,"""Pyjama party."" Oh, man.","Something's Gotta Give"
"732",2956122,2957555,"We are cute.","Something's Gotta Give"
"733",2957707,2961700,"This is pretty unusual for me.I'm not used to having sleepovers.","Something's Gotta Give"
"734",2962462,2963611,"Me, either.","Something's Gotta Give"
"735",2963755,2966144,"Really? With your social life?","Something's Gotta Give"
"736",2966591,2969742,"My dear, you're confusingsex with sleeping.","Something's Gotta Give"
"737",2970929,2973966,"Sleeping is somethingthat I prefer to do alone.","Something's Gotta Give"
"738",2974182,2975900,"Okay. Good to know.","Something's Gotta Give"
"739",2977018,2978497,"What are you hungry for?","Something's Gotta Give"
"740",2978645,2980397,"What are my choices?","Something's Gotta Give"
"741",2981231,2984541,"I know you think I'm notvery discriminating when it comes to...","Something's Gotta Give"
"742",2984777,2988372,"Please. What difference does it makewhat I think of you?","Something's Gotta Give"
"743",2988739,2991537,"I can't even imagine what you think of me.","Something's Gotta Give"
"744",2994370,2996964,"Pancakes, pasta, leftover coq au vin.","Something's Gotta Give"
"745",2997164,2999200,"- Grilled cheese?- Pancakes.","Something's Gotta Give"
"746",3000042,3001873,"Totally what I wanted.","Something's Gotta Give"
"747",3004756,3006906,"You ever miss being married?","Something's Gotta Give"
"748",3007925,3009677,"I bet you were great at it.","Something's Gotta Give"
"749",3009844,3013200,"Sometimes. Yeah, at night.But not that much anymore.","Something's Gotta Give"
"750",3013598,3016317,"Was one of usjust saying something interesting?","Something's Gotta Give"
"751",3016518,3019157,"You said you can't imaginewhat I think of you.","Something's Gotta Give"
"752",3019980,3022210,"You don't have to answer that.","Something's Gotta Give"
"753",3022774,3023889,"Okay.","Something's Gotta Give"
"754",3025277,3027916,"If you had an opinion, I'd be curious.","Something's Gotta Give"
"755",3028113,3031708,"Will you tell me firstwhy you only miss being married at night?","Something's Gotta Give"
"756",3032326,3034237,"The phone doesn't ringthat much at night...","Something's Gotta Give"
"757",3034411,3037084,"and the whole alone thinghappens at night.","Something's Gotta Give"
"758",3037289,3040645,"Sleeping by myself took somegetting used to, but I got the hang of it.","Something's Gotta Give"
"759",3040876,3042628,"You gotta sleep in the middle of the bed.","Something's Gotta Give"
"760",3042795,3046549,"It's not healthy to have a sidewhen no one has the other side.","Something's Gotta Give"
"761",3046799,3050269,"Now I'm convincedthat what I think about you is right.","Something's Gotta Give"
"762",3051137,3053207,"You're a tower of strength.","Something's Gotta Give"
"763",3053639,3055516,"Try not to rate my answer.","Something's Gotta Give"
"764",3055683,3057799,"I'm sorry, okay?","Something's Gotta Give"
"765",3058353,3059706,"You know what you're like?","Something's Gotta Give"
"766",3059854,3063767,"You're like one of those great portraitsyou see over a fireplace.","Something's Gotta Give"
"767",3064025,3067335,"Words have been inventedto describe women like you.","Something's Gotta Give"
"768",3067779,3069053,"Such as?","Something's Gotta Give"
"769",3070907,3072101,"Flinty.","Something's Gotta Give"
"770",3074286,3075685,"Impervious.","Something's Gotta Give"
"771",3075829,3078059,"- So you think I'm inhuman?- No.","Something's Gotta Give"
"772",3079082,3080879,"I think you're formidable.","Something's Gotta Give"
"773",3081043,3083682,"Cold, distant,like I'm frozen in some painting?","Something's Gotta Give"
"774",3083879,3084914,"Not at all.","Something's Gotta Give"
"775",3085047,3089757,"But I do think that you use your strengthto separate yourself from everyone.","Something's Gotta Give"
"776",3090803,3093954,"But it's thrillingwhen your defences are down...","Something's Gotta Give"
"777",3094891,3096688,"and you're not isolated.","Something's Gotta Give"
"778",3096851,3100764,"That, I believe, is your winning combo.Killer combo, actually.","Something's Gotta Give"
"779",3104651,3107643,"You know, I can't decide if you hate me...","Something's Gotta Give"
"780",3111074,3114384,"or if you're the only personwho ever really got me.","Something's Gotta Give"
"781",3114619,3116257,"I don't hate you.","Something's Gotta Give"
"782",3117914,3119472,"- You don't?- No.","Something's Gotta Give"
"783",3129259,3130374,"Mom?","Something's Gotta Give"
"784",3133055,3134249,"Surprise!","Something's Gotta Give"
"785",3135141,3136733,"- Hi!- Room service.","Something's Gotta Give"
"786",3136892,3139042,"Honey, what are you doing hereat this hour?","Something's Gotta Give"
"787",3139228,3141025,"I had this big benefit tonight.","Something's Gotta Give"
"788",3141188,3144260,"Then I went out with a bunch of friendsand I checked my messages.","Something's Gotta Give"
"789",3144484,3147362,"And I got thisso sad phone call from Harry.","Something's Gotta Give"
"790",3147570,3151358,"So bored out here, so I figured I shouldcome up and see how you're doing.","Something's Gotta Give"
"791",3151616,3154688,"Thank you so muchfor the gorgeous flowers, by the way.","Something's Gotta Give"
"792",3154911,3156503,"They're so huge.","Something's Gotta Give"
"793",3157038,3158676,"It's a pleasure.","Something's Gotta Give"
"794",3158832,3161585,"That is so sweet.You guys are making pancakes?","Something's Gotta Give"
"795",3161835,3164349,"You're both in your pj's.I feel like I'm interrupting.","Something's Gotta Give"
"796",3164546,3168300,"Don't be silly. You know I never sleep.This one doesn't sleep either.","Something's Gotta Give"
"797",3170260,3171409,"Hello?","Something's Gotta Give"
"798",3172012,3174685,"No, I'm here, babe. I made record time.","Something's Gotta Give"
"799",3177851,3179842,"Is everybody still there?","Something's Gotta Give"
"800",3183774,3185127,"Okay, bye.","Something's Gotta Give"
"801",3185359,3186474,"- Mar?- Yeah?","Something's Gotta Give"
"802",3186610,3189329,"Now that you're here,why don't you finish the pancakes...","Something's Gotta Give"
"803",3189530,3190883,"and I'll get back to work?","Something's Gotta Give"
"804",3191032,3192829,"Mom, I just got here.","Something's Gotta Give"
"805",3193242,3195995,"By the way,Dad totally stood me up today.","Something's Gotta Give"
"806",3196204,3199719,"I was supposed to have lunch with himat Barney's, and he never showed up.","Something's Gotta Give"
"807",3199958,3202347,"- Was he always like this?- Honey, I don't know.","Something's Gotta Give"
"808",3202544,3204774,"That's what happenswhen a couple gets divorced.","Something's Gotta Give"
"809",3204963,3208353,"The kid inherits all the problems.Not that I'm a kid.","Something's Gotta Give"
"810",3210093,3212926,"So how are you? How are you feeling?","Something's Gotta Give"
"811",3222940,3225374,"So tell me, when can you go home?","Something's Gotta Give"
"812",3225567,3227285,"I really am gonna do a little work.","Something's Gotta Give"
"813",3227444,3229560,"So why don't you just finish this?","Something's Gotta Give"
"814",3229738,3232855,"You two catch up,and you know how to fix these.","Something's Gotta Give"
"815",3234619,3236928,"You don't want pancakes anymore?","Something's Gotta Give"
"816",3241084,3242312,"I don't.","Something's Gotta Give"
"817",3245713,3247192,"No, I don't.","Something's Gotta Give"
"818",3257434,3258913,"I'm breaking up with Harry.","Something's Gotta Give"
"819",3259060,3260891,"What do you mean? Why?","Something's Gotta Give"
"820",3261229,3264027,"- I met someone else.- In the two days since you've been gone?","Something's Gotta Give"
"821",3264232,3267508,"You know me, my life's crazy.I meet a thousand new people every day.","Something's Gotta Give"
"822",3267736,3270409,"Besides, let's face it.He's insanely too old for me.","Something's Gotta Give"
"823",3270614,3272525,"I'd be nuts to keep this thing going.","Something's Gotta Give"
"824",3272700,3276090,"True. But you know, he's...","Something's Gotta Give"
"825",3277246,3280682,"I know. He's soulfulwhen you don't expect it, right?","Something's Gotta Give"
"826",3280916,3282952,"Oh, my God, he's unnerving.","Something's Gotta Give"
"827",3283127,3284526,"Mom, listen.","Something's Gotta Give"
"828",3284837,3287715,"I was thinking, if you could handle this...","Something's Gotta Give"
"829",3288800,3290028,"you and Harry.","Something's Gotta Give"
"830",3290176,3292929,"I can't handle it,wouldn't want to handle it.","Something's Gotta Give"
"831",3293137,3296527,"You're only saying that because you thinkthat he and I have had sex.","Something's Gotta Give"
"832",3296766,3298404,"Lower your voice.","Something's Gotta Give"
"833",3299936,3302655,"- Haven't you?- Never, not even close, I swear to God.","Something's Gotta Give"
"834",3302856,3304130,"I'm putting this out there...","Something's Gotta Give"
"835",3304274,3307266,"because for two peoplewho are convinced they've got life beat...","Something's Gotta Give"
"836",3307486,3310717,"something was cooking in the kitchenlast night other than pancakes.","Something's Gotta Give"
"837",3325671,3328060,"- Hello?- I've waited a reasonable amount of time...","Something's Gotta Give"
"838",3328257,3330771,"before calling youeven though you've been on my mind...","Something's Gotta Give"
"839",3330968,3332686,"since I woke up at 5:15.","Something's Gotta Give"
"840",3332845,3334722,"I'm wonderingwhen we could go out again.","Something's Gotta Give"
"841",3334889,3336368,"I have to work the next few nights.","Something's Gotta Give"
"842",3336516,3339428,"If we wait till next week,you'll chicken out, so how's Friday?","Something's Gotta Give"
"843",3339644,3341760,"It's a date night, but that's a good thing.","Something's Gotta Give"
"844",3341938,3343212,"Who is this?","Something's Gotta Give"
"845",3343773,3345331,"I'm kidding.","Something's Gotta Give"
"846",3346151,3349302,"Funny. Can you meet meat The Grill at 8:00?","Something's Gotta Give"
"847",3349529,3351360,"Yes, seems fine.","Something's Gotta Give"
"848",3351740,3354174,"I look forward to seeing you, too.","Something's Gotta Give"
"849",3362000,3364753,"- He's all yours.- Stop that. How'd he take it?","Something's Gotta Give"
"850",3364962,3367237,"He just took care of it for me.","Something's Gotta Give"
"851",3367673,3369664,"He was an ace. Elegant.","Something's Gotta Give"
"852",3370384,3372852,"He said our fate was to be friends.","Something's Gotta Give"
"853",3373596,3374995,"Oh, my God.","Something's Gotta Give"
"854",3376432,3378946,"He was breaking up with me.I didn't even...","Something's Gotta Give"
"855",3379143,3382055,"- He's a genius.- That's not possible. He wouldn't.","Something's Gotta Give"
"856",3382271,3385024,"He absolutely did.And you know what? It doesn't matter...","Something's Gotta Give"
"857",3385233,3388748,"'cause we're doneand we both feel fine about it. Okay?","Something's Gotta Give"
"858",3389654,3391053,"Clean slate.","Something's Gotta Give"
"859",3392824,3394223,"I gotta go.","Something's Gotta Give"
"860",3394784,3395933,"Okay.","Something's Gotta Give"
"861",3396494,3397847,"Now, Erica.","Something's Gotta Give"
"862",3398288,3402361,"Try to think of this as the smartest thingyou've ever done for yourself.","Something's Gotta Give"
"863",3469236,3470464,"Candles?","Something's Gotta Give"
"864",3471405,3472679,"Romantic.","Something's Gotta Give"
"865",3500060,3501379,"I'm sorry.","Something's Gotta Give"
"866",3501895,3503169,"For what?","Something's Gotta Give"
"867",3505357,3508110,"- I just kissed you, and I...- No, honey.","Something's Gotta Give"
"868",3508694,3510173,"I kissed you.","Something's Gotta Give"
"869",3519455,3521366,"I know that one was me.","Something's Gotta Give"
"870",3522333,3524210,"Try not to keep score.","Something's Gotta Give"
"871",3534846,3536165,"Soft lips.","Something's Gotta Give"
"872",3536681,3538751,"I'm so glad they still work.","Something's Gotta Give"
"873",3538934,3542165,"I haven't used them for kissingin such a long time.","Something's Gotta Give"
"874",3542479,3546711,"More like for wearing lipstick,and whistling, and...","Something's Gotta Give"
"875",3563250,3564603,"Well, well.","Something's Gotta Give"
"876",3565461,3567975,"Now look who's gotsomething that works.","Something's Gotta Give"
"877",3568172,3570527,"You didn't even take any Viagra...","Something's Gotta Give"
"878",3570716,3573184,"Kiss me before you make it go away.","Something's Gotta Give"
"879",3587692,3590365,"This could be world-class interesting.","Something's Gotta Give"
"880",3590946,3592095,"Yeah.","Something's Gotta Give"
"881",3592614,3594286,"Having any doubts?","Something's Gotta Give"
"882",3596410,3597479,"Yes.","Something's Gotta Give"
"883",3598495,3599723,"Me, too.","Something's Gotta Give"
"884",3601707,3603186,"But so far...","Something's Gotta Give"
"885",3603334,3606007,"the kissing is spectacular.","Something's Gotta Give"
"886",3607254,3610132,"I'm not grading you, I'm just mentioning it.","Something's Gotta Give"
"887",3610841,3612433,"Like, brilliant.","Something's Gotta Give"
"888",3628610,3631886,"I can't get past your damn turtleneck.","Something's Gotta Give"
"889",3639538,3640937,"Cut it off.","Something's Gotta Give"
"890",3641248,3642442,"Please.","Something's Gotta Give"
"891",3645294,3646522,"Cut it off.","Something's Gotta Give"
"892",3651342,3654095,"- Aren't you full of surprises?- Yeah.","Something's Gotta Give"
"893",3669819,3670888,"Yes.","Something's Gotta Give"
"894",3676034,3677706,"You're beautiful.","Something's Gotta Give"
"895",3679496,3682090,"Open your eyes so I know you hear me.","Something's Gotta Give"
"896",3684334,3685653,"Beautiful.","Something's Gotta Give"
"897",3703354,3705345,"What about birth control?","Something's Gotta Give"
"898",3705815,3707134,"Menopause.","Something's Gotta Give"
"899",3708568,3710320,"Who's the lucky boy?","Something's Gotta Give"
"900",3732676,3735509,"I think we shouldtake your blood pressure.","Something's Gotta Give"
"901",3736013,3737446,"My blood pressure?","Something's Gotta Give"
"902",3737598,3740032,"I think it's irresponsible not to.","Something's Gotta Give"
"903",3743270,3746740,"- Nobody but you would stop me.- Yeah, so you're lucky.","Something's Gotta Give"
"904",3748359,3750270,"God, I can't see.","Something's Gotta Give"
"905",3750444,3751843,"My glasses.","Something's Gotta Give"
"906",3755491,3758881,"120 over 80! Baby!","Something's Gotta Give"
"907",3766461,3767814,"Oh, my God.","Something's Gotta Give"
"908",3768171,3770480,"I do like sex.","Something's Gotta Give"
"909",3774135,3775773,"You certainly do.","Something's Gotta Give"
"910",3778265,3780256,"Oh, God.","Something's Gotta Give"
"911",3783729,3787404,"So this is what you're supposed to doon a rainy afternoon?","Something's Gotta Give"
"912",3795783,3797819,"I really thought I was...","Something's Gotta Give"
