"id","startTime","endTime","text","title"
"298",1144079,1146957,"Give him an aspirin, metoprolol,5 mg, and hang a nitro drip.","Something's Gotta Give"
"299",1147166,1148758,"- Mr. Sanborn?- Yeah.","Something's Gotta Give"
"300",1148918,1150874,"Your EKG showsyou have a blocked artery...","Something's Gotta Give"
"301",1151045,1154003,"which is not allowing enough oxygento get to the heart muscle.","Something's Gotta Give"
"302",1154215,1155967,"I'm having a heart attack?","Something's Gotta Give"
"303",1156133,1160012,"We're gonna stop it, but I need to knowwhat medications you take.","Something's Gotta Give"
"304",1160388,1162663,"I take Lipitor.","Something's Gotta Give"
"305",1162849,1164077,"Chew this.","Something's Gotta Give"
"306",1164225,1167581,"- Anything else?- And a white one for blood pressure.","Something's Gotta Give"
"307",1168855,1170573,"What about Viagra?","Something's Gotta Give"
"308",1173568,1176446,"Mr. Sanborn, did you takeany Viagra today?","Something's Gotta Give"
"309",1179533,1182093,"No Viagra.","Something's Gotta Give"
"310",1182285,1185960,"Good, I just needed to be surebecause I put nitro-glycerine into your drip.","Something's Gotta Give"
"311",1186206,1189994,"And if you had taken Viagra,the combination could be fatal.","Something's Gotta Give"
"312",1199553,1202943,"- Your dad's gonna be okay.- He's not my dad.","Something's Gotta Give"
"313",1203182,1205298,"I'm sorry. Your granddad is gonna be okay.","Something's Gotta Give"
"314",1205476,1207273,"Thank you so much.","Something's Gotta Give"
"315",1208354,1209912,"We're not related.","Something's Gotta Give"
"316",1210273,1212309,"- He's a friend.- Sorry.","Something's Gotta Give"
"317",1212942,1214500,"I'm Dr. Mercer.","Something's Gotta Give"
"318",1215111,1217341,"Mr. Sanborn did have a mild heart attack.","Something's Gotta Give"
"319",1217530,1221000,"I gave him something to dissolve the clotand it worked beautifully.","Something's Gotta Give"
"320",1221242,1222357,"He's very lucky.","Something's Gotta Give"
"321",1222494,1225850,"Another half-hour,I don't know if this would have worked.","Something's Gotta Give"
"322",1230085,1231643,"This was very intense.","Something's Gotta Give"
"323",1231795,1235105,"He's doing great.I gave him something to help him sleep.","Something's Gotta Give"
"324",1235340,1239379,"It might make him a little loopy at first,but then it should knock him out.","Something's Gotta Give"
"325",1239636,1242230,"- You're Mrs. Sanborn?- No!","Something's Gotta Give"
"326",1242640,1245677,"No, I'm Erica Barry.","Something's Gotta Give"
"327",1245893,1248851,"He was having dinner at our house.I just met him this afternoon.","Something's Gotta Give"
"328",1249063,1251054,"- You're Erica Barry.- Yes.","Something's Gotta Give"
"329",1251524,1253640,"- The playwright?- Yes.","Something's Gotta Give"
"330",1253901,1256131,"What a pleasure. I'm a huge fan.","Something's Gotta Give"
"331",1256320,1257992,"- Really?- A huge fan.","Something's Gotta Give"
"332",1258156,1259509,"Thank you.","Something's Gotta Give"
"333",1264329,1265557,"Thanks.","Something's Gotta Give"
"334",1268625,1270343,"Thank you, Doctor.","Something's Gotta Give"
"335",1271711,1275260,"- Erica. Green tea.- That's hot. Thank you.","Something's Gotta Give"
"336",1275507,1278226,"- You're welcome. May I?- Yeah, sure.","Something's Gotta Give"
"337",1279678,1281111,"This is very sweet of you.","Something's Gotta Give"
"338",1281430,1284228,"In medical schoolyou learn what can keep you up all night...","Something's Gotta Give"
"339",1284433,1285707,"without making you nuts.","Something's Gotta Give"
"340",1285851,1288763,"You know, I heardyou had a house in the Hamptons.","Something's Gotta Give"
"341",1288979,1292016,"I am a big fan. I think I've seenevery play you've ever written.","Something's Gotta Give"
"342",1292233,1294144,"I think some were writtenbefore your time.","Something's Gotta Give"
"343",1294318,1295990,"There are some Marin's never seen.","Something's Gotta Give"
"344",1296153,1299190,"I'm pretty sure I've seen them all.And I saw the last one twice.","Something's Gotta Give"
"345",1299407,1301716,"Julian, we've got a walk-in,may need stitches.","Something's Gotta Give"
"346",1301909,1303342,"Okay, thanks.","Something's Gotta Give"
"347",1303578,1304806,"I'll check on Mr. Sanborn.","Something's Gotta Give"
"348",1304954,1308867,"If he's asleep, you all get some shut-eyeand come back in the morning.","Something's Gotta Give"
"349",1309125,1311559,"Great to meet you, Erica. Ladies.","Something's Gotta Give"
"350",1319052,1320201,"Okay.","Something's Gotta Give"
"351",1320804,1324319,"Now that's the perfect guy for you.He's adorable.","Something's Gotta Give"
"352",1324725,1327717,"Mother, I have never seen a manless interested in me.","Something's Gotta Give"
"353",1327936,1329892,"Or more interested in you.","Something's Gotta Give"
"354",1330063,1331132,"Me?","Something's Gotta Give"
"355",1332149,1334947,"- He's 30 years old.- No, he's older than that.","Something's Gotta Give"
"356",1335152,1336346,"Who cares how old he is?","Something's Gotta Give"
"357",1336487,1338921,"He's not my type:He's a gorgeous, wholesome doctor.","Something's Gotta Give"
"358",1339114,1342345,"But he's perfect for youand he's hot for you. He's really perfect.","Something's Gotta Give"
"359",1342576,1345329,"Okay, stop it.He likes my work, he doesn't like me.","Something's Gotta Give"
"360",1345538,1347096,"I would never...","Something's Gotta Give"
"361",1347248,1348522,"Shut up.","Something's Gotta Give"
"362",1350918,1352954,"Oh, God. Is he all right?","Something's Gotta Give"
"363",1357509,1359181,"Harry, over here.","Something's Gotta Give"
"364",1363431,1366980,"Hi, honey. I wanna go home.Can you call Leo...","Something's Gotta Give"
"365",1367644,1370397,"- to pick me up?- No, you've got to get back into bed.","Something's Gotta Give"
"366",1370605,1372721,"Woman, you saved my life.","Something's Gotta Give"
"367",1374693,1376172,"- Get a nurse.- Nurse!","Something's Gotta Give"
"368",1376320,1378709,"I thank you from the bottom of my...","Something's Gotta Give"
"369",1381033,1384070,"Even unconscious, he's a letch! Get off!","Something's Gotta Give"
"370",1384286,1386356,"You shouldn't be standing.","Something's Gotta Give"
"371",1389291,1391361,"It's all right. Thank you.","Something's Gotta Give"
"372",1395256,1397292,"I gotta take a whiz, girls.","Something's Gotta Give"
"373",1397467,1399662,"We'll take care of that for you.","Something's Gotta Give"
"374",1399844,1401960,"Okay, I'd like to see that.","Something's Gotta Give"
"375",1407268,1409577,"Somebody better get it.","Something's Gotta Give"
"376",1413400,1415277,"What can I do you for?","Something's Gotta Give"
"377",1415443,1417399,"I'm here to pick up Harry Sanborn.","Something's Gotta Give"
"378",1417571,1420802,"Hi, I'm Dr. Mercer.Come on, I'll take you to him.","Something's Gotta Give"
"379",1421408,1423205,"And you are?","Something's Gotta Give"
"380",1423368,1425836,"I'm Leo Hoffman.I'm Harry's personal assistant.","Something's Gotta Give"
"381",1426038,1429872,"Do a little chef, little driving, littleparty planning, whatever the man needs.","Something's Gotta Give"
"382",1430125,1431763,"Sounds like a pretty interesting job.","Something's Gotta Give"
"383",1431919,1434831,"Going on six yearsand never a dull moment.","Something's Gotta Give"
"384",1436590,1439787,"Okay, Harry,looks like we're gonna have to let you go.","Something's Gotta Give"
"385",1443973,1445725,"Take it easy, kids.","Something's Gotta Give"
"386",1445975,1450093,"I just sat up a little too fast.","Something's Gotta Give"
"387",1450772,1452285,"Doc, tell them.","Something's Gotta Give"
"388",1453358,1455076,"Am I in good shape?","Something's Gotta Give"
"389",1455819,1457537,"How were my tests this morning?","Something's Gotta Give"
"390",1457696,1459607,"He's doing extremely well.","Something's Gotta Give"
"391",1459948,1462064,"- Can I hug him?- Absolutely.","Something's Gotta Give"
"392",1470542,1472339,"Let's not get goofy.","Something's Gotta Give"
"393",1473086,1474758,"We got nothing but good news here.","Something's Gotta Give"
"394",1474922,1476355,"Knock, knock.","Something's Gotta Give"
"395",1477257,1478929,"- Hi.- Hey.","Something's Gotta Give"
"396",1479718,1483028,"- I'll catch you on the way out.- Thanks a lot, Doc.","Something's Gotta Give"
"397",1490855,1493688,"So, I'm some great date?","Something's Gotta Give"
"398",1495610,1497441,"Yeah. Mr. Excitement.","Something's Gotta Give"
"399",1498488,1500206,"Tell me something.","Something's Gotta Give"
"400",1500490,1503323,"We haven't actually had sex yet, have we?","Something's Gotta Give"
"401",1504077,1507672,"No, we haven't. You're correct on that one.","Something's Gotta Give"
"402",1509374,1511251,"Something to live for.","Something's Gotta Give"
"403",1520511,1522229,"Down to the cheek.","Something's Gotta Give"
"404",1530354,1533391,"Hold on, Tarzan,we're still moving. Slowly.","Something's Gotta Give"
"405",1544452,1547569,"Harry, I'm sorry,but I can't let you travel quite yet.","Something's Gotta Give"
"406",1547789,1549905,"I ain't going back in there.","Something's Gotta Give"
"407",1550083,1553314,"I can't put you in a carand I can't leave you in the parking lot.","Something's Gotta Give"
"408",1553545,1555979,"I won't sue you,if that's what you're thinking.","Something's Gotta Give"
"409",1556173,1560724,"I'll sign whatever you like.Just let me go back to the city.","Something's Gotta Give"
"410",1562804,1564635,"Here's my best offer.","Something's Gotta Give"
"411",1566975,1570331,"I won't put you in the hospitalif you stay nearby for a few days.","Something's Gotta Give"
"412",1570562,1574077,"Get a nurse and let me keep an eyeon you until you get your strength back.","Something's Gotta Give"
"413",1574316,1575749,"Stay nearby.","Something's Gotta Give"
"414",1576777,1579894,"Doc, where do you suggest I go?","Something's Gotta Give"
"415",1591626,1595175,"Somebody please explain to mehow I ended up babysitting this guy.","Something's Gotta Give"
"416",1595421,1598015,"This is the best turkey sandwichI've ever had in my life.","Something's Gotta Give"
"417",1598216,1601094,"- You're not even listening to me.- I am. Don't get all pissy.","Something's Gotta Give"
"418",1601303,1602895,"I come out here for peace and quiet...","Something's Gotta Give"
"419",1603054,1605807,"and suddenly, I'm a characterin a Kaufman and Hart play.","Something's Gotta Give"
"420",1606016,1610726,"And the phone doesn't stop.And it's never for me.","Something's Gotta Give"
"421",1612022,1613171,"Sorry to interrupt.","Something's Gotta Give"
"422",1613315,1616273,"- No, that's fine, Leo, I'll take it.- No, that's okay.","Something's Gotta Give"
"423",1616485,1618521,"I don't mind washing them.","Something's Gotta Give"
"424",1618696,1620732,"- No.- Okay. How you doing?","Something's Gotta Give"
"425",1624076,1626715,"The man does not know my name,and I'm doing his dishes.","Something's Gotta Give"
"426",1626912,1628982,"I said I'll take it back tomorrow, okay?Great.","Something's Gotta Give"
"427",1629165,1632919,"I'll take care of it. One second.Erica, where shall I put this?","Something's Gotta Give"
"428",1633169,1634682,"Right here. I'll take it.","Something's Gotta Give"
"429",1634837,1637635,"Harry has a really bad headache.Do you have any Tylenol?","Something's Gotta Give"
"430",1637840,1639512,"Extra-strength would be fantastic.","Something's Gotta Give"
"431",1639676,1641428,"Hi! I'm Tania.","Something's Gotta Give"
"432",1641594,1643425,"- Hi.- Harry's second assistant.","Something's Gotta Give"
"433",1643638,1645594,"Dave Klein. Her assistant.","Something's Gotta Give"
"434",1646099,1647532,"Nice to meet you.","Something's Gotta Give"
"435",1647684,1649675,"Thank you. Appreciate it.","Something's Gotta Give"
"436",1652189,1653827,"""What should I do with this?""","Something's Gotta Give"
"437",1653982,1656212,"It's an empty water glass.What are the choices?","Something's Gotta Give"
"438",1656401,1659199,"Okay, I'm getting out of your hair.","Something's Gotta Give"
"439",1659446,1662358,"So you're not ready to show meany new pages?","Something's Gotta Give"
"440",1662866,1665858,"I'm not putting any pressure on you.I'm just asking.","Something's Gotta Give"
"441",1666078,1669070,"Dad! I didn't know you were here.","Something's Gotta Give"
"442",1669290,1670643,"Just on my way out, bubee.","Something's Gotta Give"
"443",1670791,1674466,"I was gonna drive back to the citywith Zoe, but I'd rather go with you.","Something's Gotta Give"
"444",1674712,1677465,"Actually, I have someone to meetbefore I go.","Something's Gotta Give"
"445",1677673,1679231,"Wait.","Something's Gotta Give"
"446",1679550,1682701,"You're leaving? Zoe is leaving?The entourage is leaving?","Something's Gotta Give"
"447",1682929,1684840,"And I'll be stuck here with him, alone?","Something's Gotta Give"
"448",1685014,1687608,"The hospital is sending over a nursein the morning.","Something's Gotta Give"
"449",1687809,1690562,"In the morning? That's 19 hours from now.","Something's Gotta Give"
"450",1691563,1695522,"Okay, I can handle this.I'll just get myself into a Zen place.","Something's Gotta Give"
"451",1696109,1698418,"Play music, cook, write. Focus.","Something's Gotta Give"
"452",1717298,1718367,"God.","Something's Gotta Give"
"453",1719383,1720736,"Thank you.","Something's Gotta Give"
"454",1734107,1737941,"Four mai tais at lunchis a bit much for anybody.","Something's Gotta Give"
"455",1740739,1741808,"Hi.","Something's Gotta Give"
"456",1743033,1746025,"Can I call you right back, doll? Thank you.","Something's Gotta Give"
"457",1751208,1753119,"- What's up?- Here's the thing.","Something's Gotta Give"
"458",1753293,1756808,"I don't want to play the part ofthe uptight nurse to your bad-boy patient.","Something's Gotta Give"
"459",1757089,1759523,"If you wanna have another heart attack,go ahead.","Something's Gotta Give"
"460",1759717,1762675,"But I have work,and no time to run to the hospital...","Something's Gotta Give"
"461",1762887,1766243,"because you're fillingyour already-clogged arteries with smoke.","Something's Gotta Give"
"462",1766474,1767702,"But more importantly...","Something's Gotta Give"
"463",1767850,1772002,"I'd rather not have my freshly paintedhouse smell like a pool hall.","Something's Gotta Give"
"464",1775108,1778896,"Have you always been like this,or do I bring it out in you?","Something's Gotta Give"
"465",1779404,1780962,"Just, you know...","Something's Gotta Give"
"466",1781322,1784598,"I don't think I've ever had this effecton a woman before.","Something's Gotta Give"
"467",1784826,1786464,"What effect?","Something's Gotta Give"
"468",1786619,1788337,"I don't quite recognize it.","Something's Gotta Give"
"469",1788496,1791294,"That's how I know I never had it before.","Something's Gotta Give"
"470",1792000,1794468,"So, you don't sleep?","Something's Gotta Give"
"471",1794669,1796705,"I only need about four hours a night.","Something's Gotta Give"
"472",1796880,1798154,"Me, too.","Something's Gotta Give"
"473",1798298,1800334,"I never slept eight hours in my life.","Something's Gotta Give"
"474",1800634,1802750,"Me, either. I wish I could.","Something's Gotta Give"
"475",1803303,1804702,"Do you want me to shut these?","Something's Gotta Give"
"476",1804847,1807122,"The sun comes in pretty strongin the morning.","Something's Gotta Give"
"477",1807308,1808457,"Sure.","Something's Gotta Give"
"478",1808601,1810637,"Who were you talking to at this hour?","Something's Gotta Give"
"479",1810811,1814087,"A friend in LA. It's only 10:00 on the Coast.","Something's Gotta Give"
"480",1814315,1816624,"And that's not past her bedtime?","Something's Gotta Give"
"481",1816901,1819973,"So you don't get more mellowas the hours pass.","Something's Gotta Give"
"482",1820238,1821830,"Good night, Harry.","Something's Gotta Give"
"483",1822240,1824515,"Can I ask you one other thing?","Something's Gotta Give"
"484",1825410,1829164,"What's with the turtlenecks?It's the middle of summer.","Something's Gotta Give"
"485",1829414,1832133,"Seriously, why do you care what I wear?","Something's Gotta Give"
"486",1832459,1833653,"Just curious.","Something's Gotta Give"
"487",1833835,1837669,"I've always liked them,and I'm just a turtleneck kind of gal.","Something's Gotta Give"
"488",1839090,1840808,"You never get hot?","Something's Gotta Give"
"489",1842344,1843413,"No.","Something's Gotta Give"
"490",1843678,1844872,"Never?","Something's Gotta Give"
"491",1845514,1846913,"Not lately.","Something's Gotta Give"
"492",1860738,1861966,"Finally.","Something's Gotta Give"
"493",1894273,1895501,"Oh, God!","Something's Gotta Give"
"494",1897401,1898754,"I'm sorry.","Something's Gotta Give"
"495",1899987,1901659,"God, am I sorry.","Something's Gotta Give"
"496",1902489,1906198,"- What are you doing?- I was just trying to find the kitchen.","Something's Gotta Give"
"497",1907119,1908268,"Back here?","Something's Gotta Give"
"498",1908412,1911927,"I got confused. It was dark, and...","Something's Gotta Give"
"499",1912959,1915189,"I didn't really see anything.","Something's Gotta Give"
"500",1918256,1920816,"Just your tits and a little...","Something's Gotta Give"
"501",1930393,1931985,"Good-bye, Mrs. Barry.","Something's Gotta Give"
"502",1932145,1935740,"Good-bye? You're leaving?No, that's not good.","Something's Gotta Give"
"503",1935982,1938735,"- I've been fired.- No, you just started.","Something's Gotta Give"
"504",1939820,1942288,"Not fired, darling. Just not needed.","Something's Gotta Give"
"505",1942489,1944878,"Not needed? What are you talking about?","Something's Gotta Give"
"506",1945075,1947031,"Of course she's needed. We need her.","Something's Gotta Give"
"507",1947202,1951434,"No. I'm actually feeling pretty perky today.Making quite a comeback.","Something's Gotta Give"
"508",1951916,1955306,"Sorry for your trouble, Mrs. Gimble.Take care, dear.","Something's Gotta Give"
"509",1956045,1957922,"You've been wonderful.","Something's Gotta Give"
"510",1959715,1962149,"Listen, about last night...","Something's Gotta Give"
"511",1962343,1964652,"How about we nevertalk about that, okay?","Something's Gotta Give"
"512",1964846,1967838,"Anyway, I was at the drugstore.Your prescriptions were ready.","Something's Gotta Give"
"513",1968057,1970571,"They said to take these two with food,this one without.","Something's Gotta Give"
"514",1970768,1971837,"You were in silhouette.","Something's Gotta Give"
"515",1971978,1974128,"I think that's talking about it.","Something's Gotta Give"
"516",1974314,1975872,"I really didn't see all that much.","Something's Gotta Give"
"517",1976024,1977377,"There you go.","Something's Gotta Give"
"518",1977525,1980676,"- Okay, I won't mention it again, but...- Going to work.","Something's Gotta Give"
"519",1981363,1982637,"You saw my ass...","Something's Gotta Give"
"520",1982781,1986137,"you don't see me acting nutsand wearing glasses and hats...","Something's Gotta Give"
"521",1986368,1988086,"and weird outfits!","Something's Gotta Give"
"522",1990664,1993019,"Yes or no? What's the deal?","Something's Gotta Give"
"523",1994168,1996557,"- Can I go?- You still getting dizzy?","Something's Gotta Give"
"524",1996795,1998990,"- Not as much.- Out of breath?","Something's Gotta Give"
"525",1999548,2001106,"Only sometimes.","Something's Gotta Give"
"526",2001967,2004606,"- Good. How's Erica treating you?- Who?","Something's Gotta Give"
"527",2005888,2007082,"Erica.","Something's Gotta Give"
"528",2009517,2010632,"Her.","Something's Gotta Give"
"529",2011018,2013373,"She is a major piece of work.","Something's Gotta Give"
"530",2013771,2017605,"Doc, the woman wears turtlenecksin the middle of the summer.","Something's Gotta Give"
"531",2017859,2022011,"She's beyond uptight.Almost makes her fun to be around.","Something's Gotta Give"
"532",2022822,2026098,"Uptight? That's funny,I haven't noticed that.","Something's Gotta Give"
"533",2026618,2028415,"Try living with her.","Something's Gotta Give"
"534",2029204,2031764,"I actually saw her naked last night.","Something's Gotta Give"
"535",2032958,2036268,"- That doesn't sound so uptight.- It was an accident.","Something's Gotta Give"
"536",2036503,2040018,"She thought I was asleep,I thought her room was the kitchen.","Something's Gotta Give"
"537",2040257,2043408,"You know what Freud said.There are no accidents.","Something's Gotta Give"
"538",2044720,2047678,"Trust me, this was an accident.","Something's Gotta Give"
"539",2048808,2051197,"Although, why would shebe walking around naked...","Something's Gotta Give"
"540",2051394,2053510,"when she knows I'm 20 feet away?","Something's Gotta Give"
"541",2053688,2056441,"Why would you thinkher bedroom was the kitchen?","Something's Gotta Give"
"542",2056649,2059288,"It was dark. It was 2:00 in the morning.","Something's Gotta Give"
"543",2059485,2061919,"That could explainwhy she was walking around naked.","Something's Gotta Give"
"544",2062113,2063307,"Deep breath.","Something's Gotta Give"
"545",2063448,2066997,"You know, I've never seena woman that age naked before.","Something's Gotta Give"
"546",2067827,2069055,"You're kidding.","Something's Gotta Give"
"547",2070121,2072316,"We're not all doctors, baby.","Something's Gotta Give"
"548",2074042,2078160,"I think she's very beautiful.And she's a fantastic writer, you know.","Something's Gotta Give"
"549",2079131,2081122,"No, I don't know.","Something's Gotta Give"
"550",2081883,2083635,"She's pretty major.","Something's Gotta Give"
"551",2084595,2086631,"So you date her daughter?","Something's Gotta Give"
"552",2087014,2089084,"Okay, now she's a great chick.","Something's Gotta Give"
"553",2089933,2092049,"Must take after her father.","Something's Gotta Give"
"554",2092811,2094483,"Which reminds me...","Something's Gotta Give"
"555",2096899,2099129,"what about Mr. Midnight here?","Something's Gotta Give"
"556",2102196,2104471,"When can I be up and runningin that department?","Something's Gotta Give"
"557",2104657,2108093,"I think Mr. Midnight needs to stay putfor another couple of weeks.","Something's Gotta Give"
"558",2108327,2110716,"But it won't kill me when I do it, right?","Something's Gotta Give"
"559",2110913,2113302,"No, it's exercise. It'll be good for you.","Something's Gotta Give"
"560",2113833,2115869,"After a heart attack, rule of thumb is:","Something's Gotta Give"
"561",2116044,2119957,"If you can climb a flight of stairs,you can have sex.","Something's Gotta Give"
"562",2140861,2144376,"So you're saying he can't travel at all?Not even by plane?","Something's Gotta Give"
"563",2145574,2147610,"- Train?- I don't think so.","Something's Gotta Give"
"564",2148744,2150063,"Been tough?","Something's Gotta Give"
"565",2150204,2153799,"He fired his nurse after an hour.Now he says he doesn't even need one.","Something's Gotta Give"
"566",2154041,2155759,"He's a bit of a workout.","Something's Gotta Give"
"567",2155918,2157146,"How are you holding up?","Something's Gotta Give"
"568",2157295,2158694,"- Me?- You.","Something's Gotta Give"
"569",2161591,2163149,"I'm fine. Fine.","Something's Gotta Give"
"570",2163384,2166182,"One more ""fine"" and I won't believe you.","Something's Gotta Give"
"571",2168473,2170270,"Wait, where's my...","Something's Gotta Give"
"572",2170517,2171711,"There.","Something's Gotta Give"
"573",2172352,2174468,"- Thank you.- You're welcome.","Something's Gotta Give"
"574",2175605,2176799,"Hello?","Something's Gotta Give"
"575",2179693,2183288,"Hi. No, I'm sorry,I haven't been able to get back.","Something's Gotta Give"
"576",2187409,2189320,"Part of the play takes place in Paris...","Something's Gotta Give"
"577",2189495,2192328,"so I keep listening to French music,hoping to get inspired.","Something's Gotta Give"
"578",2192540,2194053,"No, it's not helping at all.","Something's Gotta Give"
"579",2196544,2197943,"I'm trying.","Something's Gotta Give"
"580",2199213,2202091,"It's not exactlyflowing out of me yet, but...","Something's Gotta Give"
"581",2205970,2207881,"Pick you up around 7:00?","Something's Gotta Give"
"582",2214354,2216310,"What about the patient?","Something's Gotta Give"
"583",2216565,2219238,"Like he said, he doesn't need a nurse.","Something's Gotta Give"
"584",2239463,2242102,"I'm walking around the house!","Something's Gotta Give"
"585",2245720,2247119,"Oh, no.","Something's Gotta Give"
"586",2251351,2253023,"- Hi.- Listen.","Something's Gotta Give"
"587",2254270,2257387,"I've decided to get overthat whole ""you saw me naked"" thing.","Something's Gotta Give"
"588",2257607,2259962,"- So let's not deal with it anymore, okay?- Good.","Something's Gotta Give"
"589",2260235,2263147,"Because I have been hiding from youall day.","Something's Gotta Give"
"590",2264197,2265994,"Do you wanna come in?","Something's Gotta Give"
"591",2266199,2268952,"I don't wanna break your rhythmor anything like that.","Something's Gotta Give"
"592",2269161,2271470,"That would be wishful thinking.","Something's Gotta Give"
"593",2272414,2273927,"Nice painting.","Something's Gotta Give"
"594",2274291,2277488,"I'm gonna venture out thereand go for a short walk.","Something's Gotta Give"
"595",2277711,2280430,"- You up to that?- My doctor recommended it.","Something's Gotta Give"
"596",2280631,2284988,"I got to build up to climbing stairsand stuff like that.","Something's Gotta Give"
"597",2286387,2288298,"You wouldn't wanna join me?","Something's Gotta Give"
"598",2288597,2289916,"That means you don't want me to?","Something's Gotta Give"
"599",2290057,2293288,"No. I was asking if you wanted to.","Something's Gotta Give"
"600",2294979,2299052,"Yeah, I would. But I don't like to breakonce I start writing, so I shouldn't.","Something's Gotta Give"
"601",2299317,2301512,"I mean, not that a little fresh airwould hurt.","Something's Gotta Give"
