"id","startTime","endTime","text","title"
"983",4405349,4408079,"Looks like I crashed another one.I'm sorry.","Space Cowboys"
"984",4408752,4411220,"They want to take Jerryand Tank and me.","Space Cowboys"
"985",4411422,4415916,"That's great. You played themfellas just right. That's good.","Space Cowboys"
"986",4416126,4419926,"-You said yes, didn't you?-I didn't say anything.","Space Cowboys"
"987",4420130,4423531,"You don't want to blow it again.This is your last shot.","Space Cowboys"
"988",4424101,4425295,"This isn't easy.","Space Cowboys"
"989",4425502,4428528,"Easy, hell.Don't whine to me about easy.","Space Cowboys"
"990",4428739,4430331,"Put yourself in my shoes.","Space Cowboys"
"991",4430541,4433135,"You've been blaming me for 40 years.","Space Cowboys"
"992",4433344,4436939,"You're not laying this on me.You choke this one, it's on you.","Space Cowboys"
"993",4437147,4439513,"-All on you.-What would you do?","Space Cowboys"
"994",4439717,4441708,"I'd leave your ass on the ground.","Space Cowboys"
"995",4441919,4443250,"I'll bet you would.","Space Cowboys"
"996",4443454,4445513,"To go into space? You bet your ass.","Space Cowboys"
"997",4448192,4449625,"In a heartbeat.","Space Cowboys"
"998",4453130,4455189,"Know what the worst dayin my life was?","Space Cowboys"
"999",4457468,4461131,"The day you put the idea in my headI could pilot a ship in space.","Space Cowboys"
"1000",4471482,4475782,"I don't care what happens.If this gets out to the press--","Space Cowboys"
"1001",4475986,4478113,"It's not about the press right now.","Space Cowboys"
"1002",4478322,4480290,"But whether Roger or Ethan--","Space Cowboys"
"1003",4480591,4483321,"I'm not going up. Not without Hawk.","Space Cowboys"
"1004",4484228,4486753,"-You're gonna blackmail me again?-No, no.","Space Cowboys"
"1005",4487231,4491099,"I'll teach Ethan what he needsto know. I don't go if Hawk doesn't.","Space Cowboys"
"1006",4495039,4497064,"-Any ideas, Miss Holland?-Yes.","Space Cowboys"
"1007",4497307,4500367,"Even with the cancer,he still passed his physical...","Space Cowboys"
"1008",4500577,4505105,"...so there's no reason he can't flythe mission. Especially with backup.","Space Cowboys"
"1009",4505315,4507783,"You and Frank will put mein the loony bin.","Space Cowboys"
"1010",4515125,4518856,"Colonel Corvin? Miss Holland wouldlike you to wait here, sir.","Space Cowboys"
"1011",4523534,4526367,"Team Daedalus, all of Team Daedalus...","Space Cowboys"
"1012",4526570,4528834,"...has a launch in 92 hours.","Space Cowboys"
"1013",4529606,4533201,"So let's get rested and prepped.","Space Cowboys"
"1014",4533710,4535940,"Okay. Yes.","Space Cowboys"
"1015",4536246,4537440,"What's this?","Space Cowboys"
"1016",4537714,4539011,"Have a look.","Space Cowboys"
"1017",4540250,4545187,"UTMC-coated, 1.66, super high indexlenses on a Flexon alloy frame.","Space Cowboys"
"1018",4545456,4548391,"-Your prescription.-My prescription?","Space Cowboys"
"1019",4550494,4552553,"Holy cow.","Space Cowboys"
"1020",4552963,4554055,"Holy cow.","Space Cowboys"
"1021",4554298,4555959,"I had them made for you.","Space Cowboys"
"1022",4556400,4559927,"-You owe me dinner now.-You'd go out with Spider-Man?","Space Cowboys"
"1023",4560137,4563504,"-If he'll buy me oysters.-I'll buy you pearls.","Space Cowboys"
"1024",4563740,4565571,"I feel like dancing.","Space Cowboys"
"1025",4599610,4601407,"Bring that man back alive!","Space Cowboys"
"1026",4601845,4604245,"No, that's against my betterjudgment, Barb.","Space Cowboys"
"1027",4607584,4609108,"I won't let him die.","Space Cowboys"
"1028",4629406,4632773,"General Corvin, General Hawkins,welcome to Daedalus.","Space Cowboys"
"1029",4632976,4636537,"-We're not generals, son.-Just saying it like it ought to be.","Space Cowboys"
"1030",4656934,4658367,"You're good to go, men.","Space Cowboys"
"1031",4658569,4661003,"See you back on the ground,Team Daedalus.","Space Cowboys"
"1032",4661939,4663406,"Good luck.","Space Cowboys"
"1033",4667978,4670572,"Well, we've only waited 40 years.","Space Cowboys"
"1034",4671915,4674850,"What do you say, Reverend Tank?Is a prayer in order?","Space Cowboys"
"1035",4675752,4678653,"I was just recitingthe Shepard's prayer.","Space Cowboys"
"1036",4678855,4680584,"Alan Shepard's prayer.","Space Cowboys"
"1037",4681425,4685088,"""Oh, Lord, please don't let usscrew up.""","Space Cowboys"
"1038",4685329,4687354,"-Amen.-Amen.","Space Cowboys"
"1039",4687564,4688997,"-Amen.-Amen.","Space Cowboys"
"1040",4690000,4691968,"Amen, Reverend.","Space Cowboys"
"1041",4703280,4704508,"Let's have a comm check.","Space Cowboys"
"1042",4704848,4706941,"-PLT.-MS One.","Space Cowboys"
"1043",4707150,4708674,"-MS Two.-MS Three.","Space Cowboys"
"1044",4708885,4709874,"MS Four.","Space Cowboys"
"1045",4710287,4713984,"Fido, go. Guidance, go.","Space Cowboys"
"1046",4714858,4716189,"EECOM, go.","Space Cowboys"
"1047",4717127,4718788,"INCO, go.","Space Cowboys"
"1048",4732743,4734506,"T-minus 15 seconds.","Space Cowboys"
"1049",4738682,4742448,"T-minus ten, nine, eight, seven.","Space Cowboys"
"1050",4742653,4744621,"We have a go for main engine start.","Space Cowboys"
"1051",4747424,4751087,"Three, two, one. Ignition.","Space Cowboys"
"1052",4764908,4768674,"Liftoff of space shuttle Daedalusand STS-200.","Space Cowboys"
"1053",4792269,4793759,"How's it going?","Space Cowboys"
"1054",4794371,4796931,"Space will never be the same.","Space Cowboys"
"1055",4800277,4803269,"Houston, this is Daedalus.","Space Cowboys"
"1056",4803547,4805105,"Roll program.","Space Cowboys"
"1057",4805382,4807213,"Roger roll, Daedalus.","Space Cowboys"
"1058",4811788,4813756,"Thank you, God.","Space Cowboys"
"1059",4817461,4819588,"Stand by for throttles up.","Space Cowboys"
"1060",4819796,4822390,"Daedalus, you are goat throttles up.","Space Cowboys"
"1061",4822699,4825133,"Roger, Houston. Go with throttles up.","Space Cowboys"
"1062",4831375,4833809,"Stand by for separation of SRBs.","Space Cowboys"
"1063",4834644,4836839,"Stand by for SRB sep.","Space Cowboys"
"1064",4855465,4857524,"Coming up to negative return.","Space Cowboys"
"1065",4861338,4862896,"Negative return.","Space Cowboys"
"1066",4864641,4867872,"Roger, Daedalus.You are negative return.","Space Cowboys"
"1067",4868879,4870369,"We're just a dot.","Space Cowboys"
"1068",4875285,4877014,"Two engines tal.","Space Cowboys"
"1069",4879523,4881616,"Press to ATO.","Space Cowboys"
"1070",4883193,4885855,"Houston, do we have a gofor orbit ops?","Space Cowboys"
"1071",4886062,4889190,"Roger, Daedalus.You are go for orbit ops.","Space Cowboys"
"1072",4889766,4891256,"Good work, guys.","Space Cowboys"
"1073",4894371,4898000,"Four hours to intercept.We're right on schedule.","Space Cowboys"
"1074",4898208,4900699,"That's not what I'm worried about.","Space Cowboys"
"1075",4901044,4902568,"Relax.","Space Cowboys"
"1076",4903013,4905038,"Our man is up there with them.","Space Cowboys"
"1077",4950760,4951886,"It was worth the wait.","Space Cowboys"
"1078",4952295,4953694,"-Yeah, it was.-Thank you, Frank.","Space Cowboys"
"1079",4954498,4956159,"I owe you one.","Space Cowboys"
"1080",4958168,4960227,"Not a bad takeoff...","Space Cowboys"
"1081",4961638,4963299,"...for some rookies.","Space Cowboys"
"1082",4964541,4967339,"You guys are over, over the edge.You're in space.","Space Cowboys"
"1083",4967544,4970604,"-Welcome to the club.-Thank you, Roger.","Space Cowboys"
"1084",4976419,4981356,"Okay, Daedalus has got Ikonon the scopes.","Space Cowboys"
"1085",4982192,4984854,"We should have a visual heremomentarily.","Space Cowboys"
"1086",4986162,4988027,"Range, 5000 meters.","Space Cowboys"
"1087",4988298,4990892,"Roger, Hawk, we have a visual here.","Space Cowboys"
"1088",4995939,4998169,"Stand by for a 15-second burn.","Space Cowboys"
"1089",5004414,5006746,"All right, get readyto deploy the arm.","Space Cowboys"
"1090",5011421,5013218,"Deploying the arm.","Space Cowboys"
"1091",5019863,5022331,"2200 feet.","Space Cowboys"
"1092",5022966,5025366,"Dead center.Good driving up there, Hawk.","Space Cowboys"
"1093",5025869,5027336,"Let's light them up.","Space Cowboys"
"1094",5027671,5032131,"Stand by. T.I. burn in four,three, two, one.","Space Cowboys"
"1095",5039316,5042308,"Hello, Ikon. How we feeling today?","Space Cowboys"
"1096",5042919,5045217,"Activating floods.","Space Cowboys"
"1097",5072949,5075440,"Boy. Will you get a load of this?","Space Cowboys"
"1098",5083727,5085388,"Activating radar.","Space Cowboys"
"1099",5125869,5128599,"-He's trying to get a tone on us.-What are you saying?","Space Cowboys"
"1100",5128805,5131706,"Shut the radar down.It's painting a target on us.","Space Cowboys"
"1101",5131908,5133273,"Radar off.","Space Cowboys"
"1102",5147123,5148556,"We're okay.","Space Cowboys"
"1103",5148958,5153895,"No wonder the damn thing's orbit isdecaying. It's got to weigh 50 ton.","Space Cowboys"
"1104",5155098,5157658,"Houston, this is Daedalus.You see what we see?","Space Cowboys"
"1105",5157867,5159767,"Roger, Daedalus. We are...","Space Cowboys"
"1106",5159969,5162267,"...studying it from here.","Space Cowboys"
"1107",5162972,5164769,"Stand by for a decision.","Space Cowboys"
"1108",5168478,5171811,"It's got to have some kind ofself-defense mechanism.","Space Cowboys"
"1109",5172015,5174711,"Our radar must've activated it.","Space Cowboys"
"1110",5176953,5178113,"Can you grab it?","Space Cowboys"
"1111",5179122,5181647,"I can get it if Hawkcan get us in there.","Space Cowboys"
"1112",5183126,5184957,"I'm just worried about the mass.","Space Cowboys"
"1113",5185161,5187823,"I'm worried about this thinggetting pissed again.","Space Cowboys"
"1114",5195205,5197969,"Does that look like a communicationssatellite to you?","Space Cowboys"
"1115",5198174,5201632,"General, what sort of modificationshave your people made here?","Space Cowboys"
"1116",5204247,5207478,"That grappling arm can'thandle that much stress.","Space Cowboys"
"1117",5207984,5211112,"It's within operational limits.Frank can latch on.","Space Cowboys"
"1118",5211321,5212845,"I don't know about this.","Space Cowboys"
"1119",5213056,5216617,"Our mission is to restore thissatellite. Let's get on with it.","Space Cowboys"
"1120",5216826,5219659,"I won't let this crew get killed,you included.","Space Cowboys"
"1121",5225502,5228130,"Houston, Daedalus.We're still standing by.","Space Cowboys"
"1122",5230673,5233642,"-Give them a go to capture.-Daedalus, this is Houston.","Space Cowboys"
"1123",5233843,5236038,"You have a go for capture.","Space Cowboys"
"1124",5236246,5238407,"-Here we go, gentlemen.-Roger, Houston.","Space Cowboys"
"1125",5239349,5242876,"We have a go for capture.Pull it in, see what she looks like.","Space Cowboys"
"1126",5243086,5245213,"Give me a minute to get it stable.","Space Cowboys"
"1127",5276486,5278044,"Okay, how does that look?","Space Cowboys"
"1128",5278755,5280382,"That's close enough for me.","Space Cowboys"
"1129",5280590,5283354,"-Is he as good as you say he is?-Tank?","Space Cowboys"
"1130",5283560,5284993,"He's the man.","Space Cowboys"
"1131",5288298,5291028,"All right. You can go for it.","Space Cowboys"
"1132",5293970,5295904,"You're drifting left too far.","Space Cowboys"
"1133",5299943,5304039,"Hail Mary, full of grace.","Space Cowboys"
"1134",5306416,5310045,"Holy shit!I got it!","Space Cowboys"
"1135",5313857,5314846,"You the man, Tank.","Space Cowboys"
"1136",5315091,5317582,"Houston, Daedalus. We've got Ikon.","Space Cowboys"
"1137",5318862,5320454,"Good work, fellas.","Space Cowboys"
"1138",5332375,5334366,"You boys look mighty sharp.","Space Cowboys"
"1139",5433242,5437508,"Welcome to space, Frank.You've waited a while for this.","Space Cowboys"
"1140",5438381,5441578,"Yeah. Only 40 years.","Space Cowboys"
"1141",5455999,5459867,"All right, cowboys. Let's roundthem up. We got work to do.","Space Cowboys"
"1142",5510119,5512087,"A little light on the subject.","Space Cowboys"
"1143",5512855,5514789,"We'll take a look at its brains.","Space Cowboys"
"1144",5518928,5520589,"I don't think that's the panel.","Space Cowboys"
"1145",5521631,5522791,"You don't, do you?","Space Cowboys"
"1146",5557800,5560064,"Holy cow, Frank.","Space Cowboys"
"1147",5560369,5563532,"This is some piece of junk.","Space Cowboys"
"1148",5586295,5589355,"This isn't a sightseeing trip, Frank.","Space Cowboys"
"1149",5603679,5606147,"-Abort activity.-Frank, listen to me.","Space Cowboys"
"1150",5606349,5609182,"I said, abort activity. Now.","Space Cowboys"
"1151",5619462,5621396,"What's going on, Frank?","Space Cowboys"
"1152",5631440,5634466,"Ethan, what the hell's going on?What is this damn thing?","Space Cowboys"
"1153",5634677,5637145,"A Russian communications satellite,colonel.","Space Cowboys"
"1154",5637346,5641373,"Bullshit! You don't think I know anuclear launch platform when I see it?","Space Cowboys"
"1155",5641584,5645076,"Why are we helping the Russiansput a missile silo back into orbit?","Space Cowboys"
"1156",5645454,5647615,"You're a genius. You figure it out.","Space Cowboys"
"1157",5649859,5652327,"You're only hereas a publicity stunt!","Space Cowboys"
"1158",5652628,5655153,"You got what you wanted!You're in space!","Space Cowboys"
"1159",5655364,5657389,"Now finish the damn mission!","Space Cowboys"
"1160",5662605,5663970,"Go ahead, Frank.","Space Cowboys"
"1161",5664173,5666368,"You're on a secure line now.","Space Cowboys"
"1162",5666742,5670576,"You were right to be concernedabout this thing coming out of orbit.","Space Cowboys"
"1163",5670780,5674147,"It happens to have six armednuclear warheads on board.","Space Cowboys"
"1164",5677453,5678818,"What's he talking about?","Space Cowboys"
"1165",5679021,5680648,"I have no idea.","Space Cowboys"
"1166",5680856,5683347,"General, is there somethingyou want to tell us?","Space Cowboys"
"1167",5684860,5686225,"Yes.","Space Cowboys"
"1168",5687496,5690727,"Ikon is a relic from the Cold War.","Space Cowboys"
"1169",5691300,5695760,"It has floated dead in spaceever since the Soviet Union fell.","Space Cowboys"
"1170",5696505,5698905,"There are six missiles on board...","Space Cowboys"
"1171",5699108,5702669,"...targeted at strategicAmerican installations.","Space Cowboys"
"1172",5702912,5705312,"All, most regrettably...","Space Cowboys"
"1173",5705514,5707141,"...in large metropolitan areas.","Space Cowboys"
"1174",5707984,5709611,"If Ikon goes offline...","Space Cowboys"
"1175",5709952,5711510,"...it will assume that...","Space Cowboys"
"1176",5711988,5716322,"...there has been a catastropheand will initiate launch on its own.","Space Cowboys"
"1177",5716559,5719653,"You picked a hell of a timefor a confession, general.","Space Cowboys"
"1178",5719862,5721796,"Those are our boys up there.","Space Cowboys"
"1179",5721998,5725866,"And that is a treaty violation.A goddamn big one.","Space Cowboys"
"1180",5726068,5727763,"You bastard.","Space Cowboys"
"1181",5727970,5732066,"Bob, you don't know how touched I amthat you're worried about our safety.","Space Cowboys"
"1182",5732441,5735171,"Why don't you ask your friendthe general...","Space Cowboys"
"1183",5735378,5739337,"...how my guidance system fromSkylab got aboard this six-gun?","Space Cowboys"
"1184",5741517,5744077,"It was stolen by the KGB...","Space Cowboys"
"1185",5744287,5747586,"...from Mr. Gerson's personal files.","Space Cowboys"
"1186",5751961,5754122,"This is all news to me.","Space Cowboys"
"1187",5754830,5759358,"You'd have us put it back into orbitfully armed and keep it a secret...","Space Cowboys"
"1188",5759568,5761331,"...just to save your ass?","Space Cowboys"
"1189",5763939,5766737,"People, we have a real problem here.","Space Cowboys"
"1190",5771847,5773007,"All right, huddle up.","Space Cowboys"
"1191",5773316,5774908,"We got a big-ass problem.","Space Cowboys"
"1192",5775117,5779417,"We're latched on to a 100-megatonbomb traveling 17,000 miles an hour.","Space Cowboys"
"1193",5782058,5786017,"What about that shit heap? You thinkwe can get it out into deep space?","Space Cowboys"
"1194",5786228,5789629,"Four payload assist rockets? Just.","Space Cowboys"
"1195",5789865,5793096,"Maybe. I don't know.Let me crunch some numbers.","Space Cowboys"
"1196",5799075,5800508,"Just okay, Frank.","Space Cowboys"
"1197",5803346,5805371,"Somebody's outside the ship.","Space Cowboys"
"1198",5805581,5809813,"Daedalus, you have an unscheduledEVA you want to tell me about?","Space Cowboys"
"1199",5810386,5811216,"What?","Space Cowboys"
"1200",5820563,5822929,"He's jammed the air lock door, Frank.","Space Cowboys"
"1201",5823299,5825324,"Remove the panel and override it.","Space Cowboys"
"1202",5830473,5831997,"Turn on the lights.","Space Cowboys"
"1203",5835277,5837404,"Ethan, what are you doing out there?","Space Cowboys"
"1204",5841450,5842974,"Ethan, what are you doing?","Space Cowboys"
"1205",5843285,5844912,"Your job, Frank.","Space Cowboys"
"1206",5845821,5848016,"Putting Ikon back into geosync orbit.","Space Cowboys"
"1207",5851527,5854860,"You don't know what you're doing.Come back. That's an order.","Space Cowboys"
"1208",5855398,5857730,"You don't know the sequencing.","Space Cowboys"
"1209",5860603,5863595,"Get suited up. When the door's fixed,get out there.","Space Cowboys"
"1210",5863806,5865034,"All right.","Space Cowboys"
"1211",5874984,5878886,"Ethan, do not connect those PAMrockets. Do you understand?","Space Cowboys"
"1212",5881157,5882055,"How long?","Space Cowboys"
"1213",5882258,5883282,"I nearly got it.","Space Cowboys"
"1214",5887830,5890390,"Don't lock onto those PAM rockets.You hear me?","Space Cowboys"
"1215",5899708,5900606,"Got it.","Space Cowboys"
"1216",5930539,5931733,"It's arming itself.","Space Cowboys"
"1217",5950993,5952187,"Oh, God!","Space Cowboys"
"1218",5966775,5968106,"Oh, Lord.","Space Cowboys"
"1219",5984293,5985317,"-Hawk.-I'm on it.","Space Cowboys"
"1220",6034677,6036668,"Shit, we got a fire in here.","Space Cowboys"
"1221",6041016,6042608,"We lost Ikon and Ethan.","Space Cowboys"
"1222",6049191,6051955,"Roger's hurt, mid-deck.He's bleeding badly.","Space Cowboys"
"1223",6052528,6054621,"See what you can do for him.","Space Cowboys"
"1224",6054830,6058357,"Tank, contain the situation.Kill the 02 switch.","Space Cowboys"
"1225",6058567,6059397,"Killing it.","Space Cowboys"
"1226",6059602,6061536,"Hawk and I are going out.","Space Cowboys"
"1227",6061737,6062999,"I got it.","Space Cowboys"
"1228",6069144,6071135,"Status GBC.","Space Cowboys"
"1229",6071714,6072874,"Check.","Space Cowboys"
"1230",6073115,6074912,"They've got the fire contained.","Space Cowboys"
"1231",6075117,6078177,"Range, 100 feet. It's accelerating,Miss Holland.","Space Cowboys"
"1232",6078387,6080184,"They're gonna lose it.","Space Cowboys"
"1233",6080623,6082181,"I assume you got a plan.","Space Cowboys"
"1234",6082391,6087192,"I think I can reconfigure the flightcontrol system for stabilization burn.","Space Cowboys"
"1235",6087396,6090661,"The only trouble is, I gotta do thatat exactly the right time.","Space Cowboys"
"1236",6091066,6092533,"That's where you come in.","Space Cowboys"
"1237",6092735,6094862,"You gotta be my eyeswhile I'm in there.","Space Cowboys"
"1238",6095070,6098733,"Cue me when the satellite comes aroundand lines up with the shuttle.","Space Cowboys"
"1239",6098941,6101535,"But what about the rate of descent?","Space Cowboys"
"1240",6101744,6106181,"I'll fire a short burst from the PAM,and that'll counter-thrust.","Space Cowboys"
"1241",6106382,6109112,"Just enable the PAM rocketto accept my command.","Space Cowboys"
"1242",6109318,6111809,"Hell, I thought thiswas gonna be hard.","Space Cowboys"
"1243",6112021,6113750,"Jerry, to make all this work...","Space Cowboys"
"1244",6113956,6116447,"...give me range and rateof opening readings.","Space Cowboys"
"1245",6116859,6119350,"Frank, you have one shot, maybe.","Space Cowboys"
"1246",6119561,6121756,"You miss, you'll never make it back.","Space Cowboys"
"1247",6122097,6125498,"If those bombs hit the atmosphere,it might not matter anyway.","Space Cowboys"
"1248",6125701,6128727,"Come on, let's suit upand get out of here.","Space Cowboys"
"1249",6135544,6138069,"That's the craziest thingI've ever heard.","Space Cowboys"
"1250",6185194,6186627,"2200 feet.","Space Cowboys"
"1251",6200209,6203838,"Holy cow. This is a bad idea.","Space Cowboys"
"1252",6206348,6209442,"Frank, by my calculations,you got 15 seconds...","Space Cowboys"
"1253",6209651,6211516,"...to ignite that PAM.","Space Cowboys"
"1254",6215858,6218986,"-Speak to me, Hawk.-We're almost there, Frank.","Space Cowboys"
"1255",6221964,6222794,"Five.","Space Cowboys"
"1256",6222998,6224898,"-On a count of one.-Four.","Space Cowboys"
"1257",6225334,6226733,"-One.-Three.","Space Cowboys"
"1258",6227069,6229299,"Two, one.","Space Cowboys"
"1259",6266375,6268570,"On my mark, Frank, shut her down.","Space Cowboys"
"1260",6277519,6279282,"Five, four...","Space Cowboys"
"1261",6279955,6280785,"...three...","Space Cowboys"
"1262",6280989,6282047,"Come on, Frank.","Space Cowboys"
"1263",6282257,6284122,"...two, one...","Space Cowboys"
"1264",6284326,6285293,"...mark.","Space Cowboys"
"1265",6296338,6298101,"That's it, Frank. It's static.","Space Cowboys"
"1266",6302578,6305411,"Houston, this is Daedalus.We've arrested the fall.","Space Cowboys"
"1267",6305614,6306945,"Attaboy, Frank!","Space Cowboys"
"1268",6307149,6308878,"Oh, thank God.","Space Cowboys"
"1269",6313789,6315416,"Son of a bitch.","Space Cowboys"
"1270",6325267,6326097,"He's out.","Space Cowboys"
"1271",6330706,6334836,"I'll hook up the extra Payload AssistModules. You take Jonny Quest back.","Space Cowboys"
"1272",6339081,6342175,"We've got a problem.We've only got one rocket left.","Space Cowboys"
"1273",6343151,6346518,"One PAM's got no chance of gettingthat thing into orbit, Frank.","Space Cowboys"
"1274",6352494,6354189,"You got another problem.","Space Cowboys"
"1275",6355530,6358590,"Oh, no. Even if we getthis thing going...","Space Cowboys"
"1276",6358800,6362497,"...it's not gonna have enough powerwith two broken panels.","Space Cowboys"
"1277",6363038,6364938,"Take the kid back, I'll handle this.","Space Cowboys"
"1278",6365340,6368776,"How will you handle it, professor?You're a pilot, remember?","Space Cowboys"
"1279",6369177,6372305,"I'll need all the extra O2 modulesyou've got.","Space Cowboys"
"1280",6373682,6375479,"What are you talking about?","Space Cowboys"
"1281",6378820,6380151,"No.","Space Cowboys"
"1282",6381623,6384888,"I love you, but why do youhave to be such a killjoy?","Space Cowboys"
"1283",6385093,6387357,"Besides, you ever see a prettier moon?","Space Cowboys"
"1284",6392968,6394697,"What's he talking about, Frank?","Space Cowboys"
"1285",6399574,6402042,"You'd never makea quarter of a million miles.","Space Cowboys"
"1286",6402244,6403643,"Oh, hell, yes, I will.","Space Cowboys"
"1287",6403845,6407110,"I just gotta go halfway.The moon's gravity will do the rest.","Space Cowboys"
"1288",6407316,6410080,"I'll fire them into outer spaceand let them...","Space Cowboys"
"1289",6413989,6415616,"...self-destruct.","Space Cowboys"
"1290",6419027,6423964,"That's not a solution, Frank. One PAMrocket's not nearly enough thrust.","Space Cowboys"
"1291",6424166,6427761,"Let's everybody slow down.There's got to be another way.","Space Cowboys"
"1292",6428170,6429501,"There isn't.","Space Cowboys"
"1293",6430305,6431431,"No.","Space Cowboys"
"1294",6434142,6435370,"No.","Space Cowboys"
"1295",6435877,6439335,"Gotta be a winner in every race.Looks like it's me this time.","Space Cowboys"
"1296",6441383,6443283,"As usual, huh?","Space Cowboys"
"1297",6444353,6445752,"Oh, shit.","Space Cowboys"
"1298",6508483,6510781,"-He can't do that.-What's the status here?","Space Cowboys"
"1299",6510986,6512783,"What's the status here?","Space Cowboys"
"1300",6513088,6516546,"One orbital engine gone,primary and secondary guidance system.","Space Cowboys"
"1301",6516758,6519158,"Hydraulics are questionable.","Space Cowboys"
"1302",6519494,6520518,"Roger?","Space Cowboys"
"1303",6521797,6523355,"He has a concussion.","Space Cowboys"
"1304",6524766,6526393,"Oh, God.","Space Cowboys"
"1305",6532874,6536105,"With no Roger and no Hawk, Frank...","Space Cowboys"
"1306",6536311,6538609,"...you'll have to pilot this birdby yourself.","Space Cowboys"
"1307",6538814,6541476,"And you'll have to do it dead-stick.","Space Cowboys"
"1308",6545020,6549218,"Don't look at me. I've flown nothingbigger than a Cessna in 30 years.","Space Cowboys"
"1309",6551860,6555057,"Looks like I'm getting the better partof the deal here.","Space Cowboys"
"1310",6556865,6560028,"Stop laughing.You used up all your oxygen, dummy.","Space Cowboys"
"1311",6583158,6584750,"Frank's hot-wired it for you...","Space Cowboys"
"1312",6584960,6589488,"...but the trick is, those missilesrun out of fuel in 20,000 miles.","Space Cowboys"
"1313",6589764,6591425,"You launch them too soon...","Space Cowboys"
"1314",6591633,6594568,"...the warheads could findtheir way back home to Earth.","Space Cowboys"
"1315",6594769,6599138,"Too late, they'd run out of fueland then you'd be stuck with them.","Space Cowboys"
"1316",6600675,6602006,"Is this gonna work?","Space Cowboys"
"1317",6604646,6605670,"I don't know.","Space Cowboys"
"1318",6606481,6607675,"All right, fellas...","Space Cowboys"
"1319",6608216,6610343,"...let's shoot this baby to the moon.","Space Cowboys"
"1320",6613088,6614783,"Count down to one, right?","Space Cowboys"
"1321",6615357,6616790,"On a count of one.","Space Cowboys"
"1322",6636044,6636874,"One.","Space Cowboys"
"1323",6695136,6697104,"Ikon has left our gravitational field.","Space Cowboys"
"1324",6697305,6701139,"Hawk was able to launch the warheadsinto outer space.","Space Cowboys"
"1325",6701343,6702867,"How's Daedalus?","Space Cowboys"
"1326",6703545,6705775,"We have a critical situation.","Space Cowboys"
"1327",6707582,6711416,"The collision left us with one goodorbital maneuvering engine...","Space Cowboys"
