"id","startTime","endTime","text","title"
"1",97289,102647,"I think your bookkeeperpaid for the flatware twice.","The Lorax"
"2",102809,106802,"Albert, stop.I can't do this any more.","The Lorax"
"3",106969,109767,"Mollie, I love you and you love me.","The Lorax"
"4",109929,114445,"Albert, you're great in bedand you're my biggest account . . .","The Lorax"
"5",114609,116918,". . . but you're married!","The Lorax"
"6",117089,123244,"And I'll never fall in love withanyone else while I'm seeing you.","The Lorax"
"7",123409,127368,"You know I'm leaving Beth.It just takes time.","The Lorax"
"8",127529,133798,"Every time I say the word divorce,she loses five pounds.","The Lorax"
"9",133969,137166,"I'm sorry she's bulimic.","The Lorax"
"10",137329,141641,"- I can't wait for you forever.- It's going to work out soon.","The Lorax"
"11",141809,147918,"The doctor prescribed new pillsand she's starting ballet classes.","The Lorax"
"12",148089,154324,"- It'll be like the playwriting.- She knows this can't make her fat.","The Lorax"
"13",154489,157845,"She saidwriting made her ass spread.","The Lorax"
"14",158009,162639,"Which is insane, she's gota great ass for a 40-year-old.","The Lorax"
"15",162809,166882,"I'll tell Mr. Ross to giveyour account to someone else.","The Lorax"
"16",167049,173648,"I won't let him. I'll never letanyone else touch my books.","The Lorax"
"17",177569,184281,"God, Mollie, I'm going to burstif you don't kiss me soon.","The Lorax"
"18",222409,228120,"Follow me. I know where I'm going.I've got the map. Come on.","The Lorax"
"19",228289,234125,"Come on, keep up, you kids.Here we go.","The Lorax"
"20",235049,238724,"Wait a minute, I see something.","The Lorax"
"21",238889,242245,"I think this is it,right over here.","The Lorax"
"22",242409,246766,"This is definitely it.This is the place.","The Lorax"
"23",246929,249397,"Jackpot!","The Lorax"
"24",249569,254723,"Right down here, kids.Here we go.","The Lorax"
"25",257449,262523,"Dig in, you kids. Here we go.","The Lorax"
"26",262689,265965,"It's kind of tough here.","The Lorax"
"27",266809,271121,"Oh, oh . . .","The Lorax"
"28",271289,274167,"I'm in!","The Lorax"
"29",300809,304802,"Are you okay?","The Lorax"
"30",304969,308166,"- I broke up with George.- Who?","The Lorax"
"31",308329,315804,"George. I met him in Joe Allen's.He turned out to be stupid.","The Lorax"
"32",320409,324800,"You look lousy, doll.","The Lorax"
"33",324969,330805,"- Stomach flu. It's going around.- Nobody has the stomach flu.","The Lorax"
"34",330969,334678,"They don't?You want to hear about Albert?","The Lorax"
"35",334849,338444,"- Listen to me.- I am.","The Lorax"
"36",338609,343558,"Albert's shrink said his wife wouldnever recover if he kept seeing me.","The Lorax"
"37",343729,348007,"- He's decided to leave her.- Albert's leaving his wife?","The Lorax"
"38",348169,354404,"No, he's leaving his shrink. She wasreally an obstacle between us.","The Lorax"
"39",354569,358562,"Leaving his shrink?He's supposed to leave his wife.","The Lorax"
"40",358729,365043,"He's going to. He can't leave herwhile she's sick. She's bulimic.","The Lorax"
"41",365969,370599,"Don't give me that look.It's a very serious disease.","The Lorax"
"42",401209,404565,"What in the . . . Wait a minute.","The Lorax"
"43",404729,408483,"I've got two of these things.Look at that, they match.","The Lorax"
"44",408649,414121,"- You ate all that already?- How weird, I don't like ice cream.","The Lorax"
"45",414289,418521,"- There he is.- This is sick.","The Lorax"
"46",418689,423638,"He looks so sweet with the kids.If only Beth would stop throwing up.","The Lorax"
"47",423809,429566,"Miss Popularity, you can't expect tofind a husband if you never go out.","The Lorax"
"48",429729,434359,"- You're in every night of the week.- Ma, it's tax season.","The Lorax"
"49",434529,437601,"I was studying to pass a CPA exam, -","The Lorax"
"50",437769,442399,"- and I still managedto catch your father.","The Lorax"
"51",444569,448323,"What if Daddy was marriedwhen you first met him?","The Lorax"
"52",448489,451799,"- I wouldn't have fallen for him.- You can't control that.","The Lorax"
"53",451969,456599,"Why not?Listen, take your father here . . .","The Lorax"
"54",456769,461638,"His favourite food was cheesecake,and what did the doctor tell him?","The Lorax"
"55",461809,467008,"- ""Cut back on cholesterol.""- Now he doesn't eat cheesecake.","The Lorax"
"56",467169,470684,"Ma, that doesn't make any sense.","The Lorax"
"57",470849,474888,"You never used to like my food.Something's wrong.","The Lorax"
"58",475049,478246,"- Nothing's wrong.- Louie, something's wrong.","The Lorax"
"59",478409,482197,"- I didn't eat breakfast.- Something's wrong.","The Lorax"
"60",487849,490204,"No.","The Lorax"
"61",492809,494800,"Oh, no!","The Lorax"
"62",494969,498678,"- Yes!- Oh, no!","The Lorax"
"63",498849,504287,"- This wasn't a planned pregnancy?- This wasn't even a planned affair.","The Lorax"
"64",504449,508761,"Well . . .Iet's see how far along we are.","The Lorax"
"65",513409,519120,"Time out! Holy cow,what was that? Who's that?","The Lorax"
"66",519289,522406,"How could this have happened?","The Lorax"
"67",522569,527040,"- How old are you now, Mollie?- 33.","The Lorax"
"68",527209,531327,"Remember,your biological clock is ticking.","The Lorax"
"69",541089,546322,"Beth finally agreed to a divorce.Mollie, I'm so glad you waited.","The Lorax"
"70",546489,551438,"I knew if I was patient,this day would come.","The Lorax"
"71",555449,558566,"Remember your biological clock.","The Lorax"
"72",575249,578400,"My biological clock is ticking . . .","The Lorax"
"73",578569,582164,"I know, I've already said that.I didn't plan on this.","The Lorax"
"74",582329,586083,"I'm not asking for anything.I don't want to trap you.","The Lorax"
"75",586249,591767,"But this baby . . . it's you andme, and I'm not getting an abortion.","The Lorax"
"76",591929,597959,"I wasn't going to ask you to.This will be an incredible baby.","The Lorax"
"77",598129,603522,"He'll have your sweet faceand my business sense.","The Lorax"
"78",603689,608126,"- We'll get little Armani diapers.- It will be a great kid.","The Lorax"
"79",608289,612202,"Having my babywhat a way to say you love me","The Lorax"
"80",612369,616806,"Albert, you're making me sick.I hate that song.","The Lorax"
"81",617569,621357,"Stop singing.She gets sick, I get sick.","The Lorax"
"82",621529,624965,"What are you going to tell people?","The Lorax"
"83",625129,628007,"That I got artificially inseminated.","The Lorax"
"84",628169,633641,"What?How could you do such a thing?","The Lorax"
"85",633809,637848,"I went to the clinicand bought some frozen sperm.","The Lorax"
"86",638009,643800,"- I inserted it, now I'm pregnant.- Where's the frozen pop?","The Lorax"
"87",643969,649566,"- There's no frozen pop.- There's no husband.","The Lorax"
"88",649729,653358,"I control my lifeand I want to have a baby.","The Lorax"
"89",653529,657920,"This kind of thing a girl doesif she's very ugly or a lesbian.","The Lorax"
"90",658089,662526,"This is not the actof a beautiful intelligent girl.","The Lorax"
"91",662689,666967,"You never likedany of my boyfriends, anyway.","The Lorax"
"92",667129,671884,"- Where did this sperm come from?- A medical student.","The Lorax"
"93",672049,676327,"He goes to Columbia.His parents live on the lsland.","The Lorax"
"94",676489,680767,"His father's in piece goods.His mother works in cosmetics.","The Lorax"
"95",680929,684558,"So you're making fun of me.Wait, you'll see.","The Lorax"
"96",684729,688278,"Someday you'll have children.","The Lorax"
"97",700209,705044,"Look . . . an arm. It's an arm.","The Lorax"
"98",705209,711045,"Look . . . isn't it cute?","The Lorax"
"99",728769,733126,"Here's the head . . . isn't it?","The Lorax"
"100",746289,749281,"Get some apple juice down here!","The Lorax"
"101",756649,759117,"- Thirsty?- Go ahead.","The Lorax"
"102",760609,764682,"""The sex organs are mouldedout of similar tissue folds.""","The Lorax"
"103",764849,768808,"""By the second trimesterthey are identifiable.""","The Lorax"
"104",768969,772484,"Look, another armcoming in down there . . .","The Lorax"
"105",772649,776927,"How am I going to get thatin my mouth?","The Lorax"
"106",779129,782963,"Miss, excuse me . . .","The Lorax"
"107",784009,787445,"- What can I do for you?- Albert is expecting me.","The Lorax"
"108",787609,793320,"He's in with his decorator.You can wait over there.","The Lorax"
"109",798249,801639,"- I think you're going to enjoy it.- I'm sure I will.","The Lorax"
"110",801809,805927,"- Remember to dust it every day.- See you later.","The Lorax"
"111",806089,809479,"Hi, come on in.","The Lorax"
"112",818969,822006,"Albert, was that woman pretty?","The Lorax"
"113",822169,826959,"- No, you're pretty.- I look like a big, fat pilgrim.","The Lorax"
"114",827129,830519,"How do you like the desk?","The Lorax"
"115",830689,834602,"- It's made of stone.- It's all right.","The Lorax"
"116",834769,839160,"It's going to be great in here.This is all going.","The Lorax"
"117",839329,843720,"I'm having a custom-made muralof an ancient Navajo design.","The Lorax"
"118",843889,848485,"Leather craftsmen in Mexicoare going to make all new couches.","The Lorax"
"119",851009,855639,"- What do you think?- I like the deco stuff.","The Lorax"
"120",855809,860929,"- Don't gain too much weight.- My doctor says my weight is fine.","The Lorax"
"121",861089,867688,"Beth only gained 21 pounds.She jogged three miles a day.","The Lorax"
"122",867849,871398,"- Maybe you should marry her.- Don't start.","The Lorax"
"123",871569,877724,"- I've got problems, too.- Sorry. I'm afraid of giving birth.","The Lorax"
"124",877889,881962,"- I've never been real big on pain.- You been to Lamaze?","The Lorax"
"125",882129,885644,"I quit.It's just a bunch of breathing.","The Lorax"
"126",885809,889882,"It's so much better for the baby.When Beth had Priscilla . . .","The Lorax"
"127",890049,893928,"I'm so sick of hearing about Beth!","The Lorax"
"128",894089,898241,"How could you be in love with herand then in love with me?","The Lorax"
"129",898409,901765,"I have a degree.She took belly-dancing lessons.","The Lorax"
"130",901929,907322,"When I found out I was pregnant,I decided to make out a will.","The Lorax"
"131",907489,912483,"When Beth had the girls, she hada reading of their past lives.","The Lorax"
"132",912649,918997,"- And you're still with her!- Oh yeah? Look at this receipt.","The Lorax"
"133",919169,923003,"- Galleria Apartments.- I moved out. I did it.","The Lorax"
"134",923169,926206,"I put down a deposit this morning.","The Lorax"
"135",927569,930959,"I can't believe it!Should I come by tonight?","The Lorax"
"136",931129,934838,"You'd better not.We've still got to be careful.","The Lorax"
"137",935009,939321,"Albert, I'm so happy!","The Lorax"
"138",941889,947885,"I wonder if this storehas a bathroom. I have to go again.","The Lorax"
"139",950049,954679,"I love this . . . Look,it takes two of them to cover me.","The Lorax"
"140",954849,958762,"- Yeah, but you're having a baby.- You try it on.","The Lorax"
"141",958929,963241,"- Should I have a baby with Neal?- Do you love him?","The Lorax"
"142",963409,966128,"No.","The Lorax"
"143",966289,971841,"Try some of thatNobel Prize winners' sperm.","The Lorax"
"144",972009,975001,"Don't you want a smart baby?","The Lorax"
"145",975169,980960,"That's all I need. A babytelling me what an idiot I am.","The Lorax"
"146",981129,986601,"- I found a nice family man.- Except it's someone else's family.","The Lorax"
"147",986769,991399,"That's why he left.He loves me and we're having baby.","The Lorax"
"148",991569,996597,"It sounds like the peoplein the next compartment are.","The Lorax"
"149",1007489,1009525,"- Mollie!- Albert!","The Lorax"
"150",1009689,1014968,"- Let me explain . . .- These dresses aren't paid for.","The Lorax"
"151",1015129,1020886,"- Don't take this shit from him.- I'm going to call the cops.","The Lorax"
"152",1021049,1023688,"After you. Thank you.","The Lorax"
"153",1023849,1027967,"- Albert, what's going on?- Mollie, I've fallen in love.","The Lorax"
"154",1028129,1031804,"Beth knows.I'm going to live with Melissa.","The Lorax"
"155",1031969,1036759,"I don't know if it'll last.It just happened.","The Lorax"
"156",1036929,1040046,"Why didn't you say anything to me?","The Lorax"
"157",1040209,1043997,"You were so closeto the end of your pregnancy.","The Lorax"
"158",1044169,1046842,"I don't believe this is happening.","The Lorax"
"159",1047009,1051366,"This sounds awful, butI'm going through a selfish phase.","The Lorax"
"160",1051529,1055522,"- A selfish phase?- I admit the timing is bad.","The Lorax"
"161",1055689,1059602,"- A selfish phase?- It just happened.","The Lorax"
"162",1059769,1063842,"A selfish phase!Albert, you dick.","The Lorax"
"163",1064009,1068878,"- You lousy prick!- Leave him alone.","The Lorax"
"164",1069049,1072644,"- Come on.- Here.","The Lorax"
"165",1072809,1075642,"Hey, what the . . .","The Lorax"
"166",1076449,1081398,"- Wait, please, I'm in labour.- I was here first.","The Lorax"
"167",1082769,1087479,"Asshole! Taxi! Please . . .","The Lorax"
"168",1093329,1096401,"St. Jerome's Hospital.","The Lorax"
"169",1097209,1099723,"Oh, shit!","The Lorax"
"170",1103209,1108806,"- Slow down! It can take hours.- So can the midtown traffic.","The Lorax"
"171",1118529,1121248,"Pull over till the ludes wear off.","The Lorax"
"172",1125529,1128362,"God, you idiot!","The Lorax"
"173",1128529,1132078,"Come on, move it.","The Lorax"
"174",1134049,1139760,"Christ, this traffic . . .We're going as fast as we can.","The Lorax"
"175",1140849,1145479,"Hold onto my hand. Bear down, that'swhat they say in the hospital.","The Lorax"
"176",1146969,1152441,"- Come on, move it.- God, my water just broke.","The Lorax"
"177",1152609,1157888,"- Hey, buddy, move it.- You can't get through here.","The Lorax"
"178",1158049,1162247,"- I've got an emergency.- Sorry, buddy, move it.","The Lorax"
"179",1165929,1170002,"Just relax.Hold on, we're almost there.","The Lorax"
"180",1170169,1173366,"Look out! You're going to hit . . !","The Lorax"
"181",1177449,1180646,"Hold on!","The Lorax"
"182",1182609,1185407,"You stupid son of a . . !","The Lorax"
"183",1186849,1189807,"- Are you doing your Lamaze?- Look out!","The Lorax"
"184",1193449,1197601,"- Breathe deep.- Don't try to help, just drive!","The Lorax"
"185",1198969,1202598,"You've got to use Lamaze.My sister-in-law used it.","The Lorax"
"186",1202769,1206967,"- It's better for the kid.- All men are stupid idiots.","The Lorax"
"187",1208569,1213404,"- Should I call your husband?- I don't have a husband.","The Lorax"
"188",1213569,1217562,"- I was artificially inseminated.- Are you a lesbo?","The Lorax"
"189",1234169,1239801,"Stupid jerk! My kid will probablybe brain damaged because of you.","The Lorax"
"190",1241529,1245886,"Don't touch me! I'll have this babywithout you touching me.","The Lorax"
"191",1247809,1252564,"- Excuse me, I'm in labour.- Do you have your medical card?","The Lorax"
"192",1252729,1257439,"- I left it at home.- I have to have your medical card.","The Lorax"
"193",1257609,1262637,"- This is my first baby.- She's getting close. Upstairs.","The Lorax"
"194",1262809,1267644,"You didn't finish this.I cannot do my job . . .","The Lorax"
"195",1267809,1274044,"- Put these on over your clothes.- I'm not the father.","The Lorax"
"196",1274209,1280045,"- Nurse, another one's coming.- Deep breaths, come on.","The Lorax"
"197",1280209,1283406,"Okay, this'll pass. Watch the head.","The Lorax"
"198",1283569,1287608,"God! I need some drugs.","The Lorax"
"199",1287769,1292081,"- Slow down your breathing.- Fuck my breathing!","The Lorax"
"200",1292249,1297562,"- You've got to calm down.- Get me some drugs.","The Lorax"
"201",1297729,1302405,"- No, you don't want drugs.- I do. I'm going to split in two.","The Lorax"
"202",1302569,1306881,"By the time theytake effect she could be delivering.","The Lorax"
"203",1307049,1311964,"- But what about now?- I'm waiting for a doctor.","The Lorax"
"204",1313649,1318006,"Are you a doctor? Come on.","The Lorax"
"205",1320529,1324408,"- Water break?- Half an hour ago.","The Lorax"
"206",1324569,1329802,"- Are we doing our Lamaze breathing?- I dropped out of Lamaze.","The Lorax"
"207",1329969,1333848,"I'll go to summer schoolif you make the pain stop.","The Lorax"
"208",1334009,1338525,"- How about some Demerol?- God, that'd be great!","The Lorax"
"209",1338689,1343479,"I'd like some of that.Give me a lot of it.","The Lorax"
"210",1343649,1346880,"So it doesn't wear offduring the birth.","The Lorax"
"211",1347049,1352840,"I think maybe I'm in a bit more painthan most of your patients.","The Lorax"
"212",1353009,1356319,"Be sure and give me enough.","The Lorax"
"213",1356489,1361722,"- There we go.- Thank you a really lot.","The Lorax"
"214",1361889,1365802,"That is a little more like it.","The Lorax"
"215",1365969,1369803,"Hey, here's Mr. Hand here.","The Lorax"
"216",1371009,1376083,"Now that is very cosmic.I don't understand . . .","The Lorax"
"217",1376249,1380686,"What's that light down there?","The Lorax"
"218",1381849,1385478,"That's it, breathe!","The Lorax"
"219",1385649,1390200,"Attagirl, push. One more.","The Lorax"
"220",1390369,1394408,"Stop with that pushing!I'm falling!","The Lorax"
"221",1399809,1401845,"Help!","The Lorax"
"222",1402009,1407879,"No, put me back in! Let goof my head and put me back inside!","The Lorax"
"223",1408049,1410040,"It's a boy.","The Lorax"
"224",1410209,1413007,"It's a boy.","The Lorax"
"225",1413169,1418197,"Who are you?Lady, I'm freezing. I'm so cold.","The Lorax"
"226",1418369,1421918,"Get that thing away from me.","The Lorax"
"227",1422089,1426082,"- You want to do the cord?- No, you take this one.","The Lorax"
"228",1426249,1429480,"I need that!","The Lorax"
"229",1429649,1434359,"Lady, a blanket,something, I'm frosty out here.","The Lorax"
"230",1437129,1440838,"No, don't do that!","The Lorax"
"231",1443729,1448564,"Where are we going now?Hey, don't drop me.","The Lorax"
"232",1448729,1453484,"Oh, very nice . . .","The Lorax"
"233",1460649,1464324,"I don't know about you,but I'm beat.","The Lorax"
"234",1464489,1468118,"So you're the onethat's been kicking me.","The Lorax"
"235",1468289,1471759,"You're the onethat ate the spicy food.","The Lorax"
"236",1474249,1479846,"This is the weirdest thing that'sever happened to me . . . so far.","The Lorax"
"237",1482889,1488646,"I don't get it. I just don'tget it. Where did I go wrong?","The Lorax"
"238",1488809,1494202,"Where are my thumbs?I want to suck my thumbs.","The Lorax"
"239",1494369,1499887,"- I have to get my own place.- I've been reincarnated so quickly?","The Lorax"
"240",1500049,1503359,"What a surprise!","The Lorax"
"241",1503529,1508125,"Who stole my sucking thing?I need my sucking thing!","The Lorax"
"242",1508289,1511361,"I just rememberedI hate childhood.","The Lorax"
"243",1519849,1522761,"Look at all those daddies.","The Lorax"
"244",1522929,1529448,"Making goofball facesand taking pictures of their babies.","The Lorax"
"245",1529609,1532601,"You won't find your father here.","The Lorax"
"246",1532769,1536444,"I really messed things up for you.","The Lorax"
"247",1536609,1541683,"Don't be upset.I'm going to find you a daddy.","The Lorax"
"248",1541849,1545637,"And not just some handsome guyI'm in love with.","The Lorax"
"249",1545809,1552806,"You're all that matters to me.I'll get you the best daddy ever.","The Lorax"
"250",1556889,1563681,"Out, down, in, out . . .Well, we got that.","The Lorax"
"251",1563849,1567125,"What have you got there?A hand?","The Lorax"
"252",1567289,1570201,"Yeah, two of them.","The Lorax"
"253",1577809,1580801,"Oh, my God!","The Lorax"
"254",1587169,1591082,"""On the third or fourth dayyour breasts may swell slightly.""","The Lorax"
"255",1591249,1595720,"Slightly?I look like a Russ Meyer movie.","The Lorax"
"256",1602689,1605522,"Workman.","The Lorax"
"257",1605689,1610558,"- Oh, no! Sorry.- Real nice.","The Lorax"
"258",1612289,1617044,"- You got your figure back.- This is not my figure.","The Lorax"
"259",1617209,1621248,"Sorry I hit you and yelled at you,but I was in a lot of pain.","The Lorax"
"260",1621409,1627245,"I still owe you that cab fare,but somebody stole my purse.","The Lorax"
"261",1627409,1631721,"- How do you like New York so far?- It's my kind of town.","The Lorax"
"262",1631889,1637441,"I'll get you the rest later . . .Wait a minute . . .","The Lorax"
"263",1637609,1642808,"- How did you know where I lived?- You left it in the cab.","The Lorax"
"264",1644289,1646120,"Thanks.","The Lorax"
"265",1646289,1651204,"You should look through that thing.You've still got your diaphragm.","The Lorax"
"266",1656889,1659926,"Don't smoke that around my baby.","The Lorax"
"267",1660089,1665243,"There's a 62% higher rate of cancerin people who live with smokers.","The Lorax"
"268",1665409,1670563,"What are you trying to say?You don't want me to move in yet?","The Lorax"
"269",1670729,1675120,"Do you think the drugshad any effect on him?","The Lorax"
"270",1675289,1679441,"- How did you know I had drugs?- I don't. I didn't.","The Lorax"
"271",1679609,1682806,"You can tell in his eyes.He looks stoned.","The Lorax"
"272",1682969,1690398,"- He does not. He looks perfect.- You don't look so hot yourself.","The Lorax"
"273",1690569,1696485,"If you tried passing a watermelon,how hot would you look?","The Lorax"
"274",1696649,1700847,"Ouch! I should callmy mother more often. Get it?","The Lorax"
"275",1701009,1705719,"- Do you want a sub?- No, will you just watch him?","The Lorax"
"276",1705889,1711122,"Don't take him out of his chairand don't touch him a whole lot.","The Lorax"
"277",1712449,1714917,"Hi, Mikey. I'm James.","The Lorax"
"278",1715089,1721085,"- Good to meet you.- Do you mind if I suck on that?","The Lorax"
"279",1721249,1727768,"- How long have you been here?- About five years.","The Lorax"
"280",1727929,1734721,"- Were you born in New York?- Are you with the census bureau?","The Lorax"
"281",1734889,1741840,"How do you like the outside world?It's weird, isn't it?","The Lorax"
"282",1742009,1747766,"- Yeah, tell me about it.- Here, your first lesson in coffee.","The Lorax"
"283",1747929,1752878,"- Can you say black coffee?- No.","The Lorax"
"284",1753049,1758328,"Regular coffee has two sugars andmilk . . . which they have forgotten.","The Lorax"
"285",1758489,1765361,"Can I borrow some of yours?Coffee regular, I love it.","The Lorax"
"286",1765529,1768839,"That's breast milk.","The Lorax"
"287",1770009,1773843,"- Why didn't you tell me?- You're on your own.","The Lorax"
"288",1774009,1776967,"I'll see you guys later.","The Lorax"
"289",1777129,1783443,"I'm going to take my sub andmy breast milk and get out of here.","The Lorax"
"290",1783609,1787602,"I've got somethingcold and wet in my shorts.","The Lorax"
"291",1787769,1792559,"Could you get somebody for me?Fellas?","The Lorax"
"292",1792729,1798884,"You guys are no help. I'm cold andwet and there's nothing I can do.","The Lorax"
"293",1799049,1803804,"It's okay, Mikey. Mommy's here.","The Lorax"
"294",1803969,1809202,"That Mommy person's here again.She's okay. I like her.","The Lorax"
"295",1811609,1815966,"I start cryingand she comes in with a bottle.","The Lorax"
"296",1816129,1819121,"Crying, I can handle that.","The Lorax"
"297",1860449,1863247,"Taxi!","The Lorax"
"298",1866169,1869445,"Taxi!","The Lorax"
"299",1888609,1894002,"""80% of all women experiencepost-partum depression.""","The Lorax"
"300",1894169,1896160,"I won't.","The Lorax"
"301",1899289,1904966,"Like a lot of parents, I can'talways be there on birthdays.","The Lorax"
"302",1905129,1910920,"Help, somebody burp mebefore I blow up.","The Lorax"
"303",1911089,1919087,"That's it! You have some exoticdisease and I look like a zombie.","The Lorax"
"304",1919249,1924277,"And your father deserted us so hecould pork his interior decorator.","The Lorax"
"305",1924449,1928488,"I think you can safely saythat it can't get any worse.","The Lorax"
"306",1928649,1933325,"- Hello!- I was wrong.","The Lorax"
"307",1933489,1938324,"Where's my grandson?","The Lorax"
"308",1938489,1940923,"There he is.","The Lorax"
"309",1943049,1948885,"- Mikey, do you know who I am?- No, actually, I don't.","The Lorax"
"310",1949049,1953679,"- I'm your grandma.- Okay, if you say so.","The Lorax"
"311",1953849,1957205,"- Yes, I am.- What do you want from me?","The Lorax"
"312",1960769,1965001,"- Who's got a wet tushy?- I give up.","The Lorax"
"313",1969569,1973881,"After a new diaper, I likesome of that white stuff on me.","The Lorax"
"314",1974049,1978918,"If you had a man instead of a frozenpop, all this would be put together.","The Lorax"
"315",1979089,1984004,"You make it sound like I hadan affair with a frozen dessert.","The Lorax"
"316",1984169,1987844,"- You look awful.- Thank you.","The Lorax"
"317",1988009,1991001,"You're using too much powder.","The Lorax"
"318",1991169,1997244,"Why don't you get out of the house?I'm going to give Mikey a bath.","The Lorax"
"319",1997409,1999877,"A what?","The Lorax"
"320",2002049,2004199,"She's gone!","The Lorax"
"321",2011729,2015608,"Who would you wantas your child's father?","The Lorax"
"322",2015769,2019364,"Someone with a small mouthand good hair . . .","The Lorax"
"323",2019529,2025764,"- A guy to help raise your child.- Are there men who do that?","The Lorax"
"324",2025929,2030525,"I'm looking for a guywho's not married, -","The Lorax"
"325",2030689,2035558,"- not into drugs, not a deadbeat,but not a workaholic.","The Lorax"
"326",2035729,2041759,"- And cute.- Cute is of no importance.","The Lorax"
"327",2041929,2044602,"You're my first datesince my baby was born.","The Lorax"
"328",2044769,2048239,"This looks delicious.","The Lorax"
"329",2048409,2053437,"What is this?I asked for well done. This is raw.","The Lorax"
