"id","startTime","endTime","text","title"
"1683",4571233,4573064,"You did this to me?","Think Like a Man"
"1684",4587616,4588810,"Good evening, miss.","Think Like a Man"
"1685",4589785,4590877,"Wild...","Think Like a Man"
"1686",4591453,4592545,"-Damn.-Face...","Think Like a Man"
"1687",4592754,4594551,"I'm sorry. Very much.","Think Like a Man"
"1688",4595357,4597257,"'' Wild Mushroom en Crout''?","Think Like a Man"
"1689",4598594,4599583,"Croute.","Think Like a Man"
"1690",4599962,4600951,"Croute?","Think Like a Man"
"1691",4602364,4603353,"Thank you.","Think Like a Man"
"1692",4603565,4605658,"-Enjoy your dinner.-Thank you.","Think Like a Man"
"1693",4611306,4615936,"I would like to stop seeing melike a waiter serving hors d'oeuvres.","Think Like a Man"
"1694",4617212,4618440,"What do you think?","Think Like a Man"
"1695",4619615,4620604,"LncrÍvel .","Think Like a Man"
"1696",4622818,4624115,"As you.","Think Like a Man"
"1697",4625220,4626380,"Thank you.","Think Like a Man"
"1698",4629324,4631258,"And watch the stars.","Think Like a Man"
"1699",4631960,4633359,"Make a wish.","Think Like a Man"
"1700",4637399,4638388,"Okay.","Think Like a Man"
"1701",4644139,4645697,"You will not make a request?","Think Like a Man"
"1702",4649745,4650973,"Is not necessary.","Think Like a Man"
"1703",4666294,4669559,"And that night, Zeke wason a completely different mission.","Think Like a Man"
"1704",4669765,4671426,"Do not tell me what I said. I know.","Think Like a Man"
"1705",4671633,4673498,"-But I'm telling you, eventually.-What?","Think Like a Man"
"1706",4673702,4675431,"Do not agree with this rule 90 days.","Think Like a Man"
"1707",4675637,4676934,"You have the ammunition needed.","Think Like a Man"
"1708",4677139,4678766,"Dear, I'll rise.","Think Like a Man"
"1709",4681810,4682834,"Okay, listen.","Think Like a Man"
"1710",4683045,4687778,"Use'' as'' men show their loveagainst it to get the wafer.","Think Like a Man"
"1711",4687983,4689507,"Confess your love.Call it girlfriend.","Think Like a Man"
"1712",4689718,4691413,"Stop. Do you have any idea what I spent?","Think Like a Man"
"1713",4691620,4694111,"I am tired of paying the account and open doors,","Think Like a Man"
"1714",4694322,4696313,"and feelings and talk about our childhoods.","Think Like a Man"
"1715",4696525,4698254,"It's like  in the '50s, man! I just want sex.","Think Like a Man"
"1716",4698460,4701088,"And if she thinks another 7wait to have sex one day,","Think Like a Man"
"1717",4701296,4703196,"-she waits alone.-Are you counting?","Think Like a Man"
"1718",4703398,4705958,"I'm not telling,but you know the number of days...","Think Like a Man"
"1719",4706168,4707294,"You really like it.","Think Like a Man"
"1720",4707502,4709470,"No, man, trust me. It's over, okay?","Think Like a Man"
"1721",4709671,4710797,"I'll end this now.","Think Like a Man"
"1722",4711006,4712439,"Yes, have fun on your date.","Think Like a Man"
"1723",4712641,4714438,"I'll give you a kick in the rear of 90 days of it.","Think Like a Man"
"1724",4715877,4716901,"","Think Like a Man"
"1725",4717979,4719105,"Listen.","Think Like a Man"
"1726",4719481,4720709,"Mya, on tonight...","Think Like a Man"
"1727",4720916,4721940,"Okay, got a surprise.","Think Like a Man"
"1728",4722417,4723441,"Do you?","Think Like a Man"
"1729",4723652,4726621,"Yes, I bought tickets forJohn Legend's concert at the Nokia Theatre.","Think Like a Man"
"1730",4728690,4731022,"Okay, cool.","Think Like a Man"
"1731",4731359,4732348,"Yes","Think Like a Man"
"1732",4732994,4735019,"-Right.-Okay. So, come on.","Think Like a Man"
"1733",4742070,4745005,"I hope you do not get mad at me,","Think Like a Man"
"1734",4745207,4748540,"But my uncle is a music producerand I gave him your CD.","Think Like a Man"
"1735",4748744,4749733,"You took my CD?","Think Like a Man"
"1736",4750045,4753037,"Yes, and the three gum stuck in it.","Think Like a Man"
"1737",4753248,4755478,"You know what?I was looking for chewing gum.","Think Like a Man"
"1738",4755684,4759484,"I've had enough of the music industry, right?I love what I do.","Think Like a Man"
"1739",4759688,4761986,"Okay, Zeke,he is not forcing him to sign anything.","Think Like a Man"
"1740",4762190,4764590,"Just want new songs for the album you're working.","Think Like a Man"
"1741",4764793,4767489,"Yes, my album got a disk'''' brass, okay?","Think Like a Man"
"1742",4767696,4769664,"Two people heard and both were related.","Think Like a Man"
"1743",4769865,4773562,"True, but I was praisingand he decided to listen.","Think Like a Man"
"1744",4774936,4776233,"Should have been my agent.","Think Like a Man"
"1745",4778740,4779707,"Zeke!","Think Like a Man"
"1746",4779908,4782843,"Zeke stallion! And here, man?","Think Like a Man"
"1747",4783044,4785012,"-Man, hi, and then... Xavier!-And here, man?","Think Like a Man"
"1748",4785213,4788444,"My lord . Honey, this is Zeke.The guy who taught me to dance.","Think Like a Man"
"1749",4788650,4790174,"The Chimichanga!It was he who taught me.","Think Like a Man"
"1750",4790385,4791716,"This is my girl, Crystal.","Think Like a Man"
"1751",4791920,4793945,"So, Crystal? How are you?","Think Like a Man"
"1752",4795724,4798124,"Oh, sorry. Xavier, this is...","Think Like a Man"
"1753",4799594,4802791,"Ladies, if a manto present as a friend","Think Like a Man"
"1754",4802998,4805728,"understand, you're nothing more than that.","Think Like a Man"
"1755",4805934,4809529,"If a man hasplans for the future with you, he'll confess.","Think Like a Man"
"1756",4809738,4811399,"It will add a title to his name.","Think Like a Man"
"1757",4811606,4816441,"You will be his wife,his girl, his bride or...","Think Like a Man"
"1758",4818146,4819773,"My girlfriend, Mya.","Think Like a Man"
"1759",4822083,4824415,"Zeke realized that he could reach far beyond","Think Like a Man"
"1760",4824619,4828715,"with a good confession than six wonderful encounters.","Think Like a Man"
"1761",4837132,4838224,"Oh, my God.","Think Like a Man"
"1762",4839601,4840590,"I think we should stop.","Think Like a Man"
"1763",4842270,4843965,"I need to get up early.","Think Like a Man"
"1764",4844339,4846603,"I better go.","Think Like a Man"
"1765",4847542,4848770,"Okay.","Think Like a Man"
"1766",4849110,4850236,"Good night!","Think Like a Man"
"1767",4851980,4853311,"I could walk with you until...","Think Like a Man"
"1768",4853515,4855915,"No, you can leave. I'm fine, good night!","Think Like a Man"
"1769",4856518,4859783,"Theboys may have lost some battles but the war earned.","Think Like a Man"
"1770",4859988,4861751,"I'm telling you, Gina. It worked.","Think Like a Man"
"1771",4861957,4864425,"He ​​is finally trying to get a good job.","Think Like a Man"
"1772",4864626,4866753,"Family Feud knows what he's talking about?","Think Like a Man"
"1773",4866895,4867884,"I changed our relationship.","Think Like a Man"
"1774",4868029,4869053,"Zeke is in a relationship.","Think Like a Man"
"1775",4869164,4870222,"How this affects the rule of 90 days?","Think Like a Man"
"1776",4870332,4872425,"The rule of 90 dayswas what brought me here.","Think Like a Man"
"1777",4872634,4875501,"What I mean isthat I am not opposed to change it","Think Like a Man"
"1778",4875704,4876966,"for good behavior.","Think Like a Man"
"1779",4877172,4879299,"How to change the relationship status on Facebook?","Think Like a Man"
"1780",4879507,4881441,"That 'shows good behavior,","Think Like a Man"
"1781",4881643,4883133,"but it still will not win the'' cookie''","Think Like a Man"
"1782",4883245,4885042,"Unless you say the three magic words.","Think Like a Man"
"1783",4885247,4887977,"I hope you are ready for fun in praião.","Think Like a Man"
"1784",4888183,4889445,"Ah, yes, fun in praião.","Think Like a Man"
"1785",4890752,4893118,"Wait. Honey, should meet?Is the work.","Think Like a Man"
"1786",4893722,4894780,"Yes, all right.","Think Like a Man"
"1787",4895023,4898151,"Do not! Why should I answer callsworking with you with me?","Think Like a Man"
"1788",4898260,4900251,"Do not worry about it.-No work.","Think Like a Man"
"1789",4900729,4903027,"-You're right, Duke?-Yes.","Think Like a Man"
"1790",4903231,4906291,"Do you have your license?For you will drive back in, right?","Think Like a Man"
"1791",4911106,4912471,"I'm kidding.","Think Like a Man"
"1792",4913174,4914732,"How romantic.","Think Like a Man"
"1793",4914943,4916535,"Things were going too well.","Think Like a Man"
"1794",4916745,4919646,"Theboys had even forgotten that they were at war.","Think Like a Man"
"1795",4923551,4926042,"Okay, thank you, guys.I am Danny Vola.","Think Like a Man"
"1796",4926254,4928484,"Go up there and sing.Come on, you should...","Think Like a Man"
"1797",4928690,4930248,"No, do not sing for years, sit there.","Think Like a Man"
"1798",4930458,4933018,"Wait, slow down! Sure, Duke!","Think Like a Man"
"1799",4933228,4935890,"-All right, you can.-Care!","Think Like a Man"
"1800",4936097,4938657,"Will buy a bike like that to you, dear.","Think Like a Man"
"1801",4943271,4944829,"Ah, want one?","Think Like a Man"
"1802",4963425,4967691,"Sorry it took me, dear.One of the boys needed some advice.","Think Like a Man"
"1803",4968630,4969927,"Where were we?","Think Like a Man"
"1804",4970265,4971459,"Right here.","Think Like a Man"
"1805",4971900,4974232,"But then things started to go wrong.","Think Like a Man"
"1806",4974436,4976927,"What happened with that job at Neversoft?","Think Like a Man"
"1807",4979007,4983603,"I forgot to tell you,heard rumors that they filled the position.","Think Like a Man"
"1808",4985347,4986405,"Really?","Think Like a Man"
"1809",4987115,4988241,"Yes","Think Like a Man"
"1810",4990785,4991945,"How strange,","Think Like a Man"
"1811",4993355,4997382,"since talked with the younger brother of Sarah...","Think Like a Man"
"1812",4997759,4999886,"-Yes?-... In LinkedIn.","Think Like a Man"
"1813",5000095,5002962,"And he said that the position was still open.","Think Like a Man"
"1814",5004332,5006323,"-Really?-Yes.","Think Like a Man"
"1815",5006534,5009128,"And hepersonally recommend it to your boss.","Think Like a Man"
"1816",5009337,5012306,"But his resume was not received.","Think Like a Man"
"1817",5013141,5014130,"What?","Think Like a Man"
"1818",5016044,5017807,"I waited all this time.","Think Like a Man"
"1819",5018013,5021676,"You know what?I had to restart the modem the other day.","Think Like a Man"
"1820",5021883,5023976,"I bet you did not receive my e-mail.","Think Like a Man"
"1821",5024185,5027313,"I'll fix it tomorrow morning.","Think Like a Man"
"1822",5029724,5030952,"You are blaming the internet?","Think Like a Man"
"1823",5032460,5035486,"It happens all the time.","Think Like a Man"
"1824",5038900,5039889,"Kris?","Think Like a Man"
"1825",5041302,5043293,"The truth was coming out.","Think Like a Man"
"1826",5047509,5048908,"I'll miss you.","Think Like a Man"
"1827",5050311,5051778,"It's mine, right. Even more.","Think Like a Man"
"1828",5051980,5052947,"Right.","Think Like a Man"
"1829",5100228,5101217,"James?","Think Like a Man"
"1830",5101496,5103361,"-James Merrill?-Lauren Harris.","Think Like a Man"
"1831",5104866,5106231,"Wow, look at you.","Think Like a Man"
"1832",5106668,5107828,"Look at you.","Think Like a Man"
"1833",5110038,5113303,"It's like a fine wine.It gets better with age, is not it?","Think Like a Man"
"1834",5113508,5116477,"And you more charming.What are you doing in LA?","Think Like a Man"
"1835",5116678,5120637,"I'm renting an apartment.I was promoted to executive director of Sensala.","Think Like a Man"
"1836",5121082,5122572,"-Our.-Yes.","Think Like a Man"
"1837",5122717,5123684,"I'm moving to LA.","Think Like a Man"
"1838",5123885,5124909,"-Are you kidding?-No.","Think Like a Man"
"1839",5125053,5128113,"Nina I can not imagine moving from Chicago.","Think Like a Man"
"1840",5128323,5130018,"Well, it will not change.","Think Like a Man"
"1841",5131092,5132650,"We are finalizing our divorce.","Think Like a Man"
"1842",5133228,5135162,"-Really?-Yes.","Think Like a Man"
"1843",5135363,5138127,"-I'm sorry.No, okay.","Think Like a Man"
"1844",5138333,5139698,"-We are still friends.-That is good.","Think Like a Man"
"1845",5139901,5142461,"Do you? You are engaged? Married?","Think Like a Man"
"1846",5143204,5146139,"No. Not engaged or married.","Think Like a Man"
"1847",5146341,5147672,"Really?","Think Like a Man"
"1848",5147876,5149503,"Only dating, but nothing serious.","Think Like a Man"
"1849",5150211,5151371,"So what about dinner?","Think Like a Man"
"1850",5152380,5153472,"Course.","Think Like a Man"
"1851",5153681,5155546,"I want you. I mean, I dine with you.","Think Like a Man"
"1852",5157519,5159077,"So I have to call.","Think Like a Man"
"1853",5159287,5160686,"-It's the same number?-The same.","Think Like a Man"
"1854",5160889,5162083,"-Right. Call me-.","Think Like a Man"
"1855",5162290,5164155,"Tomorrow night, .-Absolutely.","Think Like a Man"
"1856",5165260,5166921,"-I liked the car.-I also.","Think Like a Man"
"1857",5167128,5168186,"I liked the format.","Think Like a Man"
"1858",5168963,5170157,"From car.","Think Like a Man"
"1859",5173768,5175167,"-I hate to bother you...Go away!","Think Like a Man"
"1860",5175270,5178501,"I saw this episode yesterday at home mom.It's very funny.","Think Like a Man"
"1861",5178706,5181402,"There had been called back to work last night?","Think Like a Man"
"1862",5181609,5183907,"Ah, yes, last night I went to work,","Think Like a Man"
"1863",5184112,5186205,"but said I had to go in the house of Mama","Think Like a Man"
"1864",5186414,5190248,"to get things that she had left...I told you, dear.","Think Like a Man"
"1865",5190351,5193013,"No, do not think you...-Give me a kiss. You did not hear me.","Think Like a Man"
"1866",5193121,5195487,"And the lies were increasing.","Think Like a Man"
"1867",5195690,5198181,"My mother is planning a big family reunion.","Think Like a Man"
"1868",5198393,5200520,"-I would love if you were.-What you want, dear.","Think Like a Man"
"1869",5200728,5201786,"-Really?-Course.","Think Like a Man"
"1870",5201896,5205957,"The only problem is if your mother and grandmother are beautiful as you,","Think Like a Man"
"1871",5206167,5208135,"you can have competition there.","Think Like a Man"
"1872",5208336,5209462,"Come here.","Think Like a Man"
"1873",5210705,5211694,"Cool!","Think Like a Man"
"1874",5211873,5212999,"It is in the park in Culver City.","Think Like a Man"
"1875",5213208,5215301,"You'll have a trampoline and barbecue.","Think Like a Man"
"1876",5215510,5218536,"These walls have ears.Duke, go back to bed.","Think Like a Man"
"1877",5221516,5224349,"So, it will be on the 20th and will be great.","Think Like a Man"
"1878",5224552,5226281,"We will have cotton candy machines...","Think Like a Man"
"1879",5226487,5229047,"20-Day this month? -Carousel...","Think Like a Man"
"1880",5229257,5231191,"Honey, can not in 20 days.","Think Like a Man"
"1881",5231492,5232652,"Why?","Think Like a Man"
"1882",5233061,5236792,"Actually, it'sanniversary of the church of my mother and promised her...","Think Like a Man"
"1883",5236998,5238363,"Really? You must be kidding!","Think Like a Man"
"1884",5238566,5240033,"Good night, Duke!","Think Like a Man"
"1885",5240235,5241497,"I'll see what I can do, right?","Think Like a Man"
"1886",5241703,5243671,"-Right.-I'll fix.","Think Like a Man"
"1887",5243871,5245065,"Come here, girl, come on.","Think Like a Man"
"1888",5245273,5248572,"Turns out the only problempretending to take a step forward","Think Like a Man"
"1889",5248776,5251176,"is that sometimes you even need to.","Think Like a Man"
"1890",5251379,5254576,"Keep an eye on it.Pay attention, this will jump...","Think Like a Man"
"1891",5260355,5262152,"Okay, what?","Think Like a Man"
"1892",5263958,5267724,"Right.I wanted to wait until we were in the restaurant","Think Like a Man"
"1893",5268029,5271157,"but I spoke to my uncle last night","Think Like a Man"
"1894",5271366,5274597,"and he heard his CD and loved it.","Think Like a Man"
"1895",5274802,5278260,"He is obsessed with track seven,and want to find him on Tuesday!","Think Like a Man"
"1896",5278473,5279633,"Congratulations!","Think Like a Man"
"1897",5279907,5282569,"My God. You did it for me?","Think Like a Man"
"1898",5282777,5286838,"No, you did.You put your heart in the range.","Think Like a Man"
"1899",5287315,5288907,"I love you, girl.","Think Like a Man"
"1900",5294656,5295987,"Even unwittingly","Think Like a Man"
"1901",5296090,5298854,"Zeke made a mistake and said the three magic words","Think Like a Man"
"1902",5299060,5300891,"finally opened the cookie jar.","Think Like a Man"
"1903",5325687,5327951,"But Zeke's victory was short lived.","Think Like a Man"
"1904",5336097,5338998,"MYA  - FUL BUY THE BREAKFAST NOW TURN- Zeke","Think Like a Man"
"1905",5361222,5364123,"This is not good.","Think Like a Man"
"1906",5366327,5367624,"No, no, no.","Think Like a Man"
"1907",5368129,5372031,"RULE OF NINETY DlASGetting the Respect it Deserves","Think Like a Man"
"1908",5385413,5388849,"I'm crazy orlast night was the best of my life?","Think Like a Man"
"1909",5389050,5390176,"'' You got the cookie.''","Think Like a Man"
"1910",5390385,5394685,"Cracker? I am the eater of cookies.Do you know what I bought? Coffee with milk...","Think Like a Man"
"1911",5398993,5400858,"Mya, I can explain it.","Think Like a Man"
"1912",5401062,5403530,"Your lying piece of shit!","Think Like a Man"
"1913",5404932,5407298,"I was just using it in self defense.","Think Like a Man"
"1914",5407502,5409026,"If defending against what?","Think Like a Man"
"1915",5409170,5410159,"Against the Rule of 90 days.","Think Like a Man"
"1916",5410338,5413136,"It was created to protect women againstidiots like you.","Think Like a Man"
"1917",5413241,5415038,"So I'm the villainand you do not have the courage","Think Like a Man"
"1918",5415143,5417077,"to say that I wason a 90 day trial.","Think Like a Man"
"1919",5417211,5418371,"-I would say.-When?","Think Like a Man"
"1920",5418546,5422642,"I'd tell you.But then I thought I could change it.","Think Like a Man"
"1921",5425253,5427687,"Because I thought you were the right guy.","Think Like a Man"
"1922",5428356,5429653,"Something was real?","Think Like a Man"
"1923",5430124,5434390,"Something? Dinners, Exits?Call me his girlfriend?","Think Like a Man"
"1924",5434595,5436426,"Or was it just to get a cookie?","Think Like a Man"
"1925",5438733,5439791,"Our.","Think Like a Man"
"1926",5441302,5442667,"You won, congratulations.","Think Like a Man"
"1927",5443738,5445672,"You did it, right? You win.","Think Like a Man"
"1928",5445873,5447602,"Mya, wait a minute.Mya was all true.","Think Like a Man"
"1929",5447809,5449401,"Zeke, do not touch me!","Think Like a Man"
"1930",5450578,5451943,"God, you're so good.","Think Like a Man"
"1931",5452914,5454211,"You're pretty good.","Think Like a Man"
"1932",5454449,5457111,"Because even though I know you're lying,","Think Like a Man"
"1933",5458453,5460353,"I can almost believe you.","Think Like a Man"
"1934",5460988,5465516,"In The Art of War, Sun Tzu wrote.:'' All war is based on deception. ''","Think Like a Man"
"1935",5465726,5468593,"He forgot to say.:'' Only fools are caught. ''","Think Like a Man"
"1936",5468796,5469030,"Work Phone 310-555-0162","Think Like a Man"
"1937",5469030,5470019,"Work Phone 310-555-0162","Think Like a Man"
"1938",5470231,5471562,"Dear, your phone!","Think Like a Man"
"1939",5471999,5475264,"Meanwhile, Candace neededor find the book to understand everything.","Think Like a Man"
"1940",5475470,5476528,"Phone Michael Atwater.","Think Like a Man"
"1941",5477405,5478394,"Tandace?","Think Like a Man"
"1942",5478506,5479495,"Loretta?","Think Like a Man"
"1943",5479640,5484543,"Look, I'm calling to tell Michaelhe does not need to take me to church.","Think Like a Man"
"1944",5484979,5487777,"Deacon Johnson will take me.","Think Like a Man"
"1945",5487982,5490041,"Let me talk to him. He is free?","Think Like a Man"
"1946",5490251,5491718,"He will.","Think Like a Man"
"1947",5492086,5494054,"Here goes! That dunk!","Think Like a Man"
"1948",5494255,5495552,"Michael.","Think Like a Man"
"1949",5496958,5498050,"Can I say something to you?","Think Like a Man"
"1950",5499427,5500655,"What is it?","Think Like a Man"
"1951",5500862,5501851,"You'll see.","Think Like a Man"
"1952",5501963,5503089,"Duke, go inside.","Think Like a Man"
"1953",5503431,5505228,"Darling, saw the skills this kid?","Think Like a Man"
"1954",5505433,5506491,"If I continue...","Think Like a Man"
"1955",5506701,5507827,"What happened, honey?","Think Like a Man"
"1956",5508803,5510600,"His work called.","Think Like a Man"
"1957",5510805,5513501,"I thought it might be an emergency and answered it.","Think Like a Man"
"1958",5514175,5515233,"But it was only his mother.","Think Like a Man"
"1959",5515543,5518603,"Really? You know, the list of contactsis giving you problems...","Think Like a Man"
"1960",5518813,5520110,"No more nonsense, Michael.","Think Like a Man"
"1961",5520314,5522248,"Honey, I know that sounds, but trust me...","Think Like a Man"
"1962",5522650,5524447,"Believe? I trusted you.","Think Like a Man"
"1963",5525853,5528515,"I can not compete with her mother. And I'm not going.","Think Like a Man"
"1964",5528723,5529849,"You do not have to...","Think Like a Man"
"1965",5530057,5531991,"So why lie to my face?","Think Like a Man"
"1966",5535496,5536827,"You need to go.","Think Like a Man"
"1967",5537765,5538823,"Honey, listen...","Think Like a Man"
"1968",5539066,5540499,"Get out my face, Michael.","Think Like a Man"
"1969",5548376,5551277,"And Candacewas not the only things that solved that day.","Think Like a Man"
"1970",5551479,5552639,"Hi, beautiful.","Think Like a Man"
"1971",5553381,5555281,"Hi.-How are you?","Think Like a Man"
"1972",5556217,5558879,"-I have a meeting at a 4h, then...-You are beautiful.","Think Like a Man"
"1973",5559186,5560414,"Thank you.","Think Like a Man"
"1974",5561022,5563047,"You said you had news.","Think Like a Man"
"1975",5563257,5565725,"Yesinvestor knows the friend of whom I spoke?","Think Like a Man"
"1976",5566394,5570125,"He read its prospectus ,and loved whatever you call it.","Think Like a Man"
"1977",5570631,5571825,"Really?","Think Like a Man"
"1978",5571999,5573694,"I said I was fantastic.","Think Like a Man"
"1979",5574235,5576169,"Thank you. Thank you.","Think Like a Man"
"1980",5577438,5580032,"We have to celebrate. Let's go out tonight.","Think Like a Man"
"1981",5580241,5581970,"I'm not free tonight.","Think Like a Man"
"1982",5582176,5584804,"Okay, and tomorrow night?","Think Like a Man"
"1983",5585079,5587741,"Dominic, I'll be honest with you, right?","Think Like a Man"
"1984",5587949,5591009,"I rediscovered an ex-boyfriendof my college days.","Think Like a Man"
"1985",5591218,5594745,"He ended up divorcingand is moving to LA and I...","Think Like a Man"
"1986",5595723,5596883,"'s Up with me?","Think Like a Man"
"1987",5597091,5600254,"Do not! I'm not ending,I'm just taking a break.","Think Like a Man"
"1988",5600461,5601826,"-I need space.-Space.","Think Like a Man"
"1989",5602029,5605328,"-We were going too fast...-You are talking like a man.","Think Like a Man"
"1990",5605533,5606522,"What did you say?","Think Like a Man"
"1991",5606701,5608328,"Said you're talking about the same man.","Think Like a Man"
"1992",5608869,5612430,"So I called him to come to this place?For a business lunch?","Think Like a Man"
"1993",5612740,5613866,"To be able to leave me?","Think Like a Man"
"1994",5614075,5615440,"Dominic, I really like you.","Think Like a Man"
"1995",5615776,5619940,"Right? I do not want to get you rolling.Let's be friends.","Think Like a Man"
"1996",5620147,5622411,"Do not need more friends, Lauren.","Think Like a Man"
"1997",5622717,5626949,"I do not need your friends to console me.","Think Like a Man"
"1998",5627154,5630248,"Do not be stupid, Dominic.That 'is business, not personal.","Think Like a Man"
"1999",5632393,5633917,"And you know the difference?","Think Like a Man"
"2000",5634295,5635319,"You know, Lauren, I...","Think Like a Man"
"2001",5636430,5641265,"I had not a prospectus, you know?I made just to impress her.","Think Like a Man"
"2002",5642637,5646733,"You inspired me, motivated meto do something for me first.","Think Like a Man"
"2003",5648175,5650609,"And all the timeI thought you were too good for me.","Think Like a Man"
"2004",5666027,5668257,"Kris? I bought a pizza.","Think Like a Man"
"2005",5679273,5682367,"I found this. Boys want convenience.Men build homes. Fui. K","Think Like a Man"
"2006",5701796,5706028,"What I do not understand is that according to the bookI was the guy with potential.","Think Like a Man"
"2007",5706233,5709327,"I told her the truth, I venturedand it was not enough.","Think Like a Man"
"2008",5709537,5711630,"At least it was caught in an outright lie.","Think Like a Man"
"2009",5711839,5714103,"Things are really bad with Candace now.","Think Like a Man"
"2010",5714308,5717505,"Kristen did not want to see my face when I showed up at Ginny.","Think Like a Man"
"2011",5717978,5719138,"It will change your mind.","Think Like a Man"
"2012",5719346,5722611,"No. You do not see the way she looked at me. With so...","Think Like a Man"
"2013",5722817,5724011,"-Rage? Grief-.","Think Like a Man"
"2014",5724218,5726948,"It is anger. Womenget angry more easily.","Think Like a Man"
"2015",5727154,5729884,"Either way, friends.I think we caused it ourselves.","Think Like a Man"
"2016",5730091,5734027,"It was in self defense. They attacked first!We had to give change.","Think Like a Man"
"2017",5734228,5736696,"Onlyprotect our natural right to be men.","Think Like a Man"
"2018",5737231,5738220,"-That.-Okay.","Think Like a Man"
"2019",5738432,5740059,"Love us or leave us, right?","Think Like a Man"
"2020",5740601,5741659,"Right!","Think Like a Man"
