"id","startTime","endTime","text","title"
"1243",5746118,5748344,"Reminding us that in the end...","Wonder"
"1244",5749015,5752181,"everything eventuallyreturns to the ash it came from.","Wonder"
"1245",5754688,5757952,"There is something reassuring about it.","Wonder"
"1246",5762552,5764666,"I see all of that in your eyes.","Wonder"
"1247",5768141,5770354,"Perhaps you could show mewhat you're working on.","Wonder"
"1248",5786389,5788006,"I hear it is...","Wonder"
"1249",5790284,5792289,"I hear it is extraordinary.","Wonder"
"1250",5793255,5796823,"I appreciate yourinterest in my work...","Wonder"
"1251",5796904,5799260,"but I'm loyal toGeneral Ludendorff.","Wonder"
"1252",5800046,5801012,"Besides...","Wonder"
"1253",5801092,5803733,"Now I see your attention is...","Wonder"
"1254",5807210,5808211,"elsewhere.","Wonder"
"1255",5832326,5834247,"Enjoying the party?","Wonder"
"1256",5836270,5839019,"I confess I'm not sure whatit is we're celebrating.","Wonder"
"1257",5839099,5841994,"A German victory, of course.","Wonder"
"1258",5842296,5842944,"Victory?","Wonder"
"1259",5843024,5845725,"When I hear peacecould be so close.","Wonder"
"1260",5845920,5846966,"Peace?","Wonder"
"1261",5847046,5848916,"It's only an armistice...","Wonder"
"1262",5849189,5850722,"and an endless war.","Wonder"
"1263",5851390,5852845,"Thucydides.","Wonder"
"1264",5853252,5854891,"You know your ancient Greeks?","Wonder"
"1265",5855155,5856841,"They understood...","Wonder"
"1266",5856921,5858363,"that war was a god.","Wonder"
"1267",5858904,5861529,"A god that requires human sacrifices.","Wonder"
"1268",5861609,5862795,"And in exchange...","Wonder"
"1269",5862875,5865560,"war gives man purpose...","Wonder"
"1270",5865640,5867532,"meaning, a chance to rise...","Wonder"
"1271",5867612,5869989,"above his petty,mortal little self...","Wonder"
"1272",5870725,5872039,"and be courageous...","Wonder"
"1273",5872863,5874253,"Noble!","Wonder"
"1274",5875489,5878704,"Only one of the manygods believed in that.","Wonder"
"1275",5879702,5881287,"And he was wrong.","Wonder"
"1276",5882585,5883914,"You know nothing of the gods.","Wonder"
"1277",5883994,5885502,"Herr General.","Wonder"
"1278",5888631,5890185,"Enjoy the fireworks.","Wonder"
"1279",5895798,5896805,"What are you doing?","Wonder"
"1280",5896885,5898326,"- Out of my way!- Diana, look at me.","Wonder"
"1281",5898456,5900213,"If you kill Ludendorffbefore we find the gas...","Wonder"
"1282",5900293,5901626,"we won't be able to stop anything.","Wonder"
"1283",5901706,5902829,"I will stop Ares!","Wonder"
"1284",5902909,5904443,"What if you're wrong?","Wonder"
"1285",5906012,5907614,"What if there's no Ares?","Wonder"
"1286",5909377,5910828,"You don't believe me.","Wonder"
"1287",5910930,5912666,"I can not let you do this.","Wonder"
"1288",5913328,5914786,"What I do is not up to you.","Wonder"
"1289",5921591,5922744,"Diana!","Wonder"
"1290",5927020,5928020,"Diana...","Wonder"
"1291",5928521,5929523,"The gas.","Wonder"
"1292",5930529,5932537,"The villagers!","Wonder"
"1293",5934707,5936340,"What they cheering for?","Wonder"
"1294",5938887,5939966,"Diana!","Wonder"
"1295",5942358,5943966,"What did they fire?","Wonder"
"1296",5944279,5945230,"The gas.","Wonder"
"1297",5945310,5947271,"- It was Ludendorff.- I saw him, he was in the tower.","Wonder"
"1298",5947351,5948820,"Wherever he goes you follow.","Wonder"
"1299",5949619,5951055,"How will you find us?","Wonder"
"1300",5951539,5952975,"I know how.","Wonder"
"1301",6030783,6032131,"Diana!","Wonder"
"1302",6035127,6037788,"They are dead.They are all dead.","Wonder"
"1303",6038704,6040355,"I could have saved them.","Wonder"
"1304",6040685,6043029,"I could have saved themif it weren't for you.","Wonder"
"1305",6043270,6045247,"You stopped mefrom killing Ares!","Wonder"
"1306",6045448,6047836,"- No!- Get away from me!","Wonder"
"1307",6048030,6049472,"I understand everything now.","Wonder"
"1308",6049552,6051260,"It isn't just the Germansthat Ares has corrupted.","Wonder"
"1309",6051340,6052657,"It's you too.","Wonder"
"1310",6053342,6054369,"All of you.","Wonder"
"1311",6055564,6056871,"I'll find Ares...","Wonder"
"1312",6057091,6058655,"and I'll kill him.","Wonder"
"1313",6061976,6063112,"Diana!","Wonder"
"1314",6064154,6065262,"That smoke...","Wonder"
"1315",6066399,6067342,"it's the chief!","Wonder"
"1316",6067422,6068869,"He followed Ludendorff.","Wonder"
"1317",6070360,6071944,"Follow the smoke!","Wonder"
"1318",6098260,6099958,"Hey! Diana, Over there!","Wonder"
"1319",6116375,6117576,"Come on. Let's go!","Wonder"
"1320",6139655,6141265,"Ooh! what a surprise.","Wonder"
"1321",6141891,6143184,"Strange.","Wonder"
"1322",6144563,6146667,"Unfortunately, I haveanother matter...","Wonder"
"1323",6147725,6148726,"to attend to.","Wonder"
"1324",6153789,6156315,"What are you?","Wonder"
"1325",6156395,6157635,"You will soon find out.","Wonder"
"1326",6191840,6195957,"As magnificent as you are, youare still no match for me.","Wonder"
"1327",6199807,6201791,"We'll see about that.","Wonder"
"1328",6226145,6228128,"I am Diana Temiscira...","Wonder"
"1329",6230033,6231890,"daughter of Hippolyta...","Wonder"
"1330",6232909,6235296,"Queen of the Amazons.","Wonder"
"1331",6238019,6240766,"And your wrath uponthis world is over.","Wonder"
"1332",6258252,6260751,"In the name of all that itis good in this world...","Wonder"
"1333",6261002,6263603,"I hereby complete themission of the Amazons...","Wonder"
"1334",6263889,6265690,"by ridding this world of you...","Wonder"
"1335",6265945,6266948,"forever!","Wonder"
"1336",6334515,6335515,"Diana?","Wonder"
"1337",6341252,6342253,"Diana!","Wonder"
"1338",6346529,6348069,"I killed him.","Wonder"
"1339",6349698,6351887,"I killed him, but nothing stops.","Wonder"
"1340",6353335,6356009,"You kill the god ofwar, you stop the war.","Wonder"
"1341",6356284,6358274,"Exactly what we have to do now.","Wonder"
"1342",6358457,6359858,"We need to stop the gas.Come on.","Wonder"
"1343",6360070,6361532,"No. All this shouldhave stopped.","Wonder"
"1344",6361640,6362552,"Diana...","Wonder"
"1345",6362632,6364541,"The fighting should have stopped.Why are they?","Wonder"
"1346",6364621,6366695,"I don't know! I don't know.","Wonder"
"1347",6366917,6367779,"Ares is dead.","Wonder"
"1348",6368018,6371010,"They can now stop fighting.Why are they still fighting?","Wonder"
"1349",6371217,6372911,"Because maybe it's them!","Wonder"
"1350",6373331,6374332,"Maybe...","Wonder"
"1351",6376167,6378722,"Maybe people aren't always good.","Wonder"
"1352",6379796,6381644,"Ares or no Ares...","Wonder"
"1353",6382945,6386261,"Maybe it's just, who they are.","Wonder"
"1354",6389197,6390488,"- Diana...- No.","Wonder"
"1355",6390819,6392270,"Diana, we can talkabout this later.","Wonder"
"1356",6392475,6393735,"- I need you to come with me.- No, no!","Wonder"
"1357",6393815,6395581,"After everything Isaw, it can't be!","Wonder"
"1358",6395805,6397011,"Can not be!","Wonder"
"1359",6397462,6399542,"They were killing each other.","Wonder"
"1360",6399795,6402326,"Killing people they cannot see.Children...","Wonder"
"1361",6402605,6404192,"Children!","Wonder"
"1362",6404426,6406773,"No, it had to be him.It can not be them!","Wonder"
"1363",6407020,6409347,"Diana, people... I...","Wonder"
"1364",6409605,6411149,"She was right.","Wonder"
"1365",6411676,6412606,"My mother was right.","Wonder"
"1366",6412686,6414731,"She said the world ofmen do not deserve you.","Wonder"
"1367",6414934,6416627,"They don't deserveour help, Steve.","Wonder"
"1368",6416873,6419376,"- It's not about deserve!- They do not deserve our help.","Wonder"
"1369",6419456,6421326,"Maybe we don't!","Wonder"
"1370",6422987,6425154,"But it's not about that.It's about what you believe.","Wonder"
"1371",6426152,6428966,"You don't think I get it, afterwhat I've seen out there?","Wonder"
"1372",6430451,6433932,"You don't think I wish I could tellyou that I was one bad guy to blame?","Wonder"
"1373",6434564,6436238,"It's not!","Wonder"
"1374",6438408,6440088,"We are all to blame.","Wonder"
"1375",6440363,6441363,"I am not.","Wonder"
"1376",6442972,6444574,"But maybe I am!","Wonder"
"1377",6448452,6449453,"Please.","Wonder"
"1378",6449814,6451594,"If you believe that thiswar should stop...","Wonder"
"1379",6451673,6453489,"if you want to stop it...","Wonder"
"1380",6453822,6455190,"help me stop it right now.","Wonder"
"1381",6455270,6456572,"Because... if.","Wonder"
"1382",6457970,6463220,"If you don't, there will be thousandsmore. Please, please come with me.","Wonder"
"1383",6463301,6464783,"I have to go.","Wonder"
"1384",6471305,6472917,"I have to go.","Wonder"
"1385",6484740,6485777,"Hey!","Wonder"
"1386",6490310,6491625,"- Where is Diana?- We are on our own.","Wonder"
"1387",6491768,6494579,"- What?- What did you see, Charlie?","Wonder"
"1388",6495020,6496606,"Seems like a bunchof gas pumps...","Wonder"
"1389",6496868,6499159,"but I can't see wherethey're taking them.","Wonder"
"1390",6499239,6500840,"How are we gonna get in there?","Wonder"
"1391",6501570,6503673,"I have got an idea.Come on guys.","Wonder"
"1392",6503903,6504904,"Come on!","Wonder"
"1393",6518505,6520250,"Who's there?","Wonder"
"1394",6532722,6534632,"Sir Patrick.","Wonder"
"1395",6535341,6539672,"You were right, Diana.They don't deserve our help.","Wonder"
"1396",6540836,6544701,"They only deserve destruction.","Wonder"
"1397",6546064,6547532,"You...","Wonder"
"1398",6549206,6551164,"You are him.","Wonder"
"1399",6554632,6556037,"I am.","Wonder"
"1400",6556423,6561050,"But I'm not whatyou thought I was.","Wonder"
"1401",6581694,6583259,"What is that?","Wonder"
"1402",6584551,6585869,"Future.","Wonder"
"1403",6590585,6592591,"I'm not your enemy, Diana.","Wonder"
"1404",6594621,6598359,"I'm the only one whotruly knows you.","Wonder"
"1405",6598595,6603118,"And who truly knowsthem, as you now do.","Wonder"
"1406",6605434,6609104,"They always been andalways will be...","Wonder"
"1407",6609284,6613246,"weak, cruel, selfish...","Wonder"
"1408",6613345,6616619,"and capable of thegreatest horrors.","Wonder"
"1409",6625905,6627277,"All I ever wanted was...","Wonder"
"1410",6627356,6632416,"for the Gods to see howevil my father's creation was.","Wonder"
"1411",6634393,6635537,"But they refused.","Wonder"
"1412",6635863,6637104,"I am Diana of Temiscira...","Wonder"
"1413",6637265,6638717,"So I destroyed them.","Wonder"
"1414",6638797,6640755,"daughter of Hippolyta...","Wonder"
"1415",6640835,6642867,"and I am here to complete her...","Wonder"
"1416",6650840,6652470,"The God Killer...","Wonder"
"1417",6655170,6657192,"My dear Child..","Wonder"
"1418",6658519,6661041,"that's not the God Killer.","Wonder"
"1419",6663534,6665036,"You are.","Wonder"
"1420",6667625,6670762,"Only a God can kill another God.","Wonder"
"1421",6671806,6675703,"Zeus left the child he hadwith the queen of the Amazon.","Wonder"
"1422",6675930,6678149,"As a weapon to use against me.","Wonder"
"1423",6678229,6680101,"No. You liar.","Wonder"
"1424",6681886,6684198,"I compel you totell me the truth.","Wonder"
"1425",6686502,6687988,"I am.","Wonder"
"1426",6714393,6716738,"I'm not the god of war, Diana.","Wonder"
"1427",6716947,6719414,"I am the God of truth.","Wonder"
"1428",6720948,6722270,"Mankind...","Wonder"
"1429",6722904,6725921,"Stole this world from us.","Wonder"
"1430",6727930,6731346,"They ruined it, day by day.","Wonder"
"1431",6731426,6735703,"And I, the only one wiseenough to see it...","Wonder"
"1432",6737158,6739925,"was left too weak to stop them.","Wonder"
"1433",6740851,6744399,"All these years I havestruggled alone...","Wonder"
"1434",6744479,6746551,"whispering into their ears.","Wonder"
"1435",6746631,6751451,"Ideas, inspirationfor formulas...","Wonder"
"1436",6752364,6753961,"weapons...","Wonder"
"1437",6756622,6759159,"but I don't make them use them.","Wonder"
"1438",6760219,6762167,"They start thesewars on their own.","Wonder"
"1439",6763163,6766981,"All I do is orchestrate an armisticeI know they cannot keep...","Wonder"
"1440",6767256,6769501,"in the hope theywill destroy themselves.","Wonder"
"1441",6771559,6773654,"But it has never been enough.","Wonder"
"1442",6775092,6776192,"Until you.","Wonder"
"1443",6778841,6783095,"When you first arrived Iwas going to crush you.","Wonder"
"1444",6783673,6786805,"But I knew that ifonly you could see...","Wonder"
"1445",6787011,6790882,"what the other gods could not...","Wonder"
"1446",6792256,6796770,"then you would join me, andwith our powers combined...","Wonder"
"1447",6797042,6800975,"we could finally end all thepain, all the suffering...","Wonder"
"1448",6801195,6803761,"destruction they bring.","Wonder"
"1449",6804213,6809346,"And we could return this world tothe paradise it was before them.","Wonder"
"1450",6810951,6812680,"Forever.","Wonder"
"1451",6815572,6817055,"I...","Wonder"
"1452",6821850,6824585,"I can never be a part of that.","Wonder"
"1453",6827707,6830483,"My dear, I don'twant to fight you.","Wonder"
"1454",6831590,6832863,"But if I must...","Wonder"
"1455",6842456,6844310,"- Steve!- Come on, let's go!","Wonder"
"1456",6844819,6846083,"Sammy, let's go!","Wonder"
"1457",6846524,6848011,"Get these things out of here.","Wonder"
"1458",6877947,6882390,"Oh my dear, you haveso much to learn.","Wonder"
"1459",6907421,6909905,"Oh my God!","Wonder"
"1460",6910378,6911806,"What are we gonna do?","Wonder"
"1461",6913564,6915658,"There is not much we can do...","Wonder"
"1462",6915805,6917434,"if that's who I think it is.","Wonder"
"1463",6922719,6924658,"But we can stop that plane.","Wonder"
"1464",6937863,6939680,"If we could get on the radio...","Wonder"
"1465",6939761,6942291,"we can ask flyingcorp to shoot her down.","Wonder"
"1466",6942371,6945591,"No. If it crashes, it will wipeeveryone out for 50 square miles.","Wonder"
"1467",6945671,6946591,"We gotta ground it!","Wonder"
"1468",6946815,6948407,"Bad news. It's on a timer.","Wonder"
"1469",6948708,6950867,"If we ground it here,it's the same thing.","Wonder"
"1470",6957900,6959788,"Is it flammable, Chief?","Wonder"
"1471",6959868,6963346,"Yes, you said it's hydrogen.It's flammable.","Wonder"
"1472",6970488,6972863,"I need you guys to clearme a path to that plane.","Wonder"
"1473",6972943,6975095,"- No, Steve!- Hey, Steve!","Wonder"
"1474",6977117,6978118,"Come on!","Wonder"
"1475",7020731,7023155,"Come on! This way! Steve!","Wonder"
"1476",7032721,7034569,"- Come on, Steve.- Ahead! Go!","Wonder"
"1477",7034983,7036457,"Steve!","Wonder"
"1478",7079375,7082501,"Let's see what kind ofgod you really are.","Wonder"
"1479",7108961,7112305,"You will help medestroy them, Diana.","Wonder"
"1480",7115613,7117368,"Or you will die.","Wonder"
"1481",7127431,7129783,"Come on! Let's move, let's go!Go. Go. Go.","Wonder"
"1482",7132966,7134963,"- Now!- Go! Run!","Wonder"
"1483",7160024,7162769,"Is that all you have to offer?","Wonder"
"1484",7179064,7182985,"It is futile toimagine you can win.","Wonder"
"1485",7183823,7185532,"Give up, Diana.","Wonder"
"1486",7189560,7191167,"Chief! Anything left?","Wonder"
"1487",7191247,7192127,"I got nothing.","Wonder"
"1488",7192207,7193512,"- Anything!- No!","Wonder"
"1489",7211353,7212354,"Steve.","Wonder"
"1490",7258828,7260280,"Steve.","Wonder"
"1491",7263329,7267179,"No!","Wonder"
"1492",7300399,7303001,"Yes, Diana!","Wonder"
"1493",7303403,7305969,"Take them all!","Wonder"
"1494",7306314,7309399,"Finally you see.","Wonder"
"1495",7309823,7312399,"Look at this world.","Wonder"
"1496",7312698,7315514,"Mankind did this, not me.","Wonder"
"1497",7317298,7319317,"They are ugly...","Wonder"
"1498",7319396,7321211,"filled with hatred...","Wonder"
"1499",7321511,7322595,"weak...","Wonder"
"1500",7322996,7325720,"Just like your captain Trevor.","Wonder"
"1501",7326287,7332002,"Gone and left you nothing.And for what?","Wonder"
"1502",7332389,7333974,"Pathetic!","Wonder"
"1503",7335347,7337091,"He deserved to burn!","Wonder"
"1504",7348100,7352237,"Look at her andtell me I'm wrong.","Wonder"
"1505",7360644,7364643,"She is the perfect exampleof these humans...","Wonder"
"1506",7366399,7370305,"and unworthy of yoursympathy in every way.","Wonder"
"1507",7371810,7373957,"Destroy her, Diana.","Wonder"
"1508",7375039,7378399,"You know that she deserves.That they all do.","Wonder"
"1509",7381621,7382981,"Do it!","Wonder"
"1510",7387789,7389492,"Diana!","Wonder"
"1511",7392701,7394135,"Diana...","Wonder"
"1512",7403664,7404666,"What?","Wonder"
"1513",7405166,7406770,"We have to go.","Wonder"
"1514",7409515,7411009,"What are you saying?","Wonder"
"1515",7411574,7412621,"Steve...","Wonder"
"1516",7413453,7415585,"Whatever it is, I can do it.","Wonder"
"1517",7415911,7416759,"No.. No..","Wonder"
"1518",7416886,7418274,"- Let me do it.- No.","Wonder"
"1519",7418500,7420096,"It has to be me.","Wonder"
"1520",7420176,7421831,"It has to be me.","Wonder"
"1521",7422150,7425399,"I could save today.You can save the world.","Wonder"
"1522",7434216,7436657,"I wish we had more time.","Wonder"
"1523",7436902,7439680,"What?What are you saying?","Wonder"
"1524",7442588,7443590,"I love you!","Wonder"
"1525",7455532,7457015,"You are wrong about them.","Wonder"
"1526",7466787,7468449,"They are everything you say...","Wonder"
"1527",7469318,7470907,"but so much more.","Wonder"
"1528",7471176,7472474,"Lies!","Wonder"
"1529",7498720,7502350,"They do not deserveyour protection!","Wonder"
"1530",7504126,7505212,"It's not about deserving.","Wonder"
"1531",7510087,7511992,"It's about what you believe.","Wonder"
"1532",7515627,7516962,"And I believe in love.","Wonder"
"1533",7517042,7522288,"Then I will destroy you!","Wonder"
"1534",7549506,7551235,"Goodbye brother.","Wonder"
"1535",7763404,7765796,"I used to want tosave the world.","Wonder"
"1536",7766886,7770627,"To end war and bringpeace to mankind.","Wonder"
"1537",7771381,7775256,"But then I glimpsed the darknessthat lives within their mind","Wonder"
"1538",7776104,7778369,"and learned that insideevery one of them...","Wonder"
"1539",7779085,7781371,"there will always be both.","Wonder"
"1540",7782077,7784932,"A choice each mustmake for themselves.","Wonder"
"1541",7785199,7788628,"Something no herowill ever defeat..","Wonder"
"1542",7789975,7791219,"And now I know...","Wonder"
"1543",7792390,7796934,"that only love cantruly save the world.","Wonder"
"1544",7798655,7800359,"So I stay...","Wonder"
"1545",7800626,7802779,"I fight and I give...","Wonder"
"1546",7805768,7807743,"for the world I know can be.","Wonder"
"1547",7812319,7813988,"This is my mission now.","Wonder"
"1548",7816859,7818202,"Forever.","Wonder"